sentence_id,text
228,"The use of optimization model may be flawed by the unavoidable presence of uncertainties, which may arise at different stages; in the construction and corroboration of the model itself, or in its use."
229,"Therefore, there is no guarantee the optimization process adopted by the Index Provider could always achieve the best results."
230,"In evaluating securities for inclusion and/or weighting in the Underlying Index based on ESG criteria or constraints, the Index Provider may rely upon information and data obtained by itself or from third -party data providers."
231,Such information and data may involve qualitative factors and it is thus possible that the relevant ESG criteria or constraints may not be applied correctly.
232,"Informa tion and/or data may be incomplete, inaccurate or unavailable from time to time, which may affect the Index Provider’s ability to assess potential constituents for inclusion and/or exclusion from the Underlying Index."
233,ESG criteria or constraints that are relevant to the Underlying Index are reviewed at index reviews or rebalances or specified reference dates in accordance with the index methodology.
234,"There may also be a time lag between the date as at which the data is captured and the date on which the dat a is used for review, rebalancing or assessment, which may impact the timeliness and quality of the data."
235,"As a result, there is a risk associated with the assessment of Index Securities or the issuers based on such information or data."
236,"There can be no assu rance that the Index Provider’s assessment, based on such information or data, will reflect the actual circumstances."
237,"Further, there is a risk that the ESG performance of certain Index Securities may fall over time but remain in the Underlying Index and the Sub-Fund until the next review or rebalance by the Index Provider."
238,Such Index Securities may need to be removed from the Underlying Index and the portfolio of the Sub-Fund in the next rebalance in response to such change.
239,Such act may not be advantageous to the Sub -Fund or may even have an adverse impact on the performance of the Sub-Fund.
240,"Currently, there is no universally accepted principles or factors to consider to ensure that investments are compliant with ESG criteria."
241,The lack of common standards in relation to ESG investing strategies may result in different approaches to setting and achieving ESG objectives.
242,"As a result, Index Securities selected by the Index Provider may not reflect the beliefs and standards of any particular investor and may no t exhibit favorable ESG outcome."
243,"In addition, there is a lack of standardised taxonomy in relation to ESG investing strategies."
244,The standard of disclosure adopted by funds in relation to the relevant ESG constraints or factors may vary.
245,"23 (g) RMB currency and conversion risk – The Sub-Fund is denominated in Hong Kong dollars, but the SZSE Securities acquired via Shenzhen -Hong Kong Stock Connect are denominated in offshore RMB (“CNH”)."
246,The Net Asset Value of the Sub-Fund may be affected unfavorably by fluctuations in the exchange rates between these currencies and the base currency and by changes in exchange rate controls.
247,The Sub-Fund is therefore also subject to foreign exchange costs and currency conversion risk.
248,"A Unitholder may suffer a loss if CNH depreciates against the base currency, even if the value of the Sub - Fund’s investments in CNH rises."
249,"Further, RMB is currently not freely convertible and is subject to policies of exchange controls and repatriation restrictions by the Chinese government ."
250,Conversion between RMB and other currencies is also subject to policy restrictions relating to RMB and the relevant regulatory requirements in Hong Kong.
251,Non-RMB based investors are exposed to foreign exchange risk and there is no guarantee that the value of RMB against the investors’ base currencies (for example HKD) will not depreciate.
252,There is no guarantee that the RMB will not depreciate.
253,There is no assurance that RMB will not be subject to devaluation or revaluation or that shortages in the availabil ity of the currency will not develop.
254,Any depreciation or devaluation of RMB could adversely affect the value of the investors’ investments in the Sub-Fund.
255,"Although CNH and onshore RMB (“CNY”) are the same currency, they trade at different rates."
256,Any divergence between CNH and CNY may adversely impact investors.
257,The Sub-Fund may also be subject to bid/ offer spread and currency conversion costs when converting to and from Hong Kong dollars and RMB.
258,"Under the Dual Counter arrangement, Units are traded in RMB in the RMB counter."
259,"Thus, non-RMB based investors are exposed to foreign exchange risk."
260,Any depreciation of RMB could adversely affect the value of the investor’s investment in the Sub-Fund.
261,"(h) Emerging market /PRC market risk – In tracking the Underlying Index, the Sub -Fund may invest in SZSE Securities directly via Shenzhen -Hong Kong Stock Connect ."
262,"However, investors should be aware that the PRC is still a developing country and the legal and regulatory framework of the PRC is still undergoing development and there is a degree of legal uncertainty both for local and overseas market participants."
263,"Investment in an emerging market / the PRC market may involve increased risks and special considerations not typically associated with investment in more developed markets, such as liquidity risks, currency risks/control, political and economic uncertainties, legal and taxation risks, settlement risks, custody risk and the likelihood of a high degree of volatility."
264,"These risks include the possibility of more volatile financial markets, price volatility, smaller capital markets, less developed economic, political and social conditions and policies, greater risks in relation to foreign exchange and liquidity, nationalization, expropriation, government control and intervention etc All of these may have an adverse impact on performance on the Sub-Fund."
265,"The value of the Sub -Fund’s assets may be affected by uncertainties or changes in government policies, promulgation of foreign currency and monetary policies and tax regulations."
266,Many economic reforms of the PRC are unprecedented or experimental and are subject to modification and adjustment.
267,Such modification and adjustment may have associated impact on the economy or financial markets of the PRC and may not always 24 have a positive effect on investment in the PRC companies.
268,"Furthermore, the PRC government may from time to time adopt corrective measures to control the growth of the PRC economy which may have an adverse impact on the performance or value of the Sub-Fund."
269,"The accounting, auditing and financial reporting standards in the PRC may be differe nt from international requirements, and investors should take this in account when making investment decisions."
270,(i) Counterparty and settlement risk - Counterparty risk is the risk that the party trading with the Sub-Fund will be unable to meet its obligations to make payments or to settle a trade due to a deterioration of the counterparty’s financial situation or some other failure by the counterparty.
271,The Sub -Fund bears the risk of settlement failures.
272,Any such failure may have a material adverse effect on the Sub-Fund and/or the value of Units of the Sub- Fund.
273,(j) Risks related to Shenzhen-Hong Kong Stock Connect (i) Quota limitations: Shenzhen-Hong Kong Stock Connect is subject to a Daily Quota which does not belong to the Sub-Fund and can only be utilized on a first-come-first serve basis.
274,The Daily Quota is monitored by SEHK and SZSE.
275,The Daily Quota limits the maximum net buy value of cross -boundary trades under Shenzhen -Hong Kong Stock Connect each day.
276,The Daily Quota will be reset every day.
277,Unused Daily Quota will not be carried over to next day’s Daily Quota.
278,The Northbound Daily Quota balance is disseminated on the HKEx website.
279,"If the Northbound Daily Quota drops to zero or the Daily Quota is exceeded during the opening call auction session, new buy orders will be rejected."
280,"Once the Northbound Daily Quota Balance drops to zero or the Daily Quota is exceeded during a continuous auction session, no further buy orders will be accepted for the remainder of the day."
281,"It should be noted th at quota limitations may restrict the Sub -Fund’s ability to invest in SZSE Securities through Shenzhen -Hong Kong Stock Connect on a timely basis, and the Sub -Fund may not be able to effectively pursue its investment strategies."
282,(ii) Suspension risk: The SEHK and SZSE would reserve the right to suspend Northbound and/or Southbound trading if necessary for ensuring an orderly and fair market and that risks are managed prudently.
283,Consent from the relevant regulator would be sought before a suspension is tr iggered.
284,"Where a suspension in the Northbound trading through Shenzhen-Hong Kong Stock Connect is effected, the Sub-Fund’s ability to invest in A-Shares or access the PRC market will be adversely affected."
285,"In such event, the Sub-Fund’s ability to achieve its investment objective could be negatively affected."
286,"25 (iii) Differences in trading day: Subject to any further trading calendar enhancement from time to time, Shenzhen- Hong Kong Stock Connect will only operate on days when both the PRC and Hong Kong markets are open for trading."
287,So it is possible that there are occasions when it is a normal trading day for the PRC market but Hong Kong investors (such as the Sub-Fund) cannot carry out any trading of A -shares.
288,The Sub-Fund may be subject to a risk of price fluctuations in A -shares during the time when Shenzhen-Hong Kong Stock Connect is not trading as a result.
289,(iv) Operation risk: • Shenzhen-Hong Kong Stock Conn ect provides a new channel for investors from Hong Kong and overseas to access the Mainland China stock market directly.
290,• Shenzhen-Hong Kong Stock Connect is premised on the functioning of the operational systems of the relevant market participants.
291,"Mark et participants are able to participate in Shenzhen-Hong Kong Stock Connect subject to meeting certain information technology capability, risk management and other requirements as may be specified by the relevant exchange and/or clearing house."
292,"Besides, s ecurities regimes and legal systems of the two markets differ significantly and in order for the program to operate smoothly, market participants may need to address issues arising from the differences on an on-going basis."
293,• The “connectivity” in Shenzhe n-Hong Kong Stock Connect requires routing of orders across the border.
294,This requires the development of new information technology systems on the part of the SEHK and exchange participants (i.e.
295,a new order routing system) to be set up by SEHK to which exchange participants need to connect.
296,There is no assurance that the systems of the SEHK and market participants will function properly or will continue to be adapted to changes and developments in both markets.
297,"In the event that the relevant systems failed to function properly, trading in both markets through Shenzhen -Hong Kong Stock Connect could be disrupted."
298,The Sub -Fund’s ability to access to A -share market (and hence to pursue its investment strategy) will be adversely affected.
299,The Sub-Fund may also incur trading or other unforeseeable losses in that event.
300,"(v) Restrictions on selling imposed by front-end monitoring: PRC regulations require that before an investor sells any share, there should be sufficient shares in the account; otherwise the SZS E will reject the sell order concerned."
301,SEHK will carry out pre -trade checking on SZSE Securities sell orders of its participants (i.e.
302,the stock brokers) to ensure there is no over-selling.
303,"26 (vi) Recalling of eligible stocks: If a stock is recalled from the scope of eligible stocks for trading via Shenzhen - Hong Kong Stock Connect, the stock can only be sold and cannot be bought."
304,This may affect the investment portfolio of the Sub -Fund.
305,Investors should therefore pay close attention to the list of eligible stocks as provided and renewed from time to time by both the SZSE and SEHK.
306,(vii) Clearing and settlement risk: • HKSCC and CSDCC will establish the clearing links and each will become a participant of each other to facilitate clearing and settlement of cross-boundary trades.
307,"For cross -boundary trades initiated in a market, the clearing house of that market will on one hand clear and settle with its own clearing participants, and on the other hand undertake to fulfil the clearing and settlement ob ligations of its clearing participants with the counterparty clearing house."
308,"• Should the remote event of CSDCC default occur and CSDCC be declared as a defaulter, HKSCC’s liabilities in Northbound trades under its market contracts with clearing participa nts will be limited to assisting clearing participants in pursuing their claims against CSDCC."
309,"HKSCC will in good faith, seek recovery of the outstanding stocks and monies from CSDCC through available legal channels or through CSDCC’s liquidation."
310,"In that event, the Sub-Fund may suffer delay in the recovery process or may not be able to fully recover its losses from CSDCC."
311,"(viii) Counterparty risk relating to brokers: Investment through Shenzhen -Hong Kong Stock Connect is conducted through broker(s), and is subject to the risks of default by such brokers’ in their obligations."
312,Shenzhen-Hong Kong Stock Connect follows A-share settlement cycle where the SZSE Securities are settled on the same trade day and cash on a T+1 basis.
313,"The Sub-Fund may have settlement arrangements in place with brokers different from A-share settlement cycle, the deliveries of SZSE Securities and payments therefore may not be simultaneous."
314,(ix) Participation in corporate actions and shareholders’ meetings: • HKSCC will keep CCASS participants informed of corporate actions of SZSE Securities.
315,Hong Kong and overseas investors (including the Sub- Fund) will need to comply with the arrangement and deadline specified by their respective brokers or custodians (i.e.
316,CCASS participan ts).
317,The time for them to take actions for some types of corporate actions of SZSE Securities may be as short as one Business Day only.
318,"Therefore, the Sub- Fund may not be able to participate in some corporate actions in a timely manner."
319,• Hong Kong and overseas investors (including the Sub-Fund) are holding SZSE Securities traded via Shenzhen-Hong Kong Stock Connect through their brokers or custodians.
320,"According to existing Mainland practice, 27 multiple proxies are not available."
321,"Therefore, the Sub -Fund may not be able to appoint proxies to attend or participate in shareholders’ meetings in respect of the SZSE Securities."
322,"(x) Regulatory risk: • Shenzhen-Hong Kong Stock Connect is novel in nature, and will be subject to regulations promulgated by regulato ry authorities and implementation rules made by the stock exchanges in the PRC and Hong Kong."
323,"Further, new regulations may be promulgated from time to time by the regulators in connection with operations and cross -border legal enforcement in connection wi th cross -border trades under Shenzhen - Hong Kong Stock Connect."
324,The relevant rules and regulations o n Shenzhen-Hong Kong Stock Connect are subject to change which may have potential retrospective effect.
325,• It should be noted that the regulations are untested and there is no certainty as to how they will be applied.
326,"Moreover, the current regulations are subject to change."
327,There can be no assurance that Shenzhen-Hong Kong Stock Connect will not be abolished.
328,"The Sub-Fund, which may invest in the PRC market through Shenzhen-Hong Kong Stock Connect, may be adversely affected as a result of such changes."
329,"(xi) Foreign exchange / currency conversion risk: The Sub-Fund may be subject to exchange rate fluctuations between Hong Kong dollars and RMB (specifically CNH or CNY) given that the Sub -Fund is denominated in Hong Kong dollars, but the SZSE Securities acquired via Shenzhen-Hong Kong Stock Connect are denominated in CNH."
330,The Sub -Fund may also be subject to bid/offer spread and currency conversion costs when converting to and from Hong Kong dollars and RMB.
331,(k) Risks associated with the ChiNext market The Sub-Fund may invest in the ChiNext market via the Shenzhen -Hong Kong Stock Connect.
332,Investments in the ChiNext market may result in significant losses for the Sub- Fund and its investors.
333,The following additional risks apply: (i) Higher fluctuation on stock prices and liquidity risk - Listed companies on the ChiNext market are usually of emerging nature with smaller operating scale.
334,"Hence, they are subject to higher fluctuation in stock prices and liquidity and have higher risks and turnover ratios than companies listed on the main board of the SZSE."
335,(ii) Over-valuation risk - Stocks listed on the ChiNext market may be overvalued and such exceptionally high valuation may not be sustainable.
336,Stock price may be more susceptible to manipulation due to fewer circulating shares.
337,(iii) Delisting risk - The companies listed on the ChiNext market are generally less resistant to market risks and may experience mo re fluctuations in their performance.
338,It may be more common and faster for companies listed on the 28 ChiNext market to delist.
339,This may have an adverse impact on the Sub -Fund if the companies that it invests in are delisted.
340,(iv) Differences in regulations: The rules and regulations regarding securities in the ChiNext market are less stringent in terms of profitability and share capital than those in the main board.
341,(l) Concentration risk – The Sub-Fund invests primarily in securities in the GBA and may be subject to concentration risk.
342,The value of the Sub -Fund may be more volatile than that of a fund having a more diverse portfolio of investments.
343,"The value of the Sub-Fund may be more susceptible to adverse economic, political, policy, foreign exchange, liquidity, tax, legal or regulatory event affecting the markets in the GBA."
344,(m) Risk associated with High Volatility of the Equity Market in Mainland China / Equity Securities like A-Shares – Investing in equity securities like A-shares may be associated with higher risks because the investment performance of equity securities depends upon factors which are difficult to predict.
345,Such factors include the possibility of sudden or prolonged market declines and risks associated with individual companies.
346,The fundamental risk associated with any equity portfolio is the risk that the value of the investments it holds might decrease in value.
347,High market volatility and potential settlement difficulties in the Mainland China equity market may result in significant fluctuations in the prices of the securities traded on such market and thereby may have an adverse impact on the prices of PRC securities in which the Sub-Fund invests and thereby may adversely affect the value of the Sub-Fund.
348,The stock exchanges in the PRC on which A -Shares are traded are relatively at a developing stage and the choice of investments in the A -Shares is limited as compared with other developed securities markets.
349,The prices of the A -Shares held by the Sub - Fund and the Net Asset Value of t he Sub -Fund may be adversely affected during rebalances in the Sub-Fund if markets for the A-Shares are illiquid.
350,"In addition, the final cost of creation or the realized proceeds from redemption may also deviate substantially from the Net Asset Value of the Sub-Fund if markets for the A-Shares are illiquid."
351,"Further, market volatility in the A -Share markets may result in significant fluctuations in the prices of the A -Shares held by the Sub -Fund and hence in the value of the Sub -Fund."
352,Potential illiquidity and volatility of the A-Shares market may have an adverse impact on the prices of the A-Shares in which the Sub-Fund invests.
353,The liquidity of the Sub-Fund will be affected by the liquidity of its investments.
354,(n) Risk associated with Regulatory/Exchanges Requirements/ Policies of the Equity Market in Mainland China – The stock exchanges in the PRC on which A -shares are traded are relatively at a developing stage and the choice of investments in the A -share markets is limited as compared with other developed securities markets.
355,Their trading volumes may be much lower than those in developed markets.
356,Potential volatility and illiquidity of the A -share markets may have an adverse impact on the prices of PRC securities in which the Sub-Fund invests.
357,Securities exchanges in the Mainland China typically have the right to suspend or limit trading in any security traded on the relevant exchange.
358,The government or the regulators may also implement policies that may affect the financial markets.
359,All these may have a negative impact on the Sub-Fund.
360,29 (o) Liquidity risk – Liquidity risk exists when particular investments are difficult to purchase or sell.
361,Investments made by the Sub-Fund may become illiquid or less liquid in response to market developments or adverse investor perceptions.
362,"Investments in foreign securities, derivatives or securities with substantial market and/or credit risk tend to have the greatest exposure to liquidity risk."
363,Illiquid securities may be highly volatile and more difficult to value and be disposed at their face values.
364,Some of the markets in which the Sub-Fund invests may be less liquid and more volatile than the world’s leading stock markets and this may result in the fluctuation in the pri ce of securities traded on such markets.
365,Certain securities may also be illiquid due to limited trading markets or contractual restrictions on their resale.
366,The Sub -Fund is exposed to the risk that a particular investment or position cannot be unwound or offset easily.
367,"If sizeable redemption requests are received, the Sub -Fund may need to liquidate its investments at a substantial discount in order to satisfy such requests and the Sub -Fund may suffer losses in trading such investments."
368,"As a result, this may have adverse impact on the Sub-Fund and its investors."
369,"(p) Market risk – Market risk includes such factors as changes in economic environment, consumption pattern and investors’ expectations, etc."
370,which may have significant impact on the value of the investments.
371,"Usually, emerging markets tend to be more volatile than developed markets and may experience substantial price volatility."
372,"Any options, warrants and derivatives in the Sub-Fund may also expose the Sub-Fund significantly to the fluctuations in the market."
373,Market movements may therefore result in substantial fluctuations in the Net Asset Value per Unit of the Sub-Fund.
374,(q) Risk of absence of active market – There can be no assurance that an active trading market in respect of the Units in th e Sub-Fund will be developed or maintained.
375,"There is no certain basis for predicting the actual price levels at which, or the sizes in which, the Units in the Sub -Fund may trade."
376,There can be no assurance that the Units in the Sub-Fund will experience trading or pricing patterns similar to those of other exchange traded funds which are issued by investment companies in other jurisdictions or are traded on the SEHK.
377,"(r) Risk related to divergence between the market price of the Units and the Net Asset Value of the Sub-Fund/trading risk – Investors should note that unlike a typical retail investment fund offered to the public in Hong Kong (the market price of the units of which is determined by the Net Asset Value of the investment fund), the market price of the Units traded on the SEHK is determined not only by the Net Asset Value of the Sub -Fund but also by other factors such as the supply of and demand for the Units in the SEHK."
378,"Therefore, the Units in the Sub-Fund may trade at a premium or at a discount to the Net Asset Value of the Units on the SEHK and there is a risk that the market price of the Units traded on the SEHK may diverge significantly from the Net Asset Value of the Sub-Fund."
379,"In the event of liquidation of the Sub -Fund and if market prices of the Units is higher than the Net Asset Value of the Sub-Fund, investors may not be able to recover the difference between the market price of the Units and the Net Asset Value of the Sub- Fund."
380,(s) Passive investment risk - The Sub-Fund is passively managed.
381,"Due to the inherent nature of the Sub -Fund, the Sub -Fund invests in the Index Securities regardless of their investment merit, except to the extent of any representative sampling strategy, where 30 applicable."
382,The Manager will not have the discretion to adapt to market changes and may not take an active role in defending the position of the Sub -Fund in declining markets.
383,"Hence, if the Underlying Index experiences volatility or declines, the price or the value of the Sub-Fund may vary or decline accordingly."
384,"(t) Management risk – Since there can be no guarantee that the Sub-Fund will fully replicate the Underlying Index , it is subject to management risk."
385,"T here is a risk that as the implementation of the Manager’s investment strategy is subject to a number of constraints, the investment strategy may not produce the intended results."
