sentence_id,text
600,"(e) No cash deposits shall be made in respect of the Sub-Fund which would result in the value of the Sub -Fund’s cash deposits (as defined under Note (1) to Chapter 7.1B of the UTMF Code) ma de with the same entity or entities within the same group (as defined under Note (1) to Chapter 7.1A of the UTMF Code) exceeding twenty per cent (20%) of the latest available Net Asset Value of the Sub -Fund, provided that such twenty per cent (20%) may be exceeded in the following circumstances: • cash held before the launch of the Sub -Fund and for a reasonable period thereafter prior to the initial subscription proceeds being fully invested; or • cash proceeds from liquidation of investments prior to the mer ger or termination of the Sub -Fund, whereby the placing of cash deposits with various financial institutions would not be in the best interests of Unitholders; or 45 • cash proceeds received from subscriptions pending investments and cash held for the settlement of redemption and other payment obligations, whereby the placing of cash deposits with various financial institutions be unduly burdensome and the cash deposits arrangements would not compromise the Unitholders’ interests."
601,"(f) Due to the index tracking nature of the Sub-Fund, the SFC may, upon sufficient justification, consider not requiring the Sub -Fund to strictly comply with the investment restrictions in (1)(d) and (1)(e) above on a case-by-case basis."
602,"(g) No holding of any Security may be acquired for or added to the Sub-Fund which would result in the Sub -Fund holding more than ten per cent (10%) of any ordinary shares issued by any single entity, or when aggregated with the holdings of such ordinary shares held by all other sub -funds of the Trust, collectively holding more than ten per cent (10%) of any ordinary shares issued by any single entity."
603,"(2) (a) Unless otherwise stated, the restrictions in (1)(a), (d) and (g) above and (3) below shall not apply, and the following paragraph under this (2)(a) and the restrictions in (2)(b) to ( 2)(e) below shall apply where the Sub -Fund invests in other Collective Investment Schemes."
604,No holding of Collective Investment Schemes may be acquired for or added to the Sub-Fund which would result i n the value of the Sub -Fund’s investment in units or shares in other Collective Investment Schemes which are non -eligible schemes (i.e.
605,schemes which are not set out in the list of recognised jurisdictions issued by the SFC) and not authorised by the SFC in aggregate exceeding ten per cent (10%) of the latest available Net Asset Value of the Sub-Fund.
606,(b) The Sub-Fund may invest in one or more Collective Investment Schemes which are either authorized by the SFC or eligible schemes (i.e.
607,schemes which are set out in the list of recognised jurisdictions issued by the SFC) .
608,"No holding of Collective Investment Schemes may be acquired for or added to the Sub -Fund which would result in the value of the Sub -Fund’s investment in units or shares in each such Collective Investment Scheme exceeding thirty per cent (30%) of its latest available Net Asset Value , unless the Collective Inv estment Scheme is authorized by the SFC, and the name and key investment information of the Collective Investment Scheme are disclosed in this Prospectus."
609,"(c) In addition, the objective of each Collective Investment Scheme may not be to invest primarily in any investment prohibited by Chapter 7 of the UTMF Code, and where such Collective Investment Scheme’s objective is t o invest primarily in investments restricted by Chapter 7 of the UTMF Code, such investments may not be in contravention of the relevant limitation."
610,"(i) Where the Collective Investment Schemes are also managed by the Manager, or by other companies within the same group that the Manager belongs to, then restrictions in (1)(a), (d) and (g) above and (3) below are also applicable to investments of the Collective Investment Schemes."
611,46 (ii) A Collective Investment Scheme’s objective may not be to invest primarily in other Collective Investment Scheme(s).
612,"(iii) For the avoidance of doubt, the Sub-Fund may invest in scheme(s) authorized by the SFC under Chapter 8 (except for hedge funds under Chapter 8.7 of the UTMF Code), eligible scheme(s) (i.e."
613,"schemes which are set out in the list of recognised jurisdictions issued by the SFC) of which the net derivative exposure does not exceed one hundred per cent (100%) of its total Net Asset Value, and exchange traded funds (“ETFs”) satisfying the requirements in the Note under “Investment in other schemes” of Chapter 7 of the UTMF Code in compliance with Chapter 7.11 and 7.11A of the UTMF Code."
614,"(iv) Unless otherwise stated, ETFs satisfyin g the requirements in the Note under “Investment in other schemes” of Chapter 7 of the UTMF Code shall be considered and treated by the Manager as listed securities for the purposes of and subject to restrictions in (1)(a), (d) and (g) above and (3) below."
615,"As such, no holding of any ETF may be acquired or added to the Sub-Fund which would result in the Sub -Fund’s investment in each ETF exceeding ten per cent ( 10%) of its Net Asset Value, unless otherwise stated."
616,"(d) Where the Sub-Fund invests in any Collective Investment Scheme(s) managed by the Manager or by a Connected Person of the Manager, all initial charges and redemption charges on the underlying Collective Investment Scheme(s) shall be waived."
617,No investment may be made in any underlying Collective Investment Scheme(s) managed by the Manager or by a Connected Person of the Manager if such investment would result in an increase in the overall total of Manager’s fees and other costs and charges borne by the Unitholders or by the Sub-Fund.
618,"(e) The Manager or any person acting on behalf of the Sub-Fund or the Manager shall not obtain a rebate on any fees or charges levied by an underlying Collective Investment Scheme or its management company, or any quantifiable monetary benefits in connection with investments in any underlying Collective Investment Scheme."
619,"For the avoidance of doubt, exchange traded funds may be considered and treated as (a) listed securities for the purposes of and subject to the restrictions in (1)(a), (1)(d) and (1)(g) above; or (b) collective investment schemes for the purposes of and subject to the restrictions in (2)(a), (2)(b) and (2)(c), as specified in the Note immediately preceding Chapter 7.11 of the UTMF Code (3) No holding of any Security may be acquired f or or added to the Sub-Fund which would result in the value of the Sub -Fund’s investments in Securities and other financial products or instruments that are neither listed, quoted nor dealt in on a market (as defined under Chapter 7.3 of the UTMF Code) exceeding fifteen per cent (15%) of the latest available Net Asset Value of the Sub-Fund."
620,"(4) Notwithstanding the restrictions in 1(a), (d) and (g) above, the Sub -Fund may invest in Government and other public securities (as specified in Notes (1) and (2) to Chapter 7.5 of the UTMF Code) PROVIDED THAT no such securities shall be acquired or added to 47 the Sub-Fund if as a result thereof the value of the Sub -Fund’s investment in such securities of the same issue would exceed thirty per cent (30%) of the Sub-Fund’s latest available Net Asset Value."
621,"Subject to the approval of the SFC, the said thirty per cent (30%) limit may be exceeded, and the Manager may invest all of its assets in Government and other public securities in any number of different issues despite the restriction set out in Chapter 7.5 of the UTMF Code."
622,"(5) The Sub-Fund shall not invest in physical commodities unless otherwise approved by the SFC on a case-by-case basis, taking into account the liquidity of the physical commodities concerned and availability of su fficient and appropriate additional safeguards where necessary."
623,(6) The Sub-Fund may acquire financial derivative instruments for hedging purposes.
624,"For the purpose of this restriction, financial derivative instruments are generally considered as being acquired for hedging purposes if they meet all the following criteria: • they are not aimed at generating any investment return; • they are solely intended for the purpose of limiting, offsetting or eliminating the probability of loss or risks arising from the investments being hedged; • although they may not necessarily reference to the same underlying assets, they should relate to the same asset class with high correlation in terms of risks and return, and involve taking opposite positions, in respect of the investments being hedged; and • they exhibit price movements with high negative correlation with the investments being hedged under normal market conditions."
625,"Hedging arrangement should be adjusted or re-positioned, where necessary and with due consideration on the fees, expenses and costs, to enable the Sub-Fund to meet its hedging objective in stressed or extreme market conditions."
626,(7) The Sub -Fund currently does not acquire financial derivative instruments for non - hedging purposes (“ investment purposes ”).
627,"In case the Sub -Fund acquires financial derivative instruments for investment purpose in future, the Sub -Fund’s net exposure relating to these financial derivative instruments (“ net derivative exposure ”) will not exceed fifty per cent (50%) of the latest available Net Asset Value of the Sub-Fund (and subject to the requirements as specified in Notes (1) to (3) to Chapter 7.26 of the UTMF Code)."
628,"If the Sub-Fund’s net derivative exposure exceeds fifty per cent (50%) of its latest available Net Asset Value, the Sub-Fund shall make available, through the Sub -Fund’s website or other acceptable channels, the information on financial derivative instruments acquired by the Sub-Fund (such as counterparty exposure and collateral information) to investors on an ongoing basis."
629,This P rospectus shall direct investors to the website or other channels where this information shall be published.
630,"(8) Subject to the restriction in (7) above and the restriction in (9) below, the Sub-Fund may invest in financial derivative instruments provided that no holding of any such financial derivative instruments may be acquired or added to the Sub-Fund which would result in the exposure to the underlying assets of the financial derivative instruments, together with the other investments of the Sub-Fund, in aggregate exceeding the corresponding investment restrictions or limitations applicable to such underlying assets and investments as set out in the restrictions in (1) (a), (d) and (e) and (2) and (4) above and (14)(b) below."
631,"48 (9) The fina ncial derivative instruments invested by the Sub -Fund shall be either listed/quoted on a stock exchange or dealt in over -the-counter market and comply with the following provisions: (a) the underlying assets consist solely of shares in companies, debt securities, money market instruments, units/shares of Collective Investment Schemes, deposits with substantial financial institutions, Government and other public securities, highly- liquid physical commodities, financial indices, interest rates, foreign exchange rates, currencies, or other asset classes acceptable to the SFC, in which the Sub - Fund may invest according to its investment objectives and policies (and subject to the requirements as specified in Note (2) to Chapter 7.28(a) of the UTMF Code); (b) the counterparties to transactions of over -the-counter financial derivative instruments or their guarantors are substantial financial institutions ."
632,"For this purpose, the SFC may consider to accept other entity falling outside the definition of “substantial financial institution” on a case -by-case basis taking into account factors such as the regulatory status of the entity or the group to which it belongs and the net asset value of the entity; (c) subject to the restrictions in (1)(a) and (1)(d) above, the Sub -Fund’s net counterparty exposure to a single entity arising from transactions of over -the- counter financial derivative instruments may not exceed ten per cent (10%) of the latest available Net Asset Value of the Sub-Fund."
633,"For this purpose, exposure to a counterparty of over-the-counter financial derivative instruments may be lowered by the collateral received (if applicable) and should be calculated with reference to the value of collateral and positive mark to market value of the over-the-counter financial derivative instruments with that counterparty, if applicable; and (d) the valuation of the financial derivative instruments is marked -to-market daily, subject to regular, reliable and verifiable valuation conducted by the Manager or the Trustee, or their nominee(s), agent(s) or delegate(s) independent of the issuer of the financial derivative instruments through measures such as the establishment of a valuation committee or engagement of third party services."
634,"The financial derivative instruments can be sold, liquidated or closed by an offsetting transaction at any time at their fair value at the Sub -Fund's initiative."
635,"Further, calculation agent/fund administrator should be adequately equipped wi th the necessary resources to conduct independent marked -to-market valuation and to verify the valuation of the financial derivative instruments on a regular basis."
636,"(10) For the avoidance of doubt, restrictions and limitations on counterparty as set out in (1)(a), (1)(d) and (9)(c) above will not apply to financial derivative instruments that are: (a) transacted on an exchange where the clearing house performs a central counterparty role; and (b) marked-to-market daily in the valuation of their financial derivative instrument positions and subject to margining requirements at least on a daily basis."
637,(11) The Sub-Fund shall at all times be capable of meeting all its payment and delivery obligations incurred under transactions in financial derivative instru ments (whether for 49 hedging or for investment purposes).
638,"The Manager shall, as part of its risk management process, monitor to ensure that the transactions in financial derivative instruments are adequately covered on an ongoing basis."
639,"For this purpose, ass ets that are used to cover the Sub-Fund’s payment and delivery obligations incurred under transactions in financial derivative instruments should be free from any liens and encumbrances, exclude any cash or near cash for the purpose of meeting a call on an y sum unpaid on a security (see restriction in (15) below), and cannot be applied for any other purposes."
640,"(12) Subject to the restriction in (11) above, a transaction in financial derivative instruments which gives rise to a future commitment or contingent commitment of the Sub-Fund shall be covered as follows: (a) in the case of financial derivative instruments transactions which will, or may at the Sub-Fund’s discretion, be cash settled, the Sub -Fund shall at all times hold sufficient assets that can b e liquidated within a short timeframe to meet the payment obligation; and (b) in the case of financial derivative instruments transactions which will, or may at the counterparty’s discretion, require physical delivery of the underlying assets, the Sub-Fund should hold the underlying assets in sufficient quantity at all times to meet the delivery obligation."
641,"If the Manager considers the underlying assets to be liquid and tradable, the Sub-Fund may hold other alternative assets in sufficient quantity as c over, provided that such assets may be readily converted into the underlying assets at any time to meet the delivery obligation."
642,"In the case of holding alternative assets as cover, the Sub -Fund should apply safeguard measures such as to apply haircut where appropriate to ensure that such alternative assets held are sufficient to meet its future obligations."
643,"(13) Where a financial instrument embeds a financial derivative (as defined in Chapter 7.31 of the UTMF Code), restrictions in (6) to (12) will also apply to the embedded financial derivative."
644,"(14) The Manager shall not on behalf of the Sub-Fund: (a) invest in a ny Security of any class in any company or body if any director or officer of the Manager individually owns more than 0.5 per cent (0.5%) of the total nominal amount of all the issued securities of that class, or collectively the directors and officers of the Manager own more than five per cent (5%) of those securities; (b) invest in any type of real estate (including buildings) or interes ts in real estate (including options or rights, but excluding shares in real estate companies and interests in real estate investment trusts (REITs))."
645,"In the case of investments in such shares and REITs, they shall comply with the investment limits as set out in the restrictions in (1)(a), (d) and (g), (2)(a) and (3) above, where applicable."
646,"For the avoidance of doubt, where investments are made in listed REITs, the investment limits as set out in the restrictions in (1)(a), (d) and (g) above apply, and where investments are made in unlisted REITs, which are either companies or Collective Investment Schemes, the restrictions in ( 2)(a) and ( 3) apply respectively; 50 (c) make short sales if it results in the Sub-Fund’s liability to deliver Securities exceeding ten per cent (10%) of the latest available Net Asset Value of the Sub- Fund or if the Security which is to be sold short is not actively traded on a market where short selling activity is permitted."
647,"For the avoidance of doubt, the Sub - Fund is prohibited to carry out any naked or uncovered short sale of Securities and short selling should be carried out in accordance with all applicable laws and regulations; (d) subject to the restriction in ( 3) above , lend , assume, guarantee, endorse or otherwise become directly or contingently liable for or in connection with any obligation or indebtedness of any person ."
648,"For the avoidance of doubt, reverse repurchase transactions in compliance with the requirements as set out in restrictions in (21), (23) to (25) below are not subject to the limitations herein; or (e) acquire any asset or engage in any transaction which involves the assumption of any liability which is unlimited."
649,(15) The Manager shall not be entitled to apply any part of the Sub-Fund in the acquisition of any Security which are for the time being nil paid or partly paid in respect of which a call is to be made for any sum unpaid on that Security unless such call could be met in full out of cash or near cash by the Sub -Fund’s portfolio whereby such amount of cash or near cash has not been segregated to cover a future or contingent commitment arising from transaction in financial derivative instruments for the purposes of restrictions in (11) and (12) above.
650,"(16) It shall not be necessary for the Manager to effect changes of investments if such action would, in the opinion of the Manager, cause a material disruption to the relevant securities market(s) or merely because, owing to appreciations or depreciations in the value of the investments held or made for the account of the Sub -Fund, any of the limits referred to in this section shall be exceeded, nor by reason of any of those limits being exceeded as a result of the Sub -Fund receiving, taking up or participating in any rights, bonuses or benefits in the nature of capital, or any scheme or arrangement for amalgamation, reconstruction, conversion or exchange, or as a result of any redemption caused by a redemption of Units or any payment out of the Sub-Fund but if and so long as any of such limits shall be exceeded the Manager shall not (otherwise than as aforesaid) acquire any further investments which would result in such limit being further exceeded."
651,"In the event that any of the investment limits contained in this section is breached, the Manager shall as a priority objective take all steps as may be necessary to remedy the situation within a reasonable period of time, taking due account of the interests of Unitholders."
652,"(17) The Sub-Fund may with the approval of the SFC beneficially ow n any entity, including all or part of the issued share capital of any company or companies, which for fiscal or other reasons the Manager considers it necessary or desirable for the Trustee to incorporate or acquire for the purpose of holding investments contained in the Sub-Fund, provided that all arrangements in connection with the formation and operation thereof shall have been agreed with the Trustee."
653,"None of the prohibitions, limitations or restrictions in this section shall apply to investments in, loans to or deposits with any such entity, and for the purposes of this section investments held by any such entity shall be deemed to be held or (as the case may be) made directly by the Sub-Fund."
654,"51 (18) For the purposes of this section: (a) Securities shall be deemed to be of the same class or issue if they confer identical rights and (if applicable) are subject to identical restrictions (but so that in the case of an issue of Securities which are in other respects identical with Securities already in issue, any temporary differences in rights as to the dividends or interest between such existing and new Securities shall be disregarded); and (b) the value of any investment for the purpose of any limit contained in this section shall include any accrued interest in respect thereof, and such accrued interest shall also be included in the Net Asset Value of the Sub-Fund."
655,(19) The liability of Unitholders shall be limited to their investments in the Sub-Fund.
656,"(20) Subject to other provisions of this section, the Trustee may at the request of the Manager arrange for any Securities for the time being comprised in the Sub-Fund to be loaned by, or Securities to be loaned to, the Trust through the agency of or directly with any person acceptable to the Trustee (including the Manager or the Trustee or any Connected Person of either of them)."
657,"(21) The Manager currently does not intend to engage the Sub-Fund in any securities lending, sale and repurchase and reverse repurchase transactions (collective ly, “securities financing transactions”) ."
658,"If the Sub -Fund engages in any such securities financing transactions, they should be in the best interests of Unitholders to do so and the associated risks have been properly mitigated and addressed."
659,The counterpa rties to securities financing transactions shall be financial institutions which are subject to ongoing prudential regulation and supervision.
660,"To limit the exposure to each counterparty, the Sub-Fund may receive collateral from such counterparty provided t hat the collateral complies with the requirements as set out in Chapter 7.36 to 7.38 of the UTMF Code and the disclosure requirements under C2A of Appendix C of the UTMF Code."
661,(22) The maximum level of Securities available for lending shall be limited to one hundred per cent (100%) of the latest available Net Asset Value of the Sub -Fund or such other percentage as may from time to time be determined by the Manager and specified in this Prospectus.
662,"Where securities financing transactions undertaken by the Sub-Fund exceeds fifty per cent (50%) of its latest available Net Asset Value, the Sub -Fund shall make available, through the Sub -Fund’s own website or other acceptable channels, the information on securities financing transactions undertaken by the Sub -Fund (such as counterparty exposure and collateral information) to investors on an ongoing basis."
663,This Prospectus shall direct investors to the website or other channels where this information is published.
664,"If the lending counterparty is an affiliate of the M anager, the lending transactions shall be disclosed in the Sub-Fund’s annual reports."
665,(23) The Sub-Fund shall have at least one hundred per cent (100%) collateralization in respect of the securities financing transaction(s) into which it enters to ensure there is no uncollateralized counterparty risk exposure arising from these transactions.
666,"(24) All the revenues arising from securities financing transactions, net of direct and indirect expenses as reasonable and normal compensation for the services rendered in the context of the securities financing transactions, shall, on receipt by the Trustee, be returned to the Sub-Fund."
667,"Where any loan has been arranged through the Manager or the Trustee or a 52 Connected Person of either of them, the relevant entity sha ll be entitled to retain for its own use and benefit any fee or benefit it receives on a commercial basis in connection with such arrangement."
668,(25) The Sub-Fund shall ensure that it is able at any time to recall the Securities or the full amount of cash (as the case may be) subject to the securities financing transaction(s) or terminate the securities financing transaction(s) into which it has entered.
