sentence_id,text
0,"Hang Seng Investment Index Funds Series II Hong Kong Offering Document Important – If you are in any doubt about the contents of this offering document, you should consult your broker, bank manager, solicitor or accountant or other independent professional financial adviser."
1,Investors should note that this document relates to Sub-Funds which may offer (i) both Listed Class Units and Unlisted Class Units or (ii) Listed Class Units only.
2,"The SEHK, the Securities and Futures Commission in Hong Kong (the “SFC”) and Hong Kong Securities Clearing Company Limited (the “HKSCC”) take no responsibility for the contents of this offering document, including the Product Key Facts Statement for each Sub-Fund (as defined on page i), make no representation as to its accuracy or completeness and expressly disclaim any liability whatsoever for any loss howsoever arising from or in reliance upon the whole or any part of the contents of this offering document."
3,Each of the Trust (as defined on page i) and each Sub-Fund has been authorised as a Collective Investment Scheme by the SFC.
4,"The SFC takes no responsibility for the financial soundness of the Trust, any Sub-Fund or for the correctness of any statements made or opinions expressed in this offering document."
5,SFC authorisation is not a recommendation or endorsement of a scheme nor does it guarantee the commercial merits of a scheme or its performance.
6,It does not mean the scheme is suitable for all investors nor is it an endorsement of its suitability for any particular investor or class of investors.
7,Hang Seng Investment Management Limited 1 April 2025 i This offering document relates to the offer in Hong Kong of units (the “Units”) in the Hang Seng Investment Index Funds Series II (the “Trust”) and its sub-funds.
8,"The Trust is an umbrella unit trust established under Hong Kong law by a trust deed dated 10 September 2004, as supplemented, amended and restated from time to time (the “Trust Deed”), entered into between, amongst others, Hang Seng Investment Management Limited (the “Manager”) and Cititrust Limited (the “Trustee”)."
9,The Trust can have a number of sub-funds (the “Sub-Funds” or individually a “Sub-Fund”).
10,"Where specified in the relevant Appendix, a Sub-Fund may issue (i) both Listed Class Units and Unlisted Class Units or (ii) Listed Class Units only."
11,"For a Sub-Fund which issues both Listed Class Units and Unlisted Class Units, a separate set of the Product Key Facts Statement will be available for each of the Listed Class Units and Unlisted Class Units."
12,"The Units of the HSI ESG Enhanced Select Index ETF (the “HSI ESG ETF”) are listed on The Stock Exchange of Hong Kong Limited (the “SEHK”) and the Units of the HSI ESG ETF have been accepted as eligible securities by Hong Kong Securities Clearing Company Limited (“HKSCC”) for deposit, clearing and settlement in the Central Clearing and Settlement System (“CCASS”)."
13,Settlement of transactions between participants of the SEHK is required to take place in the CCASS on the second CCASS settlement day after any trading.
14,All activities under the CCASS are subject to the General Rules of the CCASS and CCASS Operational Procedures in effect from time to time.
15,The Units of the HSI ESG ETF may also be listed on other stock exchanges in the future.
16,"Application has been made to the SEHK for the listing of, and permission to deal in the Listed Class Units of the Hang Seng High Dividend 30 Index ETF (“HSHD30 ETF”)."
17,"Subject to compliance with the admission requirements of HKSCC, the Listed Class Units of the HSHD30 ETF will be accepted as eligible securities by HKSCC for deposit, clearing and settlement in the CCASS with effect from the date of commencement of dealings in the Listed Class Units of the HSHD30 ETF on the SEHK or such other date as may be determined by HKSCC."
18,Settlement of transactions between Participants on the SEHK is required to take place in the CCASS on the second CCASS Settlement Day after the trading day.
19,All activities under the CCASS are subject to the General Rules of HKSCC and HKSCC Operational Procedures in effect from time to time.
20,The HSHD30 ETF currently also offers Unlisted Class Units.
21,Selling and Holding Restrictions Permission for the offering of any Units in Hong Kong and the distribution of this offering document (including the Product Key Facts Statement for each Sub-Fund) in Hong Kong has been obtained.
22,Units may also be listed on other stock exchanges in the future.
23,"For the authorisation/listing status of a Sub-Fund in the relevant jurisdiction(s), investors may contact the authorised agent(s) in the relevant jurisdiction(s) or the Manager."
24,The distribution of this offering document and the offering of the Units may be restricted in certain jurisdictions.
25,"This offering document does not constitute and should not be regarded as an offer or solicitation by anyone in any jurisdiction where such offer or solicitation is not authorised or may be unlawful, where the person making such offer or solicitation is not authorised to make it or where the person receiving such offer or solicitation may not lawfully receive it."
26,"In particular:- (A) Units have not been and will not be registered under the United States Securities Act of 1933, as amended (the “Securities Act”) or under the securities laws of any state and Units have not been and will not be registered under the Investment Company Act of 1940, as amended (the “Investment Company Act”)."
27,"Units may not be offered or sold to, transferred to or acquired by any “U.S."
28,Person” (a “US Person”) and may not be directly or indirectly offered or sold in the U.S.
29,or for the benefit of a US Person.
30,"For the purposes of this restriction, the term US Person shall mean the following: 1."
31,An individual: i.
32,who is deemed a resident of the U.S.
33,under any U.S.
34,law or regulation; or ii.
35,who is a U.S.
36,Citizen or Green Card Holder who has not formally renounced their U.S.
37,citizenship (including a person with dual or multiple nationality) even though they may reside ii outside of the U.S.
38,An entity: i.
39,"that is a corporation, partnership, limited liability company, collective investment vehicle, investment company, pooled account, or other business, investment, or legal entity: a."
40,that was created or organised under U.S.
41,federal or state law including any non-U.S.
42,agency or branch of such entity; or b.
43,"where regardless of place of formation or organisation, was organised principally for passive investment (such as an investment company or fund or similar entity other than an employee benefit plan or employee pension scheme for the employees, officers, or principals of a non-U.S."
44,"entity having its principal place of business outside the United States);  and owned directly or indirectly by one or more US Persons, with respect to which such US Persons (unless defined as a Qualified Eligible Person under CFTC Regulation 4.7(a)) directly or indirectly hold in the aggregate 10% or greater beneficial interest; or  where a US Person is the general partner, managing member, managing director or other position with authority for directing the entity's activities; or  was formed by or for a US Person principally for the purpose of investing in securities not registered with the Securities and Exchange Commission (SEC); or  where more than 50% of its voting ownership interests or non-voting ownership interests are directly or indirectly owned by US Persons; or c."
45,that is any agency or branch of a non-U.S.
46,entity located in the U.S.; or d.
47,has its principal place of business in the U.S.; or ii.
48,that is a trust created or organised under U.S.
49,federal or state law or regardless of the place of creation or organisation: a.
50,where the income of which is subject to U.S.
51,income tax regardless of source; or b.
52,where the administration of the trust or its formation documents are subject to the supervision of one or more U.S.
53,courts; or c.
54,"where any settlor, founder, trustee, or other person responsible in whole or in part for investment decisions related to the trust is a US Person; or iii."
55,that is an estate of a deceased person: a.
56,"where, regardless of the deceased person resided while alive where an executor or administrator is a US Person or the estate is governed by U.S."
57,Law; or b.
58,who was a resident of the U.S.
59,at the time of death or the income of which is subject to U.S.
60,income tax regardless of source.
61,An employee benefit plan or pension plan: i.
62,established and administered in accordance with the laws of the U.S; or ii.
63,established for employees of a legal entity that is a US Person or has its principal place of business in U.S.
64,A discretionary or non-discretionary or similar account (including a joint account) where: i.
65,one or more beneficial owners is a US Person or held for the benefit of one or more US Persons; or ii.
66,the discretionary or similar account is held by a dealer or fiduciary organised in the U.S.
67,"Units may not be acquired or owned by, or acquired with the assets of an ERISA Plan."
68,"An “ERISA Plan” is any retirement plan subject to Title 1 of the United States Employee Retirement Income Securities Act of 1974, as amended; or any individual retirement account or plan subject to section 4975 of the United States Internal Revenue Code of 1986, as amended."
69,"For the purpose of this definition, the “United States” and “U.S.” means the United States of America (including the States and the District of Columbia), its territories, possessions and other areas of subject to its jurisdiction."
70,"If, subsequent to a Unitholder’s investment in a Sub-Fund, the Unitholder becomes a US Person, such Unitholder (i) will be restricted from making any additional investments in the relevant Sub-Fund and (ii) as iii soon as practicable have its Units compulsorily redeemed by the relevant Sub-Fund (subject to the requirements of applicable law)."
71,(B) Units will not be offered for sale in Canada.
72,"In addition, no offer or invitation to subscribe for Units may be made to, and no Units may be held by or transferred to Canadian residents or for the benefit of any Canadian resident."
73,"A distribution or solicitation may be deemed to occur in Canada where a distribution or solicitation is made to a person (including an individual, corporation, trust, partnership or other entity, or other legal person) resident or otherwise located in Canada at the applicable time."
74,"For these purposes, the following persons will generally be considered to be a Canadian resident: 1."
75,"An individual, if i."
76,the individual’s primary principal residence is located in Canada; or ii.
77,"the individual is physically located in Canada at the time of the offer, sale or other relevant activity."
78,"A corporation, if i."
79,the corporation’s head office or principal office is located in Canada; or ii.
80,securities of the corporation that entitle the holder to elect a majority of the directors are held by Canadian Resident individuals (as described above) or by legal persons resident or otherwise located in Canada; or iii.
81,the individuals that make investment decisions or provide instructions on behalf of the corporation are Canadian Resident individuals (as described above).
82,"A trust, if i."
83,the principal office of the trust (if any) is located in Canada; or ii.
84,"the trustee (or in the case of multiple trustees, the majority of trustees) are Canadian Resident individuals (as described above) or are legal persons resident or otherwise located in Canada; or iii."
85,the individuals that make investment decisions or provide instructions on behalf of the trust are Canadian Resident individuals (as described above).
86,"A partnership, if i."
87,the partnership’s head office or principal office (if any) is located in Canada; or ii.
88,the holders of the majority of the interests of or in the partnership are held by Canadian Residents (as described above); or iii.
89,the general partner (if any) is a Canadian Resident (as described above); or iv.
90,the individuals that make investment decisions or provide instructions on behalf of the partnership are Canadian Resident individuals (as described above).
91,"In addition and without prejudice to the above, the Manager has the power to impose such restrictions as the Manager may think necessary for the purpose of ensuring that no Units are acquired or held by: (a) any person in breach of the law or requirements of any country or governmental authority or the SEHK in circumstances which, in the opinion of the Manager, might result in the Trust or the Sub-Funds suffering an adverse effect which the Trust or the Sub-Funds might not otherwise have suffered; or (b) any person or persons in circumstances (whether directly or indirectly affecting such person or persons and whether taken alone or in conjunction with any other persons, connected or not, or any other circumstances appearing to the Manager to be relevant) which, in the opinion of the Manager, might result in the Trust or the Sub-Funds incurring any liability to taxation or suffering any other pecuniary disadvantage which the Trust or the Sub-Funds might not otherwise have suffered."
92,"If the Manager becomes aware that any Units are owned directly or beneficially by any person in contravention of any restrictions applied by the Manager, the Manager may require such person to transfer or redeem such Units."
93,Enquiries and Complaints to the Manager All investors’ enquiries and complaints directed to the Manager should be made in writing and sent to the following address: Hang Seng Investment Management Limited 83 Des Voeux Road Central Hong Kong iv The Manager will respond to investors’ enquiries or complaints in writing as soon as practicable.
94,v CONTENTS PART 1 – GENERAL INFORMATION RELATING TO THE TRUST AND THE SUB-FUNDS 1 INTRODUCTION 2 INVESTMENT OBJECTIVE AND STRATEGY 3 WHAT ARE THE RISKS OF INVESTING IN A SUB-FUND?
95,"5 THE OFFERING AND REDEMPTION OF LISTED CLASS UNITS 20 THE OFFERING, REDEMPTION AND SWITCHING OF UNLISTED CLASS UNITS 29 DETERMINATION OF NET ASSET VALUE 35 FEES AND EXPENSES 39 DIVIDEND POLICY AND REPORTING 42 MANAGEMENT OF THE TRUST 44 TAXATION 48 STATUTORY AND GENERAL INFORMATION 53 PART 2 – SPECIFIC INFORMATION RELATING TO EACH SUB-FUND 56 APPENDIX 1: HSI ESG Enhanced Select Index ETF 57 APPENDIX 2: Hang Seng High Dividend 30 Index ETF 70 Schedule 1 – Investment Restrictions, Security Lending and Borrowing 86 Schedule 2 – Procedures for Creation and Redemption of Listed Class Units 92 Schedule 3 – Glossary 98 1 PART 1 – GENERAL INFORMATION RELATING TO THE TRUST AND THE SUB-FUNDS Part 1 of this offering document includes information relevant to the Trust and all Sub-Funds established under the Trust."
96,The information presented in this Part 1 should be read in conjunction with the information presented in the relevant Appendix in Part 2 of this offering document in respect of a particular Sub-Fund.
97,"Where the information in Part 2 of this offering document conflicts with the information presented in this Part 1, the information in the relevant Appendix in Part 2 prevails, however, it is applicable to the specific Sub-Fund of the relevant Appendix only."
98,Please refer to “PART 2 – SPECIFIC INFORMATION RELATING TO EACH SUB-FUND” for further information.
99,"In this offering document (including the relevant Appendix for any Sub-Fund), unless the context requires otherwise, capitalised terms shall have the meanings set out in the Glossary."
100,"Other capitalised terms used, but not defined in the glossary shall have the meaning given to those terms in the Trust Deed."
101,2 INTRODUCTION The Trust The Trust is an umbrella unit trust created by the Trust Deed between the Manager and the Trustee made under Hong Kong law to facilitate the establishment of various index-tracking funds including ETFs.
102,Each of the Trust and each Sub-Fund is authorised as a Collective Investment Scheme by the SFC under Section 104 of the SFO and each Sub-Fund falls within Chapter 8.6 of the Code.
103,SFC authorisation is not a recommendation or endorsement of a Sub-Fund nor does it guarantee the commercial merits of a Sub-Fund or its performance.
104,It does not mean that a Sub-Fund is suitable for all investors nor is it an endorsement of its suitability for any particular investor or class of investors.
105,The Sub-Funds The Trust may issue different classes of Units and the Trustee shall establish a separate pool of assets under the Trust Deed as separate trusts (each such separate pool of assets a “Sub-Fund”) to which one or more class of Units shall be attributable.
106,The assets of a Sub-Fund will be invested and administered separately from the other assets of the Trust.
107,Each Sub-Fund will be an ETF listed on the SEHK.
108,The Manager and the Trustee reserve the right to establish other Sub-Funds and/or issue further classes of Units relating to a Sub-Fund or Sub-Funds in the future in accordance with the provisions of the Trust Deed.
109,"Where indicated in the relevant Appendix, the Listed Class Units in a Sub-Fund may be available for trading on the SEHK using a Dual Counter."
110,Each Sub-Fund will have its own Appendix.
111,Each Sub-Fund may issue Listed Class Units and/or Unlisted Class Units.
112,"In respect of a Sub-Fund which offers both Listed Class Units and Unlisted Class Units, please refer to the table set out in the relevant Appendix which sets out the key similarities and differences between the Listed Class Units and Unlisted Class Units."
113,"Currently, the HSI ESG ETF offers Listed Class Units only, and the HSHD30 ETF offers both Listed Class Units and Unlisted Class Units."
114,"3 INVESTMENT OBJECTIVE AND STRATEGY Investment Objective The investment objective of each Sub-Fund is to provide investment results that, before fees and expenses, closely correspond to the performance of the relevant Index unless otherwise stated in the relevant Appendix."
115,"Investment Strategy Index-tracking funds are not managed according to traditional methods of active investment management, which involve the buying and selling of securities based on the fund manager’s economic, financial and market analysis and investment judgement."
116,"Unlike an actively managed investment fund, an index-tracking fund does not attempt to outperform any particular stock market or sector thereof nor any underlying benchmark or stock index."
117,"Instead, using a passive approach or indexing investment strategy, the fund manager attempts to match, as closely as practicable, the performance of the underlying index relevant to the index-tracking fund."
118,What are indexing investment strategies?
119,Indexing investment strategies are used by fund managers to fulfil an index-tracking fund’s investment objective.
120,Replication and representative sampling are the two most common strategies.
121,"Replication Strategy Using a replication strategy, an index-tracking fund invests in substantially all the Index Constituent Stocks in substantially the same weightings (i.e."
122,proportions) as these stocks have in the underlying index.
123,The composition of the Index may change when a stock ceases to be an Index Constituent Stock or when it is delisted.
124,When a stock ceases to be an Index Constituent Stock rebalancing occurs which involves selling the outgoing Index Constituent Stock and using the proceeds to acquire the incoming Index Constituent Stock.
125,The downside of using a replication strategy is that transaction costs may be higher than when a representative sampling strategy is being used.
126,"Representative Sampling Strategy Using a representative sampling strategy, an index-tracking fund invests in a representative sample of Index Constituent Stocks selected by the fund manager using quantitative analytical models in a technique known as portfolio sampling."
127,"Under this technique, each stock is considered for inclusion in the fund based on its contribution to certain capitalisation, industry and fundamental investment characteristics."
128,"The fund manager seeks to construct the portfolio of the fund so that, in the aggregate, its capitalisation, industry and fundamental investment characteristics perform like those of its underlying index."
129,"The risk of using a representative sampling strategy is that it may not track the underlying index as closely as a replication strategy would allow, but a representative sampling strategy does provide for a close correlation to the underlying index in a cost-efficient manner."
130,"Switching Between Strategies Whilst the replication strategy is likely to track the performance of the relevant Index more closely when compared to the representative sampling strategy, it may not be the most efficient way to do so."
131,"Also, it may not always be possible or it may be difficult to buy or hold certain Securities comprising the Index."
132,"The Manager may therefore, in the appropriate circumstances, choose to use a representative sampling strategy, having regard to the number of Securities constituting the Index, the liquidity of such Securities, any restrictions on the ownership of such Securities, the transaction expenses and other trading costs, and tax and other regulatory restrictions."
133,"Investors should note that, where described in the relevant Appendix, the Manager may switch between the above investment strategies, without prior notice to investors, in its absolute discretion as it believes appropriate in order to achieve the investment objective of the relevant Sub-Fund by tracking the relevant Index as closely (or efficiently) as possible for the benefit of investors."
134,"In addition to the investment strategies set out above, a Sub-Fund may be launched with synthetic or futures strategies as described in the relevant Appendix for each such Sub-Fund."
135,"4 For a Sub-Fund which may invest in ETFs, whenever local regulations permit and in the best interest of the Unitholders, the Sub-Fund will invest in ETFs managed by the Manager or its associate, unless an appropriate ETF is not available."
136,5 WHAT ARE THE RISKS OF INVESTING IN A SUB-FUND?
137,Investors should note that the risk factors mentioned below are general risks associated with investments in a Sub- Fund and investors should consider the information included in this offering document before investing in a Sub- Fund.
138,"Whilst to the best of knowledge of the Manager, this offering document includes the information necessary for investors to be able to make an informed judgment of their investments and in particular the risks attached thereto, investors should however not solely rely upon such information for any investment in a Sub-Fund."
139,"Investors should note that there may be various other risks or considerations arising from the then prevailing political, economic, social and other conditions which may also need to be taken into account before making any decision to invest in a Sub-Fund."
140,"Investors should carefully consider the risks involved in investing in a Sub-Fund together with all other information included in this offering document (including the additional risk factors specific to each Sub-Fund as set out in the relevant Appendix) and satisfy themselves that such Sub-Fund is suitable for them having regard to their own circumstances, including their financial situation, investment experience and investment objectives before making an investment decision."
141,Investors should note that the decision whether or not to invest remains with them.
142,"If investors have any doubt as to whether or not a Sub-Fund is suitable for them, they should consult their investment adviser and obtain independent professional advice."
143,The Net Asset Value per Unit may fall or rise.
144,There can be no assurance that an investor will achieve any return on an investment in the Units or a return on the capital invested.
145,"Investors should not invest in a Sub-Fund unless they fully understand and are willing to take the various risks associated with the underlying investments of such Sub-Fund (which may expose the Sub-Fund to significant losses in terms of income as well as principal), and have the financial resources necessary to bear the substantial, or even total, loss of the capital invested."
146,"In addition, investors should avoid excessive investment in any single type of investment (in terms of its proportion in the overall investment portfolio) including any proposed investment in a Sub-Fund so as to avoid having the investment portfolio being over-exposed to any particular investment risk."
147,Many factors will affect the performance of a Sub-Fund.
148,"A Sub-Fund’s Net Asset Value will change based on changes in market conditions in response to other economic, political, monetary and financial developments."
149,"A Sub-Fund’s reaction to these developments will be affected by the types of securities in which the Sub-Fund invests, the financial condition, industry and economic sector, and geographic location of an issuer, and the Sub-Fund’s level of investment in the securities of that issuer."
150,"To the extent that the Index concentrates in the securities of a particular industry or group of industries, the Manager may similarly concentrate a Sub-Fund’s investments."
151,Such Sub-Fund’s performance could depend heavily on the performance of that industry or group of industries and could be more volatile than the performance of less concentrated funds.
