sentence_id,text
1245,"Website www.hangsenginvestment.com (this website has not been reviewed by the SFC) Key information applicable to the Listed Class Units only Initial Issue Date 3 April 2025 (the Business Day immediately before the Listing Date) Listing Date (SEHK) 7 April 2025 Issue Price during the Initial Offer Period HKD 15, or such other amount from time to time determined by the Manager and approved by the Trustee."
1246,Exchange Listing SEHK – Main Board Stock Code 03466 – HKD Counter Short Stock Name HS HIGH DIV – HKD Counter Trading Board Lot Size 400 Units – HKD Counter Trading Currency Hong Kong dollars (HKD) – HKD counter Distribution Policy Monthly cash distributions (if any) at the discretion of the Manager.
1247,Each Unitholder will receive distributions in HKD only.
1248,There is no guarantee of regular distributions and if distributions are paid the amount being distributed.
1249,The Manager may at its discretion pay distribution out of capital or effectively out of the capital15 of the HSHD30 ETF.
1250,Payment 15 The Manager may at its discretion pay distribution out of gross income while charging/paying all or part of 71 of distributions out of capital amounts to a return or withdrawal of part of an investor’s original investment or from any such capital gains attributable to that original investment.
1251,Any such distributions may result in an immediate reduction in the Net Asset Value per Unit.
1252,"Creation/Redemption Policy Cash (in HKD) or in-kind creation and redemption Application Unit Size (only by or through Participating Dealers) Minimum 200,000 Units (or multiples thereof) or such other number of Units determined by the Manager, approved by the Trustee and notified by the Manager to the Participating Dealers Dealing Deadline 3:00 p.m."
1253,(Hong Kong time) for a cash Creation Application or Redemption Application and 4:30 p.m.
1254,"for an in-kind Creation Application or Redemption Application Management Fee Currently up to 0.55% per year of the Net Asset Value Market Makers (HKD counter)* BNP Paribas Securities (Asia) Limited China Merchants Securities (HK) Co., Limited Participating Dealers* BNP PARIBAS China Merchants Securities (HK) Co., Limited Mirae Asset Securities (HK) Limited Service Agent HKCAS Listing Agent Hang Seng Investment Management Limited * Please refer to the Manager’s website for the latest lists of Market Makers and Participating Dealers."
1255,"Key information applicable to the Unlisted Class only Initial Issue Date 7 April 2025 Unlisted Classes Offered Class A HKD – Income Units Class A USD – Income Units Class A RMB (hedged) – Income Units Class D HKD – Accumulation Units Class I HKD – Accumulation Units Initial Issue Price Class A HKD – Income Units: HKD 10 Class A USD – Income Units: USD 10 Class A RMB (hedged) – Income Units: RMB 10 Class D HKD – Accumulation Units: HKD 1 Class I HKD – Accumulation Units: HKD 10 the HSHD30 ETF’s fees and expenses to/out of the capital of the HSHD30 ETF (resulting in an increase in distributable income for the payment of distribution by the HSHD30 ETF), and thereby effectively pay distributions out of the capital of the HSHD30 ETF."
1256,72 Dealing Deadline 4:00 p.m.
1257,(Hong Kong time) Distribution Policy Accumulation Units: Income arising in respect of Accumulation Units accumulated.
1258,No distributions will be made currently.
1259,Any income received by Accumulation Units (whether in the form of cash or otherwise) will be accumulated and reflected in the Unit price.
1260,Income Units: Monthly (if any).
1261,Monthly cash dividends (if any) at the discretion of the Manager.
1262,The Manager may make declaration of distribution every month.
1263,"There is no guarantee of regular distribution and, if distribution is made, the amount being distributed."
1264,"The Manager may, at its discretion, pay dividend out of capital."
1265,"The Manager may also, at its discretion, pay dividend out of gross income while all or part of the fees and expenses of the HSHD30 ETF are charged to/paid out of the capital of the HSHD30 ETF, resulting in an increase in distributable income for the payment of dividends by the HSHD30 ETF and therefore, the HSHD30 ETF may effectively pay dividend out of capital."
1266,Payments of dividends out of capital or effectively out of capital amounts to a return or withdrawal of part of an investor’s original investment or from any capital gains attributable to that original investment.
1267,Any distributions involving payment of dividends out of the HSHD30 ETF’s capital or effectively out of capital may result in an immediate reduction in the Net Asset Value per Unit.
1268,All Units will receive distributions in their respective class currencies.
1269,"Management Fee Class A HKD – Income Units Class A USD – Income Units Class A RMB (hedged) – Income Units Currently up to 1% per year of the Net Asset Value Class D HKD – Accumulation Units Currently up to 0.55% per year of the Net Asset Value Class I HKD – Accumulation Units Currently up to 0.275% per year of the Net Asset Value Trustee Fee 0.049% per annum, subject to a minimum monthly fee of HKD10,425 Key similarities and differences between Listed Class and Unlisted Class Investment Objective Same for both Listed Class and Unlisted Class."
1270,Please refer to the sections below headed “What is the investment objective?” and “What is the investment strategy?” Investment Strategy Valuation Policy Same for both Listed Class and Unlisted Class.
1271,Please refer to the section headed “DETERMINATION OF NET ASSET VALUE” of this Prospectus.
1272,73 Valuation Point Same for both Listed Class and Unlisted Class.
1273,Please refer to the section headed “DEFINITIONS” of this Prospectus.
1274,"Dealing Arrangements There are some differences in certain dealing arrangements in respect of each of the Listed Class and Unlisted Class, including but not limited to different minimum amounts for creation/subscription and redemption of Units."
1275,"Unitholders should note that the dealing frequency, the definition of “Dealing Day” and the Dealing Deadline for creation/subscription and redemption in respect of Listed Class and Unlisted Class are the same."
1276,"However, the applicable dealing procedures and timing with the relevant Participating Dealer (in the case of the Listed Class) and the Authorised Distributor (if applicable, in the case of the Unlisted Class) may be different."
1277,Unitholders should check with the relevant Participating Dealer or Authorised Distributor (as applicable) for the applicable dealing procedures and timing.
1278,In respect of the Listed Class: - a cash Creation Application or Redemption Application for Listed Class Units received at or before 3:00 p.m.
1279,(Hong Kong time) on Day T will be processed at the Net Asset Value per Unit of the Listed Class Units of the HSHD30 ETF of Day T; - a cash Creation Application or Redemption Application for Listed Class Units received after the dealing deadline of Day T for such Class (i.e.
1280,3:00 p.m.
1281,"(Hong Kong time) on Day T), will be processed on the next Dealing Day (i.e."
1282,Day T+1) at the Net Asset Value per Unit of Listed Class Units of the HSHD30 ETF of Day T+1; - an in-kind Creation Application or Redemption Application for Listed Class Units received at or before 4:30 p.m.
1283,(Hong Kong time) on Day T will be processed at the Net Asset Value per Unit of the Listed Class Units of the HSHD30 ETF of Day T; - an in-kind Creation Application or Redemption Application for Listed Class Units received after the dealing deadline of Day T for such Class (i.e.
1284,4:30 p.m.
1285,"(Hong Kong time) on Day T), will be processed on the next Dealing Day (i.e."
1286,Day T+1) at the Net Asset Value per Unit of Listed Class Units of the HSHD30 ETF of Day T+1; - the Manager may determine and agree with the Trustee such other time prior to the calculation of the Net Asset Value of the HSHD30 ETF on the relevant Dealing Day as the dealing deadline; and - a secondary market investor can buy and sell the Listed Class Units on the SEHK through his stockbroker at any time the SEHK is open for trading.
1287,Investors can buy or sell the Listed Class Units at market price.
1288,In respect of the Unlisted Class: - a subscription or redemption application for Unlisted Class Units received at or before 4:00 p.m.
1289,(Hong Kong time) on Day T will be processed at the Net Asset Value per Unit of the Unlisted Class Units of Day T; - a subscription or redemption application for Unlisted Class Units received after the dealing deadline of Day T for such class (i.e.
1290,4:00 p.m.
1291,"(Hong Kong time) on Day T), will be processed on the next Dealing Day (i.e."
1292,Day T+1) at the Net Asset Value per Unit of the Unlisted Class Units of Day T+1; and 74 - applicants may apply for Unlisted Class Units through the Manager or an Authorised Distributor.
1293,"Authorised Distributors may have different dealing procedures, including earlier cut-off times for receipt of applications and/or cleared funds."
1294,Applicants who intend to apply for Unlisted Class Units through an Authorised Distributor should therefore consult the Authorised Distributor for details of the relevant dealing procedures.
1295,"Please refer to the sections headed “THE OFFERING AND REDEMPTION OF LISTED CLASS UNITS” and “THE OFFERING, REDEMPTION AND SWITCHING OF UNLISTED CLASS UNITS” in this Hong Kong Offering Document for details of the dealing arrangements of Listed Class Units and Unlisted Class Units respectively."
1296,Distribution Policy In respect of the Listed Class: Monthly cash distributions (if any) at the discretion of the Manager.
1297,Each Unitholder will receive distributions in HKD only.
1298,There is no guarantee of regular distributions and if distributions are paid the amount being distributed.
1299,In respect of the Unlisted Classes: Accumulation Units: Income arising in respect of Accumulation Units accumulated.
1300,No distributions will be made currently.
1301,Any income received by Accumulation Units (whether in the form of cash or otherwise) will be accumulated and reflected in the Unit price.
1302,Income Units: Monthly (if any).
1303,Monthly cash dividends (if any) at the discretion of the Manager.
1304,The Manager may make declaration of distribution every month.
1305,"There is no guarantee of regular distribution and, if distribution is made, the amount being distributed."
1306,"The Manager may, at its discretion, pay dividend out of capital."
1307,"The Manager may also, at its discretion, pay dividend out of gross income while all or part of the fees and expenses of the HSHD30 ETF are charged to/paid out of the capital of the HSHD30 ETF, resulting in an increase in distributable income for the payment of dividends by the HSHD30 ETF and therefore, the HSHD30 ETF may effectively pay dividend out of capital."
1308,Payments of dividends out of capital or effectively out of capital amounts to a return or withdrawal of part of an investor’s original investment or from any capital gains attributable to that original investment.
1309,Any distributions involving payment of dividends out of the HSHD30 ETF’s capital or effectively out of capital may result in an immediate reduction in the Net Asset Value per Unit.
1310,All Units will receive distributions in their respective class currencies.
1311,Fee Structure In respect of the Listed Class: The current Management Fee is up to 0.55% per annum of the Net Asset Value of Listed Class and is accrued daily and calculated as at each Dealing Day.
1312,It is payable out of the Listed Class monthly in arrears.
1313,"An investment in the Listed Class in the secondary market is subject to fees involved in relation to the trading of such Listed Class Units on the SEHK (such as the brokerage fee, transaction levy, trading fee and so on)."
1314,"75 In respect of the Unlisted Classes: The management fee is currently up to 1% per annum for Class A Units, up to 0.55% per annum for Class D Units and up to 0.275% per annum for Class I Units of the Net Asset Value of each respective Class, and is accrued daily and calculated as of each Dealing Day."
1315,The Manager may levy a Preliminary Charge of up to 2.5% of the Issue Price of Unlisted Class Units.
1316,No Redemption Charge will be levied on the Unlisted Class Units.
1317,Please refer to the sections headed “Fees and Expenses Payable by a Sub-Fund” and “Fees and expenses payable by Participating Dealers and investors of the Listed Class Units only” in this Appendix for further details.
1318,Net Asset Value per unit There is a separate Net Asset Value for each class of Units.
1319,"The Net Asset Value may be different in respect of each of the Listed Class and Unlisted Class due to various factors, including but not limited to the different fee and expense items applicable to each class of Units, and charges, stamp duty and so on."
1320,"Accordingly, the performance of the different classes will be different."
1321,"Further, Listed Class Units in the secondary market will be bought and sold at market price which may be different from the Net Asset Value per Unit of the Listed Class."
1322,Please refer to the relevant risk factors in the product key facts statements of the Listed Class and Unlisted Class and the section headed “WHAT ARE THE RISKS OF INVESTING IN A SUB-FUND?” in this Hong Kong Offering Document.
1323,"Termination Due to the nature of the listing of the Listed Class Units, the termination procedures applicable to the Listed Class Units and Unlisted Class Units may differ."
1324,Please refer to the sub-section headed “Termination” under the section headed “STATUTORY AND GENERAL INFORMATION” of this Hong Kong Offering Document for further details.
1325,Is an investment in the HSHD30 ETF suitable for me?
1326,The answer really depends on an assessment of your own circumstances.
1327,"You should satisfy yourself that the HSHD30 ETF is suitable for you having regard to your own circumstances, including your financial situation, investment experience and investment objectives, before making any decision to invest in the HSHD30 ETF."
1328,Please note that the decision whether or not to invest remains with you.
1329,"If you have any doubt as to whether or not the HSHD30 ETF is suitable for you, you should consult your investment adviser and obtain independent professional advice."
1330,"By way of background, the HSHD30 ETF has been established for investors seeking a more cost efficient (based on the ongoing charges figure disclosed in the Product Key Facts Statement of the HSHD30 ETF) and passive means of investing in a portfolio of shares of companies or real-estate investment trusts (“REITs”) with the highest dividend yield."
1331,"In tracking the Index, the HSHD30 ETF intends to invest in the 30 companies / real-estate investment trusts (“REITs”) listed on the SEHK with the highest net dividend yield."
1332,You should carefully consider the risks involved in investing in the HSHD30 ETF together with all other information included in this offering document before making an investment decision.
1333,Please specifically see the section headed “What are the Risks of Investing in the HSI ESG ETF?”.
1334,"In addition, you should avoid excessive investment in any single type of investment (in terms of its proportion of your overall portfolio) including any proposed investment in Units so as to avoid having your investment portfolio 76 being over-exposed to any particular investment risk."
1335,What is the investment objective of HSHD30 ETF?
1336,"The HSHD30 ETF is an index-tracking fund that seeks to provide investment returns for investors that match, before fees and expenses, the price return performance of the Hang Seng High Dividend 30 Index as closely as practicable."
1337,What Investment Strategy is used by the HSHD30 ETF?
1338,"In seeking to achieve the HSHD30 ETF’s investment objective, the Manager will primarily adopt a full replication strategy by which the assets of the HSHD30 ETF will comprise the constituent securities with reference to their respective weightings in the Index."
1339,"In order to maximise portfolio management efficiency, minimise transaction costs and tracking error, exposure to the Index may also be obtained through representative sampling strategies which include: a."
1340,direct holding of a representative sample of securities; and/or b.
1341,FDIs (such as futures); and/or c.
1342,"other collective investment schemes (including exchange-traded funds), from which the return to the HSHD30 ETF substantially reflects the performance of the Index."
1343,"As part of the foregoing, the HSHD30 ETF may or may not have exposure to all of the securities in the Index, and may have exposure to securities which are not included in the Index."
1344,"When representative sampling strategies are used, the weighting of a particular constituent security in the HSHD30 ETF may exceed its weighting in the Index and such excess is subject to a maximum limit of up to 4% of the Net Asset Value of the HSHD30 ETF in respect of any constituent security."
1345,Such strategies and FDIs are chosen based on their correlation with the Index and cost efficiency in order to reflect the characteristics of the Index.
1346,"The Manager may adopt the full replication strategy or representative sampling strategies without prior notice to investors, in its absolute discretion."
1347,"Although FDIs may be used (as aforesaid), they will not be used extensively for investment purpose."
1348,Financial derivative instruments may also be used for currency hedging purposes in respect of hedged Unlisted Class(es).
1349,The net derivative exposure will be up to 50% of its Net Asset Value.
1350,"Currently, the Manager has no intention to have any securities lending, repurchase, reverse repurchase or similar over-the-counter transactions entered into for the account of the HSHD30 ETF."
1351,"In the future, where the Manager intends to have any securities lending, repurchase, reverse repurchase or similar over-the-counter transactions entered into for the account of the HSHD30 ETF, subject to SFC’s prior approval (if necessary), 1 month’s prior notice will be given to the relevant Unitholders."
1352,Are there any Investment or other Restrictions Applicable to the HSHD30 ETF?
1353,"Please refer to Schedule 1 – Investment Restrictions, Security Lending and Borrowing of this offering document."
1354,What are the Risks of Investing in the HSHD30 ETF?
1355,"In addition to certain risk factors applicable to the HSHD30 ETF presented in Part 1 of this offering document, the risk factors set forth below are, in the opinion of the Manager, also considered to be relevant and presently applicable to the HSHD30 ETF."
1356,Dividend risk There is no assurance that dividends will be declared and paid in respect of the securities comprising the Index.
1357,"Dividend payment rates in respect of such securities will depend on the performance of the companies or REITs 77 which form the constituent securities of the Index as well as factors beyond the control of the Manager including but not limited to, the dividend distribution policy of these companies or REITs."
1358,"In addition, whether or not distributions will be made by the HSHD30 ETF is at the discretion of the Manager taking into account various factors and its own distribution policy."
1359,There can be no assurance that the distribution yield of the HSHD30 ETF is the same as that of the Index.
1360,Geographical concentration risk The Index is subject to concentration risk as a result of tracking the performance of securities of Hong Kong listed securities of specific industry sectors.
1361,The value of the HSHD30 ETF may be more volatile than that of a fund having a more diverse portfolio of investments.
1362,"The value of the HSHD30 ETF may be more susceptible to adverse economic, political, policy, foreign exchange, liquidity, tax, legal or regulatory event affecting the Hong Kong market."
1363,Mid-capitalisation companies risk The stocks of mid-capitalisation companies may have lower liquidity and their prices are typically more volatile and more vulnerable to adverse business or economic developments than those of larger capitalisation companies.
1364,This may impact the Net Asset Value of the HSHD30 ETF to a larger extent than those of funds that invest in stocks of larger capitalisation companies.
1365,Mid-capitalisation companies generally have less diverse product lines than large-capitalisation companies and thus are more susceptible to adverse developments concerning their products.
1366,New Index Risk The Index is a new index having only been launched on 14 March 2025.
1367,"As such, the HSHD30 ETF may be riskier than other index funds tracking more established indices with longer operating history."
1368,Risk of investing in other collective investment schemes The underlying collective investment schemes in which the HSHD30 ETF may invest may not be regulated by the SFC.
1369,There may be additional costs involved when investing into these underlying collective investment schemes.
1370,There is also no guarantee that the underlying collective investment schemes will always have sufficient liquidity to meet the HSHD30 ETF’s redemption requests as and when made.
1371,The Offering and Redemption of Listed Class Units The attention of investors is drawn to the section entitled “THE OFFERING AND REDEMPTION OF LISTED CLASS UNITS” in Part 1 of this offering document.
1372,"Initial Offer Period During the Initial Offer Period, (a) Participating Dealers (acting for themselves or for their clients) may apply for Units (to be available for trading on the Listing Date) by means of (i) a cash Creation Application (in HKD only) or (ii) in-kind Creation Application on each Dealing Day for themselves and/or their clients by transferring cash and/or Securities in accordance with the Operating Guidelines; and (b) the Manager may facilitate special creations of Units by HS Funds by means of (i) a cash Special Creation Application (in HKD only) or (ii) in-kind Special Creation Application on each Dealing Day."
1373,The latest time for making a Creation Application or a Special Creation Application for Units during the Initial Offer Period is 1:00 p.m.
1374,"Hong Kong time on 2 April 2025 Hong Kong time, i.e."
1375,"2 Business Days prior to the Listing Date, or such other time as the Manager (with the approval of the Trustee) may from time to time determine."
1376,"The Issue Price which is the subject of a Creation Application or a Special Creation Application during the Initial Offer Period will be HKD15, or such other amount from time to time determined by the Manager and approved by the Trustee."
1377,After Listing Dealings in the Listed Class Units on the SEHK are expected to commence on 7 April 2025 but may be postponed by the Manager to a date no later than 6 May 2025.
1378,"The current Dealing Deadline for making a Creation Application, a Redemption Application, a Special Creation 78 Application or a Special Redemption Application is 3:00 p.m."
1379,Hong Kong time on each Dealing Day (for making a cash Creation or Redemption Application) and 4:30 p.m.
1380,"Hong Kong time on each Dealing Day (for making an in- kind Creation or in-kind Redemption Application), or such other time as the Manager (with the approval of the Trustee) may from time to time determine."
1381,All investors may buy and sell Units in the secondary market on the SEHK.
1382,"Applications for creation of Units may be made by way of a Creation Application or a Special Creation Application, either in (i) cash (in HKD only) or (ii) in-kind."
1383,Settlement for subscribing Units is due at the time specified in the Operating Guidelines or the Special Operating Guidelines on the relevant Dealing Day in accordance with the Operating Guidelines or the Special Operating Guidelines (as the case may be).
1384,"The Issue Price or Redemption Price of each Unit for any relevant Dealing Day will, subject to the qualification below, be based on the Net Asset Value of the HSHD30 ETF in HKD at the Valuation Point divided by the number of Units then in issue or deemed to be in issue, rounded to the nearest four decimal places with any amount of 0.00005 or above being rounded up (unless otherwise agreed by the Manager and the Trustee)."
1385,The benefit of any such rounding shall accrue to the HSHD30 ETF.
1386,The attention of investors is drawn to the section entitled “THE OFFERING AND REDEMPTION OF LISTED CLASS UNITS” in Part 1 of this offering document.
1387,"Summary of timetable The following table summarises all key events and the Manager’s expected timetable: Initial Offer Period commences  Participating Dealers may submit Creation Applications for themselves or for their clients in a minimum number of 200,000 Units (or multiples thereof) (or such other number of Units determined by the Manager, approved by the Trustee and notified by the Manager to the Participating Dealers)  HS Funds may submit Special Creation Applications  9:00 a.m."
1388,(Hong Kong time) on 1 April 2025 or such other date or time as the Manager may determine The date that is 2 Business Days prior to the Listing Date  Latest time for Creation Applications by Participating Dealers and Special Creation Applications for Units to be available for trading on the Listing Date  1:00 p.m.
