sentence_id,text
507,Cash subscriptions and redemptions for all Listed Class Units must be in the relevant Sub-Fund’s base currency.
508,"The Application Unit size applicable to creations or redemptions through Participating Dealers does not apply to a Special Creation Application or Special Redemption Application, which may be made in a minimum of one Unit or more."
509,"The Dealing Deadline for making a Special Creation Application and a Special Redemption Application by the HS Funds is the official closing time of the SEHK on the relevant Dealing Day, or such other time prior to the calculation of the Net Asset Value of the relevant Sub-Fund on that Dealing Day as the Manager may determine and agree with the Trustee, unless otherwise stated in the relevant Appendix."
510,Timetable Initial Offer Period The Initial Offer Period and the Listing Date of a new Sub-Fund is set out in the Appendix of the new Sub-Fund.
511,"The purpose of the Initial Offer Period is to enable Participating Dealers to subscribe for Listed Class Units either on their own account or for their clients, in accordance with the Trust Deed and the Operating Guidelines."
512,"During this period, Participating Dealers (acting for themselves or for their clients) may apply for Listed Class Units to be available for trading on the Listing Date by creation."
513,No redemptions are permitted during the Initial Offer Period.
514,"Upon receipt of a Creation Application from a Participating Dealer (acting for itself or its clients) during the Initial Offer Period, the Manager shall procure the creation of Listed Class Units for settlement on the Initial Issue Date."
515,Participating Dealers may have their own application procedures for their respective clients and may set application and payment cut-off times for their respective clients which are earlier than those set out in this offering document and which may change from time to time.
516,The Dealing Deadline in respect of Listed Class Units in a Sub-Fund may also change due to market related events.
517,Investors are therefore advised to consult the relevant Participating Dealer on its requirements if they want a Participating Dealer to subscribe for the Listed Class Units on their behalf.
518,After Listing “After Listing” commences on the Listing Date and continues until the relevant Sub-Fund is terminated.
519,All investors may purchase and sell Listed Class Units in the secondary market on the SEHK and Participating Dealers (for themselves or for their clients) may apply for creation and redemption of Listed Class Units in the primary market.
520,Are there any Special RMB Payment or Account Procedures for Sub-Funds adopting a Dual Counter Arrangement?
521,"Although the base currency of Listed Class Units for certain Sub-Funds adopting a Dual Counter Arrangement (as specified in the relevant Appendix) may be HKD, Listed Class Units in the RMB counter are available to be bought and sold on the secondary market in RMB."
522,Investors should note that RMB is the only official currency of the PRC.
523,"While both onshore RMB (“CNY”) and offshore RMB (“CNH”) are the same currency, they are traded in different and separated markets."
524,"Since the two RMB markets operate independently where the flow between them is highly restricted, CNY and CNH are traded at different rates and their movement may not be in the same direction."
525,Although there is a significant amount of RMB held offshore (i.e.
526,"outside the PRC), CNH cannot be freely remitted into the PRC and is subject to certain restrictions, and vice versa."
527,"As such, whilst CNH and CNY are both the same currency, certain special restrictions do apply to RMB outside the PRC."
528,"The liquidity and trading price of the Listed Class Units may be adversely affected by the limited availability of, and restrictions applicable to, RMB outside the 23 PRC."
529,"If any investors wish to buy or sell Listed Class Units in RMB on the secondary market, they should contact their brokers and they are reminded to confirm with their brokers in respect of Listed Class Units traded in RMB such brokers’ readiness for dealing and/or clearing transactions in RMB securities and to check other relevant information published by the SEHK regarding readiness of its participants for dealing in RMB securities from time to time."
530,CCASS Investor Participants who wish to settle the payment in relation to their trades in the Listed Class Units traded in RMB using their CCASS Investor Participant account should make sure that they have set up an RMB designated bank account with the CCASS.
531,Investors intending to purchase Listed Class Units traded in RMB from the secondary market should consult their brokers as to the RMB funding requirement and settlement method for such purchase.
532,Investors may need to open and maintain securities dealing accounts with the broker first before any dealing in Listed Class Units traded in either HKD or RMB can be effected.
533,Investors should ensure they have sufficient RMB to settle trades of Listed Class Units traded in RMB.
534,Investors should consult the banks for the account opening procedures as well as terms and conditions of the RMB bank account.
535,Some banks may impose restrictions on their RMB cheque account and fund transfers to third party accounts.
536,For non-bank financial institutions (e.g.
537,"brokers), however, such restriction may not be applicable and investors should consult their brokers as to the currency exchange service arrangement if required."
538,"The transaction costs of dealings in the Listed Class Units on the SEHK include the SEHK trading fee, SFC transaction levy and AFRC transaction levy."
539,"All these secondary trading related fees and charges will be collected in HKD and, in respect of Listed Class Units traded in RMB, calculated based on an exchange rate as determined by the Hong Kong Monetary Authority on the date of the trade which will be published on HKEx’s website by 11:00 a.m."
540,or earlier on each trading day.
541,Investors should consult their own brokers or custodians as to how and in what currency the trading related fees and charges and brokerage commission should be paid by the investors.
542,Where payment in RMB is to be made by cheque investors should consult the bank at which their respective RMB bank accounts are opened in advance as to whether there are any specific requirements in relation to the issue of RMB cheques.
543,"In particular, investors should note that some banks have imposed an internal limit (usually RMB80,000) on the balance of RMB cheque account of their clients or the amount of cheques that their clients can issue in a day and such limit may affect an investor’s arrangement of funding for purchase of Listed Class Units traded in RMB."
544,"When an individual investor opens an RMB bank account or settle RMB payments, he or she will be subject to a number of restrictions, including the daily maximum remittance amount to the PRC of RMB80,000, and that a remittance service is only available to an RMB deposit account-holder who remits from his or her RMB deposit account to the PRC and provided that the account name of the account in the PRC is identical with that of the RMB bank account with the bank in Hong Kong."
545,Please also refer to the sub-section headed “General risks of investments associated with RMB currency” in the section headed “ 24 WHAT ARE THE RISKS OF INVESTING IN A SUB-FUND?” for further details.
546,"25 Diagrammatic illustration of investment in the Sub-Funds The diagrams below illustrate the creation and redemption of Listed Class Units and trading of Listed Class Units in the secondary market: (3) Creation and redemption of Listed Class Units – Initial Offer Period and After Listing (3) Trading of Listed Class Units in the secondary market – After Listing Evidence of Unitholding Listed Class Units will be deposited, cleared and settled by the CCASS."
547,"Listed Class Units are held in registered entry form only, which means that no Unit certificates are issued."
548,The register of the relevant Sub-Fund is the evidence of ownership of Listed Class Units.
549,HKSCC Nominees Limited is the registered owner (i.e.
550,the sole holder of record) of all outstanding Listed Class Units deposited with the CCASS and is holding such Listed Class Units for the participants in accordance with the General Rules of CCASS.
551,"Furthermore, the Trustee and the Manager acknowledge that pursuant to the General Rules of CCASS neither HKSCC Nominees Limited nor HKSCC has any proprietary interest in the Listed Class Investors Creation and Redemption (through Participating Dealers) 1 Unit or multiples thereof Baskets + Cash Component or Cash Minimum number of Listed Class Units (Cash or in-kind) or multiples thereof, as specified in the relevant Appendix Baskets + Cash Component or Cash Special Creations and Redemptions for the HS Funds (through the Manager) SUB-FUND HS Funds Listed Class Units (in Trading Board Lot Size) traded on the SEHK SEHK Cash settled through CCASS Sellers Buyers 26 Units."
552,Investors owning Listed Class Units in the CCASS are beneficial owners as shown on the records of the participating brokers or the relevant Participating Dealer(s) or PD Agent(s) (as the case may be) who are participants of the CCASS.
553,"Your beneficial interest in Listed Class Units shall be established through your account with your chosen CCASS Participant or, as the case may be, other intermediary."
554,"27 Summary of Different Trading Methods of Listed Class Units and Related Fees Initial Offer Period Different Trading Methods of Listed Class Units Minimum Number of Listed Class Units (multiple of) Channel Available to Consideration, Fees and Charges1 Cash creation Application Unit size (see relevant Appendix) Through Participating Dealers Any investor satisfying the minimum unit requirements and acceptable to the Participating Dealer as its client Issue Price2 (in cash and in base currency) Transaction Fee Any fees and charges imposed by the Participating Dealer In-kind creation Application Unit size (see relevant Appendix) Through Participating Dealers Any investor satisfying the minimum unit requirements and acceptable to the Participating Dealer as its client Basket Cash Component Transaction Fee Any fees and charges imposed by the Participating Dealer Duties and Charges Special creation 1 Through the Manager only HS Funds only Basket + Cash Component (in-kind) or Issue Price2 (in cash) After Listing Different Trading Methods of Listed Class Units Minimum Number of Listed Class Units (multiple of) Channel Available to Consideration, Fees and Charges1 Purchase and sale in cash through brokers on the SEHK (secondary market) Trading Board Lot Size (see relevant Appendix) On the SEHK Any investor satisfying the minimum unit requirements Market price of Units on the SEHK Brokerage fees Other Duties and Charges Cash creation and redemption Application Unit size (see relevant Appendix) Through Participating Dealers Any investor satisfying the minimum unit requirements and acceptable to the Participating Dealer as its client Issue Price / Redemption Price2 (in cash and in base currency) Transaction Fee Any fees and charges imposed by the Participating Dealer In-kind creation and redemption Application Unit size (see relevant Appendix) Through Participating Dealers Any investor satisfying the minimum unit requirements Basket Cash Component Transaction Fee Any fees and charges imposed by the Participating Dealer 28 Different Trading Methods of Listed Class Units Minimum Number of Listed Class Units (multiple of) Channel Available to Consideration, Fees and Charges1 Duties and Charges Special creation and redemption 1 Through the Manager HS Funds only Basket + Cash Component (in-kind) or Issue Price / Redemption Price2 (in cash) 1 For details, please see section “Current Fees and Charges” as stated in the relevant Appendix."
555,2 The appropriate Duties and Charges will be taken into account in determining the Issue Price and Redemption Price (as the case may be).
556,For details please see the section “Calculation of Issue Price and Redemption Price”.
557,No money should be paid to any intermediary in Hong Kong who is not licensed or registered to carry on Type 1 (dealing in securities) regulated activity under Part V of the SFO.
558,Rejection of Applications The Manager reserves the right to reject Applications to subscribe for/create Listed Class Units.
559,Fractional Units The Sub-Funds will not issue fractional Listed Class Units unless otherwise stated in the relevant Appendix.
560,"29 THE OFFERING, REDEMPTION AND SWITCHING OF UNLISTED CLASS UNITS This section headed “THE OFFERING, REDEMPTION AND SWITCHING OF UNLISTED CLASS UNITS” contains disclosure relating to the Unlisted Class Units only."
561,"For information relating to the offering and redemption of the Listed Class Units, please refer to the section headed “THE OFFERING AND REDEMPTION OF LISTED CLASS UNITS”."
562,SUBSCRIPTION OF UNLISTED CLASS UNITS Unlisted Class Units will initially be offered to investors on the terms described in the relevant Appendix.
563,"Subject as otherwise provided in the relevant Appendix, after such initial offer, Unlisted Class Units will be available for issue on each Dealing Day for Unlisted Class Units."
564,"Individual Authorised Distributors may have the discretion, from time to time, to decide which Sub-Fund and/or classes of Unlisted Class Units to be made available to investors for subscription and/or switching, as such, investors should be aware that they may not be able to subscribe or switch to any Sub-Fund or any class of Unlisted Class Units where such Sub-Fund or Unlisted Class of Units are not made available by a particular Authorised Distributor."
565,Selected Unlisted Class Units may be distributed via selected channel(s) as determined by individual Authorised Distributors and agreed by the Manager.
566,"In order for applications to be dealt with on a Dealing Day, applications must be received by the Manager and/or its delegate prior to the application cut-off time for that Dealing Day and the relevant application monies must be received in cleared funds on behalf of the Trust prior to the payment cut-off time for such Dealing Day (both as specified in the relevant Appendix)."
567,Different application cut-off times and payment cut-off times may apply in relation to different classes of Unlisted Class Units.
568,"Subject to the Manager’s discretion to accept some late applications from an Authorised Distributor as applications received before the relevant cut-off time for that Dealing Day in certain situations as specified in the relevant Appendix, applications and application monies received after the relevant cut-off time for that Dealing Day will be processed on the next Dealing Day."
569,Payment Procedures Please refer to the relevant Appendix for specific payment procedures.
570,Payment of application monies shall be in cash.
571,"Where application monies are paid in a currency other than the currency of the relevant Unlisted Class Units, they will be converted, at the cost of the investor, into such currency before being applied (net of all currency conversion costs) in the purchase of Unlisted Class Units."
572,Conversion of currencies may involve some delay.
573,No payment by any person other than the applicant will be allowed.
574,"The Manager may also, at its sole discretion accept subscriptions in-kind."
575,No money should be paid to an intermediary in Hong Kong who is not licensed or registered to carry on Type 1 Regulated Activity (dealing in securities) under Part V of the SFO.
576,"Issue Price After the close of the Initial Offer Period (if applicable), the issue price of Unlisted Class Units in a Sub-Fund on a Dealing Day will be calculated based on the Net Asset Value of that Sub-Fund as at the applicable Valuation Point on the Dealing Day to which the application relates (for further details please refer to the section headed “DETERMINATION OF NET ASSET VALUE”)."
577,"In calculating the Issue Price of a Unit of an Unlisted Class, the Manager may impose such amount or rate (if any) as the Manager may estimate as appropriate to reflect any Duties and Charges which would be incurred for the account of the relevant Sub-Fund if the appropriate number of underlying securities were purchased at the values attributed to them in calculating the Net Asset Value per Unit."
578,"For further details, please refer to the section headed “Calculation of Issue Price and Redemption Price” under “DETERMINATION OF NET ASSET VALUE”."
579,Details of the Valuation Point applicable to each Dealing Day are set out in the relevant Appendix.
580,Currency Hedged Classes of Units Unlisted Class Units may offer “currency hedged” classes of Units.
581,"For the currency hedged classes of Units, hedging will be performed to hedge the currency of denomination of the class of Units against (i) the base currency of the Sub-Fund or (ii) the portfolio currency."
582,Currency hedged class will either be classified as a base currency hedged class or a portfolio currency hedged class.
583,Portfolio currency hedged class are the class of Units where (i) the currency exposure of the portfolio investments 30 is predominantly hedged to the currency of denomination of the class of Units; or (ii) a Sub-Fund’s base currency is hedged to the currency of denomination of the class of Units and a Sub-Fund is managed to a return in a Sub- Fund’s base currency while the portfolio investments may be exposed to multiple currencies.
584,Portfolio currency hedged classes seek to minimise the effect of currency fluctuations between the currency of denomination of the class of Units and a Sub-Fund’s base currency such that the price in the currency of denomination of the class of Units moves similarly to the price in a Sub-Fund’s base currency.
585,Base currency hedged classes are the class of Units where the underlying portfolio has or may have a material exposure to assets which are denominated in a currency (or currencies) which is (or are) different to a Sub-Fund’s base currency.
586,"Subject to the investment objective of a Sub-Fund, such exposure may or may not be material in actuality for prolonged or temporary periods."
587,Base currency hedged classes seek to provide a return which is consistent with the return on the currency of denomination of the class of Units which is the same as a Sub-Fund’s base currency.
588,"However, the returns may differ due to various factors (including interest rate differentials between the currency of denomination of the class of Units of base currency hedged classes and a Sub-Fund’s base currency and transaction costs)."
589,Investors in the base currency hedged classes will be exposed to currency exchange rate movements of the underlying portfolio currencies against a Sub-Fund’s base currency rather than being exposed to the underlying portfolio currencies against currency of denomination of the class of Units.
590,There is no assurance that hedging will be effective.
591,Any gains or losses from currency hedging shall accrue to the value of the relevant currency hedged class of Units.
592,The currency hedged class(es) which a Sub-Fund offers is/are portfolio currency hedged class(es).
593,"Minimum Investment and Subsequent Holding Subject as otherwise provided in the relevant Appendix, the Manager does not require a minimum investment or holding amount for the Unlisted Class Units."
594,"However, Authorised Distributors may impose an amount which is equal to or higher than the minimum investment and holding criteria as set out in the relevant Appendix (if any)."
595,"The Manager has the discretion to waive, change or accept an amount lower than the minimum investment or subsequent holding amount from time to time, whether generally or in a particular case."
596,"Preliminary Charge Subject as otherwise provided in the relevant Appendix, the Manager is entitled to a Preliminary Charge of up to 2.5% (or such higher percentage as the Manager with the approval of the SFC and the Trustee may determine or such lower percentage as the Manager may determine) of the issue price of each Unit."
597,The Manager has a discretion to waive this Preliminary Charge in whole or in part in relation to any application for Unlisted Class Units.
598,"Application Procedure Unless otherwise specified in the relevant Appendix, applications for Unlisted Class Units may be made by completing the relevant instruction form of any Authorised Distributor or through the Manager (as the case may be) and sending it to the relevant Authorised Distributor or the Manager (and/or its delegate) by facsimile or SWIFT messaging only for subsequent subscription application, as the case may be, together with payment for the Unlisted Class Units and the Preliminary Charge."
599,"The relevant Authorised Distributor or the Manager, as the case may be, will provide payment details for payment of the Unlisted Class Units and the Preliminary Charge."
600,Please refer to the relevant Appendix for deadlines for submitting the instruction forms and paying application monies.
601,"Save where there is a suspension of the determination of the Net Asset Value of the relevant Sub-Fund or relevant Unlisted Class, a request for subscription once given cannot be revoked without the consent of the Manager."
602,"Authorised Distributors The Manager may appoint one or more distributor(s) to market, promote, sell and/or distribute Unlisted Class Units in one or more Sub-Fund(s), and to receive applications for subscription, redemption and/or switching of Unlisted Class Units."
603,"Where application for Unlisted Class Units is made through an Authorised Distributor, Unlisted Class Units may be registered in the name of a nominee company of the Authorised Distributor through whom the applicant applies for the Unlisted Class Units."
604,"As a result of this arrangement, the applicant will be dependent on the person in whose name the applicant’s Unlisted Class Units are registered to take action on his/her behalf."
605,"As the Authorised Distributor (or its nominee) is the Unitholder of the Unlisted Class Units of the relevant Sub-Fund, the Manager and the Trustee shall not be responsible for any arrangements between the relevant applicant and the Authorised Distributor regarding the subscription, holding and redemption of such Unlisted Class Units and any related matters, as well as any costs or losses that may arise therefrom."
606,"The Manager will however, exercise reasonable care in 31 the selection and appointment of the Authorised Distributor(s), in accordance with the Overarching Principles of the SFC Handbook for Unit Trusts and Mutual Funds, Investment-Linked Assurance Schemes and Unlisted Structured Investment Product."
607,"Investors who apply for subscription, redemption and/or switching of Unlisted Class Units through Authorised Distributor(s) should note that such Authorised Distributor(s) may impose earlier Dealing Deadline for receiving instructions for subscriptions, redemptions or switching."
608,Investors should pay attention to the arrangements of the Authorised Distributor(s) concerned.
609,"For the avoidance of doubt, any fees, costs and expenses payable to the Authorised Distributor(s) arising out of any advertisement or promotional activities in connection with the Trust or the Sub-Fund(s) will not be paid from the assets of the Trust or the Sub-Fund(s)."
610,No money should be paid to any intermediary in Hong Kong who is not licensed or registered to carry on Type 1 regulated activity under Part V of the SFO.
611,Anti-Money Laundering Regulations The Trustee and the Manager have responsibility to prevent money laundering.
612,They may require detailed verification of a prospective investor's identity and the source of the payment of application monies.
613,"Depending on the circumstances of each application, a detailed verification may not be required where: (a) the investor makes payment from an account in the investor's name at a recognised financial institution; (b) the investor is regulated by a recognised regulatory authority; or (c) the application is made through a recognised financial intermediary."
614,"The foregoing will only apply if the financial institution, regulatory authority or intermediary referred to is within a country recognised by Hong Kong as having sufficient anti-money laundering regulations."
615,The Trustee and the Manager reserve the right to request such information as is necessary to verify the identity of an applicant and the source of the payment.
616,"In the event of delay or failure by the applicant to produce any information required for verification purposes, the Trustee and/or the Manager may refuse to accept the application and return the application monies relating to such application."
617,"Neither the Manager, nor the Trustee, nor their delegates shall be liable to the applicant for any loss suffered by the applicant as a result of the rejection or delay of any application."
618,Measures against Market Timing and/or Active Trading The Manager does not knowingly allow investments which are associated with market timing and/or active trading practices as such practices may adversely affect the interests of Unitholders of Sub-Funds in the Trust.
619,"In general, market timing refers to the investment behaviour of an individual, a company or a group of individuals or companies buying, selling or exchanging shares or other securities by taking advantage of time differences and/or imperfections and deficiencies in the methodology adopted for determining the value of such shares or other securities."
