sentence_id,text
876,"49 The Manager intends to manage and operate the Trust and each Sub-Fund in such a manner that the Trust and each Sub-Fund should not be treated as a PRC tax resident enterprise or non-PRC tax resident enterprise with a PE in the Mainland for CIT purposes, although this cannot be guaranteed."
877,"Unless a specific exemption or reduction is available under current PRC tax laws and regulations or relevant tax treaties, non-PRC tax resident enterprises without a PE in the Mainland are subject to CIT on a withholding basis (“WIT”), generally at a rate of 10% (such rate may however be subject to change from time to time), to the extent it directly derives the PRC sourced passive income."
878,"PRC sourced passive income (such as dividend income) may arise from investments in the H-shares, certain red chips shares and/or certain P chips shares."
879,"Accordingly, the Trust or the Sub-Funds may be subject to WIT on any cash dividends it receives from its investment in H-shares, certain red chips shares and/or certain P chips shares."
880,Such WIT will reduce the income from the relevant Sub- Fund and adversely affect the performance of such Sub-Fund.
881,The entity distributing or paying such PRC sourced passive income is required to withhold such tax.
882,The Manager reserves the right to make relevant provision on dividends if the WIT is not withheld at source.
883,There are still uncertainties as to the application of the PRC CIT Law and its implementation rules.
884,It is also uncertain as to whether a Sub-Fund may be subject to other taxes imposed in the Mainland in respect of its investments.
885,"It is possible that the current tax laws, rules, regulations and practice in the Mainland and/or the current interpretation or understanding thereof may change in the future and such change(s) may have retrospective effect."
886,"A Sub-Fund could become subject to additional taxation that is not anticipated as at the date hereof or when the investments are made, valued or disposed of."
887,"Any of those changes may reduce the income from, and/or the value of, that Sub-Fund’s investments."
888,Any increased tax liabilities on that Sub-Fund may adversely affect that Sub-Fund’s value.
889,"Where no provision is made by the Manager in relation to all or part of the actual tax levied by the relevant PRC tax authorities in future, investors should note that the Net Asset Value of a Sub-Fund may be lowered, as the Sub- Fund will ultimately have to bear the full amount of tax liabilities."
890,"In this case, such amount of tax liabilities will only impact Units in issue at the relevant time, and the then existing Unitholders and subsequent Unitholders will be disadvantaged."
891,The Manager reserves the right to provide for WIT and to deduct or to withhold the tax for the account of the relevant Sub-Fund so warranted.
892,Value-Added Tax With the Circular Caishui [2016] No.
893,"36 (“Circular 36”) promulgated by the Ministry of Finance and the State Administration of Taxation of the PRC on 23 March 2016 regarding the final stage of PRC Value-Added Tax (“VAT”) reform which came into effect on 1 May 2016, gains derived from the trading of PRC securities will be subject to VAT instead of PRC Business Tax starting from 1 May 2016."
894,"If VAT is applicable, there may also be other surtaxes."
895,There are still uncertainties as to the application of the rules and regulations on the VAT and its surtaxes (e.g.
896,"it is not clear as to whether gains realised on the disposals of a Sub-Fund’s investments in H-shares, certain red chips shares and certain P chips shares would be subject to VAT and its surtaxes)."
897,"Where no provision is made by the Manager in relation to all or part of the actual taxes levied by the relevant PRC tax authorities in future, investors should note that the Net Asset Value of a Sub-Fund may be lowered, as the Sub-Fund will ultimately have to bear the full amount of tax liabilities."
898,"In this case, such amount of tax liabilities will only impact Units in issue at the relevant time, and the then existing Unitholders and subsequent Unitholders will be disadvantaged."
899,The Manager reserves the right to provide for VAT and its surtaxes and to deduct or to withhold the taxes for the account of a Sub-Fund if so warranted.
900,Please refer to the risk factor “PRC tax risk” under “WHAT ARE THE RISKS OF INVESTING IN A SUB-FUND?” for further information in this regard.
901,"Taxes and Duties Payable by Investors You should consult your professional advisers on the consequences to you of acquiring, holding, redeeming, transferring or selling Units under the relevant laws of the jurisdictions to which you are subject, including the tax consequences and any exchange control requirements."
902,"The consequences, including the availability of, and the value of, tax relief will vary with the law and practice of your country of citizenship, residence, domicile or incorporation and your personal circumstances."
903,50 The information below regarding taxation and duties is based on the law and practice in force in Hong Kong at the date of this offering document.
904,You should be aware that levels and bases of taxation are subject to change and that the value of any relief from taxation depends upon your personal circumstances.
905,The following statements are intended as a general guide only and do not necessarily describe the tax consequences for all types of investors in the Sub-Funds.
906,"Hong Kong Profits Tax Hong Kong profits tax is not payable by the investors in respect of profits from the purchase and sale of Units effected outside Hong Kong, profits in the nature of capital gains rather than trading profits and income or profits otherwise exempt under the Inland Revenue Ordinance (Chapter 112 of the Laws of Hong Kong)."
907,"There is generally no capital gains tax payable on the sale of the Units, save and except that where a person is or is deemed as carrying on a trade, profession or business in Hong Kong, gains or profits on the sale of the Units may be treated as normal trading receipts from that trade, profession or business and thus attract Hong Kong profits tax."
908,Distributions to the Unitholders are not subject to withholding taxes in Hong Kong.
909,"Stamp Duty in respect of Listed Class Units Pursuant to section 19(1DA) and Part 2 of Schedule 10 of the SDO and according to the Stamping Circular No.02/2019, each Sub-Fund is an “authorized open-ended collective investment scheme” as defined under the SDO, and, provided that the value of the Hong Kong stock is proportionate to the value of the Listed Class Unit, any Hong Kong stamp duty (i.e."
910,fixed and ad valorem) on the delivery of Hong Kong stocks as consideration for the allotment of Listed Class Units will be exempted.
911,"Similarly, provided that the value of the Hong Kong stock is proportionate to the value of the Listed Class Unit, Hong Kong stamp duty on the delivery of Hong Kong stocks as consideration for redemption of Listed Class Units will also be exempted."
912,The allotment or redemption is considered to be proportionate if the value of the Hong Kong stock sold or purchased is equivalent to the asset value of the Sub-Fund which the allotted or redeemed Listed Class Unit represents as at the date of allotment or redemption (as the case may be).
913,No Hong Kong stamp duty is payable by an investor in relation to an issue of Listed Class Units to him or her or the redemption of Listed Class Units by him or her or on the sale and purchase of Listed Class Units by him or her in the secondary market.
914,"Stamp Duty in respect of Unlisted Class Units No Hong Kong stamp duty should be payable where the sale or transfer of the Unlisted Class Units is effected by selling the relevant Units back to the Manager, who then either extinguish the Unlisted Class Units or re-sells the Unlisted Class Units to another person within two months thereof."
915,Other types of sales or purchases or transfers of Unlisted Class Units by the Unitholders in a Sub-Fund should normally be liable to Hong Kong stamp duty under the SDO.
916,Subscription of Unlisted Class Units/switching into Unlisted Class Units effected through allotment of new Unlisted Class Units and redemption/switching out effected through cancellation of Unlisted Class Units respectively will normally not be subject to Hong Kong stamp duty.
917,"Automatic Exchange of Financial Account Information The Inland Revenue (Amendment) (No.3) Ordinance 2016 (the “Amendment Ordinance”), which is the legislative framework for the implementation of Automatic Exchange of Financial Account Information (the “AEOI”) in Hong Kong, came into force on 30 June 2016."
918,The AEOI is a system that involves the transmission of financial account information from Hong Kong to a tax 51 jurisdiction with which Hong Kong has entered into an AEOI agreement1.
919,"Under the Amendment Ordinance, reporting financial institutions in Hong Kong are required to apply due diligence procedures to identify the tax residency of the account holders and controlling persons for the purpose of AEOI2 and collect the specified information."
920,The financial institution is required to report to the Inland Revenue Department (the “IRD”) the required information collected in respect of the reportable accounts on an annual basis.
921,IRD will then transmit the information to the tax administration of the relevant jurisdiction of which the account holder is tax resident3.
922,"Under the Amendment Ordinance, information that may be reported to the IRD includes details of account holders, including but not limited to their name, date of birth, place of birth (if any), address, jurisdiction of tax residence, tax identification number (if any), account number, account balance/value, distribution income and sales/redemption proceeds."
923,"Each Sub-Fund, as a reporting financial institution, is required to, amongst other things: (i) conduct due diligence on its financial accounts to identify whether any such accounts are considered as “Reportable Accounts” for AEOI purpose; and (ii) report to the IRD the required information on such Reportable Accounts."
924,"By investing and/or continuing to invest in the Sub-Funds, Unitholders acknowledge that: (i) the IRD may automatically exchange information of the Unitholders (and information on controlling persons including beneficial owners, beneficiaries, direct or indirect shareholders or other persons associated with such Unitholders that are passive non-financial entities) as outlined above with relevant tax authorities in other jurisdictions; (ii) Unitholders may be required to provide additional information and/or documentation for AEOI purpose; and (iii) in the event that an Unitholder fails to provide the requested information and/or documentation, irrespective of whether or not that actually leads to non-compliance on the part of the Sub-Fund(s) and/or the Manager, the Manager reserves the right to take remedial actions including, without limitation, to require the Unitholder to transfer the Unitholder’s Units or, failing such transfer, redeem such Units in accordance with the Trust Deed, and to the extent permitted by applicable laws and regulations."
925,Unitholders and prospective investors should consult their professional advisers and obtain independent professional advice on the implications of AEOI on their current and/or proposed investment in a Sub-Fund.
926,The United States of America – Foreign Account Tax Compliance Act (FATCA) Sections 1471 through 1474 of the U.S.
927,Internal Revenue Code (“FATCA”) impose a 30% withholding tax on certain payments to a foreign financial institution (“FFI”) if that FFI is not compliant with FATCA.
928,"Each of the Sub-Funds is a FFI and thus, subject to FATCA."
929,Each Sub-Fund in the Trust intends to comply with FATCA by qualifying as a Deemed-Compliant FFI.
930,"This withholding tax applies to payments to each Sub-Fund that constitute interest, dividends and other types of income from U.S."
931,sources (such as dividends paid by a U.S.
932,corporation).
933,"These FATCA withholding taxes may be imposed on payments to a Sub-Fund unless (i) the relevant Sub-Fund becomes FATCA compliant pursuant to the provisions of FATCA and the relevant regulations, notices and announcements issued thereunder, or (ii) the relevant Sub-Fund is subject to an appropriate Intergovernmental Agreement to improve international tax compliance and to implement FATCA (“IGA”)."
934,The Sub-Funds intend to comply with FATCA so that no FATCA withholding is imposed on any payments to the Sub-Funds.
935,Hong Kong and the U.S.
936,"have entered into an IGA for the implementation of FATCA, adopting “Model 2” IGA 1 FAQ1 of the Frequently Asked Questions regarding the Automatic Exchange of Financial Account Information available at the website of the Inland Revenue Department http://www.ird.gov.hk/eng/faq/dta_aeoi.htm 2 FAQ6 of the Frequently Asked Questions regarding the Automatic Exchange of Financial Account Information available at the website of the Inland Revenue Department http://www.ird.gov.hk/eng/faq/dta_aeoi.htm 3 FAQ3 of the Frequently Asked Questions regarding the Automatic Exchange of Financial Account Information available at the website of the Inland Revenue Department http://www.ird.gov.hk/eng/faq/dta_aeoi.htm 52 arrangements."
937,"Under these “Model 2” IGA arrangements, FFIs in Hong Kong (such as the Sub-Funds) will be required to register with the U.S."
938,Internal Revenue Service (“IRS”) and comply with the terms of the FFI Agreement.
939,"Otherwise, they will be subject to a 30% withholding tax on relevant US-sourced payments to them."
940,"As a sponsoring entity, the Manager has registered with the U.S."
941,IRS on behalf of each Sub-Fund.
942,Each Sub-Fund intends to take any other measures that may be required to ensure compliance under the terms of the IGA and local implementing regulations.
943,"In order to comply with its FATCA obligations, each Sub-Fund is required to obtain certain information from its Unitholders so as to ascertain their U.S."
944,"tax status, including the appropriate IRS withholding statement on Form W-8 or W-9."
945,If the Unitholder is a specified U.S.
946,"person, U.S."
947,owned non-U.S.
948,"entity, non-participating FFI (“NPFFI”) or does not provide the requisite documentation, each Sub-Fund may need to report information on these Unitholders to the appropriate tax authority, as far as legally permitted."
949,"If a Unitholder either fails to provide the relevant Sub-Fund, its agents or authorised representatives with any correct, complete and accurate information that may be required for the Sub-Fund to comply with FATCA or is a NPFFI, to the extent that it is required to comply with the terms of the IGA, the Unitholder may be subject to withholding on amounts otherwise distributable to the Unitholder (provided that the Manager or the Trustee shall observe relevant legal requirements and shall act in good faith and on reasonable grounds)."
950,The Sub-Fund may at its discretion enter into any supplemental agreement without the consent of Unitholders to provide for any measures that the Sub-Fund deem appropriate or necessary to comply with FATCA.
951,"Other countries have adopted or are in the process of adopting tax legislation concerning the reporting of information, including AEOI as described above."
952,"Each of the Sub-Funds also intends to comply with such other similar tax legislation that may apply to each Sub-Fund, although the exact parameters of such requirements are not yet fully known."
953,"As a result, each Sub-Fund may need to seek information about the tax status of Unitholders under such other country’s laws and each Unitholder for disclosure to the relevant governmental authority."
954,The disclosure in this section is based on advice received by the Trust regarding the law and practice in force in the U.S Unitholders/Investors should consult their own tax advisors regarding the FATCA requirements with respect to their own situation.
955,"In particular, investors who invest in a Sub-Fund through intermediaries should confirm the FATCA compliance status of those intermediaries to ensure that they do not suffer FATCA withholding tax on their investment returns."
956,"Although each Sub-Fund will attempt to satisfy any obligations imposed on it to avoid the imposition of the FATCA withholding tax, no assurance can be given that the Sub-Fund will be able to satisfy these obligations."
957,"If the Sub-Fund becomes subject to a withholding tax as a result of the FATCA regime, the value of the Units held by Unitholders may suffer material losses."
958,"53 STATUTORY AND GENERAL INFORMATION Trust Deed and Participation Agreements The Trust and each Sub-Fund were established under Hong Kong law by the Trust Deed made between the Manager, the Trustee and the Index Proprietor."
959,There are a number of Participating Dealers for each Sub-Fund and each has entered into a Participation Agreement.
960,"All investors are entitled to the benefit of, are bound by and are deemed to have notice of, the provisions of the Trust Deed and those in the form of the Participation Agreement."
961,"In the event of any inconsistency between any of the provisions of this offering document (including the Product Key Facts Statement for each Sub-Fund) and those of the Trust Deed or of the form of Participation Agreement, the provisions of the Trust Deed or of the form of Participation Agreement shall prevail."
962,The Trust Deed contains provisions for the indemnification of the Trustee and the Manager and their relief from liability in certain circumstances.
963,You should refer to the relevant terms of the Trust Deed for further details.
964,"Supply and Inspection of Documents Copies of the constitutive documents in respect of the Trust and each Sub-Fund are available for inspection free of charge during normal business hours on each Business Day at the office of the Manager (83 Des Voeux Road Central, Hong Kong)."
965,Material Changes to an Index The SFC should be consulted on any events that may affect the acceptability of an Index.
966,Significant events relating to an Index will be notified to the Unitholders as soon as practicable.
967,"These may include a change in the methodology or rules for compiling or calculating the Index, or a change in the objective or characteristics of the relevant Index."
968,"Replacement of an Index The Manager reserves the right, with the prior consent of the Trustee and the prior approval of the SFC and any other relevant regulator(s) and provided that in its opinion the interests of the Unitholders would not be adversely affected, to replace an Index with another index that is tradable and has similar objectives to the relevant Index, in accordance with the provisions of the Code and the Trust Deed."
969,The circumstances under which any such replacement might occur include but are not limited to the following events: (a) the relevant Index is discontinued; or (b) the Manager’s license from the Index Proprietor and Index Provider to use the relevant Index is terminated.
970,The Manager may change the name of a Sub-Fund if the relevant Index changes or for any other reasons including if license to use the relevant Index is terminated.
971,Any change to (i) the use by a Sub-Fund of the Index and/or (ii) the name of a Sub-Fund will be notified to Unitholders.
972,Transfer of Listed Class Units The Trust Deed provides that a Unitholder may transfer Listed Class Units subject to the provisions of the Trust Deed.
973,"As all Listed Class Units will be held in the CCASS, a Unitholder is entitled to transfer Listed Class Units registered in his name by using the standard transfer form issued by SEHK or in such other form as the Trustee may from time to time approve (and if the transferor or the transferee is a clearing house or its nominee(s), by hand or by machine imprinted signature or by such other manner of execution)."
974,A transferor will be deemed to remain the Unitholder of the Listed Class Units transferred until the name of the transferee is entered in the register of Unitholders in respect of the Listed Class Units being transferred.
975,Each instrument of transfer must relate to a single Sub-Fund only.
976,"General Information Anti-Money Laundering Regulations 54 As part of the Trustee’s and the Manager’s responsibility to prevent money laundering, they may require detailed verification of your identity and the source of your payment for any investment in Units."
977,The Codes on Takeovers and Mergers and Share Repurchases You should be aware that any shareholding of Index Constituent Stocks resulting from an “in-kind” redemption of Units may be subject to the application of the Hong Kong Takeovers Code.
978,"In circumstances where you hold a significant amount of Index Constituent Stocks, you should consult a solicitor or financial adviser so as to ensure full compliance with the Hong Kong Takeovers Code."
979,"Notices to Investors With the prior consent of the SFC and the SEHK (as the case may be), notice of general matters may be given to investors in the Units by publication on www.hangsenginvestment.com (this website has not been reviewed by the SFC) and via the SEHK’s website www.hkex.com.hk (this website has not been reviewed by the SFC)."
980,"In all other cases, as required by the SFC, notices will be sent to investors by post to their mailing address or, if approved by the SFC and agreed with the relevant investors, by electronic mail, electronic publication or other electronic means."
981,Meetings of Investors The Trust Deed provides for meetings of investors to be convened by the Trustee or the Manager upon at least 21 days’ notice.
982,Proxies may be appointed.
983,"The quorum at any meetings is investors present in person or by proxy holding not less than 10% (or, in relation to a resolution proposed as an extraordinary resolution, 25%) of the Units in the relevant Class or the relevant Sub-Fund then in issue."
984,"If a quorum is not present, the meeting will be adjourned for not less than 15 days."
985,"At an adjourned meeting investors in the Units who are present at the adjourned meeting, whatever their number or the number of Units held by them, will form a quorum."
986,An extraordinary resolution is required under the Trust Deed for certain purposes and is a resolution proposed as such and passed by 75% or more of the total number of votes cast.
987,"The Trust Deed provides that at any meeting of investors in the Units, on a poll, every investor who (being an individual) is present in person or (being a partnership or corporation) is present by an authorised representative shall have one vote for every Unit of which he is the holder."
988,"Responsibility Statement The Manager accepts full responsibility for the accuracy of the information contained in this offering document (including the Product Key Facts Statement for each Sub-Fund) as at the date of publication and confirms, having made all reasonable enquiries, that to the best of its knowledge and belief there are no other facts the omission of which would make any statement misleading."
989,"Termination The Trust may be terminated by the Trustee in the following circumstances: (a) if the Manager shall go into liquidation (except a voluntary liquidation for the purpose of reconstruction or amalgamation upon terms previously approved in writing by the Trustee) or if a receiver is appointed over any of its assets and is not discharged within 60 days; (b) if in the opinion of the Trustee the Manager shall be incapable of performing or shall in fact fail to perform its duties satisfactorily or shall do any other thing which in the opinion of the Trustee is calculated to bring the Trust into disrepute or to be harmful to the interests of investors; (c) if any law shall be passed which renders it illegal or in the opinion of the Trustee impracticable or inadvisable to continue the Trust; 55 (d) if the Manager shall have ceased to be the Manager and, within a period of 30 days thereafter, no other person acceptable to the SFC shall have been appointed by the Trustee as successor Manager; or (e) if the relevant Index of the Sub-Funds is discontinued or the Manager’s license with the Index Provider and Index Proprietor is terminated or if the Listed Class Units cease to be listed on the SEHK."
990,"The Trust and/or a Sub-Fund may be terminated by the Manager in the following circumstances: (a) the aggregate Net Asset Value of all Units outstanding of the Trust is less than HK$10,000,000 or the Units outstanding of the relevant Sub-Fund is less than HK$4,000,000; (b) if the Trust and/or the relevant Sub-Fund (as the case may be) shall not be or ceases to be authorised or otherwise officially approved pursuant to the SFO; or (c) if any law shall be passed which renders it illegal or in the opinion of the Manager impracticable or inadvisable to continue the Trust and/or any Sub-Fund."
991,Any unclaimed proceeds or other cash held by the Trustee under the provisions in the event of termination may at the expiration of twelve months from the date upon which the same became payable be paid into court subject to the right of the Trustee to deduct therefrom any expenses it may incur in making such payment.
992,"Investors should note that, due to the nature of the listing of the Listed Class Units on the SEHK, the termination procedures applicable to Listed Class Units and Unlisted Class Units of the same Sub-Fund may differ."
