sentence_id,text
156,Such fees and expenses are subject to change from time to time.
157,"Charges incurred when trading the Sub-Fund on SEHK Fee What you pay Brokerage fee At each broker’s discretion SFC Transaction levy 0.0027%1 Accounting and Financial Reporting Council (“AFRC”) Transaction levy 0.00015%2 SEHK Trading fee 0.00565%3 Stamp duty Waived 1 SFC Transaction levy of 0.0027% of the price of the Units, payable by the buyer and the seller."
158,"2 AFRC Transaction levy of 0.00015% of the price of the Units, payable by the buyer and the seller."
159,"3 SEHK Trading fee of 0.00565% of the price of the Units, payable by the buyer and the seller."
160,Ongoing fees payable by the Sub-Fund The following expenses will be paid out of the Sub-Fund.
161,They affect you because they reduce the NAV of the Sub-Fund which may affect the trading price.
162,"Annual rate (as a % of the Sub-Fund’s NAV) Management fee* 0.5% per annum, up to a maximum of 2% per annum Trustee fee* 0.06% per annum , up to a maximum of 0.5% per annum4 Performance fee N/A Servicing fee Currently waived Other Ongoing Costs Please refer to Appendix III to the Prospectus for details of ongoing costs payable by the Sub-Fund 4 The Trustee fee includes fund administration fee and global custody fee."
163,"* Please note that some fees may be increased, up to a permitted maximum amount, by giving Unitholders at least three (3) months’ prior notice (or such shorter period as the SFC may approve/ allow)."
164,Please refer to the section of “Fees And Charges Applicable to the Sub-Fund” in Appendix III to the Prospectus.
165,"Additional Information You can find the following information of the Sub -Fund at the Manager’s website ^ (www.boci- pru.com.hk/english/etf/intro.aspx ( for English ), www.boci -pru.com.hk/chinese/etf/intro.aspx ( for Chinese)): • The latest Prospectus and this Product Key Facts Statement (as revised from time to time); • The latest audited annual report and unaudited interim report of the Sub-Fund; • Any announcements/information in respect of the Sub-Fund, including information in relation to the Sub-Fund (including additional information about the Sub -Fund as an ESG fund) and the W.I.S.E."
166,- Nasdaq China New Economy Companies ESG Index Tracker (formerly known as “W.I.S.E.
167,"– Nasdaq Overseas China New Economy Companies Top 50 Index Tracker”) 9 Underlying Index, notices of material alterations or additions to the offering documents or the constitutive documents of the Sub -Fund, notices of suspension of the calculation of NAV, changes in fees and charges, the suspension and resumption of trading of Units; • The last NAV per Unit and NAV of the Sub-Fund (updated on each Dealing Day); • The real-time or near real-time indicative NAV per Unit throughout each Dealing Day*; • Latest list of Participating Dealer(s) and link to latest list of market makers; • Full holdings of the Sub-Fund (updated on each Dealing Day); • The tracking difference and tracking error information of the Sub-Fund; and • The compositions of distributions (i.e."
168,the relative amounts paid out of (i) net distributable income and (ii) capital) for the last 12 months.
169,* It will be updated every 15 seconds during SEHK trading hours on each Dealing Day.
170,"Important If you are in doubt, you should seek professional advice."
171,The SFC takes no responsibility for the contents of this statement and makes no representation as to its accuracy or completeness.
172,^ This website has not been reviewed by the SFC.
