sentence_id,text
140,"Reliance on market maker risks • Although the Manager will use its best endeavours to put in place arrangements so that at least one market maker will maintain a market for the Listed Class of Units and that at least one market maker gives not less than three months’ notice prior to terminating market making arrangement under the relevant market maker agreement, liquidity in the market for the Listed Class of Units may be adversely affected if there is no or only one market maker for the Listed Class of Units."
141,There is also no guarantee th at any market making activity will be effective.
142,Distributions out of or effectively out of capital risk • Payments of distributions out of capital and/or effectively out of capital amounts to a return or withdrawal of part of an investor’s original investment or from any capital gains attributable to that original investment.
143,Any such distributions involving payment of dividends out of capital or effectively out of capital of the Sub-Fund may result in an immediate reduction in the Net Asset Value per Unit of the Sub-Fund and will reduce the capital available for future investment.
144,How has the Sub-Fund performed?
145,• Past performance information is not indicative of future performance.
146,Investors may not get back the full amount invested.
147,"• The computation basis of the performance is based on the calendar year end, Net Asset Value to Net Asset Value."
148,• These figures show by how much the Sub- Fund increased or decreased in value during the calendar year shown.
149,Performance data has been calculated in HKD including ongoing charges and excluding trading costs on SEHK you might have to pay.
150,"• Where no past performance is shown, there was insufficient data available in that year to provide performance."
151,-17.7% 11.3% -17.5% 11.6% -20.0% -15.0% -10.0% -5.0% 0.0% 5.0% 10.0% 15.0% 2020 2021 2022 2023 2024 Sub Fund Underlying Index 8 • Sub-Fund launch date: 21 March 2022 Is there any guarantee?
152,The Sub-Fund does not have any guarantees.
153,You may not get back the amount of money you invest.
154,What are the fees and charges?
155,"Charges incurred when trading the Sub-Fund on SEHK Fee What you pay Brokerage fee Market rates Transaction levy 0.0027%1 of the trading price Accounting and Financial Reporting Council (“AFRC”) transaction levy 0.00015%2 of the trading price Trading fee 0.00565%3 of the trading price Stamp duty Nil 1 Transaction levy of 0.0027% of the trading price of the Units, payable by each of the buyer and the seller."
156,"2 AFRC transaction levy of 0.00015% of the trading price of the Units, payable by each of the buyer and the seller."
157,"3 Trading fee of 0.00565% of the trading price of the Units, payable by each of the buyer and the seller."
158,Ongoing fees payable by the Sub-Fund The following expenses will be paid out of the Sub- Fund.
159,They affect you because they reduce the Net Asset Value of the Sub-Fund which may affect the trading price.
160,"Annual rate (as a % of the Sub-Fund’s Net Asset Value) Management fee* Currently 0.29% per annum Trustee fee Included in the Single Management Fee (as defined below) Registrar fee Included in the Single Management Fee Performance fee Not applicable Administration fee Not applicable * The management fee is a single flat fee, payable out of the assets of the Sub-Fund, to cover all of the costs, fees and expenses associated with the Sub-Fund, including the fees payable to the Manager for portfolio management services, Manager’s servicing fee (if any), Trustee’s fee, Registrar’s fee, Service Agent’s fees and operational fees of the Sub-Fund (the “Single Management Fee”)."
161,"Any costs, fees and expenses associated with the Sub-Fund exceeding the Single Management Fee shall be borne by the Manager and shall not be charged to the Sub-Fund."
162,"For the avoidance of doubt, the Single Management Fee does not include (to the extent not included in the operational fees as set out in the Prospectus) any costs, fees and expenses payable by investors on the creation and realisation of units, such as the fees to participating dealers, brokerage fees, transaction levy, trading fee and stamp duty, or any extraordinary or exceptional costs and expenses (such as litigation expenses) as may arise from time to time and any tax liabilities in respect of the Sub-Fund which will be paid separately out of the assets of the Sub-Fund."
163,"In addition, the Single Management Fee does not represent the estimated tracking error of the Sub-Fund."
164,Please note that the Single Management Fee may be increased up to a permitted maximum amount by providing one month’s prior notice to Unitholders.
165,Please refer to the section headed “Fees and Charges” of the Prospectus for details.
166,Other fees You may have to pay other fees when dealing in the Units of the Sub-Fund.
167,Please refer to the Prospectus for details.
168,"9 Additional information You can find the following information of the Sub- Fund in English and Chinese (unless otherwise specified) on the following website https://www.globalxetfs.com.hk/ (which has not been reviewed or approved by the SFC):  the Prospectus and this Product Key Facts Statement (as revised from time to time);  the latest annual audited financial reports and interim unaudited financial reports (in English only);  any public announcements made by the Manager in respect of the Sub- Fund, including information with regard to the Sub-Fund and the Underlying Index, notices of suspension of creation and redemption of Units, suspension of calculation of the Net Asset Value, changes in fees and charges and suspension and resumption of trading;  any notices relating to material changes to the Sub- Fund which may have impact on its investors such as material alterations or additions to the Prospectus (including this Product Key Facts Statement) or the constitutive documents of the Trust and/or the Sub-Fund;  the full portfolio information of the Sub-Fund (updated on a daily basis);  the near real time indicative Net Asset Value per Unit of the Sub-Fund throughout each dealing day (updated ev ery 15 seconds throughout the SEHK trading hours) in HKD;  the last Net Asset Value of the Sub- Fund in HKD and the last Net Asset Value per Unit of the Sub- Fund in HKD;  the past performance information of both the Listed Class of Units and Unlisted Classes of Units of the Sub- Fund;  the ongoing charges of both the Listed Class of Units and Unlisted Classes of Units of the Sub-Fund;  the annual tracking difference and tracking error of the Sub-Fund;  the composition of distributions (i.e."
169,"the relative amounts paid out of net distributable income and capital), if any, for a 12-month rolling period;  the latest list of participating dealers and market makers for the Sub-Fund; and  the proxy voting policy of the Manager."
170,"I mportant If you are in doubt, you should seek professional advice."
171,The SFC takes no responsibility for the contents of this statement and makes no representation as to its accuracy or completeness.
