sentence_id,text
996,Automatic Exchange of Financial Account Information The Inland Revenue (Amendment) (No.3) Ordinance (the “Ordinance”) came into force on 30 June 2016.
997,This is the legislative framework for the implementation in Hong Kong of the Standard for Automatic Exchange of Financial Account Information ( “AEOI”).
998,"The AEOI requires financial institutions (“ FIs”) in Hong Kong to collect certain required information relating to non -Hong Kong tax residents holding financial accounts with the FIs, and report such information to the Hong Kong Inland Revenue Depa rtment (“IRD”) for the purpose of AEOI exchange."
999,"Generally, the information will be reported and automatically exchanged in respect of account holders that are tax residents in an AEOI partner jurisdiction(s) with which Hong Kong has a Competent Authority Agreement (“CAA”) in force; however, the MSCI China ETF and/or its agents may further collect information relating to residents of other jurisdictions."
1000,"The MSCI China ETF is required to comply with the requirements of the Ordinance, which means that the MS CI China ETF and/or its agents shall collect and provide to the IRD the required information relating to Unitholders and prospective investors."
1001,"The Ordinance as implemented by Hong Kong requires the MSCI China ETF to, amongst other things: (i) register the MSCI China ETF as a “Reporting Financial Institution” with the IRD (when there are reportable accounts); (ii) conduct due diligence on its accounts (i.e."
1002,Unitholders) to identify whether any such accounts are considered “Reportable Accounts” under the Ordinance; and (iii) report to the IRD the required information on such Reportable Accounts.
1003,The IRD is expected on an annual basis to transmit the required information reported to it to the government authorities of the jurisdictions with which Hong Kong has a CAA in force.
1004,"Broadly, AEOI contemplates that Hong Kong FIs should report on: (i) individuals or entities that are tax residents in a jurisdiction with which Hong Kong has a CAA in force; and (ii) certain entities controlled by individuals who are tax r esidents in such jurisdictions."
1005,"Under the Ordinance, details of Unitholders, including but not limited to their name, place of birth, address, tax residence, tax identification number (if any), account number, account balance/value, and income or sale or r edemption proceeds, may be reported to the IRD and subsequently exchanged with government authorities in the relevant jurisdictions."
1006,"By investing in the MSCI China ETF and/or continuing to invest in the MSCI China ETF, Unitholders acknowledge that they may be required to provide additional information to the MSCI China ETF, the Manager and/or the MSCI China ETF’s agents in order for the MSCI China ETF to comply with the Ordinance."
1007,"The Unitholder’s information (and information on controlling persons including beneficial owners, beneficiaries, direct or indirect shareholders or other persons associated with such Unitholders that are passive non-financial entities), may be transmitted by the IRD to authorities in other jurisdictions."
1008,Each Unitholder and prospec tive investor should consult its own professional advisor(s) on the administrative and substantive implications of AEOI on its current or proposed investment in the MSCI China ETF.
1009,60 FATCA General Information The Foreign Account Tax Compliance Act (“FATCA”) is a US tax law enacted in March 2010 with the withholding requirements for new accounts which became effective on 1 July 2014.
1010,FATCA attempts to minimise tax avoidance by US persons investing in foreign assets both through their own accounts and through t heir investments in foreign entities.
1011,"Unless an intergovernmental agreement (an “IGA”) is in place, FATCA requires foreign financial institutions (“FFIs”) to provide information to the US tax authority, the Internal Revenue Service (the “IRS”), regarding t heir US account holders including substantial US owners of certain non-financial foreign entities (“NFFEs”)."
1012,"FFIs who fail to commit to meeting certain due diligence, withholding and reporting requirements and certain NFFEs who fail to provide required information on their substantial US owners will be subject to 30% FATCA withholding on most types of income from US investments (as further described below)."
1013,Payments of U.S.
1014,"source fixed, determinable, annual, or periodic income (“FDAP”), such as dividends a nd interest, are subject to withholding beginning on 1 July 2014 when paid to non -participating FFIs (“NPFFIs”), non-compliant NFFEs, recalcitrant account holders at participating FFIs (“PFFIs”), and electing PFFIs."
1015,Payments made in the ordinary course of business for non -financial services are excluded from withholding.
1016,tax law has detailed rules for determining the source of income.
1017,Different rules apply for each type of income.
1018,"Interest and dividends, two of the most important types of income for in vestors, are generally sourced by reference to the residence of the obligor."
1019,"Specifically, dividends are generally treated as U.S."
1020,source income when paid by a U.S.
1021,"corporation with respect to its stock, and interest is generally treated as U.S."
1022,source income when paid by a U.S.
1023,borrower of money.
1024,"If an IGA is in place between the US and the country where the FFI is domiciled, then the terms of the IGA replace FATCA, meaning that all FFIs in the IGA country will generally be able to apply simpler, less burdensome due diligence and tax information sharing requirements, with generally no FATCA tax withholding."
1025,The United States Department of Treasury and Hong Kong has on 13 November 2014 entered into an intergovernmental agreement based on the Model 2 format ( “Model 2 IGA”).
1026,The Model 2 IGA modifies the foregoing requirements but generally requires similar information to be disclosed to the IRS.
1027,FATCA Registration Status The Trust and/or the MSCI China ETF are classified as “Qualifying Institutions” under the Model 2 IGA.
1028,As such they are a non -reporting Hong Kong Financial Institutions and are certified deemed compliant.
1029,No registration is required with the IRS.
1030,"Impact to the MSCI China ETF and Unitholders In the event that the MSCI Ch ina ETF holds US securities and is not FATCA compliant, the MSCI China ETF may become subject to a 30% FATCA withholding as a result of the FATCA regime, and the value of the Units held by Unitholders may suffer material losses."
1031,The Manager does not supp ort US tax evasion or any request to help investors avoid detection under FATCA.
1032,The Manager is not able to provide tax advice and cannot determine the impact or compliance obligations of FATCA or an applicable IGA for investors’ business 61 activities.
1033,The M anager strongly encourages Unitholders to seek the advice of an experienced tax adviser to determine what actions Unitholders may need to take.
1034,"Certification for Compliance with FATCA or Other Applicable Laws Each investor (i) shall be required to, upon d emand by the Trustee or the Manager, provide any form, certification or other information reasonably requested by and acceptable to the Trustee or the Manager that is necessary for the MSCI China ETF (a) to prevent withholding (including, without limitatio n, any withholding taxes required under FATCA) or qualify for a reduced rate of withholding or backup withholding in any jurisdiction from or through which the MSCI China ETF receives payments and/or (b) to satisfy reporting or other obligations under the IRS Code and the United States Treasury Regulations promulgated under the IRS Code, or to satisfy any obligations relating to any applicable law, regulation or any agreement with any tax or fiscal authority in any jurisdiction, (ii) will update or replace such form, certification or other information in accordance with its terms or subsequent amendments or when such form, certificate or other information is no longer accurate, and (iii) will otherwise comply with any reporting obligations imposed by the Uni ted States, Hong Kong or any other jurisdiction (including any law, rule and requirement relating to AEOI) and reporting obligations that may be imposed by future legislation."
1035,"Power to Disclose Information to Authorities Subject to applicable laws and regulations in Hong Kong, the Manager, the Trustee or any of their authorised person (as permissible under applicable law or regulation) may be required to report or disclose to any government agency, regulatory authority or tax or fiscal authority in any jur isdictions (including but not limited to the IRS and the IRD), certain information in relation to a Unitholder, including but not limited to the Unitholder’s name, address, jurisdiction of birth, tax residence, tax identification number (if any), social se curity number (if any) and certain information relating to the Unitholder’s holdings, account balance/value, and income or sale or redemption proceeds, to enable the MSCI China ETF to comply with any applicable law or regulation or any agreement with a tax authority (including, but not limited to, any law, rule, requirement, regulation or agreement relating to AEOI and FATCA)."
1036,"62 DEFINITIONS In this Prospectus, unless the context requires otherwise, the following expressions have the meanings set out below."
1037,“AFRC” means the Accounting and Financial Reporting Council or its successors.
1038,"“Application” means, in respect of the MSCI China ETF, an application by a Participating Dealer for the creation or redemption of Units through CCASS, in accordance with the procedures for creation and redemption of Units set out in the Operating Guidelines and the terms of the Trust Deed."
1039,"“Application Basket” means, in respect of the MSCI China ETF, a portfolio of Index Shares which constitute the Index Basket fixed by th e Manager for the MSCI China ETF at the start of business on the relevant Dealing Day for the purpose of the creation and redemption of Units in an Application Unit size, notified on the relevant date by the Manager in accordance with the Operating Guidelines for Applications."
1040,"“Application Basket Value” means, in respect of the MSCI China ETF, the aggregate value of the Index Shares constituting the Application Basket at the Valuation Point on the relevant Dealing Day."
1041,"“Application Cancellation Fee” means the fee payable by a Participating Dealer in respect of a default, as set out in the Operating Guidelines applicable at the time the relevant Creation Application or Redemption Application is made."
1042,"“Application Unit” means, in relation to the MSCI China ETF, such number of Units of a class or whole multiples thereof as specified in this Prospectus or such other multiple of Units of a class from time to time determined by the Manager, approved by the Trustee and notified to Participating Dealers, either generally or for a particular class or classes of Units."
1043,"“BlackRock Group” means the BlackRock group of companies, the ultimate holding company of which is BlackRock, Inc."
1044,"“BTC” means BlackRock Institutional Trust Company, N.A., which is the securities lending agent to the MSCI China ETF."
1045,"“Business Day” means a day (other than a Saturday and Sunday) on which the SEHK is open for normal trading, and on which banks in Hong Kong are open for, or available to provide, banking services (including on days where such s ervices can be supported via electronic channels only), or such other day or days as the Manager and the Trustee may determine from time to time."
1046,"“Cancellation Compensation” means an amount payable by a Participating Dealer in respect of a default, as set out in the Trust Deed and in the Operating Guidelines applicable at the time the relevant Creation Application or Redemption Application is made."
1047,“Cash Component” means the difference between the aggregate Net Asset Value of the Units comprising an Application Unit and the Application Basket Value.
1048,“CCASS” means the Central Clearing and Settlement System established and operated by HKSCC or any successor system operated by HKSCC or its successors.
1049,63 “CCASS Operational Procedures” means the CCA SS Operational Procedures as amended from time to time.
1050,"“China” or “PRC” means the People’s Republic of China but, for the purposes of this prospectus for geographical reference excludes Taiwan, Macau and Hong Kong."
1051,“Code” means the Code on Unit Trusts and Mutual Funds issued by the SFC (as amended or replaced from time to time).
1052,“Collective investment scheme” has the same meaning as in the Securities and Futures Ordinance.
1053,"“Connected Person” has the meaning as set out in the Code which at the date of the Prospectus means in relation to a company: (a) any person or company beneficially owning, directly or indirectly, 20% or more of the ordinary share capital of that company or able to exercise directly or indirectly, 20% or more of the total votes in that company; or (b) any person or company controlled by a person who or which meets one or both of the descriptions given in (a); or (c) any member of the group of which that company forms part; or (d) any director or officer of that company or of any of its connected persons as defined in (a), (b) or (c)."
1054,"“Creation Application” means, in respect of the MSCI China ETF, an application by a Participating Dealer for the creation and issue of Units of the MSCI China ETF in an Application Unit size (or whole multiples thereof) in accordance with the Operating Guidelines and terms of the Trust Deed."
1055,"“Dealing Day” means each Business Day during the continuance of the Trust, and/or such other day or days as the Manager may from time to time determine with the approval of the Trustee either generally or for a particular class or classes of Units."
1056,"“Dealing Deadline” in relation to any particular place and any particular Dealing Day, means the dealing deadline as specified in the Operating Guidelines."
1057,"“Deposited Property” means, in respect of the MSCI China ETF, all the assets (including cash) for the time being held or deemed to be held upon the trusts of the Trust Deed for the account of the MSCI China ETF excluding (i) the Income Property and (ii) any amount fo r the time being standing to the credit of the Distribution Account (as defined in the Trust Deed)."
1058,“Depositary Receipt” are securities issued by a financial institution or “depository” and evidence ownership interests in foreign issuers.
1059,"Depositary receip ts can include American Depositary Receipts (ADRs), European Depositary Receipts (EDRs), and Global Depositary Receipts (GDRs)."
1060,"For depositary receipts that are ADRs, the depository is typically a U.S."
1061,financial institution and generally issues such ADRs i n registered form for use in the U.S.
1062,securities markets.
1063,"For other forms of depositary receipts, the depository may be a non -U.S."
1064,or a U.S.
1065,"entity, and the underlying securities may be issued by a non-U.S."
1066,or a U.S.
1067,issuer.
1068,"“Duties and Charges” means, in relation to any particular transaction or dealing, all stamp and other duties, taxes, government charges, brokerage, bank charges, transfer fees, registration 64 fees, transaction levies and other duties and charges whether in connection with the constitution of the deposited property (as defined in the Trust Deed) or the increase or decrease of the deposited property or the creation, issue, transfer, cancellation or redemption of Units or the acquisition or disposal of Securities or otherwise which may have b ecome or may be payable in respect of, and whether prior to, upon or after the occasion of, any transaction or dealing and including but not limited to, in relation to an issue of Units or redemption of Units, a charge (if any) of such amount or at such rate as is determined by the Manager to be made for the purpose of compensating or reimbursing the Trust for the difference between (a) the prices used when valuing the Securities of the Trust for the purpose of such issue or redemption of Units and (b) (in the case of an issue of Units) the prices which would be used when acquiring the same Securities if they were acquired by the Trust with the amount of cash received by the Trust upon such issue of Units and (in the case of a redemption of Units) the prices which would be used when selling the same Securities if they were sold by the Trust in order to realise the amount of cash required to be paid out of the Trust upon such redemption of Units."
1069,“entities within the same group” means entities which are includ ed in the same group for the purposes of consolidated financial statements prepared in accordance with internationally recognised accounting standards.
1070,“Extension Fee” means any fee payable by a Participating Dealer in accordance with the Operating Guidelines because of the extension of any settlement period.
1071,“FDI” means financial derivative instrument.
1072,“Futures Exchange” means the Hong Kong Futures Exchange Limited or its successors.
1073,“Government and other Public Securities” has the meaning as set out in the Code.
1074,“HKSCC” means the Hong Kong Securities Clearing Company Limited or its successors.
1075,“Hong Kong” means the Hong Kong Special Administrative Region of the People’s Republic of China.
1076,"“Hong Kong dollar”, “HKD” or “HK$” mean the lawful currency for the time being and from time to time of Hong Kong."
1077,"“Income Property” means, in respect of the MSCI China ETF, (a) all interest, dividends and other sums deemed by the Manager, (after consulting the Auditors either on a general or case by case basis), to be in the nature of income (including taxation repayments, if any) received or receivable by the Trustee in respect of the Deposited Property (whether in cash or, without limitation, by warrant, cheque, money, credit or otherwise or the proceeds of sale of any Income Property received in a form other than cash); (b) all interest and other sums received or receivable by the Trustee in respect of (a), (c) or (d) of this definition; (c) all Cash Component payments received or receivable by the Trustee for the account of the MSCI China ETF; and (d) all Cancellation Compensation received by the Trustee for the account of the MSCI China ETF, but excluding (i) the Deposited Property; (ii) any amount for the time being standing to the credit of the Distribution Account (as defined in the Trust Deed) for the account of the relevant Index Fund or previously distributed to Unitholders; (iii) gains for the account of the MSCI China ETF arising from the realisation of Securities; and (iv) any sums applied towards payment of the fees, costs and expenses payable by the Trust from the Income Property of the MSCI China ETF."
1078,"65 “Index Basket” means a portfolio of Index Shares as determined by the Manager substantially similar in composition and weighting to the relevant Underlying Index , provided that such portfolio shall comprise only whole numbers of shares and no fractions or, if the Manager determines, shall comprise only round lots and not any odd lots."
1079,"“Index Fund” means a segregated pool of assets and liabilities into which the Tr ust Fund is divided in accordance with the Trust Deed and where the context requires, only the MSCI China ETF."
1080,"“Index Provider” means, in respect of the MSCI China ETF, the person responsible for compiling the Underlying Index against which the MSCI China ETF benchmarks its investments and who holds the right to licence the use of such Underlying Index to the MSCI China ETF."
1081,“Index Shares” means shares of those companies which are at the relevant time the constituent companies of the relevant Underlying Index listed on a Market.
1082,"“Issue Price” means, in respect of the MSCI China ETF, the price at which Units may be issued, determined in accordance with the Trust Deed."
1083,“Manager” means BlackRock Asset Management North Asia Limited or its successors.
1084,"“Market” means the following, in any part of the world:– (A) in relation to any Security: the SEHK or a Recognised Stock Exchange; and (B) in relation to any futures contract: the Futures Exchange or any Recognised Futures Exchange."
1085,“Market Maker” means a broker or dealer permitted by the SEHK to act as such by making a market for the Units in the secondary market on the SEHK.
1086,“MSCI” means MSCI Inc.
1087,"(formerly known as Morgan Stanley Capital International Inc.) “MSCI China ETF” means iShares Core MSCI China ETF, the first Index Fund of the Trust."
1088,"“Multi-Counter” means the facility by which the Units traded in USD and HKD are each assigned separate stock codes on the SEHK and are accepted for deposit, clearing and settlement in CCASS in more than one eligible currency (USD or HKD) as described in this Prospectus."
1089,"“Net Asset Value” means the net asset value of the MSCI China ETF or, as the context may require, of a Unit calculated pursuant to the Trust Deed."
1090,"“Operating Guidelines” means in relation to the MSCI China ETF, the guidelines for the creation and redemption of Units of the relevant class set out in the Schedule to the Participation Agreement as amended from time to time by the Manager with the approval of the Trustee, and following consultation, t o the extent reasonably practicable, with the Participating Dealers and as notified in writing to the Participating Dealers (for the avoidance of doubt, different Operating Guidelines may be established for different Index Funds)."
1091,"Unless otherwise specifie d, references to the Operating Guidelines shall be to the Operating Guidelines for the MSCI China ETF applicable at the time of the relevant Application."
1092,"66 “Participating Dealer” means, in respect of the MSCI China ETF, any licensed broker or dealer who is (or who has appointed an agent who is) admitted by HKSCC as either a Direct Clearing Participant or a General Clearing Participant (as defined in the General Rules of CCASS) in CCASS and who has entered into a Participation Agreement, and any reference in t his Prospectus to “Participating Dealer” shall, where the context requires, include a reference to any agent so appointed by the Participating Dealer."
1093,"“Participation Agreement” means an agreement entered into between the Trustee, the Manager, a Participating Dealer and (where relevant) a Participating Dealer’s agent, setting out, (amongst other things), the arrangements in respect of the issue of Units for cash and/or Index Shares constituting the Application Basket of the MSCI China ETF and the related Cash Component and the redemption and cancellation of Units for cash and/or Index Shares constituting the Application Basket of the MSCI China ETF and the related Cash Component."
1094,“Recognised Futures Exchange” means an international futures exchange which is recognised by the SFC or which is approved by the Trustee and the Manager.
1095,“Recognised Stock Exchange” means an international stock exchange which is recognised by the SFC or which is approved by the Trustee and the Manager.
1096,"“Redemption Application” means, an application by a Participating Dealer for the redemption of Units of the MSCI China ETF in Application Unit size (or whole multiples thereof) in accordance with the Operating Guidelines and terms of the Trust Deed."
1097,"“Redemption Value” means, in respect of a Unit of the MSCI China ETF, the price per Unit at which such Unit is redeemed, calculated in accordance with the Trust Deed."
1098,“reverse repurchase transactions” has the meaning as set out in the Code.
1099,“sale and repurchase transactions” has the meaning as set out in the Code.
1100,“securities lending transactions” has the meaning as set out in the Code.
1101,"“Securities” means any share, stock, debenture, unit, loan stock, bond, security, commercial paper, acceptance, trade bill, treasury bill, instrument or note of, or issued by or under the guarantee of, any body, whether incorporated or unincorporated, or of any government or local government authority or supranational body, whether paying interest or dividends or not and whether fully-paid, partly paid or nil p aid and includes (without prejudice to the generality of the foregoing):– (A) any right, option or interest (howsoever described) in or in respect of any of the foregoing, including units in any Unit Trust (as defined in the Trust Deed); (B) any certificat e of interest or participation in, or temporary or interim certificate for, receipt for or warrant to subscribe or purchase, any of the foregoing; (C) any instrument commonly known or recognised as a security; (D) any receipt or other certificate or document evidencing the deposit of a sum of money, or any rights or interests arising under any such receipt, certificate or document; and (E) any bill of exchange and any promissory note."
1102,67 “Securities and Futures Ordinance” means the Securities and Futures Ordin ance (Cap.
1103,571) of Hong Kong.
1104,“securities financing transactions” has the meaning as set out in the Code.
1105,“SEHK” means The Stock Exchange of Hong Kong Limited or its successors.
