sentence_id,text
0,"The Stock Exchange of Hong Kong Limited, Hong Kong Exchanges and Clearing Limited, Hong Kong Securities Clearing Company Limited and the Hong Kong Securities and Futures Commission take no responsibility for the contents of this Prospectus, make no representation as to its accuracy or completeness and expressly disclaim any liability whatsoever for any loss howsoever arising from or in reliance upon the whole or any part of the contents of this Prospectus."
1,The iShares Asia Trust and the iShares Core MSCI China ETF have been authorised as collective investment schemes by the Hong Kong Securities and Futures Commission.
2,Authorisation by the Securities and Futures Commission is not a recommendation or endorsement of a product nor does it guarantee the commercial merits of a product or its performance.
3,It does not mean the product is suitable for all investors nor is it an endorsement of its suitability for any particular investor or class of investors.
4,"23 September 2024 IMPORTANT: Investments involve risks, including the loss of principal."
5,Investors are advised to consider their own investment objectives and circumstances in determining the suitability of an investment in the iShares Core MSCI China ETF (the “MSCI China ETF”).
6,An investment in the MSCI China ETF may not be suitable for everyone.
7,"If you are in any doubt about the contents of this Prospectus, you should consult your stockbroker, bank manager, solicitor, accountant or other financial adviser for independent financial advice."
8,iShares Core MSCI China ETF (HKD Counter Stock Code: 2801) (USD Counter Stock Code: 9801) iShares Asia Trust A Hong Kong unit trust authorised under Section 104 of the Securities and Futures Ordinance (Cap.
9,"571) of Hong Kong Listing Agent and Manager BlackRock Asset Management North Asia Limited 貝萊德資產管理北亞有限公司 i IMPORTANT INFORMATION This Prospectus relates to the offer in Hong Kong of Units in the iShares Core MSCI China ETF (the “MSCI China ETF”), a sub-fund of iShares Asia Trust (the “Trust”), an umbrella unit trust established under Hong Kong law by a trust deed dated 16 November 2001 between Barclays Global Investors North Asia Limited (now known as BlackRock Asset Management North Asia Limited) (the “Manager”) and HSBC Institutional Trust Services (Asia) Limited (the “Trustee”) as amended from time to time."
10,"The Manager accepts full responsibility for the accuracy of the information contained in this Prospectus and for the accuracy and fairness of the opinions expressed (at the date of its publication), and confirms that this Prospectus includes particulars given in compliance with the Rules Governing the Listing of Securities on The Stock Exchange of Hong Kong Limited (the “SEHK”) and the Code on Unit Trusts and Mutual Funds (the “Code”) and the Overriding Principles of the SFC Handbook for Unit Trusts and Mutual Funds, Investment -Linked Assurance Schemes and Unlisted Investment Products for the purposes of giving information with regard to the Units of the MSCI China ETF and that having made all reasonable enquiries, the Manager confirms that, to the best of its knowledge and belief that the information contained in this Prospectus is true, accurate and complete in all material respects and not misleading; there are no other matters the omission of which would make any statement in this Prospectus misleading, whether of fact or opinion; any inferences that might reasonably be drawn from any statement in this Prospectus are true and are not misleading; and all opinions and intents expressed in this Prospectus have been arrived at after due and careful consideration and are founded on bases and assumptions that are fair and reasonable."
11,"The Trustee is not responsible for the preparation of this Prospectus and shall not be held liable to any person for any information disclosed in this Prospectus, except for the information regarding the Trustee itself under “Trustee, Registrar and Custodian”."
12,The MSCI China ETF is a fund falling within Chapter 8.6 of the Code.
13,The Trust and the MSCI China ETF are authorised by the Securities and Futures Commission (the “SFC”) in Hong Kong pursuant to section 104 of the Securities and Futures Ordinance.
14,The SFC takes no responsibility for the financial soundness of the Trust and the MSC I China ETF or for the correctness of any statements made or opinions expressed in this Prospectus.
15,Authorisation by the SFC is not a recommendation or endorsement of the Trust and the MSCI China ETF nor does it guarantee the commercial merits of the MSCI China ETF or its performance.
16,It does not mean the MSCI China ETF is suitable for all investors nor is it an endorsement of its suitability for any particular investor or class of investors.
17,"Applicants for Units shall undertake to the Manager and the Trust ee that, to the best of their knowledge, the monies used to invest in Units in the MSCI China ETF are not sourced from mainland China."
18,"Applicants for Units should consult their financial advisers, tax advisers and take legal advice as appropriate as to whe ther any governmental or other consents are required, or other formalities need to be observed, to enable them to acquire Units as to whether any taxation effects, foreign exchange restrictions or exchange control requirements are applicable and to determine whether any investment in the MSCI China ETF is appropriate for them."
19,Dealings in the Units in the MSCI China ETF (the HKD traded Units) on the SEHK commenced on 28 November 2001.
20,"Units in the MSCI China ETF have been accepted as eligible securities by Hong Kong Securities Clearing Company Limited (“HKSCC”) for deposit, clearing and settlement in the Central Clearing and Settlement System (“CCASS”) with effect from 28 November 2001."
21,ii Further applications may be made to list units in additional Index Funds constituted under the Trust in future on the SEHK.
22,"No action has been taken to permit an offering of Units of the MSCI China ETF or the distribution of this Prospectus in any jurisdiction other than Hong Kong and, accordingly, the Prospectus does not cons titute an offer or solicitation to anyone in any jurisdiction in which such offer is not authorised or to any person to whom it is unlawful to make such offer or solicitation."
23,"Furthermore, distribution of this Prospectus shall not be permitted unless it is accompanied by a copy of the latest annual financial report of the MSCI China ETF and, if later, its most recent interim financial report, which form a part of this Prospectus."
24,"In particular: (a) Units in the MSCI China ETF have not been registered under the United States Securities Act of 1933 (as amended) and except in a transaction which does not violate such Act, may not be directly or indirectly offered or sold in the United States of America or any of its territories or for the benefit of a US Person (as defined in Regulation S of such Act); (b) The MSCI China ETF has not been and will not be registered under the United States Investment Company Act of 1940, as amended."
25,"Accordingly, Units may not, except pursuant to an exemption from, or in a transact ion not subject to, the regulatory requirements of the US Investment Company Act of 1940 be acquired by a person who is deemed to be a US Person under the 1940 Act and regulations; (c) Units may not, except pursuant to a relevant exemption, be acquired or owned by, or acquired with the assets of an ERISA Plan."
26,"An ERISA Plan is defined as (i) any retirement plan subject to Title I of the United States Employee Retirement Income Securities Act of 1974, as amended; or, (ii) any individual retirement account o r plan subject to Section 4975 of the United States Internal Revenue Code of 1986, as amended; and (d) Units may not be acquired by any person or investor which may be prohibited to invest in the MSCI China ETF by its relevant regulator, government or oth er statutory authority."
27,"Where the Manager becomes aware that the Units are directly or indirectly beneficially owned by any person in breach of the above restrictions, the Manager may give notice to such person requiring him to transfer such Units to a person who would not thereby be in contravention of such restrictions or to request in writing the redemption of such Units in accordance with the trust deed."
28,"Investors should note that any amendment, addendum or replacement to this Prospectus will only be posted on the Manager’s website (www.blackrock.com/hk)."
29,Investors should refer to “Information Available on the Internet” for more details.
30,"iShares® and BlackRock® are registered trademarks of BlackRock, Inc., or its subsidiaries in the United States and elsewhere."
31,"All other trademarks, servicemarks or registered trademarks are the property of their respective owners."
32,"©2024 BlackRock, Inc."
33,All rights reserved.
34,"iii DIRECTORY MANAGER BLACKROCK ASSET MANAGEMENT NORTH ASIA LIMITED 16/F CHAMPION TOWER 3 GARDEN ROAD, CENTRAL HONG KONG DIRECTORS OF THE MANAGER SUSAN WAI-LAN CHAN JAMES RABY HIROYUKI SHIMIZU AARTI ANGARA SUB-MANAGERS BLACKROCK (SINGAPORE) LIMITED #18-01, TWENTY ANSON 20 ANSON ROAD SINGAPORE 079912 BLACKROCK INVESTMENT MANAGEMENT (UK) LIMITED 12 THROGMORTON AVENUE LONDON EC2N 2DL UNITED KINGDOM BLACKROCK JAPAN CO., LTD."
35,"13 MARUNOUCHI CHIYODA-KU TOKYO 100-8217 JAPAN TRUSTEE, REGISTRAR AND CUSTODIAN HSBC INSTITUTIONAL TRUST SERVICES (ASIA) LIMITED 1 QUEEN’S ROAD CENTRAL HONG KONG SERVICE AGENT HK CONVERSION AGENCY SERVICES LIMITED 8/F, TWO EXCHANGE SQUARE 8 CONNAUGHT PLACE CENTRAL HONG KONG AUDITORS PRICEWATERHOUSECOOPERS 22ND FLOOR PRINCE’S BUILDING CENTRAL HONG KONG 1 TABLE OF CONTENTS INTRODUCTION 3 The Trust and the MSCI China ETF 3 Investment Objective 3 Investment Strategy 3 Leverage 5 Investment and Borrowing Restrictions 5 Index Licence Agreement 5 Cross-trades 5 DESCRIPTION OF THE MSCI CHINA ETF ."
36,6 CREATIONS AND REDEMPTIONS (PRIMARY MARKET) 11 Investment in the MSCI China ETF .
37,11 Creation by Participating Dealers 11 Redemption of Units 14 Directed Cash Dealing 17 Suspension of Creations and Redemptions 17 Transfer of Units 18 EXCHANGE LISTING AND TRADING (SECONDARY MARKET) 20 DETERMINATION OF NET ASSET VALUE 22 Suspension of Net Asset Value 23 Issue Price and Redemption Value .
38,"23 FEES AND EXPENSES 25 Fees and Expenses Payable by the MSCI China ETF 26 RISK FACTORS 28 Investment Risk 28 Market Trading Risks Associated with the MSCI China ETF 34 Risks Associated with the Underlying Index 37 Regulatory Risks 39 Risk Factors Relating to the PRC 40 Stock Connect Related Risks 41 MANAGEMENT OF THE TRUST 42 The Manager 42 The Sub-Managers 43 Trustee, Registrar and Custodian 44 Service Agent ."
39,44 Indemnities of the Trustee and Manager 45 Auditor.
40,45 Conflicts of Interest 45 Soft Dollars 49 STATUTORY AND GENERAL INFORMATION 50 Reports and Accounts 50 Trust Deed 50 2 Modification of Trust Deed 50 Provision of Information 51 Voting Rights 51 Termination 51 Inspection of Documents 52 Part XV of the Securities and Futures Ordinance 52 Anti-Money Laundering Regulations 53 Liquidity Risk Management 53 Takeovers Code 54 Change of Underlying Index 54 Information Available on the Internet 55 Notices 56 Enquiries and Complaints 56 TAXES 57 DEFINITIONS 62 SCHEDULE 1 69 Investment Restrictions 69 Securities Financing Transactions 74 Financial Derivative Instruments 75 Collateral 77 Borrowing Policy 80 SCHEDULE 2 82 Disclaimer by MSCI 82 SCHEDULE 3 83 What is the Stock Connect?
41,83 Stock Connect Related Risks 85 3 INTRODUCTION The information contained in this Prospectus has been prepared to assist potential investors in making an informed decision in relation to investing in the MSCI China ETF.
42,It contains important facts about the Trust as a whole and the MSCI China ETF.
43,"The Trust and the MSCI China ETF The Trust is an umbrella unit trust created by a trust deed (the “Trust Deed”) dated 16 November 2001, as amended, made under Hong Kong law between Barclays Global Investors North Asia Limited (now known as BlackRock Asset Management North Asia Limited) (the “Manager”) and HSBC Institutional Trust Services (Asia) Limited (the “Trust ee”)."
44,The Trust may issue different classes of units and the Trustee shall establish a separate pool of assets within the Trust (each such separate pool of assets an “Index Fund”) for each class of units.
45,The assets of an Index Fund will be invested and ad ministered separately from the other assets of the Trust.
46,The Manager reserves the right to establish other Index Funds and to issue further classes of Units in the future.
47,"This Prospectus relates to one of the Index Funds, iShares Core MSCI China ETF, whi ch is an exchange traded fund (or “ETF”) authorised by the SFC."
48,ETFs are funds that are designed to track an index.
49,The Units of the MSCI China ETF are listed on the SEHK and trade like any other equity security listed on the SEHK.
50,Only Participating Dealers may create or redeem Units directly from the MSCI China ETF at Net Asset Value who are under no obligation to accept instructions to create or redeem Units on behalf of retail investors.
51,All other investors may only buy and sell Units in the MSCI China ETF on the SEHK.
52,PRICES FOR THE MSCI CHINA ETF ON THE SEHK ARE BASED ON SECONDARY MARKET TRADING FACTORS AND MAY DEVIATE SIGNIFICANTLY FROM THE NET ASSET VALUE OF THE MSCI CHINA ETF.
53,"Investment Objective The investment objective of the MSCI China ETF is to provide investment results that, before fees and expenses, closely correspond to the performance of the Underlying Index."
54,"An index is a group of Securities which an index provider selects as representative of a market, market segment or specific industry sector."
55,The Index Provider is independent of the Manager and determines the relative weightings of the Securities in the index and publishes information regarding the market value of the index.
56,There can be no assurance that the MSCI China ETF will achieve its investment objective.
57,The Underlying Index of the MSCI China ETF may be changed by prior approval of the SFC and notice to Unitholders.
58,Investment Strategy The Manager uses a passive or indexing approach to try to achieve the MSCI China ETF’s investment objective.
59,"The investment objective is to provide investment results that, before fees and expenses, closely correspond to the performance of the Underlying Index."
60,The Manager does not try to beat or perform better than the Underlying Index.
61,4 The MSCI China ETF aims to invest at least 95% of its assets in achieving the investment objective.
62,"The MSCI China ETF may invest, either directly or indirectly, in Securities included in the Underlying Index, or in Securities that are not included in its Underlying Index, but which the Manager believes will help the MSCI China ETF achieve its investment objective."
63,"The MSCI China ETF may also invest its remaining assets in money market instruments or funds that invest exclusively in money market instruments, in repurchase agreements, in stocks that are in the relevant market but not the Underlying Index, and/or in combinations of stock index futures contracts, options on futures contracts, stock index options, swaps, cash, local currency and forward currency e xchange contracts that are intended to provide the MSCI China ETF with exposure to a stock."
64,The investment strategy of the MSCI China ETF is subject to the investment and borrowing restrictions set out in Schedule 1.
65,"In managing the MSCI China ETF, the Man ager may adopt a representative sampling investment strategy in lieu of a replication investment strategy as described below."
66,A representative sampling investment strategy may be more appropriate in view of the comparative illiquidity and possible settleme nt difficulties which may be experienced with certain B shares comprised in the Underlying Index.
67,"Having regard to the number of Securities constituting the Underlying Index, the liquidity of such Securities, any restrictions on the ownership of Index Shar es, high transaction expenses and other trading costs, and tax and other regulatory restrictions the Manager may decide to adopt a representative sampling investment strategy."
68,This means that the MSCI China ETF may not hold all shares in all the constituent companies of the Underlying Index.
69,"However, the Manager may swap between the two investment strategies, without prior notice to Unitholders, in its absolute discretion as often as it believes appropriate in order to achieve the investment objective of the MSCI China ETF."
70,"Representative Sampling Investment Strategy “Representative sampling” is an indexing strategy that involves investing, directly or indirectly, in a representative sample of the Securities included in the relevant index that collectively has an investment profile that reflects the profile of the relevant index."
71,"The MSCI China ETF, adopting a representative sampling investment strategy, may or may not hold (either directly or indirectly) all of the Securities that are included in the Underly ing Index, and may hold Securities which are not included in the Underlying Index, provided that the sample closely reflects the overall characteristics of the Underlying Index and if the Manager believes that a replication investment strategy is not the m ost efficient means to track the Underlying Index."
72,The Manager will select a representative sample of Securities using quantitative analytical models in a technique known as “portfolio sampling”.
73,"Under this technique, each stock is considered for inclusion in the MSCI China ETF based on its contribution to certain capitalisation, industry and fundamental investment characteristics."
74,"The Manager seeks to construct the portfolio of the MSCI China ETF so that, in the aggregate, its capitalisation, industry and fundamental investment characteristics perform like those of its Underlying Index."
75,"Over time, the Manager may alter (or “rebalance”) the portfolio composition of the MSCI China ETF to reflect changes in the characteristics of its Underlying Index or to bring the performance and characteristics of the MSCI China ETF more in line with that of its Underlying Index."
76,"The Manager will review the MSCI China ETF regularly and will adjust its portfolio, when necessary, to conform to changes in the composition of the Underlying Index."
77,Rebalancing may also be required for tax purposes.
78,These rebalancings will require the MSCI China ETF to incur transaction costs and other expenses.
79,"Replication Investment Strategy Although a representative sampling investment strategy h as proven an effective means of approximating index performance in the past, it may not enable the MSCI China ETF to track the Underlying Index’s performance as well as a replication investment strategy."
80,"“Replication” is an indexing strategy that involves investing in substantially all of the Securities in the 5 Underlying Index, either directly or indirectly, in substantially the same proportions as those Securities have in the Underlying Index."
81,The Manager reserves the right to invest in all of the Underlying Index.
82,"Correlation An index is a theoretical financial calculation based on the performance of particular components that make up the index, whereas the MSCI China ETF is an actual investment portfolio."
83,"The performance of the MSCI China ETF and its Underlying Index may be different due to transaction costs, asset valuations, corporate actions (such as mergers and spin-offs), timing variances and differences between the MSCI China ETF’s portfolio and the Underlying Index."
84,These differences may result for example from legal restrictions affecting the ability of the MSCI China ETF to purchase or dispose of Securities or the employment of a representative sampling investment strategy.
85,The use of a representative sampling investment strategy can be expected to result in greater tracking error than a replication investment strategy.
86,The consequences of “tracking error” are described in more detail in “Risk Factors”.
87,Leverage The MSCI China ETF’s net derivative exposure may be up to 50% of the MSCI China ETF’s Net Asset Value.
88,Investment and Borrowing Restrictions The MSCI China ETF must comply with the investment and borrowing restrictions as summarised in Schedule 1 of this Prospectus (which includes a summary of the investment restrictions set out in the Trust Deed).
89,"Index Licence Agreement The Manager has been granted a licence by MSCI to use the Underlying Index as the basis for determining the composition of the MSCI China ETF and to sponsor, issue, establish, organise, structure, operate, manage, offer, sell , market, promote, write, list, exchange and distribute the MSCI China ETF pursuant to a licence agreement."
90,The initial term of the licence was five years commencing from 18 May 2001.
91,"On the expiry of the initial term, the licence was (and shall be) automa tically extended for successive renewal terms of three years at a time, unless either party may terminate the licence agreement by written notice to the other party given not later than ninety days prior to the end of the initial term or any renewal term."
92,Investors’ attention is drawn to “Risks Associated with the Underlying Index” on page 37.
93,"Cross-trades Cross-trades between the MSCI China ETF and other funds managed by the Manager or its affiliates may be undertaken where the Manager considers that, as part of its portfolio management, such cross-trades would be in the best interests of the Unitholders to achieve the investment objective and policy of the MSCI China ETF."
94,"By conducting cross -trades, the Manager may achieve trading efficiencies and savings for the benefit of the Unitholders."
95,"In conducting transactions, the Manager will ensure that the trades are execut ed on arm’s length terms at current market value and the reason for such trades shall be documented prior to execution, in accordance with the SFC’s Fund Manager Code of Conduct."
96,"6 DESCRIPTION OF THE MSCI CHINA ETF Key Information The following table is a summary of key information in respect of the MSCI China ETF, and should be read in conjunction with the full text of this Prospectus."
97,"Underlying Index Index: MSCI China Index Launch Date: 31 December 1992 Number of constituents: 704 stocks (as at 31 March 2024) Total Market Capitalisation (Free Float): HK$14,164.91 billion (as at 31 March 2024) Base Currency: HK$ Listing Date 28 November 2001# #For HKD-traded Units."
98,Trading for USD Units commenced on 17 August 2021.
99,"Exchange Listing SEHK – Main Board Initial public offering Not applicable Stock Code 2801 – HKD Counter 9801 – USD Counter Stock Short Names ISHARES CHINA – HKD Counter ISHARES CHINA-U – USD Counter ISIN Numbers HK2801040828 – HKD Counter HK0000768561 – USD Counter Trading Board Lot Size 200 Units (for each counter) Base Currency Hong Kong dollars (HK$) Trading Currencies Hong Kong dollars (HKD) – HKD Counter US dollars (USD) – USD Counter Distribution Policy Annually, at the Manager’s discretion (usually in November/December each year) (if any)."
100,Distributions may be made out of capital or effectively out of capital as well as income at the Manager’s discretion.
101,"All Units will receive distributions in the Base Currency (HKD) only.* In-kind Creation/Redemption (only Participating Dealers) Minimum 300,000 Units (or multiples thereof) (for each counter) 7 Management Fee 0.20% p.a."
102,of Net Asset Value accrued daily Investment strategy Replication investment strategy or representative sampling investment strategy (r efer to the Introduction above and the “Investment Strategy” section below) Financial year end 31 December Website www.blackrock.com/hk *Unitholders of the MSCI China ETF should note that all Units will receive distributions in the Base Currency (HKD) only.
103,"As such, the Unitholder may have to bear the fees and charges associated with the conversion of such distributions from HKD to USD or any other currency."
104,Unitholders are advised to check with their brokers for arrangements concerning distributions and consider the risk factor “Other Currencies Distributions Risk”.
105,"Investment Objective The investment objective of the MSCI China ETF is to provide investment results that, before fees and expenses, closely correspond to the performance of the Underlying Index."
106,There can be no assurance that the MSCI China ETF will achieve its investment objective.
107,Investment Strategy The Manager may use either a replication investment strategy or a representative sampling investment strategy to achieve the M SCI China ETF’s investment objective by investing in Chinese securities*.
108,"In pursuing a representative sampling investment strategy, the Manager may overweight the holdings of the MSCI China ETF relative to their respective weightings in the Underlying Index."
109,For example such overweighting of holdings may occur if the Manager considers certain Securities in the Underlying Index should be excluded in view of the comparative illiquidity and possible settlement difficulties which may be experienced with such Securities.
110,"In pursuing a representative sampling investment strategy, the Manager will select underlying Securities, based on their contribution to certain capitalisation, industry and fundamental investment characteristics, that will, in the aggregate, p rovide performance like that of the Underlying Index."
