sentence_id,text
957,"In addition, where the Sub-Funds under the Trust hold in aggregate more than the limit of 10% of the ordinary shares issued by any single entity and the SFC has not agreed to waive this prohibition under the Code, the Manager shall take as a priority objective all steps as are necessary within a reasonable period to remedy the situation, taking into account the interests of the Unitholders."
958,"80 The Manager shall notify the SFC and publish a notice of suspension following the suspension, and at least once a month during the suspension, on its website at www.chinaamc.com.hk (the contents of which and of other websites referred to in this Prospectus have not been reviewed by the SFC) or in such other publications as it decides."
959,The Manager shall consider any Redemption Application or any Creation Application received during the period of suspension (that has not been otherwise withdrawn) as having been received immediately following the termination of the suspension.
960,The period for settlement of any redemption will be extended by a period equal to the length of the period of suspension.
961,"A Participating Dealer may, at any time after a suspension has been declared and before termination of such suspension, withdraw any Creation Application or Redemption Application by notice in writing to the Manager and the Manager shall promptly notify and request the Trustee to return to the Participating Dealer any Securities and/or cash received by it in respect of the Creation Application (without interest) as soon as practicable."
962,A suspension shall remain in force until the earlier of (a) the Manager declaring the suspension is at an end; and (b) the first Dealing Day on which (i) the condition giving rise to the suspension shall have ceased to exist; and (ii) no other condition under which suspension is authorised exists.
963,"Deferred Redemption In the event that redemption requests are received for the redemption of Units representing in aggregate more than 10% (or such higher percentage as the Manager may determine in respect of the Sub-Fund) of the total number of Units in a Sub-Fund then in issue, the Manager may direct the Trustee to reduce the requests rateably and pro rata amongst all Unitholders seeking to redeem Units on the relevant Dealing Day and carry out only sufficient redemptions which, in aggregate, amount to 10% (or such higher percentage as the Manager may determine in respect of a Sub-Fund) of the Units in the relevant Sub- Fund then in issue."
964,Units which are not redeemed but which would otherwise have been redeemed will be redeemed on the next Dealing Day (subject to further deferral if the deferred requests in respect of the relevant Sub-Fund themselves exceed 10% (or such higher percentage as the Manager may determine in respect of that Sub-Fund) of the Units in the relevant Sub-Fund then in issue) in priority to any other Units in the relevant Sub-Fund for which redemption requests have been received.
965,Units will be redeemed at the Redemption Value prevailing on the Dealing Day on which they are redeemed.
966,"Restrictions on Unitholders The Manager has power to impose such restrictions as it may think necessary for the purpose of ensuring that no Units are acquired or held which would result in such holding being: (a) a breach of the law or requirements of any country or governmental authority or any stock exchange on which the Units are listed in circumstances which, in the Manager's opinion, might result in the Trust or the Sub-Fund suffering any adverse effect which the Trust or the Sub-Fund might not otherwise have suffered; or (b) in the circumstances which, in the Manager’s opinion, may result in the Trust or the Sub-Fund incurring any tax liability or suffering any other pecuniary disadvantage which the Trust or the Sub-Fund might not otherwise have incurred or suffered."
967,"Upon notice that any Units are so held, the Manager may require such Unitholders to redeem or transfer such Units in accordance with the provisions of the Trust Deed."
968,A person who becomes aware that he is holding or owning Units in breach of any of the above restrictions is required either to redeem his Units in accordance with the Trust Deed or to transfer his Units to a person whose holding would be permissible under this Prospectus and the Trust Deed in a manner that would result in such Unitholder no longer being in breach of the restrictions above.
969,"Evidence of Unitholding 81 Units will be deposited, cleared and settled by the CCASS."
970,"Units are held in registered entry form only, which means that no Unit certificates are issued."
971,HKSCC Nominees Limited is the registered owner (i.e.
972,the sole holder of record) of all outstanding Units deposited with the CCASS and is holding such Units for the participants in accordance with the General Rules of CCASS.
973,"Furthermore, the Trustee and the Manager acknowledge that pursuant to the General Rules of CCASS neither HKSCC Nominees Limited nor HKSCC has any proprietary interest in the Units."
974,Investors owning Units in CCASS are beneficial owners as shown on the records of the participating brokers or the relevant Participating Dealer(s) (as the case may be) who either are themselves participants of CCASS or have appointed PD Agents that are participants of CCASS.
975,Transfer of Units The Trust Deed provides that a Unitholder may transfer Units with the consent of the Manager.
976,"As all Units will be held in CCASS, the Manager’s consent is deemed given where an investor is transferring his interest in Units within CCASS."
977,"A Unitholder is entitled to transfer Units held by him by using the standard transfer form issued by SEHK or by an instrument in writing in such other form (and if the transferor or the transferee is a clearing house or its nominee(s), by hand or by machine imprinted signature or by such other manner of execution) as the Trustee may from time to time approve."
978,The transferor will be deemed to remain the Unitholder of the Units transferred until the name of the transferee is entered in the register of Unitholders in respect of the Units being transferred.
979,Each instrument of transfer must relate to a single Sub-Fund only.
980,"If and to the extent that all Units are deposited, cleared and settled in CCASS, HKSCC Nominees Limited will be the sole Unitholder, holding such Units for the persons admitted by HKSCC as a participant of CCASS and to whose account any Units are for the time being allocated in accordance with the General Rules of CCASS."
981,"Dual Counter / Multi-Counter Units created and issued pursuant to a Creation Application may be deposited in CCASS as HKD traded Units, USD traded Units or RMB traded Units initially."
982,"Similarly, Units redeemed pursuant to a Redemption Application may be withdrawn from any trading counter (i.e."
983,"HKD counter, USD counter or RMB counter)."
984,"82 EXCHANGE LISTING AND TRADING (SECONDARY MARKET) General The purpose of the listing of the Units on the SEHK is to enable investors to buy and sell Units on the secondary market, normally via a broker or dealer in smaller quantities than would be possible if they were to subscribe and/or redeem Units in the primary market."
985,The market price of a Unit listed or traded on the SEHK may not reflect the Net Asset Value per Unit.
986,Any transactions in the Units on the SEHK will be subject to the customary brokerage commissions and/or transfer taxes associated with the trading and settlement through the SEHK.
987,There can be no guarantee that once the Units are listed on the SEHK they will remain listed.
988,The Manager will use its best endeavours to put in place arrangements so that at least one Market Maker will maintain a market for the Units.
989,"Where Multi-Counter or a Dual Counter has been adopted in respect of a Sub-Fund the Manager will use its best endeavours to put in place arrangements so that there is at least one Market Maker for each counter, although these Market Makers may be the same entity."
990,"Broadly, the obligations of a Market Maker will include quoting bid and offer prices on the SEHK with the intention of providing liquidity."
991,"Given the nature of the Market Maker’s role, the Manager will make available to a Market Maker, the portfolio composition information made available to a Participating Dealer."
992,Units may be purchased from and sold through the Market Makers.
993,"However, there is no guarantee or assurance as to the price at which a market will be made."
994,"In maintaining a market for Units, the Market Makers may make or lose money based on the differences between the prices at which they buy and sell Units, which is to a certain extent dependent on the difference between the purchase and sale prices of the underlying Securities comprised within the Index."
995,Market Makers may retain any profits made by them for their own benefit and they are not liable to account to the Sub-Funds in respect of their profits.
996,"If you wish to buy or sell Units on the secondary market, you should contact your brokers."
997,"If trading of the Units on the SEHK is suspended or trading generally on the SEHK is suspended, then there will be no secondary market dealing for the Units."
998,Units are neither listed nor dealt on any other stock exchange and no application for such listing or permission to deal is being sought as at the date of this Prospectus.
999,Application may be made in the future for a listing of Units of any Sub-Fund on one or more other stock exchanges.
1000,Participating Dealers should note that they will not be able to sell or otherwise deal in the Units on the SEHK until dealings begin on the SEHK.
1001,"83 ISSUE PRICE AND REDEMPTION VALUE The Issue Price which is the subject of a Creation Application during the Initial Offer Period of a Sub-Fund will be a fixed amount per Unit, or a percentage of the closing level of the relevant Index (expressed in the Base Currency of the relevant Sub-Fund) as at the last day of the Initial Offer Period, rounded to four decimal places (0.00005 or above being rounded up, and less than 0.00005 being rounded down), or such other amount from time to time determined by the Manager and approved by the Trustee."
1002,The Issue Price during the Initial Offer Period of each Sub-Fund will be set out in the relevant Appendix.
1003,"After the expiry of the Initial Offer Period, the Issue Price of Units created and issued by a Creation Application, will be the prevailing Net Asset Value of the relevant Sub-Fund in HKD as at the relevant Valuation Point divided by the total number of Units in issue rounded to the nearest four decimal places (0.00005 or above being rounded up, and less than 0.00005 being rounded down)."
1004,"The Redemption Value on a Dealing Day shall be the prevailing Net Asset Value of the relevant Sub-Fund in HKD as at the relevant Valuation Point divided by the total number of Units in issue rounded to the nearest four decimal places (0.00005 or above being rounded up, and less than 0.00005 being rounded down)."
1005,The benefit of any rounding adjustments will be retained by the relevant Sub-Fund.
1006,The latest Net Asset Value of the Units will be available on the Manager’s website at www.chinaamc.com.hk (the contents of which and of other websites referred to in this Prospectus have not been reviewed by the SFC) or published in such other publications as the Manager decides.
1007,"Neither the Issue Price nor the Redemption Value takes into account Duties and Charges, Transaction Fees or fees payable by a Participating Dealer."
1008,"84 SCHEDULE 3 – PROVISIONS RELATING TO THE OFFER, SUBSCRIPTION, CONVERSION AND REDEMPTION OF THE UNLISTED CLASS(ES) OF UNITS This Schedule 3 contains disclosure relating to the Unlisted Class(es) of Units only."
1009,"Unless the context otherwise requires, references to “Units” and “Unitholders” in this Schedule shall be construed to refer to an Unlisted Class of Units of the Sub-Fund or a Unitholder of such Units."
1010,"Save for terms defined below, all other terms used in this Schedule shall have the same meanings as assigned to them under the main part of the Prospectus."
1011,"SUBSCRIPTION OF UNLISTED CLASS(ES) OF UNITS Initial Issue of Units During an Initial Offer Period, Units in a Sub-Fund will be offered to investors at an initial Subscription Price of a fixed price per Unit determined by the Manager in its absolute discretion as specified in the relevant Appendix."
1012,Units will be issued immediately following the close of the Initial Offer Period or such other Business Day as the Manager may determine.
1013,Dealing of the Units will commence on the Dealing Day immediately following the closure of the relevant Initial Offer Period.
1014,"Subsequent issue of Units Following the close of the relevant Initial Offer Period, Units will be available for issue on each Dealing Day at the relevant Subscription Price."
1015,"Unless otherwise specified in the relevant Appendix and subject to any swing pricing adjustment made in accordance with the section ""Anti-Dilution Pricing Adjustment"" below, the Subscription Price on any Dealing Day will be the price per Unit ascertained by dividing the Net Asset Value of the relevant class of the Sub-Fund as at the Valuation Point in respect of the relevant Dealing Day by the number of Units of such class of the Sub-Fund then in issue and rounded to 4 decimal places (0.00005 or above being rounded up, and less than 0.00005 being rounded down) or in such manner and to such other number of decimal places as may from time to time be determined by the Manager."
1016,Any rounding adjustment will be retained by the relevant class.
1017,The Subscription Price will be calculated and quoted in the relevant Class Currency of the Sub-Fund.
1018,The Manager is entitled to impose a subscription fee on the subscription monies for the application for the issue of Units.
1019,"The Manager may, either generally or in any particular case, differentiate as to the amount of the subscription fee to be levied in respect of different classes of Units, differentiate between applicants as to the amount of the subscription fee to be levied and/or allow to persons a discount to the subscription fee on such basis or on such scale as the Manager may think fit."
1020,"For the avoidance of doubt, the Manager will charge the same rate of subscription fee for all applicants in the same Unlisted Class(es) of Units."
1021,The Manager may retain the benefit of such subscription fee.
1022,Details of the subscription fee are set out in the section headed “Fees and Expenses” in this Prospectus.
1023,"The Manager may require an applicant to pay, in addition to the Subscription Price of the subscription proceeds and any subscription fee, a further amount which it reasonably considers to represent an appropriate allowance for (a) estimated bid/offer spread of the investments of the Sub-Fund, (b) extraordinary transactional fees or expenses, including stamp duty, other taxes, brokerage, bank charges, transfer fees or registration fees, or (c) other charges which are customarily incurred in investing a sum equal to the application monies and issuing the relevant Units or of delivery or issue of certificates in respect thereof or the remittance of money to the Trust (the “Subscription Adjustment Allowance”)."
1024,Any such Subscription Adjustment Allowance will be paid to the Trust and will form part of the assets of the Sub-Fund or the relevant class.
1025,"Application Procedure To subscribe for Units, an applicant should complete a subscription application form and return the 85 application form, together with the required supporting documents, to the Manager by facsimile or other electronic means (as may be agreed between the Manager and the Trustee)."
1026,The original application form is not required to be submitted unless otherwise required by the Manger or the Trustee.
1027,Applicants who choose to send an application form by facsimile or other electronic means bear the risk of the form not being received by the Manager.
1028,"Applicants should therefore, for their own benefit, confirm with the Manager safe receipt of an application form."
1029,"None of the Manager, the Transfer Agent or the Trustee will be responsible to an applicant for any loss resulting from non-receipt or illegibility of any application form sent by facsimile or other electronic means or for any loss caused in respect of any action taken as a consequence of such application believed in good faith to have originated from properly authorised persons."
1030,"Unless otherwise specified in the relevant Appendix, applications for Units during the Initial Offer Period must be received by the Manager no later than 2:00 p.m."
1031,(Hong Kong time) on the last day of the Initial Offer Period.
1032,"After the Initial Offer Period, applications must be received by the Manager by the Subscription Deadline."
1033,Application requests submitted after the applicable Subscription Deadline in respect of any Dealing Day will be dealt with on the next Dealing Day.
1034,Each applicant whose application is accepted will be sent a contract note confirming details of the purchase of relevant Unlisted Class(es) of Units but no certificates will be issued.
1035,Applicants may apply for Units through a distributor appointed by the Manager.
1036,"Distributors may have different dealing procedures, including earlier cut-off times for receipt of applications and/or cleared funds."
1037,Applicants who intend to apply for Units through a distributor should therefore consult the distributor for details of the relevant dealing procedures.
1038,"Where an applicant applies for Units through a distributor, the Manager will treat the distributor (or its nominee) as the applicant."
1039,The distributor (or its nominee) will be registered as Unitholder of the relevant Unlisted Class(es) of Units.
1040,"The Manager will treat the distributor (or its nominee) as the Unitholder and shall not be responsible for any arrangements between the relevant applicant and the distributor regarding the subscription, holding and redemption of Units and any related matters, as well as any costs or losses that may arise therefrom."
1041,"The Manager will, however, take all reasonable care in the selection and appointment of distributors."
1042,No money should be paid to any intermediary in Hong Kong who is not licensed or registered to carry on Type 1 (dealing in securities) regulated activity under Part V of the Securities and Futures Ordinance.
1043,"The Manager may, at its discretion, reject in whole or in part any application for Units."
1044,"In the event that an application is rejected, application monies will be returned without interest and net of expenses by telegraphic transfer or by such other means as the Trustee considers appropriate at the risk of the applicant."
1045,No applications for Units will be dealt with during any periods in which the determination of the Net Asset Value of the Sub-Fund is suspended (for details see “Suspension of Determination of Net Asset Value” in this Prospectus).
1046,"Please also refer to the section headed “Suspension of the issue, subscription and redemption of Unlisted Class(es) of Units” below regarding suspension of issue and subscription of Units."
1047,Payment Procedure Subscription monies should be paid in the Class Currency of the relevant Unlisted Class of Units.
1048,"Subscription monies in cleared funds should be received by (i) the deadline for cleared funds on the relevant Dealing Day on which an application was received or (ii) in the case of applications for Unlisted Class(es) of Units during the Initial Offer Period, such time on the last day of the Initial Offer Period of Unlisted Class(es) of Units as specified in the relevant Appendix, or within such other period as determined by the Manager."
1049,86 Subscription monies paid by any person other than the applicant will not be accepted.
1050,"The Manager may exercise its discretion to accept late payment of subscription monies, provisionally allot Units by reference to the Net Asset Value of the relevant class of Units in the Sub-Fund and charge interest on such overdue monies until payment is received in full, at such rate as the Manager thinks appropriate."
1051,"However, if payment of subscription monies in cleared funds are not made within such period as determined by the Manager, the application may, at the discretion of the Manager, be considered void and cancelled."
1052,"Upon such cancellation, the relevant Units shall be deemed never to have been issued and the applicant shall have no right to claim against the Manager or the Transfer Agent and any loss will be borne by the applicant, provided that: (i) no previous valuations of the Sub- Fund shall be re-opened or invalidated as a result of the cancellation of such Units; (ii) the Manager may require the applicant to pay, for the account of the Sub-Fund, in respect of each such Unit cancelled, the amount (if any) by which the Subscription Price on the relevant Dealing Day exceeds the applicable Redemption Price on the date of cancellation; and (iii) the Trustee shall be entitled to charge the applicant a cancellation fee for the administrative costs involved in processing the application and subsequent cancellation."
1053,Payment in other freely convertible currencies may be accepted.
1054,"Where amounts are received in a currency other than the relevant Class Currency, they will be converted into the relevant Class Currency and the proceeds of conversion (after deducting the costs of such conversions) will be applied in the subscription of Units in the relevant Unlisted Class(es) of Units of the Sub-Fund."
1055,Conversion of currencies may involve delay.
1056,Bank charges (if any) incurred in converting the subscription monies shall be borne by the relevant applicant and accordingly will be deducted from the subscription proceeds.
1057,General All holdings of Units will be in registered form and certificates will not be issued.
1058,Evidence of title of Units will be the entry on the register of Unitholders of the Sub-Fund.
1059,Unitholders should therefore be aware of the importance of ensuring that the Transfer Agent is informed of any change to the registered details.
1060,Fractions of a Unit may be issued rounded down to the nearest 4 decimal places.
1061,Subscription monies representing smaller fractions of a Unit will be retained by the Sub-Fund.
1062,A maximum of 4 persons may be registered as joint Unitholders.
1063,87 REDEMPTION OF UNLISTED CLASS(ES) OF UNITS Redemption procedure Unitholders of Units who wish to redeem their Units in the Sub-Fund may do so on any Dealing Day by submitting a redemption request to the Manager.
1064,Any redemption request must be received by the Manager before the Redemption Deadline.
1065,Investors redeeming Units through a distributor (or its nominee) should submit their redemption requests to the distributor (or its nominee) in such manner as directed by the distributor (or its nominee).
1066,"Distributors (or their nominees) may have different dealing procedures, including earlier cut-off times for receipt of redemption requests."
1067,"Where an investor holds its investment in Units through a distributor (or its nominee), the investor wishing to redeem such Units must ensure that the distributor (or its nominee), as the registered Unitholder, submits the relevant redemption request by the Redemption Deadline."
1068,Redemption requests submitted after the applicable Redemption Deadline in respect of any Dealing Day will be dealt with on the next Dealing Day.
1069,A redemption request may be sent by facsimile or other electronic means (as may be agreed between the Manager and the Trustee) from time to time determined by the Manager.
1070,"The redemption request must specify: (i) the name of the Sub-Fund, (ii) the relevant class and the value or number of Units to be redeemed, (iii) the name(s) of the registered Unitholder(s) and (iv) payment instructions for the redemption proceeds."
1071,A Unitholder who chooses to send an application form by facsimile or other electronic means bears the risk of the form not being received by the Manager.
1072,"Unitholders should therefore, for their own benefit, confirm with the Manager safe receipt of a redemption request."
1073,"None of the Manager, the Transfer Agent or the Trustee will be responsible to a Unitholder for any loss resulting from non-receipt or illegibility of any redemption request sent by facsimile or other electronic means or for any loss caused in respect of any action taken as a consequence of such request believed in good faith to have originated from properly authorised persons."
1074,"Partial redemption of a holding of Units in an Unlisted Class of Units of the Sub-Fund by a Unitholder may be effected, provided that such redemption will not result in the Unitholder holding Units less than the minimum holding for that class specified in the section headed “Summary” under the sub-section “Key Information applicable to Unlisted Class(es) of Units only”."
1075,"In the event that, for whatever reason, a Unitholder’s holding of Units is less than such minimum holding for that Class, the Manager may give notice requiring such Unitholder to submit a redemption request in respect of all the Units of that Unlisted Class of Units held by that Unitholder or deem such request to have been made in respect of all Units of the relevant Unlisted Class of Units held by the Unitholder."
