sentence_id,text
0,"IMPORTANT: If you are in any doubt about the contents of this Prospectus, you should consult your stockbroker, bank manager, solicitor, accountant or other financial adviser for independent professional financial advice."
1,Investors should note that this Prospectus relates to a Sub-Fund which offers both exchange-traded class of Units and unlisted (not exchange-traded) class(es) of Units.
2,CHINAAMC GLOBAL ETF SERIES II (a Hong Kong umbrella unit trust authorised under Section 104 of the Securities and Futures Ordinance (Cap.
3,"571) of Hong Kong) ChinaAMC Asia USD Investment Grade Bond ETF HKD Counter Stock Code: 3141 USD Counter Stock Code: 9141 ChinaAMC Asia High Dividend ETF Stock Code: 3145 ChinaAMC MSCI Japan Hedged to USD ETF Stock Code: 3160 ChinaAMC MSCI Europe Quality Hedged to USD ETF Stock Code: 3165 ChinaAMC NASDAQ 100 ETF HKD Counter Stock Code: 3086 USD Counter Stock Code: 9086 PROSPECTUS Manager China Asset Management (Hong Kong) Limited Investment Delegate Mackenzie Financial Corporation 23 December 2024 Hong Kong Exchanges and Clearing Limited (“HKEX”), The Stock Exchange of Hong Kong Limited (the “SEHK”), Hong Kong Securities Clearing Company Limited (“HKSCC”) and the Hong Kong Securities and Futures Commission (the “SFC”) take no responsibility for the contents of this Prospectus, make no representation as to its accuracy or completeness and expressly disclaim any liability whatsoever for any loss howsoever arising from or in reliance upon the whole or any part of the contents of this Prospectus."
4,The Trust and the Sub-Funds have each been authorised as collective investment schemes by the SFC.
5,SFC authorisation is not a recommendation or endorsement of a scheme nor does it guarantee the commercial merits of a scheme or its performance.
6,It does not mean the scheme is suitable for all investors nor is it an endorsement of its suitability for any particular investor or class of investors.
7,"i IMPORTANT INFORMATION This Prospectus relates to the offer in Hong Kong of units (the “Units”) in the ChinaAMC Global ETF Series II (the “Trust”), an umbrella unit trust established under Hong Kong law by a trust deed dated 17 October 2014, as amended, supplemented and restated from time to time (the “Trust Deed”)."
8,The Trust Deed was entered into between BMO Global Asset Management (Asia) Limited and Cititrust Limited on 17 October 2014.
9,"Pursuant to a Deed of Retirement and Appointment dated 3 June 2019, State Street Trust (HK) Limited (the “Trustee”) is appointed as the trustee in place of Cititrust Limited with effect from 25 November 2019."
10,"Pursuant to a Deed of Retirement and Appointment dated 7 April 2021, China Asset Management (Hong Kong) Limited (the “Manager”) is appointed as the manager in place of BMO Global Asset Management (Asia) Limited with effect from 28 May 2021."
11,The Trust currently has a number of sub-funds (the “Sub-Funds” or individually a “Sub-Fund”).
12,The Trust may establish sub-funds in respect of which a separate class or classes of Units will be issued.
13,The Sub- Fund issues both exchange-traded classes of Units (“Listed Class of Units”) and/or unlisted (not exchange-traded) classes of Units (“Unlisted Class(es) of Units”).
14,The information contained in this Prospectus has been prepared to assist potential investors in making an informed decision in relation to investing in the Sub-Funds.
15,It contains important facts about the Sub-Funds whose Units are offered in accordance with this Prospectus.
16,"As the Sub-Fund issues both Listed Class of Units and Unlisted Class(es) of Units, a separate set of product key facts statement which contains the key features and risks of each of the Sub-Funds is also issued for the Listed Class of Units and Unlisted Class(es) of Units respectively by the Manager and such product key facts statements shall form part of this Prospectus, and shall be read, in conjunction with, this Prospectus."
17,"The Manager accepts full responsibility for the accuracy of the information contained in this Prospectus and the product key facts statements and confirms, having made all reasonable enquiries, that to the best of its knowledge and belief there are no other facts the omission of which would make any statement misleading."
18,"The Manager also confirms that this Prospectus includes particulars given in compliance with (in respect of the Listed Class of Units only) the Rules Governing the Listing of Securities on the Stock Exchange of Hong Kong Limited and the Code on Unit Trusts and Mutual Funds (the “Code”) and the “Overarching Principles” of the SFC Handbook for Unit Trusts and Mutual Funds, Investment- Linked Assurance Schemes and Unlisted Structured Investment Products for the purposes of giving information with regard to the Units of the Sub-Funds."
19,"The Trustee is not responsible for the preparation of this Prospectus and shall not be held liable to any person for any information disclosed in this Prospectus, except for the information regarding the Trustee itself under the paragraph headed “The Trustee” in the section on “Management and Administration of the Trust”."
20,Each Sub-Fund is a fund falling within Chapter 8.6 of the Code.
21,The Trust and each Sub-Fund are authorized by the SFC in Hong Kong under Section 104 of the Securities and Futures Ordinance.
22,"The SFC takes no responsibility for the financial soundness of the Trust, the Sub-Funds or for the correctness of any statements made or opinions expressed in this Prospectus."
23,SFC authorisation is not a recommendation or endorsement of a scheme nor does it guarantee the commercial merits of a scheme or its performance.
24,It does not mean the scheme is suitable for all investors nor is it an endorsement of its suitability for any particular investor or class of investors.
25,"You should consult your financial adviser, consult your tax advisers and take legal advice as appropriate as to whether any governmental or other consents are required, or other formalities need to be observed, to enable you to acquire Units as to whether any taxation effects, foreign exchange restrictions or exchange control requirements are applicable and to determine whether any investment in a Sub-Fund is appropriate for you."
26,"The Listing Committee of The Stock Exchange of Hong Kong Limited (the “SEHK”) has accepted the application for the listing of, and permission to deal in the Units of the Sub-Funds."
27,Dealings in the Units of the Sub-Funds on the SEHK have already commenced.
28,"The Units of the Sub-Funds have been accepted as eligible securities by Hong Kong Securities Clearing Company Limited (“HKSCC”) for deposit, clearance and settlement in the Central Clearing and Settlement System (“CCASS”)."
29,Settlement of transactions between participants of the SEHK is required to take place in CCASS on the second CCASS Settlement Day after any trading day.
30,All activities under CCASS are subject to the General Rules of HKSCC and HKSCC Operational Procedures in effect from time to time.
31,"No action has been taken to permit an offering of Units or the distribution of this Prospectus in any jurisdiction other than Hong Kong and, accordingly, this Prospectus does not constitute an offer or solicitation to anyone in any jurisdiction in which such offer is not authorized or to any person to whom it is unlawful to make such offer or solicitation."
32,"The Units have not been, and will not be, registered under the United States Securities Act of 1933, as amended (the “US Securities Act”) or any other United States Federal or State law and, except in a transaction which does not violate the US Securities Act, may not be directly or indirectly offered to or sold in the United States of America or any of its territories or for the benefit of a US Person (as defined in Regulation S of the US Securities Act)."
33,"The Trust and the Sub-Funds have not been and will not be registered as an investment company under the United States Investment Company Act of 1940, as amended."
34,"Units may not be acquired or owned by (i) an employee benefit plan, as defined in ii Section 3(3) of the Employee Retirement Income Security Act of 1974, as amended (“ERISA”), that is subject to Title I of ERISA, (ii) a plan, as defined in Section 4975(e)(1) of the US Internal Revenue Code of 1986, as amended (the “Internal Revenue Code”), that is subject to Section 4975 of the Internal Revenue Code, (iii) a plan that is subject to any other law, regulation, rule or restriction that is substantially similar to ERISA or Section 4975 of the Internal Revenue Code (“Similar Law”) or (iv) an entity whose assets are deemed to include the assets of such an employee benefit plan or plan for purposes of ERISA, Section 4975 of the Internal Revenue Code or Similar Law, unless the purchase, holding and disposition of units will not constitute a violation under ERISA, Section 4975 of the Internal Revenue Code and any applicable Similar Law."
35,"Furthermore, distribution of this Prospectus (including the product key facts statements) shall not be permitted unless it is accompanied by a copy of the latest annual financial statements of the Sub-Funds (where existing) and, if later, its most recent interim report."
36,"You should note that any amendment or addendum to this Prospectus will only be posted on the Manager’s website ( www.chinaamc.com.hk) the contents of which, and of any other websites referred to in this Prospectus (including the product key facts statements), have not been reviewed by the SFC."
37,This Prospectus may refer to information and materials included in websites.
38,Such information and materials do not form part of this Prospectus and they have not been reviewed by the SFC or any regulatory body.
39,Investors should note that the information provided in websites may be updated and changed periodically without any notice to any person.
40,Questions and Complaints Investors may raise any questions on or make any complaints about the Trust (including the Sub-Funds) by contacting the Manager at its address as set out in the Directory of this Prospectus or calling the Manager on 3406 8686 during normal office hours.
41,"iii DIRECTORY Manager China Asset Management (Hong Kong) Limited 37/F, Bank of China Tower 1 Garden Road Central Hong Kong Trustee State Street Trust (HK) Limited 68/F Two International Finance Centre 8 Finance Street Central Hong Kong Administrator and Custodian State Street Bank and Trust Company 68/F, Two International Finance Centre 8 Finance Street Central Hong Kong Investment Delegate Mackenzie Financial Corporation 180 Queen Street West Toronto, Ontario M5V-3K1 Canada Registrar (in respect of Listed Class of Units only) Tricor Investor Services Limited Level 54, Hopewell Centre 183 Queen’s Road East Hong Kong Transfer Agent (in respect of Unlisted Class(es) of Units only) State Street Bank and Trust Company 68/F, Two International Finance Centre 8 Finance Street Central Hong Kong Participating Dealers and PD Agents*# Please refer to the relevant Appendix of each Sub-Fund Market Makers*# Please refer to the relevant Appendix of each Sub-Fund Legal Counsel to the Manager Simmons & Simmons 30/F, One Taikoo Place 979 King’s Road Hong Kong Auditor KPMG 8/F Prince’s Building 10 Chater Road Central Hong Kong Service Agent# HK Conversion Agency Services Limited 1/F, One & Two Exchange Square 8 Connaught Place Central Hong Kong * Please refer to the Manager’s website for the latest lists of Market Makers, Participating Dealers and PD Agents."
42,Please also refer to the Hong Kong Exchanges and Clearing Limited’s website at www.hkex.com.hk for the latest list of Market Makers.
43,# Applicable in respect of Listed Class of Units only.
44,"iv CONTENTS PART 1 – GENERAL INFORMATION RELATING TO THE TRUST AND SUB-FUNDS 1 INTRODUCTION 10 INVESTMENT OBJECTIVE, INVESTMENT STRATEGY, INVESTMENT RESTRICTIONS, SECURITIES LENDING AND BORROWING 11 DETERMINATION OF NET ASSET VALUE 13 FEES AND EXPENSES 15 RISK FACTORS 19 MANAGEMENT AND ADMINISTRATION OF THE TRUST 31 STATUTORY AND GENERAL INFORMATION 39 HONG KONG TAXATION 47 SCHEDULE 1 - INVESTMENT RESTRICTIONS 51 SCHEDULE 2 – PROVISIONS RELATING TO THE OFFER, CREATION, REDEMPTION, LISTING AND TRADING OF THE LISTED CLASS OF UNITS 63 SCHEDULE 3 – PROVISIONS RELATING TO THE OFFER, SUBSCRIPTION, CONVERSION AND REDEMPTION OF THE UNLISTED CLASS(ES) OF UNITS 84 PART 2 – SPECIFIC INFORMATION RELATING TO EACH SUB-FUND 96 APPENDIX 1: CHINAAMC ASIA USD INVESTMENT GRADE BOND ETF 97 APPENDIX 2: CHINAAMC ASIA HIGH DIVIDEND ETF 116 APPENDIX 3: CHINAAMC MSCI JAPAN HEDGED TO USD ETF 131 APPENDIX 4: CHINAAMC MSCI EUROPE QUALITY HEDGED TO USD ETF 148 APPENDIX 5: CHINAAMC NASDAQ 100 ETF 165 1 PART 1 – GENERAL INFORMATION RELATING TO THE TRUST AND SUB-FUNDS Part 1 of this Prospectus includes information relevant to the Trust and all Sub-Funds established under the Trust."
45,The information presented in this Part 1 should be read in conjunction with the information presented in the relevant Appendix in Part 2 of this Prospectus in respect of a particular Sub-Fund.
46,"Where the information in Part 2 of this Prospectus conflicts with the information presented in this Part 1, the information in the relevant Appendix in Part 2 prevails, however, it is applicable to the specific Sub-Fund of the relevant Appendix only."
47,Please refer to Part 2 “Specific Information Relating to Each Sub-Fund” for further information.
48,"2 DEFINITIONS In this Prospectus (including the relevant Appendix for any Sub-Fund), unless the context requires otherwise, the following expressions have the meanings set out below."
49,"Other capitalised terms used, but not defined, have the meaning given to those terms in the Trust Deed."
50,"“After Listing” means, in respect of Listed Class of Units, the period which commences on the Listing Date and continues until the Sub-Funds are terminated."
51,“Appendix” means an appendix to this Prospectus that sets out specific information applicable to a Sub-Fund.
52,"“Application” means, in respect of Listed Class of Units, an application by a Participating Dealer or PD Agent (as the case may be) for the creation or redemption of Units in accordance with the procedures for creation and redemption of Units set out in the Operating Guidelines, the relevant Participation Agreement and the terms of the Trust Deed."
53,"“Application Unit” means, in respect of Listed Class of Units, such number of Units of such class or whole multiples thereof as specified in this Prospectus or such other whole multiple of Units determined by the Manager, approved by the Trustee and notified to the Participating Dealers."
54,“Base Currency” means the currency of account of a Sub-Fund as specified in Part 2 of this Prospectus.
55,"“Business Day” in respect of the Sub-Funds, means, unless the Manager and the Trustee otherwise agree, a day on which (a)(i) the SEHK is open for normal trading; and (ii) the relevant securities market on which Securities comprised in the Index are traded is open for normal trading or if there are more than one such securities market, the securities market designated by the Manager is open for normal trading, and (b) the Index is compiled and published, or such other day or days as the Manager and the Trustee may agree from time to time provided that if on any such day, the period during which the relevant securities market is open for normal trading is reduced, such day shall not be a Business Day unless the Manager and the Trustee otherwise agree."
56,"“Cancellation Compensation” means, in respect of Listed Class of Units, an amount payable by a Participating Dealer for the account of the relevant Sub-Fund in respect of a Default, as set out in the Trust Deed and in the Operating Guidelines applicable at the time the relevant Creation Application or Redemption Application is made."
57,“CCASS” means the Central Clearing and Settlement System established and operated by HKSCC or any successor system operated by HKSCC or its successors.
58,“CCASS Settlement Day” means the term “Settlement Day” as defined in the General Rules of HKSCC.
59,"“Class Currency” means, in relation to a class of Units, the base currency of a Sub-Fund relating thereto or such other currency of account as the Manager may specify for such class of Units in accordance with the Trust Deed."
60,"“Code” means the Code on Unit Trusts and Mutual Funds issued by the SFC (as amended, or replaced, from time to time)."
61,"“Connected Person” has the meaning as set out in the Code which at the date of this Prospectus means in relation to a company: (a) any person or company beneficially owning, directly or indirectly, 20% or more of the ordinary share capital of that company or able to exercise directly or indirectly, 20% or more of the total votes in that company; or (b) any person or company controlled by a person who or which meets one or both of the descriptions given in (a); or 3 (c) any member of the group of which that company forms part; or (d) any director or officer of that company or of any of its connected persons as defined in (a), (b) or (c)."
62,“Conversion Agent” means HK Conversion Agency Services Limited or such other persons as may from time to time be appointed to act as conversion agent in relation to Listed Class of Units of a Sub-Fund.
63,"“Creation Application” means, in respect of Listed Class of Units, an application by a Participating Dealer or PD Agent (as the case may be) for the creation and issue of Units in an Application Unit size (or whole multiples thereof) in accordance with the Operating Guidelines and the Trust Deed."
64,"“Dealing Day” means each Business Day during the continuance of the Sub-Funds, and/or such other day or days as the Manager may from time to time determine with the approval of the Trustee."
65,"“Dealing Deadline” means, in relation to the Listed Class of Units and any particular place and any particular Dealing Day, the time on each Dealing Day specified in the “The Offering Phases” section of Schedule 2 to this Prospectus, or such other time or day as the Manager may from time to time with the written approval of the Trustee determine."
66,"“Default” means, in respect of Listed Class of Units, a failure by a Participating Dealer in respect of: (a) a Creation Application to deliver the relevant cash amount; or (b) a Redemption Application to deliver the Units the subject of the Redemption Application and/or relevant cash amount."
67,"“Deposited Property” means, in respect of a Sub-Fund, all the assets (including Income Property), received or receivable by the Trustee, for the time being held or deemed to be held upon the trusts of and subject to the Trust Deed for the account of the Sub-Fund but excluding (i) Income Property standing to the credit of the distribution account (other than interest earned thereon), and (ii) any other amount for the time being standing to the credit of the distribution account."
68,"“Dual Counter” means the facility by which the Listed Class of Units of a Sub-Fund traded in HKD and traded in USD are each assigned separate stock codes on the SEHK and are accepted for deposit, clearing and settlement in CCASS in more than one eligible currency (HKD or USD) as described in Part 2 of this Prospectus."
69,"“Duties and Charges” means, in relation to any particular transaction or dealing in respect of Listed Class of Units, all stamp and other duties, taxes, government charges, brokerage, bank charges, transfer fees, registration fees, transaction levies and other duties and charges whether in connection with the constitution of the Deposited Property or the increase or decrease of the Deposited Property or the creation, issue, transfer, cancellation or redemption of Units or the acquisition or disposal of Securities or otherwise which may have become or may be payable in respect of, and whether prior to, upon or after the occasion of, such transaction or dealing and including but not limited to, in relation to an issue of Units or redemption of Units, a charge (if any) of such amount or at such rate as is determined by the Manager or the Trustee to be made for the purpose of compensating or reimbursing the Trust for the difference between (a) the prices used when valuing the Securities in the Trust Fund for the purpose of such issue or redemption of Units and (b) (in the case of an issue of Units) the prices which would be used when acquiring the same Securities if they were acquired by the Trust with the amount of cash received by the Trust upon such issue of Units and (in the case of a redemption of Units) the prices which would be used when selling the same Securities if they were sold by the Trust in order to realise the amount of cash required to be paid out of the Trust Fund upon such redemption of Units."
70,"For the avoidance of doubt, when calculating subscription and redemption prices, duties and charges may include (if applicable) any provision for bid and ask spreads (to take into account the difference between the price at which assets were valued for the purpose of calculating the Net Asset Value and the estimated price at which such assets shall be bought as a result of a subscription or sold as a result of a redemption), but may not include (if applicable) any commission payable to agents on sales 4 and purchases of the Units or any commission, taxes, charges or costs which may have been taken into account in ascertaining the Net Asset Value of Units)."
71,"“Encumbrance” means any mortgage, charge, pledge, lien, third party right or interest, any other encumbrance or security interest of any kind or another type of preferential arrangement (including, without limitation, a title transfer or retention arrangement) having similar effect other than any such encumbrance or security interest imposed by the terms of the relevant clearing system/depositary or otherwise created by the terms of the Participation Agreement, the Trust Deed or any agreement between the Manager, the Trustee and the relevant Participating Dealer."
72,"“Extension Fee” means, in respect of Listed Class of Units, the fee payable to the Trustee on each occasion the Manager, upon a Participating Dealer’s request, grants the Participation Dealer an extended settlement in respect of a Creation Application or Redemption Application."
73,"“Government and other public securities” means any investment issued by, or the payment of principal and interest on, which is guaranteed by a government, or any fixed-interest investment issued by its public or local authorities or other multilateral agencies."
74,"“HKD” means Hong Kong dollars, the lawful currency of Hong Kong."
75,“HKEX” means Hong Kong Exchanges and Clearing Limited or its successors.
76,“HKSCC” means the Hong Kong Securities Clearing Company Limited or its successors.
77,“IFRS” means International Financial Reporting Standards.
78,"“Income Property” means, in respect of each Sub-Fund, (a) all interest, dividends and other sums deemed by the Manager (after consulting the auditors either on a general or case by case basis) to be in the nature of income (including taxation repayments, if any) received or receivable by the Trustee in respect of the Deposited Property of the relevant Sub-Fund (whether in cash or, without limitation, by warrant, cheque, money, credit or otherwise or the proceeds of sale or transfer of any Income Property received in a form other than cash); (b) all interest and other sums received or receivable by the Trustee in respect of (a), (c) or (d) of this definition; (c) all cash payments received or receivable by the Trustee for the account of the relevant Sub-Fund in respect of an Application; and (d) all Cancellation Compensation received by the Trustee for the account of the relevant Sub-Fund; (e) any payments to be received or are receivable by the Trustee under any contractual agreements in the nature of investments for the benefit of the relevant Sub-Fund but excluding (i) the Deposited Property; (ii) any amount for the time being standing to the credit of the distribution account for the account of the relevant Sub-Fund or previously distributed to Unitholders; (iii) gains for the account of the relevant Sub-Fund arising from the realisation of Securities; and (iv) any sums applied towards payment of the fees, costs and expenses payable by the Trust from the Income Property of the relevant Sub-Fund."
79,"“Index” means, in respect of a Sub-Fund, the index or benchmark against which the relevant Sub-Fund tracks, replicates or corresponds as set out in the relevant Appendix."
80,"“Index Provider” means, in respect of a Sub-Fund, the person responsible for compiling the Index against which the relevant Sub-Fund benchmarks its investments and who holds the right to licence the use of such Index to the relevant Sub-Fund as set out in the relevant Appendix."
81,"“Initial Issue Date” means, in respect of Listed Class of Units, the date of the first issue of Units, which shall be 3 Business Days before the Listing Date."
82,"“Initial Offer Period” means, in respect of each Sub-Fund or a class, such period as may be determined by the Manager as the initial offer period in relation to that Sub-Fund or class (as the case may be), which (in the case of Listed Class of Units) shall be the period before the relevant Listing Date as set out in the relevant Appendix."
