sentence_id,text
585,"Modification of the Trust Deed The Trustee and the Manager may agree to modify, alter or add to the provisions of the Trust Deed by supplemental deed provided that in the opinion of the Trustee and the Manager such modification, alteration or addition (i) does not materially prejudice the interests of Unitholders, does not operate to release to any material extent the Trustee or the Manager or any other person from any liability to the Unitholders and (with the exception of the costs incurred in connection with the relevant supplemental deed) does not increase the costs and charges payable out of the assets of the Sub-Funds or (ii) is necessary in order to make possible compliance with any fiscal, statutory, regulatory or official requirement (whether or not having the force of law) or (iii) is made to correct a manifest error."
586,"In all other cases, modifications, alterations and additions involving material changes require the sanction of an extraordinary resolution of the Unitholders affected or the approval of the SFC (but only to the extent such approval is required under the Code)."
587,The Manager will notify affected Unitholders of the amendments as soon as practicable after they are made if such notification is required under the Code.
588,"40 Name of the Trust and Sub-Funds Under the Trust Deed the Manager may, on notice to the Trustee, change the name of the Trust and the Sub-Funds."
589,Meetings of Unitholders Proxies may be appointed.
590,A Unitholder who is the holder of two or more Units may appoint more than one proxy to represent him and vote on his behalf at any meeting of the Unitholders.
591,"If a clearing house (or its nominee(s)), being a corporation, is a Unitholder, it may authorise such persons as it thinks fit to act as its representatives at any meeting of the Unitholders provided that, if more than one person is so authorised, the authorisation shall specify the number and class of Units in respect of which each such representative is so authorised."
592,"Each person so authorised shall be deemed to have been duly authorised without further evidence of the facts and shall be entitled to exercise the same rights and powers on behalf of the clearing house (or its nominee(s)) as if such person were the registered Unitholder of the Units held by the clearing house (or its nominee(s)), including the right to vote individually on a poll."
593,"Voting Rights Unitholders’ meetings may be convened by the Manager, by the Trustee or by Unitholders representing at least 10% of the value of the Units in issue, on not less than 21 days’ notice."
594,"These meetings may be used to modify the terms of the Trust Deed, including increasing the maximum fees payable to the service providers (including the Manager and the Trustee), removing the Manager or terminating the Sub-Funds at any time."
595,Such amendments to the Trust Deed must be considered by Unitholders of at least 25% of the Units in issue and passed by a 75% or more of the votes cast.
596,Other matters that require an ordinary resolution being passed would be considered by Unitholders of at least 10% of the Units in issue and passed by a simple majority of more than 50% of the votes cast.
597,The Trust Deed contains provisions for the holding of separate meetings of Unitholders holding Units of different classes where only the interests of Unitholders of such class are affected.
598,"Termination The Trust may be terminated by the Trustee if: (i) the Manager goes into liquidation or a receiver is appointed and not discharged within 60 days or (ii) in the opinion of the Trustee, the Manager is incapable of performing its duties satisfactorily or (iii) the Manager has failed to perform its duties satisfactorily or has, in the opinion of the Trustee, done something calculated to bring the Trust into disrepute or that is harmful to the interests of Unitholders or (iv) a law is passed that renders it illegal or in the opinion of the Trustee and the Manager, impracticable or inadvisable to continue the Trust or (v) the Trustee is unable to find an acceptable person to replace the Manager within 30 days after the removal of the Manager, or the person nominated shall fail to be approved by Extraordinary Resolution or (vi) if the Trustee notifies the Manager in writing of its intention to retire and no suitable person willing to act as trustee has been identified by the Manager within 60 days of the Trustee’s notice."
599,"The Manager may terminate the Trust if: (i) after one year from the date of the Trust Deed, the aggregate Net Asset Value of all the Units in each Sub-Fund is less than HKD100 million; (ii) any law or regulation is passed or amended or any regulatory directive or order is imposed that affects the Trust and which renders the Trust illegal or in the good faith opinion of the Manager, makes it impracticable or inadvisable to continue the Trust; or (iii) within a reasonable time and using commercially reasonable endeavours, the Manager is unable to find a person acceptable to act as the new trustee after deciding to remove the Trustee in accordance with the Trust Deed."
600,"41 The Manager may, in its absolute discretion, by notice in writing to the Trustee, terminate a Sub-Fund if: (i) after one year from the date of establishment of the Sub-Fund, the aggregate Net Asset Value of all the Units in the relevant Sub-Fund is less than HKD100 million; (ii) any law or regulation is passed or amended or any regulatory directive or order is imposed that affects the relevant Sub-Fund and which renders the relevant Sub-Fund illegal or in the good faith opinion of the Manager makes it impracticable or inadvisable to continue that Sub-Fund; (iii) its Index is no longer available for benchmarking or if the relevant Sub-Fund only has Listed Class of Units, and such Units of the relevant Sub-Fund are no longer listed on the SEHK or any such other stock exchange from time to time determined by the Manager; (iv) if the relevant Sub-Fund only has Listed Class of Units and if, at any time, the relevant Sub-Fund ceases to have any Participating Dealer; or (v) the Manager is unable to implement its investment strategy in respect of the relevant Sub- Fund."
601,"Further, the Unitholders may at any time authorise termination of the Trust or the relevant Sub-Funds by extraordinary resolution."
602,"The Trustee may, in its absolute discretion, by notice in writing to the Manager, terminate a Sub-Fund if: (i) the Trustee forms the opinion for good and sufficient reason that the Manager is incapable of performing its duties satisfactorily in respect of the relevant Sub-Fund; (ii) the Trustee forms the opinion for good and sufficient reason that the Manager has failed to perform its duties satisfactorily in respect of the relevant Sub-Fund or has done something calculated to bring the relevant Sub-Fund into disrepute or that is harmful to the interests of Unitholders of the relevant Sub-Funds; or (iii) any law or regulation is passed or amended or any regulatory directive or order is imposed that affects the relevant Sub-Fund and which renders the relevant Sub-Fund illegal or in the good faith opinion of the Trustee makes it impracticable or inadvisable to continue the relevant Sub-Fund."
603,Notice of the termination of the Trust or the Sub-Funds will be given to the Unitholders after the SFC has approved the notice.
604,"The notice will contain the reasons for the termination, the consequences to Unitholders of terminating the Trust or the Sub-Funds and the alternatives available to them, and any other information required by the Code."
605,"Any unclaimed proceeds or other cash held by the Trustee upon termination of the Trust or a Sub- Fund, as the case may be, may at the expiration of twelve months from the date upon which the same were payable be paid into court subject to the right of the Trustee to deduct therefrom any expenses it may incur in making such payment."
606,"Distribution Policy Listed Class of Units The Manager will adopt a distribution policy for each Sub-Fund as the Manager considers appropriate having regard to the Sub-Fund’s net income, fees and costs."
607,For each Sub-Fund this distribution policy (including the currency of such distribution) will be set out in the relevant Appendix.
608,"Distributions will always depend on payments on Securities held by the relevant Sub- Fund which will in turn depend on factors beyond the control of the Manager including, general economic conditions, and the financial position and distribution policies of the relevant underlying entities."
609,"Unless otherwise specified in the relevant Appendix, no distribution will be paid out of capital and/or effectively out of capital of the Sub-Fund."
610,There can be no assurance that such entities will declare or pay dividends or distributions.
611,"Unlisted Class of Units In relation to accumulation Unlisted Classes of Units, there will be no dividend distributions."
612,All interest and other income earned on investments will be accumulated and re-invested into the relevant Sub-Fund on behalf of the Unitholders of the accumulation Classes.
613,"In relation to distribution Unlisted Classes of Units, the Manager may make dividend distributions as set out in the relevant Appendix, subject to its discretion."
614,The Manager intends to distribute 42 income to Unitholders having regard to the relevant Sub-Fund’s net income after fees and costs.
615,Distributions (if any) will be paid from net income after deduction of all fees and costs and may be paid out of or effectively out of the capital of the Sub-Fund.
616,All Units of the distribution classes will receive distributions (if any) in the currency of the relevant distribution Unlisted Classes of Units.
617,The distribution policy of each Class may be amended subject to the SFC’s prior approval (if required) and upon giving not less than one month’s prior notice to Unitholders.
618,"For Listed Class of Units and distribution Unlisted Classes of Units, the composition of distributions payable on Units (i.e."
619,"the relative amounts of distributions paid and the percentages of dividends out of (i) net distributable income and (ii) capital), if any, for the last 12 months are available from the Manager on request and are also published on the website www.chinaamc.com.hk ."
620,Inspection of Documents Copies of the following documents in respect of each Sub-Fund are available for inspection free of charge at the offices of the Manager and copies thereof (other than (e) which is free of charge) may be obtained from the Manager at a cost of HKD150 per set of copy documents: (a) Trust Deed; (b) Registrar Agreement; (c) Service Agreement; (d) Participation Agreement(s); and (e) The most recent annual financial statements of the Trust and the Sub-Funds (if any) and the most recent interim financial statements of the Trust and the Sub-Funds (if any).
621,Part XV of the SFO Part XV of the SFO sets out the Hong Kong disclosure of interests’ regime applicable to Hong Kong listed companies.
622,The regime does not apply to unit trusts that are listed on the SEHK like the Trust.
623,"Consequently, Unitholders are not obliged to disclose their interest in the Sub-Fund."
624,"Anti-money Laundering Regulations As part of the Manager’s, the Trustee’s, the Administrator’s, the Registrar’s, the Transfer Agent’s and the Participating Dealer’s responsibility for the prevention of money laundering and to comply with all applicable laws to which the Manager, the Trustee, the Administrator, the Registrar, the Transfer Agent, the Sub-Funds or the relevant Participating Dealer is subject, the Manager, the Trustee, the Administrator, the Registrar, the Transfer Agent or the relevant Participating Dealer may require a detailed verification of an investor’s identity and the source of payment of any applications for Units."
625,"Depending on the circumstances of each application, a detailed verification might not be required where: (a) the investor makes the payment from an account held in the investor’s name at a recognised financial institution; or (b) the application is made through a recognised intermediary."
626,"These exceptions apply only if the financial institution or intermediary is within a country recognised by the Manager, the Trustee and the Registrar as having sufficient anti-money laundering regulations."
627,"43 Liquidity Risk Management The Manager has established a liquidity risk management policy which enables it to identify, monitor and manage the liquidity risks of the Sub-Funds and to ensure that the liquidity profile of the investments of the relevant Sub-Fund will facilitate compliance with such Sub-Fund’s obligation to meet redemption requests."
628,"Such policy, combined with the liquidity management tools of the Manager, also seeks to achieve fair treatment of Unitholders and safeguard the interests of remaining Unitholders in case of sizeable redemptions."
629,"The Manager’s liquidity risk management policy takes into account the investment strategy, the liquidity profile, the redemption policy, the dealing frequency, the ability to enforce redemption limitations and the fair valuation policies of the Sub-Funds."
630,These measures seek to ensure fair treatment and transparency for all investors.
631,"The liquidity risk management policy involves monitoring the profile of investments held by each Sub-Fund on an ongoing basis to ensure that such investments are appropriate to the redemption policy as set out in Schedule 2 and Schedule 3 respectively, and will facilitate compliance with each Sub-Fund’s obligation to meet redemption requests."
632,"Further, the liquidity risk management policy requires periodic stress testing to be carried out by the Manager to manage the liquidity risk of the Sub-Funds under normal and exceptional market conditions."
633,"As a liquidity risk management tool: - the Manager may limit the number of Units of a Sub-Fund redeemed on any Dealing Day to Units representing 10% (or such higher percentage as the Manager may determine in respect of the Sub-Fund) of the total number of Units in such a Sub-Fund then in issue, subject to the conditions as set out under “Deferred Redemption” in Schedule 2 and Schedule 3 respectively; - in respect to the Unlisted Class of Units only, the Manager may (if in its opinion in good faith it is in the best interest of Unitholders to do so), through swing pricing mechanism, adjust the Net Asset Value of such Units of the Unlisted Class of Units so as to ensure that investors of the Unlisted Class of Units will not be prejudiced in the event of substantial net subscriptions or net redemptions as further detailed in the section on “Anti-Dilution Pricing Adjustment” in Schedule 3."
634,Material Changes to an Index The SFC should be consulted on any events that may affect the acceptability of an Index.
635,Significant events relating to an Index will be notified to the Unitholders of the relevant Sub-Fund as soon as practicable.
636,"These may include a change in the methodology/rules for compiling or calculating the Index, or a change in the objective or characteristics of the Index."
637,"Replacement of an Index The Manager reserves the right, with the prior approval of the SFC and provided that in its opinion the interests of the Unitholders of the relevant Sub-Fund would not be adversely affected, to replace an Index with another index in accordance with the provision of the Code and the Trust Deed."
638,"The circumstances under which any such replacement might occur include but are not limited to the following events: (a) the relevant Index ceasing to exist; (b) the licence to use the Index being terminated; (c) a new index becoming available that supersedes the existing Index; (d) a new index becoming available that is regarded as the market standard for investors in the particular market and/or would be regarded as more beneficial to the Unitholders than the existing Index; 44 (e) investing in the Securities comprised within the Index becomes difficult; (f) the Index Provider increasing its licence fees to a level considered too high by the Manager; (g) the quality (including accuracy and availability of the data) of the Index having in the opinion of the Manager, deteriorated; (h) a significant modification of the formula or calculation method of the Index rendering that index unacceptable in the opinion of the Manager; and (i) the instruments and techniques used for efficient portfolio management not being available."
639,The Manager may change the name of the Sub-Fund if the relevant Index changes or for any other reasons including if licence to use the Index is terminated.
640,Any change to (i) the use by the relevant Sub-Fund of the Index and/or (ii) the name of the relevant Sub-Fund will be notified to investors.
641,"Information Available on the Internet The Manager will publish important news and information with respect to each Sub-Fund (including in respect of the relevant Index), in the English and Chinese languages (unless otherwise specified), on the Manager’s website at www.chinaamc.com.hk (which has not been reviewed or approved by the SFC) including: (a) this Prospectus and the product key facts statements in respect of the Sub-Funds (as revised from time to time)."
642,"Investors should note that where a Sub-Fund offers both Listed Class of Units and Unlisted Class(es) of Units to Hong Kong investors, separate sets of product key facts statement will be available for the Listed Class of Units and the Unlisted Class(es) of Units of the same Sub-Fund respectively; (b) the latest annual audited accounts and interim half yearly unaudited report (in English only); (c) any notices for material alterations or additions to this Prospectus or the Sub-Fund’s constitutive documents; (d) any public announcements and notices made by the Sub-Funds, including information with regard to the Sub-Funds and Index, notices of the suspension of the calculation of the Net Asset Value, changes in fees and, in respect of Listed Class of Units, the suspension and resumption of trading; (e) (in respect of Listed Class of Units only) the real time or near-real time indicative Net Asset Value per Unit updated every 15 seconds during trading hours throughout each Dealing Day in HKD (where a Dual Counter has been adopted for a Sub-Fund, in HKD and USD, and where a Multi-Counter has been adopted for a Sub-Fund, in HKD, USD and RMB); (f) (in respect of Listed Class of Units only) the last Net Asset Value of each Sub-Fund in HKD and, the last Net Asset Value per Unit of each Sub-Fund (updated on a daily basis) in HKD (where a Dual Counter has been adopted for a Sub-Fund, in HKD and USD, and where a Multi-Counter has been adopted for a Sub-Fund, in HKD, USD and RMB); (g) the full holdings of the Sub-Funds (updated on a daily basis unless otherwise specified in the relevant Appendix); (h) (in respect of Listed Class of Units only) the latest list of the Participating Dealers and Market Makers; 45 (i) if applicable to the Sub-Fund, the composition of distributions (i.e."
643,"the relative amounts paid out of (i) net distributable income, and (ii) capital), if any, for a 12-month rolling period; and (j) if a Sub-Fund’s net derivative exposure exceeds 50% of its total Net Asset Value or if securities financing transactions undertaken by a Sub-Fund exceed 50% of its total Net Asset Value, information on financial derivative instruments acquired by or securities financing transactions undertaken by the Sub-Fund (such as counterparty exposure and collateral information)."
644,In respect of Listed Class of Units of the Sub-Fund: Real-time updates about the Index can be obtained through other financial data vendors.
645,"It is your own responsibility to obtain additional and the latest updated information about the Index (including without limitation, a description of the way in which the Index is calculated, any change in the composition of the Index, any change in the method for compiling and calculating the Index) via the Manager’s website and the Index Provider’s website (neither of which, nor any other website referred to in this Prospectus, has been reviewed by the SFC)."
646,Please refer to the section on “Website Information” for the warning and the disclaimer regarding information contained in such website.
647,In respect of a Sub-Fund where a Dual Counter has been adopted for its Listed Class of Units: (a) the near-real time indicative Net Asset Value per Unit in USD is indicative and for reference purposes only.
648,"The near-real time indicative Net Asset Value per Unit in USD is calculated by ICE Data Indices, LLC using the near-real time indicative Net Asset Value per Unit in HKD multiplied by the real time USD:HKD foreign exchange rate."
649,This is updated during SEHK trading hours when the SEHK is opened for trading.
650,(b) the last Net Asset Value per Unit in USD is indicative and for reference purposes only and is calculated using the last Net Asset Value per Unit in HKD multiplied by an assumed foreign exchange rate using the USD:HKD exchange rate quoted by WM Reuters at 4:00 p.m.
651,(London time)* as of the same Dealing Day.
652,In respect of a Sub-Fund where a Multi-Counter has been adopted for its Listed Class of Units: (c) the near-real time indicative Net Asset Value per Unit in USD and RMB is indicative and for reference purposes only.
653,"The near-real time indicative Net Asset Value per Unit in USD and RMB is calculated by ICE Data Indices, LLC using the near-real time indicative Net Asset Value per Unit in HKD multiplied by the real time USD:HKD and RMB(CNH):HKD foreign exchange rates."
654,This is updated during SEHK trading hours when the SEHK is opened for trading.
655,(d) the last Net Asset Value per Unit in USD and RMB is indicative and for reference purposes only and is calculated using the last Net Asset Value per Unit in HKD multiplied by an assumed foreign exchange rate using the USD:HKD or RMB(CNH):HKD exchange rate quoted by WM Reuters at 4:00 p.m.
656,(London time)* as of the same Dealing Day.
657,*Please note 4:00 p.m.
658,(London time) (i) during British Summer Time is equivalent to 11:00 p.m.
659,Hong Kong time and (ii) otherwise is equivalent to 12:00 a.m.
660,Hong Kong time on the next day.
661,"Notices All notices and communications to the Manager and Trustee should be made in writing and sent to the following addresses: Manager Trustee 46 China Asset Management (Hong Kong) Limited 37/F, Bank of China Tower 1 Garden Road Central Hong Kong State Street Trust (HK) Limited 68/F, Two International Finance Centre 8 Finance Street Central Hong Kong Website information The offer of the Units is made solely on the basis of information contained in this Prospectus."
662,All references in this Prospectus to other websites and sources where further information may be obtained are merely intended to assist you to access further information relating to the subject matter indicated and such information does not form part of this Prospectus.
663,"None of the Manager or the Trustee accepts any responsibility for ensuring that the information contained in such other websites and sources, if available, is accurate, complete and/or up-to-date, and no liability is accepted by the Manager and the Trustee in relation to any person’s use of or reliance on the information contained in these other websites and sources save, in respect of the Manager, its website www.chinaamc.com.hk (the contents of which and of other websites referred to in this Prospectus have not been reviewed by the SFC)."
664,The information and materials included in these websites have not been reviewed by the SFC or any regulatory body.
665,You should exercise an appropriate degree of caution when assessing the value of such information.
666,"47 HONG KONG TAXATION The following summary of Hong Kong taxation is of a general nature, for information purposes only, and is not intended to be an exhaustive list of all of the tax considerations that may be relevant to a decision to purchase, own, redeem or otherwise dispose of Units."
667,This summary does not constitute legal or tax advice and does not purport to deal with the tax consequences applicable to all categories of investors.
668,"Prospective investors should consult their own professional advisers as to the implications of their subscribing for, purchasing, holding, redeeming or disposing of Units both under the laws and practice of Hong Kong and the laws and practice of their respective jurisdictions."
669,The information below is based on the law and practice in force in Hong Kong at the date of this Prospectus.
670,"The relevant laws, rules and practice relating to tax are subject to change and amendment (and such changes may be made on a retrospective basis)."
671,"As such, there can be no guarantee that the summary provided below will continue to be applicable after the date of this Prospectus."
672,"Furthermore, tax laws can be subject to different interpretations and no assurance can be given that relevant tax authorities will not take a contrary position to the tax treatments described below."
673,"Investors should refer to additional summaries of applicable taxation, where appropriate, as set out in the Appendix relevant to a Sub-Fund."
674,"Taxation of the Trust and Sub-Funds Profits Tax As the Trust and the Sub-Funds have been authorised as a collective investment scheme by the SFC under Section 104 of the SFO, profits of the Trust and the Sub-Funds are exempt from Hong Kong profits tax under Section 26A(1A)(a)(i) of the Inland Revenue Ordinance."
675,"Stamp Duty Hong Kong stamp duty is ordinarily payable, inter alia, on the sale or purchase of Hong Kong stock."
