sentence_id,text
1559,"In relation to distribution Unlisted Classes of Units, the Manager currently intends to distribute income to unitholders at least semi-annually (usually in March and September of each year)."
1560,The Manager intends to distribute income to Unitholders having regard to the Sub-Fund’s net income after fees and costs.
1561,Distributions (if any) will be paid from net income after deduction of all fees and costs and may be paid out of or effectively out of the capital of the Sub-Fund at the Manager’s discretion.
1562,All Units of the distribution Classes will receive distributions (if any) in the currency of the relevant distribution Unlisted Classes of Units.
1563,The distribution policy of each class may be amended subject to the SFC’s prior approval (if required) and upon giving not less than one month’s prior notice to Unitholders.
1564,"For Listed Class of Units and distribution Unlisted Classes of Units, the composition of distributions payable on Units (i.e."
1565,"the relative amounts of distributions paid and the percentages of dividends out of (i) net distributable income and (ii) capital), if any, for the last 12 months are available from the Manager on request and are also published on the website www.chinaamc.com.hk ."
1566,The Index This section is a brief overview of the Index.
1567,It contains a summary of the principal features of the Index and is not a complete description of the Index.
1568,"As at the date of this Prospectus, the summary of the Index in this section is accurate and consistent with the complete description of the Index."
1569,Complete information on the Index appears in the website identified below.
1570,Such information may change from time to time and details of the changes will appear on that website.
1571,"General Information on the Index The Index is a float adjusted modified market capitalisation weighted index comprising accepted securities with at least three consecutive years of increasing annual regular dividend payments from a universe of components that are determined to be Hong Kong, Singapore, mainland 126 China, India, Indonesia, Korea, Malaysia, the Philippines, Taiwan and Thailand."
1572,"To be eligible for inclusion in the Index, a security must meet the following additional criteria: (a) it must have a minimum float adjusted market capitalisation of USD200 million; (b) it must have a minimum three-month average daily dollar trading value of USD500,000; (c) it must have at least three consecutive years of increasing annual regular dividend based on ex-date; (d) it must have a Dividend Sustainability score greater than 80 as calculated by NASDAQ OMX Group, Inc.; (e) it must rank within the top 70% of components by yield of the total constituents at time of review, or within the top 80% of components by yield at time of review if they were in the Index in the prior period; (f) it must be included in the NASDAQ Asia Pacific Ex-Japan Index; (g) it must not be classified as New Zealand or Australia by NASDAQ OMX Group, Inc.; (h) it must not be classified as a “B” share if a security is classified as mainland China by NASDAQ OMX Group, Inc.; (i) it must not be classified as real estate investment trust by the Industry Classification Benchmark (ICB); (j) it may not have entered into a definitive agreement or other arrangement which would likely result in the security no longer being Index eligible; (k) it may not be issued by an issuer currently in bankruptcy proceedings; (l) it must not have met foreign ownership restriction limitations; and (m) if an issuer has multiple securities, the security with the highest three-month average daily dollar trading volume."
1573,The Index securities are evaluated annually in March.
1574,The above eligibility criteria are applied using market data through the end of December.
1575,Securities meeting the eligibility criteria and are in the top 70% by yield are included in the Index.
1576,Index securities which are already included in the Index and rank within the top 80% by yield are also retained in the Index and those Index Securities which meet all eligibility rules but are outside the top 80% by yield are removed from the Index.
1577,Security additions and deletions are made effective after the close of trading on the third Friday in March.
1578,"If at any time during the year, an Index security no longer meets the eligibility criteria or is otherwise determined to have become ineligible for inclusion in the Index, the security is removed from the Index and is not replaced."
1579,"Additionally, at each month-end, if an Index security suspends its dividend payments based on the prior ex-date of the last dividend distributed, then the Index security will be removed from the Index after the close of trading on the third Friday of the following month."
1580,"In all cases, a security is removed from the Index at its last sale price."
1581,"If, however, at the time of its removal the Index security is halted from trading on its primary listing market and an official closing price cannot readily be determined, the Index security may, in NASDAQ OMX’s discretion, be removed at a zero price."
1582,"The zero price will be applied to the Index security after the close of the market but prior to the time the official closing value of the Index is disseminated, which is ordinarily 17:16:00 ET."
1583,"To ensure that the Index is well diversified, the index methodologies provide, amongst other things, that: 127 (i) no single country can have a weighting greater than 40% of the total market capitalisation of the Index; (ii) no single stock can have a weighting of more than 8% of the total market capitalisation of the Index; (iii) no country can have more than two securities in excess of 4% of the total market capitalisation of the Index; (iv) the maximum number of securities in excess of 4% of the total market capitalisation of the Index is five; and (v) the aggregate weight of securities listed on exchanges not approved by MPFA is no greater than 10%."
1584,The Index is a total return net index.
1585,A total return net index calculates the performance of the index constituents on the basis that any dividends or distributions are reinvested after the deduction of any taxes that may apply.
1586,"The Index was launched on 13 January 2014 and had a base level of 1,000."
1587,"As at 13 December 2024, the Index had a total market capitalisation of HKD 7.51 trillion and 138 constituents out of the eligible Asian markets defined by the Index."
1588,The Index is denominated in HKD.
1589,"The Manager (and each of its Connected Persons) is independent of The NASDAQ OMX Group, Inc., the Index Provider."
1590,Index Calculation The Index is a float adjusted modified market capitalisation weighted index.
1591,"The value of the Index equals the aggregate value of the Index share weights, also known as the Index Shares, of each of the Index securities multiplied by each such security’s last sale price, and divided by the divisor of the Index."
1592,The divisor serves the purpose of scaling such aggregate value to a lower order of magnitude which is more desirable for Index reporting purposes.
1593,The formula for index value is as follows: Aggregate Adjusted Market Value/Divisor The formula for the divisor is as follows: (Market Value after Adjustments/Market Value before Adjustments) X Divisor before Adjustments The Index reflects extraordinary cash distributions.
1594,"The modified market capitalisation weighted methodology is applied to the capitalisation of each Index Security, using the last sale price of the security at the close of trading on the last trading day in February, May, August and November."
1595,Index shares are then calculated multiplying the weight of the security derived above by the new market value of the Index and dividing the float adjusted modified market capitalisation for each Index security by its corresponding last sale price.
1596,"The changes are made effective after the close of trading on the third Friday in March, June, September and December."
1597,Index Periodical Review The constituents of the Index are rebalanced quarterly.
1598,"Index Constituents 128 You can obtain the most updated list of the constituents of the Index together with their respective weightings and additional information of the Index including the index methodology and the closing level of the Index from the website of The NASDAQ OMX Group, Inc."
1599,at https://www.nasdaq.com/solutions/nasdaq-global-index-policies.
1600,This website has not been reviewed by the SFC.
1601,Please refer to the Manager’s website for the latest hyperlink for the Index.
1602,"Index Code Bloomberg Code: DAAXJPHN Index Provider Disclaimer The Sub-Fund is not sponsored, endorsed, sold or promoted by The NASDAQ OMX Group, Inc."
1603,"or its affiliates (NASDAQ OMX, with its affiliates, are referred to as the “Corporations”)."
1604,"The Corporations have not passed on the legality or suitability of, or the accuracy or adequacy of descriptions and disclosures relating to, the Sub-Fund."
1605,"The Corporations make no representation or warranty, express or implied to the owners of the Sub-Fund or any member of the public regarding the advisability of investing in securities generally or in the Sub-Fund particularly, or the ability of the NASDAQ Asia ex Japan Dividend Achievers TM Index to track general stock market performance."
1606,"The Corporations’ only relationship to China Asset Management (Hong Kong) Limited (“Licensee”) is in the licensing of the NASDAQ®, OMX®, NASDAQ Asia ex Japan Dividend Achievers TM Index trade/service marks, and certain trade names of the Corporations and the use of the NASDAQ Asia ex Japan Dividend Achievers TM Index which is determined, composed and calculated without regard to Licensee or the Sub-Fund."
1607,"NASDAQ OMX has no obligation to take the needs of the Licensee or the owners of the Sub-Fund into consideration in determining, composing or calculating the NASDAQ Asia ex Japan Dividend AchieversTM Index."
1608,"The Corporations are not responsible for and have not participated in the determination of the timing of, prices at, or quantities of the Sub-Fund to be issued or in the determination or calculation of the equation by which the Sub-Fund is to be converted into cash."
1609,"The Corporations have no liability in connection with the administration, marketing or trading of the Sub-Fund."
1610,THE CORPORATIONS DO NOT GUARANTEE THE ACCURACY AND/OR UNINTERRUPTED CALCULATION OF THE NASDAQ ASIA EX JAPAN DIVIDEND ACHIEVERS TM INDEX OR ANY DATA INCLUDED THEREIN.
1611,"THE CORPORATIONS MAKE NO WARRANTY , EXPRESS OR IMPLIED, AS TO RESULTS TO BE OBTAINED BY LICENSEE, OWNERS OF THE SUB-FUND, OR ANY OTHER PERSON OR ENTITY FROM THE USE OF THE NASDAQ ASIA EX JAPAN DIVIDEND ACHIEVERSTM INDEX OR ANY DATA INCLUDED THEREIN."
1612,"THE CORPORATIONS MAKE NO EXPRESS OR IMPLIED WARRANTIES, AND EXPRESSLY DISCLAIM ALL WARRANTIES OF MERCHANTABILITY OR FITNESS FOR A PARTICULAR PURPOSE OR USE WITH RESPECT TO THE NASDAQ ASIA EX JAPAN DIVIDEND ACHIEVERS TM INDEX OR ANY DATA INCLUDED THEREIN."
1613,"WITHOUT LIMITING ANY OF THE FOREGOING, IN NO EVENT SHALL THE CORPORATIONS HAVE ANY LIABILITY FOR ANY LOST PROFITS OR SPECIAL, INCIDENTAL, PUNITIVE, INDIRECT, OR CONSEQUENTIAL DAMAGES, EVEN IF NOTIFIED OF THE POSSIBILITY OF SUCH DAMAGES."
1614,Index Licence Agreement The initial term of the licence of the Index commenced on 28 May 2014 and will continue for one year.
1615,"After the expiration of the initial one year term, the licence should be automatically renewed for successive terms of one year unless either party to the licence agreement gives at least 90 days’ notice of termination prior to the end of the then current term to the other party."
1616,The licence agreement (as novated and amended from time to time) may otherwise be terminated in accordance with the provisions of the licence agreement.
1617,"Risks Factors Specific to the Sub-Fund In addition to the risk factors presented in Part 1 of this Prospectus, the risk factors set forth below 129 are also specific risks, in the opinion of the Manager, considered to be relevant and presently applicable specifically to the Sub-Fund."
1618,High Dividend Yield Securities Risk.
1619,The Sub-Fund invests in high dividend yield securities which may offer a higher rate of dividend yield.
1620,"However, high dividend yield securities are subject to risks that the dividend could be reduced or abolished, or the risks that the value of the securities could decline or have lower-than average potential for price appreciation."
1621,Risks Associated with FDIs.
1622,"A FDI is a financial contract or instrument the value of which depends on, or is derived from, the value of an underlying asset such as a Security or an index and may have a high degree of price variability and is subject to occasional rapid and substantial changes."
1623,"Compared to conventional Securities, FDIs can be more sensitive to changes in interest rates or to sudden fluctuations in market prices due to both the low margin deposits required, and the extremely high degree of leverage involved in their pricing."
1624,"As a result, a relatively small price movement in a FDI may result in immediate and substantial loss (or gain) to the Sub-Fund."
1625,The losses of the Sub-Fund may be greater if it invests in FDIs than if it invests only in conventional Securities.
1626,There may also be no active market in FDIs and therefore investment in FDIs can be illiquid.
1627,"In order to meet redemption requests, the Sub-Fund may rely upon the issuer of the FDIs to quote a price to unwind any part of the FDIs that will reflect the market liquidity conditions and the size of the transaction."
1628,"In addition, many FDIs are not traded on exchanges."
1629,"As a result, if the Sub-Fund engages in transactions involving FDIs, it will be subject to the risk of inability or refusal to perform such contracts by the counterparties with which the Sub-Fund trades, and as such the Sub-Fund may suffer a total loss of the Sub-Fund interest in the FDIs."
1630,This risk is also aggregated by the fact that over-the-counter derivatives markets are generally not regulated by government authorities and participants in these markets are not required to make continuous markets in the contracts they trade.
1631,An investment in the FDIs does not entitle the FDIs holder to the beneficial interest in the shares nor to make any claim against the company issuing the shares.
1632,There can be no assurance that the price of the FDIs will equal the underlying value of the company or securities market that it may seek to replicate or obtain exposure.
1633,Exchange Rates Movement between the Base Currency and Other Currencies Risk (applicable to Unlisted Class of Units only) .
1634,The Sub-Fund’s Base Currency is in HKD but the Sub-Fund has Unlisted Class of Units denominated in the Class Currency of the relevant Unlisted Class of Units other than HKD.
1635,Accordingly investors in respect of the Unlisted Class of Units which is denominated in a Class Currency other than HKD may be subject to additional costs or losses associated with foreign currency fluctuations between the Base Currency and the relevant Class Currency other than HKD.
1636,Investors whose assets and liabilities are predominantly in currencies other than HKD should take into account the potential risk of loss arising from fluctuations in value between HKD and the relevant Class Currency other than HKD.
1637,"There is no guarantee that HKD will appreciate in value against any other currency, or that the strength of HKD may not weaken."
1638,"Accordingly, it is possible that an investor may enjoy a gain in terms of HKD but suffer a loss when converting funds from HKD back into any other currency."
1639,Distributions Out Of/Effectively Out of Capital Risk (applicable to Listed Class of Units and distribution Unlisted Class of Units only) .
1640,"The Manager may at its discretion pay dividends out of income or capital (or effectively out of capital) (or partly one and partly the other), and furthermore any applicable charges, fees and expenses of the Sub-Fund may be paid out of the assets of the Sub-Fund."
1641,Payment of dividends out of capital or effectively out of capital amounts to a return or withdrawal of part of an investor’s original investment or from any capital gains attributable to that original investment.
1642,Any distributions involving payment of dividends out of the Sub-Fund’s capital or effectively out of capital may result in an immediate reduction of the Net Asset Value per Unit of the relevant class.
1643,This may also reduce the capital that the Sub-Fund has available for investment 130 in future and may constrain capital growth.
1644,The Manager may amend its distribution policy with respect to distributions out of capital (and/or effectively out of capital) of the Sub-Fund subject to the SFC’s prior approval and by giving not less than one month’s prior notice to Unitholders.
1645,131 APPENDIX 3: CHINAAMC MSCI JAPAN HEDGED TO USD ETF Key Information Set out below is a summary of key information in respect of this Sub-Fund which should be read together with the full text of this Appendix and the Prospectus.
1646,Key information applicable to both Listed Class of Units and Unlisted Classes of Units Index MSCI Japan 100% Hedged to USD Index Investment Delegate Mackenzie Financial Corporation Investment Strategy Primarily Full Replication.
1647,The Manager and the Investment Delegate may also use Representative Sampling Strategy.
1648,Base Currency HKD Maximum Deviation from Index Weighting 3% Financial Year End 31 December Website www.chinaamc.com.hk* * This website has not been reviewed by the SFC.
1649,Key information applicable to Listed Class of Units only Listing Date (SEHK) 18 February 2016 Exchange Listing SEHK – Main Board Stock Code 3160 Short Stock Name CAM JAPAN HDG Trading Board Lot Size 200 Units Base Currency HKD Trading Currency HKD Distribution Policy The Manager intends to distribute income to Unitholders at least semi-annually (usually in March and September of each year) having regard to the Sub-Fund’s net income after fees and costs.
1650,Distributions may be paid out of capital or effectively out of capital as well as income at the Manager’s discretion.
1651,"Creation/Redemption Policy Cash (HKD or USD, as agreed with the relevant Participating Dealer) and in-kind 132 Application Unit Size (only by or through Participating Dealers) Minimum 100,000 Units (or multiples thereof) for cash creation/redemption Minimum 1,000,000 Units (or multiples thereof) for in- kind creation/redemption Dealing Deadline 11:00 a.m."
1652,(for cash creation / redemption) or 4:30 p.m.
1653,"(for in-kind creation / redemption) on the relevant Dealing Day, or such other time as the Manager (with the approval of the Trustee) may determine Participating Dealer** BNP Paribas China Merchant Securities (HK) Co., Limited DBS Vickers (Hong Kong) Limited Goldman Sachs (Asia) Securities Limited Haitong International Securities Company Limited Huatai Financial Holdings (Hong Kong) Limited Korea Investment & Securities Asia Limited Phillip Securities (Hong Kong) Limited Merrill Lynch Far East Limited Mirae Asset Securities (HK) Limited Yue Xiu Securities Company Limited Market Maker** Flow Traders Hong Kong Limited Optiver Trading Hong Kong Limited Management Fee Currently 0.50% per year of the Net Asset Value ** Please refer to the Manager’s website for the latest lists of Market Makers and Participating Dealers for the Sub-Fund."
1654,Please also refer to the HKEX’s website at www.hkex.com.hk for the latest lists of Market Makers for the Sub-Fund.
1655,"Key information applicable to Unlisted Classes of Units only Unlisted Classes of Units Offered Class A HKD (Acc), Class A HKD (Dist), Class A USD (Acc), Class A USD (Dist), Class A RMB (Acc), Class A RMB (Dist), Class B HKD (Acc), Class B HKD (Dist), Class B USD (Acc), Class B USD (Dist), Class B RMB (Acc), Class B RMB (Dist) Minimum initial investment and minimum holding Class A HKD (Acc): HKD 1,000 Class A HKD (Dist): HKD 1,000 Class A USD (Acc): USD 100 Class A USD (Dist): USD 100 Class A RMB (Acc): RMB 1,000 Class A RMB (Dist): RMB 1,000 Class B HKD (Acc): HKD 1 133 Class B HKD (Dist): HKD 1 Class B USD (Acc): USD 0.1 Class B USD (Dist): USD 0.1 Class B RMB (Acc): RMB 1 Class B RMB (Dist): RMB 1 Minimum subsequent investment and minimum redemption amount Class A HKD (Acc): HKD 1,000 Class A HKD (Dist): HKD 1,000 Class A USD (Acc): USD 100 Class A USD (Dist): USD 100 Class A RMB (Acc): RMB 1,000 Class A RMB (Dist): RMB 1,000 Class B HKD (Acc): HKD 1 Class B HKD (Dist): HKD 1 Class B USD (Acc): USD 0.1 Class B USD (Dist): USD 0.1 Class B RMB (Acc): RMB 1 Class B RMB (Dist): RMB 1 Initial Offer Period 9:00 a.m."
1656,(Hong Kong time) on 23 December 2024 and ends at 11:00 a.m.
1657,"(Hong Kong time) on 23 December 2024, or such other date or time as the Manager may determine for a particular Class Subscription Price during the Initial Offer Period Class A Units HKD / Class B Units HKD: HKD 10 Class A Units USD / Class B Units USD: USD 1 Class A Units RMB / Class B Units RMB: RMB 10 Subscription Deadline / Redemption Deadline 11:00 a.m."
1658,(Hong Kong time) on the Dealing Day Distribution Policy Accumulation Unlisted Classes of Units: There will be no dividend distributions.
1659,All interest and other income earned on investments will be accumulated and re-invested into 134 the Sub-Fund on behalf of the Unitholders of the relevant accumulation Classes.
1660,Distribution Unlisted Classes of Units: The Manager intends to distribute income to unitholders at least semi- annually (usually in March and September of each year).
1661,Distributions may be paid out of capital or effectively out of capital as well as income at the Manager’s discretion.
1662,All Units of the distribution Unlisted Class of Units will receive distributions (if any) in the currency of the relevant Classes.
1663,Management Fee Class A Units HKD / Class A Units USD / Class A Units RMB: 0.50% per annum of the Net Asset Value Class B Units HKD / Class B Units USD / Class B Units RMB: 0.99% per annum of the Net Asset Value Key similarities and differences between Listed Class of Units and Unlisted Classes of Units Investment Objective Same for both Listed Class of Units and Unlisted Classes of Units.
1664,Please refer to the “What is the Investment Objective?” section of this Appendix.
1665,Investment Strategy Same for both Listed Class of Units and Unlisted Classes of Units.
1666,Please refer to the “What is the Investment Strategy?” section of this Appendix.
1667,Valuation Policy Same for both Listed Class of Units and Unlisted Classes of Units.
1668,Please refer to the “Determination of Net Asset Value” section in Part 1 of this Prospectus.
1669,"Deadline for Dealing in Units Same for in-cash creation and redemption for the Listed Class of Units, and subscription and redemption for the Unlisted Classes of Units – 11:00 a.m."
1670,(Hong Kong time) on a Dealing Day.
1671,Different in respect of in-kind creation and redemption for the Listed Class of Units which is 4:30 p.m.
1672,(Hong Kong time) on the Dealing Day.
1673,Dealing Arrangements Different in respect of each of Listed Class of Units and Unlisted Classes of Units.
1674,In respect of the Listed Class of Units: - the dealing period in respect of each Dealing Day for a Creation Application or Redemption Application commences at 9:00 a.m.
1675,(Hong Kong time) and ends at the Dealing Deadline at 11:00 a.m.
1676,(for cash creation / redemption) or 4:30 p.m.
1677,"(for in-kind creation / redemption) (Hong Kong time) on each Dealing Day (“Day T”), or such other time as the Manager (with the written approval of Trustee) may determine on any day when the trading hours of the 135 SEHK are reduced; - a secondary market investor can buy and sell the Listed Class of Units on the SEHK through his stockbroker at any time the SEHK is open."
1678,Investors can buy or sell the Listed Class of Units at market price; and - the Creation Application or Redemption Application for Listed Class of Units received after 11:00 a.m.
1679,(for cash creation / redemption) or 4:30 p.m.
1680,(for in-kind creation / redemption) (Hong Kong time) on each Dealing Day will be processed on the next Dealing Day (i.e.
1681,Day T+1) at the Net Asset Value per Unit of Listed Class of Units of Day T+1.
1682,"In respect of the Unlisted Classes of Units, the Subscription Deadline and Redemption Deadline is 11:00 a.m."
1683,(Hong Kong time) on each Dealing Day.
1684,Investors can buy or sell the Unlisted Classes of Units at Net Asset Value.
1685,The subscription application or redemption requests for Unlisted Classes of Units submitted after 11:00 a.m.
1686,"(Hong Kong time) on Day T, i.e."
1687,"after the Subscription or Redemption Deadline of Day T for such class, will be processed on the next Dealing Day (i.e."
1688,Day T+1) at the Net Asset Value per Unit of Unlisted Class of Units of Day T+1.
1689,"Please refer to Schedule 3 “Provisions relating to the offer, creation, redemption, listing and trading of the Listed Class of Units” and Schedule 4 “Provisions relating to the offer, subscription, conversion and redemption of the Unlisted Classes of Units” in Part 1 of this Prospectus for information relating to the Listed Class of Units and Unlisted Classes of Units respectively."
1690,Dealing Frequency Same for both Listed Class of Units and Unlisted Classes of Units – daily on each Business Day.
1691,Valuation Point Same for both Listed Class of Units and Unlisted Classes of Units – approximately 2:00 p.m.
