sentence_id,text
0,"Bosera RMB Money Market ETF (Stock Code: 83192 / 03192) Bosera HKD Money Market ETF (Stock Code: 03152 ) Bosera USD Money Market ETF (Stock Code: 09196 / 03196 / 83196) Bosera 20+ Year US Treasury Bond ETF (Stock Code: 09156 / 03156 / 09107) Bosera China Reform Hong Kong Central-SOEs High Dividend Yield Index ETF (Stock Code: 03437 / 83437 / 09437) Galaxy Bosera MSCI China ASEAN Economic Linkage Select Index ETF (Stock Code: 02805 / 82805 / 09805) sub-funds of Bosera Global Exchanged Traded Funds Series Open-ended Fund Company Prospectus March 2026 IMPORTANT: If you are in any doubt about the contents of this Prospectus, you should consult your stockbroker, bank manager, solicitor, accountant or other financial adviser for independent professional financial advice."
1,Investors should note that this Prospectus relates to Sub -Fund(s) which may offer both exchange -traded class of Shares and unlisted (not exchange-traded) class of Shares.
2,"BOSERA GLOBAL EXCHANGE TRADED FUNDS SERIES OPEN- ENDED FUND COMPANY (a Hong Kong public umbrella open-ended fund company with variable capital, limited liability and segregated liability between sub-funds and authorized under section 104 of the Securities and Futures Ordinance (Cap."
3,"571) of Hong Kong (the “SFO”)) PROSPECTUS BOSERA RMB MONEY MARKET ETF (Stock Code: 03192 / 83192) BOSERA HKD MONEY MARKET ETF (Stock Code: 03152 ) BOSERA USD MONEY MARKET ETF (Stock Code: 09196 / 03196 / 83196) BOSERA 20+ YEAR US TREASURY BOND ETF (Stock Code: 09156 / 03156 / 09107) BOSERA CHINA REFORM HONG KONG CENTRAL-SOES HIGH DIVIDEND YIELD INDEX ETF (Stock Code: 03437 / 83437 / 09437) GALAXY BOSERA MSCI CHINA ASEAN ECONOMIC LINKAGE SELECT INDEX ETF (Stock code: 02805 / 82805 / 09805) Manager Bosera Asset Management (International) Co., Limited Listing Agent Altus Capital Limited March 2026 Hong Kong Exchanges and Clearing Limited (“HKEX”), The Stock Exchange of Hong Kong Limited (the “SEHK”), Hong Kong Securities Clearing Company Limited (“HKSCC”) and the Hong Kong Securities and Futures Commission (the “SFC”) take no responsibility for the contents of this Prospectus, make no representation as to its accuracy or completeness and expressly disclaim any liability whatsoever for any loss howsoever arising from or in reliance upon the whole or any part of the contents of this Prospectus."
4,The Company has been registered with the SFC as an open-ended fund company.
5,The Company and each Sub-Fund have each been authorised as collective investment schemes by the SFC.
6,"Registration with and authorisation by the SFC do not represent a recommendation or endorsement of the Company or any of the Sub-Funds nor do they guarantee the commercial merits of the Company, any of the Sub-Funds or their performance."
7,They do not mean the Company or any of the Sub-Funds is suitable for all investors nor does it represent an endorsement of their suitability for any particular investor or class of investors.
8,"IMPORTANT – while section 112S of the SFO provides for segregated liability between sub-funds, the concept of segregated liability is relatively new."
9,"Accordingly, where claims are brought by local creditors in foreign courts or under foreign law contracts, it is not yet known how those foreign courts will react to section 112S of the SFO."
10,i IMPORTANT INFORMATION This Prospectus relates to the offer in Hong Kong of shares (the “Shares”) in the Bosera Global Exchange Traded Funds Series Open-ended Fund Company (the “Company”) and its sub-fund(s).
11,The Company is a public umbrella open- ended fund company incorporated in Hong Kong on 14 July 2022 with variable capital and limited liability.
12,"The Company can have a number of sub -funds (each a “Sub-Fund”), with segregated liability among them and in respect of which a separate class or classes of Shares will be issued."
13,"Bosera RMB Money Market ETF, Bosera HKD Money Market ETF, Bosera USD Money Market ETF , Bosera 20+ Year US Treasury Bond ETF, Bosera HashKey Bitcoin ETF and Bosera HashKey Ether ETF are Sub-Funds of the Company."
14,"This Prospectus relates to Bosera RMB Money Market ETF, Bosera HKD Money Market ETF, Bosera USD Money Market ETF, Bosera 20+ Year US Treasury Bond ETF , Bosera China Reform Hong Kong Central -SOEs High Dividend Yield Index ETF and Galaxy Bosera MSCI China ASEAN Economic Linkage Select Index ETF only."
15,"Where specified in the relevant Appendix, a Sub -Fund may issue both exchange-traded classes of Shares (“Listed Class of Shares”) and/or unlisted (not exchange -traded) classes of Shares (“Unlisted Class of Shares”)."
16,"Bosera Asset Management (International) Co., Limited (the “Manager”) has been appointed as the management company of the Company and each Sub-Fund."
17,The information contained in this Prospectus has been prepared to assist potential investors in making an informed decision in relation to investing in the Sub-Fund(s).
18,It contains important facts about the Sub-Fund(s) whose Shares are offered in accordance with this Prospectus.
19,"A product key facts statement which contains the key features and risks of each Sub-Fund is also issued by the Manager and such product key facts statement(s) shall form part of this Prospectus, and shall be r ead, in conjunction with, this Prospectus."
20,"For a Sub -Fund which issues both Listed Class of Shares and Unlisted Class(es) of Shares, separate sets of product key facts statement will be available for the Listed Class of Shares and the Unlisted Class(es) of Shares that are offered to Hong Kong investors respectively."
21,"The Manager accepts full responsibility for the accuracy of the information contained in this Prospectus and the Product Key Facts Statement of each Sub -Fund and confirms having made all reasonable enquiries, that to the best of its knowledge and belief there are no other facts the omission of which would make any statement in this Prospectus or any Product Key Facts Statement misleading."
22,"The Manager also confirms that this Prospectus includes particulars given in compliance with The Rules Governing the Listing of Securities on The Stock Exchange of Hong Kong Limited and the Code on Unit Trusts and Mutual Funds (the “UT Code”), the Code on Open Ended Fund Companies and the “Overarching Principles” of the SFC Handbook for Unit Trusts and Mutual Funds, Investment-Linked Assurance Schemes and Unlisted Structured Investment Products for the purposes of giving information with regard to the Shares in each Sub-Fund."
23,The Company has been registered with the SFC as an open-ended fund company under Section 112D of the SFO.
24,The Company and each Sub-Fund are authorised by the SFC in Hong Kong under Section 104 of the SFO.
25,"The SFC takes no responsibility for the financial soundness of the Company, any Sub-Fund or for the correctness of any statements made or opinions expressed in this Prospectus."
26,Registration with and authorisation by the SFC do not represent a recommendation or endorsement of the Company or any of the Sub-Funds nor do they guarantee the commercial merits of a scheme or its performance.
27,They do not mean the Company or the Sub -Funds are suitable for all investors nor do they represent an endorsement of their suitability for any particular investor or class of investors.
28,"You should consult your financial adviser or your tax advisers and take legal advice as appropriate as to whether any governmental or other consents are required, or other formalities need to be observed, to enable you to acquire Shares as to whether any taxation effects, foreign exchange restrictions or exchange control requirements are applicable and to determine whether any investment in a Sub-Fund is appropriate for you."
29,"The Listed Class of Shares of Bosera RMB Money Market ETF , Bosera HKD Money Market ETF , Bosera USD Money Market ETF, Bosera 20+ Year US Treasury Bond ETF and Bosera China Reform Hong Kong Central-SOEs High Dividend Yield Index ETF have been accepted as eligible securities by HKSCC for deposit, clearing and settlement in CCASS with effect from the commencement of dealings in the Shares of Bosera RMB Money Market ETF, Bosera HKD Money Market ETF, Bosera USD Money Market ETF, Bosera 20+ Year US Treasury Bond ETF and Bosera China Reform Hong Kong Central -SOEs High Dividend Yi eld Index ETF on the SEHK or such other date as may be determined by HKSCC."
30,All activities under CCASS are subject to the General Rules of HKSCC and HKSCC Operational Procedures in effect from time to time.
31,"Application has been made to the Listing Committ ee of the SEHK for the listing of, and permission to deal in the Listed Class of Shares of Galaxy Bosera MSCI China ASEAN Economic Linkage Select Index ETF."
32,"Subject to compliance with the admission requirements of the HKSCC, the Listed Class of Shares of Galaxy Bosera MSCI China ASEAN Economic Linkage Select Index ETF will be accepted as eligible securities by HKSCC for deposit, clearing and settlement in CCASS with effect from the date of commencement of dealings in the Listed Class of Shares of Galaxy Bosera MSCI China ASEAN Economic Linkage Select Index ETF on the SEHK or such other date as may be determined by HKSCC."
33,All activities under CCASS are subject to the General Rules of HKSCC and HKSCC Operational Procedures in effect from time to time.
34,"ii No action has been taken to permit an offering of Shares or the distribution of this Prospectus in any jurisdiction other than Hong Kong and, accordingly, this Prospectus does not constitute an offer or solicitation to anyone in any jurisdiction in which such offer is not authorised or to any person to whom it is unlawful to make such offer or solicitation."
35,"The Shares have not been, and will not be, registered under the United States Securities Act of 1933, as amended (the “Securities Act”) or any other United St ates Federal or State law and, except in a transaction which does not violate the Securities Act, may not be directly or indirectly offered to or sold in the United States of America or any of its territorie s or for the benefit of a US Person (as defined i n Regulation S of the Securities Act)."
36,"The Company and each Sub -Fund have not been and will not be registered as an investment company under the United States Investment Company Act of 1940, as amended."
37,"Shares may not be acquired or owned by (i) an employe e benefit plan, as defined in Section 3(3) of the Employee Retirement Income Security Act of 1974, as amended (“ERISA”), that is subject to Title I of ERISA, (ii) a plan, as defined in Section 4975(e)(1) of the United States Internal Revenue Code of 1986, as amended (the “Internal Revenue Code”), that is subject to Section 4975 of the Internal Revenue Code, (iii) a plan that is subject to any other law, regulation, rule or restriction that is substantially similar to ERISA or Section 4975 of the Internal Revenue Code (“Similar Law”) or (iv) an entity whose assets are deemed to include the assets of such an employee benefit plan or plan for purposes of ERISA, Section 4975 of the Internal Revenue Code or Similar Law, unless the purchase, holding and disposition of Shares will not constitute a violation under ERISA, Section 4975 of the Internal Revenue Code and any applicable Similar Law."
38,"Furthermore, distribution of this Prospectus (including the Product Key Facts Statement) shall not be permitted unless it is accompanied by a copy of the latest annual financial report of the Sub -Fund(s) (where existing) and, if later, its most recent interim report."
39,"You should note that any amendment or addendum to this Prospectus will only be posted on the Company’s website (www.bosera.com.hk) the contents of which, and of any other websites referred to in this Prospectus, have not been reviewed by the SFC."
40,This Prospectus (including the Product Key Facts Statement) may refer to information and materials included in websites.
41,Such information and materials do not form part of this Prospectus and they have not been reviewed by the SFC or any regulatory body.
42,Investors should note that the information provided in websites may be updated and changed periodically without any notice to any person.
43,Questions and Complaints Investors may raise any questions on or make any complaints about the Company (including the Sub -Fund(s)) by contacting the Managers Customer Service Hotline at its address as set out in the Directory of this Prospectus or calling the Manager on +852 2537 6658 during normal office hours.
44,"iii DIRECTORY Company Bosera Global Exchange Traded Funds Series Open-ended Fund Company Suite 4109, Jardine House One Connaught Place Central Hong Kong Directors of the Company LIAN Shaodong ZENG Peng Manager and QFI Holder Bosera Asset Management (International) Co., Limited Suite 4109, Jardine House One Connaught Place Central Hong Kong Directors of the Manager WU Huifeng LIAN Shaodong ZENG Peng OU Zhiming ZHOU Yi Sub-Manager of Galaxy Bosera MSCI China ASEAN Economic Linkage Select Index ETF China Galaxy International Asset Management (Hong Kong) Co., Limited 20/F Wing On Centre 111 Connaught Road Central Hong Kong Custodian of the Company, Bosera RMB Money Market ETF and Bosera HKD Money Market ETF CMB Wing Lung (Trustee) Limited 6/F, CMB Wing Lung Bank Building 45 Des Voeux Road Central Hong Kong Custodian of the Company , Bosera USD Money Market ETF , Bosera 20+ Year US Treasury Bond ETF , Bosera HashKey Bitcoin ETF , Bosera HashKey Ether ETF and Galaxy Bosera MSCI China ASEAN Economic Linkage Select Index ETF BOCI-Prudential Trustee Limited Suites 1501-1507 & 1513-1516, 15/F 1111 King’s Road Taikoo Shing Hong Kong Custodian of the Company and Bosera China Reform Hong Kong Central -SOEs High Dividend Yield Index ETF Bank of Communications Trustee Limited 1/F Far East Consortium Building 121 Des Voeux Road Central Hong Kong Administrator of Bosera RMB Money Market ETF and Bosera HKD Money Market ETF CMB Wing Lung (Trustee) Limited 6/F, CMB Wing Lung Bank Building 45 Des Voeux Road Central Hong Kong Administrator of Bosera USD Money Market ETF , Bosera 20+ Year US Treasury Bond ETF , Bosera HashKey Bitcoin ETF , Bosera HashKey Ether ETF Registrar of Bosera RMB Money Market ETF and Bosera HKD Money Market ETF CMB Wing Lung (Trustee) Limited 6/F, CMB Wing Lung Bank Building 45 Des Voeux Road Central Hong Kong Registrar of Bosera USD Money Market ETF , Bosera 20+ Year US Treasury Bond ETF , Bosera HashKey Bitcoin ETF, Bosera HashKey Ether ETF and Galaxy iv and Galaxy Bosera MSCI China ASEAN Economic Linkage Select Index ETF BOCI-Prudential Trustee Limited Suites 1501-1507 & 1513 -1516, 15/F 1111 King’s Road Taikoo Shing Hong Kong Administrator of Bosera China Reform Hong Kong Central-SOEs High Dividend Yield Index ETF Bank of Communications Trustee Limited 1/F Far East Consortium Building 121 Des Voeux Road Central Hong Kong Tokenisation Provider of Bosera USD Money Market ETF and Bosera HKD Money Market ET F** HBS (Hong Kong) Limited 14th Floor, Three Exchange Square 8 Connaught Place Central, Hong Kong Bosera MSCI China ASEAN Economic Linkage Select Index ETF BOCI-Prudential Trustee Limited Suites 1501-1507 & 1513-1516, 15/F 1111 King’s Road Taikoo Shing Hong Kong Registrar of Bosera China Reform Hong Kong Central-SOEs High Dividend Yield Index ETF Bank of Communications Trustee Limited 1/F Far East Consortium Building 121 Des Voeux Road Central Hong Kong Token Custodian of Bosera USD Money Market ETF and Bosera HKD Money Market ET F** Hash Blockchain Limited acting via its associated entity HashKey Custody Services Limited Unit 614-615, Core D, Cyberport 3, 100 Cyberport Road, Hong Kong Participating Dealers Please refer to the Manager’s website and the website of the HKEX for the latest list of Participating Dealers of each Sub-Fund."
45,Listing Agent* Altus Capital Limited 21 Wing Wo Street Central Hong Kong Market Makers Please refer to the Manager’s website and the website of the HKEX for the latest list of Market Makers for each Sub-Fund.
46,"Auditor Ernst & Young 22/F, CITIC Tower 1 Tim Mei Avenue, Central Hong Kong Service Agent / Conversion Agent* HK Conversion Agency Services Limited 8th Floor, Two Exchange Square 8 Connaught Place Central, Hong Kong * Applicable in respect of Listed Class of Shares of Bosera RMB Money Market ETF, Bosera HKD Money Market ETF , Bosera USD Money Market ETF, Bosera 20+ US Treasury Bond ETF, Bosera China Reform Hong Kong Central -SOEs High Dividend Yield Index ETF and Galaxy Bosera MSCI China ASEAN Economic Linkage Select Index ETF only."
47,** Applicable in respect of tokenised Shares of Bosera USD Money Market ETF and Bosera HKD Money Market ETF only.
48,"v CONTENTS DIRECTORY iii CONTENTS v PART 1 – GENERAL INFORMATION RELATING TO THE COMPANY AND SUB-FUNDS 6 DEFINITIONS 7 INTRODUCTION 16 INVESTMENT OBJECTIVE, STRATEGY AND RESTRICTIONS, SECURITIES LENDING AND BORROWING 17 DETERMINATION OF NET ASSET VALUE 32 FEES AND EXPENSES 35 RISK FACTORS 39 MANAGEMENT OF THE COMPANY AND SUB-FUNDS 56 STATUTORY AND GENERAL INFORMATION 63 TAXATION 75 SCHEDULE 1 – PROVISIONS RELATING TO THE OFFER, CREATION, REDEMPTION, LISTING AND TRADING OF THE LISTED CLASS OF SHARES 82 SCHEDULE 2 – PROVISIONS RELATING TO THE OFFER, SUBSCRIPTION, CONVERSION AND REDEMPTION OF THE UNLISTED CLASS(ES) OF SHARES 103 SCHEDULE 3 – DEALING OF TOKENISED CLASS OF SHARES 112 PART 2 – SPECIFIC INFORMATION RELATING TO EACH SUB-FUND 119 APPENDIX 1: Bosera RMB Money Market ETF 120 APPENDIX 2: Bosera HKD Money Market ETF 152 APPENDIX 3: Bosera USD Money Market ETF 178 APPENDIX 4: Bosera 20+ Year US Treasury Bond ETF 210 APPENDIX 5: Bosera China Reform Hong Kong Central-SOEs High Dividend Yield Index ETF 238 APPENDIX 6: Galaxy Bosera MSCI China ASEAN Economic Linkage Select Index ETF 263 6 PART 1 – GENERAL INFORMATION RELATING TO THE COMPANY AND SUB-FUNDS Part 1 of this Prospectus includes information relevant to the Company and all Sub-Fund(s) established under the Company."
49,The information presented in this Part 1 should be read in conjunction with the information presented in the relevant Appendix in Part 2 of this Prospectus in respect of a particular Sub -Fund.
50,"Where the information in Part 2 of this Prospectus c onflicts with the information presented in this Part 1, the information in the relevant Appendix in Part 2 prevails, however, it is applicable to the specific Sub - Fund of the relevant Appendix only."
51,Please refer to Part 2 “Specific Information Relating to Each Sub- Fund” for further information.
52,"7 DEFINITIONS In this Prospectus (including the relevant Appendix for any Sub -Fund), unless the context requires otherwise, the following expressions have the meanings set out below."
53,"“Administrator” in respect of a Sub-Fund, means such person duly appo inted from time to time as administrator hereof in succession thereto, as specified in the relevant Appendix."
54,“AFRC” means the Accounting and Financial Reporting Council or its successors.
55,"“After Listing” means, in respect of a Listed Class of Shares, the period which commences on the Listing Date and continues until the relevant Sub-Fund is terminated."
56,“Appendix” means an appendix to this Prospectus that sets out specific information applicable to a Sub-Fund.
57,"“Application” means, in respect of a Listed Class of Shares, an application by a Participating Dealer for the creation or redemption of Shares in accordance with the procedures for creation and redemption of Shares set out in the Operating Guidelines, the relev ant Participation Agreement and the terms of the Instrument."
58,"“Application Share” means, in respect of a Listed Class of Shares, such number of Shares of a class or whole multiples thereof as specified in this Prospectus for the relevant Sub -Fund or such ot her number of Shares from time to time determined by the Manager, approved by the relevant Custodian and notified to the Participating Dealers, either generally or for a particular class or classes or for a particular period of time."
59,"“Business Day” in respect of a Sub-Fund, means, unless the Manager otherwise agrees or otherwise specified in Part 2 of this Prospectus, a day on which (a)(i) the SEHK is open for normal trading; and (ii) the relevant market on which Securities and/or Futures Contracts comprised in the relevant Index or Securities and/or Futures Contracts comprised in the relevant Sub-Fund, as the case may be, are traded is open for normal trading, or if there are more than one such market, the market designated by the Manager is open for normal trading, and (b) (where applicable) the Index is compiled and published, or such other day or days as the Manager and the relevant Custodian may agree from time to time provided that if on any such day, the period during which the relevant market is open for normal trading is reduced as a result of a Number 8 Typhoon Signal, Black Rainstorm warning or other similar event, such day shall not be a Business Day unless the Manager otherwise agrees."
60,"“Cancellation Compensation” means, in respect of a Listed Clas s of Shares, an amount payable by a Participating Dealer for the account of the relevant Sub-Fund in respect of a Default or a cancellation of Creation Application or Redemption Application in accordance with the Instrument, the Participation Agreement and/or the Operating Guidelines applicable at the time the relevant Creation Application or Redemption Application is made."
61,“CCASS” means the Central Clearing and Settlement System established and operated by HKSCC or any successor system operated by HKSCC or its successors.
62,“CCASS Settlement Day” means the term “Settlement Day” as defined in the General Rules of HKSCC.
63,"“Class Currency” means, in relation to a class of Shares, the base currency of the Sub-Fund relating thereto or such other currency of account as the Manager may specify for such class of Shares in accordance with the Instrument."
64,“Company” means Bosera Global Exchange Traded Funds Series Open-ended Fund Company.
65,"“Connected Person” has the meaning as set out in the UT Code which at the date of this Prospectus means in relation to a company: (a) any person or company beneficially owning, directly or indirectly, 20% or more of the ordinary 8 share capital of that company or able to exercise directly or indirectly, 20% or more of the total votes in that company; or (b) any person or company controlled by a person who or which meets one or both of the descriptions given in (a); (c) any member of the group of which that company forms part; or (d) any director or officer of that company or of any of its connected persons as defined in (a), (b) or (c)."
66,"“Conversion Agency Agreement” means the agreement by which the Conversion Agent agrees with the Manager to provide its services in respect of the Listed Class of Shares of a Sub -Fund, as may from time to time be entered amongst the Company, the Manager, the Conversion Agent and HKSCC."
67,“Conversion Agent” means HK Conversion Agency Services Limited or such other person as may from time to time be appointed to act as conversion agent in relation to the Listed Class of Shares of a Sub-Fund.
68,"“Creation Application” means, in respect of a Listed Class of Shares, an application by a Participating Dealer for the creation and issue of Shares in an Application Share size in accordance with the Operating Guidelines and the Instrument."
69,"“CSDCC” means the China Securities Depository and Clearing Co., Ltd."
70,“CSRC” means China Securities Regulatory Commission.
71,"“Custodian” in respect of a Sub-Fund, means such person for from time to time duly appointed by the Company as custodian of the Company and the relevant Sub -Fund, or in succession thereto, as specified in the relevant Appendix."
72,“Custody Agreement” means the custody agreement between the Company for a Sub-Fund and the relevant Custodian by which the relevant Custodian is appointed.
73,"“Dealing Day” means each Business Day during the continuance of the relevant Sub -Fund, and/or such other day or days as the Manager may from time to time determine either generally or for a particular class or classes of Shares, as specified in the relevant Appendix, provided that a Dealing Day for the issue of a class of Shares may be a different day or days from the Dealing Day for the redemption of such class."
74,"“Dealing Deadline” means, in respect of a Sub -Fund, in relation to any Dealing Day, such time or times as the Manager may from time to time in consultation with the relevant Custodian determine generally or in relation to any particular class or classes of Shares of a Sub -Fund or any particular place for (in respect of Listed Class of Shares) submission of Application(s) by a Participating Dealer or (in respect of Unlisted Class(es) of Shares) submission of application for subscription or redemption of Shares, as specified in the relevant Appendix."
75,"“Default” means, in respect of a Listed Class of Shares, a failure by a Participating Dealer in respect of: (a) a Creation Application to deliver the requisite Securities, Futures Contracts and/or any relevant cash amount; or (b) a Redemption Application to deliver the Shares the subject of the Redemption Application and/or relevant cash amount."
76,“Digital Platform” has the meaning as defined in the section headed “DEALING OF TOKENISED CLASS OF SHARES” under Schedule 3 to this Prospectus.
