sentence_id,text
863,"When the Manager appears in, prosecutes or defends any action or suit in respect of the provisions of the Management Agreement or the Instrument or in respect of the Company, any Sub-Fund or any part thereof or any corporate or Shareholders’ action which in its opinion would or might involve it in expense or liability, it shall be entitled to be indemnified by the Company out of the relevant Sub-Fund to its satisfaction against any costs or expenses in connection with the Manager appearing, prosecuting or defending such actions or suits."
864,Nothing in the Management Agreement excludes or restricts the liability to the Company which the Manager may have under the SFO.
865,"No provision of the Instrument or the Management Agreement shall be construed as (i) providing any exemption of any liability of the Manager to the Shareholders under Hong Kong law, nor may the Manager be indemnified against such liability by Shareholders or at the Shareholders’ expense, or (ii) diminishing or exempting the Manager from any of its duties and liabilities under applicable Laws and Regulations, and no provision shall have the effect of providing any of such exemption or indemnity."
866,"Indemnities of the Custodian No provision of the Instrument or a Custody Agreement shall be construed as (i) providing any exemption of any liability of a Custodian to the Shareholders of the relevant Sub -Fund under Hong Kong law or for breach of trust through fraud or negligence, nor may the Custodian be indemnified against such liability by Shareholders of the relevant Sub -Fund or at the expense of Shareholders of the relevant Sub -Fund, or (ii) diminishing or exempting the Custodian from any of its duties and liabilities under applicable laws and regulations, and no provision shall have the effect of providing any of such exemption or indemnity."
867,Nothing in a Custody Agreement excludes or limits the liability to the Company which a Custodian may have under the SFO.
868,"Please also refer to the respective Appendix for information r elating to a Custodian’s liability to the Company in respect of the relevant Sub -Fund, and the indemnity available to a Custodian, under the relevant Custody Agreement."
869,Modification of the Instrument An amendment to the Instrument may be made to the extent permitted by the Laws and Regulations applicable to the Company and in accordance with the Instrument.
870,"No alteration to the Instrument may be made unless: (a) the alteration has been approved by Shareholders by a special resolution (as defined in the Instrument); or (b) each Custodian certifies in writing that in its opinion the proposed alteration: (i) is necessary to make possible compliance with fiscal or other statutory, regulatory or official requirements; (ii) does not materially prejudice Shareholders’ interests, does not to any material extent release the Directors, the Manager, the Custodian(s) or any other person from any liability to Shareholders and does not increase the costs and charges payable from the scheme property; or (iii) is necessary to correct a manifest error, provided that for (b), where the alteration to the Instrument impacts only one or more Sub-Funds, the certification of the Custodian(s) of the impacted Sub-Fund(s) will suffice."
871,"In all other cases involving any material changes, no alteration may be made except by a special resolution of Shareholders or the approval of the SFC."
872,The Company shall provide written notice to Shareholders in respect of any alteration to this Instrument and any alteration to the Company generally in accordance with the Laws and Regulations applicable to the Company.
873,65 Shareholders and intending applicants are advised to consult the terms of the Instrument for further details.
874,Meetings of Shareholders Proxies may be appointed.
875,A Shareholder who is the holder of two or more Shares may appoint more than one proxy to represent him and vote on his behalf at any meeting of the Shareholders.
876,"If a clearing house (or its nominee(s)), being a corporation, is a Shareholder, it may authorise such persons as it thinks fit to act as its representatives at any meeting of the Shareholders provided that, if more than one person is so authorised, the authorisation shall specify the number and class of Shares in respect of which each such representative is so authorised."
877,"Each pe rson so authorised shall be deemed to have been duly authorised without further evidence of the facts and shall be entitled to exercise the same rights and powers on behalf of the clearing house (or its nominee(s)) as if such person were the registered Sha reholder of the Shares held by the clearing house (or its nominee(s)), including the right to vote individually on a poll."
878,"Voting Rights Shareholders’ meetings may be convened by the Directors or by Shareholders representing at least 10% of the Shares in issue, on not less than 21 calendar days’ notice in respect of a meeting where a special resolution (as defined in the Instrument) is to be proposed and 14 calendar days’ notice in respect of a meeting where an ordinary resolution (as defined in the Instrument) is to be proposed."
879,"These meetings may be used to modify the terms of the Instrument, including removing the Manager or terminating a Sub-Fund at any time."
880,Such amendments to the Instrument must be considered by Shareholders of at least 25% of the Shares in issue and passed by a 75% or more of the votes cast.
881,Other matters that require an ordinary resolution being passed would be considered by Shareholders of at least 10% of the Shares in issue and passed by a simple majority of more than 50% of the votes cast.
882,"If within half an hour from the time appointed for the meeting a quorum is not present, the meeting shall stand adjourned to such day and time not being less than 15 days thereafter and to such place as may be appointed by the chairman of the me eting."
883,"At such adjourned meeting, the Shareholders present in person or by proxy shall be a quorum."
884,"Notice of any adjourned meeting of Shareholders shall be given in the same manner as for an original meeting and such notice shall state that the Shareholders present at the adjourned meeting, whatever their number and the number of Shares held by them, will form a quorum."
885,The Instrument contains provisions for the holding of separate meetings of Shareholders holding Shares of different classes where only the interests of Shareholders of such class are affected.
886,Removal and Retirement of the Directors A person ceases to be a Director if the person: (a) ceases to be a Director or is prohibited from being a Director under the applicable Laws and Regulations or under the Companies (Winding Up and Miscellaneous Provisions) Ordinance (Chapter 32 of the Laws of Hong Kong); (b) becomes bankrupt or makes any arrangement or composition with the person’s creditors generally; (c) becomes a mentally incapacitated person; (d) resigns from the office of Director by notice in writing of the resignation of not less than 28 days; (e) for more than 6 months has been absent without the Directors’ permission from Directors’ meetings held during that period; (f) upon the expiry of any period or notice peri od stated in an agreement for the provision of 66 services between the Company and the Director or if such agreement is summarily terminated in accordance with its terms; or (g) is removed from the office of Director by an ordinary resolution (as defined in the Instrument).
887,Special notice (in accordance with the applicable Laws and Regulations) is required of a resolution to remove a Director or appoint a person in place of a Director so removed at the meeting at which the Director is removed.
888,"Removal and Retirement of the Manager Under the Instrument and the Management Agreement, the Manager must retire in the case of (i) below, and must be subject to removal by notice in writing from the Directors in the case of (ii) or (iii) below: (i) when it c eases to be eligible to be a Manager or is prohibited from being a Manager under the applicable Laws and Regulations, or when the SFC withdraws its approval of the Manager; (ii) when it goes into liquidation, becomes bankrupt or has a receiver appointed over it s assets; (iii) when for good and sufficient reason, the Directors state in writing that a change in the Manager is desirable in the interests of the Shareholders."
889,"The Manager shall be entitled to retire in favour of some other person considered by the Company to be suitably qualified and approved by the SFC, upon giving written notice to the Company in accordance with the Management Agreement and subject to such person entering into a management agreement similar to the Management Agreement."
890,"In the event that the Manager shall retire or be removed or its appointment shall otherwise terminate, the Company shall appoint another corporation eligible under the Laws and Regulations (as defined in the Management Agreement) to act as the investment manager of an open -ended fund company which is approved by the SFC to be the investment manager of the Company in place of the Manager so retiring or being removed on or before the expiry of any period of notice of such retirement or removal."
891,The Manager may not retire except upon the appointment of a new Manager approved by the SFC.
892,"Removal and Retirement of the Custodian Under the Instrument and each Custody Agreement, a Custodian must retire in the case of (i) below, and must be subject to removal by notice in writing in the case of (ii) and (iii) below: (i) when it ceases to be eligible to be a Custodian or is prohibited from being a Custodian under applicable Laws and Regulations, or when the SFC withdraws its approval of the Custodian; (ii) when it goes into liquidation, becomes b ankrupt or has a receiver appointed over its assets; or (iii) when for good and sufficient reason, the Directors state in writing that a change in the Custodian is desirable in the interests of the Shareholders of the relevant Sub -Fund."
893,"In the event that a Custodian shall retire or be removed or its appointment shall otherwise terminate, the Company shall appoint another corporation eligible under the Laws and Regulations to act as a custodian of the relevant Sub -Fund and the Company."
894,Such custodian should be app roved by the SFC to be the Custodian in place of the Custodian so retiring or being removed on or before the expiry of any period of notice of such retirement or removal.
895,The retirement of the Custodian should take effect at the same time as the new Custod ian takes up office.
896,The Custodian may not retire except upon the appointment of a new Custodian approved by the SFC.
897,"67 Deferred Redemption In the event that redemption requests are received for the redemption of Shares (in respect of both Listed Class of Shares and Unlisted Class(es) of Shares) representing in aggregate more than 10% (or such higher or lower percentage as the Manager may determine in respect of the Sub -Fund as permitted by the SFC) of the total Net Asset Value of Shares in a Sub -Fund then in issue, the Company may reduce the requests rateably and pro rata amongst all Shareholders (both Listed Class of Shares and Unlisted Class(es) of Shares) seeking to redeem Shares on the relevant Dealing Day and carry out only sufficient redemptions which, in aggregate, amount to 10% (or such higher percentage as the Manager may determine in respect of a Sub-Fund as permitted by the SFC) of the total Net Asset Value of Shares in the relevant Sub -Fund then in issue."
898,"Shares which are not redeemed but which wou ld otherwise have been redeemed will be redeemed on the next Dealing Day (subject to further deferral if the deferred requests in respect of the relevant Sub -Fund themselves exceed 10% (or such higher or lower percentage as the Manager may determine in respect of that Sub -Fund as permitted by the SFC) of the total Net Asset Value of Shares in the relevant Sub-Fund then in issue, pro rata amongst both Listed and Unlisted Classes of Shares) in priority to any other Shares in the relevant Sub -Fund for which re demption requests have been received."
899,Shares will be redeemed at (in the case of a Listed Class of Shares) the Redemption Value or (in the case of an Unlisted Class of Shares) the Redemption Price prevailing on the Dealing Day on which they are redeemed.
900,"Compulsory Redemption If the Directors reasonably suspect that Shares of any class are owned directly or beneficiary by any person: (a) who is an Unauthorised US Person; (b) in contravention of any laws or requirements of any country, any governmental authority or any stock exchange on which such Shares are listed (if applicable); (c) in circumstances which, in the Directors’ opinion, might result in the Sub -Fund in relation to such class of Shares, the Company, the Directors, any service provider and/or other Shareholders incurring any tax liability or suffering any other pecuniary disadvantage which the Sub-Fund, the Company, the Directors, any service provider and/or other Shareholders might not otherwise have incurred or suffered; or (d) in breach of any requirements specified in this Prospectus in relation to such class of Shares, the Directors may give notice to the relevant Shareholder requiring him to transfer such Shar es to a person who would not be in contravention of any such restrictions as aforesaid within 30 days of the date of the notice, or take such other actions as they reasonably believe are required by the Laws and Regulations."
901,"If any Shareholder upon whom such a notice is served pursuant to the Instrument does not, within 30 days of such notice, transfer such Shares as aforesaid or establish to the satisfaction of the Directors (whose judgment shall be final and binding) that such Shares are not held in contravention of any such restrictions he shall be deemed upon the expiry of the 30-day period to have given a redemption request in respect of the relevant Shares on the expiry of the notice."
902,"Termination (otherwise than by winding up) Without prejudice to any provision in the applicable Laws and Regulations by virtue of which the Company, or a Sub -Fund or a class of Shares may be terminated, the Company, a Sub -Fund or a class of Shares may be terminated, subject to and in accordance with the applicable Laws an d Regulations, by the Directors in their absolute discretion if: (a) in the case of a Sub -Fund including classes therein, 1 year from the date of the first issue of Share relating to the relevant Sub -Fund or at any date thereafter the Net Asset Value of the relevant Sub-Fund is less than USD10,000,000 or its equivalent in the base currency of the Sub-Fund; 68 (b) in the case of a class only, there are no Shareholders of such class in a Sub-Fund; (c) in the case of the Company, 1 year from the date of the first issue of Shares relating to the first Sub-Fund or at any date thereafter the Net Asset Value of the Company is less than USD10,000,000 or its equivalent in the base currency of the Sub-Fund(s); (d) any law shall be passed which renders it illegal or in the reasonable opi nion of the Directors impracticable or inadvisable to continue the relevant Sub-Fund or the Company; (e) in the case of a Sub-Fund including classes therein, the Index (for an Index Tracking Sub-Fund) is no longer available for benchmarking; (f) in the case of a L isted Class of Shares or a Sub -Fund with only Listed Class of Shares, the Listed Class of Shares is no longer listed on the SEHK or any such other stock exchange from time to time determined by the Manager; (g) in the case of a Listed Class of Shares or a Sub-Fund with only Listed Class of Shares, at any time, the Listed Class of Shares ceases to have any Participating Dealer; or (h) in the case of a Listed Class of Shares or a Sub-Fund with only Listed Class of Shares, at any time, the relevant Listed Class of Shares ceases to have any Market Maker."
903,"The Directors shall give reasonable notice of termination of the Company, the relevant Sub-Fund, or the class of Shares (as the case may be) to the Shareholders in the Company, the relevant Sub-Fund or the class of Sha res (as the case may be) in such manner and with such contents which are compliant with the applicable Laws and Regulations, and by such notice fix the date on which such termination is to take effect, provided that no less than one month’s notice will be given to the relevant Shareholders in case of termination of the Company or a Sub -Fund."
904,Shareholders’ approval is not required to effect termination of the Company or a Sub-Fund.
905,"Investors should note that, due to the nature of the listing of the Listed Class of Shares on the SEHK, the termination procedures applicable to Listed Class of Shares and Unlisted Class(es) of Shares of the same Sub-Fund may differ."
906,"In the event of termination of the Company, a Sub-Fund or a particular class of Shares, Shareholders will be notified of the relevant termination procedures applicable to its holding of the relevant class of Shares."
907,"With effect on and from the date as at which the Company or any Sub-Fund is to terminate: (a) no Shares of the relevant class or classes may be issued or sold by the Company; (b) the Manager shall on the instructions of the Directors realise all the assets then comprised in the relevant Sub-Fund; (c) distributions shall be made to the Shareholders of the relevant class or classes in proportion to their respective interests in the relevant Sub-Fund of all net cash proceeds derived from the realisation of the relevant Sub-Fund and available for the purpose of such distribution, provided that the relevant Custodian shall be entitled to retain out of any monies in its hands as part of the relevant Sub -Fund full provision for all costs, charges, expenses, claims and demands reasonably incurred by or on behalf of the Company, Directors, the Manager or the relevant Custodian in connection with or arising out of the termination of the relevant Sub-Fund; and (d) any unclaimed proceeds or other monies held by a Custodian in the event of a termination may at the expiration of 12 calendar months from the date upon which the same became payable be paid into court, subject t o the right of the Manager and the relevant Custodian to deduct therefrom any expenses it may incur in making such payment."
908,Every such distribution shall be made in such manner as the Directors shall at their reasonable discretion determine but shall be ma de only against the production of such evidence relating to the Shares of the relevant class or classes in respect of which the same is made and upon delivery of such form of request for payment as shall be reasonably required.
909,"69 Winding Up Subject to any other provisions applicable to the specific Sub-Fund set out in the relevant Appendix to this Prospectus, the rights of the Shareholders to participate in the property comprised in a Sub - Fund on a winding up of the Company or a Sub -Fund shall be proportion ate to the proportionate interests in the Sub-Fund represented by the Shares which they hold."
910,"If the Company or a Sub-Fund is wound up and a surplus remains after the payment of debts proved in the winding up, the liquidator: (a) may, with the required sanctio n of a special resolution (as defined in the Instrument) of the Company or Shareholders of the relevant Sub -Fund and any other sanction required by the Laws and Regulations, divide amongst the Shareholders the whole or any part of the assets of the Company or relevant Sub-Fund (whether they consist of property of the same kind or not) and may, for this purpose, set a value the liquidator thinks fair on any property to be so divided; and (b) may determine how the division is to be carried out between the Shareho lders or different classes of Shareholders."
911,"Distribution Policy The Manager will adopt a distribution policy for each Sub-Fund as the Manager considers appropriate having regard to the Sub -Fund’s net income, fees and costs."
912,For each Sub -Fund this distribut ion policy (including the currency of such distribution) will be set out in the relevant Appendix.
913,"Distributions will always depend on payments on Securities held by the relevant Sub-Fund which will in turn depend on factors beyond the control of the Manager including, general economic conditions, and the financial position and distribution policies of the relevant underlying entities."
914,There can be no assurance that such entities will declare or pay dividends or distributions.
915,"Where specified in the relevant Appendix, the Manager may at its discretion make distributions (i) out of capital or (ii) out of gross income while all or part of the fees and expenses of the Sub -Fund are charged to/paid out of the capital of a Sub -Fund or class, resulting in an increa se in distributable income for the payment of distributions by the relevant Sub-Fund or class and therefore, the relevant Sub-Fund or class may effectively pay distributions out of the capital."
916,Payment of distributions out of capital or effectively out of capital amounts to a return or withdrawal of part of an investor’s original investment or from any capital gains attributable to that original investment.
917,Any distributions involving payment of distributions out of or effectively out of the Sub -Fund’s or class’ capital may result in an immediate reduction of the Net Asset Value per Share.
918,Please refer to “ Distributions out of or Effectively out of Capital Risk” under the section headed “Risk Factors” above.
919,Inspection of Documents Copies of the following do cuments are available for inspection free of charge at the offices of the Manager and copies thereof may be obtained from the Manager upon the payment of a reasonable fee: (a) Instrument; (b) Management Agreement; (c) Custody Agreement(s); (d) Participation Agreements; (e) the most recent audited annual reports and the unaudited half-yearly reports of the Company and each Sub-Fund (if any).
920,70 Part XV of the SFO Part XV of the SFO sets out the Hong Kong disclosure of interests’ regime applicable to Hong Kong listed companies.
921,The regime applies to open-ended fund companies whose Securities are listed on the SEHK.
922,However the Company has made a Category 3 application to the SFC for exemption from Part XV of the SFO pursuant to section 309(2) thereof and the Guidelines for the Exemption of Listed Corporations and Other Persons from Part XV of the SFO (Disclosure of Interests).
923,"Consequently, Shareholders of Listed Class of Shares are not obliged to disclose their interest in the Company or in a Sub-Fund."
924,"Anti-money Laundering Regul ations As part of the Manager’s, the Company’s, the Administrator’s, the Registrar’s and the Participating Dealer’s responsibility for the prevention of money laundering and to comply with all applicable laws to which the Manager, the Company, the Administrator, the Registrar, each Sub-Fund or the relevant Participating Dealer is subject, the Manager, the Company, the Administrator, the Registrar or the relevant Participating Dealer may require a detailed verification of an investor’s identity and the source of payment of any applications for Shares at any time as they think appropriate."
925,"The Company may, to the extent permitted by law, delegate the maintenance of its anti-money laundering procedures to a third party service provider or agent."
926,"Depending on the circumstances of each application, a detailed verification by the Manager, the Registrar, the Administrator, the relevant Custodian or the relevant Participating Dealer might not be required where: (a) the investor makes the payment from an account held in the investor’s name at a recognised financial institution; or (b) the application is made through a recognised intermediary."
927,These exceptions apply only if the financial institution or intermediary is within a country recognised by the relevant Custodian and the Manager as having sufficient anti-money laundering regulations.
928,Delay or failure to provide with the required documents may result in delay or refusal of application or withholding of redemption proceeds.
929,"For the purpose of anti -money laundering and/or c ounter- terrorist financing, the Manager may compulsorily redeem the Shares held by any Shareholder."
930,"The Manager may, to the extent permitted by law, share, for the purposes of combating money laundering and terrorist financing, the information in connectio n with the Shareholders with its affiliates."
