sentence_id,text
2986,216 Fee Structure Different in respect of each of the Listed Class of Shares and Unlisted Classes of Shares.
2987,"An investment in the Listed Class of Shares in the secondary market is subject to fees involved in relation to the trading of such Shares on the SEHK (such as the S ervice Agent’s fee, transaction costs, brokerage fee, transaction levy, trading fee etc.)."
2988,"An investment in the Unlisted Classes of Shares may be subject to the payment of subscription fees and switching fees (if applicable), but not redemption fees."
2989,Please refer to the “Fees and Expenses” section in Part 1 of this Prospectus and this Appendix respectively.
2990,"Investment Return / Net Asset Value Different in respect of each of the Listed Class of Shares and Unlisted Classes of Shares due to various factors, including but not limited to the different fee structures applicable to each class of Shares, different dealing arrangements (i.e."
2991,"Listed Class of Shares can be bought and sold at market price whereas Unlisted Classes of Shares are bought and sold at Net Asset Value), costs (such as Transaction Fee and Duties and Charges in respect of creation and redemption of Listed Class of Shares in the primary market and fees payable in respect of trading of Listed Class of Shares in the secondary market) and stamp dut y."
2992,"Accordingly, the performance of the different classes of Shares will be different."
2993,There is a separate Net Asset Value for each class of Shares.
2994,The Custodian does allow each class of Shares to have its own Net Asset Value (i.e.
2995,one Net Asset Value for one class of Shares).
2996,"Please refer to the “Risk associated with differences in trading, fee and cost arrangements between Listed Class and Unlisted Class(es) of Shares” risk factor of Part 1 of this Prospectus."
2997,"Termination Due to the nature of the listing of the Listed Class of Shares, the termination procedures applicable to the Listed Class of Shares and Unlisted Classes of Shares may differ."
2998,Please refer to the sub-section headed “Termination (otherwise than by winding up)” under the section headed “Statutory and General Information” of Part 1 of this Prospectus for further details Overview of US Treasury bond market 217 US Treasury securities are debt instruments issued by the U.S.
2999,"Department of Treasury to raise the money needed to operate the federal go vernment, and are backed by the full faith of the U.S."
3000,government.
3001,"Historically, the US Treasury securities have been part of debt financing since the Revolutionary War and is one of the primary financing tools used by the U.S."
3002,government throughout the years.
3003,"There are several types of US Treasury securities, including bills, notes, bonds, treasury inflation - protected securities (TIPS) and floating rate notes (FRNs) which are sold at auctions held by the U.S."
3004,Department of Treasury.
3005,US Treasury securities can also be bought and sold in the secondary market before the securities mature.
3006,US Treasury bonds are long -term securities with fixed maturities of more than 10 years.
3007,"They are issued with a fixed rate of interest, paid interest semi-annually, and are redeemed at par at maturity."
3008,"Historically, in 1963 a competitive bidding by syndicates of securities dealers and banks was introduced for Treasury bonds."
3009,"In 1974, the 25 -year bond issues became a regular feature of Treasury’s mid-quarter coupon refunding, and by 1977, the 30-year bond issues replaced the 25-year bond issues."
3010,"Currently, the U.S."
3011,"Department of Treasury auctions 20 -year and 30 -year bonds at original issue in February, May, August, and November and are re -opened for auction 8 times per year."
3012,"Investment Objective The investment objective of the Sub -Fund is to provide investment results that, before deduction of fees and expenses, closely correspond to the performance of the ICE US Treasury 20+ Year Bond Index (the “Index”)."
3013,"Investment Strategy In seeking to achieve the Sub -Fund’s investment objective, the Manager will primarily use a representative sampling strategy and invest in a representative sample of the constituent Securities of the Index (“Index Securities”) selected by the Manager that co llectively reflects the investment characteristics of the Index."
3014,"The Sub -Fund may or may not hold all Index Securities, and may hold US Treasury securities which are not included in the Index, provided that these securities collectively feature a high corr elation with the Index."
3015,The Sub-Fund may invest directly up to 100% of its Net Asset Value in Index Securities (i.e.
3016,US Treasury bonds).
3017,"The Sub -Fund may from time to time hold US Treasury securities with maturities other than at least 20 years that are not included in the Index, which the Manager believes will help the Sub -Fund achieve its investment objective."
3018,It is intended that at least 80% of the Net Asset Value of the Sub-Fund will be invested in US Treasury securities with remaining maturity of at le ast 20 years as constituent securities of the Index.
3019,The Sub -Fund may also invest not more than 10% of its Net Asset Value in cash and cash equivalents (including money market funds which are authorised under Chapter 8.2 of the Code) or eligible schemes under Chapter 7.11A of the Code for cash management purposes.
3020,"There is no current intention for the Sub -Fund to engage in sale and repurchase transactions, reverse repurchase transactions and/or other similar over -the-counter transactions."
3021,The Manager will seek the prior approval of the SFC (if required) and provide at least one month’s prior notice to Shareholders before the Sub-Fund engages in any such investments.
3022,The investment strategy of the Sub-Fund is subject to the investment and borrowing restrictions set out in Part 1 of this Prospectus.
3023,"Notwithstanding the investment and borrowing restrictions set out in Part 1 of this Prospectus, the Sub -Fund shall not invest in units or shares of other collective investment schemes, with the exception of money market funds that are either authorised by the SFC or eligible schemes as determined by the SFC."
3024,218 Securities Lending Transactions The Sub-Fund may enter into securities lending transactions for up to 50% of its Net Asset Value and the expected level of se curities lending transactions is approximately 20% of the Sub -Fund’s Net Asset Value.
3025,"The Manager may, on behalf of the Sub -Fund, recall the securities lent out at any time."
3026,All securities lending transactions will only be carried out in the best interest of the Sub-Fund and as set out in the relevant securities lending agreement.
3027,Such transactions may be terminated at any time by the Manager at its absolute discretion.
3028,"Please refer to the section headed “Investment Objective, Strategy And Restrictions, Securities Lending And Borrowing” in Part 1 of this Prospectus in regard to the details of the arrangements."
3029,"As part of the securities lending transactions, the Sub -Fund must receive cash and/or non -cash collateral (fulfilling the requirements under sub -section titled “Collateral” of the section headed “Investment Objective, Strategy and Restrictions, Securities Lending and Borrowing” in Part 1 of this Prospectus) of 100% of the global valuation of the securities lent (interests, dividends and other eventual r ights included)."
3030,The collateral will be marked -to-market on a daily basis and be subject to safekeeping by the Custodian or an agent appointed by the Custodian.
3031,Please refer to the section headed “Management of the Company and Sub-Funds” in Part 1 of this Prospectus in regard to the extent of the Custodian’s responsibility for the safekeeping of the assets of the Company and the appointment of agents.
3032,The valuation of the collateral generally takes place on trading day T.
3033,"If the value of the collateral fall s below 100% of the value of the securities lent on any trading day T, the Manager will call for additional collateral on trading day T, and the borrower will have to deliver additional collateral to make up for the difference in securities value by 4:00 p .m."
3034,on trading day T+2.
3035,"Non-cash collateral received may not be sold, re -invested or pledged."
3036,"Any re -investment of cash collateral received shall be subject to the requirements as set out in the sub-section titled “Collateral” of the section headed “Invest ment Objective, Strategy and Restrictions, Securities Lending and Borrowing” in Part 1 of this Prospectus."
3037,"To the extent the Sub -Fund undertakes securities lending transactions, all revenues (net of direct and indirect expenses as reasonable and normal com pensation for the services rendered by the Manager, a securities lending agent and/or other service providers in the context of such transactions to the extent permitted by applicable legal and regulatory requirements) shall be returned to the Sub -Fund."
3038,The cost relating to securities lending transactions will be borne by the borrower.
3039,"Securities lending transactions nonetheless give rise to certain risks including counterparty risk, collateral risk and operational risk."
3040,Please refer to the risk factors be low for further details.
3041,Use of derivatives The Sub-Fund may invest in FDIs for hedging or non -hedging (i.e.
3042,"investment) purposes, in order to achieve efficient portfolio management."
3043,The Sub -Fund’s net derivative exposure may be up to 50% of its Net Asset Value.
3044,"The Sub -Fund may invest no more than 10% of the Sub -Fund’s Net Asset Value in FDIs for investment and hedging purposes such as US Treasury bond futures, options or interest rate swaps, where the Manager believes such investments will help the Sub -Fund achieve its investment objective."
3045,The futures in which the Sub -Fund may invest will be index futures that exhibit high correlation with the Index in order to manage the Sub -Fund’s exposure to the Index constituents.
3046,"219 Sub-Fund Details Classes of Shares The Sub-Fund is currently available in 3 classes, namely: (a) Distributing Listed Share Class (in USD and HKD counters) is available for trading in the SEHK – Main Board."
3047,The Distributing Listed Share Class pays distribution to Shareholders of this share class (which may be made out of capital or effectively out of capital as well as income) at the Manager’s discretion.
3048,(b) Accumulating Listed Share Class (in USD counter only) is available for trading in the SEHK – Main Board.
3049,The Accumulating Listed Share Class is a share class that does not pay dividends to Shareholders of this share class.
3050,(c) Unlisted Classes of Shares are not listed on the SEHK and will be offered to investors at the initial Subscription Price of a fixed price per Share (as specified in this Appe ndix) during the Initial Offer Period.
3051,The Unlisted Classes of Shares of the Sub -Fund pays distribution to Shareholders of this share class (which may be made out of capital or effectively out of capital as well as income) at the Manager’s discretion.
3052,"Specific Risk Factors In addition to the risk factors presented in Part 1 of this Prospectus, the risk factors set forth below are also specific risks, in the opinion of the Manager, considered to be relevant and presently applicable to the Sub-Fund."
3053,Risk factors relevant to both Listed Class of Shares and Unlisted Classes of Shares Investment risk The Sub-Fund’s investment portfolio may fall in value due to any of the risk factors relevant to the Sub-Fund.
3054,"Whilst it is the intention of the manager to implement strategies which are designed to minimise tracking error, there can be no assurance that these strategies will be successful."
3055,"In addition, trading errors is an intrinsic factor to any investment process, and will occur, notwithstanding the execution of due care and special procedures designed to prevent such errors."
3056,It is possible that investors may lose a substantial proportion or all of its investment in the Sub -Fund where the Index value declines.
3057,Investors may suffer losses as a result.
3058,There is no guarantee of repayment of principal.
3059,"Concentration risk / Single issuer risk The Sub-Fund’s investments are concentrated in a single country, namely the US and in bonds of a single issuer."
3060,"The Sub-Fund’s value may be more volatile than that of a fund having a more diverse portfolio and may be more susceptible to adverse economic, political, policy, foreign exchange, liquidity, tax, legal or regulatory event affecting the US market."
3061,"The Sub -Fund’s investment in US Treasury securities is not subject to US withholding, income or capital gains tax."
3062,The Sub-Fund may invest up to 100% of its Net Asset Value in debt securities issued and/or guaranteed by the US government as a single sovereign issuer.
3063,Such investments are based on reference to the Index.
3064,Please note the ratings of the US government as a sovereign issuer may change from time to time.
3065,"Passive investment risk The Sub-Fund is passively managed, and the Manager will not have the discretion to adapt to market changes due to the inherent investment n ature of the Sub-Fund."
3066,Falls in the Index are expected to result in corresponding falls in the value of the Sub-Fund.
3067,"Accordingly, the Sub-Fund may be affected by a decline in the market segments relating to the Index."
3068,Investors may lose a significant part of their 220 respective investments if the Index falls.
3069,"The Sub -Fund invests in the Securities included in or representative of the Index regardless of their investment merit, except to the extent of any representative sampling strategy."
3070,The Manager does not attempt to select securities individually or to take defensive positions in declining markets.
3071,"Investors should note that the lack of discretion on the part of the Manager to adapt to market changes due to the inherent investment nature of the Sub- Fund will mean a decline in the Index or Indices are expected to result in corresponding falls in the Net Asset Value of the Sub-Fund, and investors may lose substantially all of their investment."
3072,Illiquidity of bonds close to maturity risk The Sub-Fund’s underlying fixed income securities may become more illiquid when nearing maturity.
3073,It therefore may be more difficult to achieve fair valuation in the market.
3074,"US Treasury risk US Treasury securities may differ from other securities in their interest rates, maturit ies, times of issuance and other characteristics and may provide relatively lower returns than those of other securities."
3075,"Similar to other issuers, changes to the financial condition or credit rating of the US government may affect the value of the US Treasury bonds held by the Sub-Fund."
3076,"Concentration of Index The Index and the investments of a Sub-Fund may be concentrated in securities of a single or several issuers, an industry or group of industries, or in a particular jurisdiction or market (including a n emerging market)."
3077,"Changes in the financial condition of an issuer, changes in specific economic or political conditions that affect an issuer, industry, jurisdiction or market, and changes in general economic or political conditions can adversely affect the value of Securities and result in price volatility."
3078,Such changes may have a negative impact on the Securities held by the Sub -Fund.
3079,The value of a Sub-Fund with concentrated investment exposure may be more volatile than that of a Sub -Fund having a more diverse portfolio of investments.
3080,"Risks relating to fixed income securities Credit / counterparty risk Investment in fixed income instruments is subject to the credit risk of the issuers which may be unable or unwilling to make timely payments of principa l and/or interest, and the value of the Sub -Fund is affected by the credit worthiness of its underlying investments."
3081,"In the event of a default or credit rating downgrading of the fixed income instruments (or the issuers thereof) held by the Sub-Fund, valuation of the Sub-Fund’s portfolio may become more difficult, the Sub-Fund’s value will be adversely affected and investors may suffer a substantial loss as a result."
3082,The Sub-Fund may also encounter difficulties or delays in enforcing its rights against the issuers who may be incorporated in countries/regions other than Hong Kong and therefore not subject to the laws of Hong Kong.
3083,"Fixed income instruments are offered on an unsecured basis without collateral, and will rank equally with other unsecured debts o f the relevant issuer."
3084,"As a result, if the issuer becomes bankrupt, proceeds from the liquidation of the issuer’s assets will be paid to holders of fixed income instruments only after all secured claims have been satisfied in full."
3085,The Sub -Fund is therefore fully exposed to the credit/insolvency risk of its counterparties as an unsecured creditor.
3086,Income risk The Sub-Fund’s income may decline when interest rates fall.
3087,"This decline can occur because the debt instruments held by the Sub-Fund will have floating, or variable, interest rates."
3088,Interest rate risk 221 The Sub-Fund’s investments in fixed income instruments are subject to interest rate risk.
3089,"Generally, the value of fixed income instruments is expected to be inversely correlated with changes in interest rates."
3090,"As interest rates rise, the market value of fixed income instruments tends to decrease."
3091,"As the Sub-Fund invests in US Treasury bonds, the Sub -Fund is additionally subject to policy risk as changes in macro-economic policies in the US (including monetary policy and fiscal policy) may have an influence over the US capital markets and affect the pricing of the bonds in the Sub-Fund’s portfolio, which may in turn adversely affect the return of the Sub -Fund."
3092,Falling interest rates can lead to a decline in income for the Sub-Fund.
3093,Interest rate risk is generally lower for shorter term fixed income investments and higher for longer term fixed income investments.
3094,Long -term fixed income instruments in general are subject to higher sensitivity to interest rate changes than short-term fixed income instruments.
3095,Any increase in interest rates may adversely impact the value of the Sub-Fund’s portfolio.
3096,"Valuation risk Valuation of the Sub-Fund’s investments may involve uncertainties and judgemental determinations, and independent pricing information may not at all times be available."
3097,"If such valuations should prove to be incorrect, the Net Asset Value of the Sub-Fund may need to be adjusted and may be adversely affected."
3098,The value of fixed income securities may be affected by changing market conditions or other significant events affecting valuation.
3099,"For example, in the event of the credit rating downgrade of an issuer, the value of the relevant fixed income instrument may decline rapidly, and the value of the Sub-Fund may be adversely affected."
3100,Credit risk and sovereign debt risk The Sub-Fund is exposed to the credit/default risk of issuers of debt securities that the Sub-Fund may invest in.
3101,"The financial condition of an issuer of a debt security or other instrument may cause such issuer to default, become unable to p ay interest or principal due or otherwise fail to honor its obligations or cause such issuer to be perceived as being in such situations."
3102,"Further, the Sub-Fund’s investment in securities issued or guaranteed by governments (e.g."
3103,"US government) may be exposed to political, social and economic risks and may not be able or willing to repay the principal and/or interest when due or may request the Sub-Fund to participate in restructuring such debts."
3104,The Sub- Fund may suffer significant losses when there is default in sovereign debt issuers.
3105,Credit rating risk Credit ratings assigned by rating agencies are subject to limitations and do not guarantee the creditworthiness of the security and/or issuer at all times.
3106,Downgrading risk The credit rating of a debt instrument or its issuer may subsequently be downgraded.
3107,"In the event of such downgrading, the value of the Sub-Fund may be adversely affected."
3108,The Manager may or may not be able to dispose of the debt instruments that are being downgraded.
3109,Securities lending transactions risk Securities lending transactions may involve the risk that the borrower may fail to return the securities lent out in a timely manner and the value of the collateral may fall below the value of the securities lent out.
3110,Difference in distribution policy The Manager will pay distributions to Shareholders of the Distributing Listed Share Class and may pay distributions to Shareholders of the Unlisted Classes of Shares but not to Shareholders of the Accumulating Listed Share Class.
3111,Distributions made in respect of the Distributing Listed Share Class 222 and Unlisted Classes of Shares may result in an immediate reduction in their respective Net Asset Value per Share.
3112,All income and capital gain received in the Accumulating Listed Share Class will be reinvested and reflected in the Net Asset Value per Share.
3113,The difference in the distribution policies of the classes will lead to difference in the Net Asset Value between the classes.
3114,"Distributions out of or effectively out of capital risk In respect of the Distributing Listed Share Class and Unlisted Classes of Shares, the Manager may, at its discretion make distributions out of capital."
3115,"The Manager may also, at its discretion, make distributions out of gross income while all or part of the fees and exp enses of the Distributing Listed Share Class and/or Unlisted Classes of Shares of the Sub-Fund respectively are charged to/paid out of the capital of that class of the Sub -Fund, resulting in an increase in distributable income for the payment of distributions by that class of the Sub-Fund and therefore, that class of the Sub-Fund may effectively pay distributions out of the capital."
3116,Payment of distributions out of capital or effectively out of capital amounts to a return or withdrawal of part of an investor ’s original investment or from any capital gains attributable to that original investment.
3117,Any distributions involving payment of distributions out of or effectively out of Distributing Listed Share Class and/or Unlisted Classes of Shares of the Sub -Fund’s capital may result in an immediate reduction of the Net Asset Value per Share of that class of the Sub -Fund.
3118,The Manager may amend its distribution policy subject to the SFC’s prior approval (to the extent required under applicable regulatory requirements) and by giving not less than one month's prior notice (or such shorter notice period as may be permitted under applicable regulatory requirements) to Shareholders.
3119,Derivatives risk The Sub-Fund may invest in FDIs for hedging purposes and in adverse situat ions its use of FDIs may become ineffective and/or cause the Sub -Fund to suffer significant loss.
3120,"Risks associated with FDIs include counterparty/credit risk, liquidity risk, valuation risk, volatility risk and over -the-counter transaction risk."
3121,The levera ge element / component of an FDI can result in a loss significantly greater than the amount invested in the FDI by the Sub -Fund.
3122,Exposure to FDIs may lead to a high risk of significant loss by the Sub-Fund.
3123,Please refer to “Collateral and FDI Risks” under the section entitled “Risk Factors” in Part 1 of this Prospectus for further details.
3124,"Tracking error risk The Sub-Fund may be subject to tracking error risk, which is the risk that its performance may not track that of the Index exactly."
3125,The Sub -Fund only holds a representative sample of securities that represents the profile of the Index and may invest in US Treasury bonds that are not included in the Index.
3126,The Net Asset Value of the Sub -Fund may not have exactly the same net asset value of the Index.
3127,"Factors such as fees and expenses of the Sub -Fund, the investments of the Sub -Fund not matching exactly the constituent securities which make up the Index, an inability to rebalance the Sub-Fund’s holdings of securities in response to changes to the securities which make up the Index, rounding of securities prices, changes to the Index and regulatory policies that may affect the Manager’s ability to achieve close correlation with the Index."
3128,The Manager will monitor and seek to manage such risk and minimise tracking error.
3129,Although the Manager will regularly monitor the level of correspondence of the performance of a Sub-Fund with the performance of the Index (i.e.
3130,"“tracking accuracy”), there is no assurance that the Sub -Fund will achieve any particular level of tracking accuracy and/or no guarantee or assurance of exact or identical replication by the Sub -Fund of the performance of the Index due to, amongst others, the fees and expenses of the Sub-Fund and/or the liquidity of the market."
3131,"Differences in dealing, fee and cost arrangement between Listed Class of Shares and Unlisted Classes of Shares The Sub -Fund offers both Listed Class of Shares and Unlisted Classes of Shares."
3132,"Dealing arrangements in respect of Listed Class of Shares and Unlisted Classes of Shares are different, and 223 depending on market conditions, investors of the Listed Class of Shares may be at an advantage compared to investors of the Unlisted Classes of Shares, or vice versa."
