sentence_id,text
1733,"Emerging market risk The Sub-Fund will invest in emerging markets such as Mainland China, which are subject to higher risks (for example, liquidity risk, currency risk, political risk, regulatory risk, legal and taxation risks, settlement risk, custody risk and economic risk) and higher volatility than more developed markets."
1734,"This is due to, among other things, greater market volatility, lower trading volume, political and economic instability, settlement risk (including risks arising from settlement procedures), greater risk of market shut down and more governme ntal limitations on foreign investment than those typically found in developed markets."
1735,"Some emerging markets securities may be subject to brokerage or securities transfer taxes levied by governments, which would have the effect of increasing the cost of investment and which may reduce the realised gain or increase the loss on such securities at the time of sale."
1736,"Risks relating to fixed income securities Short-term fixed income instruments risk As the Sub-Fund invests substantially in short -term fixed income instruments with short maturities, 132 the turnover rates of the Sub -Fund’s investments may be relatively high and the transaction costs incurred as a result of the purchase or sale of short-term fixed income instruments may also increase which in turn may have a negative impact on the Net Asset Value of the Sub-Fund."
1737,The Sub-Fund’s underlying fixed income securities may become more illiquid when nearing maturity.
1738,It therefore may be more difficult to achieve fair valuation in the market.
1739,"Credit / counterparty risk Investment in fixed income instruments is subject to the credit risk of the issuers and the guarantors (if applicable) which may be unable or unwilling to make timely payments of principal and/or interest, and the value of the Sub -Fund is affected by the credit worthiness of its underlying investments."
1740,"In the event of a default or credit rating downgrading of the fixed income instruments (or the issuers or the guarantors thereof) held by the Sub -Fund, valuation of the Sub -Fund’s portfolio may becom e more difficult, the Sub-Fund’s value will be adversely affected and investors may suffer a substantial loss as a result."
1741,The Sub-Fund may also encounter difficulties or delays in enforcing its rights against the issuers or guarantors who may be incorporated in countries/regions other than Hong Kong and therefore not subject to the laws of Hong Kong.
1742,"Fixed income instruments are offered on an unsecured basis without collateral, and will rank equally with other unsecured debts of the re levant issuer."
1743,"As a result, if the issuer becomes bankrupt, proceeds from the liquidation of the issuer’s assets will be paid to holders of fixed income instruments only after all secured claims have been satisfied in full."
1744,The Sub -Fund is therefore fully exposed to the credit/insolvency risk of its counterparties as an unsecured creditor.
1745,Volatility and liquidity risk The fixed income securities in the Greater China markets (in particular Mainland China and Taiwan) and other emerging markets may be subject to higher volatility and lower liquidity compared to more developed markets.
1746,The prices of securities traded in such markets may be subject to fluctuations.
1747,The bid and offer spreads of the price of such securities may be large and the Sub -Fund may incur significant trading costs.
1748,Interest rate risk The Sub-Fund’s investments in fixed income instruments are subject to interest rate risk.
1749,"Generally, the value of fixed income instruments is expected to be inversely correlated with changes in interest rates."
1750,"As interest rates rise, the market value of fi xed income instruments tends to decrease."
1751,Long - term fixed income instruments in general are subject to higher sensitivity to interest rate changes than short-term fixed income instruments.
1752,Any increase in interest rates may adversely impact the value of the Sub-Fund’s portfolio.
1753,"As the Sub-Fund may invests in emerging market debt (for example, the Mainland China markets), the Sub-Fund is additionally subject to policy risk as changes in macro-economic policies an emerging market country/region (including monetary policy and fiscal policy) may have an influence over such country/region’s capital markets and affect the pricing of the bonds in the Sub-Fund’s portfolio, which may in turn adversely affect the return of the Sub-Fund."
1754,Credit rating risk Credit ra tings assigned by rating agencies are subject to limitations and do not guarantee the creditworthiness of the security and/or issuer and/or guarantor at all times.
1755,"Credit rating agency risk In respect of investments in onshore China fixed income securitie s, the credit appraisal system in Mainland China and the rating methodologies employed in Mainland China may be different from 133 those employed in other markets."
1756,Credit ratings given by Mainland China rating agencies may therefore not be directly comparable with those given by other international rating agencies.
1757,"Risk of credit rating downgrades Changing market conditions or other significant events, such as credit rating downgrades affecting issuers or guarantors or major financial institutions, may also su bject the Sub -Fund to increased liquidity risk as it may become more difficult for the Sub-Fund to dispose of its holdings of bonds at a reasonable price or at all, which would have an adverse impact on the value and performance of the Sub-Fund."
1758,The Manager may or may not be able to dispose of the fixed income instruments that are being downgraded.
1759,"Valuation risk Valuation of the Sub-Fund’s investments may involve uncertainties and judgemental determinations, and independent pricing information may not at all times be available."
1760,"If such valuations should prove to be incorrect, the Net Asset Value of the Sub-Fund may need to be adjusted and may be adversely affected."
1761,The value of fixed income securities may be affected by changing market conditions or other significant events affecting valuation.
1762,"For example, in the event of the credit rating downgrade of an issuer, the value of the relevant fixed income instrument may decline rapidly, and the value of the Sub-Fund may be adversely affected."
1763,"Settlement risk To the extent that the Sub-Fund transacts in the inter-bank bond market in Mainland China, the Sub- Fund may also be exposed to risks associated with settlement procedures and default of counterparties."
1764,"If counterparty defaults in delivering the securities, the trade may be cancelled and this may adversely affect the value of the Sub-Fund."
1765,Any transaction via exchange markets may also be subject to settlement delays.
1766,Please also refer to “Risks associated with onshore China bonds – Settlement risks” below for further details.
1767,"Sovereign debt obligations By investing in debt obligations issued or guaranteed by governmental entities, the Sub-Fund will be exposed to the direct or indirect consequences of political, social and economic changes in various countries and regions."
1768,"In adverse situations, the sovereign issuers may not be able or willing to repay the principal and/or interest when due or may request the Sub -Fund to participate in restructuring such debts."
1769,The Sub -Fund may suffer significant losses when th ere is a default of sovereign debt issuers.
1770,Political changes in a particular country/region may affect the willingness of a particular government to make or provide for timely payments of its debt obligations.
1771,"The country/region's economic status, as reflected, among other things, in its inflation rate, the amount of its external debt and its gross domestic product, will also affect the government's ability to honour its obligations."
1772,"The ability of governments to make timely payments on their debt obligations is likely to be influenced strongly by the issuer's balance of payments, including export performance, and its access to international credits and investments."
1773,"To the extent that a particular country/region receives payment for its exports in currenci es other than the currency of the relevant debt obligation, such country/region's ability to make debt payments in the currency of the relevant debt obligation could be adversely affected."
1774,"To the extent that a particular country/region develops a trade def icit, such country/region will need to depend on continuing loans from foreign governments, supranational entities or private commercial banks, aid payments from foreign governments and on inflows of foreign investment."
1775,"The access of a particular country/region to these forms of external funding may not be certain, and a withdrawal of external funding could adversely affect the capacity of such country/region to make payments on its debt obligations."
1776,"In addition, the cost of servicing debt 134 obligations can b e affected by a change in global interest rates since the majority of these debt obligations carry interest rates that are adjusted periodically based upon global rates."
1777,"The Sub-Fund’s portfolio may comprise debt obligations of governmental entities and su pranational entities, for which a limited or no established secondary market exists."
1778,Reduced secondary market liquidity may have an adverse effect on the market price and the Sub -Fund’s ability to dispose of particular instruments when necessary to meet li quidity requirements or in response to specific economic events such as deterioration in the creditworthiness of the issuer.
1779,Reduced secondary market liquidity for such debt obligations may also make it more difficult to obtain accurate market quotations for the purpose of determining the Net Asset Value of the Sub -Fund.
1780,Market quotations are generally available on many sovereign debt obligations only from a limited number of dealers and may not necessarily represent firm bids of those dealers or prices for actual sales.
1781,The holder of certain sovereign debt obligations may have limited legal recourse in the event of a default with respect to such obligations.
1782,"For example, remedies from defaults on certain debt obligations of governmental entities, unlike those on private debt, must, in some cases, be pursued in the courts of the defaulting party itself."
1783,Legal recourse therefore may be significantly diminished.
1784,"Bankruptcy, moratorium and other similar laws applicable to issuers of sovereign debt obligations may be substantially different from those applicable to issuers of private debt obligations."
1785,"The political context, expressed as the willingness of an issuer of sovereign debt obligations to meet the terms of the debt obligation, for example, is of considerable importance."
1786,"In addition, investment in debt obligations of supranational entities is subject to the additional risk that one or more member governments may fail to make required capital contributions to a particular supranational entity and, as a result, such supranational entity may be unable to meet its obligations with respect to its debt obligations."
1787,"Corporate debt obligations Investment in debt obligations issued by companies and other entities, is subject to the risk that a particular issuer may n ot fulfil its payment or other obligations in respect of such debt obligations."
1788,"Additionally, an issuer may experience an adverse change in its financial condition which may in turn result in a decrease in the credit rating assigned to such issuer and its debt obligations, possibly below investment grade."
1789,"Such adverse change in financial condition or decrease in credit rating(s) may result in increased volatility in the price of an issuer's debt obligations and negatively affect liquidity, making any such debt obligation more difficult to sell."
1790,Risks relating to bank deposits Bank deposits are subject to the credit risks of the relevant financial institutions.
1791,"The Sub-Fund may also place deposits in non-resident accounts (NRA) and offshore accounts (OSA), which are offshore deposits with offshore branches of Mainland Chinese banks."
1792,"The Sub -Fund’s deposit may not be protected by any deposit protection schemes, or the value of the protection under the deposit protection schemes may not cover the full amount d eposited by the Sub -Fund."
1793,"Therefore, if the relevant financial institution defaults, the Sub-Fund may suffer losses as a result."
1794,Risks associated with onshore China bonds Mainland China sovereign debt risk The Sub-Fund’s investments may include sovereign d ebt securities and such investments involve special risks.
1795,The Chinese governmental entity that controls the repayment of sovereign debt may not be able or willing to repay the principal and/or interest when due in accordance with the terms of such debt.
1796,"A Chinese governmental entity’s willingness or ability to repay principal and interest due in a timely manner may be affected by, among other factors, its cash flow situation, the extent of its 135 foreign reserves, the availability of sufficient foreign exchan ge on the date a payment is due, the relative size of the debt service burden to the economy as a whole, the Chinese governmental entity’s policy towards the International Monetary Fund and the political constraints to which a governmental entity may be su bject."
1797,"Chinese governmental entities may also be dependent on expected disbursements from foreign governments, multilateral agencies and others abroad to reduce principal and interest arrearage on their debt."
1798,"The commitment on the part of these governments , agencies and others to make such disbursements may be conditioned on a Chinese governmental entity’s implementation of economic reforms and/or economic performance and the timely service of such debtor’s obligations."
1799,"Failure to implement such reforms, ac hieve such levels of economic performance or repay principal or interest when due may result in the cancellation of such third parties’ commitments to lend funds to the Chinese governmental entity, which may further impair such debtor’s ability or willingn ess to service its debt on a timely basis."
1800,"Consequently, governmental entities may default on their sovereign debt."
1801,"Holders of Mainland China sovereign debt, including the Sub-Fund, may be requested to participate in the rescheduling of such debt and to ex tend further loans to governmental entities."
1802,"As at the date of this Prospectus, there is no bankruptcy proceeding by which sovereign debt on which a Chinese governmental entity has defaulted may be collected in whole or in part."
1803,The Sub-Fund’s recourse against a defaulting sovereign is limited.
1804,"In addition, a lowering of the credit rating of the Chinese government may also affect the liquidity of its sovereign debt securities, making it more difficult to sell."
1805,"In general, fixed income instruments that have a lower credit rating or that are non-rated will be more susceptible to the credit risk of the issuers."
1806,"In the event of a credit rating downgrade of the Chinese government, the Sub -Fund’s value will be adversely affected and investors may suffer a substantial loss as a result."
1807,"Settlement risks Settlement procedures in Mainland China are less developed and less reliable and may involve the Sub-Fund’s delivery of securities, or transfer of title to securities, before receipt of payment for their sale."
1808,The Sub-Fund may be subject to a risk of substantial loss if a securities firm defaults in the performance of its responsibilities.
1809,"The Sub-Fund may incur substantial losses if its counterparty fails to pay for securities the Sub -Fund has delivered, or for any reason fails to complete its contractual obligations owed to the Sub-Fund."
1810,"On the other hand, significant delays in settlement may occur in certain markets in registering the transfer of securities."
1811,Such delays could result in substantial losses for the S ub-Fund if investment opportunities are missed or if the Sub -Fund is unable to acquire or dispose of a security as a result.
1812,"To the extent that the Sub-Fund transacts in the inter-bank bond market in Mainland China, the Sub- Fund may also be exposed to risk s associated with settlement procedures and default of counterparties."
1813,All trades settled through CSDCC are on delivery versus payment basis.
1814,"If a counterparty defaults in delivering the securities, the trade may be cancelled and this may adversely affect the value of the Sub-Fund."
1815,The Sub-Fund may invest in the Chinese bond market via the exchange market and all bond trades will be settled through the CSDCC.
1816,"If a counterparty defaults in payment or delivery obligation, a trade may be delayed and this may adversely affect the value of the Sub-Fund."
1817,Concentration risk The Sub-Fund will invest primarily in RMB -denominated and settled short -term deposits and high quality money market instruments.
1818,"The Sub-Fund may also be concentrated in a particular market or region, including Greater China."
1819,The Sub -Fund is therefore likely to be more volatile than a broad - based fund that adopts a more diversified strategy.
1820,"The value of the Sub -Fund may be more susceptible to adverse economic, political, policy, foreign exchange, liquidity, tax, legal or regulatory events affecting the RMB money markets, or the market or region in which its investments are focused."
1821,"RQFII risks 136 RQFII system risks The rules regulating investments by RQFIIs in Mainland China and the repatriation of capital out of Mainland China are relatively new, and as such their application and interpretation are relatively untested and there is no certainty as to how they will be applied by the relevant Mainland China authorities in any given situation."
1822,Any chan ge to the RQFII systems may adversely affect the value of the Sub-Fund’s investments.
1823,"In addition, the Sub-Fund is exposed to the credit risk of the relevant onshore Mainland China custodians and brokers, and a default of any such Mainland China custodian or broker may cause significant losses."
1824,"RQFII regulation/status risk Changes to the foreign investment regulation in Mainland China may be made at any time by the CSRC and the SAFE, and such changes may have a detrimental impact on the ability of the Sub - Fund to achieve its investment objective."
1825,There can be no assurance that the RQFII status of the Manager will not be suspended or revoked.
1826,"Such event may hinder the ability of the Sub -Fund to invest in onshore Mainland China instruments, which may in turn affect the Sub -Fund’s ability to achieve its investment objective."
1827,"Changes of the relevant rules may have potential retrospective effect, which may affect the Sub-Fund’s ability to acquire securities in Mainland China via the RQFII regime."
1828,"There can be no assurance that the RQFII status of the Manager will not be suspended, revoked or invalidated."
1829,Such event may lead to substantial loss in the Sub -Fund as it may affect the implementation of the investment strategy of the Sub-Fund.
1830,Repatriation risk There is no assurance that Mainland China rules and regulations in relation to repatriation of funds invested via /RQFII will not change or that repatriation restrictions will not be imposed in the future.
1831,Any new restrictions on repatriation of the invested capit al and net profits may impact on the Sub - Fund’s ability to meet redemption requests.
1832,Risks associated with Mainland Inter-bank Bond Market Market volatility and potential lack of liquidity due to low trading volume of certain fixed income securities in th e Mainland inter -bank bond market may result in prices of certain fixed income securities traded on such market fluctuating significantly.
1833,The Sub -Fund is therefore subject to liquidity and volatility risks.
1834,"The bid and offer spreads of the prices of such securities may be large, and the Sub-Fund may therefore incur significant trading and realisation costs and may even suffer losses when selling such investments."
1835,The Sub -Fund is also exposed to risks associated with settlement procedures and default of counterparties.
1836,The counterparty which has entered into a transaction with the Sub-Fund may default in its obligation to settle the transaction by delivery of the relevant security or by payment for value.
1837,"For investments via the Foreign Access Regime, the relevant filings, registration with the PBOC and account opening have to be carried out via an onshore settlement agent, offshore custody agent, registration agent or other third parties (as the case may be)."
1838,"As such, the Sub-Fund is subject to the risks of default or errors on the part of such third parties."
1839,Investing in the Mainland inter -bank bond market via Foreign Access Regime is also subject to regulatory risks.
1840,The relevant rules and regulations on these regimes are subject to change which may have potential retrospective effect.
1841,"In the event that the relevant Mainland Chinese authorities suspend account opening or trading on the Mainland inter-bank bond market, the Sub-Fund’s ability to invest in the Mainland inter -bank bond market will be adversely affected."
1842,"In such event, the Sub- Fund’s ability to achieve its investment objective will be negatively affected."
1843,"137 In addition, there is no specific guidance by the Mainland tax authorities on the treatment of income tax and other tax categories payable in re spect of trading in Mainland inter -bank bond market by foreign institutional investors via the Foreign Access Regime."
1844,"By investing in the Mainland inter-bank bond market, the Sub -Fund may be at risk of being subject to Mainland Chinese taxes."
1845,"There is a possibility that the current tax laws, rules, regulations and practice in Mainland China and/or the current interpretation or understanding thereof may change in the future and such change(s) may have retrospective effect."
1846,"The Sub -Fund could become subject t o additional taxation that is not anticipated as at the date hereof or when the relevant investments are made, valued or disposed of."
1847,"Any of those changes may reduce the income from, and/or the value of, the relevant investments in the Sub-Fund."
1848,Bond Connect Risk.
1849,The relevant rules and regulations on Bond Connect are subject to change which may have potential retrospective effect.
1850,"Where a suspension in the trading through Bond Connect is effected, the Sub - Fund’s ability to invest in or access the Mainland China market will be adversely affected."
1851,"In such event, the Sub-Fund will have to increase its reliance on the RQFII regime or Foreign Access Regime, and its ability to achieve its investment objective could be negatively affected."
1852,“Dim Sum” bond market risks “Dim Sum” bonds are bonds which are issued outside of Mainland China but denominated in RMB.
1853,The “Dim Sum” bond market is still a relatively small market which is more susceptible to volatility and illiquidity.
1854,The operation of the “Dim Sum” bond marke t as well as new issuances could be disrupted causing a fall in the Net Asset Value of the Sub-Fund should there be any promulgation of new rules which limit or restrict the ability of issuers to raise RMB by way of bond issuances and/or reversal or suspen sion of the liberalisation of the offshore RMB (CNH) market by the relevant regulator(s).
1855,"Borrowing Risks The Sub -Fund may borrow for various reasons, such as facilitating redemptions or to acquire investments for the account of the Sub -Fund."
1856,"Borrowing involves an increased degree of financial risk and may increase the exposure of the Sub-Fund to factors such as rising interest rates, downturns in the economy or deterioration in the conditions of the assets underlying its investments."
1857,"There can be no assurance that the Sub-Fund will be able to borrow on favourable terms, or that the Sub-Fund's indebtedness will be accessible or be able to be refinanced by the Sub-Fund at any time."
1858,RMB currency risk The RMB is not a freely convertible currency as it is subject to foreign exchange control policies and repatriation restrictions imposed by the Chinese government.
1859,"Such government policies and restrictions are subject to change, and there can be no assurance that the RMB exchange rate will not fluctuate widely against the US dollar or any other foreign currency in the future."
1860,Non-RMB based investors are exposed to foreign exchange risk and there is no guarantee that the value of RMB against the investors’ base currencies (for example HKD) will not depreciate.
1861,Any depreciation of RMB could adversely affect the value of investor’s investment in the Sub -Fund.
1862,"In calculating the Net Asset Value per Share of a Class denominated in RMB (if applicable) and in effecting any currency conversions involving RMB, the Manager m ay apply the CNH rate (i.e."
1863,the exchange rate for the offshore RMB market in Hong Kong).
1864,"Although offshore RMB (CNH) and onshore RMB (CNY) are the same currency, they trade at different rates."
1865,Any divergence between CNH and CNY may adversely impact investors.
1866,Please also refer to “Offshore RMB (“CNH”) Market Risk” below for further details.
