sentence_id,text
812,"In the case of the final Ex -Dividend Date of the full year distribution period of the Trust, the Trustee will allocate for final distribution among the unitholders of the Trust as at the relevant Record Date the Manager's estimation of: (i) the lower of: ( a) all of the net income of the Trust (after deduction of the Trust's fees, costs and expenses properly payable from income and making an appropriate provision for the payment of accrued fees, costs and expenses properly payable from income); and (b) an amount equal to the average value of the Trust's NAV multiplied by the average yield of the Underlying Index (after deducting therefrom an amount in respect of all fe es, costs and expenses properly payable from income and an appropriate provision for the payment of accrued fees, costs and expenses properly payable from income), in each case in respect of that full year distribution period less the amount previously allocated and distributed by way of interim distribution; and (ii) such amount of any net realized capital gains, as determined by the Manager having due regard to the total return of the Underlying Index in the relevant period, the amount of net income to be distributed and the overall interests of unitholders, in respect of that full year distribution period less the amount of net realized capital gains previously allocated and distributed by way of interim distribution."
813,Any net income (after the deduction of the Trust's fees and expenses) and net realized capital gains that have not been allocated and distributed to unitholders in respect of a full year distribution period shall be allocated as Deposited Property following the final Record Date of the full year distribution period.
814,Amounts to be distributed in respect of each Unit will be rounded down to the nearest HK$0.01 per Unit.
815,Any amount of income not distributed in a semi -annual distribution period shall be taken into account when calculating the amount available for allocation and distribution to each unitholder on the next final Ex-Dividend Date.
816,"The Record Dates and Ex-Dividend Dates, and accordingly the distribution period, may be changed, or added to, as determined by the Manager with the prior approval of the Trustee."
817,Distributions payable to investors shall be paid for the respective semi-annual and annual distributions within two weeks of the relevant Ex -Dividend Date.
818,"To the extent that the Trustee and the Manager have made payments to HKSCC Nominees, neither the Tr ustee nor the Manager will have any responsibility for the distribution by HKSCC Nominees of such payments to CCASS Participants whose Units are registered in the name of HKSCC Nominees."
819,"Details of dividend declaration dates, dividend amounts, Ex -Dividend Dates and dividend payment dates will be published on the Trust's website, ABF Hong Kong Bond Index (hsbc.com.hk) , and the Stock Exchange's website, www.hkex.com.hk."
820,Note that the Trust's website has not been reviewed / authorized by the SFC.
821,Income received by the Trust pending distribution may be invested by the Manager in a manner consistent with achieving the investment objective of the Trust.
822,"Any moneys payable to a unitholder which remain unclaimed after a period of 12 months shall be accumulated by the Trustee in a special account (the ""Unclaimed Moneys Account"")."
823,"The Trustee shall cause such sums which represent moneys unclaimed by a unitholder for more than six years and interest, if any, earned thereon to be paid into court after deducting all fees, costs and expenses incurred in relation to such payment provided that if the said sum is insufficient to meet all such fees, costs and expenses, the Trustee shall be entitled to have recourse t o the Trust property."
824,Unclaimed moneys payable to a CCASS Participant are governed by the General Rules of CCASS and CCASS Operational Procedures in effect from time to time.
825,"Unitholders should be aware that, in accordance with the a forementioned calculation, the Dividends may therefore impact their tax position and accordingly investors are encouraged to seek appropriate tax advice in relation to their investment."
826,Investors should note that the payment of distributions out of capital represents a return or withdrawal of part of the amount they originally invested or from any capital gains attributable to the original investment.
827,Any distributions involving payment of dividends out of a capital will result in an immediate reduction in the NAV.
828,The composition of the latest dividends (i.e.
829,the relative amounts paid out of (i) net distributable income and (ii) capital) (if any) for the last 12 months is available from the Manager on request and on the website ABF Hong Kong Bond Index (hsbc.com.hk)12.
830,The Manager may amend the dividend policy with respective distribution out of capital subject to the SFC's prior approval and by giving not less than one month's prior notice to investors.
831,Income Equalisation The Manager may from time to time at its discretion operate an income equalisation account .
832,Income equalisation aims to mitigate the effects of subscriptions and redemptions during the financial year on the level of accrued income.
833,"The effect being that, if an investor subscribes during the accounting period, the subsequent dividend will include a portion representing a return of capital on the original investment."
834,12 Please note that this website has not been reviewed by the SFC.
835,"General Information Taxation As with any investment, prospective investors should consider how their investment in Units will be taxed."
836,The tax information in this Prospectus is provided as general information and does not constitute tax or legal advice.
837,Prospective investors should consult their own tax professional about the tax consequences of an investment in Units.
838,"Hong Kong Profits Tax As the Trust has been authorised as a Collective Investment Scheme by the SFC pursuant to section 104 of the SFO, the Trust is not expected to be subject to Hong Kong tax in respect of its authorised activities."
839,"Hong Kong profits tax will not be payable by an investor on dividends or other income distributions of the Trust or in respect of any capital gains or profits arising from the sale, redemption or other disposal of Units unless such transactions form part of a trade, profession or business carried on in Hong Kong."
840,"Hong Kong Stamp Duty In general, the sale, purchase or transfer of ""Hong Kong stock"" will be liable to Hong Kong stamp duty of 0.13% borne by each of the buyer and seller, on the purchase consideration."
841,"However, securities of the Trust are expected to only comprise bonds which qualify as “loan capital” under the Stamp Duty Ordinance (Cap."
842,117) of Hong Kong.
843,"On the basis that the scope of ""Hong Kong stock"" does not include ""loan capital"", such bonds should not attract Hong Kong stamp duty and the Trust should not be liable to stamp duty when buying, selling or transferring such bonds."
844,"Pursuant to the remission order issued by the Secretary for the Treasury on 20 October 1999, any Hong Kong stamp duty on the transfer of Hong Kong stocks to the Trust by an investor pursuant to an application in specie will be remitted or refunded."
845,"Similarly, Hong Kong stamp duty on the transfer of Hong Kong stock by the Trust to an investor upon redemption of units will also be remitted or refunded."
846,No Hong Kong stamp duty is payable by the Trust on an issue or redemption of units.
847,"Furthermore, no Hong Kong stamp duty is payable by an investor in relation to an issue or redemption of units to him or her."
848,No Hong Kong stamp duty is payable by investors when trading via sale or purchase of units of the Trust on the Stock Exchange due to a stamp duty remission granted by the Secretary for Financial Services and the Treasury to the Trust.
849,"Pursuant to the Stamp Duty (Amendment) Ordinance 2015, with effect from 13 February 2015, no stamp duty is payable on the transfer (purchase or sale) of units of all exchange traded funds on the Stock Exchange."
850,"For the Trust, as a stamp duty remission order was previously granted by the Secretary for Financial Services and the Treasury, hence no stamp duty was in effect payable for the transfer of units in the Trust prior to 13 February 2015."
851,"As such, the waiver of stamp duty does not affect the Trust in practice."
852,Automatic exchange of information Automatic exchange of information (“AEOI”) is an umbrella term covering a number of inter - governmental and multi-lateral agreements concerning information sharing between states to promote tax transparency.
853,Investors should consult their own tax advisors regarding AEOI requirements with respect to their own situation.
854,"In particular, investors who hold their units through intermediaries should confirm the AEOI compliance status of those intermediaries."
855,AEOI: Foreign Account Tax Compliance Act The US Foreign Account Tax Compliance Act (“FATCA”) requires non -U.S.
856,(foreign) financial institutions (“FFI”) to report certain investor information to the US authorities.
857,Under sections 1471 through 1474 of the U.S.
858,Internal Revenue Code if an FFI is not compliant with FATCA then a 30% withholding tax may be imposed on certain payments to FFIs.
859,"Currently this withholding tax only applies to payments that constitute interest, dividends and other types of income from U.S."
860,sources (such as dividends paid by a U.S.
861,corporation).
862,"However, beginning on 1 January 2019, this withholding tax is extended to the proc eeds received from the sale or disposition of assets that give rise to U.S."
863,source dividend or interest payments.
864,"These FATCA withholding taxes may be imposed on payments to the Trust unless (i) the Trust becomes FATCA compliant pursuant to the provisions of FATCA and the relevant regulations, notices and announcements issued thereunder, or (ii) the Trust is subject t o an appropriate Intergovernmental Agreement to improve international tax compliance and to implement FATCA (“IGA”)."
865,Hong Kong has signed an IGA Model 2 with the U.S.
866,and the Trust intends to comply with the terms of the IGA and local implementing regulations.
867,"As an IGA has been signed between Hong Kong and the U.S., FFIs in Hong Kong (such as the Trust) complying with the FFI Agreement (i) will generally not be subject to the above described 30% withholding tax; and (ii) will not be required to withhold tax on payments to recalcitrant accounts (i.e."
868,accounts of which the holders do not consent to FATCA reporting and disclosure to the U.S.
869,IRS) or close those recalcitrant accounts (provided that information regarding such recalcitrant account holders is reported to the U.S.
870,"IRS), but may be required to withhold tax on payments made to non-compliant FFIs."
871,"As at the date of the Prospectus, the Trust is treated as a “Non-reporting IGA FFIs” under IGA Model 2 with the U.S."
872,"This means that the Manager will act as ""FATCA sponsoring entity"" and carry out FATCA obligations on behalf of the Trust."
873,"In order to comply with its FATCA obligations, the Trust will be required to obtain certain information from its investors so as to ascertain their U.S."
874,tax status.
875,If the investor is a specified U.S.
876,"person, U.S."
877,owned non-U.S.
878,"entity, non-participating FFI (“NPFFI”) or does not provide the requisite documentation, the Trust may need to report information on these investors to the appropriate tax authority, as far as legally permitted."
879,"If an investor or an intermediary through which it holds its interest in the Trust fails to provide the Trust, its agents or authorised representatives with any correct, complete and accurate information that may be required for the Trust to comply with FATCA, the investor may be subject to withholding on amounts otherwise distributable to the investor, may be compelled to sell its inte rest in the Trust or, in certain situations, the investor’s interest in the Trust may be sold involuntarily (provided that the Manager or the Trustee shall observe relevant legal requirements and shall act in good faith and on reasonable grounds)."
880,"The Trust may, at its discretion, enter into any supplemental agreement without the consent of investors to provide for any measures that the Trust deems appropriate or necessary to comply with FATCA."
881,Investors should consult their own tax advisors regarding the FATCA requirements with respect to their own situation.
882,"In particular, investors who hold their Units through intermediaries should confirm the FATCA compliance status of those intermediaries to ensure that they do not suffer FATCA withholding tax on their investment returns."
883,"Although the Trust will attempt to satisfy any obligations imposed on it to avoid the imposition of the FATCA withholding tax, no assurance can be given that the Trust will be able to satisfy these obligations."
884,"If the Trust becomes subject to a withholding tax as a result of the FATCA regime, the value of the Units held by unitholders may suffer material losses."
885,AEOI: Common Reporting Standard Hong Kong’s Inland Revenue (Amendment) (No.3) Ordinance (the “Ordinance”) came into force on 30 June 2016 - this is the legislative framework for the implementation in Hong Kong of the OECD Standard for Automatic Exchange of Financial Account Information – Common Reporting Standard (the “CRS”).
886,"CRS in Hong Kong requires financial institutions, such as the Trust, and/or their agents to collect information relating to non-Hong Kong tax residents holding accounts with FIs, and for certain account holders, report their information to the Hong Kong Inland Revenue Department (“IRD”) who will in turn exchange the information with the jurisdiction(s) in which that account holder is resident."
887,"Generally, tax information will only be reported to the IRD and exchanged if such jurisdiction has a Competent Authority Agreement (“CAA”) with Hong Kong; however, the Trust and/or its agents may further collect information relating to residents of other jurisdictions."
888,"The CRS rules as implemented by Hong Kong require the Trust to, amongst other things: (i) register the Trust’s status as a ""Reporting Financial Institution"" with the IRD; (ii) conduct due diligence on its accounts (i.e., investors) to identify whether any such accounts are considered ""Reportable Accounts"" for CRS purposes; and (iii) report to the IRD information on such Reportable Accounts."
889,The IRD is expected on an annual basis to transmit the information reported to it to the government authorities of th e relevant jurisdictions with which Hong Kong has signed a CAA.
890,"Broadly, CRS contemplates that Hong Kong FIs should report on: (i) individuals or entities that are tax resident in a jurisdiction with which Hong Kong has signed a CAA; and (ii) certain entities controlled by individuals who are tax resident in such othe r jurisdiction."
891,"Under the Ordinance, details of investors, including but not limited to their name, address, tax residence, account number, account balance/value, distribution income and sale/redemption proceeds, may be reported to the IRD and subsequently exchanged with government authorities in the relevant jurisdictions of tax residence."
892,"By investing (or continuing to invest) in the Trust, investors shall be deemed to acknowledge that: (i) the IRD may be required to automatically exchange information as outlined above with relevant tax authorities in other jurisdictions; (ii) the Trust (or their agent) may be required to disclose to the relevant tax authorities in other jurisdictions certain confidential information when registering with such authorities and if such authorities contact the Trust (or its agent directly) with further enquiries; (iii) the Trust may require the investor to provide additional information and/or documentation which the Trust may be required to disclose to the IRD; (iv) in the event an investor does not provide the requested information and/or documentation, whether or not that actually leads to compliance failures by the Trust, the Trust reserves the right to take any action and/or pursue all remedies at its disposal including, without limitation, compulsory redemption or withdrawal of the investor concerned, to the extent permitted by applicable laws and the Trust’s constitutional documents and the Manager shall observe relevant legal requirements and shall act in good faith and on reasonable grounds; (v) no investor affected by any such action or remedy shall have any claim against the Trust (or its agent) for any form of damages or liability as a result of actions taken or remedies pursued by or on behalf of the Trust in order to comply with CRS in Hong Kong or any of the relevant underlying legislation; and (vi) the Trust may, at its discretion, enter into supplemental agreements without the consent of investors to provide for any measures that the Trust deems appropriate or necessary to comply with CRS regulations in Hong Kong."
893,"Anti-Money Laundering As part of the Manager's and the Trustee's responsibility for the prevention of money laundering and to comply with all applicable laws to which the Manager, the Trustee or the Trust is subject, the Manager, the Trustee or the Receiving Agent may require a detailed verification of a potential investor's identity and the source of payment of any subscriptions."
894,In the event of delay or failure by the applicant to produce any information required for verification purposes an order for Units may be refused.
895,"The Trustee will not participate in transactions or activities or make any payments denominated in US dollars, which, if carried out by a US person, would be subject to sanctions of the Office of Foreign Assets Control of the US Department of the Treasury."
896,HSBC group of companies has adopted a policy of compliance with the sanctions issued by the Office of Foreign Assets Control.
897,"As part of its policy, the Trustee may request for additional information if deemed necessary."
898,Financial Reports The Trust's financial year ends on 31st July in each year.
899,The Trustee will arrange for annual financial reports to be prepared in respect of the Trust and audited by the Trust' s auditors (who are currently KPMG).
900,"Such financial reports, along with reports prepared by the Manager and the Trustee will be published and distributed to unitholders by post and posted on the Trust's designated web-page within four months of the end of the Trust's financial year."
901,"In addition, the Trustee or the Manager will procure that unaudited interim reports will be published for the period ending 31 st January in each year and distributed to unitholders and posted on the Trust's web -page within two months of the end of that period."
902,The contents of these re ports will comply with the requirements of the SFC Code and such reports shall be prepared in accordance with generally accepted accounting principles of Hong Kong.
903,Annual and interim reports will be provided in English and Chinese.
904,Interim reports must apply the same accounting policies and method of computation as are applied to in the annual reports of the Trust and disclose a statement to such effect or include a description of the nature and effect of any change in these policies and methods.
905,"To the extent that any of the valuation principles used to determine the Trust's NAV per Unit at the Valuation Point with respect to each Dealing Day is or becomes inconsistent with generally accepted accounting principles of Hong Kong, the Trust's financial reports may not necessarily be in line with the published NAV per Unit."
906,"In this case, a reconciliation note may need to be included in the financial reports of the Trust to reconcile values arrived at by applying generally accepted accounting principles in Hong Kong and the NAV per Unit of the Trust by applying the Trust's valuation principles."
907,Notices Any notices required to be given to unitholders under the Trust Deed and/or by the SFC Code or the Listing Rules shall be sent by post to unitholders.
908,"In addition, such notices will be published on the Trust's designated web -page and the Stock Exchange's website."
909,Copies of such notices will also be available from the Participating Dealers and the Manager.
910,"Meetings of Unitholders The Trust Deed sets out procedures to be followed in respect of meetings of the unitholders, including provisions as to the giving of notice, appointment of proxies and quorum."
911,"Amending the Trust Deed without Unitholder Approval The Trustee and the Manager may not alter, modify or vary the terms of the Trust Deed whereby such alteration, modification or variation involves any material changes without obtaining the approval by an extraordinary resolution of unitholders, except where the alteration, modification or variation is: • made to enable the Trust to comply with fiscal or other statutory, regulatory or official requirements (whether or not having the force of law) of any country or authority provided that the Trustee certifies in writing that, in its opinion, such change is necessary to so comply; or • necessary to correct a manifest error and the Trustee certifies in writing accordingly; or • expedient for any purpose and the Trustee certifies in writing that, in its opinion, such alteration, modification or variation: - is not materially prejudicial to the interests of unitholders; and - does not to any material extent release the Trustee, the Manager or any other person from liability to unitholders; and - does not increase the costs and charges payable out of the Trust (other than costs incurred in altering, modifying or varying the Deed)."
912,"In addition, no alteration, modification or variation, regardless of it having been approved by extraordinary resolution, may impose any liability on any unitholder to make further payments in respect of Units held by him or to accept any additional liability in respect of the Units."
913,"The Trustee may in addition certify that, in its opinion, an amendment to the Trust Deed is necessary or desirable for the purposes of listing or maintaining a listing of the Units on the Stock Exchange , in which case, the approval of unitholders by extraordinary resolution will not be necessary to make that amendment."
914,Any amendment to be made to the Trust Deed by the Manager and the Trustee without requiring the prior approval of unitholders under the Trust Deed will require the approval of the Supervisory Committee.
915,Unless the SFC consents otherwise the Manager will give prior notice to unitholders in writing of any amendments made to the Trust Deed without unitholders' approval.
916,Intermediaries in Hong Kong No application monies should be paid to any intermediary in Hong Kong who is not licensed or registered to carry on Type 1 (dealing in securities) regulated activity under the SFO.
917,Liability and Indemnities The Trust Deed contains the duties and responsibilities of the Trustee and the Manager.
918,The Trust Deed requires that (subject as provided in the Trust Deed) the Trustee and the Manager exercise their respective powers and authorities in the exclusive interests of the unitholders.
919,"The SFC Code requires that the Trustee, amongst other things, take into its custody or under its control all of the property of the Trust, registers investments in its name or to its order and is liable for the acts and omissions of its nominees and agents in relation to the assets forming part of the property of the Trust."
920,The Trustee has appointed the Custodian to safekeep the property of the Trust.
921,"Under the SFC Code, the Manager must manage the Trust in accordance with the constitutive documents of the Trust (including, the Trust Deed) and must comply with the applicable requirements set out in the SFC Code."
922,"The SFC Code provides that neither the Trustee nor the Manager can be exempted from any liability to unitholders imposed under Hong Kong law or for breaches of trust through fraud or negligence, nor may they be indemnified against such liability by unitholders or at the expense of unitholders."
923,"The Trust Deed includes certain exclusions of liability and indemnities in favour of the Trustee and the Manager, other than in respect of the Trustee's or Manager's fraud, negligence, bad faith or wilful default."
924,The liability of unitholders must be limited to their Investments in the Trust.
