sentence_id,text
517,"In addition, the Manager reserves the right to require the substitution of an amount of cash (i.e., a ""cash in lieu"" amount) to be added to, and comprise part of, the Cash Component to replace any Deposit Security that may be unavailable or may not be available in sufficient quantity for delivery to the Trust."
518,"Participating Dealers who are permitted market makers (or whose wholly -owned subsidiary, holding company which owns all its issued shares or other wholly -owned subsidiary of that holding company (each a ""100% Group Company"") is a permitted market maker) may with the approval of the Manager also elect to substitute cash for Deposit Securities (to be added to and comprise part of the Cash Component) upon a creation of Units on any Dealing Day."
519,The aggregate value of all repl aced Index Securities and non-Index Securities substituted by cash shall not exceed 40% (or such other percentage as determined by the Manager from time to time and approved by the Trustee and the Supervisory Committee) of the Subscription Value on the previous Dealing Day .
520,"In addition, on any Dealing Day the sum of (i) the aggregate value of non -Index Securities comprising a Portfolio Deposit to be deposited with the Trust; and (ii) the amount of any cash in lieu of all substituted Index Securities and non-Index Securities shall not exceed 50% (or such other percentage as determined by the Manager from time to time and approved by the Trustee and the Supervisory Committee) of the Subscription Value on the previous Dealing Day."
521,"Whenever a cash payment in lieu of Deposit Securities is made by an investor via a Participating Dealer or a Participating Dealer who (or whose 100% Group Company) is a permitted market maker, an additional provision for duties and charges as determined by the Manager may also be charged (for the account of the Trust) to the Participating Dealer (as described under ""Fees Payable by Investors when creating or redeeming Units"" under the section entitled ""Management and Operations"")."
522,"Cash Creations On any Dealing Day, Units will be available for subscription in Creation Unit aggregations for cash at the Subscription Value (calculated on a per Unit basis if applicable)."
523,"The full amount of the Subscription Value, and any duties and charges and Transact ion Fees, in cleared funds, shall be paid in respect of such Creation Unit (or Unit) aggregations according to the procedures discussed in the section entitled ""Creation of Units - Placement of Creation Orders in Cash""."
524,"Whenever a cash payment is made by an investor as a result of cash creations effected on a Dealing Day, an additional provision for duties and charges as determined by the Manager may be charged (for the account of the Trust) to that investor (as described under ""Fees Payable by Investors when creating or redeeming Units"" under the section entitled ""Management and Operations"")."
525,"The minimum amount for any order for cash creations on a Dealing Day is 50,000 Units."
526,The Manager aims to fully invest the cash proceeds received as a result of cash creations effected on a Dealing Day for the account of the Trust by the end of the Transaction Date (as defined below) to which such cash creations relate.
527,"Procedures for Creation of Units To be eligible to place orders with the Receiving Agent to create a Creation Unit of the Trust, an entity must be (i) a broker or custodian who is admitted for the time being by Hongkong Clearing as a participant of CCASS (a "" CCASS Participant"") or (ii) able to effect transactions through a CCASS Participant, and who has entered into an agreement with the Receiving Agent, the Manager and the Trustee with respect to creations and redemptions of Units (""Participant Agreement"")."
528,"Such party is referred to as a ""Participating Dealer""."
529,Investors may contact the Receiving Agent for the names of Participating Dealers that have entered into a Participant Agreement.
530,"In addition, a list of the current Participating Dealers is available on the Trust's designated web-page."
531,"All Units, however created, will be entered on the records of CCASS in the name of HKSCC Nominees for the account of a CCASS Participant."
532,"All orders to create Units must be received by the Receiving Agent no later than 2:30 p.m., Hong Kong time (the "" Creation Dealing Deadline "")."
533,If the order in proper form is received by the Receiving Agent after the Creation Dealing Deadline on any Dealing Day it will be deemed to have been received on the next Dealing Day.
534,"Whether or not a creation order has been received by the Receiving Agent by the Creation Dealing Deadline shall be determined by the Receiving Agent, whose determination shall be final and binding."
535,"The date on which an order to create Units (or an order to redeem Units, as discussed below) is received or treated as having been received by the Receiving Agent is referred to as the "" Transaction Date""."
536,Orders must be transmitted to the Receiving Agent by a Participating Dealer in wr iting or other transmission method acceptable to the Receiving Agent pursuant to procedures set forth in the Participant Agreement.
537,"However, a Participating Dealer may telephone the Receiving Agent to confirm the Receiving Agent's receipt of a creation or der."
538,"Severe economic or market disruptions or changes, or facsimile or other communication failure may impede the ability to reach the Receiving Agent or a Participating Dealer."
539,"All investor orders to create Units must be placed with a Participating Dealer, in the form required by such Participating Dealer."
540,"In addition, the Participating Dealer may request the investor to make certain representations or enter into agreements with respect to the order, for example, to provide for payments of cash, when required."
541,"Investors should be aware that their particular broker or dealer may not have executed a Participant Agreement and that, therefore, orders to create Units have to be place d by the investor's broker or dealer through a Participating Dealer that has entered into a Participant Agreement."
542,In such cases there may be additional charges to such investor.
543,"At any given time, there will be only a limited number of Participating Dealers."
544,Those placing orders for Units should afford sufficient time to permit proper submission of the order to the Receiving Agent prior to the Creation Dealing Deadline on the relevant Dealing Day.
545,"Placement of Creation Orders in Kind To initiate an order for a Creation Unit aggregation of the Trust in kind, the Participating Dealer must submit a completed order to the Receiving Agent no later than the Creation Dealing Deadline on the relevant Dealing Day."
546,All creation orders in kind must be in a Creation Unit aggregation.
547,"In the case of a cash in lieu order, the Participating Dealer must also comply with the credit requirements of the Trustee."
548,"The Receiving Agent is required to inform the Manager, the Trustee and the Custodian of all such orders."
549,"All questions as to the number and type of Deposit Securities to be delivered, and the validity, form and eligibility (including time of receipt) for the deposit of any tendered securities, will be determined by the Custodian on behalf of the Trustee, whose determination will be final and binding."
550,"The Deposit Securities must be delivered to the Custodian no later than 11:30 a.m., Hong Kong time on the second Dealing Day following the relevant Transaction Date (T+2)."
551,"The amount of cash in respect of the Cash Component (plus the Transaction Fee and any other duties and charges) must be transferred directly to the Custodian in a timely manner so as to be received by the Custodian no later than 11:30 a.m., Hong Kong time on the second Dealing Day following the relevant Transaction Date (T+2)."
552,"However, if the Custodian does not receive both the required Deposit Securities and Cash Component (plus the Transaction Fee and any other duties and charges) by 11:30 a.m."
553,"on the second Dealing Day following the relevant Transaction Date (T+2), the creation order will be cancelled."
554,"Upon written notice to the Receiving Agent, such cancelled order may be resubmitted by the Participating Dealer the following Dealing Day using a Portfolio Deposit as newly constituted for that following Dealing Day."
555,"In addition to the Transaction Fee and any duties and charges applicable to a creation of Units, Participating Dealers will be charged a second Transaction Fee resulting from creation orders submitted by them that are cancelled by the Participating Dealer (otherwise than as permitted by the Trust Deed or the Participant Agreement ) or that are cancelled as a result of the Participating Dealer failing to deliver or transmit the requisite cash."
556,"In addition, Participating Dealers may also be charged the amount of any losses and interest costs arising in respect of the Trust's sale and/or purchase of Index Securities, non-Index Securities and/or other investments permitted by the Trust Deed ("" Investments"") in connection with such cancellation and any difference between (i) the issue price of the Units the subject of the cancellation at the Transaction Date of the creation order and (ii) the redemption value of such Units as at the cancellation date."
557,Default interest will also be payable on the above amounts.
558,The delivery of Creation Units properly applied for will occur no later than the Dealing Day which is two Dealing Days following the relevant Transaction Date (T+2).
559,"Placement of Creation Orders in Cash To initiate an order for a Creation Unit aggregation of the Trust in cash on any Dealing Day, the Participating Dealer must submit a completed order to the Receiving Agent no later than the Creation Dealing Deadline for the relevant Dealing Day."
560,The Receiving Agent is required to inform the Manager and the Trustee of all such orders.
561,"The amount of cash payments in respect of cash creations in Creation Unit aggregations (plus the Transaction Fee and any other duties and charges) must be transferred directly to the Custodian in a timely manner so as to be received by the Custodian no later than 11:30 a.m., Hong Kong time on the second Dealing Day following the relevant Transaction Date (T+2)."
562,"However, if the Custodian does not receive the cash (plus the Transaction Fee and any other duties and charges) by 11:30 a.m."
563,"on the second Dealing Day following the relevant Transaction Date (T+2), the creation order will be cancelled."
564,"Upon written notice to the Receiving Agent, such cancelled order may be resubmitted by the Participating Dealer on the following Dealing Day."
565,"In addition to the Transaction Fee and any duties and charges applicable to a creation of Units, Participating Dealers will be charged a second Transaction Fee resulting from creation orders submitted by them that are cancelled by the Participating Dealer (otherwise than as permitted by the Trust Deed or the Participant Agreement) or that are cancelled as a result of the Participating Dealer failing to deliver or transmit the requisite cash."
566,"In addition, Participating Dealers may also be charged the amount of any losses and interest costs arising in respect of the Trust's sale and/or purchase of Investments in connection with such cancellation and any difference between (i) the issue price of the Units the subject of the cancellation at the Transaction Date of the creation order and (ii) the redemption value of such Units as at the cancellation date."
567,Default interest will also be payable on the above amounts.
568,The delivery of Creation Units properly applied for will occur no later than the Dealing Day which is two Dealing Days following the relevant Transaction Date (T+2).
569,Acceptance of Orders for Units The Trustee and the Manager reserve the absolute right without giving any reason therefor to reject a creation order transmitted to the Receiving Agent in respect of the Trust.
570,"It is the current intention of the Manager that a creation order will be rejected if: (i) the order is not in proper f orm; (ii) under applicable law or regulation, the applicant is not eligible to subscribe for, purchase or hold Units, or in the discretion of the Trustee or the Manager the purchase or holding of Units by the applicant might result in the Trust, the Manage r or the Trustee incurring any liability to tax or suffering any other financial disadvantage or becoming subject to any law or regulation which they might not otherwise have incurred or suffered or become subject to; (iii) the securities delivered as Depo sit Securities do not comprise a basket of Deposit Securities as disseminated by the Receiving Agent for that Dealing Day, as described above; (iv) acceptance of the Deposit Securities would have certain adverse tax consequences to the Trust; (v) acceptance of the Portfolio Deposit would, in the opinion of the Trustee or the Manager, be unlawful; (vi) acceptance of the Portfolio Deposit would otherwise, in the discretion of the Trustee or the Manager, have an adverse effect on the Trust or the rights of beneficial owners; or (vii) in the event that circumstances outside the control of the Trustee, the Custodian, the Receiving Agent or the Manager make it for all practical purposes impossible to process creation orders (examples of such circumstances include acts of God; public service or utility problems such as fires, floods, extreme weather conditions and power outages resulting in telephone, facsimile and computer failures; market conditions or activities causing trading halts; systems failures involving computer or ot her information systems affecting the Trustee, the Manager, the Receiving Agent, the Custodian, CCASS, the Stock Exchange or any other participant in the creation process, and similar extraordinary events)."
571,The Receiving Agent will notify the Participating Dealer of any rejection of an order placed by that Participating Dealer.
572,"The Trustee, the Manager, the Custodian and the Receiving Agent are under no duty to: (i) give notification of any defects or irregularities in the delivery of Portfolio Deposits nor will any of them incur any liability for the failure to give any such not ification; or (ii) provide reasons for rejecting a creation order transmitted to the Receiving Agent in respect of the Trust."
573,"Creation orders will be confirmed to Participating Dealers by the Receiving Agent before 5 p.m., Hong Kong time on the Transaction Date."
574,"Participating Dealers may, however, (and are strongly recommended to) telephone the Receiving Agent to confirm the Rec eiving Agent's receipt of any creation order it submits."
575,"No Units will be issued and no creation orders will be accepted during any period when the creation and redemption of Units is suspended (see the section entitled ""Suspension of Creations and Redemptions"" below)."
576,"The Manager may, with the prior approval of the Trustee, at its discretion change the number of Units comprising a Creation Unit aggregation for the purpose of effecting creations of Units."
577,"Creation orders not placed through Participating Dealers Notwithstanding the above, the Manager may in exceptional circumstances, at its discretion and with the prior approval of the Trustee, accept a creation order from an investor that is not a Participating Dealer provided such person making the creation orde r has agreed to comply with equivalent terms governing creations made through a Participating Dealer in all material respects save to the extent otherwise agreed by the Manager and the Trustee."
578,"The Manager shall only exercise its discretion to accept a cre ation order from an investor that is not a Participating Dealer if it considers: (a) a more efficient creation mechanism can be established for such investor than the process in place for creation orders through a Participating Dealer; (b) there are except ional circumstances which cause creations through a Participating Dealer to be less effective for such investor; and (c) it would not, in the opinion of the Trustee, materially prejudice the interests of the other unitholders."
579,Redemption of Units Creation Units may be redeemed in kind and for cash.
580,Units may only be redeemed in a Creation Unit aggregation.
581,Redemption of Units in Creation Unit aggregations in Kind Units of the Trust may be redeemed only in Creation Unit aggregations through the Receiving Agent at their prevailing NAVs calculated at the Valuation Point with respect to the Dealing Day on which the Receiving Agent receives or is treated as having received a request in proper form (i.e.
582,the Transaction Date).
583,Units may not be redeemed in amounts less than Creation Unit aggregations.
584,"Payment for such redemptions will normally be in the form of an in -kind transfer of a basket of fixed income securities comprised in the Trust's portfolio, as determined for that Dealing Day by the Manager provided that the value of Non -Index Securities (on the previous Dealing Day) shall not exceed 20% (or such other percentage as determined by the Manager from time to time with the approval of the Trustee and Supervisory Committee) of the NAV of the Creation Unit aggregation being redeemed (""Redemption Securities""), as described below."
585,"The Receiving Agent, through the Trust's web-page or such other methods as the Receiving Agent may determine from time to time, will make available on each Dealing Day, prior to the opening of trading on the Stock Exchange, the list of Redemption Securities that will be applicable to redemption requests received or deemed to be received for that Dealing Day."
586,Redemption Securities received on redemption may not be identical to Deposit Securities that are applicable to creations of Creation Unit aggregations.
587,"The redemption proceeds for a Creation Unit aggregation will generally consist of Redemption Securities, plus or minus cash (the ""Cash Redemption Amount"") in an amount equal to the difference between (1) the Subscription Value and (2) the total aggregate market value (per Creation Unit of the Trust) of the Redemption Securities transferred in kind, determined at the Valuation Point less the redemption Transaction Fee."
588,"The Cash Redemption Amount serves the function of compensating for differences, if any, b etween the NAV per Creation Unit and the Redemption Securities' NAV, determined at the Valuation Point in respect of each Creation Unit."
589,"If the Cash Redemption Amount is a negative number (i.e., the NAV per Creation Unit is less than the Redemption Securi ties' NAV), a compensating cash payment equal to the difference is required to be made to the Custodian by or through a Participating Dealer by the redeeming investor."
590,"Cash Redemptions On a Dealing Day, unitholders may submit a request for either cash redemption or in -kind transfer of Redemption Securities and the Cash Redemption Amount."
591,"If no election is made, the Manager shall treat the redemption request to be a request for an in -kind transfer of Redemption Securities and the Cash Redemption Amount but retains the absolute discretion to distribute cash in settlement of the redeemed Units."
592,Units may be redeemed in Creation Unit aggregations at their prevailing NAVs calculated at the V aluation Point with respect to the Dealing Day on which the Receiving Agent receives or is treated as having received a request in proper form (i.e.
593,the Transaction Date).
594,"The minimum amount for any request for redemptions for cash on a Dealing Day is 50,000 Units, comprising a Creation Unit aggregation."
595,"Placement of Redemption Orders in Kind Generally, only Participating Dealers are able to place redemption requests with the Receiving Agent."
596,"All requests to redeem Creation Unit aggregations in kind must be received by the Receiving Agent no later than 2:30 p.m., Hong Kong time (the ""Redemption Dealing Deadline"")."
597,If the redemption request in proper form is received by the Receiving Agent after the Redemption Dealing Deadline on any Dealing Day it will be deemed to have been received on the next Dealing Day.
598,"Whether or not a redemption request has been receive d by the Receiving Agent by the Redemption Dealing Deadline shall be determined by th e Receiving Agent, whose determination shall be final and binding."
599,Redemption requests must be transmitted to the Receiving Agent by a Participating Dealer in writing or other transmission method acceptable to the Receiving Agent pursuant to procedures set forth in the Participant Agreement.
600,"However, a Participating Dealer may telephone the Receiving Agent to confirm the Receiving Agent's receipt of a redemption request."
601,"Severe economic or market disruptions or changes, or facsimile or other communicatio n failure may impede the ability to reach the Receiving Agent or a Participating Dealer."
602,"All requests to redeem Creation Unit aggregations in kind must be placed with a Participating Dealer, in the form required by such Participating Dealer."
603,"In addition, the Participating Dealer may request the investor to enter into agreements with respect t o the request, for example, to provide for payments of cash, when required."
604,"Investors should be aware that their particular broker or dealer may not have entered into a Participant Agreement with the Manager and the Trustee and that, therefore, requests to redeem Creation Unit aggregations of the Trust must b e placed by the investor's broker or dealer through a Participating Dealer that has entered into a Participant Agreement."
605,In such cases there may be additional charges to such investor.
606,"At any given time, there will be only a limited number of Participating Dealers."
607,All the Units being redeemed must be delivered to the Trustee or its delegate no later than 11:30 a.m.
608,(Hong Kong time) on the second Dealing Day following the Transaction Date (T+2).
609,"All questions as to the Units delivered, and their validity, form and e ligibility (including time of receipt) will be determined by the Trustee, whose determination will be final and binding."
610,"If the Trustee or its delegate does not receive the required Units by 11:30 a.m., Hong Kong time on the second Dealing Day following the Transaction Date (T+2) and (if applicable) the Custodian does not receive any negative Cash Redemption Amount (plus the Transaction Fee and any other duties and charges) by 11:30 a.m., Hong Kong time on the second Dealing Day following the Transaction D ate (T+2), the redemption request will, subject to the consent of the Manager, be cancelled."
611,"Upon written notice to the Receiving Agent such cancelled request may be resubmitted by the Participating Dealer the following Dealing Day, in respect of which payment for such redemption will comprise Redemption Securities as newly determined for that following Dealing Day."
612,"In addition to the Transaction Fee, the Participating Dealers will be charged any duties and charges applicable to a creation of Units, as well as a second Transaction Fee resulting from redemption orders submitted by them that are cancelled by the Participating Dealer (otherwise than as permitted by the Trust Deed or the Participant Agreement ) or that are cancelled as a result of the Participating Dealer failing to deliver or transmit the requisite Units and/or cash."
613,"In addition, Participating Dealers may also be charged the amount of any losses and interest costs arising in respect of the Trust's sale and/or purchase of Investments in connection with such failed redemption, and the difference between (i) the issue price of such Units as at the date of cancellation of the redemption request and (ii) the redemption value of Units the subject of the cancellation at the Transaction Date."
614,Default interest will also be payable on the above amounts.
615,Those placing requests to redeem Creation Unit aggregations should afford sufficient time to permit proper submission of the request to the Receiving Agent prior to the Redemption Dealing Deadline on the relevant Dealing Day.
616,The requisite Redemption Securities and the Cash Redemption Amount will be transferred to the Participating Dealer or on its order by the Dealing Day which is two Dealing Days following the Transaction Date (T+2).
617,"If it is not possible to effect deliveries of the Redemption Securities, at the discretion of the Manager, the redemption request may be satisfied in cash to be added to, and comprise part of, the Cash Redemption Amount to replace any Redemption Security."
618,"In addition, a Participating Dealer who is (or whose 100% Group Company is) a permitted market maker may with the approval of the Manager also elect to substitute cash for Redemption Securities upon a redemption of Units on any Dealing Day."
