sentence_id,text
0,"IMPORTANT If you are in any doubt about this Prospectus, you should consult your stockbroker, bank manager, solicitor, professional accountant or other professional adviser."
1,"The Stock Exchange of Hong Kong Limited (the "" Stock Exchange""), Hong Kong Securities Clearing Company Limited ("" Hongkong Clearing "") and the Hong Kong Securities and Futures Commission (the ""SFC"") take no responsibility for the contents of this Prospectus, make no representation as to its accuracy or completeness and expressly disclaim any liability whatsoever for any loss howsoever arising from or in reliance upon the whole or any part of the contents of this Prospectus."
2,_______________________________________________________________________________________ ABF HONG KONG BOND INDEX FUND a Hong Kong unit trust authorized under section 104 of the Securities and Futures Ordinance (Cap.
3,"571) of Hong Kong Prospectus _______________________________________________________________________________________ This Prospectus describes and offers for sale units in the ABF Hong Kong Bond Index Fund (the ""Trust"")."
4,Potential investors in the Trust should be aware of certain risks relating to an investment in the Trust.
5,"See the section entitled ""Principal Risk Factors"" on pages 13 to 21."
6,"The Trust seeks investment results that correspond closely to the total return of the Markit iBoxx ABF Hong Kong Index (the ""Underlying Index"") compiled by Markit Indices Limited (the "" Index Provider""), before fees and expenses."
7,"HSBC Investment Funds (Hong Kong) Limited, based in Hong Kong (the ""Manager""), is the manager of the Trust."
8,"Units of the Trust, called "" Units"" throughout this Prospectus are currently listed and dealt only on the Stock Exchange at market prices throughout the trading day."
9,"Market prices for Units may, however, be different from their net asset value (""NAV"")."
10,The Trust issues and redeems Units at NAV on each day on which (i) the Stock Exchange is open for normal trading; and (ii) the Underlying Index is compiled and published.
11,"However, Units are generally only issued and redeemed in blocks of 50,000 Units (eac h a "" Creation Unit"") or in multiples thereof ."
12,"An issue and redemption of Creation Units may be effected in exchange (i) for a specified basket of HK$ denominated Government or Other Public Securities and a specified amount of cash, or (ii) for cash only."
13,"Government or Other Public Securities means HK$ denominated debt obligations issued or guaranteed by the government of Hong Kong (""HKSAR Government"") (or any other of the following Asian governments; the governments of China, Indonesia, Korea, Malaysia, Philippines, Singapore and Thailand ("" Asian Governments "" and ""Asian Government"" being any one of them)), by an agency or instrumentality of the HKSAR Government (or any other Asian Government), by a HKSAR Government (or any other Asian Government) sponsored entity or a quasi HKSAR Government (or any other Asian Government) entity and HK$ denominated debt  Markit iBoxx is a registered trade mark of Markit Indices Limited."
14,obligations issued by supranational financial institutions in each case as determined by the Index Provider and which are for the time being constituent securities of the Markit iBoxx ABF Hong Kong Index and certain other securities issued by the same issu er of any such constituent securities.
15,"As a practical matter, only securities dealers or other large investors purchase or redeem Creation Units."
16,Most smaller investors will buy and sell Units on the Stock Exchange.
17,"Except when aggregated in Creation Un it sizes, Units are not redeemable securities."
18,An investment in the Trust is not a bank deposit nor is it insured or guaranteed by the HKSAR Government or any other Hong Kong government agency.
19,The Trust has been authorized by the SFC under the Securities and Futures Ordinance (Cap.
20,"571) of Hong Kong (the "" SFO"")."
21,SFC authorization is not a recommendation or endorsement of the Trust nor does it guarantee the commercial merits of the Trust or its performance.
22,It does not mean the Trust is suitable for all investors nor is it an endorsement of its suitability for any particular investor or class of investors.
23,"Units have been accepted as eligible securities by Hongkong Clearing for deposit, clearing and settlement in the Central Clearing and Settlement System ("" CCASS"")."
24,All activities under CCASS are subject to the General Rules of CCASS and CCASS Operational Procedures in effect from time to time.
25,"Personal Data or Confidential Information (1) Information (including personal data, confidential information and information necessary to assess tax status) provided by a unitholder and details of transactions of such unitholder will be used, shared, stored, processed, transferred and disclosed (in and outside Hong Kong) so that the Manager or any HSBC entity (the “HSBC Group”) can carry out its obligations in respect of the Trust or for other purposes including but not limited to (a) providing services to the unitholder, (b) fulfilling or complying with any applicable statute, law, regulation, ordinance, rule, judgment, decree, voluntary code, directive, sanctions regime, court order, agreement with authorities ( ""Laws""); any demands from authorities or obligations under Laws; and Laws requiring any member of the HSBC Group to verify the identity of the unitholder ( ""Compliance Obligations""), (c) detecting, investigating and preventing fraud, money laundering, corruption, tax evasion and any other crime or attempts to violate Laws and fulfilling related Compliance Obligations, (d) enforcing or defending HSBC Group 's, or a member of the HSBC Group's rights, (e) fulfilling internal operational requirements of the HSBC Group, (f) maintaining HSBC Group's overall relationship with the unitholder."
26,(2) Failure to provide information may result in the Manager being unable to provide services to the unitholder or taking appropriate action or reporting to tax authorities.
27,Information may be shared with other parties including but not limited to entities within the HSBC Group (provided that such information will be protected by HSBC Group's data protection policy).
28,(3) A unitholder has the right to request access to and correction of any personal data or to request the personal data not to be used for direct marketing purposes.
29,(4) Collection and use of personal data will be subject to the requirements under the Personal Data (Privacy) Ordinance of Hong Kong.
30,"Enquiries and Complaints Enquiries and complaints concerning the Trust (including information concerning creation and redemption procedures and the current net asset value) should be directed to the Manager at (852) 2284 1118 or at Level 22, HSBC Main Building, 1 Queen's Road Central, Hong Kong."
31,The Manager will respond to any enquiry or complaint as soon as practicable.
32,"23 September 2024 Table of Contents OVERVIEW 1 INTRODUCTION 1 THE OFFER OF UNITS 2 LISTING AND DEALING 2 DESCRIPTION OF THE TRUST 4 INVESTMENT OBJECTIVE AND POLICIES OF THE TRUST 5 INVESTMENT OBJECTIVE 5 INVESTMENT POLICIES AND STRATEGIES 5 BENCHMARK AND PERFORMANCE 10 PROHIBITED SECURITIES 10 COLLATERAL 10 PRINCIPAL RISK FACTORS 14 RISK FACTORS SPECIFIC TO THE TRUST 14 UNDERLYING INDEX RISK FACTORS 20 OTHER RISK FACTORS 21 LIQUIDITY RISK MANAGEMENT 22 FEES AND EXPENSES 24 CREATION AND REDEMPTION OF UNITS 26 CREATION OF UNITS 26 REDEMPTION OF UNITS 31 FURTHER PROVISIONS RELATING TO CREATIONS AND REDEMPTIONS 35 BUYING AND SELLING UNITS 37 BOOK ENTRY 37 TRUST UNIT TRADING PRICES 37 MANAGEMENT AND OPERATIONS 39 MANAGER 39 INVESTMENT ADVISER 39 TRUSTEE 40 THE SUPERVISORY COMMITTEE 43 RECEIVING AGENT 44 PROCESSING AGENT 44 LISTING AGENT 44 INDEX PROVIDER 44 FEES, COSTS AND EXPENSES PAYABLE BY THE TRUST 45 FEES PAYABLE BY INVESTORS 47 DIVIDENDS AND DISTRIBUTIONS 48 GENERAL INFORMATION 51 TAXATION 51 ANTI-MONEY LAUNDERING 54 FINANCIAL REPORTS 54 NOTICES 54 MEETINGS OF UNITHOLDERS 55 AMENDING THE TRUST DEED WITHOUT UNITHOLDER APPROVAL 55 INTERMEDIARIES IN HONG KONG 55 LIABILITY AND INDEMNITIES 55 TERMINATION 56 CONFLICTS OF INTEREST 57 UNDERLYING INDEX DISCLAIMERS 59 DOCUMENTS AVAILABLE FOR INSPECTION 60 APPENDIX 1 - UNDERLYING INDEX 61 APPENDIX 2 - SELLING RESTRICTIONS 66 UNITED STATES 66 CANADA 67 APPENDIX 3 - PARTIES INVOLVED IN THE TRUST 69 Overview Introduction This Prospectus This Prospectus provides certain information you need in order to make an informed decision about investing in the Trust."
33,It contains important facts about the Trust.
34,"This Prospectus includes particulars given in compliance with the Code on Unit Trust s and Mutual Funds issued by the SFC (the ""SFC Code"") and the Rules Governing the Listing of Securities on the Stock Exchange (the ""Listing Rules"") for the purpose of providing information to the public with regard to the Trust."
35,"The Manager of the Trust accepts full responsibility for the accuracy of the information contained in this Prospectus and confirm, having made all reasonable enquiries, that to the best of its knowledge and belief there are no other facts the omission of which would make any statement misleading."
36,This Prospectus is published in connection with the offer of Units in Hong Kong.
37,"No person is authorized in connection with the issue of Units to give any information, or to make any representation not contained in this Prospectus, and any information or representation not contained herein must not be relied upon as having been authorized by either the Manager or any of its directors or any other persons involved in the issue of Units pursuant to the offer contained in this Prospectus."
38,"The Trust Authorization The Trust is a unit trust authorized under section 104 of the SFO and is established under the terms of a trust deed dated 10 th June 2005 (the "" Trust Deed"") made between HSBC Investment Funds (Hong Kong) Limited (as the "" Manager"") and HSBC Institutional Trust Services (Asia) Limited (as the ""Trustee"")."
39,The Trust Deed is governed by Hong Kong law.
40,"The Trust The Trust is an ""index fund"" which seeks investment results that correspond closely to the total return of the Markit iBoxx ABF Hong Kong Index, before fees and expenses."
41,"The Markit iBoxx ABF Hong Kong Index is an indicator of investment returns of HK$ de nominated debt obligations issued or guaranteed by the HKSAR Government (or any other Asian Government), by an agency or instrumentality of the HKSAR Government (or any other Asian Government), by a HKSAR Government (or any other Asian Government) sponsore d entity or a quasi HKSAR Government (or any other Asian Government) entity and HK$ denominated debt obligations issued by supranational financial institutions in each case as determined by the Index Provider and which are for the time being constituent securities of the Underlying Index (""Index Securities"")."
42,"The Index Provider determines the composition of the Underlying Index in accordance with its rules and procedures for the Underlying Index (which may change from time to time), and publishes informatio n regarding the composition, investment characteristics and return of the Underlying Index."
43,"The Underlying Index is discussed more fully under the section entitled ""Description of the Trust"" and Appendix 1."
44,"The Trust is designed for investors who seek an ""index -based"" approach to investing in a portfolio of HK$ denominated government and quasi -government bond securities."
45,Units may also be used as an asset allocation component or as a trading instrument.
46,"Whilst the Trust mainly invests in a portfolio of bonds issued by the HKSAR Government and other Index Securities, the Trust itself is not guaranteed by the HKSAR Government or any Hong Kong government agency."
47,"Unlike many conventional unit trusts and mutual funds, which are only bought and sold at closing net asset values, the Units have been designed to be tradable in the secondary market on the Stock Exchange on an intra -day basis, and to be created and redeem ed in cash or in -kind in a Creation Unit size of 50,000 Units or multiples thereof at the NAV calculated with respect to each Dealing Day (as defined in the section entitled ""Creation and Redemption of Units"")."
48,"The Manager of the Trust, HSBC Investment Funds (Hong Kong) Limited, is an indirectly wholly- owned subsidiary of HSBC Holdings plc (""HSBC"")."
49,"The Manager is a licensed corporation under the SFO for Types 1 (dealing in securities), 4 (advising on securities), 5 (advising on futures contracts) and 9 (asset management) regulated activities."
50,"In addition, as the appointed manager of the Trust the Manager is subject to, and required to comply with, the SFC Code."
51,"The Trustee of the Trust, HSBC Institutional Trust Services (Asia) Limited, is an indirectly wholly - owned subsidiary of HSBC."
52,HSBC Institutional Trust Services (Asia) Limited is a registered trust company under the Trustee Ordinance (Cap.
53,29) of Hong Kong.
54,"Under the terms of the Trust Deed, a supervisory committee (the ""Supervisory Committee"") has been constituted to direct and oversee the Trustee and the Manager on certain matters relating to the management and administration of the Trust."
55,The Supervisory Committee currently comprises four members.
56,"See the section entitled ""Management and Operations""."
57,"The ""Investment Objective and Policies of the Trust"" and ""Principal Risk Factors"" sections of this Prospectus discuss the principal strategies and risks applicable to the Trust, while the ""Description of the Trust"" section provides other important informat ion about the Trust, including a brief description of the Underlying Index."
58,"The base currency of the Trust is Hong Kong dollars (""HK$"" or ""HK dollars"")."
59,The Offer of Units No action has been taken to permit the public offer of the Units or the distribution of this Prospectus in any jurisdiction other than Hong Kong.
60,"Accordingly, this Prospectus may not be used for the purpose of, and does not constitute, an offer or invitat ion in any jurisdiction or in any circumstances in which such an offer or invitation is not authorized or to any person to whom it is unlawful to make such an offer or invitation."
61,The distribution of this Prospectus and the offering of Units in certain jurisdictions may be restricted and accordingly persons into whose possession this document comes are required to inform themselves about and to observe such restrictions.
62,No offer of Units is made in any jurisdiction in which such offer is illegal.
63,No public offer of Units is intended in any jurisdiction (other than Hong Kong) which distinguishes between public offers and private placings of securities.
64,Listing and Dealing Units are currently listed and dealt only on the Stock Exchange in board lots of 100 Units.
65,The Units are traded in HK dollars.
66,Units have been accepted by Hongkong Clearing as eligible securities of CCASS.
67,Settlement of transactions between participants of the Stock Exchange is required to take place in CCASS on the second trading day after any effected trade.
68,All activities under CCASS are subject to the General Rules of CCASS and CCASS Operational Procedures in effect from time to time.
69,Certificates will not be issued in respect of the Units.
70,"Units are registered in the name of HKSCC Nominees Limited (""HKSCC Nominees"") by the Registrar."
71,The register of unitholders of the Trust is the evidence of ownership.
72,Any beneficial interest in the Units will be established through an account with CCASS.
73,Description of the Trust The Trust is a unit trust authorized under section 104 of the SFO and is established under the terms of the Trust Deed made between HSBC Investment Funds (Hong Kong) Limited as the Manager and HSBC Institutional Trust Services (Asia) Limited as the Trustee.
74,Authorization of the Trust does not imply official approval or recommendation of the Trust by the SFC.
75,The Trust Deed is governed by Hong Kong law.
76,The Supervisory Committee has been constituted to direct and oversee the Trustee and the Manager on certain matters relating to the management and administration of the Trust including the power to direct the Trustee and the Manager on matters relating to the overall structure of the Trust and strategic issues relating to its management and administration and the power to recommend that the Manager or the Trustee should be removed.
77,"Refer to the section entitled ""Management and Operations - The Supervisory Committee"" for details on the powers of the Supervisory Committee."
78,Units are currently listed and dealt only on the Stock Exchange.
79,Units have been accepted by Hongkong Clearing as eligible securities of CCASS.
80,Investors will not therefore receive any Unit certificates.
81,"The Trust is an ""index fund"" which seeks investment results that correspond closely to the total return of the Markit iBoxx ABF Hong Kong Index, before fees and expenses."
82,Stock Exchange Trading Symbol: 2819 Underlying Index: Markit iBoxx ABF Hong Kong Index The Markit iBoxx ABF Hong Kong Index (i.e.
83,"the Underlying Index) is determined and composed by Markit Indices Limited (""Markit"" or the ""Index Provider"")."
84,"The Markit iBoxx ABF Hong Kong Index is an indicator of investment returns of HK$ denominated debt obligations issued or guaranteed by the HKSAR Government (or any other Asian Government), by an agency or instrumentality of the HKSAR Government (or any oth er Asian Government), by a HKSAR Government (or any other Asian Government) sponsored entity or a quasi HKSAR Government (or any other Asian Government) entity and HK$ denominated debt obligations issued by supranational financial institutions in each case as determined by the Index Provider and which are for the time being constituent securities of the Underlying Index."
85,The SFC reserves the right to withdraw the authorization of the Trust if the Underlying Index is no longer considered by the SFC to be acceptable.
86,Additional information in respect of the Underlying Index is set out in Appendix 1.
87,"Investment Objective and Policies of the Trust Investment Objective The investment objective of the Trust is to seek to provide investment results that correspond closely to the total return of the Markit iBoxx ABF Hong Kong Index, before fees and expenses."
88,Investment Policies and Strategies The Manager will seek to achieve the Trust's investment objective by investing the Trust's assets primarily in Index Securities and adopting a representative sampling strategy or similar strategy.
89,"Representative sampling is a strategy investing in a representative sample of securities in the Underlying Index which, on aggregate, have a similar investment profile as that of the Underlying Index (such as yield and duration)."
90,The Trust generally will not hold all the securities that are included in the Under lying Index and the Trust may hold Index Securities in excess of their corresponding weighting in the Underlying Index provided that the total exposure to an Index Security will not exceed such Index Security's weighting in the Underlying Index by an amount which is more than 5% of the Trust's total NAV.
91,"In addition, in order to minimize the Trust’s tracking error relative to the performance of the Underlying Index, the Manager may also invest up to 20% of the Trust's NAV in investments other than Index Securities comprising: (a) securities which are not Index Securities (“non-Index Securities”) as long as they are issued by an issuer of any Index Security and HK$ denominated with a minimum issue size of HK$250 million (or such other amount as determined by the Manager from time to time with the prior approval of the Trustee and the Supervisory Committee)."
92,(b) securities which qualified under the provisions of (a) at the point of investment but which no longer qualify but the Manager considers that retaining them is beneficial to meeting the investment objective.
93,These investments may include government and quasi - government bonds as well as corporate bonds which may carry a greater degree of credit risk.
94,"The Manager will rebalance the Trust's portfolio of investments from time to time to reflect any changes to the composition of, or the weighting of, securities in the Markit iBoxx ABF Hong Kong Index with a view to minimizing tracking error of the Trust's overall returns relative to the performance of the Underlying Index."
95,Such rebalancing may include making investments in non-Index Securities.
96,"In accordance with the SFC Code, the Manager will ensure that the Trust will invest in at least six different issues of securities with no more than 30% of the Trust's total NAV invested in any security (which is a Government or Other Public Security, including without limitation an Index Security) of the same issue."
97,"For this purpose, Government or Other Public Securities will be regarded as being of a different issue if, even though they are issued by the same person, they are issued on different terms whether as to repayment dates, interest rates, the identity of the guarantor, or otherwise."
98,Derivatives may be used to manage interest rate risk and otherwise for efficient portfolio management.
99,The Manager will use these derivatives in the Trust's portfolio to help achieve the investment objective of the Trust by closely matching the Trust's po rtfolio with the Underlying Index as well as with other characteristics important to tracking the Underlying Index.
100,"The Trust may invest up to 10% (other than for hedging purposes) of its total NAV (as calculated in accordance with the requirements and guidance issued by the SFC which may be updated from time to time) in Sale and Repurchase Transactions/Reverse Repurchase Transactions (as defined on page 6), futures contracts, options on futures contracts, options, warrants and other derivative instruments related to the Underlying Index or related to positions in Index Securities or non-Index Securities held by the Trust , in seeking performance that corresponds closely with the Underlying Index consisten t with achieving the investment objective of the Trust and in managing cash flows."
101,A separate 10% limit will be applicable to any similar investments made for hedging purposes.
102,This shall also apply to any derivative instrument that is embedded in an Investment or a financial instrument.
103,The Trust may invest in instruments with loss -absorption features (e.g.
104,contingent convertible securities).
105,"The actual exposure of such instruments will depend on the composition of the Index Securities, and in any event, should be less than 30% of the NAV of the Trust."
106,"The Trust may also invest, as needed, in cash equivalent investments."
107,"However, the Manager intends to minimize the Trust's holdings of cash and cash equivalents at any time."
108,"Unlike ""actively managed"" unit trusts and mutual funds, the Trust does not try to ""beat"" the market it tracks and does not seek temporary defensive positions when markets decline or appear overvalued by some standards."
109,"Accordingly, a fall in the Underlyin g Index will result in a corresponding fall in the NAV of the Trust."
110,Correlation.
111,"""Correlation"" measures the degree to which the periodically measured total return of one investment resembles that of another investment."
112,An index is a theoretical financial calculation while the Trust is an actual investment portfolio.
113,"The performance of the Trust and the Underlying Index will vary somewhat due to fees and expenses, transaction costs, variations in their constituent securities, market impact and timing variances."
114,"The Manager expects that, over the long term, the correlation between the Trust's total return and that of the Underlying Index, before fees and expenses, will be 95% or better."
115,A figure of 100% would indicate perfect correlation.
116,It is expected that the tracking error between pre-expense total returns of the Trust and its related Underlying Index will be less than 50 basis points on an annual basis.
117,The tracking error is a measure of the variation between the Trust's total return and the total return of the Underlying Index; the Trust's pre-expense total returns measured on an annual basis should differ from the total return of the Underlying Index by less than this tracking error amount most of the time on average over the long term.
118,"While the Manager expects to achieve the above correlation, neither the Manager nor the Trustee shall be liable if the actual correlation of the Trust's total returns, before fees and expenses, and that of the Underlying Index is less than the anticipated correlation."
119,Strategies to minimize tracking error.
120,"In order to minimize the tracking error, it is the intention of the Manager that the Trust will be passively managed with its portfolio's duration, yield curve and credit risk matched closely to that of the Underlying Index at all times."
121,"The Trust's portfolio securities will be chosen in a way that the Trust's average portfolio duration, sector, maturity bucket distribution, yield curve risk and credit risk is similar to that of the Underlying Index, subject always to availability of the relevant Index Securities in the market at the time of investment or purchase."
122,Index Securities are always preferred to non -Index Securities (or securities which qualified as non - Index Securities at the point of investment and the Manager has retained) as portfolio holdings in order to match the Underlying Index.
