sentence_id,text
229,"Some or all of these risks may adversely affect the Trust's NAV, Unit price, trading price, yield, total return and/or its ability to meet its objectives."
230,Risk Factors Specific to the Trust Market risk.
231,The Trust's NAV and trading prices will react to securities markets movements.
232,"Investors may lose money over short periods due to fluctuation in the Trust's NAV and trading price in response to market movements, and over longer periods during market downturns."
233,Interest rate risk.
234,"Because the Trust invests in fixed-income securities, the Trust is subject to interest rate risk."
235,Interest rate risk is the risk that the value of the Trust's portfolio will decline because of rising interest rates.
236,Interest rate risk is generally lowe r for shorter-term investments and higher for longer- term investments.
237,Income risk.
238,The risk that the income from the Trust's portfolio will decline because of falling market interest rates.
239,"This can result when, in a declining interest rate market, the Trust receives in -kind deposits of portfolio securities in connection with creation s of new Units, or reinvests proceeds of securities sold out of the portfolio in longer -term securities as part of the Trust's attempt to match the maturity or duration of the Underlying Index, at market interest rates that are below the portfolio's then- current earnings rate."
240,Emerging Market Risk.
241,The Trust may invest in securities issued by certain Asian Governments whose economies are considered to be emerging markets.
242,"These markets are subject to special risks associated with foreign investment in these emerging markets including, but not limited to: generally less liquid and less efficient securities markets; generally greater price volatility; exchange rate fluctuations and exchange controls; imposition of restrictions on the expatriation of funds or other assets; less publicly available information about issuers; the imposition of taxes; higher transaction and custody costs; settlement delays and risk of loss; difficulties in enforcing contracts; lesser regulation of securities markets; smaller market capitalisation; differ ent accounting and disclosure standards; governmental interference; greater risk of market shutdown; the risk of expropriation of assets; higher inflation; social, economic and political uncertainties; and the risk of war."
243,Counterparty and settlement risk.
244,Counterparty risk is the risk that the party trading with the Trust will be unable to meet its obligation to make payments or to settle a trade due to a deterioration of the counterparty's financial situation or some other failure by the counterparty.
245,The Trust bears the risk of settlement failures.
246,Any such failure may have a material adverse effect on the Trust and/or the value of the Units.
247,Credit risk.
248,The value of the Trust is subject to risk resulting from changes in the credit worthiness of its underlying investments.
249,"For example, an issuer of a bond might not be able to meet its obligation to make interest and principal payments, or bond investors as a whole may downgrade their view of the issuer resulting in a deterioration of the price of the issuer's debt."
250,Credit rating risk.
251,Credit rating agencies may assign credit ratings to indicate credit quality of such securities.
252,These are subject to limitations and may not accurately reflect the creditworthiness of the security and/or issuer at all times.
253,"Conversely, some debt securities are unrated, meaning that assessment of credit quality will solely be down to the Investment Adviser."
254,The credit rating and/or credit quality of a debt instrument or its issuer may decli ne.
255,"In the event of such decline, the value of the Trust may be adversely affected and the Manager may or may not be able to dispose of the relevant debt instruments."
256,Tracking error risk.
257,Changes in the NAV of the Trust are unlikely to replicate exactly changes in the Underlying Index.
258,"Factors such as fees and expenses of the Trust, liquidity of the market, imperfect correlation of returns between the Trust's securities and those in the Underlying Index, changes to the Underlying Index and regulatory policies may affect the Manager's ability to achieve close correlation with the Underlying Index of the Trust."
259,Imperfect correlation between the returns of portfolio securities and the Underlying Index is more likely to happen to the extent that the Trust invests in securities that are non -Index Securities (or securities which qualified as non -Index Securities at the point of investment and the Manager retained).
260,The Trus t's returns may therefore deviate from those of the Underlying Index and there is no guarantee or assurance of exact replication of the Underlying Index.
261,"However, a fall in the Underlying Index will result in a corresponding fall in the NAV of the Trust."
262,Absence of prior active market .
263,"Although Units have been listed for trading on the Stock Exchange, there can be no assurance that an active trading market will be maintained."
264,"There is no certain basis for predicting the actual price levels at, or sizes in, which Units may trade."
265,"Fur ther, there can be no assurance that Units will experience trading or pricing patterns similar to those of market-traded shares which are issued by investment companies in other jurisdictions or which are based upon indices other than the Underlying Index."
266,Liquidity risk.
267,The price at which portfolio securities may be purchased or sold by the Trust upon any rebalancing activities or otherwise and the value of the Units will be adversely affected if trading markets for the Trust's portfolio securities are limited or absent o r if spreads are wide.
268,"The Trust may invest in securities issued by Asian Governments or quasi -Asian Government issuers, and in certain markets there may be low levels of liquidity."
269,"There is a risk, therefore, that creation or redemption orders (requiring the Manager to respectively buy or sell Asian bonds) may have a high cost of dealing, or take some time to be fully integrated into the portfolio holdings of the Trust and thereby cause disruption in the Trust's asset allocation."
270,"Also, the Trust is relatively large, with the potential effect of more costly periodic portfolio rebalancing."
271,Trading in Units on the Stock Exchange may be suspended .
272,Investors will not be able to purchase or sell Units on the Stock Exchange during any period that the Stock Exchange suspends trading in the Units.
273,The Stock Exchange may suspend the trading of Units whenever the Stock Exchange determines that it is appropriate in the interests of a fair and orderly market to protect investors.
274,The creation and redemption of Creation Units may also be suspended in the event that the trading of Units on the Stock Exchange is suspended.
275,Units may be delisted from the Stock Exchange.
276,"The Stock Exchange imposes certain requirements for the continued listing of securities, including the Units, on the Stock Exchange."
277,Investors cannot be assured that the Trust will continue to meet the requirements necessary to maintain the listing of Units on the Stock Exchange or that the Stock Exchange will not change the listing requirements.
278,The Trust may be terminated if its Units are delisted from the Stock Exchange.
279,Units may trade at prices other than NAV.
280,"As with any exchange traded fund, the market price of Units will be subject to a ""bid/ask"" spread – being the difference between the prices being bid by potential purchasers and the prices being asked by potential sellers."
281,"Units may trade below, at or a bove their NAV."
282,The NAV of Units will fluctuate with changes in the market value of the Trust's holdings.
283,The trading prices of Units will fluctuate in accordance with changes in their NAVs as well as market supply and demand for Units on the Stock Exchange.
284,"In times of severe market disruption or when there is an insufficient number of buyers and sellers of Units, the bid/ask spread may increase significantly."
285,"When the market price of Units is falling rapidly, Units are most likely to be traded at a discount to the NAV per Unit, which may be the time when most investors want to sell their Units."
286,"However, given tha t Units can be created and redeemed in Creation Unit aggregations at NAV, the Manager believes that large discounts or premiums to the NAVs of Units should not be sustained."
287,Minimum creation and redemption size.
288,"Units will generally only be issued or redeemed in Creation Unit aggregations (currently 50,000 Units, and multiples thereof)."
289,Investors who do not hold Creation Unit aggregations may only be able to realise the value of their Units by selling their Units on the Stock Exchange at the prevailing trading price of the Units.
290,Lack of discretion of the Manager to adapt to market changes .
291,"Unlike many unit trusts and mutual funds, the Trust is not ""actively managed""."
292,"Therefore, the Trust will not adjust the composition of its portfolio except in order to seek to closely correspond to the duration and total return of the Underlying Index."
293,"The Trust does not try to ""beat"" the market it tracks and does not seek temporary defensive positions when markets decline or when the market is judged to be overvalued."
294,"Accordingly, a fall in the Underlying Index will result in a corresponding fall in the NAV of the Trust."
295,Reliance on Participating Dealers .
296,The creation and redemption of Units may generally only be effected through Participating Dealers.
297,The number of Participating Dealers at any given time will be limited.
298,Participating Dealers are under no obligation to accept instructions to apply for or redeem Units on behalf of investors.
299,"Participating Dea lers will not be able to create or redeem Units during any period when, amongst other things, dealings on the Stock Exchange are restricted or suspended, settlement or clearing of securities in CCASS is disrupted or the Underlying Index is not compiled or published."
300,"In addition, Participating Dealers will not be able to create or redeem Units if some other event occurs which impedes the calculation of the NAV of the Trust or during which delivery of Deposit Securities or Redemption Securities or disposal of the Trust's portfolio securities cannot be effected."
301,Suspension of creations and redemptions.
302,Dealings of Units on the Stock Exchange may not necessarily be suspended in the event that the creation and redemption of Creation Units is temporarily suspended by the Manager in accordance with the terms of the Trust Deed.
303,"If the creation and redemption of Creation Units is temporarily suspended, the trading price of the Units may be adversely affected and differ from the market value of the Trust's underlying assets."
304,Use of futures and options contracts involve certain risks.
305,The Manager may use futures contracts and options to manage interest rate risk and otherwise for efficient portfolio management with a view to achieving the Trust's investment objective.
306,"In particular, the Manager may invest the Trust's assets in futures contracts and options in order to seek performance that corresponds to the Underlying Index and to manage cash flows."
307,There is no guarantee that such techniques will achieve their desired result.
308,There are certain investment risks in using futures contracts and options.
309,Such risks may include: ( i) the inability to close out a futures contract or option caused by the non-existence of a liquid secondary market; and (ii) an imperfect correlation between price movements of the futures contracts or option s with price movements of the subject portfolio securities or the Underlying Index.
310,"Further, the risk of loss in trading futures contracts is potentially great, due to both the low margin deposits r equired and the extremely high degree of leverage involved in futures pricing."
311,"As a result, a relatively small price movement in a futures contact may result in immediate and substantial loss (or gain) to the Trust."
312,Use of Sale and Repurchase Transaction/Reverse Repurchase Transaction involves certain risks.
313,"For example, if the seller of securities under a Sale and Repurchase Transaction and Reverse Repurchase Transaction defaults on its obligation to repurchase the underlying securities, as a result of its insolvency or otherwise, the Trust will seek to dispose of such securities, which action could involve costs or delays."
314,"If the seller fails to repurchase the securities, the Trust may suffer a loss to the extent proceeds from the sale of the underlying securities are less than the repurchase price."
315,"If the seller becomes insolvent and subject to liquidation or reorganization under applicable bankruptcy or other laws, the Trust's ability to dispose of the underlying securities may be restricted."
316,"Finally, it is possible that the Trust may not be able to substantiate its interest in the underlying securities."
317,Risk of swap agreements.
318,The risk of loss with respect to swaps generally is limited to the net amount of payments that the Trust is contractually obligated to make.
319,Swap agreements are also subject to the risk that the swap counterparty will default on its obligations.
320,"If such a default were to occur, the Trust will have contractual remedies pursuant to the agreements related to the transaction."
321,"However, such remedies may be subject to bankruptcy and insolvency laws which could affect the Trust's right s as a creditor."
322,For example the Trust may not receive the net amount of payments that it contractually is entitled to receive.
323,Risks associated with investments in debt instruments with loss-absorption features.
324,"The Trust may invest in instruments with loss -absorption features which are subject to greater risks when compared to traditional debt instruments as such instruments typically include terms and conditions which may result in them being partly or wholly written off, written down, or converted to ordinary shares of the issuer upon the occurrence of a pre-defined trigger event (e.g."
325,when the issuer is near or at the point of non-viability or when the issuer’s capital ratio falls to a specified level).
326,Such trigger events are likely to be outside of the issuer’s control and commonly include a reduction in the issuer’s capital ratio below a specified level or upon specific government or regulatory action being taken as a result of the issuer’s ongoing financial viability.
327,"Trigger events are complex and difficult to predict and can result in a significant or total reduction in the value of such instruments, giving rise to consequential loss of the Trust."
328,"In the event of the activation of a trigger, there ma y be potential price contagion and volatility to the entire asset class."
329,"Debt instruments with loss -absorption features may also be exposed to liquidity, valuation and sector concentration risk."
330,"For example, the Trust may invest in contingent convertible securities, which are hybrid capital securities that absorb losses when the capital of the issuer falls below a certain level."
331,"Upon the occurrence of a predetermined event (known as a trigger event), contingent convertible securities can be converted into shares of the issuing company, potentially at a discounted price, or the principal amount invested may be lost on a permanent or temporary basis."
332,Contingent convertible securities are risky and highly complex instruments.
333,Coupon payments on contingent convertible securities are discretionary and may at times also be ceased or deferred by the issuer.
334,"Trigger events can vary but these could include the capital ratio of the issuing company falling below a certain level, or the share price of the issuer falling to a particular level for a certain period of time."
335,Contingent convertible securities are also subject to additional risks specific to their structure including: i.
336,Trigger level risk Trigger levels differ and determine exposure to conversion risk.
337,It might be difficult for the Investment Adviser of the Trust invested in contingent convertible securities to anticipate the trigger events that would require the debt to convert into equity or the write down to zero of principal investment and/or accrued interest.
338,"Trigger events may include: (i) a reduction in the issuing bank’s Core Tier 1/ Common Equity Tier 1 (CT1/CET1) ratio or other ratios, (ii) a regulatory authority, at any time, making a subjective determination that an institution is “non -viable”, i.e."
339,"a det ermination that the issuing bank requires public sector support in order to prevent the issuer from becoming insolvent, bankrupt or otherwise carry on its business and requiring or causing the conversion of the contingent convertible securities into equity or write down, in circumstances that are beyond the control of the issuer or (iii) a national/regional authority deciding to inject capital."
340,"Coupon cancellation risk Coupon payments on some contingent convertible securities are entirely discretionary and may be cancelled by the issuer at any point, for any reason, and for any length of time."
341,The discretionary cancellation of payments is not an event of default and there are no possibilities to require re - instatement of coupon payments or payment of any passed missed payments.
342,Coupon payments may also be subject to approval by the issuer’s regulator and may be s uspended in the event there are insufficient distributable reserves.
343,"As a result of uncertainty surrounding coupon payments, contingent convertible securities may be volatile and their price may decline rapidly in the event that coupon payments are suspended."
344,"Capital structure inversion risk Contrary to the classic capital hierarchy, investors in contingent convertible securities may suffer a loss of capital when equity holders do not, for example when the loss absorption mechanism of a high trigger/ write down of a contingent convertible security is activated."
345,This is contrary to the normal order of the capital structure where equity holders are expected to suffer the first loss.
346,Call extension risk Some contingent convertible securities are issued as perpetual instruments and only callable at pre - determined levels upon approval of the competent regulatory authority.
347,It cannot be assumed that these perpetual contingent convertible securities will be c alled on a call date.
348,Contingent convertible securities are a form of permanent capital.
349,The investor may not receive return of principal as expected on a call date or indeed at any date.
350,Conversion risk Trigger levels differ between specific contingent convertible securities and determine exposure to conversion risk.
351,It might be difficult at times for the Investment Adviser to assess how the contingent convertible securities will behave upon conversion.
352,"I n case of conversion into equity, the Investment Adviser might be forced to sell these new equity shares since the investment policy of the Trust may not allow the holding of equity securities."
353,"Given the trigger event is likely to be some event depressing the value of the issuer’s common equity, this forced sale may result in the Trust experiencing some loss."
354,Valuation and write-down risk Contingent convertible securities often offer attractive yield which may be viewed as a complexity premium.
355,The value of contingent convertible securities may need to be reduced due to a higher risk of overvaluation of such asset class on the relevant elig ible markets.
356,"Therefore, the Trust may lose its entire investment or may be required to accept cash or securities with a value less than its original investment."
357,"Market value fluctuations due to unpredictable factors The value of contingent convertible securities is unpredictable and will be influenced by many factors including, without limitation (i) creditworthiness of the issuer and/or fluctuations in such issuer’s applicable capital ratios; (ii) supply and demand for the contingent convertible securities; (iii) general market conditions and available liquidity and (iv) economic, financial and political events that affect the issuer, its particular market or the financial markets in general."
358,Liquidity risk Contingent convertible securities are relatively new instruments and the outstanding amount and trading volume of contingent convertible securities tend to be small.
359,In certain circumstances finding a buyer ready to invest in contingent convertible securities may be difficult and the seller may have to accept a significant discount to the expected value of the bond in order to sell it.
360,Sector concentration risk Contingent convertible securities are issued by banking and insurance institutions.
361,The performance of the Trust which invests significantly in contingent convertible securities will depend to a greater extent on the overall condition of the financial services industry than for a fund following a more diversified strategy.
362,"Subordinated instruments Contingent convertible securities will, in the majority of circumstances, be issued in the form of subordinated debt instruments in order to provide the appropriate regulatory capital treatment prior to a conversion."
363,"Accordingly, in the event of liquidation, dissolution or winding-up of an issuer prior to a conversion having occurred, the rights and claims of the holders of the contingent convertible securities, such as the Trust, against the issuer in respect of or arising under the terms of the contingent convertible securities shall generally rank junior to the claims of all holders of unsubordinated obligations of the issuer."
364,Unknown risk The structure of contingent convertible securities is innovative yet untested.
365,"In a stressed environment, when the underlying features of these instruments will be put to the test, it is uncertain how they will perform."
366,The Trust may cease to be authorized.
367,The SFC reserves the right to withdraw the authorization of the Trust if the Underlying Index is no longer considered by the SFC to be acceptable.
368,The Trust may be terminated if the SFC is to withdraw its authorization for the Trust.
369,Reliance on Market Makers.
370,There may or may not be market makers for the Trust.
371,Investors should note that liquidity in the secondary market for the Units may be adversely affected if there is no market maker for the Trust.
372,Concentration of the Underlying Index in certain issuers .
373,The Underlying Index and the investments of the Trust may be concentrated in securities of a single or several issuers.
374,"Changes in the financial condition of an issuer, changes in specific economic or political conditions that affect a particular issuer, and changes in general economic or political conditions can affect the value of an issuer's securities."
375,Such issuer-specific changes may have an impact on the securities held by the Trust.
376,Geographic concentration risk.
377,The Trust’s investments are concentrated in a certain geographical region(s).
378,The value of the Trust may be more volatile than that of a fund having a more diverse portfolio of investments.
379,"Further, the value of the Trust may be more susceptible to adverse economic, political, policy, foreign exchange, liquidity, tax, legal or regulatory event affecting such geographical region(s)."
380,Asset class risk.
381,The returns generated from the securities in which the Trust invests may not provide returns equivalent to that of other classes of securities or different asset classes.
382,The securities in which the Trust invests may be subject to cycles of underperforman ce relative to that of other classes of securities.
383,EMEAP's investment in the Trust.
384,"The Executives' Meeting of East Asia and Pacific Central Banks group (""EMEAP"") member central banks and monetary authorities are like any other investors in the Trust and each of them is entitled to dispose of their respective interest in the Units they hold."
385,There are no guarantees that the EMEAP member central banks and monetary authorities will continue to be investors in the Trust.
386,"Should the EMEAP member central banks and monetary authorities decide to sell or redeem all or a portion of their Units, it may have a materially adverse effect on the Trust and the price of the Units."
387,Minimum commercial size.
388,The Trust is structured as an index fund with low management and trustee fees.
389,"Given that this is an index fund with low fees (based on a percentage of NAV of the Trust), the size of the Trust needs to be significantly larger than other typical unit tr usts to remain commercially viable."
390,Lending of securities .
391,The Trust may lend its portfolio securities.
392,"Although the Trust will receive collateral in connection with all loans of its securities, the Trust would be exposed to a risk of loss should a borrower default on its obligation to return the borrowed securities (e.g."
393,the loaned securities may have appreciated beyond the value of the collateral held by the Trust).
394,"In addition, the Trust will bear the risk of loss of any cash collateral that it invests."
395,Withholding tax risk.
