sentence_id,text
683,"In respect of a Realisation Application, unless the requisite documents in respect of the relevant Units have been delivered to the Manager by such time on the Settlement Day as prescribed in the Operating Guidelines, the Realisation Application shall be deemed never to have been made except that the Transaction Fee in respect of such Realisation Application shall remain due and payable and once paid, shall be retained by and for the benefit of the Trustee, and in such circumstances: (a) the Manager shall be entitled to charge the relevant Participating Dealer for the account and benefit of the Trustee an Application Cancellation Fee; (b) the Manager may at its absolute discretion require the relevant Participating Dealer to pay to the Trustee, for the account of the relevant In vestment Fund, Cancellation Compensation in respect of each Unit, being the amount (if any) by which the Realisation Price of each Unit is less than the Issue Price which would have applied in relation to each Unit if a Participating Dealer had, on the final day permitted for delivery of the requisite documents in respect of the Units which are the subject of the Realisation Application, made a Creation Application; and (c) no previous valuations of the relevant Investment Fund shall be re-opened or invalidated as a result of an unsuccessful Realisation Application, provided that the Manager, with the approval of the Trustee, may at its discretion extend the settlement period on such terms and conditions as the Manager may determine (including as to, but not limited to, the payment of an Extension Fee)."
684,45 The following illustrates the process of realisation of Units.
685,Units sold Units realised Cash / In-Kind In-kind(and cash amount(if any)) or in- cash Investment Fund Participating Dealer Primary Market Investor (if any) 46 TRADING OF UNITS ON THE SEHK An investor can buy or sell the Units through his stockbroker on the SEHK.
686,The diagram below illustrates the trading of Units on the SEHK: Units (in board lot size) SEHK Cash (purchase price) No money should be paid to any intermediary in Hong Kong which is not licensed or registered to carry on Type 1 regulated activity under Part V of the Securities and Futures Ordinance.
687,Retail investors may place an order with a broker to sell their Units on the SEHK at any time during the trading day.
688,To sell Units – or to buy new ones – a retail investor will need to use an intermediary such as a stockbroker or any of the share dealing services offered by banks or other financial advisers.
689,The trading price of Units of an Investment Fund on the SEHK may differ from the Net Asset Value per Unit and there can be no assurance that a liquid secondary market will exist for the Units.
690,"Brokerage, stamp duty and other fees may be payable when selling (and purchasing) Units."
691,Please see the section headed “Fees Payable by Retail Investors Dealing in Units on the SEHK” below.
692,"Subject to applicable regulatory requirements, the Manager intends to use its best endeavours to put in place arrangements so that there is at least one market maker for each Investment Fund to facilitate efficient trading."
693,"Where a Dual Counter has been adopted in respect of an Investment Fund, the Manager intends to use its best endeavours to put in place arrangements so that there is at least one market maker for each counter although these market makers may be the same entity."
694,Buyers Sellers 47 DETERMINATION OF NET ASSET VALUE The Net Asset Value of the relevant Investment Fund shall be determined at the Valuation Point on the relevant Valuation Day in respect of each Dealing Day for Units of the relevant class (or at such other time as the Manager and the Trustee may determine) by valuing the assets of the relevant Investment Fund and deducting the liabilities attributable to the Fund in accordance with the terms of the Trust Deed.
695,"A summary of t he applicable Trust Deed provisions relating to the determination of the value of investments in the Trust is set out as follows: (a) the value of any investment quoted, listed or normally dealt in on a securities market (other than an interest in a collectiv e investment scheme) shall be calculated by reference to the price appearing to the Manager to be the last traded price or last bid price or midway between the latest available market dealing offered price and the latest available market dealing bid price on the securities market on which the investment is quoted, listed or normally dealt in for such amount of such investment as the Manager may consider in the circumstances to provide a fair criterion, provided that: (i) if an investment is quoted, listed or n ormally dealt in on more than one securities market, the Manager shall adopt the price or, as the case may be, last traded price on the securities market which, in their opinion, provides the principal market for such investment; (ii) in the case of any invest ment which is quoted, listed or normally dealt in on a securities market but in respect of which, for any reason, prices on that securities market may not be available at any relevant time, the value thereof shall be certified by such firm or institution m aking a market in such investment as may be appointed for such purpose by the Manager, or, if the Trustee so requires, by the Manager after consultation with the Trustee; (iii) there shall be taken into account interest accrued on interest-bearing investments up to (and including) the date as at which the valuation is made, unless such interest is included in the quoted or listed price; and for the purpose of the foregoing provisions the Manager and the Trustee shall be entitled to use and to rely upon electronic transmitted information from such source or sources as they may from time to time think fit with regard to the pricing of the investments on any securities market and the prices derived therefrom shall be deemed to be the last traded prices; (b) the value of any investment which is not quoted, listed or normally dealt in on a securities market (other than an interest in a collective investment scheme) shall be the initial value thereof ascertained as hereinafter provided or the value thereof as asse ssed on the latest revaluation thereof made in accordance with the provisions hereinafter provided."
696,"For this purpose: (i) the initial value of an unquoted investment shall be the amount expended out of the relevant Investment Fund in the acquisition thereof ( including in each case the amount of the stamp duties, commissions and other expenses incurred in the acquisition thereof and the vesting thereof in the Trustee for the purposes of the Trust Deed); 48 (ii) the Manager may at any time in consultation with the Trustee and shall at such times or at such intervals as the Trustee may request, cause a revaluation to be made of any unquoted investment by a professional person approved by the Trustee as qualified to value such unquoted investment; notwithstanding the above, the Manager may determine to value on a straight line basis investments in debt instruments acquired as a discount to their face value."
697,"(c) cash, deposits and similar investments shall be valued at their face value (together with accrued interest) unless, in the opinion of the Manager, any adjustment should be made to reflect the value thereof; (d) the value of each unit, share or other interest in any collective investment scheme shall be the last available net asset value per unit, share or other interest in such collective investment scheme or, shall be determined from time to time in such manner as the Manager shall determine; (e) notwithstanding the foregoing, the Manager may, in consultation with the Trustee adjust the value of any investment or permit some other method of valuation to be used if, having regard to currency, applicable rate of interest, maturity, marketability and other considerations the Manager deems relevant, the Manager considers that such adjustment or use of such other method is required to reflect the fair value thereof."
698,"The Manager shall, at such times as the Trustee may require, cause an independent valuation to be made by a person approved by the Trustee."
699,"The Trustee may rely upon financial data furnished to it by third parties including the relevant calculation agent, automatic processing services, brokers, market makers or intermediaries, the Manager, and any administrator or valuations agent of other collective investments into which an Investment Fund may invest."
700,"If and to the extent that the Manager is responsible for or otherwise involved in the pricing of an Investment Fund's assets, the Trustee may accept, use and rely on such prices in determining the Net Asset Value of an Investment Fund; and (f) the value of any investment (whether of a Security or cash) otherwise than in the Base Currency shall be converted into the Base Currency at the rate (whether official or otherwise) which the Manager shall deem appropriate in the circums tances having regard to any premium or discount which may be relevant and to costs of exchange."
701,"49 SUSPENSION OF DEALING OR DETERMINATION OF NET ASSET VALUE The Manager may, in consultation with the Trustee, having regard to the best interests of the Unitholders, declare a suspension of the determination of the Net Asset Value of an Investment Fund for the whole or any part of any period during which: (a) there is a closure of or the restriction or disruption or suspension of trading on any securities market on which a substantial part of the investments of the Investment Fund is normally traded or a breakdown in any of the means normally employed by the Manager or the Trustee (as the case may be) in ascertaining the prices of investments or determining the Net Asset Value of the Investment Fund or the Net Asset Value per Unit of the relevant class; (b) for any other reason, the prices of investments held or contracted for by the Manager for the account of the Investment Fund cannot, in the reasonable opinion of the Manager, reasonably, promptly or fairly be ascertained; (c) circumstances exist as a result of which, in the reasonable opinion of the Manager, it is not reasonably practicable to realise any investments held or contracted for the ac count of the Investment Fund or it is not possible to do so without seriously prejudicing the interests of Unitholders of the relevant class; (d) the remittance or repatriation of funds which will or may be involved in the realisation of, or in the payment for, the investments of that Investment Fund or the subscription or realisation of Units of the relevant class is prohibited, restricted, delayed or cannot, in the reasonable opinion of the Manager, be carried out promptly at normal exchange rates; (e) in respect of an Index Tracking Investment Fund only, the relevant Underlying Index is not compiled or published; (f) a breakdown occurs in any of the systems and/or means of communication normally employed in ascertaining the Net Asset Value of the relevant Investme nt Fund or the Net Asset Value per Unit, Issue Price or Realisation Price of the relevant class, or when for any other reason the Net Asset Value of the relevant class cannot be ascertained in a prompt or accurate manner; (g) the existence of any state of aff airs as a result of which delivery of Index Securities or Securities (as the case may be) comprised in a Basket or disposal of investments for the time being comprised in the Investment Fund's assets cannot, in the opinion of the Manager, be effected normally or without prejudicing the interests of Unitholders; (h) any period when the dealing of Units is suspended pursuant to any order or direction issued by the Commission; or (i) any period when the business operations of the Manager or the Trustee in relation t o the operation of the Trust are substantially interrupted or closed as a result of arising from pestilence, acts of war, terrorism, insurrection, revolution civil unrest, riots, strikes or acts of God."
702,"Upon declaration of the suspension by the Manager, the suspension shall take effect."
703,"During the suspension: 50 (a) there shall be no determination of the Net Asset Value of the relevant Investment Fund or the Issue Price or the Realisation Price of Units in the relevant class; (b) no Application shall be made by any of the Participating Dealers and in the event any Application is received in respect of any Dealing Day falling within such period of suspension (that has not been otherwise withdrawn), such Application shall be deemed as having been received immediately following the termination of the suspension; (c) in the case of an Index Tracking Investment Fund, the Manager shall be under no obligation to rebalance the Deposited Property of the Index Tracking Investment Fund; and (d) no Units shall be created and issued or realised for the account of the Investment Fund."
704,"The suspension shall terminate (a) when the Manager, after consultation with the Trustee, having regard to the best interests of the Unitholders, declares the suspension at an end, or (b) in any event on the day following the first Business Day on which the condition giving rise to the suspension ceases to exist; and no other condition under which suspension shall be declared exists."
705,"The Manager shall notify the Commission if dealing in Units is suspended and publish a notice of suspension immediately following such suspension and, at least once a month during the period of suspension, on its website at https://www.globalxetfs.com.hk/ or in such publications as the Manager decides."
706,"As soon as reasonably practicable after the termination of suspension, the Manager shall publish a notice of such termination on the website maintained by the Ma nager for the Investment Fund or through such other means as the Manager considers appropriate."
707,A Participating Dealer may at any time after a suspension has been declared and before termination of such suspension withdraw an Application submitted prior to such suspension by notice in writing to the Manager and the Manager shall promptly notify the Trustee accordingly.
708,"If the Manager has not received any such notification of withdrawal of such Application before termination of such suspension, the Trustee shall, subject to and in accordance with the provisions of the Trust Deed, create and issue Units or realise Units in respect of such Application and such Application shall be deemed to be received immediately following the termination of such suspension."
709,"51 SUSPENSION OF DEALING IN UNITS ON THE SEHK Dealing in Units on the SEHK, or trading on the SEHK generally, may at any time be suspended by the SEHK subject to any conditions imposed by the SEHK if the SEHK considers it necessary for the protection of investors or for the maintenance of an orderly market or in such other circumstances as the SEHK may consider appropriate."
710,"52 DISTRIBUTION POLICY Unless otherwise specified in the relevant Appendix, (a) the Manager may at its absolute discretion declare distributions for the relevant Investment Fund to Unitholders at such times as it may determine in each financial year in May, and (b) the amount to be distributed to Unitholders will be derived from the net income of such Investment Fund, and will not be paid out of capital or effectively out of capital of an Investment Fund, meaning that distribution will not be paid out of gross income of an Investment Fund while all or part of such Investment Fund’s fees and expenses is charged to or paid out of capital of such Investment Fund."
711,The Manager may amend the policy with respect to distribution out of capital or effectively out of capital in respect of an Investment Fund subject to the Commission’s prior approval and by giving not less than one month’s prior notice to investors.
712,"Where distributions are paid out of capital or effectively out of capital of an Investment Fund, the compositions of dividends (i.e."
713,the relative amounts paid out of (i) net distributable income and (ii) capital) for the last 12 months of that Investment Fund will be available from the Manager on request and on the Manager’s website https://www.globalxetfs.com.hk/ (this website has not been reviewed by the Commission).
714,"On a distribution from the Investment Fund, the Trustee, in accordance with the instructions of the Manager, will allocate the amounts available for distribution between Unitholders and will pay such amounts to Unitholders."
715,"53 FEES AND CHARGES For details of the amount of fees and charges currently applicable to an Investment Fund, please refer to Part 2 of this Prospectus relating to the relevant Investment Fund."
716,"Management Fees and Servicing Fee Under the terms of the Trust Deed, the Manager may, on giving not less than one month’s written notice to the relevant Unitholders, increase each of the rate of the management fee or servicing fee payable in respect of an Investment Fund up to or towards its maximum rate of 2% per annum of the Net Asset Value of the Investment Fund accrued daily and calculated as at each Dealing Day and payable monthly in arrears, or such higher percentage as may be approved by the relevant Unitholders in accordance with the terms of the Trust Deed."
717,Please refer to Part 2 of this Prospectus for further details.
718,"An Investment Fund may employ a single management fee structure, whereby a single flat fee will be paid out of the assets of the relevant Investment Fund to cover all of the costs, fees and expenses of an Investment Fund (the “Single Management Fee”)."
719,"For an Investment Fund which employs such single management fee structure, the Manager will retain the Single Management Fee to pay for all of the costs, fees and expenses associated with the Inves tment Fund, including the fees payable to the Manager for portfolio management services, Manager’s servicing fee (if any), Trustee’s fee, Registrar’s fee, Service Agent’s fees and Operational Fees (as defined below) of the Investment Fund."
720,"Any costs, fees and expenses associated with the relevant Investment Fund exceeding the Single Management Fee shall be borne by the Manager and shall not be charged to such Investment Fund."
721,"For the avoidance of doubt, the Single Management Fee does not include any costs, fees and expenses payable by investors on the creation and realisation of Units, such as the fees to Participating Dealers, brokerage fees, transaction levy, AFRC transaction levy, trading fee and stamp duty, any brokerage and transaction costs, any extraordinary or exceptional costs and expenses (such as litigation expenses) as may arise from time to time and any tax liabilities in respect of the Investment Fund which will be paid separately out of the assets of the relevant Investment Fund."
722,"In addition, i n respect of an Index Tracking Investment Fund, the Single Management Fee does not represent the estimated tracking error of the relevant Index Tracking Investment Fund."
723,The current rate of Single Management Fee in respect of an Investment Fund which adopts a single management fee structure is set out in the relevant Appendix.
724,The maximum rate of the Single Management Fee in respect of an Investment Fund shall be 2% per annum of the Net Asset Value of the Investment Fund.
725,Please refer to the Appendix in respect of the relevant Investment Fund for further details.
726,"For an Investment Fund which does not employ a single management fee structure, all of the costs, fees and expenses relating to such Investment Fund (including but not limited to the fees payable to the Manager for portfolio management services, Manager’s servicing fee (if any), Trustee’s fee and Registrar’s fee) shall be borne by the Investment Fund."
727,The Manager shall be responsible for paying the fees of any additional sub-managers or investment delegates appointed by the Manager.
728,The Manager may pay a distribution fee to any distributor or sub-distributors of the Trust out of the management fees it receives from the Trust.
729,A distributor may re -allocate an amount of the distribution fee to the sub-distributors.
730,"54 Trustee Fee Under the terms of the Trust Deed, the Trustee may, after consulting the Manager, on giving not less than one month’s written notice to the relevant Unitholders, increase the rate of the trustee fee payable in respect of an Investment Fund up to or towards the maximum rate of 1% per annum of the Net Asset Value of the Investment Fund accrued daily and calculated as at each Dealing Day and payable monthly in arrears, or such higher percentage as may be approved by the relevant Unitholders in accordance with the terms of the Trust Deed."
731,"For an Investment Fund which employs a single management fee structure, the Trustee’s fee will be paid out of the Single Management Fee."
732,"If the Trustee’s fee exceeds the Single Management Fee, the excess amount shall be borne by the Manager."
733,Please refer to Part 2 of this Prospectus for further details.
734,"In respect of each Investment Fund which invests directly in A -Shares, the Trustee Fee will be inclusive of the fee payable to the PRC Custodian."
735,Registrar’s Fee The Registrar may charge an initial placing fee per Investment Fund and an ongoing registry service fee in respect of each Investment Fund.
736,The rate of the Registrar's fee in respect of an Investment Fund is set out in Part 2 of this Prospectus relating to the relevant Investment Fund.
737,"In addition, the Registrar will be reimbursed for all of its out-of-pocket expenses incurred in connection with performing its services."
738,"For an Investment Fund which employs a sing le management fee structure, the Registrar’s fee, including the Registrar’s out-of-pocket expenses incurred in connection with performing its services, will be paid out of the Single Management Fee."
739,"If the Registrar’s fee exceeds the Single Management Fee, the excess amount shall be borne by the Manager."
740,Service Agent’s Fee The Service Agent will charge such fees and expenses as are set out in Part 2 of this Prospectus relating to the relevant Investment Fund.
741,"For an Investment Fund which employs a single management fee structure, the Service Agent’s fee will be paid of the Single Management Fee."
742,"If the Service Agent’s fee exceeds the Single Management Fee, the excess amount shall be borne by the Manager."
743,Please refer to the relevant Appendix in respect of the Investment Fund for further details.
744,"Other Charges and Expenses The relevant Investment Fund will bear the costs set out in the Trust Deed, which are directly attributable to it."
745,"Where such costs are not directly attributable to the Investment Fund, the Manager with the approval of the Trustee shall determine how such costs are to be allocated."
