sentence_id,text
1463,"TO THE EXTENT PERMITTED BY APPLICABLE LAW, NO RESPONSIBILITY OR LIABILITY IS ACCEPTED BY HANG SENG INDE XES COMPANY LIMITED OR HANG SENG DATA SERVICES LIMITED (i) IN RESPECT OF THE USE OF AND/OR REFERENCE TO ANY OF THE INDEX BY MIRAE ASSET GLOBAL INVESTMENTS (HONG KONG) LIMITED IN CONNECTION WITH THE INVESTMENT FUND; OR (ii) FOR ANY INACCURACIES, OMISSIONS, MISTAKES OR ERRORS OF HANG SENG INDEXES COMPANY LIMITED IN THE COMPUTATION OF ANY OF THE INDEX; OR (iii) FOR ANY INACCURACIES, OMISSIONS, MISTAKES, ERRORS OR INCOMPLETENESS OF ANY INFORMATION USED IN CONNECTION WITH THE COMPUTATION OF ANY OF THE INDEX WHICH IS SUPPLIED BY ANY OTHER PERSON; OR (iv) FOR ANY ECONOMIC OR OTHER LOSS WHICH MAY BE DIRECTLY OR INDIRECTLY SUSTAINED BY ANY BROKER OR HOLDER OF THE INVESTMENT FUND OR ANY OTHER PERSON DEALING WITH THE INVESTMENT FUND AS A RESULT OF ANY OF THE AFORESAID, AND NO CLAIMS, ACTIONS OR LEGAL PROCEEDINGS MAY BE BROUGHT AGAINST HANG SENG INDEXES COMPANY LIMITED AND/OR HANG SENG DATA SERVICES LIMITED in connection with the Investment Fund in any manner whatsoever by any broker, holder or other person dealing with the Investment Fund."
1464,"Any broker, holder or other person dealing with the Investment Fund does so therefore in full knowledge of this disclaimer and can place no reliance whatsoever on Hang Seng Indexes Company Limited and Hang Seng Data Services Limited."
1465,"For the avoidance of doubt, this 112 disclaimer does not create any contractual or quasi -contractual relationship between any broker, holder or other person and Hang Seng Indexes Company Limited and/or Hang Seng Data Services Limited and must not be construed to have created such relationship."
1466,113 APPENDIX 3 – GLOBAL X CHINA BIOTECH ETF This part of the Prospectus sets out specific information applicable to the Global X China Biotech ETF (formerly known as Mirae Asset Horizons China Biotech ETF).
1467,Prospective investors’ attention is drawn to “Risk Factors relating to the Global X China Biotech ETF” below.
1468,"KEY INFORMATION The following table is a summary of key information in respect of the Global X China Biotech ETF, and should be read in conjunction with the full text of this Prospectus."
1469,"Investment Type Exchange Traded Fund (“ETF”) Tracked Index Solactive China Biotech Index NTR Type: Net total return Inception Date: 18 April 2019 Number of constituents: 30 (as at 31 August 2022) B a s e C u r r e n c y o f I n d e x : R e n m i n b i ( “R M B”) Initial Issue Date 24 July 2019 Listing Date 25 July 2019 Exchange Listing SEHK - Main Board Stock Code HKD counter: 2820 USD counter: 9820 Trade Lot Size HKD counter: 50 Units USD counter: 50 Units Base Currency Renminbi (RMB) Trading Currency United States dollars (USD) – USD counter Hong Kong dollars (HKD) – HKD counter 114 Dividend Policy Global X China Biotech ETF aims to pay annual cash distribution (in May each year), having regard to Global X China Biotech ETF’s net income after fees and costs and subject to the Manager’s discretion."
1470,The amount or rate of distribution (if any) is not guaranteed.
1471,"115 The Manager may, at its discretion, pay distributions out of capital."
1472,"Distributions on all Units (USD counter Units and HKD counter Units) will be in RMB only# Application Unit Size for Creation/Realisation by Participating Dealers Minimum 50,000 Units (or multiples thereof) Method(s) of Creation/Realisation available (through Participating Dealer) Cash (RMB) only Investment Delegate No investment delegate has been appointed Market Makers* Flow Traders Hong Kong Limited Mirae Asset Securities Co., Ltd."
1473,Vivienne Court Trading Pty.
1474,"Participating Dealers* ABN AMRO Clearing Hong Kong Ltd China Merchants Securities (HK) Co., Limited Citigroup Global Markets Asia Limited Haitong International Securities Company Limited Mirae Asset Securities (HK) Limited Yuanta Securities (Hong Kong) Company Limited Listing Agent Altus Capital Limited Financial Year Ending 31 March each year Management Fee The Global X China Biotech ETF adopts a single management fee structure."
1475,The current rate of Single Management Fee is 0.68% per annum of the NAV accrued daily and calculated as at each Dealing Day.
1476,Website https://www.globalxetfs.com.hk/ # Both HKD traded Units and USD traded Units will receive distributions in RMB only.
1477,"In the event that the relevant Unitholder has no RMB account, the Unitholder may have to bear the fees and charges associated with the conversion of such distribution from RMB into HKD or USD or any 116 other currency."
1478,Unitholders are advised to check with their brokers for arrangements concerning distributions and to consider the risk factor entitled “RMB distributions risk” below.
1479,* Please refer to the Manager’s website for the latest lists of Market Makers and Participating Dealers for the Investment Fund.
1480,EXCHANGE LISTING AND TRADING Creation and Realisation Participating Dealers (acting for themselves or for their clients) may continue to apply for Units by means of Creation Applications on each Dealing Day by transferring cash in accordance with the Operating Guidelines.
1481,Units may be realised by cash realisation through Participating Dealers in Application Unit size or multiples thereof.
1482,"However, notwithstanding the Dual Counter, realisation proceeds shall be paid in RMB only."
1483,The dealing period on each Dealing Day for a Creation Application or a Real isation Application commences at 9:00 a.m.
1484,"(Hong Kong time)] and ends at the Dealing Deadline at 11:00 a.m.(Hong Kong time)], as may be revised by the Manager from time to time."
1485,Please note that the Participating Dealers may impose different cut-off times for the dealing period for the Primary Market Investor.
1486,Notwithstanding a Dual Counter being adopted: (a) all Creation Applications must be made in cash (in RMB only).
1487,Units which are created must be deposited in CCASS as HKD counter Units (i.e.
1488,tradable in HKD only) or USD counter units (i.e.
1489,tradable in USD only); and (b) although a Participating Dealer may withdraw from any of the trading counter (i.e.
1490,"either HKD counter or USD counter), any cash proceeds received by a Participating Dealer in a cash Realisation Application shall be paid only in RMB."
1491,Both HKD traded Units and USD traded Units may be realised by way of a Realisation Application (through a Participating Dealer).
1492,"Where a Participating Dealer wishes to realise HKD traded Units, the realisa tion process is the same as for USD traded Units."
1493,Units are listed and dealt only on the SEHK and no application for listing or permission to deal on any other stock exchanges is being sought as at the date of this Prospectus.
1494,Application may be made in the future for a listing of Units on other stock exchanges.
1495,"If trading of the Units of the Global X China Biotech ETF on the SEHK is suspended or trading generally on the SEHK is suspended, then there will be no secondary market dealing for those Units."
1496,Dual Counter The Manager has arranged for the Units to be available for trading on the secondary market on the SEHK under a Dual Counter arrangement.
1497,Units are denominated in RMB.
1498,"Despite the Dual Counter arrangement, the creation of new Units and realisa tion of Units in the primary market are settled in RMB only."
1499,The Global X China Biotech ETF offers two trading counters on the SEHK (i.e.
1500,USD counter and HKD counter) to investors for secondary trading purposes.
1501,Units traded in USD counter will be settled in USD and Units traded in HKD counter will be settled in HKD.
1502,"Apart from 117 settlement in different currencies, the trading prices of Units in the two counters may be different as the USD counter and HKD counter are two distinct and separate markets."
1503,Units traded on both counters are of the same class and all Unitholders of both counters are treated equally.
1504,"The two counters will have different stock codes, different stock short names and different ISIN numbers as follows: USD counter and traded Units have a SEHK stock code 9820 and a stock short name “GX CN BIOTECH -U” whilst the HKD counter and traded Units have a SEHK stock code 2820 and a stock short name “GX CN BIOTECH”."
1505,The ISIN for USD counter and traded Units is HK0000516689 and the ISIN for HKD counter and traded Units is HK0000516697.
1506,"Normally, investors can buy and sell Units traded in the same counter or alternatively buy in one counter and sell in the other counter provided their brokers provide both HKD and USD trading services at the same time and offer inter-counter transfer services to support Dual Counter trading."
1507,Inter-counter buy and sell is permissible even if the trades take places within the same trading day.
1508,"However, investors should note that the trading price of Units traded in the USD counter and that of HKD counter may be different and may not always maintain a close relationship depending on factors such as market demand and supply and liquidity in each counter."
1509,More information with regard to the Dual Counter is available in the frequently asked questions in respect of the Dual Counter published on HKEX’s website https://www.hkex.com.hk/Global/Exchange/FAQ/Featured/RMB-Readiness-and-Services/Dual- Tranche-Dual-Counter-Model?sc_lang=en.
1510,"Investors should consult their brokers if they have any questions concerning fees, timing, procedures and the operation of the Dual Counter, including inter -counter transfers."
1511,Investors’ attention is also drawn to the risk factors below entitled “Dual Coun ter risks” and “Inter -counter trading risk”.
1512,"INVESTMENT OBJECTIVE AND STRATEGY The Global X China Biotech ETF seeks to provide investment results that, before deduction of fees and expenses, closely correspond to the performance of the Underlying Index."
1513,The Manager intends to adopt a combination of physical and synthetic replication strategy to achieve the investment objective of the Global X China Biotech ETF.
1514,"The Global X China Biotech ETF will: (i) invest 50% to 100% of its Net Asset Value directly in Index Securities; and (ii) use synthetic replication strategy as an ancillary strategy when the Manager considers that such investments are beneficial to the Global X China Biotech ETF by investing up to 50% of its Net Asset Value in FDIs, mainly funded total return Swap transaction(s) with one or more Swap Counterparty(ies)."
1515,The Global X China Biotech ETF intends to obtain exposure to the Index Securities (through direct investment and/or through FDIs) in substantially the same weightings as these Securities have in the Underlying Index.
1516,"Where the adoption of the strategy to obtain exposure to the Index Securities (through direct investment and/or through FDIs) in substantially the same weightings as these Securities have in the Underlying Index is not efficien t or practicable or where the Manager considers appropriate in its absolute discretion, the Manager may obtain exposure to a representative sample of the constituent Securities of the Underlying Index selected by the Manager (through direct investment and/ or through FDIs) using quantitative analytical models to 118 derive a portfolio sample."
1517,"Investors should note that the Manager may switch between the abovementioned strategies without prior notice to investors, in its absolute discretion ."
1518,"When adopting a synthetic replication strategy, the Global X China Biotech ETF will pass on the relevant portion of cash to the Swap Counterparty(ies) for each Swap contract entered into and in return the Swap Counterparty(ies) will provide the Global X China Biotech ETF with an exposure to the economic gain/loss in the performance of the constituent Securities of the Underlying Index (net of indirect costs)."
1519,"The Global X China Biotech ETF will bear the Swap fees, which is a one -off variable fee consisting of commission an d transaction costs payable to the Swap Counterparty each time the Global X China Biotech ETF enters into a Swap transaction."
1520,The Swap fees are charged based on the notional value of the Swap transaction and may vary between different Swap transactions.
1521,No fees are payable for the unwinding or early termination of Swaps.
1522,"The Swap fees will be borne by the Global X China Biotech ETF and hence may have an adverse impact on the Net Asset Value and the performance of the Global X China Biotech ETF, and may resu lt in higher tracking difference."
1523,"The Swap fees, if any, will be disclosed in the interim and annual financial reports of the Global X China Biotech ETF."
1524,"In relation to the Global X China Biotech ETF’s investments in A-Shares, the Manager will invest via the Stock Connect (as explained in the section “What is Stock Connect?” below)."
1525,"119 Other investments Currently, the Global X China Biotech ETF will not enter into sale and repurchase transactions, reverse repurchase transactions or other similar over-the-counter transactions."
1526,"Should there be any change in such intention, the Manager will seek prior approval of the Commission if required and not less than one month’s prior notice (or such other notice period as agreed with the Commission) will be given to Unitholders."
1527,The investment strategy of the Global X China Biotech ETF is subject to the investment and borrowing restrictions set out in Part 1 of the Prospectus.
1528,"SECURITIES LENDING TRANSACTIONS The Manager may, on behalf of the Global X China Biotech ETF, enter into securities lending transactions with a maximum level of up to 50% and expected level of approximately 20% of the Global X China Biotech ETF’s Net Asset Value."
1529,The Manager will be abl e to recall the Securities lent out at any time.
1530,All securities lending transactions will only be carried out in the best interest of the Global X China Biotech ETF and as set out in the relevant securities lending agreement.
1531,Such transactions may be termi nated at any time by the Manager at its absolute discretion.
1532,Please refer to the sub -section titled “Securities Financing Transactions” of the section headed “Investment and Borrowing Restrictions” in Part 1 of this Prospectus in regard to the details of the arrangements.
1533,"As part of the securities lending transactions, the Global X China Biotech ETF must receive cash and/or non-cash collateral (fulfilling the requirements under sub -section titled “Collateral” of the section headed “Investment and Borrowing Restrictions” in Part 1 of this Prospectus) of 100% of the value of the Securities lent (interests, dividends and other eventual rights included)."
1534,The collateral will be marked-to-market on a daily basis and be subject to safekeeping by the Trustee or an agent appointed by the Trustee.
1535,Please refer to the sub -section titled “Trustee” of the section headed “Management and Administration” in Part 1 of this Prospectus in regard to the extent of the Trustee’s responsibility for the safekeeping of the assets of the Trust and the appointment of agents.
1536,The valuation of the collateral generally takes place on trading day T.
1537,"If the value of the collateral falls below 100% of the value of the securities lent on any trading day T, the Manager will call for additional collateral on trading day T, and the borrower will have to deliver additional collateral to make up for the difference in securities value by 4:00 p.m."
1538,on trading day T+2.
1539,"Non-cash collateral received may not be sold, re-invested or pledged."
1540,Any re-investment of cash collateral received shall be subject to the requirements as set out in the sub-section titled “Collateral” of the section headed “Investment and Borrowing Restrictions” in Part 1 of this Prospectus.
1541,"To the extent the Global X China Biotech E TF undertakes securities lending transactions, all revenues (net of direct and indirect expenses as reasonable and normal compensation for the services rendered by the Manager, a Securities Lending Agent and/or other service providers in the context of such transactions to the extent permitted by applicable legal and regulatory requirements) shall be returned to the Global X China Biotech ETF."
1542,The cost relating to securities lending transactions will be borne by the borrower.
1543,"Securities lending transaction s nonetheless give rise to certain risks including counterparty risk, collateral risk and operational risk."
1544,Please refer to the risk factor titled “Securities lending transactions risk” below and the sub-section titled “Securities Financing Transactions” of the section headed “Risk Factors” in Part 1 of this Prospectus for further details.
1545,120 USE OF DERIVATIVES The Global X China Biotech ETF may invest in FDIs for hedging or non -hedging (i.e.
1546,"investment) purposes, in order to achieve the investment objective of the Global X China Biotech ETF and efficient portfolio management."
1547,The Global X China Biotech ETF’s net derivative exposure may be up to 50% of the Investment Fund’s Net Asset Value.
1548,"Other than Swaps, the Manager may also invest no more than 10% of the Global X China Biotech ETF’s Net Asset Value in futures for investment and hedging purposes, where the Manager believes such investments will help the Global X China Biotech ETF achieve its investment objective and are beneficial to the Global X China Biotech ETF."
1549,The futures in which the Global X China Biotech ETF may invest will be index futures which exhibit high correlation with the Underlying Index in order to manage the Global X China Biotech ETF’s exposure to the Underlying Index constituents.
1550,WHAT IS STOCK CONNECT?
1551,"The Shanghai -Hong Kong Stock Connect is a securities trading and clearing links programme developed by the HKEX, Shanghai Stock Exchange (the “ SSE”) and the CSDCC, and the Shenzhen-Hong Kong Stock Connect is a securities trading and clearing links programme developed by HKEX, the Shenzhen Stock Exchange (the “SZSE”) and the CSDCC."
1552,The aim of the Stock Connect is to achieve mutual stock market access between mainland China and Hong Kong.
1553,The Shanghai-Hong Kong Stock Connect comprises a Northbound Shanghai Trading Link and a Southbound Hong Kong Trading Link.
1554,"Under the Northbound Shanghai Trading Link, Hong Kong and overseas investors (including the Global X China Biotech ETF), through thei r Hong Kong brokers and a securities trading service company established by the SEHK, are able to trade eligible securities listed on the SSE by routing orders to the SSE."
1555,The Shenzhen-Hong Kong Stock Connect comprises a Northbound Shenzhen Trading Link and a Southbound Hong Kong Trading Link.
1556,"Under the Northbound Shenzhen Trading Link, Hong Kong and overseas investors (including the Global X China Biotech ETF), through their Hong Kong brokers and a securities trading service company established by SEHK, a re able to trade eligible securities listed on the SZSE by routing orders to SZSE."
1557,"Eligible securities Under the Shanghai-Hong Kong Stock Connect, Hong Kong and overseas investors (including the Global X China Biotech ETF) are able to trade certain stock s listed on the SSE market (“ SSE Securities”)."
1558,"SSE Securities include all the constituent stocks from time to time of the SSE 180 Index and SSE 380 Index, and all the SSE -listed A -Shares that are not included as constituent stocks of the relevant indices but which have corresponding H-Shares listed on the SEHK, except the following: (a) SSE-listed shares which are not traded in RMB; and (b) SSE-listed shares which are under “risk alert”."
1559,It is expected that the list of eligible securities will be subject to review.
1560,"Under the Shenzhen-Hong Kong Stock Connect, Hong Kong and overseas investors (including the Global X China Biotech ETF) are able to trade certain eligible shares listed on the SZSE market (“SZSE Securities”)."
1561,"These include all the constituent stoc ks of the SZSE Component Index and 121 the SZSE Small/Mid Cap Innovation Index which have a market capitalisation of not less than RMB 6 billion, and all the SZSE -listed A-Shares which have corresponding H -shares listed on SEHK, except the following: (a) SZSE-listed shares which are not traded in RMB; and (b) SZSE-listed shares which are under “risk alert” or under delisting arrangement."
1562,"At the initial stage of Shenzhen -Hong Kong Stock Connect, investors eligible to trade shares that are listed on the ChiNext Board of the SZSE (“ChiNext Board”) under Northbound trading will be 122 limited to institutional professional investors as defined in the relevant Hong Kong rules and regulations."
1563,It is expected that the list of eligible securities will be subject to review.
1564,Hong Kong and overseas investors are able to trade eligible SSE-listed and SZSE-listed ETFs that satisfy the relevant criteria at a regular review and are accepted as eligible ETFs for Northbound trading in Stock Connect.
1565,Regular reviews will be performed to determine the eligible ETFs for Northbound trading every six months.
1566,"Trading days Investors (including the Global X China Biotech ETF) will only be allowed to trade on the SSE market and the SZSE market on days where the PRC and Hong Kong stock markets are open for trading, and banking services are available in both markets on the corresponding settlement days."
1567,"Trading quota Trading under the Stock Connect is subject to a daily quota (the “ Daily Quota”), which will be separate for Northbound and Sout hbound trading."
1568,"Northbound Shanghai Trading Link under the Shanghai-Hong Kong Stock Connect, Northbound Shenzhen Trading Link under the Shenzhen - Hong Kong Stock Connect, Southbound Hong Kong Trading Link under the Shanghai-Hong Kong Stock Connect and Sout hbound Hong Kong Trading Link under the Shenzhen -Hong Kong Stock Connect will be respectively subject to a separate set of Daily Quota."
1569,The Daily Quota limits the maximum net buy value of cross-boundary trades under each of the Stock Connect each day.
1570,The quotas do not belong to the Global X China Biotech ETF and are utilised on a first-come-first-serve basis.
1571,The SEHK will monitor the quota and publish the remaining balance of the Northbound Daily Quota at scheduled times on the HKEX’s website.
1572,The Daily Q uota may change in future.
1573,The Manager will not notify Unitholders in case of a change of quota.
1574,"Settlement and custody The HKSCC, a wholly -owned subsidiary of HKEX, is responsible for the clearing, settlement and the provision of depository, nominee and other related services of the trades executed by Hong Kong market participants and investors."
1575,"A-Shares traded through the Stock Connect are issued in scripless form, so investors will not hold any physical A-Shares."
1576,Hong Kong and overseas investors who have acquired SSE Securities or SZSE Securities through Northbound trading should maintain the SSE Securities or SZSE Securities with their brokers’ or custodians’ stock accounts with CCASS (the Central Clearing and Settlement System operated by HKSCC for th e clearing securities listed or traded on SEHK).
1577,"Corporate actions and shareholders’ meetings Notwithstanding the fact that HKSCC does not claim proprietary interests in the SSE Securities and SZSE Securities held in its omnibus stock account in the CSDC C, the CSDCC as the share registrar for SSE and SZSE listed companies still treats the HKSCC as one of the shareholders when it handles corporate actions in respect of such SSE Securities and SZSE Securities."
1578,The HKSCC will monitor the corporate actions affecting SSE Securities and SZSE Securities and keep the relevant brokers or custodians participating in CCASS (“CCASS participants”) informed of all such corporate actions that require CCASS participants to take steps in order to participate in them.
1579,SSE- /SZSE-listed companies usually announce information regarding their annual general meetings/extraordinary general meetings about two to three weeks before the meeting date.
1580,A poll is called on all resolutions for all votes.
1581,"HKSCC will advise CCASS particip ants of all general meeting details such as meeting date, time, venue and the number of resolutions."
1582,123 Currency Hong Kong and overseas investors (including the Global X China Biotech ETF) will trade and settle SSE Securities and SZSE Securities in RMB only.
1583,"124 Foreign shareholding restrictions CSRC stipulates that, when holding A -Shares through the Stock Connect, Hong Kong and overseas investors are subject to the following shareholding restrictions: (a) shares held by a single foreign investor (such as the Global X China Biotech ETF) investing in a listed company must not exceed 10% of the total issued shares of such listed company; and (b) total shares held by all foreign investors (i.e."
1584,Hong Kong and overseas investors) who make investm ent in a listed company must not exceed 30% of the total issued shares of such listed company.
1585,"When the aggregate foreign shareholding of an individual A-Share reaches 26%, SSE or SZSE, as the case may be, will publish a notice on its website ( http://www.sse.com.cn//disclosure/diclosure/qfii/ for SSE and https://www.szse.cn/disclosure/deal/qfii/index.html for SZSE)."
1586,"If the agg regate foreign shareholding exceeds the 30% threshold, the foreign investors concerned will be requested to sell the shares on a last-in-first-out basis within five trading days."
