sentence_id,text
2580,The current rate of the Single Management Fee is 0.29% per annum of the Net Asset Value accrued daily and calculated as at each Dealing Day.
2581,Website https://www.globalxetfs.com.hk/ (this website has not been reviewed by the Commission) * Please refer to the Manager’s website for the latest lists of Market Makers and Participating Dealers for the Investment Fund.
2582,182 EXCHANGE LISTING AND TRADING Initial Offer Period Units of the Global X Hang Seng ESG ETF will initially be offered only to the Participating Dealer(s) from 9:00 a.m.
2583,(Hong Kong time) on 16 March 2022 to 5:00 p.m.
2584,"(Hong Kong time) on 16 March 2022, or such other time as the Manager (with the approval of the Trustee) may determine (the “Initial Offer Period”)."
2585,"The Issue Price of Units which is the subject of a Creation Application during the Initial Offer Period is one-thousandth (1/1,000th) of the closing level of the Underlying Index (as defined below) (in HKD) on the trading day immediately preceding the Initial Offer Period per Unit, or such other amount determined by the Manager with the approval of the Trustee prior to the Initial Offer Period."
2586,Applications for creation of Units may be made by way of a cash Creation Application (in HKD only) or an in-kind Creation Application.
2587,After Listing Dealings in the Units of the Global X Hang Seng ESG ETF on the SEHK (the “Listing”) are expected to commence on 21 March 2022.
2588,Participating Dealers (acting for themselves or for their clients) may co ntinue to apply for Units by means of a cash Creation Application (in HKD only) or an in -kind Creation Application on each Dealing Day by transferring cash and/or Securities in accordance with the Operating Guidelines.
2589,Units may be realised by means of a cash Realistion Application (in HKD only) or an in -kind Realisation Application through Participating Dealers in Application Unit size or multiples thereof.
2590,The dealing period on each Dealing Day after Listing for a Creation Application or a Realisation Application commences at 9:00 a.m.
2591,(Hong Kong time) and ends at the Dealing Deadline at 11:00 a.m.
2592,(Hong Kong time) (in respect of a cash Application) or 4:15 p.m.
2593,"(Hong Kong time) (in respect of an in-kind Application), as may be revised by the Manager from time to time."
2594,Please note that the Participating Dealers may impose different cut-off times for the dealing period for the Primary Market Investor.
2595,Units are listed and dealt only on the SEHK and no application for listing or permission to deal on any other stock exchanges is being sought as at the date of this Prospectus.
2596,Application may be made in the future for a listing of Units on other stock exchanges.
2597,"If trading of the Units of the Global X Hang Seng ESG ETF on the SEHK is suspended or trading generally on the SEHK is suspended, then there will be no secondary market dealing for those Units."
2598,"INVESTMENT OBJECTIVE AND STRATEGY The Global X Hang Seng ESG ETF seeks to provide investment results that, before deduction of fees and expenses, closely c orrespond to the performance of the HSI ESG Enhanced Index (the “Underlying Index”)."
2599,"The Manager intends to primarily adopt a full replication strategy through investing all, or substantially all, of the assets of the Global X Hang Seng ESG ETF directly in all Securities constituting the Underlying Index in substantially the same weightings as these Securities have in the Underlying Index to achieve the investment objective of the Global X Hang Seng ESG ETF."
2600,"183 Where the adoption of a full replication strategy is not efficient or practicable or where the Manager considers appropriate in its absolute discretion, the Manager may pursue a representative sampling strategy and hold a representative sample of the constituent Securities of the Underlying Index selected by the Manager using rule-based quantitative analytical models to derive a portfolio sample."
2601,"In pursuing a representative sampling strategy, the Manager may cause the Global X Hang Seng ESG ETF to deviate from the Underlying Index weighting on the condition that the maximum deviation from the Underlying Index weighting of any constituent will not exceed 3 percentage points above or below such weighting."
2602,"Investors should note that the Manager may switch between the full replication strategy and the representative sampling strategy without prior notice to investors, in its absolute discretion as often as it believes appropriate in order to achieve the investment objective of the Global X Hang Seng ESG ETF by tracking the Underlying In dex as closely (or efficiently) as possible for the benefit of investors."
2603,"For an explanation on full replication strategy and representative sample strategy, please refer to the sub -section titled “Investment Policies” of the section headed “Investment Ob jectives and Policies” in Part 1 of this Prospectus."
2604,The Global X Hang Seng ESG ETF may invest not more than 5% of its Net Asset Value in cash and money market funds authorised under Chapter 8.2 of the Code or eligible schemes under Chapter 7.11A of the Code for cash management purposes.
2605,"Currently, the Global X Hang Seng ESG ETF will not enter into sale and repurchase transactions, reverse repurchase transactions or other similar over -the-counter transactions."
2606,The Manager will seek the prior approval of the Commission (if required) and provide at least one month’s prior notice to Unitholders before the Manager engages in any such investments.
2607,The investment strategy of the Global X Hang Seng ESG ETF is subject to the investment and borrowing restrictions set out in Part 1 of this Prospectus.
2608,"SECURITIES LENDING TRANSACTIONS The Manager may, on behalf of the Global X Hang Seng ESG ETF, enter into securities lending transactions with a maximum level of up to 50% and expected level of approximately 20% of th e Global X Hang Seng ESG ETF’s Net Asset Value."
2609,The Manager will be able to recall the Securities lent out at any time.
2610,All securities lending transactions will only be carried out in the best interests of the Global X Hang Seng ESG ETF and as set out in the relevant securities lending agreement.
2611,Such transactions may be terminated at any time by the Manager at its absolute discretion.
2612,Please refer to the sub -section titled “Securities Financing Transactions” of the section headed “Investment and Borrowing Restrictions” in Part 1 of this Prospectus in regard to the details of the arrangements.
2613,"As part of the securities lending transactions, the Global X Hang Seng ESG ETF must receive cash and/or non-cash collateral (fulfilling the requirements under the sub-section titled “Collateral” of the section headed “Investment and Borrowing Restrictions” in Part 1 of this Prospectus) of 100% of the value of the Securities lent (interests, dividends and other eventual rights included)."
2614,The collateral will be marked-to-market on a daily basis and be subject to safekeeping by the Trustee or an agent appointed by the Trustee.
2615,Please refer to the sub -section titled “Trustee” of the section headed “Management and Administration” in Part 1 of this Prospectus in regard to th e extent of the Trustee’s responsibility for the safekeeping of the assets of the Trust and the appointment of agents.
2616,The valuation of the collateral generally takes place on trading day T.
2617,"If the value of the collateral falls below 100% of the value of the Securities lent on any trading day T, the Manager will call for 184 additional collateral on trading day T, and the borrower will have to deliver additional collateral to make up for the difference in securities value by 4:00 p.m."
2618,on trading day T+2.
2619,"Non-cash collateral received may not be sold, re-invested or pledged."
2620,Any re-investment of cash collateral received shall be subject to the requirements as set out in the sub-section titled “Collateral” of the section headed “Investment and Borrowing Restrictions” in Part 1 of this Prospectus.
2621,"To the extent the Global X Hang Seng ESG ETF undertakes securities lending transactions, all revenues (net of direct and indirect expenses as reasonable and normal compensation for the services rendered by the Manager, a Securities Lending Agent and/or other service providers in the context of such transactions to the extent permitted by applicable legal and regulatory requirements) shall be returned to the Global X Hang Seng ESG ETF."
2622,The cost relating to securities lending transactions will be borne by the borrower.
2623,"Securities lending transactions nonetheless give rise to certain risks including counterparty risk, collateral risk and operational risk."
2624,Please refer to the risk factor titled “Securities lending transactions risk” below and the sub-section titled “Securities Financing Transactions” of the section headed “Risk Factors” in Part 1 of this Prospectus for further details.
2625,USE OF DERIVATIVES The Global X Hang Seng ESG ETF may invest in financ ial derivative instruments (“ FDIs”) for hedging or non -hedging (i.e.
2626,"investment) purposes, in order to achieve efficient portfolio management."
2627,The Global X Hang Seng ESG ETF’s net derivative exposure may be up to 50% of its Net Asset Value.
2628,"The Manager may invest no more than 10% of the Global X Hang Seng ESG ETF’s Net Asset Value in futures for investment and hedging purposes, where the Manager believes such investments will help the Global X Hang Seng ESG ETF achieve its investment objective and are beneficial to the Global X Hang Seng ESG ETF."
2629,"The futures in which the Global X Hang Seng ESG ETF may invest will be index futures to manage its exposure to the Underlying Index constituents, such as Hang Seng Index futures."
2630,Exposure of the Global X Hang Seng ESG ETF to the Underlying Index constituents will be substantially in the same weightings (i.e.
2631,proportions) as such constituents have in the Underlying Index.
2632,"DISTRIBUTION POLICY The Global X Hang Seng ESG ETF aims to pay annual cash distribution (usually in May each year), out of its net income earned after fees and costs and at the discretion of the Manager."
2633,The amount or rate of distribution (if any) is not guaranteed.
2634,Distributions may not be paid if the cost of the Global X Hang Seng ESG ETF’s ope rations is higher than the return from management of the Global X Hang Seng ESG ETF’s cash and holding of investment products.
2635,"The Manager may, at its discretion, pay distributions out of capital."
2636,"The Manager may also, at its discretion, pay distributions out of gross income while all or part of the fees and expenses of the Global X Hang Seng ESG ETF are charged to/paid out of the capital of the Global X Hang Seng ESG ETF, resulting in an increase in distributable income for the payment of dividends by the Global X Hang Seng ESG ETF and therefore, the Global X Hang Seng ESG ETF may effectively pay distributions out of capital."
2637,Investors should note that payments of distributions out of capital or effectively out of capital amounts to a return or withdrawal of part of an investor’s original investment or from any capital gains attributable to that original investment.
2638,Any distributions involving payment of distributions out of the Global X Hang Seng ESG ETF’s capital or effectively out of its capital may result in an immediate reduction in the Net Asset Value of the Global X Hang Seng ESG ETF and will reduce the capital available for future investment.
2639,"185 Details of the distribution declaration dates, distribution amounts and ex -dividend payment dates will be published on the Manager’s website at https://www.globalxetfs.com.hk/ (the contents of which have not been reviewed by the Commission)."
2640,There can be no assurance that a distribution will be paid.
2641,The composition of the distributions (i.e.
2642,the relative amounts paid out of net distributable income and capital) for the last 12 months are available by the Manager on request and also on the Manager’s website at https://www.globalxetfs.com.hk/ (the contents of which have not been reviewed by the Commission).
2643,Each Unitholder will receive distributions in HKD.
2644,"THE INDEX The Underlying Index is a modified free float-adjusted market capitalisation weighted index which aims to measure the overall performance of the Hong Kong stock market combined with ESG initiatives based on internationally recognised ESG principles, data, research and ratings."
2645,The Underlying Index is compiled and managed by Hang Seng Indexes Company Limited (“HSIL” or the “Index Provider”).
2646,The Manager (and each of its Connected Persons) are independent of HSIL.
2647,The Underlying Index is denominated and quoted in HKD.
2648,Please refer to the section “Index Description” for detailed information on the Underlying Index.
2649,"RISK FACTORS RELATING TO THE GLOBAL X HANG SENG ESG ETF In addition to the principal risk factors common to all Investment Funds set out in Part 1 of this Prospectus, investors should also consider the potential risks associated with investing in the Global X Hang Seng ESG ETF including those set out below."
2650,Investors should carefully consider the risk factors described below together with all of the other information included in this Prospectus before deciding whether to invest in Units of the Global X Hang Seng ESG ETF.
2651,New index risk.
2652,The Underlying Index is new and has minimal operating history by which investors can evaluate its previous performance.
2653,There can be no assurance as to the performance of the Underlying Index.
2654,The Global X Hang Seng ESG ETF may be riskier than other exchange traded funds tracking more established indices with longer operating history.
2655,"Risks associated with environmental, social and governance (“ESG”) investing."
2656,"The use of ESG criteria in the construction of the Underlying Index may affect the Global X Hang Seng ESG ETF’s investment performance and, as such, the Global X Hang Seng ESG ET F may perform differently compared to similar funds that do not use such criteria."
2657,ESG-based exclusionary criteria used in the selection methodology of the Underlying Index may result in the Underlying Index excluding certain Securities when it might otherwise be advantageous for the Global X Hang Seng ESG ETF to invest in those Securities.
2658,"The construction of the Underlying Index (including constituent selection and index calculation) is based on, among others, the results from various ESG assessment and ratings as well as the application of certain ESG based exclusion factors."
2659,It is possible that the Underlying Index (and hence the Global X Hang Seng ESG ETF’s portfolio) may perform less well than portfolios with similar investment objectives that are not engaged in similar (or any) ESG rating assessment and ESG based exclusions.
2660,The Global X Hang Seng ESG ETF’s investments may be concentrated in companies with a greater ESG focus and thus its value may be more volatile than that of a fund with having a m ore diverse portfolio of investments.
2661,186 The constituent selection and index calculation process of the Underlying Index involves analysis and exclusions based on ESG criteria.
2662,"While the Manager and the Index Provider have exercised care in the ESG-related data and information to be relied upon, such assessment by the ESG data providers of the ESG screenings mentioned below (being Sustainalytics, Arabesque S-Ray and ISS ESG) may involve qualitative factors and it is thus possible that the relevant investment criteria may not be applied correctly."
2663,"In evaluating a Security or issuer based on ESG criteria, the Index Provider is dependent upon information and data from the ESG data providers which may be incomplete, inaccurate or unavailable f rom time to time, which may in turn affect the Index Provider’s ability to assess potential constituents for inclusion or exclusion from the Underlying Index."
2664,"There can be no assurance that the Index Provider’s assessment, based upon data from the ESG data providers, will reflect the actual circumstances or that the Securities selected will fulfill ESG criteria."
2665,All of these can lead to the Global X Hang Seng ESG ETF forgoing investment opportunities which meet the relevant ESG criteria or investing in Securities which do not meet such criteria.
2666,"In addition, there is a lack of standardised taxonomy in relation to ESG investing strategies."
2667,The standard of disclosure adopted by funds in relation to the relevant ESG factors or principles may vary.
2668,Risk associated with investments in companies with weighted voting rights.
2669,"The Global X Hang Seng ESG ETF may invest in, or the constituents of the Underlying Index tracked by the Global X Hang Seng ESG ETF may include, companies (such as innovative companies) which have a weighted voting rights (WVR) structure (or the so-called dual-class shares structure) under which some key individuals including the founders and key management hold specific classes of shares that are attached with higher voting power than ordinary shares and are disproportionate to the shareholding, or other governance right or arrangement of the beneficiary’s economic interest in the equity securities of the issuer."
2670,"This leads to issues relating to shareholder rights and corporate governance as well as investor protection, which may have a negative impact on the Global X Hang Seng ESG ETF where the Global X Hang Seng ESG ETF invests in the ordinary shares of such companies."
2671,Geographical concentration risk.
2672,"The Underlying Index is subject to concentration risk as a result of tracking the performance of Securities of companies listed on the SEHK which are incorporated in, or with the majority of revenue derived from, or with a principal place of business in, the Greater China region."
2673,"The Net Asset Va lue of the Global X Hang Seng ESG ETF is therefore likely to be more volatile than a broad-based fund, such as a global or regional fund, as the Underlying Index is more susceptible to fluctuations in value resulting from adverse economic, political, policy, foreign exchange, liquidity, tax, legal or regulatory event affecting the Greater China region."
2674,Securities lending transactions risk.
2675,The Global X Hang Seng ESG ETF may be exposed to the following risks as a result of entering into securities lending transactions: Counterparty risk: The borrower may fail to return the Securities lent out in a timely manner or at all.
2676,The Global X Hang Seng ESG ETF may as a result suffer from a loss or delay when recovering the Securities lent out.
2677,This may restrict the Global X Hang Seng ESG ETF’s ability in meeting delivery or payment obligations from realisation requests.
2678,"Collateral risk: As part of the securities lending transactions, the Global X Hang Seng ESG ETF must receive at least 100% of the valuation of the Securities lent as collateral marked-to-market on a daily basis."
2679,"However, there is a risk of shortfall of collateral value due to inaccurate pricing of the collateral, adverse market movements in the collateral value or change of value of Securities lent."
2680,This may cause significant losses to the Global X Hang Seng ESG ETF if the borrower fails to return the Securities lent out.
2681,"The Global X Hang Seng ESG ETF may also be subject to liquidity and custody risk of the collateral, as well as legal risk of enforcement."
2682,"187 Operational risk: By undertaking securities lending transactions, the Global X Hang Seng ESG ETF is exposed to operational risks such as delay or failure of settlement."
2683,Such delays and failure may restrict the Global X Hang Seng ESG ETF’s ability in meeting delivery or payment obligations from realisation requests.
2684,Trading risk.
2685,"Generally, retail investors can only buy or sell Units on the SEHK."
2686,The trading price of the Units on the SEHK is driven by market factors such as deman d and supply of the Units.
2687,"Therefore, the Units may trade at a substantial premium/discount to its Net Asset Value."
2688,As investors will pay certain charges (e.g.
2689,"trading fees and brokerage fees) to buy or sell Units on the SEHK, retail investors may pay more than the Net Asset Value per Unit when buying Units on the SEHK, and may receive less than the Net Asset Value per Unit when selling Units on the SEHK."
2690,Distributions out of or effectively out of capital risk .
2691,The Manager may at its discretion pay distributions out of the capital of the Global X Hang Seng ESG ETF.
2692,"The Manager may also, at its discretion, pay distributions out of gross income while all or part of the fees and expenses of the Global X Hang Seng ESG ETF are charged to/paid out of the capital of the Global X Hang Seng ESG ETF, resulting in an increase in distributable income for the payment of dividends by the Global X Hang Seng ESG ETF and therefore, the Global X Hang Seng ESG ETF may effectively pay dividend out of capital."
2693,Payment of dividends out of capital or effectively out of capital amounts to a return or withdrawal of part of an investor’s original investment or from any capital gains attributable to that original investment.
2694,Any distributions involving payment of dividends out of or effectively out of the Global X Hang Seng ESG ETF’s capital may result in an immediate reduction of the Net Asset Value per Unit of the Global X Hang Seng ESG ETF and will reduce the capital available for future investment.
2695,"TERMINATION In addition to the grounds of termination as set out in this Prospectus, the Global X Hang Seng ESG ETF may be terminated if the aggregate Net Asset Value of all Units of the Global X Hang Seng ESG ETF shall be less than HKD50 million."
2696,FEES AND CHARGES Management Fees and Servicing Fees The Global X Hang Seng ESG ETF employs a single management fee structure.
2697,"The Manager will retain the Single Management Fee to pay for the costs, fees and expenses associated with the Global X Hang Seng ESG ETF as detailed in the sub -section titled “Management Fees and Servicing Fee” of the section headed “Fees and Charges” in Part 1 of this Prospectus."
2698,The Single Management Fee is the sum of anticipated charges to the Global X Hang Seng ESG ETF and expressed as a percentage of the Net Asset Value of the Global X Hang Seng ESG ETF.
2699,The current Single Management Fee is at the rate of 0.29% per annum of the Net Asset Value of the Global X Hang Seng ESG ETF accrued daily and calculated as at each Dealing Day and payable monthly in arrears.
2700,"Any costs, fees and expenses associated with the Global X Hang Seng ESG ETF exceeding the Single Management Fee shall be borne by the Manager and shall not be charged to the Global X Hang Seng ESG ETF."
2701,"For the avoidance of doubt, the Single Management Fee does not include (to the extent not included in the operational fees as set out in this Prospectus) any costs, fees and expenses payable by investors on the creation and realisation of units, such as the fees to participating dealers, brokerage fees, transact ion levy, AFRC transaction levy, trading fee and stamp duty, or any extraordinary or exceptional costs and expenses (such as litigation expenses) as may 188 arise from time to time and any tax liabilities in respect of the Global X Hang Seng ESG ETF which will be paid separately out of the assets of the Global X Hang Seng ESG ETF."
2702,The Manager’s servicing fee (if any) will be paid out of the Single Management Fee.
2703,Trustee’s Fee The Trustee’s fee will be paid by the Manager out of the Single Management Fee.
2704,Registrar’s Fee The Registrar’s fee will be paid by the Manager out of the Single Management Fee.
2705,Fees Payable by Participating Dealers The fees payable by Participating Dealers in respect of the Global X Hang Seng ESG ETF are summarised in the table below: Creation of Units Transaction Fee See Note 1.
2706,Service Agent Fee See Note 2.
2707,"Extension Fee HKD10,000 per Application."
2708,See Note 3.
2709,"Application Cancellation Fee HKD10,000 per Application."
2710,See Note 4.
2711,"All other duties and charges incurred by the Trustee or the Manager in connection with the creation As applicable and may include, inter alia, brokerage costs and stamp duty charges."
2712,See Note 5.
2713,Realisation of Units Transaction Fee See Note 1.
2714,Service Agent Fee See Note 2.
2715,"Extension Fee HKD10,000 per Application."
2716,See Note 3.
2717,"Application Cancellation Fee HKD10,000 per Application."
2718,See Note 4.
2719,"All other duties and charges incurred by the Trustee or the Manager in connection with the realisation As applicable and may include, inter alia, brokerage costs and stamp duty charges."
2720,See Note 5.
2721,189 Fees Payable by Retail Investors Dealing in Units on the SEHK The fees payable by retail investors dealing in Units of the Global X Hang Seng ESG ETF on the SEHK are summarised in the table below: Brokerage Market rates Transaction Levy 0.0027%.
2722,See Note 6.
2723,AFRC Transaction Levy 0.00015%.
2724,See Note 7.
2725,Trading Fee 0.00565%.
2726,See Note 8.
2727,Stamp Duty Nil Notes 1.
2728,"A Transaction Fee of HKD7,500 per Application is payable by each Participating Dealer to the Manager for the account and benefit of the Trustee."
2729,"A service agent fee of HKD1,000 is payable by each Participating Dealer to the Service Agent for each book -entry deposit transactio n or book -entry withdrawal transaction."
