sentence_id,text
0,GLOBAL X ETF SERIES (A Hong Kong unit trust authorised under Section 104 of the Securities and Futures Ordinance (Cap.
1,"571) of Hong Kong) Global X MSCI China ETF (Stock Code: 3040) Global X Hang Seng High Dividend Yield ETF (Stock Code: 3110) Global X China Biotech ETF (USD Counter Stock Code: 9820 HKD Counter Stock Code: 2820) Global X China Cloud Computing ETF (USD Counter Stock Code: 9826 HKD Counter Stock Code: 2826) Global X Hang Seng ESG ETF (Stock Code: 3029) Global X Electric Vehicle and Battery Active ETF (Stock Code: 3139) Global X Metaverse Theme Active ETF (Stock Code: 3006) PROSPECTUS 21 March 2023 The Stock Exchange of Hong Kong Limited, Hong Kong Exchanges and Clearing Limited, Hong Kong Securities Clearing Company Limited and the Hong Kong Securities and Futures Commission (the “Commission”) take no responsibility for the contents of thi s prospectus, make n o representation as to its accuracy or completeness and expressly disclaim any liability whatsoever for any loss howsoever arising from or in reliance upon the whole or any part of the contents of this prospectus."
2,The Commission's authorisation is not a recommendation or endorsement of a scheme nor does it guarantee the commercial merits of a scheme or its performance.
3,It does not mean the scheme is suitable for all investors nor is it an endorsement of its suitability for any particular investor or class of investors.
4,"IMPORTANT: If you are in any doubt about the contents of this prospectus, you should consult your stockbroker, bank manager, solicitor, accountant or other financial adviser for independent financial advice."
5,CONTENTS PARTIES I DEFINITIONS X PART 1 – GENERAL INFORMATION RELATING TO THE TRUST 1 THE TRUST 1 INVESTMENT OBJECTIVES AND POLICIES 8 RISK FACTORS .
6,"12 INVESTMENT AND BORROWING RESTRICTIONS 24 CREATION AND REALISATION OF APPLICATION UNITS 35 TRADING OF UNITS ON THE SEHK 44 DETERMINATION OF NET ASSET VALUE 45 SUSPENSION OF DEALING OR DETERMINATION OF NET ASSET VALUE 47 SUSPENSION OF DEALING IN UNITS ON THE SEHK 49 DISTRIBUTION POLICY 50 FEES AND CHARGES 51 TAXATION 57 OTHER IMPORTANT INFORMATION 61 PART 2 – INFORMATION RELATING TO THE INVESTMENT FUNDS 72 APPENDIX 1 – GLOBAL X MSCI CHINA ETF 73 APPENDIX 2 – GLOBAL X HANG SENG HIGH DIVIDEND YIELD ETF 98 APPENDIX 3 – GLOBAL X CHINA BIOTECH ETF 113 APPENDIX 4 – GLOBAL X CHINA CLOUD COMPUTING ETF 147 APPENDIX 5 – GLOBAL X HANG SENG ESG ETF 180 APPENDIX 6 – GLOBAL X ELECTRIC VEHICLE AND BATTERY ACTIVE ETF 202 APPENDIX 7 – GLOBAL X METAVERSE THEME ACTIVE ETF 218 I MAIN\HODONO\37517895_3.docx MAIN\HODONO\37517895_3.docx PARTIES Manager Mirae Asset Global Investments (Hong Kong) Limited Room 1101, 11/F, Lee Garden Three 1 Sunning Road, Causeway Bay Hong Kong Trustee Cititrust Limited 50/F., Champion Tower 3 Garden Road, Central Hong Kong Custodian Citibank, N.A."
7,"50/F., Champion Tower 3 Garden Road, Central Hong Kong Administrator Citibank, N.A., Hong Kong Branch 50/F., Champion Tower 3 Garden Road, Central Hong Kong Auditors PricewaterhouseCoopers 22/F, Prince’s Building Central, Hong Kong Directors of the Manager Cho, Wanyoun Kim, Byung Ha Song, Se Han II MAIN\HODONO\37517895_3.docx MAIN\HODONO\37517895_3.docx III MAIN\HODONO\37517895_3.docx MAIN\HODONO\37517895_3.docx Service Agent HK Conversion Agency Services Limited 8th Floor, Two Exchange Square 8 Connaught Place, Central Hong Kong Registrar Computershare Hong Kong Investor Services Limited# 46/F, Hopewell Centre 183 Queen’s Road East, Wanchai Hong Kong Tricor Investor Services Limited## 54/F, Hopewell Centre 183 Queen’s Road East, Wanchai Hong Kong Market Makers* Please refer to the Appendix of the relevant Investment Fund Participating Dealers* Please refer to the Appendix of the relevant Investment Fund Listing Agent Please refer to the Appendix of the relevant Investment Fund Tax Adviser to the Manager (PRC tax) Ernst & Young (China) Advisory Limited Beijing Branch Office Level 6, Ernst & Young Tower Oriental Plaza No."
8,"1 East Chang An Avenue Dong Cheng District Beijing China 100738 Tax Adviser to the Manager (FATCA) Deloitte Touche Tohmatsu 35/F, One Pacific Place 88 Queensway Hong Kong # In respect of Global X MSCI China ETF, Global X Hang Seng High Dividend Yield ETF, Global X China Biotech ETF and Global X China Cloud Computing ETF only."
9,"## In respect of Global X Hang Seng ESG ETF, Global X Electric Vehicle and Battery Active ETF and Global X Metaverse Theme Active ETF only."
10,* Please refer to the Manager’s website for the latest lists of Market Makers and Participating Dealers.
11,"IV MAIN\HODONO\37517895_3.docx MAIN\HODONO\37517895_3.docx V MAIN\HODONO\37517895_3.docx MAIN\HODONO\37517895_3.docx PRELIMINARY This Prospectus has been prepared in connection with the offer in Hong Kong of Units in the Investment Funds, each being sub-funds of Global X ETF Series (formerly known as Mirae Asset Horizons Exchange Traded Funds Series) (the “ Trust”), an umbrella u nit trust established under Hong Kong law by a trust deed dated 23 December 2010 between Mirae Asset Global Investments (Hong Kong) Limited (the “ Manager”) and Cititrust Limited (the “ Trustee”), as amended, supplemented and/or restated from time to time."
12,"The Manager accepts full responsibility for the accuracy of the information contained in this Prospectus and the Product Key Facts Statement of each Investment Fund and confirm, having made all reasonable enquiries, that to the best of their knowledge and belief, there are no other facts the omission of which would make any statement misleading and that this Prospectus includes particulars given in compliance with the Rules Governing the Listing of Securities on The Stock Exchange of Hong Kong Limited (the “SEHK”), the Code on Unit Trusts and Mutual Funds (the “Code”) and the “Overarching Principles” of the Commission’s Handbook for Unit Trusts and Mutual Funds, Investment-Linked Assurance Schemes and Unlisted Structured Investment Products for the purposes of giving information with regard to the units of the Investment Funds; any inferences that might reasonably be drawn from any statement in the prospectus are true and are not misleading; and all opinions and intents expressed in this Prospectus have been arrived at after due and careful consideration and are founded on bases and assumptions that are fair and reasonable."
13,"The Trustee is not responsible for the preparation of this Prospectus and is therefore not responsible for its contents, apart from descriptions of or relating to Cititrust Limited as the Trustee on page 16 of this Prospectus."
14,"Applicants for Units should consult their financial advisers and take legal advice as appropriate as to whether any governmental or other consents are required, or ot her formalities need to be observed, to enable them to acquire Units and as to whether any taxation effects, foreign exchange restrictions or exchange control requirements are applicable."
15,The Units of Investment Funds are listed on the SEHK.
16,"The Units of Investment Funds have been accepted as eligible securities by Hong Kong Securities Clearing Company Limited (“HKSCC”) for deposit, clearing and settlement in the Central Clearing and Settlement System (“ CCASS”)."
17,Settlement of transactions between participants on the SEHK is required to take place in CCASS on the second CCASS settlement day after the trading day.
18,All activities under CCASS are subject to the General Rules of CCASS and CCASS Operational Procedures in effect from time to time.
19,No action has been taken to permit an offering of Units or the distribution of this Prospectus in any jurisdiction other than Hong Kong where action would be required for such purposes.
20,"Accordingly, this Prospectus may not be used for the purpose of an offer or solicita tion in any jurisdiction or in any circumstances in which such offer or solicitation is not authorised."
21,"Distribution of this Prospectus shall not be permitted unless it is accompanied by a copy of the latest annual financial report of the Trust (where existing) and, if later, its most recent interim financial report, which form a part of this Prospectus."
22,The Trust is not registered as an investment company with the United States Securities and Exchange Commission.
23,"Units have not been, and will not be, regi stered under the United States Securities Act of 1933 or any other United States Federal or State law and accordingly Units are not offered to, and may not be transferred to or acquired by, US persons (including without limitation US citizens and residents as well as business entities organised under United States’ law), except under any relevant exemption."
24,VI MAIN\HODONO\37517895_3.docx MAIN\HODONO\37517895_3.docx VII MAIN\HODONO\37517895_3.docx MAIN\HODONO\37517895_3.docx The Manager shall have the power to impose such restrictions as the Manager may think necessary for the purpose of ensuring that no Units in any Investment Fund are acquired or held by an Unqualified Person (as defined in the “Definitions” section).
25,"Potential applicants for Units in the Investment Funds should inform themselves as to (a) the possible tax consequences, (b) the legal requirements and (c) any foreign exchange restrictions or exchange control requirements which they might encounter under the laws of the countries of their incorporation, citizenship, residence or domicile and which might be relevant to the subscription, holding or disposal of Units in the Investment Funds."
26,Investors should note that any amendment or addendum to this Prospectus will only be posted on the Manager’s website (https://www.globalxetfs.com.hk/)1.
27,1 The contents of this website and any other websites referred to in this Prospectus have not been reviewed by the Commission.
28,"VIII MAIN\HODONO\37517895_3.docx MAIN\HODONO\37517895_3.docx IX MAIN\HODONO\37517895_3.docx MAIN\HODONO\37517895_3.docx X MAIN\HODONO\37517895_3.docx MAIN\HODONO\37517895_3.docx DEFINITIONS In this Prospectus, unless the context requires otherwise, the following expressions have the meanings set out below."
29,"“A-Shares” means shares issued by companies incorporated in the PRC and listed on the Shanghai Stock Exchange or the Shenzhen Stock Exchange, traded in RMB and available for investment by domestic investors and qualified foreign investors via QFII/RQFII."
30,"“Administrator” means Citibank, N.A., Hong Kong Branch, appointed by the Trustee."
31,"“Application” means, in respect of an Investment Fund, a Creation Application or a Realisation Application."
32,"“Application Basket Value” means, in respect of an Investment Fund, the aggregate value of the Securities constituting the Basket, at the Valuation Point in relation to the relevant Valuation Day (unless otherwise stated in this Prospectus)."
33,"“Application Cancellation Fee” means the fee payable by a Participating Dealer in respect of cancellation of an Application as set out in the Trust Deed, the rate of which is set out in the prospectus of the relevant Investment Fund."
34,"“Application Unit” means, in relation to each I nvestment Fund, such number of Units of a class or whole multiples thereof as specified in the prospectus for the relevant Investment Fund or such other multiple of Units of a class from time to time determined by the Manager and the Trustee and notified to the Participating Dealers, either generally or for a particular class or classes of Units."
35,“Auditors” means the auditor or auditors of the Investment Funds and the Trust from time to time appointed by the Manager with the prior approval of the Trustee p ursuant to the provisions of the Trust Deed.
36,“AFRC” means the Accounting and Financial Reporting Council in Hong Kong or its successors.
37,“Base Currency” means the currency of account of an Investment Fund as specified by the Manager with the approval of the Trustee from time to time.
38,"“Basket” means, (i) in respect of an Index Tracking Investment Fund, a portfolio of Index Securities which seeks to benchmark the Underlying Index by replication strategy or otherwise or (ii) in respect of an Investment Fund that is not an Index Tracking Investment Fund, a portfolio of Securities, in each case, determined by the Manager for the relevant Investment Fund at the start of business on the relevant Dealing Day for the purpose of the creation and realisation of Unit s in an Application Unit size, notified on the relevant date by the Manager to the Participating Dealers for the relevant Investment Fund; provided that such portfolio under (i) or (ii) shall comprise only whole numbers of Securities and no fraction or, if the Manager determines, shall comprise only round lots and not odd lots."
39,"“Business Day” in respect of an Investment Fund, means, unless the Manager and the Trustee otherwise agree, a day on which (a) (i) the SEHK is open for normal trading; and (ii) the relevant securities market on which the Index Securities or Securities comprised in the Investment Fund, as the case may be, are traded is open for normal trading; or (iii) if there are more than one (1) such securities markets, the securities market designated by the Manager is open for normal trading, and (b) (where applicable) the Underlying Index is compiled and published, or such other day or days as the Manager and the Trustee may agree from time to time provided that if on any such day, the period during which the relevant securities market is open for normal trading is reduced as a result XI MAIN\HODONO\37517895_3.docx MAIN\HODONO\37517895_3.docx of a Number 8 Typhoon Signal or higher, Black Rainstorm warning or other similar event, such day shall not be a Business Day unless the Manager and the Trustee otherwise agree."
40,XII MAIN\HODONO\37517895_3.docx MAIN\HODONO\37517895_3.docx “Cancellation Compensation” means an amount payable by a Participating Dealer in respect of cancellation of an Application pursuant to the Trust Deed.
41,“Cash Component” means the aggregate Net Asset Value of all the Units in connection with an Application less the Application Basket Value.
42,“CCASS” means the Central Clearing and Settlement System established and operated by HKSCC or any successor system operated by HKSCC or its successors.
43,“CCASS Operational Procedures” means the CCASS Opera tional Procedures as amended from time to time.
44,"“Code” means the Code on Unit Trusts and Mutual Funds issued by the Commission, as may be amended from time to time."
45,“Commission” means the Securities and Futures Commission of Hong Kong or its successors.
46,"“Connected Person” in relation to a company, means: (a) any person or company beneficially owning, directly or indirectly, twenty% (20%) or more of the ordinary share capital of that company or able to exercise, directly or indirectly, twenty% (20%) or more of the total votes in that company; (b) any person or company controlled by a person who or which meets one or both of the descriptions given in (a) above; (c) any member of the group of which that company forms part; or (d) any director or other officer of that company or of any of its Connected Persons as defined in (a), (b) or (c) above; “Creation Application” means an application by a Participating Dealer for the creation of Units of an Investment Fund in Application Unit size (or whole multiples thereof) in acco rdance with the relevant procedures set out in the Trust Deed, and the relevant Participation Agreement."
47,"“CSDCC” means the China Securities Depository and Clearing Co., Ltd."
48,“CSRC” means the China Securities Regulatory Commission.
49,"“Custodian” means Citibank, N.A., appointed by the Trustee."
50,"“Dealing Day” means each Business Day or such other day or days as the Manager may from time to time, with the approval of the Trustee, determine either generally or in respect of a particular class or classes of Units, provided that if any recognised commodities market or recognised securities market on which, in the opinion of the Manager, all or part of (for an Index Tracking Investment Fund) the Index Securities or (for an Investment Fund that is not an Index Tracking Investment Fund) the Securities comprised in the Investment Fund are quoted, listed or dealt in is on any day not open for trading, the Manager may, without notice to the Unitholders of such Investment Fund determine that such day shall not be a Dealing Day in relation to such Investment Fund."
51,"“Dealing Deadline” in relation to any Dealing Day, shall be such time or times as the Manager may from time to time with the approval of the Trustee determine generally or in relation to a particular XIII MAIN\HODONO\37517895_3.docx MAIN\HODONO\37517895_3.docx class or classes of Units or any particular place for submission of Application(s) by a Participating Dealer."
52,"“Deposited Property” means, in respect of each Investment Fund, all the assets (including cash) received or receivable by the Trustee for the time being held or deemed to be held upon the trusts of the Trust Deed for the account of the relevant Investment Fund excluding (i) the Income Property and (ii) any amount for the time being standing to the credit of the Distribution Account (as defined in the Trust Deed)."
53,"“Dual Counter” means the facility by which the Units of an Investment Fund traded in RMB/USD and traded in HKD are each assigned separate stock codes on the SEHK and are accepted for deposit, clearing and settlement in CCASS in more than one eligible c urrency (RMB, USD or HKD) as described in the relevant Appendix of this Prospectus."
54,“entities within the same group” means entities which are included in the same group for the purposes of consolidated financial statements prepared in accordance with inte rnationally recognised accounting standards.
55,“ETF” means an exchange-traded fund.
56,“Extension Fee” means any fee payable by a Participating Dealer in accordance with the Operating Guidelines in connection with an extension of the settlement period to facilitate the making of an Application by such Participating Dealer.
57,“FDIs” means financial derivative instruments.
58,“Government and other Public Securities” has the meaning as set out in the Code.
59,“HKEX” means Hong Kong Exchanges and Clearing Limited or its successors.
60,“HKSCC” means the Hong Kong Securities Clearing Company Limited or its successors.
61,“Hong Kong” means the Hong Kong Special Administrative Region of the People’s Republic of China.
62,"“Hong Kong dollar”, “HKD” or “HK$” mean the lawful curren cy for the time being and from time to time of Hong Kong."
63,"“Income Property” means, in respect of each Investment Fund, (a) all interest, dividends and other sums deemed by the Manager, (after consulting the Auditors either on a general or case by case basis), to be in the nature of income (including taxation repayments, if any) received or receivable by the Trustee in respect of the Deposited Property of the relevant Investment Fund (whether in cash or, without limitation, by warrant, cheque, money, cre dit or otherwise or the proceeds of sale of any Income Property received in a form other than cash); (b) all Cash Component payments received or receivable by the Trustee for the account of the relevant Investment Fund; and (c) all Cancellation Compensation received by the Trustee for the account of the relevant Investment Fund; (d) all interest and other sums received or receivable by the Trustee in respect of (a), (b) or (c) of this definition, but excluding (i) the Deposited Property of the relevant Investment Fund; (ii) any amount for the time being standing to the credit of the Distribution Account (as defined in the Trust Deed) for the account of the relevant Investment Fund or previously distributed to Unitholders; (iii) gains for the account of the relevant Investment Fund arising from the realisation of Securities; and (iv) any sums applied towards payment of the fees, costs and expenses payable by the Trust from the Income Property of the relevant Investment Fund."
64,"XIV MAIN\HODONO\37517895_3.docx MAIN\HODONO\37517895_3.docx XV MAIN\HODONO\37517895_3.docx MAIN\HODONO\37517895_3.docx “Index Provider” means, in respect of each Index Tracking Investment Fund, the person responsible for compiling the Underlying Index against which the relevant Index Tracking Investment Fund benchmarks its investments and who holds the right to licence the use of such Underlying Index to the relevant Index Tracking Investment Fund."
65,"“Index Securities” means, in respect of an Index Tracking Investment Fund, shares of those companies which are at the relevant time the constituent companies of the relevant Underlying Index, any Securities used to track the performance of such shares of the companies constituting the relevant Underlying Index at the relevant time or such other securities designated by the Manager."
66,"“Index Tracking Investment Fund” means an Investment Fund with a principal objective to track, replicate or correspond to a financial index or benchmark, with an aim of providing or achieving investment results or returns that closely match or correspond to the performance of the Underlying Index that it tracks."
67,“Investment Fund” means a segregated pool of assets and liabilities established under the Trust.
68,"“Issue Price” means, in respect of each Investment Fund, the issue price per Unit calculated pursuant to the Trust Deed at which Units are from time to time issued or to be issued."
69,“Korean won” or “KRW” means the lawful currency for the time being and from time to time of South Korea.
70,“KRX” means the Korea Exchange or its successors.
71,“Listing Agent” means such entity appointed by the Manager as the listing agent for the relevant Investment Fund.
72,“Manager” means Mirae Asset Global Investments (Hong Kong) Limited or any other person (or persons) who for the time being is duly appointed as manager (or managers) of the Trust and being approved by the Commission as qualified to act as such for the purposes of the Code.
73,"“Net Asset Value” means the net asset value of an Investment Fund or, as the context may require, of a Unit calculated pursuant to the Trust Deed."
74,"“Operating Guidelines” means in relation to an Investment Fund, the operating guidelines governing the Participating Dealers, including without limitation, the procedures for creation and realisation of Units."
75,"“Participating Dealer” means a broker or dealer who is (or who has appointed an agent or delegate who is) a participant in CCASS and to whose account any Units are for the time being credited by the HKSCC and who has entered into a Participation Agreement in form and substance acceptable to the Manager and the Trustee, and any reference in this Prospectus to the “Participating Dealer” shall include a reference to any agent or delegate so appointed by the Participating Dealer."
76,"“Participation Agreement” means an agreement entered into between, amongst others, the Trustee, the Manager and a Participating Dealer se tting out, amongst other things, the arrangements in respect of the Applications."
77,"References to the Participation Agreement shall, where appropriate, mean the Participation Agreement, read together with the Operating Guidelines."
78,“PBOC” means the People’s Bank of China.
79,"“PRC” means the People’s Republic of China, excluding for the purposes of interpretation of this Prospectus only, Hong Kong, Macau and Taiwan."
80,XVI MAIN\HODONO\37517895_3.docx MAIN\HODONO\37517895_3.docx XVII MAIN\HODONO\37517895_3.docx MAIN\HODONO\37517895_3.docx “PRC Custodian” means Industrial and Commercial Bank of China Limited or such other person (or persons) who for the time being is duly appointed to be the PRC custodian for Investment Funds which invest directly in A-Shares.
81,"“PRC Custody Agreement” means the custodian agreement entered into between the Manager and the PRC Custodian, as amended from time to time."
82,"“PRC Participation Agreement” means the participation agreement entered into between the Trustee, the Manager and the PRC Custodian, as amended from time to time."
83,“Primary Market Investor” means an investor who makes a request to a Partic ipating Dealer to effect an Application on his behalf.
84,"“QFII/RQFII” means a qualified foreign investor which has been approved by CSRC to invest in PRC domestic securities and futures with funds (in foreign currencies and/or offshore Renminbi) overseas or, as the context may require, the QFII/RQFII regime."
85,"“Realisation Application” means, in respect of an Investment Fund, an application by a Participating Dealer for the realisation of Units in Application Unit size (or whole multiples thereof) in accordance with the relevant procedures set out in the Trust Deed and the relevant Participation Agreement."
86,"“Realisation Price” means, in respect of a Unit of an Investment Fund, the Realisation price per Unit of a particular class calculated in accordance with t he Trust Deed at which Units are from time to time realised."
87,“Register” the register of Unitholders to be kept pursuant to the Trust Deed.
88,"“Registrar” means, such person as may from time to time be appointed by the Manager to keep the Register."
89,“reverse repurchase transactions” means transactions whereby an Investment Fund purchases Securities from a counterparty of sale and repurchase transactions and agrees to sell such Securities back at an agreed price in the future.
90,"“RMB” or “Renminbi” means Renminbi Yuan, the lawful currency of the PRC."
