sentence_id,text
1079,Audited accounts in English and Chinese will be available from the Manager’s website at www .
1080,blackrock .
1081,com/hk within four months of the end of each financial year-end and unaudited reports will be available from the same website within two months of the end of the semi-financial year-end .
1082,Hard copies of these financial reports may also be obtained from the Manager free of charge .
1083,Unitholders will be notified of the means of getting access to the financial reports as and when the financial reports are issued and available .
1084,Unitholders will be given at least one month’s prior notice of any change to the mode of delivery of these financial reports .
1085,Trust Deed The Trust was established under Hong Kong law by a trust deed made between the Manager and the Trustee .
1086,"All Unitholders are entitled to the benefit of, are bound by and are deemed to have notice of, the provisions of the Trust Deed ."
1087,The Trust Deed contains provisions for the indemnification of the Trustee and the Manager out of the assets of the Trust and their relief from liability in certain circumstances (summarised above in “Indemnities of the Trustee and Manager”) .
1088,Unitholders and intending applicants are advised to consult the terms of the Trust Deed .
1089,"Modification of Trust Deed The Trustee and the Manager may agree to modify the Trust Deed by supplemental deed provided that in the opinion of the Trustee such modification (i) does not materially prejudice to the interests of Unitholders, does not operate to release to any material extent the Trustee or the Manager from any responsibility to the Unitholders and (with the exception of the costs incurred in connection with the relevant supplemental deed) does not increase the costs and charges payable out of the assets of any Index Fund or (ii) is necessary in order to make possible compliance with any fiscal, statutory or official requirement (whether or not having the force of law) or (iii) is made to correct a manifest error ."
1090,"In all other cases modifications, alterations and additions require the sanction of an extraordinary resolution of the Unitholders affected ."
1091,"Except in respect of amendments sanctioned by extraordinary resolution or necessary for the Trust to comply with relevant legal requirements, the Manager will notify affected Unitholders of amendments as soon as practicable after they are made ."
1092,No such notice will be given if the Trustee is of the opinion that the amendment is not of material significance or is made to correct a manifest error .
1093,"Provision of Information Subject to all applicable laws/regulations and to the extent legally permissible, the Manager or the Trustee may, if requested by a regulatory body or department of any government or administration in any jurisdiction, provide such regulatory body or department in any jurisdiction with any information regarding the Trust Fund, the Unitholders and/or beneficial owners of Units, the investments and income of the Trust Fund and/or the provisions of the Trust Deed ."
1094,Neither the Trustee nor the Manager shall incur any liability to the Unitholders and/or beneficial owners of Units or any of them or to any other person as a result of or in connection with such compliance to the extent the Trustee or the Manager is legally required to do so .
1095,"39 Voting Rights Unitholders’ meetings may be convened by the Manager, by the Trustee or by Unitholders representing one-tenth or more of the current Units in issue ."
1096,"These meetings may be used to modify the terms of the Trust Deed, including increasing the maximum fees payable to the service providers, removing the Trustee or terminating the Trust at any time ."
1097,Such amendments to the Trust Deed must be considered by Unitholders of at least 25% of the Units in issue and passed by a 75% majority of the votes cast .
1098,Unitholders will be given not less than 21 days’ notice of such meeting .
1099,"Termination The Trust may be terminated by the Trustee if: (i) the Manager goes into liquidation or a receiver is appointed and not discharged within 60 days; (ii) in the opinion of the Trustee, the Manager is incapable of performing its duties satisfactorily; (iii) the Manager has failed to perform its duties satisfactorily or has, in the opinion of the Trustee, done something calculated to bring the Trust into disrepute or that is harmful to the interests of Unitholders; (iv) a law is passed that renders it illegal, or in the opinion of the Trustee, impracticable or inadvisable to continue the Trust; (v) the Trustee is unable to find an acceptable person to replace the Manager within 30 days after the removal of the Manager, or the person nominated shall fail to be approved by Extraordinary Resolution; or (vi) 30 days after the Trustee notifies the Manager of its intention to retire, no new person willing to act as trustee has been identified ."
1100,"The Manager may terminate the Trust (or in the case of (iii) any Index Fund) if: (i) after 3 years from the date of the Trust Deed, the aggregate Net Asset Value of all the Units in each Index Fund is less than HK$1 50 million; (ii) any law is passed or amended or regulatory directive or order is imposed which renders it illegal or in the opinion of the Manager, impracticable or inadvisable to continue the Trust; (iii) any law or regulation is passed or amended or any regulatory directive or order is imposed that affects an Index Fund and which renders such Index Fund illegal or in the good faith opinion of the Manager, makes it impracticable or inadvisable to continue such Index Fund; or (iv) within a reasonable time and using commercially reasonable endeavours, the Manager is unable to find a person acceptable to act as the new trustee after deciding to remove the Trustee in accordance with the Trust Deed ."
1101,"The Manager may, in its absolute discretion, by notice in writing to the Trustee, terminate any Index Fund if: (i) after 1 year from the date of the creation of such Index Fund, the Net Asset Value of such Index Fund is less than HK$1 50 million; (ii) at any time the Net Asset Value of such Index Fund is less than the Hong Kong dollar equivalent of US$1 0 million; (iii) its Underlying Index is no longer available for benchmarking or if the Units of the relevant Index Fund are no longer listed on the SEHK or any other Recognised Stock Exchange; (iv) at any time, the Index Fund ceases to have any Participating Dealer; or (v) if, the Manager is unable to implement its investment strategy ."
1102,"In such circumstances, unless the Manager and the Trustee agree that another strategy is: (a) possible, feasible as well as practicable; and (b) in the best interests of the Unitholders, the Units then in issue shall be compulsorily redeemed at the Net Asset Value of the Index Fund ."
1103,"The Manager shall, in such event, notify the SFC in advance in such circumstance and agree with the SFC appropriate methods of notification of Unitholders in the Index Fund prior to such redemption and termination ."
1104,"Further, the Unitholders may at any time authorise termination of the Trust or any Index Fund by extraordinary resolution ."
1105,"Upon the Manager giving notice to the Trustee to terminate the Trust or an Index Fund pursuant to the Trust Deed, where the assets of the relevant Index Fund include Securities that cannot be traded on exchange or otherwise be disposed of, the Manager may, upon consultation with the Trustee, compulsorily redeem at NAV of all the Units then in issue of the relevant Index Fund, following which the relevant Index Fund may be terminated in accordance with the provisions of the Trust Deed ."
1106,"Unless previously terminated as described above or under another provision in the Trust Deed, the Trust shall in any event terminate at the expiry of 80 years from the date of the Trust Deed ."
1107,Notice of any termination of an Index Fund will be given to the Unitholders after the SFC has approved release of the notice .
1108,"The notice will contain the reasons for the termination, the consequences to Unitholders of terminating the Index Fund and the alternatives available to them, and any other information required by the Code ."
1109,"Unless previously terminated, the Trust will terminate on 1 6 November 2081 ."
1110,40 Inspection of Documents Copies of the constitutive documents are available for inspection free of charge at the offices of the Manager and copies thereof may be obtained from the Manager at a cost of HK$1 50 per set .
1111,Part XV of the Securities and Futures Ordinance Part XV of the Securities and Futures Ordinance sets out the Hong Kong disclosure of interests’ regime applicable to Hong Kong listed companies .
1112,The regime does not apply to unit trusts that are listed on the SEHK like the iShares Core Hang Seng Index ETF .
1113,"Consequently, Unitholders are not obliged to disclose their interest in the iShares Core Hang Seng Index ETF ."
1114,"Further, pursuant to section 323(1)(c)(i) of the Securities and Futures Ordinance, Unitholders are not considered to hold an interest in the underlying shares of a Hong Kong listed company held by the iShares Core Hang Seng Index ETF ."
1115,"Anti-Money Laundering Regulations As part of the Manager’s and the Trustee’s responsibility for the prevention of money laundering and to comply with all applicable laws to which the Manager, the Trustee or the Trust is subject, the Manager, the Registrar or the Trustee may require a detailed verification of an investor’s identity and the source of payment of any subscriptions ."
1116,"Depending on the circumstances of each application, a detailed verification might not be required where: • the investor makes the payment from an account held in the investor’s name at a recognised financial institution; or • the application is made through a recognised intermediary ."
1117,These exceptions apply only if the financial institution or intermediary is within a country recognised by the Trustee and the Manager as having sufficient anti-money laundering regulations .
1118,"Liquidity Risk Management At the level of the iShares Core Hang Seng Index ETF and primary market trading in the relevant Units, liquidity risk is the risk that (i) a particular position cannot be easily unwound or offset due to insufficient market depth or market disruption; or (ii) the iShares Core Hang Seng Index ETF’s financial obligations arising from investment activity (such as margin calls) or investor redemptions will not be able to be met ."
1119,"An inability to sell a particular underlying security or portion of the iShares Core Hang Seng Index ETF’s assets may have a negative impact to the value of the iShares Core Hang Seng Index ETF and may have negative implications for investors being able to redeem, on the primary market, in a timely fashion ."
1120,"Additionally, investors who remain invested in an Index Fund may also be adversely affected ."
1121,"The Manager has established a Liquidity Risk Management Policy (the “ LRM Policy ”) which enables it to identify, monitor and manage certain liquidity risks associated with the iShares Core Hang Seng Index ETF ."
1122,"The LRM Policy, combined with the liquidity management tools available and an oversight committee comprising senior representatives of the Manager, seeks to achieve fair treatment of Unitholders and safeguard the interests of remaining Unitholders against the redemption behaviour of other investors from a liquidity perspective ."
1123,"Tools to Manage Liquidity Risk Under the LRM Policy, tools available to the iShares Core Hang Seng Index ETF to manage liquidity risk include some or all of the following: • In respect of any Redemption Application, the Manager may deduct from and set off against any amount payable to a Participating Dealer on the Redemption Value such sum (if any) as the Manager may consider represents an appropriate provision for Duties and Charges ."
1124,• The iShares Core Hang Seng Index ETF may borrow up to 1 0% of its latest available Net Asset Value .
1125,"41 • The Manager may, in consultation with the Trustee, limit the total number of Units of the iShares Core Hang Seng Index ETF which Participating Dealers may redeem on any Dealing Day to 1 0% of the total number of Units then in issue of the iShares Core Hang Seng Index ETF ."
1126,"• In respect of the iShares Core Hang Seng Index ETF, the Manager shall, on receipt of an effective Redemption Application from a Participating Dealer, effect the redemption of the relevant Units in Application Unit size in cash or in-specie (or a combination of both) as determined by the Manager at its discretion ."
1127,"• The Manager, with the approval of the Trustee, may at its discretion extend the settlement period beyond the Settlement Day, such extension to be on such terms and conditions as the Manager may determine but, in any event, not later than one month from the receipt of an effective Redemption Application ."
1128,"• The Manager may, at its discretion, at any time after giving notice to the Trustee (and where practicable, after consultation with Participating Dealers) suspend the right of Unitholders to redeem Units of the iShares Core Hang Seng Index ETF and/or delay the payment of any moneys and transfer of any Securities in respect of any Redemption Application in certain circumstances ."
1129,Please refer to the section “Suspension of Creations and Redemptions” under “Creations and Redemptions (Primary Market)” for further details .
1130,"• The Manager may, after giving notice to the Trustee, declare a suspension of the determination of Net Asset Value of the iShares Core Hang Seng Index ETF in certain circumstances ."
1131,No Units will be issued or redeemed during any period of suspension of the Net Asset Value .
1132,Please refer to the section “Suspension of Net Asset Value” under “Determination of Net Asset Value” for further details .
1133,"• The Manager may, in its absolute discretion, by notice in writing to the Trustee, terminate the iShares Core Hang Seng Index ETF in certain circumstances, including where after 3 years from the date of creation of the iShares Core Hang Seng Index ETF, the Net Asset Value of the iShares Core Hang Seng Index ETF is less than HK$1 50 million ."
1134,"• The Manager may adjust the value of any investment if, having regard to relevant circumstances, the Manager (following consultation with the Trustee) considers that such adjustment is required to fairly reflect the value of the investment ."
1135,Investors should note that there is a risk that the tools available may be ineffective to manage liquidity and redemption risk .
1136,Takeovers Code Unitholders are advised that any shareholding resulting from redemption of Units will normally be subject to the application of the Takeovers Code .
1137,"Furthermore, where a Unitholder holds one million Units or more, while one or more of the companies whose shares constitute Index Shares are subject to the governance of the Takeovers Code (such as during an offer period) and the Unitholder is acting in concert with the relevant parties (such as an offeror or offeree company), the Takeovers Code will be applicable ."
1138,"In these circumstances, a Unitholder should consult a solicitor or financial adviser to ensure compliance with the Takeovers Code ."
1139,"Change of Underlying Index The Manager reserves the right with the prior approval of the SFC and provided that in its opinion the interests of the Unitholders would not be adversely affected, to replace the Underlying Index with another underlying index ."
1140,"The circumstances under which any such replacement might occur include but are not limited to the following events: (a) the Underlying Index ceasing to exist; (b) the licence to use the Underlying Index being terminated; (c) a new index becoming available that supersedes the existing Underlying Index; 42 (d) a new index becoming available that is regarded as the market standard for investors in the particular market and/or would be regarded as more beneficial to the Unitholders than the existing Underlying Index; (e) investing in the Securities comprised within the Underlying Index becomes difficult; (f) the Index Provider increasing its licence fees to a level considered too high by the Manager; (g) the quality (including accuracy and availability of the data) of the Underlying Index having in the opinion of the Manager, deteriorated; (h) a significant modification of the formula or calculation method of the Underlying Index rendering that index unacceptable in the opinion of the Manager; and (i) the instruments and techniques used for efficient portfolio management not being available ."
1141,The Manager may change the name of the iShares Core Hang Seng Index ETF if the Underlying Index changes or for any other reasons including if licence to use the Underlying Index is terminated .
1142,Any change to the Underlying Index and or the name of the iShares Core Hang Seng Index ETF will be notified to investors .
1143,"Information Available on the Internet The Manager will publish important news and information with respect to the iShares Core Hang Seng Index ETF, both in the English and in the Chinese languages, on the Manager’s website at www ."
1144,blackrock .
1145,com/hk including: • This Prospectus and the product key facts statement (as revised from time to time); • Latest annual audited accounts and interim half yearly unaudited report; • Latest closing Net Asset Value (in the iShares Core Hang Seng Index ETF’s Base Currency only) and latest closing NAV per unit (in each of the iShares Core Hang Seng Index ETF’s trading currencies i .
1146,"USD, HKD and RMB); • Near real time estimated Net Asset Value per unit throughout each dealing day (in each of the iShares Core Hang Seng Index ETF’s trading currencies i ."
1147,"USD, HKD and RMB); • Latest closing level of the Underlying Index; • iShares Core Hang Seng Index ETF’s holdings (updated on a daily basis); • The past performance of the iShares Core Hang Seng Index ETF; • Public notices and announcements made by the iShares Core Hang Seng Index ETF; • Latest list of Participating Dealers and link to latest list of market makers; • The tracking difference and tracking error of the iShares Core Hang Seng Index ETF; and • Composition of any distributions paid by the iShares Core Hang Seng Index ETF (i ."
1148,the relative amounts paid out of (i) net distributable income and (ii) capital) since the launch of the iShares Core Hang Seng Index ETF or for the last 12 months (whichever is the shorter period) .
1149,The Manager will publish on its website the constituent securities of the iShares Core Hang Seng Index ETF at such frequency as is permitted by the Index Provider .
1150,"43 For the iShares Core Hang Seng Index ETF, please note that the near real time estimated NAV per Unit (in each of the trading currencies i ."
1151,"USD, HKD and RMB) and the latest closing NAV per Unit in USD and RMB are for reference only ."
1152,The near real time estimated NAV per Unit in USD and RMB does not use a real time exchange rate between the Base Currency (i .
1153,HKD) and each of the trading currencies (i .
1154,USD and RMB) .
1155,It is calculated using the estimated NAV per Unit in HKD multiplied by the WM Reuters 4:00p .
1156,m (London time)* rate for USD and RMB (CNH) respectively for the previous Dealing Day .
1157,The latest closing NAV per Unit in USD and RMB is calculated using the latest closing NAV per Unit in the Base Currency (i .
1158,HKD) multiplied by the WM Reuters 4:00p .
1159,m (London time)* rate for USD and RMB (CNH) respectively for that Dealing Day .
1160,*Please note 4:00p.m (London time) (i) during British Summer Time is equivalent to 1 1:00p.m Hong Kong Time and (ii) otherwise is equivalent to 12:00a.m.
1161,Hong Kong Time All of the information outlined above can be found on the product webpage of the iShares Core Hang Seng Index ETF .
1162,The product webpage of the iShares Core Hang Seng Index ETF can be located by using the search function and inserting the stock codes of the iShares Core Hang Seng Index ETF (i .
1163,"031 1 5, 831 1 5 or 091 1 5) at www ."
1164,blackrock .
1165,com/hk .
1166,This website has not been reviewed by the SFC .
1167,The product webpage also provides a link to the announcements and notices section of the website where public announcements and notices can be found .
1168,"Notices All notices and communications to the Manager and Trustee should be made in writing and sent to the following addresses: Manager Trustee BlackRock Asset Management North Asia Limited 1 6/F Champion Tower 3 Garden Road Central Hong Kong HSBC Institutional Trust Services (Asia) Limited 1 Queen’s Road Central Hong Kong Queries and Complaints Investors may contact the Manager at its address as set out above, or by phone at its telephone number: (852) 3903 2823 or by email: iSharesAsiaEnquiry@blackrock ."
1169,com to seek any clarification regarding the Trust or the iShares Core Hang Seng Index ETF or to file a complaint .
1170,"If a query or complaint is received by phone, the Manager will respond orally ."
1171,"If a query or complaint is received in writing, the Manager will respond in writing ."
1172,Under normal circumstances the Manager will respond to any query or complaint as soon as practicable and in any event within 21 days .
1173,"44 T AxES The following summary of Hong Kong and FATCA is of a general nature, for information purposes only, and is not intended to be an exhaustive list of all of the tax considerations that may be relevant to a decision to purchase, own, redeem or otherwise dispose of Units ."
1174,This summary does not constitute legal or tax advice and does not purport to deal with the tax consequences applicable to all categories of investors .
1175,"Prospective investors should consult their own professional advisers as to the implications of their subscribing for, purchasing, holding, redeeming or disposing of Units both under the laws and practice of Hong Kong, and the laws and practice of their respective jurisdictions ."
1176,The information below is based on the law and practice in force in Hong Kong at the date of this Prospectus .
1177,"The relevant laws, rules and practice relating to tax are subject to change and amendment (and such changes may be made on a retrospective basis) ."
1178,"As such, there can be no guarantee that the summary provided below will continue to be applicable after the date of this Prospectus ."
1179,"Hong Kong The iShares Core Hang Seng Index ETF Profits Tax: As the iShares Core Hang Seng Index ETF has been authorised as a collective investment scheme by the SFC pursuant to section 1 04 of the Securities and Futures Ordinance, profits of the iShares Core Hang Seng Index ETF arising from the sale or disposal of securities, net investment income received by or accruing to the iShares Core Hang Seng Index ETF and other profits of the iShares Core Hang Seng Index ETF are exempt from Hong Kong profits tax ."
1180,"Stamp Duty: Pursuant to a remission order issued by the Secretary for the Treasury on 20 October 1 999, any Hong Kong stamp duty on the transfer of Securities to the iShares Core Hang Seng Index ETF by an investor pursuant to an application in specie will be remitted or refunded ."
1181,"Similarly, Hong Kong stamp duty on the transfer of Securities by the iShares Core Hang Seng Index ETF to an investor upon redemption of Units will also be remitted or refunded ."
1182,No Hong Kong stamp duty is payable by the iShares Core Hang Seng Index ETF on an issue or redemption of Units .
1183,The sale and purchase of Hong Kong stocks by the iShares Core Hang Seng Index ETF will be subject to stamp duty in Hong Kong at the current rate of 0 .
1184,2% of the price of the shares being sold and purchased .
1185,The iShares Core Hang Seng Index ETF will be liable to one half of such Hong Kong stamp duty .
1186,"The Unitholders Profits Tax: Hong Kong profits tax will not be payable by the Unitholder (other than Unitholders carrying on a trade, profession or business of investing in securities in Hong Kong) on any gains or profits made on the sale, redemption or other disposal of the Units and on any distributions made by the iShares Core Hang Seng Index ETF ."
1187,In accordance with the practice of the Inland Revenue Department of Hong Kong (as at the date of this Prospectus) tax should not be payable in Hong Kong in respect of dividends payable to Unitholders .
1188,"Stamp Duty: Pursuant to a remission order issued by the Secretary for the Treasury on 20 October 1 999, any Hong Kong stamp duty on the transfer of Securities to the iShares Core Hang Seng Index ETF by an investor pursuant to an application in specie will be remitted or refunded ."
1189,"Similarly, Hong Kong stamp duty on the transfer of Securities by the iShares Core Hang Seng Index ETF to an investor upon redemption of Units will also be remitted or refunded ."
1190,"Pursuant to the Stamp Duty (Amendment) Ordinance 201 5, with effect from 1 3 February 201 5, no stamp duty is payable on the transfer (purchase or sale) of units of all exchange traded funds on the SEHK ."
1191,No stamp duty is therefore payable on the transfer of Units of the iShares Core Hang Seng Index ETF .
1192,"45 PRC The iShares Core Hang Seng Index ETF Corporate Income Tax: Under the general taxing provision of the PRC Corporate Income Tax Law (“CIT”), which became effective on 1 January 2008, a PRC non-resident enterprise is subject to 1 0% withholding tax on passive income (including dividends, interest, capital gains on disposals of PRC equity interests, etc ."
