sentence_id,text
378,(Hong Kong time) on 23 October 2020; or • 12:15 p.m.
379,(Hong Kong time) on 14 September 2020 if the SEHK opens for normal trading only in the morning of that day but may be postponed by the Manager to no later than 12:15 p.m.
380,(Hong Kong time) on 23 October 2020.
381,"After listing (period commences on the Listing Date)  All investors may start trading Units on the SEHK through any designated brokers; and  Participating Dealersmay apply for creation and redemption (for themselves or for their clients) in the Application Unit size of 150,000 Units (or multiples thereof or such other number of Units above the minimum as determined by the Manager)  Commence at 9:30 a.m."
382,"(Hong Kong time) on 17 September 2020, but may be postponed by the Manager to a date no later than 28 October 2020  In accordance to such times as specified in the Operating Guidelines from time to time."
383,24 Diagrammatic illustration of investment in the iShares Hang Seng TECH ETF The diagrams below illustrate the issue or redemption and the buying or selling of Units: (a) Issue and buying of Units in the primary market – Initial Offer Period and After listing * Clients of the ParticipatingDealers may agree with the ParticipatingDealers settlement in another currency.
384,(b) Redemption and sale of Units in the primary market – After listing * Clients of the Participating Dealers may agree with the ParticipatingDealers settlement in another currency.
385,"CLIENTS OF PARTICIPATING DEALERS PARTICIPATING DEALERS iShares Hang Seng TECH ETF Cash (HKD)* and/or securities Units bought Cash (HKD) and/or securities Units issued PARTICIPATING DEALERS iShares Hang Seng TECH ETF Cash (HKD)* and/or securities Units sold Cash (HKD) and/or securities Units redeemed CLIENTS OF PARTICIPATING DEALERS 25 (c) Buying or selling of Units in the secondary market on the SEHK – After listing Summary of offering methods and related fees Initial Offer Period Method of Offering Minimum Number of Units (or such other number of Units above the minimum as determined by the Manager) Channel Available to Consideration, Fees and Charges* Cash creation (HKD) 150,000 (Application Unit) Through Participating Dealers or through brokers that have an account with the Participating Dealers Any person acceptable to the Participating Dealer as its client Cash (based on the initial issue price and the number of Units applied) *Please refer to the “Fees and Expenses” and “Creations and Redemptions (Primary Market)” sections of this Prospectus for further details."
386,"In-specie creation 150,000 (Application Unit) Through Participating Dealers Any person acceptable to the Participating Dealer as its client Basket(s) of Securities and the difference between the aggregate value of the Securities and the Net USD and HKD traded Units (in board lots of 100 Units) traded on SEHK INVESTOR BUYER Cash (USD and HKD) settled through CCASS INVESTOR SELLER SEHK 26 Asset Value of the Application Unit size *Please refer to the “Fees and Expenses” and “Creations and Redemptions (Primary Market)” sections of this Prospectus for further details."
387,"After Listing Method of Acquisition or Disposal of Units Minimum Number of Units (or such other number of Units above the minimum as determined by the Manager) Channel Available to Consideration, Fees and Charges* Purchase and sale in cash through brokers on the SEHK (secondary market) in USD or HKD Board lot of 100 Units for USD traded Units and HKD traded Units On the SEHK Any investor Market price of Units on SEHK (USD for USD traded Units and HKD for HKD traded Units) *Please refer to the “Fees and Expenses” section of this Prospectus for further details."
388,"Cash creation and cash redemption (HKD) 150,000 (Application Unit) Through Participating Dealers only Any person acceptable to the Participating Dealer as its client Cash based on the Issue Price /Redemption Value and the number of Units applied (payable/ receivable in HKD only unless otherwise agreed) 27 *Please refer to the “Fees and Expenses” and “Creations and Redemptions (Primary Market)” sections of this Prospectus for further details."
389,"In-specie creation and redemption 150,000 (Application Unit) Through Participating Dealers only Any person acceptable to the Participating Dealer as its client Basket(s) of Securities and the difference between the aggregate value of the Securities and the Net Asset Value of the Application Unit size *Please refer to the “Fees and Expenses” and “Creations and Redemptions (Primary Market)” sections of this Prospectus for further details."
390,"28 CREATIONS AND REDEMPTIONS (PRIMARY MARKET) Investment in an Index Fund There are two types of investors in an Index Fund, with two corresponding methods of investment in Units and realisation of an investment in Units."
391,"The first type of investor is a Participating Dealer, being a licensed dealer that has entered into a Participation Agreement in respect of an Index Fund."
392,Only a Participating Dealer can create and redeem Units directly with the Index Fund.
393,A Participating Dealer may create and redeem Units on their own account or for the account of their clients.
394,"The second type of investor is an investor, other than a Participating Dealer, who buys and sells the Units on the SEHK."
395,"This section relates to the first type of investor: Participating Dealers, and should be read in conjunction with the Operating Guidelines and the Trust Deed."
396,The section titled “Exchange Listing and Trading (Secondary Market)” relates to the second type of investor.
397,Creation by Participating Dealers Only Participating Dealers may apply for Units directly from an Index Fund.
398,"Units in an Index Fund are continuously offered to Participating Dealers who may apply for them on any Dealing Day on their own account or for the account of their clients, in the minimum Application Unit size in accordance with Operating Guidelines."
399,"The Manager expects that Participating Dealers will generally accept and submit creation requests received from third parties, subject to normal market conditions and their client acceptance procedures."
400,Participating Dealers may impose fees and charges in handling any creation request which would increase the cost of investment.
401,Investors are advised to check with the Participating Dealers as to relevant fees and charges.
402,"You should note although the Manager has a duty to closely monitor the operations of the Trust, neither the Manager nor the Trustee is empowered to compel any Participating Dealer to disclose its fees agreed with specific clients or other proprietary or confidential information to the Manager, or to accept any such application requests received from third parties."
403,"In addition, neither the Trustee nor the Manager can ensure effective arbitrage by the Participating Dealer."
404,The Application Unit size for an Index Fund is set out under “Description of the iShares Core Hang Seng Index ETF” and “Description of the iShares Hang Seng TECH ETF”.
405,Applications submitted in respect of Units other than in Application Unit size or whole multiples thereof will not be accepted.
406,The minimum holding of an Index Fund is one Application Unit.
407,Creation Applications may be made in specie or in cash.
408,"The Manager shall instruct the Trustee to effect, for the account of the Trust, the creation of Units in Application Unit size in exchange for a transfer of Securities or cash or a combination of Securities and cash in accordance with the Operating Guidelines and the Trust Deed."
409,"Whilst it is open to a Participating Dealer to choose the method of creation, in addition to its rights to reject or cancel a Creation Application under the Trust Deed, the Manager reserves the right to reject or cancel a Creation Application if it is unable to invest the cash proceeds of a cash creation or if proposed Securities are not acceptable to the Manager."
410,"Notwithstanding a Multi-Counter being adopted, all cash Creation Applications must be made in the Base Currency of an Index Fund."
411,"The Manager shall instruct the Trustee to effect, for the account of the Trust, the creation of Units in an Index Fund in Application Unit size in accordance with any of (a), (b) or (c) below (or a combination of any or all of the same) as determined by the Manager in its discretion (note that any payments in cash must be made in the Base Currency): 29 (a) in exchange for a transfer, by the Participating Dealer, to or for the account of the Trustee of Securities constituting an application basket for the relevant Units, a cash amount equivalent to any Duties and Charges payable plus, if the cash component is a positive value, a cash payment equivalent to the amount of the cash component."
412,"If the cash component is a negative value, the Trustee shall be required to make a cash payment equivalent to the amount of the cash component (expressed as a positive figure) to the Participating Dealer."
413,"In the event that the Index Fund has insufficient cash required to pay any cash component payable by the Index Fund, the Manager may effect sales of the deposited property of the Index Fund, or may borrow moneys in accordance with the Trust Deed, to provide the cash required; (b) if permitted by the Manager, in exchange for a cash payment by the Participating Dealer equivalent to the relevant application basket value (which shall be accounted for as deposited property) plus an amount equivalent to any cash component, which the Manager shall use to purchase the Securities comprised in the application basket, provided that the Manager shall be entitled in its discretion to (a) charge (for the account of the Index Fund) to the applicant of any Units for which cash is paid in lieu of delivering any Securities such additional sum as represents the appropriate provision for Duties and Charges and (b) cause to be paid to the Participating Dealer such amount as is determined by the Manager for the purpose of compensating the Participating Dealer up to an amount equal to the positive difference (if any) between the prices used when valuing the Securities of the Index Fund for the purpose of such creation and the purchase prices actually paid or to be paid out of the deposited property in relation to the Index Fund in acquiring such Securities for the Index Fund (after the addition to the relevant purchase prices of any Duties and Charges in respect of such acquisition of Securities); or (c) in exchange for a cash payment by the Participating Dealer equivalent to the Issue Price of the relevant Units plus such sum as the Manager in its discretion considers appropriate for the Duties and Charges, provided that the Manager shall have the right to reject or suspend a Creation Application if (i) in the opinion of the Manager, acceptance of any Security in connection with the Creation Application would have certain adverse tax consequences for the Index Fund; (ii) the Manager reasonably believes that the acceptance of any Security would be unlawful; (iii) the acceptance of any Security would otherwise, in the opinion of the Manager, have an adverse effect on the Index Fund; (iv) circumstances outside control of the Manager make it for all practicable purposes impossible to process the Creation Application; (v) the Manager has suspended the rights of Participating Dealers to redeem Units; or (vi) an insolvency event occurs in respect of the Participating Dealer."
414,"Units will be issued at the Issue Price prevailing on the relevant Dealing Day, provided that the Manager may add to such Issue Price such sum (if any) as represents an appropriate provision for Duties and Charges."
415,"Once the Units are created, the Manager shall effect, for the account of the Trust, the issue of Units to a Participating Dealer in accordance with the Operating Guidelines."
416,Units of an Index Fund are denominated in the Base Currency of the Index Fund and no fractions of a Unit shall be created or issued by the Trustee.
417,"The creation and issue of Units pursuant to a Creation Application shall be effected on the Dealing Day on which the Creation Application is received (or deemed received) and accepted in accordance with the Operating Guidelines but, for valuation purposes only, Units shall be deemed created and issued after the Valuation Point on the Dealing Day on which the relevant Creation Application was received or deemed received and the register will be updated on Settlement Day or the Dealing Day 30 immediately following Settlement Day if the settlement period is extended."
418,(An extension fee may be payable in relation to such an extension.
419,See the section on “Fees and Expenses” for further details).
420,"If a Creation Application is received on a day which is not a Dealing Day or is received after the Dealing Deadline (see “Description of the iShares Core Hang Seng Index ETF” and “Description of the iShares Hang Seng TECH ETF”) on a Dealing Day, that Creation Application shall be treated as having been received at the opening of business on the next following Dealing Day, which shall be the relevant Dealing Day for the purposes of that Creation Application."
421,"No Units shall be issued to any Participating Dealer unless the application is in a form and substance satisfactory to, and accompanied by such documents as may be required by, the Trustee and the Manager in accordance with the Operating Guidelines."
422,The Manager may charge a Transaction Fee in respect of Creation Applications and may on any day vary the rate of the Transaction Fee it charges (but not as between different Participating Dealers in respect of the same Index Fund).
423,"The Manager may, at its discretion, waive the charging of Transaction Fee and any Duties and Charges in respect of certain Creation Applications on any dividend ex-date, where such Creation Applications directly facilitate the partial or full payment of the pending dividend distribution to Unitholders at that time in accordance with the distribution policy."
424,"Such waiver will be offered in respect of Creation Applications on a “first come, first served” basis."
425,The Transaction Fee (if any) shall be paid by or on behalf of the Participating Dealer applying for such Units for the benefit of the Trustee and/or the Service Agent.
426,See the section on “Fees and Expenses” for further details.
427,"Any commission, remuneration or other sum payable by the Manager to any agent or other person in respect of the issue or sale of any Unit shall not be added to the Issue Price of such Unit and shall not be paid from the assets of the Index Fund."
428,"The Trustee shall be entitled to refuse to enter (or allow to be entered) Units in the register if at any time the Trustee is of the opinion that the provisions, in regard to the issue of Units, are being infringed."
429,"Evidence of Unitholding Units will be deposited, cleared and settled by CCASS."
430,"Units are held in registered entry form only, which means that no Unit certificates are issued."
431,HKSCC Nominees Limited is the registered owner (i.e.
432,the sole holder of record) of all outstanding Units deposited with CCASS and is holding such Units for the participants in accordance with the General Rules of CCASS.
433,"Furthermore, the Trustee and the Manager acknowledge that pursuant to the General Rules of CCASS neither HKSCC Nominees Limited nor HKSCC has any proprietary interest in the Units."
434,Investors owning Units in CCASS are beneficial owners as shown on the records of the participating brokers or the relevant Participating Dealer(s) (as the case may be).
435,"Restrictions on Unitholders The Manager has power to impose such restrictions as it may think necessary for the purpose of ensuring that no Units are acquired or held which would result in such holding being:–  a breach of the law or requirements of any country or governmental authority or any stock exchange on which the Units are listed in circumstances which, in the Manager’s opinion, might result in the Trust or the Index Fund being adversely affected which the Trust or the Index Fund might not otherwise have suffered; or 31  in the circumstances which, in the Manager’s opinion, may result in the Trust or the Index Fund incurring any withholding or any tax liability or suffering any other pecuniary disadvantage which the Trust or the Index Fund might not otherwise have incurred or suffered."
436,"Upon notice that any Units are so held, the Manager may require such Unitholders to redeem or transfer such Units in accordance with the provisions of the Trust Deed."
437,A person who becomes aware that he is holding or owning Units in breach of any of the above restrictions is required either to redeem his Units in accordance with the Trust Deed or to transfer his Units to a person whose holding would be permissible under this Prospectus and the Trust Deed in a manner that would result in such Unitholder no longer being in breach of the restrictions above.
438,"Cancellation of Units The Trustee shall cancel Units created and issued in respect of a Creation Application if it has not received good title to all Securities and/or cash (including Duties and Charges) relating to the Creation Application by the Settlement Day, provided that the Manager may at its discretion, with the approval of the Trustee, (a) extend the settlement period (either for the Creation Application as a whole or for a particular Security) such extension to be on such terms and conditions (including as to the payment of collateral and an Extension Fee to the Manager or the Trustee or their Connected Persons or otherwise) as the Manager may determine or (b) partially settle the Creation Application to the extent to which Securities and/or cash has been vested in the Trustee, on such terms and conditions the Manager may determine including terms as to any extension of the settlement period for the outstanding Securities and/or cash."
439,"Upon the cancellation of any Units as provided for above or if a Participating Dealer otherwise withdraws a Creation Application other than in certain circumstances contemplated in the Trust Deed, any Securities and/or cash received by or on behalf of the Trustee in connection with a Creation Application shall be redelivered to the Participating Dealer (without interest) and the relevant Units shall be deemed for all purposes never to have been created and the applicant therefore shall have no right or claim against the Manager or the Trustee in respect of such cancellation provided that:  the Manager may charge the Participating Dealer for the account of the Trustee and/or the Registrar an Application Cancellation Fee; see the section on “Fees and Expenses” for further details;  the Manager may at its discretion require the Participating Dealer to pay to the Trustee for the account of the Index Fund in respect of each Unit so cancelled Cancellation Compensation, being the amount (if any) by which the Issue Price of each such Unit exceeds the Redemption Value which would have applied in relation to each such Unit if a Participating Dealer had, on the date on which such Units are cancelled, made a Redemption Application, plus any charges, expenses and losses incurred by the Index Fund as a result of such cancellation;  the Trustee and/or the Service Agent shall be entitled to the Transaction Fee payable in respect of a Redemption Application; see the section on “Fees and Expenses” for further details; and  no previous valuations of the Index Fund shall be re-opened or invalidated as a result of the cancellation of such Units."
440,32 Redemption of Units Redemption Applications may only be made by a Participating Dealer in respect of an Application Unit size or whole multiple thereof.
441,"Participating Dealer may redeem Units on any Dealing Day in accordance with the Operating Guidelines, by submitting a Redemption Application to the Trustee."
442,The Manager may charge a Transaction Fee in respect of Redemption Applications.
443,The Transaction Fee shall be paid by or on behalf of the Participating Dealer submitting the Redemption Application(s) (and may be set off and deducted against any amount due to the Participating Dealer in respect of such Redemption Application(s)) for the benefit of the Trustee and/or the Service Agent.
444,See the section on “Fees and Expenses” for further details.
445,Investors cannot acquire or redeem Units directly from an Index Fund.
446,Only Participating Dealers may submit redemption applications to the Manager.
447,"The Manager expects that Participating Dealers will generally accept and submit redemption requests received from third parties, subject to normal market conditions and their client acceptance procedures."
448,Participating Dealers may impose fees and charges in handling any redemption request which would increase the cost of investment and or reduce the redemption proceeds.
449,Investors are advised to check with the Participating Dealers as to relevant fees and charges.
450,"You should note although the Manager has a duty to closely monitor the operations of the Trust, neither the Manager nor the Trustee is empowered to compel any Participating Dealer to disclose its fees agreed with specific clients or other proprietary or confidential information to the Manager, or to accept any such application requests received from third parties."
451,"In addition, neither the Trustee nor the Manager can ensure effective arbitrage by the Participating Dealer."
452,"If a Redemption Application is received on a day which is not a Dealing Day or is received after the Dealing Deadline (see the “Description of the iShares Core Hang Seng Index ETF” and “Description of the iShares Hang Seng TECH ETF”) on a Dealing Day, the Redemption Application shall be treated as having been received at the opening of business on the next following Dealing Day."
453,"For the purpose of valuation, the relevant Valuation Point shall be the Valuation Point for the Dealing Day on which the Redemption Application is treated as having been received."
454,"On a redemption, a Participating Dealer shall have transferred to it Securities or cash or a combination of Securities and cash in accordance with the Operating Guidelines."
455,"The Manager shall, on receipt of an effective Redemption Application for an Index Fund from a Participating Dealer, effect the redemption of the relevant Units in Application Unit size in accordance with any of (a), (b) or (c) below (or a combination of any or all of the same) as determined by the Manager in its discretion (note that any payments in cash will be made in the Base Currency):– (a) require the Trustee to transfer to the Participating Dealer, in accordance with the Operating Guidelines, Securities constituting an application basket for the relevant Units plus, if the cash component is a positive value, a cash payment equivalent to the amount of the cash component."
456,"If the cash component is a negative value, the Participating Dealer shall be required to make a cash payment equivalent to the amount of the cash component (expressed as a positive figure) to the Trustee."
457,"The Participating Dealer shall be required to make a cash payment (if any) in respect of any Redemption Application in accordance with the Operating Guidelines; (b) require the Trustee to pay to the Participating Dealer, (i) a cash amount equivalent to the relevant application basket value plus (ii) an amount determined by the Manager for the purpose of compensating the Participating Dealer up to the amount by which the prices used when valuing the Securities of the Index Fund for the purpose of such Redemption Application are less than the sale prices actually received or to be received in selling the Securities for the 33 Index Fund (after the deduction from the relevant sale prices of any Duties and Charges in respect of such disposal of Securities); or (c) require the Trustee to pay to the Participating Dealer a cash amount equivalent to the Redemption Value of the relevant Units minus such sum as the Manager in its discretion considers appropriate for the Duties and Charges."
458,"In the event that the Index Fund has insufficient cash to pay any cash amount payable, the Manager may effect sales of the Deposited Property of the Index Fund, or borrow moneys in accordance with the Trust Deed, to provide the cash required."
459,"To be effective, a Redemption Application must:  be given by a Participating Dealer in accordance with the Operating Guidelines;  specify the number and class of Units which is the subject of the Redemption Application; and  include the certifications required in the Operating Guidelines in respect of redemptions of Units, together with such certifications and opinions of counsel as the Trustee and the Manager may consider necessary to ensure compliance with applicable Securities and other laws in relation to the redemption of Units which are the subject of the Redemption Application."
460,A Redemption Application once given cannot be revoked or withdrawn without the consent of the Manager.
461,The Redemption Value of Units tendered for redemption and cancellation shall be the Net Asset Value per Unit of the Index Fund rounded to the nearest 4 decimal places.
462,The Manager may deduct from the redemption proceeds such sum (if any) as the Manager may consider represents an appropriate provision for Duties and Charges and/or the Transaction Fee.
