sentence_id,text
705,"Although the Units are listed on the SEHK and one or more Market Makers have been appointed in respect of each counter, investors should be aware that there may be no liquid trading market for the Units or that such Market Maker(s) may cease to fulfil that role."
706,"Further, there can be no assurance that Units will experience trading or pricing patterns similar to those of exchange traded funds which are issued by investment companies in other jurisdictions or those traded on the SEHK which are based upon indices other than the Underlying Index."
707,Counterparty to the Executing Broker Risk.
708,"Institutions, such as brokerage firms, banks, and broker-dealers, may enter into transactions with the Trustee in relation to the sale and purchase of assets or Securities."
709,"Bankruptcy, fraud, regulatory sanction or a refusal to complete a transaction at one of these institutions could significantly impair the operational capabilities or the capital position of the Trust or an Index Fund."
710,The Manager intends to attempt to limit each Index Fund’s investment transactions to well-capitalised and established banks and brokerage firms in an effort to mitigate such risks.
711,"There can be no guarantee that transactions between such counterparties will always be completed in the manner contemplated by, and favourable to, an Index Fund."
712,"Furthermore, the Manager is permitted to borrow for the account of an Index Fund in order to carry out its functions under the Trust Deed."
713,Borrowings may be secured by the Securities or other assets of the Index Fund that are pledged to counterparties as collateral.
714,Counterparty to the Custodian Risk.
715,Each Index Fund will be exposed to the credit risk of any custodian or any depository used by the custodian where cash is held by the custodian or other depositaries.
716,"Where the custodial and/ or settlement systems in a market the Index Fund invests in are not fully developed, the assets of the Index Fund may be exposed to custodial risk."
717,"In the event 50 of the liquidation, bankruptcy or insolvency of the custodian or other depositaries, the Index Fund may take a longer time to recover its assets."
718,"In extreme circumstances such as the retroactive application of legislation and fraud or improper registration of title, the Index Fund may even be unable to recover all of its assets."
719,"The costs borne by the Index Fund in investing and holding investments in such market, if applicable, will be generally higher than in organised securities markets."
720,"Further, in the event of the insolvency the custodian or other depositaries, an Index Fund will be treated as a general creditor of the custodian or other depositaries in relation to cash holdings of the Index Fund."
721,An Index Fund’s Securities are however maintained by the custodian or other depositaries in segregated accounts and should be protected in the event of insolvency of the custodian or other depositaries.
722,Indemnity Risk.
723,"Under the Trust Deed, the Trustee and the Manager have the right to be indemnified for any liability or expense incurred by them in performing their respective duties except as a result of their own negligence, fraud, default or breach of duty or trust."
724,Any reliance by the Trustee or the Manager on the right of indemnity would reduce the assets of an Index Fund or the Trust and the value of the Units.
725,Operating Cost Risk.
726,There is no assurance that the performance of an Index Fund will achieve their investment objective.
727,The level of fees and expenses payable by an Index Fund will fluctuate in relation to the Net Asset Value.
728,"Although the amounts of certain ordinary expenses of an Index Fund can be estimated, the growth rate of the Index Fund, and hence its Net Asset Value, cannot be anticipated."
729,"Accordingly, no assurance can be given as to the performance of an Index Fund or the actual level of its expenses."
730,Epidemic and Pandemic Risks.
731,"The impact of epidemics, pandemics or outbreaks of contagious diseases (such as the avian flu, swine flu, African swine fever, Severe Acute Respiratory Syndrome (SARS), Middle East Respiratory Syndrome (MERS), Ebola virus disease and COVID-19) could affect the economies of many nations, individual companies and the market in general in ways that cannot necessarily be foreseen at the present time."
732,"The impact could include wide spread and severe interruption of economic activities, national holidays being extended and personnel being placed in quarantine and/or leave of absence, the closure of transport links for affected regions, and the implementation and enforcement of quarantine and lockdowns of affected regions."
733,"A n effective vaccine may not be discovered in time to protect against such epidemic or pandemic, or to mitigate the impact of the contagious disease."
734,"Such health crisis may exacerbate other pre-existing political, social and economic risks in certain countries."
735,"It is possible that the impact of any such outbreak of a disease will affect certain countries or regions in a more severe manner, relative to other parts of the world."
736,Market Trading Risks Associated with each Index Fund Dependence upon Trading Market for Index Shares.
737,"The existence of a liquid trading market for an Index Fund’s investments will depend on whether there is supply of, and demand for, such investments."
738,There can be no assurance that there will be active trading in any of the Index Fund’s investments (including for example where there is a suspension of trading of the Index Fund’s investments).
739,The price at which the Index Fund’s investments may be purchased or sold by the Index Fund upon any rebalancing activities or otherwise and the net asset value of the Index Fund may be adversely affected if trading markets for the Index Fund’s investments are limited or absent.
740,Absence of Active Market and Liquidity Risks.
741,"Although Units of an Index Fund are listed for trading on the SEHK, there can be no assurance that an active trading market for such Units will develop or be maintained."
742,"In addition, if the underlying Securities which comprise the Index Fund themselves have limited trading markets, or if the spreads are wide, this may adversely affect the price of the Units and the ability of an investor to dispose of its Units at the desired price."
743,"If a Unitholder needs to sell its Units at a time when no active market for them exists, the price it receives for its Units 51 — assuming it is able to sell them — is likely to be lower than the price received if an active market did exist."
744,Liquidity Risk.
745,Liquidity risk exists when particular investments are difficult to purchase or sell.
746,Any investor buying Units in small numbers may not necessarily be able to find other buyers should that investor wish to sell.
747,"To help address this risk, one or more Market Makers have been appointed."
748,"In addition, to the extent an Index Fund invests in illiquid Securities or Securities that become less liquid, such investments may have a negative effect on the returns of the Index Fund because the Index Fund may be unable to sell the illiquid Securities at an advantageous time or price."
749,"Liquid investments may become illiquid or less liquid after purchase by an Index Fund, particularly during periods of market turmoil or economic uncertainty."
750,"Illiquid and relatively less liquid investments may be harder to value, especially in changing markets."
751,"If the Index Fund is forced to sell underlying Securities at reduced prices or under unfavorable conditions to meet redemption requests or for other cash needs, the Index Fund may suffer a loss."
752,Reliance on Market Makers Risk.
753,Investors should note that liquidity in the market for the Units may be adversely affected if there is no Market Maker for any of the counters.
754,It is the Manager’s intention that there will always be at least one Market Maker in respect of the Units traded in each counter and the Manager use its best endeavours to put in place arrangements so that at least one Market Maker for the Units traded in each counter (where there is a Multi-Counter) gives not less than 3 months notice prior to termination of the market making arrangement.
755,There may be less interest by potential Market Makers in making a market in Units denominated or traded in currencies other than HKD.
756,"Furthermore, any disruption to the availability of RMB may adversely affect the capability of Market Makers in providing liquidity for RMB traded Units of the iShares Core Hang Seng Index ETF."
757,It is possible that there is only one Market Maker to a counter of an Index Fund and therefore it may not be practical for the Index Fund to remove the only Market Maker to a counter even if the Market Maker fails to discharge its duties as the sole Market Maker.
758,Reliance on Participating Dealers Risk.
759,The creation and redemption of Units may only be effected through Participating Dealers.
760,A Participating Dealer may charge a fee for providing this service.
761,"Participating Dealers will not be able to create or redeem Units during any period when, amongst other things, dealings on the SEHK are restricted or suspended, settlement or clearing of securities through the CCASS is disrupted or the Underlying Index is not compiled or published."
762,"In addition, Participating Dealers will not be able to create or redeem Units if some other event occurs that impedes the calculation of the NAV of the Index Fund or disposal of the Index Fund’s Securities cannot be effected."
763,"Where a Participating Dealer appoints an agent (who is a CCASS participant) to perform certain CCASS-related functions, if the appointment is terminated and the Participating Dealer fails to appoint an alternative agent, or if the agent ceases to be a CCASS participant, the creation or redemption of Units by such Participating Dealer may also be affected."
764,"Since the number of Participating Dealers at any given time will be limited, and there may even be only one Participating Dealer at any given time, there is a risk that investors may not always be able to create or redeem Units freely."
765,Units May Trade at Prices Other than Net Asset Value Risk.
766,Units of an Index Fund trade on the SEHK at prices above or below the most recent Net Asset Value.
767,"The Net Asset Value per Unit of an Index Fund is calculated at the end of each Business Day and fluctuates with changes in the market value of the Index Fund’s holdings and changes in the exchange rate between the Hong Kong dollar and, where Securities are denominated in another currency, the subject foreign currency."
768,The trading prices of an Index Fund’s Units fluctuate continuously throughout the trading hours based on market supply and demand rather than Net Asset Value.
769,The trading price of an Index Fund’s Units may deviate significantly from Net Asset Value particularly during periods of market volatility.
770,Any of these factors may lead to the Units of an Index Fund trading at a premium or discount to the Net Asset Value in the secondary market.
771,"On the basis that Units can be created and redeemed in Application 52 Unit sizes at Net Asset Value, the Manager believes that large discounts or premiums to Net Asset Value are not likely to be sustained over the long-term."
772,"While the creation/redemption feature is designed to make it likely that an Index Fund’s Units will normally trade at prices close to the Index Fund’s next calculated Net Asset Value, trading prices are not expected to correlate exactly with the Index Fund’s Net Asset Value due to reasons relating to timing as well as market supply and demand factors."
773,"In addition, disruptions to creations and redemptions or the existence of extreme market volatility may result in trading prices that differ significantly from Net Asset Value."
774,"In particular, if an investor purchases Units at a time when the market price is at a premium to Net Asset Value or sells when the market price is at a discount to Net Asset Value, then the investor may sustain losses."
775,Investors Buying at a Premium and Early Termination Risk.
776,An Index Fund may be terminated early under certain circumstances as set out in the section “Termination”.
777,"Upon an Index Fund being terminated, the Trustee will distribute the net cash proceeds (if any) derived from the realisation of the investments comprised in the Index Fund to the Unitholders in accordance with the Trust Deed."
778,Any such amount distributed may be less than the capital invested by the Unitholder.
779,"In that event, a Unitholder may suffer a loss."
780,A Unitholder who purchases Units at a time when the market price is at a premium to Net Asset Value may therefore be unable to recover the premium in the event the Index Fund is terminated.
781,Trading in Secondary Market during Primary Market Trading Suspension Risk.
782,"Units of an Index Fund may trade on the SEHK even when the Index Fund does not accept orders to create or redeem Units (for example, where the Manager in accordance with the Trust Deed has determined that primary market creations and redemptions should be suspended)."
783,"On such days, Units may trade in the secondary market with more significant premiums or discounts than might be experienced on days when the Index Fund accepts creation and redemption orders."
784,Cost of Trading Units Risk.
785,Buying or selling Units on the SEHK involves various types of costs that apply to all Securities transactions.
786,When trading Units through a broker investors will incur a brokerage commission or other charges imposed by the broker.
787,"In addition, investors on the secondary market, will also incur the cost of the trading spread, which is the difference between what investors are willing to pay for the Units (bid price) and the price they are willing to sell Units (ask price)."
788,"Accordingly, investors may pay more than the NAV per Unit when buying Units on the SEHK and may receive less than the NAV per Unit when selling Units on the SEHK."
789,Frequent trading may detract significantly from investment results and an investment in Units may not be advisable particularly for investors who anticipate regularly making small investments.
790,Suspension of Trading Risk.
791,"Investors and potential investors will not be able to buy, nor will investors be able to sell, Units on the SEHK during any period in which trading of the Units is suspended."
792,The SEHK may suspend the trading of Units whenever the SEHK determines that it is appropriate in the interests of a fair and orderly market to protect investors.
793,"The Manager may, in accordance with The Rules Governing the Listing of Securities on the SEHK, request for the trading of Units to be suspended."
794,Any such suspension would depend on the SEHK’s agreement to the suspension.
795,The subscription and redemption of Units may also be suspended if the trading of Units is suspended.
796,Multi-Counter Risks.
797,The Multi-Counter arrangement for exchange traded funds listed on the SEHK is relatively new.
798,"The novelty may bring additional risks for investment in such ETF for example where for some reason there is a settlement failure on an inter-counter transfer if the Units of one counter are delivered to CCASS at the last batch settlement run on a trading day, leaving not enough time to transfer the Units to the other counter for settlement on the same day."
799,"In addition, where there is a suspension of the inter-counter transfer of Units between different counters for any reasons, for example, operational or systems interruption, Unitholders will only be 53 able to trade their Units in the currency of the relevant counter."
800,Accordingly it should be noted that inter-counter transfers may not always be available.
801,"There is a risk that the market price on the SEHK of Units traded in one counter may deviate significantly from the market price on the SEHK of Units traded in another counter due to different factors such as market liquidity, supply or demand in each counter and exchange rate fluctuations."
802,The trading price of Units in each counter is determined by market forces and sowill not be the same as the trading price of Units multiplied by the prevailing rate of foreign exchange.
803,"Accordingly when selling Units or buying Units traded in one counter, an investor may receive less or pay more than the equivalent amount in the currency of another counter if the trade of the relevant Units took place on another counter."
804,There can be no assurance that the price of Units in each counter will be equivalent.
805,Investors without RMB or USD accounts (as applicable) may not be able to buy or sell RMB or USD traded Units (as applicable).
806,"It is possible that some brokers and CCASS participants may not be familiar with and may not be able to (i) buy Units in one counter and to sell Units in the other, (ii) carry out inter-counter transfers of Units, or (iii) trade Units in different counters at the same time."
807,In such a case another broker or CCASS participant may need to be used.
808,"Accordingly investors may only be able to trade their Units in one currency, investors are recommended to check the readiness of their brokers in respect of the Multi-Counter trading and inter-counter transfer and should fully understand the services which the relevant broker is able to provide (as well as any associated fees)."
809,Exchange Rates Movement between the Base Currency and Other Currencies Risk.
810,Investors whose assets and liabilities are predominantly in currencies other than the Base Currency of an Index Fund should take into account the potential risk of loss arising from fluctuations in value between the Base Currency of the Index Fund and the currency of the Units traded.
811,"There is no guarantee that the Base Currency will appreciate in value against any other currency, or that the strength of the Base Currency may not weaken."
812,"Accordingly, it is possible for an investor may enjoy a gain in terms of the Base Currency but suffer a loss when converting funds from the Base Currency back into any other currency."
813,Risks Associated with the Underlying Index The Underlying Index is Subject to Fluctuations Risk.
814,"The performance of the Units should, before expenses, correspond closely with the performance of the Underlying Index."
815,"If the Underlying Index experiences volatility or declines, the price of the Units will vary or decline accordingly."
816,Composition of and Weightings in the Underlying Index May Change Risk.
817,The companies which comprise the Underlying Index are changed by the Index Provider from time to time.
818,The price of the Units may rise or fall as a result of such changes.
819,The composition of the Underlying Index may also change if one of the constituent companies were to delist its shares or if a new eligible company were to list its shares and be added to the Underlying Index.
820,"If this happens, the weighting or composition of the Securities owned by the Index Fund would be changed as considered appropriate by the Manager to achieve the Investment Objective."
821,"Thus, an investment in Units will generally reflect the Underlying Index as its constituents change from time to time, and not necessarily the way it is comprised at the time of an investment in the Units."
822,"However, there can be no guarantee that the Index Fund will, at any given time, accurately reflect the composition of the Underlying Index (refer to “Tracking Error Risk”)."
823,Licence to Use Underlying Index may be Terminated Risk.
824,The Manager is granted a licence by each Index Provider to use the relevant Underlying Index to create each Index Fund based on the Underlying Index and to use certain trade marks and any copyright in the Underlying Index.
825,An Index Fund may not be able to fulfil its objective and may be terminated if the relevant licence agreement is terminated.
826,An Index Fund may also be terminated if the Underlying Index ceases to be compiled or 54 published and there is no replacement Underlying Index using the same or substantially similar formula for the method of calculation as used in calculating the Underlying Index.
827,The Index Provider and the Manager (and its Connected Persons) are independent of one another.
828,Underlying Index Related Risk.
829,"As prescribed by this Prospectus, in order to meet its investment objective, an Index Fund seeks to achieve a return which corresponds generally to the performance, before fees and expenses, of the Underlying Index as published by the Index Provider."
830,"There is no assurance that the Index Provider will compile the Underlying Index accurately, or that the Underlying Index will be determined, composed or calculated accurately."
831,"While the Index Provider does provide descriptions of what the Underlying Index is designed to achieve, the Index Provider does not provide any warranty or accept any liability in relation to the quality, accuracy or completeness of data in respect of their indices, and does not guarantee that the Underlying Index will be in line with its described index methodology."
832,The Manager’s mandate as described in this Prospectus is to manage an Index Fund consistently with the Underlying Index provided to the Manager.
833,"Consequently, the Manager does not provide any warranty or guarantee for Index Provider errors."
834,"Errors in respect of the quality, accuracy and completeness of the data may occur from time to time and may not be identified and corrected for a period of time, particularly where the indices are less commonly used."
835,"Therefore gains, losses or costs associated with Index Provider errors will be borne by the Index Fund and its Unitholders."
836,"For example, during a period where the Underlying Index contains incorrect constituents, the Index Fund tracking such published Underlying Index would have market exposure to such constituents and would be underexposed to the Underlying Index’s other constituents."
837,"As such, errors may result in a negative or positive performance impact to the Index Fund and its Unitholders."
838,Unitholders should understand that any gains from Index Provider errors will be kept by the Index Fund and its Unitholders and any losses resulting from Index Provider errors will be borne by the Index Fund and its Unitholders.
839,"Apart from scheduled rebalances, the Index Provider may carry out additional ad hoc rebalances to the Underlying Index in order, for example, to correct an error in the selection of index constituents."
840,"Where an Underlying Index is rebalanced and the Index Fund in turn rebalances its portfolio to bring it in line with its Underlying Index, any transaction costs and market exposure arising from such portfolio rebalancing will be borne directly by the Index Fund and its Unitholders."
841,"Unscheduled rebalances to the Underlying Index may also expose the Index Fund to tracking error risk, which is the risk that its returns may not track exactly those of the Underlying Index."
842,"Therefore, errors and additional ad hoc rebalances carried out by the Index Provider to the Underlying Index may increase the costs and market exposure risk of the Index Fund."
843,The past performance of the Underlying Index is not a guide to future performance.
844,"The Manager does not guarantee the accuracy or the completeness of the Underlying Index or any data included therein and the Manager shall have no liability for any errors, omissions or interruptions therein."
845,"The Manager makes no warranty, express or implied, to the Unitholders of an Index Fund or to any other person or entity, as to results to be obtained by the Index Fund from the use of the Underlying Index or any data included therein."
846,"Without limiting any of the foregoing, in no event shall the Manager have any liability for any special, punitive, direct, indirect or consequential damages (including lost profits), even if notified of the possibility of such damages."
847,Regulatory Risks Withdrawal of SFC Authorisation Risk.
848,Each Index Fund has been authorised as a collective investment scheme under the Code by the SFC pursuant to section 104 of the Securities and Futures Ordinance.
849,Authorisation by the SFC is not a recommendation or endorsement of an Index Fund nor does it guarantee the commercial merits of the Index Fund or its performance.
850,It does not mean the Index Fund is suitable for all investors nor is it an endorsement of its suitability for any particular investor or class of investors.
851,The SFC reserves the right to withdraw the authorisation of an Index Fund or impose such conditions as it considers appropriate.
852,"Without limiting the foregoing, the SFC 55 may withdraw authorisation where the SFC no longer considers the Underlying Index acceptable."
853,"If the Manager does not wish an Index Fund to continue to be authorised by the SFC, the Manager will give Unitholders at least 3 months’ notice of the intention to seek SFC’s withdrawal of such authorisation."
854,"In addition, any authorisation granted by the SFC may be subject to certain waivers which may be withdrawn or varied by the SFC."
855,"If as a result of such withdrawal or variation of waivers it becomes illegal, impractical or inadvisable to continue the Index Fund, the Index Fund will be terminated."
856,Units May be Delisted from the SEHK Risk.
857,"The SEHK imposes certain requirements for the continued listing of Securities, including the Units, on the SEHK."
