sentence_id,text
1005,"In addition, where an Index Fund invests in any ETF managed by the Manager or its affiliates, neither such Index Fund nor its Unitholders will suffer any increase in the overall total of initial charges, management fee, or any other costs and charges payable to the Manager and/or its affiliate as a result of the investment in such ETF."
1006,"Investment Allocation and Order Priority When executing a transaction in a security on behalf of a client, it can be aggregated and the aggregated transaction fulfilled with multiple trades."
1007,Trades executed with other client orders result in the need to allocate those trades.
1008,The ease with which the Manager can allocate trades to a certain client’s account can be limited by the sizes and prices of those trades relative to the sizes of the clients’ instructed transactions.
1009,A process of allocation can result in a client not receiving the whole benefit of the best priced trade.
1010,"The Manager manages this conflict by following an Investment and Trading Allocation Policy, which is designed to ensure the fair treatment of all clients’ accounts over time."
1011,Side-by-Side Management: Performance fee The Manager manages multiple client accounts with differing fee structures.
1012,There is a risk that such differences lead to inconsistent performances levels across client accounts with similar mandates by incentivising employees to favour accounts delivering performance fees over flat or non-fee accounts.
1013,BlackRock Group companies manage this risk through a commitment to a Code of Business Conduct and Ethics Policy.
1014,"General The Manager and the Trustee may from time to time act as trustee, administrator, registrar, secretary, manager, custodian, investment manager or investment adviser or perform other functions in relation to, or be otherwise involved in or with, other funds and clients which have similar investment objectives to those of the Trust or the Index Funds."
1015,"63 In addition:-  the Manager, its delegate or any Connected Persons may enter into investments for the Trust and may, with the consent of the Trustee and deal with the Trust as principal provided that such transactions are executed at arm’s length and in the best interests of the Unitholders, are executed on the best available terms;  the Trustee, the Manager or the Registrar or any of their Connected Persons may have banking or other financial relationships with any company or party which is the issuer of Securities, financial instruments or investment products held by the Trust;  the Trustee, the Manager or the Registrar or any of their Connected Persons may hold and deal in Units or in investments held by the Trust either for their own account or for the account of their customers; and  the monies of the Trust may be deposited with the Manager, the Trustee or any of their Connected Persons or invested in certificates of deposit or banking instruments issued by any of them."
1016,"The Trustee, the Manager or the Registrar or their Connected Persons may, in the course of business, and in providing services to the Trust, have potential conflicts of interest with the Trust or an Index Fund."
1017,"Each will, at all times, have regard to its obligations to the Trust and to Unitholders and will endeavour to ensure that any such conflicts are resolved fairly."
1018,"Conflicts of interest may arise due to the widespread business operations of the Trustee, the Manager, the Registrar and the Service Agent and their respective holding companies, subsidiaries and affiliates."
1019,"The foregoing parties may effect transactions where those conflicts arise and shall not, subject to the terms of the Trust Deed, be liable to account for any profit, commission or other remuneration arising."
1020,"However, all transactions carried out by or on behalf of the Trust (or an Index Fund) will be on arm’s length terms."
1021,No more than 50% in aggregate of an Index Fund’s transactions in any one financial period shall be carried out with or through a broker or dealer connected to the Manager or any Connected Person of the Manager.
1022,Soft Dollars The Manager and any investment delegate (as well as any of their Connected Persons) will not receive or enter into any soft dollar commissions or arrangements in respect of the management of the Index Funds.
1023,The Manager and any investment delegate (as well as any of their Connected Persons) will not retain any cash rebates from any broker or dealer.
1024,64 STATUTORY AND GENERAL INFORMATION Reports and Accounts The financial year-end of the Trust and the Index Funds is 31 December every year.
1025,Audited financial reports are to be prepared according to International Financial Reporting Standards and half-yearly unaudited financial reports are also to be prepared up to the last Dealing Day in June of each year.
1026,The first audited financial reports will be prepared for the period from the launch date of the iShares Hang Seng TECH ETF up to and including 31 December 2021.
1027,"The reports provide details of the assets of the Trust and the Manager’s statement on transactions during the period under review (including a list of any constituent Securities of the Underlying Index, if any, that each accounts for more than 10% of the weighting of the Underlying Index as at the end of the relevant period and their respective weighting showing any limits adopted by each Index Fund have been complied with)."
1028,The reports shall also provide a comparison of each Index Fund’s performance and the actual Underlying Index performance over the relevant period and such other information as is required under the Code.
1029,Audited financial reports in English and Chinese will be available from the Manager’s website at www.blackrock.com/hk within four months of the end of each financial year-end and unaudited financial reports will be available from the same website within two months of the end of the semi- financial year-end.
1030,Hard copies of these financial reports may also be obtained from the Manager free of charge.
1031,Unitholders will be notified of the means of getting access to the financial reports as and when the financial reports are issued and available.
1032,Unitholders will be given at least one month’s prior notice of any change to the mode of delivery of these financial reports.
1033,Trust Deed The Trust was established under Hong Kong law by a trust deed made between the Manager and the Trustee.
1034,"All Unitholders are entitled to the benefit of, are bound by and are deemed to have notice of, the provisions of the Trust Deed."
1035,The Trust Deed contains provisions for the indemnification of the Trustee and the Manager out of the assets of the Trust and their relief from liability in certain circumstances (summarised above in “Indemnities of the Trustee and Manager”).
1036,Unitholders and intending applicants are advised to consult the terms of the Trust Deed.
1037,"Modification of Trust Deed The Trustee and the Manager may agree to modify the Trust Deed by supplemental deed provided that in the opinion of the Trustee such modification (i) does not materially prejudice to the interests of Unitholders, does not operate to release to any material extent the Trustee or the Manager from any responsibility to the Unitholders and (with the exception of the costs incurred in connection with the relevant supplemental deed) does not increase the costs and charges payable out of the assets of any Index Fund or (ii) is necessary in order to make possible compliance with any fiscal, statutory, regulatory or official requirement (whether or not having the force of law) or (iii) is made to correct a manifest error."
1038,"In all other cases modifications, alterations and additions involving any material changes require the sanction of an extraordinary resolution of the Unitholders affected."
1039,"Except in respect of amendments sanctioned by extraordinary resolution or necessary for the Trust to comply with relevant legal requirements, the Manager will notify affected Unitholders of amendments as soon as practicable after they are made."
1040,No such notice will be given if the Trustee 65 is of the opinion that the amendment is not of material significance or is made to correct a manifest error.
1041,"Provision of Information Subject to all applicable laws/regulations and to the extent legally permissible, the Manager or the Trustee may, if requested by a regulatory body or department of any government or administration in any jurisdiction, provide such regulatory body or department in any jurisdiction with any information regarding the Trust Fund, the Unitholders and/or beneficial owners of Units, the investments and income of the Trust Fund and/or the provisions of the Trust Deed."
1042,Neither the Trustee nor the Manager shall incur any liability to the Unitholders and/or beneficial owners of Units or any of them or to any other person as a result of or in connection with such compliance to the extent the Trustee or the Manager is legally required to do so.
1043,"Voting Rights Unitholders’ meetings may be convened by the Manager, by the Trustee or by Unitholders representing one-tenth or more of the current Units in issue."
1044,"These meetings may be used to modify the terms of the Trust Deed, including increasing the maximum fees payable to the service providers, removing the Trustee or terminating the Trust at any time."
1045,Such amendments to the Trust Deed must be considered by Unitholders of at least 25% of the Units in issue and passed by a 75% majority of the votes cast.
1046,Unitholders will be given not less than 21 days’ notice of such meeting.
1047,"Termination The Trust may be terminated by the Trustee if: (i) the Manager goes into liquidation or a receiver is appointed and not discharged within 60 days; (ii) in the opinion of the Trustee, the Manager is incapable of performing its duties satisfactorily; (iii) the Manager has failed to perform its duties satisfactorily or has, in the opinion of the Trustee, done something calculated to bring the Trust into disrepute or that is harmful to the interests of Unitholders; (iv) a law is passed that renders it illegal, or in the opinion of the Trustee, impracticable or inadvisable to continue the Trust; (v) the Trustee is unable to find an acceptable person to replace the Manager within 30 days after the removal of the Manager, or the person nominated shall fail to be approved by Extraordinary Resolution; or (vi) 30 days after the Trustee notifies the Manager of its intention to retire, no new person willing to act as trustee has been identified."
1048,"The Manager may terminate the Trust (or in the case of (iii) any Index Fund) if: (i) after 3 years from the date of the Trust Deed, the aggregate Net Asset Value of all the Units in each Index Fund is less than HK$150 million; (ii) any law is passed or amended or regulatory directive or order is imposed which renders it illegal or in the opinion of the Manager, impracticable or inadvisable to continue the Trust; (iii) any law or regulation is passed or amended or any regulatory directive or order is imposed that affects an Index Fund and which renders such Index Fund illegal or in the good faith opinion of the Manager, makes it impracticable or inadvisable to continue such Index Fund; or (iv) within a reasonable time and using commercially reasonable endeavours, the Manager is unable to find a person acceptable to act as the new trustee after deciding to remove the Trustee in accordance with the Trust Deed."
1049,"The Manager may, in its absolute discretion, by notice in writing to the Trustee, terminate any Index Fund if: (i) after 1 year from the date of the creation of such Index Fund, the Net Asset Value of such Index Fund is less than HK$150 million; (ii) at any time the Net Asset Value of such Index Fund is less than the Hong Kong dollar equivalent of US$10 million; (iii) its Underlying Index is no longer available for benchmarking or if the Units of the relevant Index Fund are no longer listed on the SEHK or any other Recognised Stock Exchange; (iv) at any time, the Index Fund ceases to have any Participating Dealer; or (v) if, the Manager is unable to implement its investment strategy."
1050,"In such 66 circumstances, unless the Manager and the Trustee agree that another strategy is: (a) possible, feasible as well as practicable; and (b) in the best interests of the Unitholders, the Units then in issue shall be compulsorily redeemed at the Net Asset Value of the Index Fund."
1051,"The Manager shall, in such event, notify the SFC in advance in such circumstance and agree with the SFC appropriate methods of notification of Unitholders in the Index Fund prior to such redemption and termination."
1052,"Further, the Unitholders may at any time authorise termination of the Trust or any Index Fund by extraordinary resolution."
1053,"Upon the Manager giving notice to the Trustee to terminate the Trust or an Index Fund pursuant to the Trust Deed, where the assets of the relevant Index Fund include Securities that cannot be traded on exchange or otherwise be disposed of, the Manager may, upon consultation with the Trustee, compulsorily redeem at NAV of all the Units then in issue of the relevant Index Fund, following which the relevant Index Fund may be terminated in accordance with the provisions of the Trust Deed."
1054,"Unless previously terminated as described above or under another provision in the Trust Deed, the Trust shall in any event terminate at the expiry of 80 years from the date of the Trust Deed."
1055,Notice of any termination of an Index Fund will be given to the Unitholders after the SFC has approved release of the notice.
1056,"The notice will contain the reasons for the termination, the consequences to Unitholders of terminating the Index Fund and the alternatives available to them, and any other information required by the Code."
1057,Any unclaimed proceeds or other monies held by the Trustee under the provisions of the Trust Deed may at the expiration of twelve Months from the date upon which the same became payable be paid into court subject to the right of the Trustee to deduct therefrom any expenses it may incur in making such payment.
1058,"Unless previously terminated, the Trust will terminate on 16 November 2081."
1059,Inspection of Documents Copies of the constitutive documents are available for inspection free of charge at the offices of the Manager and copies thereof may be obtained from the Manager at a cost of HK$150 per set.
1060,Part XV of the Securities and Futures Ordinance Part XV of the Securities and Futures Ordinance sets out the Hong Kong disclosure of interests’ regime applicable to Hong Kong listed companies.
1061,The regime does not apply to unit trusts that are listed on the SEHK like the Index Funds.
1062,"Consequently, Unitholders are not obliged to disclose their interest in an Index Fund."
1063,"Further, pursuant to section 323(1)(c)(i) of the Securities and Futures Ordinance, Unitholders are not considered to hold an interest in the underlying shares of a Hong Kong listed company held by an Index Fund."
1064,"Anti-Money Laundering Regulations As part of the Manager’s and the Trustee’s responsibility for the prevention of money laundering and to comply with all applicable laws to which the Manager, the Trustee or the Trust is subject, the Manager, the Registrar or the Trustee may require a detailed verification of an investor’s identity and the source of payment of any subscriptions."
1065,"Depending on the circumstances of each application, a detailed verification might not be required where:  the investor makes the payment from an account held in the investor’s name at a recognised financial institution; or 67  the application is made through a recognised intermediary."
1066,These exceptions apply only if the financial institution or intermediary is within a country recognised by the Trustee and the Manager as having sufficient anti-money laundering regulations.
1067,"Liquidity Risk Management At the level of an Index Fund and primary market trading in the relevant Units, liquidity risk is the risk that (i) a particular position cannot be easily unwound or offset due to insufficient market depth or market disruption; or (ii) the Index Fund’s financial obligations arising from investment activity (such as margin calls) or investor redemptions will not be able to be met."
1068,"An inability to sell a particular underlying security or portion of the Index Fund’s assets may have a negative impact to the value of the Index Fund and may have negative implications for investors being able to redeem, on the primary market, in a timely fashion."
1069,"Additionally, investors who remain invested in an Index Fund may also be adversely affected."
1070,"The Manager has established a Liquidity Risk Management Policy (the “LRM Policy”) which enables it to identify, monitor and manage certain liquidity risks associated with each Index Fund."
1071,"The LRM Policy, combined with the liquidity management tools available and an oversight committee comprising senior representatives of the Manager, seeks to achieve fair treatment of Unitholders and safeguard the interests of remaining Unitholders against the redemption behaviour of other investors from a liquidity perspective."
1072,"Tools to Manage Liquidity Risk Under the LRM Policy, tools available to an Index Fund to manage liquidity risk include some or all of the following:  In respect of any Redemption Application, the Manager may deduct from and set off against any amount payable to a Participating Dealer on the Redemption Value such sum (if any) as the Manager may consider represents an appropriate provision for Duties and Charges."
1073, The Index Fund may borrow up to 10% of its total Net Asset Value.
1074," The Manager may, in consultation with the Trustee, limit the total number of Units of the Index Fund which Participating Dealers may redeem on any Dealing Day to 10% of the total number of Units then in issue of the Index Fund."
1075," In respect of the Index Fund, the Manager shall, on receipt of an effective Redemption Application from a Participating Dealer, effect the redemption of the relevant Units in Application Unit size in cash or in-specie (or a combination of both) as determined by the Manager at its discretion."
1076," The Manager, with the approval of the Trustee, may at its discretion extend the settlement period beyond the Settlement Day, such extension to be on such terms and conditions as the Manager may determine but, in any event, not later than one month from the receipt of an effective Redemption Application unless the Market(s) in which a substantial portion of investments of the Index Fund is made is subjectto legal or regulatory requirements (such as foreign currency controls) thus rendering the payment of redemption proceeds within the aforesaid time period not practicable."
1077," The Manager may, at its discretion, at any time after consultation with the Trustee(and where practicable, after consultation with Participating Dealers) suspend the right of Unitholders to 68 redeem Units of the Index Fund and/or delay the payment of any moneys and transfer of any Securities in respect of any Redemption Application in certain circumstances."
1078,Please refer to the section “Suspension of Creations and Redemptions” under “Creations and Redemptions (Primary Market)” for further details.
1079," The Manager may, after consultation with the Trustee, declare a suspension of the determination of Net Asset Value of the Index Fund in certain circumstances."
1080,No Units will be issued or redeemed during any period of suspension of the Net Asset Value.
1081,Please refer to the section “Suspension of Net Asset Value” under “Determination of Net Asset Value” for further details.
1082," The Manager may, in its absolute discretion, by notice in writing to the Trustee, terminate the Index Fund in certain circumstances, including where after 1 year from the date of creation of the Index Fund, the Net Asset Value of the Index Fund is less than HK$150 million."
1083," The Manager may adjust the value of any investment or permit some other method of valuation to be used if, having regard to relevant circumstances, the Manager (following consultation with the Trustee) considers that such adjustment is required to fairly reflect the value of the investment."
1084,Investors should note that there is a risk that the tools available may be ineffective to manage liquidity and redemption risk.
1085,Takeovers Code Unitholders are advised that any shareholding resulting from redemption of Units will normally be subject to the Takeovers Code.
1086,"If a Unitholder receives shares of a constituent company of the Index from redemption of Units and the relevant company is under the application of the Takeovers Code at the relevant time (such as during an offer period), the Takeovers Code may be applicable to such Unitholder."
1087,"In these circumstances, the Unitholder should consult a solicitor or financial adviser to ensure compliance with the Takeovers Code."
1088,"Change of Underlying Index The Manager reserves the right with the prior approval of the SFC and provided that in its opinion the interests of the Unitholders would not be adversely affected, to replace the Underlying Index with another underlying index."
1089,"The circumstances under which any such replacement might occur include but are not limited to the following events: (a) the Underlying Index ceasing to exist; (b) the licence to use the Underlying Index being terminated; (c) a new index becoming available that supersedes the existing Underlying Index; (d) a new index becoming available that is regarded as the market standard for investors in the particular market and/or would be regarded as more beneficial to the Unitholders than the existing Underlying Index; (e) investing in the Securities comprised within the Underlying Index becomes difficult; (f) the Index Provider increasing its licence fees to a level considered too high by the Manager; 69 (g) the quality (including accuracy and availability of the data) of the Underlying Index having in the opinion of the Manager, deteriorated; (h) a significant modification of the formula or calculation method of the Underlying Index rendering that index unacceptable in the opinion of the Manager; and (i) the instruments and techniques used for efficient portfolio management not being available."
1090,The Manager may change the name of an Index Fund if the Underlying Index changes or for any other reasons including if licence to use the Underlying Index is terminated.
1091,Any change to the Underlying Index and or the name of an Index Fund will be notified to investors.
1092,"Information Available on the Internet The Manager will publish important news and information with respect to each Index Fund, both in the English and in the Chinese languages, on the Manager’s website at www.blackrock.com/hk including:  This Prospectus and the product key facts statement (as revised from time to time);  Latest annual audited financial report and interim half yearly unaudited financial report;  Last Net Asset Value (in the Index Fund’s Base Currency only) and last NAV per unit (in each of the Index Fund’s trading currencies i.e."
1093,"USD, HKD and RMB for the iShares Core Hang Seng Index ETF; USD and HKD for the iShares Hang Seng TECH ETF);  Near real time indicative Net Asset Value per unit updated every 15 seconds during trading hours on each dealing day (in each of the Index Fund’s trading currencies i.e."
1094,"USD, HKD and RMB for the iShares Core Hang Seng Index ETF; USD and HKD for the iShares Hang Seng TECH ETF);  The Index Fund’s holdings (updated on a daily basis);  Public notices and announcements made by the Index Fund;  Latest list of Participating Dealers and Market Makers;  The past performance of the Index Fund;  The tracking difference and tracking error of the Index Fund; and  Composition of any distributions paid by the Index Fund (i.e."
1095,the relative amounts paid out of (i) net distributable income and (ii) capital) for the last 12 months.
1096,"For the iShares Core Hang Seng Index ETF, please note that the near real time indicative NAV per Unit (in each of the trading currencies i.e."
1097,"USD, HKD and RMB) and the last NAV per Unit in USD and RMB are for reference only."
1098,The near real time indicative NAV per Unit in USD and RMB does not use a real time exchange rate between the Base Currency (i.e.
1099,HKD) and each of the trading currencies (i.e.
1100,USD and RMB).
1101,It is calculated using the indicative NAV per Unit in HKD multiplied by the WM Reuters 4:00p.m (London time)* rate for USD and RMB (CNH) respectively for the previous Dealing Day.
1102,The last NAV per Unit in USD and RMB is calculated using the last NAV per Unit in the Base Currency (i.e.
1103,HKD) multiplied by the WM Reuters 4:00p.m (London time)* rate for USD and RMB (CNH) respectively for that Dealing Day.
1104,"70 For the iShares Hang Seng TECH ETF, please note that the near real time indicative NAV per Unit (in each of the trading currencies i.e."
1105,USD and HKD) and the last NAV per Unit in USD are for reference only.
1106,The near real time indicative NAV per Unit in USD does not use a real time exchange rate between the Base Currency (i.e.
1107,HKD) and USD.
1108,It is calculated using the indicative NAV per Unit in HKD multiplied by the WM Reuters 4:00p.m (London time)* rate for USD for the previous Dealing Day.
1109,The last NAV per Unit in USD is calculated using the last NAV per Unit in the Base Currency (i.e.
