sentence_id,text
646,"The above summary is, by its nature, limited and does not provide a complete description of how the various assets of the iShares Core Hang Seng Index ETF are valued ."
647,Investors are encouraged to review the specific provisions of the Trust Deed in relation to valuation of assets .
648,"20 Suspension of Net Asset Value The Manager may, after giving notice to the Trustee, declare a suspension of the determination of the Net Asset Value of the iShares Core Hang Seng Index ETF for the whole or any part of any period during which: (a) there exists any state of affairs prohibiting the normal disposal of the relevant iShares Core Hang Seng Index ETF’s investments; or (b) there is a breakdown in any of the means normally employed in determining the Net Asset Value of the iShares Core Hang Seng Index ETF or the Net Asset Value per Unit of the iShares Core Hang Seng Index ETF, or when for any other reason the value of any Security or other asset in the iShares Core Hang Seng Index ETF cannot, in the opinion of the Manager, reasonably, promptly and fairly be ascertained; or (c) circumstances exist as a result of which, in the opinion of the Manager, it is not reasonably practicable to realise any Securities held or contracted for the account of the iShares Core Hang Seng Index ETF or it is not possible to do so without seriously prejudicing the interest of Unitholders of the iShares Core Hang Seng Index ETF; or (d) the remittance or repatriation of funds which will or may be involved in the realisation of, or in the payment for, the Securities of the iShares Core Hang Seng Index ETF or the subscription or realisation of Units of the iShares Core Hang Seng Index ETF is delayed or cannot, in the opinion of the Manager, be carried out promptly or at normal rates of exchange; or (e) the right to redeem Units of the relevant class is suspended ."
649,Any suspension shall take effect upon the declaration thereof and thereafter there shall be no determination of the Net Asset Value of the iShares Core Hang Seng Index ETF and the Manager shall be under no obligation to rebalance the iShares Core Hang Seng Index ETF until the suspension is terminated on the earlier of (a) the Manager declaring the suspension at an end and (b) the first Dealing Day on which (i) the condition giving rise to the suspension shall have ceased to exist and (ii) no other condition under which suspension is authorised exists .
650,"The Manager shall notify the SFC and publish a notice of suspension following the suspension, and at least once a month during the suspension, on its website at www ."
651,blackrock .
652,com/hk or in such publications as it decides .
653,No Units will be issued or redeemed during any period of suspension of the Net Asset Value .
654,"Issue Price and Redemption Value The Issue Price of Units of the iShares Core Hang Seng Index ETF, created and issued pursuant to a Creation Application, will be the Net Asset Value of the iShares Core Hang Seng Index ETF divided by the total number of Units of the iShares Core Hang Seng Index ETF in issue rounded to the nearest 4 decimal places ."
655,The Redemption Value of a Unit on a Dealing Day shall be the Net Asset Value of the iShares Core Hang Seng Index ETF divided by the total number of Units in issue for the iShares Core Hang Seng Index ETF rounded to the nearest 4 decimal places .
656,The Issue Price and the Redemption Value for the Units (or the latest Net Asset Value of the Units) will be available on the Manager’s website at www .
657,blackrock .
658,com/hk or published in such publications as the Manager may decide from time to time .
659,Neither the Issue Price nor Redemption Value takes into account Duties and Charges or fees payable by the Participating Dealer .
660,"21 FEES AND ExPENSES There are 3 levels of fees and expenses applicable to investing in the iShares Core Hang Seng Index ETF as set out in the following table, current as at the date of the Prospectus ."
661,"Fees and expenses payable by Participating Dealers on Amount creation and redemption of Units (primary market) Transaction Fee HK$1 5,000 and HK$1,000 per Application 1 Application Cancellation Fee HK$1 0,000 2 per Application Extension Fee HK$1 0,000 3 per Application Partial Delivery Request Fee HK$1 0,000 4 per Application Stamp duty Nil Transaction levy and trading fee Nil Fees and expenses payable by investors on SEHK Amount (secondary market) Brokerage Market rates Transaction levy 0 ."
662,0027% 5 of the trading price Trading fee 0 .
663,005% 6 of the trading price Stamp Duty Nil Inter-counter transfer fee HK$5 per instruction 7 No money should be paid to any intermediary in Hong Kong which is not licensed or registered to carry on Type 1 regulated activity under Part V of the SFO .
664,Fees and expenses payable by the Amount iShares Core Hang Seng Index ETF (see further disclosure below) Management Fee 8 0 .
665,09% p .
666,"of Net Asset Value calculated daily 1 HK$1,000 per book-entry deposit and book-entry withdrawal is payable to the Service Agent."
667,2 An Application Cancellation fee is payable to the Trustee and/or Registrar by the Participating Dealer in respect of either a withdrawn or failed Creation Application or Redemption Application.
668,Cancellation compensation may also be payable pursuant to the terms of the Operating Guidelines.
669,3 An extension fee is payable by the Participating Dealer to the Trustee on each occasion the Manager grants the Participation Dealer’ s request for extended settlement in respect of a Creation or Redemption Application.
670,4 A partial delivery request fee is payable by the Participating Dealer for the benefit of the Trustee or Registrar on each occasion the Manager grants the Participation Dealer’ s request for partial settlement.
671,5 Transaction levy of 0.0027% of the price of the Units payable by the buyer and the seller.
672,"6 Trading fee of 0.005% of the price of the Units, payable by the buyer and the seller."
673,7 HKSCC will charge each CCASS participant a fee of HK$5 per instruction for effecting an inter-counter transfer of Units from one counter to another counter.
674,Investors should check with their brokers regarding any additional fees.
675,8 Accrued daily and payable monthly in arrears.
676,"22 Fees and Expenses Payable by the iShares Core Hang Seng Index ETF The iShares Core Hang Seng Index ETF employs a single management fee structure, with the iShares Core Hang Seng Index ETF paying all of its fees, costs and expenses (and its due proportion of any costs and expenses of the Trust allocated to it) as a single flat fee (the “Management Fee”) ."
677,"Fees and expenses taken into account in determining the iShares Core Hang Seng Index ETF’s Management Fee include, but are not limited to, the Manager’s fee, Trustee’s fees (which includes fees for registrar and custody and administration transaction handling fees), fees and expenses of the auditor, fees of service agents, ordinary legal and out-of-pocket expenses incurred by the Trustee or Manager, and the costs and expenses of licensing indices used in connection with the iShares Core Hang Seng Index ETF ."
678,The Manager reserves the right in its discretion to share part of the Management Fee (that the Manager is entitled to receive as its own fee) with any distributor or sub- distributor of the iShares Core Hang Seng Index ETF .
679,A distributor may re-allocate an amount of any distribution fee to the sub-distributors .
680,"The Management Fee does not include brokerage and transaction costs (including but not limited to fees, charges, commissions or spreads relating to the acquisition or disposal of portfolio assets), stamp duty, taxes and extraordinary items such as litigation expenses ."
681,"The Management Fee is accrued daily, paid monthly in arrears ."
682,The iShares Core Hang Seng Index ETF will not be charged for any promotional expenses including those incurred by any marketing agents and any fees imposed by such marketing agents on their customers investing in the iShares Core Hang Seng Index ETF will not be paid (either in whole or in part) out of the iShares Core Hang Seng Index ETF .
683,"Establishment Costs The cost of establishing the Trust and the iShares Core Hang Seng Index ETF including the preparation of this Prospectus, the costs of seeking and obtaining the listing and all initial legal and printing costs has been borne by the Manager ."
684,"If subsequent Index Funds are launched and incur establishment costs which are specific to them, such expenses may either be allocated to the relevant Index Fund for whose account they were incurred or be paid by the Manager ."
685,"Increase in fees The fees payable to the Manager and the Trustee (which are included in the calculation of the Management Fee) may be increased on 3 months’ notice to Unitholders, subject to the maximum rates set out in the Trust Deed ."
686,23 RISK FACTORS An investment in the Trust carries various risks referred to below.
687,"Each of these risks may affect the Net Asset Value, yield, total return and trading price of the Units."
688,There can be no assurance that the investment objective of the iShares Core Hang Seng Index ETF will be achieved.
689,"Prospective investors should carefully evaluate the merits and risks of an investment in the iShares Core Hang Seng Index ETF in the context of their overall financial circumstances, knowledge and experience as an investor."
690,Investment Risk Market Risk.
691,Past performance is not indicative of future performance .
692,The Net Asset Value of the iShares Core Hang Seng Index ETF will change with changes in the market value of the Securities it holds .
693,The price of Units and the income from them may go down as well as up .
694,"There can be no assurance that the iShares Core Hang Seng Index ETF will achieve its investment objective or that an investor will achieve profits or avoid losses, significant or otherwise ."
695,"The capital return and income of the iShares Core Hang Seng Index ETF is based on the capital appreciation and income on the Securities it holds, less expenses incurred ."
696,The iShares Core Hang Seng Index ETF’s return may fluctuate in response to changes in such capital appreciation or income .
697,"Furthermore, the iShares Core Hang Seng Index ETF may experience volatility and decline in a manner that broadly corresponds with its Underlying Index ."
698,Investors in the iShares Core Hang Seng Index ETF are exposed to the same risks that investors who invest directly in the underlying Securities would face .
699,"These risks include, for example, interest rate risks (risks of falling portfolio values in a rising interest rate market); income risks (risks of falling incomes from a portfolio in a falling interest rate market); and credit risk (risk of a default by the underlying issuer of a Security that forms part of the Underlying Index) ."
700,Asset Class Risk.
701,"Although the Manager is responsible for the continuous supervision of the investment portfolio of the iShares Core Hang Seng Index ETF, the returns from the types of Securities in which the iShares Core Hang Seng Index ETF invests may underperform or outperform returns from other Securities markets or from investment in other assets ."
702,Different types of securities tend to go through cycles of outperformance and underperformance when compared with other general Securities markets .
703,Derivatives Risk.
704,The iShares Core Hang Seng Index ETF may invest in stock index future contracts and other derivatives .
705,Investing in a derivative is not the same as investing directly in an underlying constituent Security which is part of the Underlying Index .
706,A derivative is a form of contract .
707,Under the terms of a derivative contract the iShares Core Hang Seng Index ETF and its counterparty (i .
708,the person(s) with whom the iShares Core Hang Seng Index ETF has made the agreement) agree to make certain payments to the other party under particular circumstances or on the occurrence of particular events specified in the contract .
709,"The value of the derivative depends on, or is derived from, or determined by reference to, the value of an underlying asset such as a Security or an index ."
710,Certain derivatives may give rise to a form of leverage and may expose the iShares Core Hang Seng Index ETF to greater risk and increase its costs .
711,Derivatives may be more sensitive to factors which affect the value of investments .
712,Accordingly derivatives have a high degree of price variability and are subject to occasional rapid and substantial price changes .
713,"As a result, a relatively small price movement in a derivative may result in immediate and substantial loss (or gain) to the iShares Core Hang Seng Index ETF ."
714,"The iShares Core Hang Seng Index ETF’s losses may be greater and potentially equal to the full value of the derivatives, if it invests in derivative instruments than if it invests only in conventional Securities ."
715,"In addition, many derivatives are not traded on exchanges ."
716,This means that it may be difficult for the iShares Core Hang Seng Index ETF to sell its investments in derivatives in order to raise cash and/or to realise a gain or loss or value such derivatives accurately .
717,"The sale and purchase of derivatives, which are not traded on an exchange, are privately negotiated and are generally not subject to central clearing agency guarantees, daily marking-to-market, settlement, and segregation, minimum capital requirements applicable to intermediaries, or regulation by government authorities and it may be difficult to find a willing buyer/seller because there is no regulatory requirement for a market maker to ensure that there is continuous market for such derivatives ."
718,24 Derivatives Counterparty Risk.
719,"As explained in the section on Derivatives Risk, a derivative is a form of contract ."
720,Payments to be made under many derivatives contracts are not made through or guaranteed by a central clearing agency .
721,Accordingly the iShares Core Hang Seng Index ETF which invests in derivatives is exposed to the risk of its counterparty being unwilling or unable to perform its payment (and other) obligations under the contract .
722,"If the counterparty to the derivative is involved in any insolvency event, the value of that derivative may drop substantially or be worth nothing and the iShares Core Hang Seng Index ETF may experience significant delays in obtaining any recovery ."
723,This is because investing in a derivative is not the same as investing directly in an underlying asset which is part of the Underlying Index .
724,Futures Trading Risk.
725,Futures are highly leveraged which means that a relatively small movement in the price of a futures contract may result in a profit or loss which is high in proportion to the amount of funds actually placed as margin and may result in unquantifiable further loss exceeding any margin deposited .
726,Trading in many futures contracts is subject to daily price fluctuation restrictions which prohibit the execution of futures trades on any given day outside a prescribed price range based on the previous day’s closing prices .
727,"This may create liquidity risk, as it may be costly or impossible for the Manager to liquidate a futures position against which the market is moving ."
728,Passive Investments Risks.
729,The iShares Core Hang Seng Index ETF is passively managed .
730,The aim of the iShares Core Hang Seng Index ETF is to track the performance of the Underlying Index .
731,The iShares Core Hang Seng Index ETF does not try to beat or perform better than the Underlying Index .
732,"The iShares Core Hang Seng Index ETF invests (either directly or indirectly) in the Securities included in or representative of its Underlying Index regardless of their investment merit, except to the extent of any representative sampling investment strategy ."
733,The Manager does not attempt to select stocks individually or to take defensive positions in declining markets .
734,Investors should note that the lack of discretion on the part of the Manager to adapt to market changes due to the inherent investment nature of the iShares Core Hang Seng Index ETF will mean that falls in the Underlying Index are expected to result in corresponding falls in the value of the iShares Core Hang Seng Index ETF .
735,Management Risk.
736,"Because there can be no guarantee that the iShares Core Hang Seng Index ETF will fully replicate its Underlying Index and may hold non-index stocks, it is subject to management risk ."
737,"This is the risk that the Manager’s strategy, the implementation of which is subject to a number of constraints, may not produce the intended results ."
738,"In addition, the Manager has absolute discretion to exercise Unitholders’ rights with respect to Securities comprising the iShares Core Hang Seng Index ETF ."
739,There can be no guarantee that the exercise of such discretion will result in the investment objective of the iShares Core Hang Seng Index ETF being achieved .
740,Investors should also note that none of the Unitholders has any voting rights with respect to Securities held by the iShares Core Hang Seng Index ETF .
741,Tracking Error Risk.
742,The Net Asset Value of the iShares Core Hang Seng Index ETF may not have exactly the same net asset value of its Underlying Index .
743,"Factors such as the fees and expenses of the iShares Core Hang Seng Index ETF, the investments of the iShares Core Hang Seng Index ETF not matching exactly the Securities which make up the Underlying Index (e ."
744,"where it uses representative sampling), an inability to rebalance the iShares Core Hang Seng Index ETF’s holdings of Securities in response to changes in the constituents of the Underlying Index, the iShares Core Hang Seng Index ETF holding uninvested cash, differences in timing of the accrual of dividends or interest, tax (including gains or losses and / or withholding), rounding of Security prices, changes to the Underlying Index and regulatory policies may affect the Manager’s ability to achieve close correlation with the Underlying Index ."
745,This may cause the iShares Core Hang Seng Index ETF’s returns to deviate from its Underlying Index .
746,The Manager will monitor and seek to manage such risk in minimising tracking error .
747,There can be no assurance of exact or identical replication at any time of the performance of the Underlying Index .
748,Concentration Risk.
749,"To the extent that the Underlying Index is concentrated in a particular Security, group of Securities, market, industry, group of industries, sectors, asset class or geographical region, the iShares Core Hang Seng Index ETF may be adversely affected by the performance of those Securities ."
750,"It may be subject to price volatility and may be more susceptible to adverse economic, market, political or regulatory event affecting that Security, group of Securities, market, industry, group of industries, sector, asset class or geographical region ."
751,25 Investments Associated with the PRC Risk.
752,The iShares Core Hang Seng Index ETF tracks the Underlying Index and its investments include shares of companies which have substantial business exposure to growth opportunities in the PRC and listed on the SEHK (including H-shares and red chips shares) .
753,"However, investors should be aware that the economy of the PRC differs from the economies of most developed countries in many respects, including with respect to government involvement in its economy, level of development, growth rate and control of foreign exchange ."
754,The regulatory and legal framework for capital markets and companies in the PRC is not well developed when compared with those of developed countries .
755,"By investing in H-shares and red chips shares, the iShares Core Hang Seng Index ETF is subject to the risks of investing in emerging markets generally and the risks specific to the PRC market in particular, which are not typically associated with investing in those of developed countries ."
756,"General risks of investing in emerging markets include but are not limited to: generally less liquid and less efficient securities markets; generally greater price volatility; exchange rate fluctuations and foreign exchange control; less publicly available information about issuers; the imposition of taxes; difficulties in enforcing contracts; less liquidity and smaller market capitalisations; less well regulated markets resulting in more volatile stock prices; different accounting and disclosure standards; governmental interference; higher inflation; social, economic and political uncertainties ."
757,RMB Currency Risk.
758,"Under the Multi-Counter model, Units are traded in RMB (in addition to USD and HKD) ."
759,RMB is currently not freely convertible and is subject to exchange controls and restrictions .
760,Investors in the secondary market who buy and sell Units traded in RMB are also exposed to foreign exchange currency risk arising from the fluctuations between the iShares Core Hang Seng Index ETF’s Base Currency and RMB .
761,The Units in the RMB counter are RMB denominated securities traded on the SEHK and settled in CCASS .
762,Not all stockbrokers or custodians may be ready and able to carry out trading and settlement of the RMB traded Units .
763,The limited availability of RMB outside the PRC may also affect the liquidity and trading price of the RMB traded Units .
764,Taxation in the PRC Risk.
765,The PRC Government has implemented a number of tax reform policies in recent years .
766,There can be no assurance that the current tax laws and regulations will not be revised or amended in the future .
767,Any revision or amendment in tax laws and regulations may affect the after-taxation profit of PRC companies and foreign investors in such companies .
768,Please refer to the section “Taxes – PRC” for further information about PRC taxation .
769,Asia Regional Economic Risks.
770,"Adverse economic developments in Hong Kong or elsewhere in the Asia region, and in particular, the PRC (given the economic inter-dependence between the PRC and Hong Kong and the inclusion of H-share constituents within the Underlying Index), could have a material adverse effect on the financial conditions and results of operations of the constituent companies of the Underlying Index ."
771,"From the latter half of 1997 to the first half of 1998, many Asian countries experienced significant adverse changes in economic conditions ."
772,Hong Kong also suffered adverse economic developments during this period .
773,The outbreak of the Severe Acute Respiratory Syndrome (SARS) in 2003 also had a marked adverse impact on the economy of Hong Kong .
774,The market turmoil triggered by the U .
775,housing crisis in 2007 and 2008 caused a material contraction of the economy of Hong Kong and other countries .
776,The performance of the constituent companies of the Underlying Index may have been and may continue to be adversely affected by these events .
777,Operational Risk.
778,"Trading errors are an intrinsic factor in any complex investment process, and will occur, notwithstanding the execution of due care and special procedures designed to prevent such errors ."
779,"Such trade errors may have adverse consequences (for example, due to an inability to correct effectively such an error when detected) ."
780,The Manager and the iShares Core Hang Seng Index ETF’s service providers may experience disruptions or operating errors that could negatively impact the iShares Core Hang Seng Index ETF .
781,"While service providers are required to have appropriate operational risk management policies and procedures, their methods of operational risk management may differ from the iShares Core Hang Seng Index ETF’s in the setting of priorities, the personnel and resources available or the effectiveness of relevant controls ."
782,"The Manager, through its monitoring and oversight of service providers, seeks to ensure that service providers take appropriate precautions to avoid and mitigate risks that could lead to disruptions and operating errors ."
783,"However, it is not possible for the Manager or the other iShares Core Hang Seng Index ETF service providers to identify all of the operational risks that may affect the iShares Core Hang Seng Index ETF or to develop processes and controls to completely eliminate or mitigate their occurrence or effects ."
784,26 Distributions May Not Be Paid Risk.
785,Whether the iShares Core Hang Seng Index ETF will pay distributions on Units is subject to the Manager’s distribution policy and also depends on distributions declared and paid in respect of the Securities of the Underlying Index .
786,"Distribution payment rates in respect of such Securities will depend on factors beyond the control of the Manager or Trustee including, general economic conditions, and the financial position and distribution policies of the relevant underlying entities ."
787,There can be no assurance that such entities will declare or pay distributions or distributions .
788,Distributions Payable Out of Capital or Effectively Out of Capital Risk.
789,The Manager may at its discretion pay distributions out of the capital of the iShares Core Hang Seng Index ETF .
790,"The Manager may also, at its discretion, pay distribution out of gross income while all or part of the fees and expenses of the iShares Core Hang Seng Index ETF are charged to/paid out of the capital of the iShares Core Hang Seng Index ETF, resulting in an increase in distributable income for the payment of distributions by the iShares Core Hang Seng Index ETF and therefore, the iShares Core Hang Seng Index ETF may effectively pay distribution out of capital ."
