sentence_id,text
0,"The Stock Exchange of Hong Kong Limited, Hong Kong Exchanges and Clearing Limited, Hong Kong Securities Clearing Company Limited and the Hong Kong Securities and Futures Commission take no responsibility for the contents of this Prospectus, make no representation as to its accuracy or completeness and expressly disclaim any liability whatsoever for any loss howsoever arising from or in reliance upon the whole or any part of the contents of this Prospectus."
1,"The iShares Asia Trust, the iShares Core Hang Seng Index ETF and the iShares Hang Seng TECH ETF have been authorised as collective investment schemes by the Hong Kong Securities and Futures Commission."
2,Authorisation by the Securities and Futures Commission is not a recommendation or endorsement of a product nor does it guarantee the commercial merits of a product or its performance.
3,It does not mean the product is suitable for all investors nor is it an endorsement of its suitability for any particular investor or class of investors.
4,"IMPORTANT: Investments involve risks, including the loss of principal."
5,Investors are advised to consider their own investment objectives and circumstances in determining the suitability of an investment in the iShares Core Hang Seng Index ETF or the iShares Hang Seng TECH ETF.
6,An investment in the iShares Core Hang Seng Index ETF or the iShares Hang Seng TECH ETF may not be suitable for everyone.
7,"If you are in any doubt about the contents of this Prospectus, you should consult your stockbroker, bank manager, solicitor, accountant or other financial adviser for independent financial advice."
8,PROSPECTUS iShares Core Hang Seng Index ETF (HKD Counter Stock Code: 03115) (RMB Counter Stock Code: 83115) (USD Counter Stock Code: 09115) iShares Hang Seng TECH ETF (HKD Counter Stock Code: 03067) (USD Counter Stock Code: 09067) iShares Asia Trust A Hong Kong unit trust authorised under Section 104 of the Securities and Futures Ordinance (Cap.
9,"571) of Hong Kong Listing Agent and Manager BlackRock Asset Management North Asia Limited 貝萊德資產管理北亞有限公司 30 October 2020 i IMPORTANT INFORMATION This Prospectus relates to the offer in Hong Kong of Units in the iShares Core Hang Seng Index ETF and the iShares Hang Seng TECH ETF, sub-funds of the iShares Asia Trust (the “Trust”), an umbrella unit trust established under Hong Kong law by a trust deed dated 16 November 2001 between Barclays Global Investors North Asia Limited (now known as BlackRock Asset Management North Asia Limited) (the “Manager”) and HSBC Institutional Trust Services (Asia) Limited (the “Trustee”) as amended from time to time."
10,"The Manager accepts full responsibility for the accuracy of the information contained in this Prospectus and for the accuracy and fairness of the opinions expressed (at the date of its publication), and confirm that this Prospectus includes particulars given in compliance with the Rules Governing the Listing of Securities on The Stock Exchange of Hong Kong Limited (the “SEHK”) and the Code on Unit Trusts and Mutual Funds (the “Code”) and the Overarching Principles of the SFC Handbook for Unit Trusts and Mutual Funds, Investment-Linked Assurance Schemes and Unlisted Investment Products for the purposes of giving information with regard to the Units of the iShares Core Hang Seng Index ETF and the iShares Hang Seng TECH ETF and that having made all reasonable enquiries, the Manager confirms that, to the best of its knowledge and belief that the information contained in this Prospectus is true, accurate and complete in all material respects and not misleading; there are no other matters the omission of which would make any statement in this Prospectus misleading, whether of fact or opinion; any inferences that might reasonably be drawn from any statement in the Prospectus are true and are not misleading; and all opinions and intents expressed in this Prospectus have been arrived at after due and careful consideration and are founded on bases and assumptions that are fair and reasonable."
11,"The Trustee is not responsible for the preparation of this Prospectus and shall not be held liable to any person for any information disclosed in this Prospectus, except for the information regarding the Trustee itself under “Trustee and Registrar”."
12,The iShares Core Hang Seng Index ETF and the iShares Hang Seng TECH ETF are funds falling within Chapter 8.6 of the Code.
13,"The Trust, the iShares Core Hang Seng Index ETF and the iShares Hang Seng TECH ETF are authorised by the Securities and Futures Commission (the “SFC”) in Hong Kong pursuant to section 104 of the Securities and Futures Ordinance."
14,"The SFC takes no responsibility for the financial soundness of the iShares Core Hang Seng Index ETF and the iShares Hang Seng TECH ETF, or for the correctness of any statements made or opinions expressed in this Prospectus."
15,"Authorisation by the SFC is not a recommendation or endorsement of the Trust, the iShares Core Hang Seng Index ETF or the iShares Hang Seng TECH ETF nor does it guarantee the commercial merits of the iShares Core Hang Seng Index ETF or the iShares Hang Seng TECH ETF or their performance."
16,It does not mean the iShares Core Hang Seng Index ETF or the iShares Hang Seng TECH ETF is suitable for all investors nor is it an endorsement of its suitability for any particular investor or class of investors.
17,"Applicants for Units shall undertake to the Manager and the Trustee that, to the best of their knowledge, the monies used to invest in Units in the iShares Core Hang Seng Index ETF or the iShares Hang Seng TECH ETF are not sourced from mainland China."
18,"Applicants for Units should consult their financial adviser, tax advisers and take legal advice as appropriate as to whether any governmental or other consents are required, or other formalities need to be observed, to enable them to acquire Units as to whether any taxation effects, foreign exchange restrictions or exchange control requirements are applicable and to determine whether any investment in the iShares Core Hang Seng Index ETF or the iShares Hang Seng TECH ETF is appropriate for them."
19,Dealings in the Units in the iShares Core Hang Seng Index ETF on the SEHK commenced on 23 November 2016.
20,"Units in the iShares Core Hang Seng Index ETF have been accepted as eligible ii securities by the Hong Kong Securities Clearing Company Limited (“HKSCC”) for deposit, clearing and settlement in the Central Clearing and Settlement System (“CCASS”) with effect from 23 November 2016."
21,"Application has been made to the Listing Committee of the SEHK for the listing of, and permission to deal in the Units of the iShares Hang Seng TECH ETF."
22,"Subject to compliance with the admission requirements of HKSCC, the Units of the iShares Hang Seng TECH ETF will be accepted as eligible securities by HKSCC for deposit, clearing and settlement in the CCASS with effect from the date of commencement of dealings in the Units on the SEHK or such other date as may be determined by HKSCC."
23,Settlement of transactions between participants of the SEHK is required to take place in CCASS on the second CCASS settlement day after any trading day.
24,All activities under CCASS are subject to the General Rules of CCASS and CCASS Operational Procedures in effect from time to time.
25,Further applications may be made to list units in additional Index Funds constituted under the Trust in future on the SEHK.
26,"No action has been taken to permit an offering of Units of the iShares Core Hang Seng Index ETF or the iShares Hang Seng TECH ETF or the distribution of this Prospectus in any jurisdiction other than Hong Kong and, accordingly, the Prospectus does not constitute an offer or solicitation to anyone in any jurisdiction in which such offer is not authorised or to any person to whom it is unlawful to make such offer or solicitation."
27,"Furthermore, distribution of this Prospectus shall not be permitted unless it is accompanied by a copy of the latest annual financial report of the iShares Core Hang Seng Index ETF and the iShares Hang Seng TECH ETF (where existing) and, if later, its most recent interim financial report, which form a part of this Prospectus."
28,"In particular: (a) Units in the iShares Core Hang Seng Index ETF and the iShares Hang Seng TECH ETF have not been registered under the United States Securities Act of 1933 (as amended) and except in a transaction which does not violate such Act, may not be directly or indirectly offered or sold in the United States of America or any of its territories or for the benefit of a US Person (as defined in Regulation S of such Act); (b) The iShares Core Hang Seng Index ETF and the iShares Hang Seng TECH ETF have not been and will not be registered under the United States Investment Company Act of 1940, as amended."
29,"Accordingly, Units may not, except pursuant to an exemption from, or in a transaction not subject to, the regulatory requirements of the US Investment Company Act of 1940 be acquired by a person who is deemed to be a US Person under the 1940 Act and regulations; (c) Units may not, except pursuant to a relevant exemption, be acquired or owned by, or acquired with the assets of an ERISA Plan."
30,"An ERISA Plan is defined as (i) any retirement plan subject to Title I of the United States Employee Retirement Income Securities Act of 1974, as amended; or, (ii) any individual retirement account or plan subject to Section 4975 of the United States Internal Revenue Code of 1986, as amended."
31,"Where the Manager becomes aware that the Units are directly or indirectly beneficially owned by any person in breach of the above restrictions, the Manager may give notice to such person requiring him to transfer such Units to a person who would not thereby be in contravention of such restrictions or to request in writing the redemption of such Units in accordance with the trust deed."
32,"iii Investors should note that any amendment, addendum or replacement to this Prospectus will only be posted on the Manager’s website (www.blackrock.com/hk)."
33,Investors should refer to “Information Available on the Internet” for more details.
34,"iShares® and BlackRock® are registered trademarks of BlackRock, Inc., or its subsidiaries (collectively “BlackRock”) in the United States and elsewhere."
35,"All other trademarks, servicemarks or registered trademarks are the property of their respective owners."
36,"©2020 BlackRock, Inc."
37,All rights reserved.
38,"iv DIRECTORY MANAGER BLACKROCK ASSET MANAGEMENT NORTH ASIA LIMITED 16/F CHAMPION TOWER 3 GARDEN ROAD CENTRAL HONG KONG DIRECTORS OF THE MANAGER BELINDA BOA GERALDINE BUCKINGHAM SUSAN WAI-LAN CHAN GRAHAM DOUGLAS TURL TRUSTEE, REGISTRAR AND CUSTODIAN HSBC INSTITUTIONAL TRUST SERVICES (ASIA) LIMITED 1 QUEEN’S ROAD CENTRAL HONG KONG SERVICE AGENT HK CONVERSION AGENCY SERVICES LIMITED 8/F, TWO EXCHANGE SQUARE 8 CONNAUGHT PLACE CENTRAL HONG KONG AUDITORS PRICEWATERHOUSECOOPERS 22ND FLOOR PRINCE’S BUILDING CENTRAL HONG KONG LISTING AGENT BLACKROCK ASSET MANAGEMNT NORTH ASIA LIMITED 16/F CHAMPION TOWER 3 GARDEN ROAD CENTRAL HONG KONG LEGAL ADVISER TO THE MANAGER SIMMONS & SIMMONS 30TH FLOOR, ONE TAIKOO PLACE 979 KING’S ROAD HONG KONG i TABLE OF CONTENTS INTRODUCTION 1 The Trust and the Index Funds 1 Investment Objective 1 Investment Strategy 2 Leverage 3 Investment and Borrowing Restrictions 3 Cross-trades 3 DESCRIPTION OF THE ISHARES CORE HANG SENG INDEX ETF 4 Key Information 4 Investment Objective 5 Investment Strategy 5 Investment and borrowing restrictions 6 Underlying Index 6 Index Methodology 6 Distribution Policy 10 Further Information 10 DESCRIPTION OF THE ISHARES HANG SENG TECH ETF 11 Key Information 11 Investment Objective 12 Investment Strategy 12 Investment and borrowing restrictions 13 Underlying Index 13 Index Methodology 14 Distribution Policy 18 Specific Risks .18 ii Further Information 20 OFFERING PHASES (iShares Hang Seng TECH ETF only) 21 Initial Offer Period 21 After Listing 21 Timetable 22 CREATIONS AND REDEMPTIONS (PRIMARY MARKET) 28 Investment in an Index Fund 28 Creation by Participating Dealers 28 Redemption of Units 32 Redemption Gate 35 Directed Cash Dealing 35 Suspension of Creations and Redemptions 35 Transfer of Units 36 Multi-Counter 37 EXCHANGE LISTING AND TRADING (SECONDARY MARKET) 38 DETERMINATION OF NET ASSET VALUE 41 Suspension of Net Asset Value 42 Issue Price and Redemption Value .42 FEES AND EXPENSES 43 Fees and Expenses Payable by an Index Fund 44 RISK FACTORS 46 Investment Risk 46 Market Trading Risks Associated with each Index Fund .50 Risks Associated with the Underlying Index 53 Regulatory Risks 54 MANAGEMENT OF THE TRUST 57 The Manager 57 iii Trustee and Registrar 58 Indemnities of the Trustee and Manager 59 Service Agent .60 Auditor60 Conflicts of Interest 60 Soft Dollars 63 STATUTORY AND GENERAL INFORMATION 64 Reports and Accounts 64 Trust Deed 64 Modification of Trust Deed 64 Provision of Information 65 Voting Rights 65 Termination 65 Inspection of Documents 66 Part XV of the Securities and Futures Ordinance 66 Anti-Money Laundering Regulations 66 Liquidity Risk Management 67 Takeovers Code 68 Change of Underlying Index 68 Information Available on the Internet 69 Notices 70 Queries and Complaints 70 TAXES 71 DEFINITIONS 76 SCHEDULE 1 81 PART A – INVESTMENT AND BORROWING RESTRICTIONS APPLICABLE TO EACH INDEX FUND 81 iv PART B – ADDITIONAL INVESTMENT AND BORROWING RESTRICTIONS APPLICABLE TO THE iSHARES CORE HANG SENG INDEX ETF 88 1 INTRODUCTION The information contained in this Prospectus has been prepared to assist potential investors in making an informed decision in relation to investing in the iShares Core Hang Seng Index ETF and/or the iShares Hang Seng TECH ETF."
39,"It contains important facts about the Trust as a whole, the iShares Core Hang Seng Index ETF and the iShares Hang Seng TECH ETF offered in accordance with this Prospectus."
40,"The Trust and the Index Funds The Trust is an umbrella unit trust created by a trust deed (the “Trust Deed”) dated 16 November 2001, as amended, made under Hong Kong law between Barclays Global Investors North Asia Limited (now known as BlackRock Asset Management North Asia Limited) (the “Manager”) and HSBC Institutional Trust Services (Asia) Limited (the “Trustee”)."
41,The Trust may issue different classes of units and the Trustee shall establish a separate pool of assets within the Trust (each such separate pool of assets an “Index Fund”) for each class of units.
42,The assets of an Index Fund will be invested and administered separately from the other assets of the Trust.
43,The Manager reserves the right to establish other Index Funds and to issue further classes of Units in the future.
44,"This Prospectus relates to the following Index Funds, each of which is an exchange traded fund (or “ETF”) authorised by the SFC: 1."
45,iShares Core Hang Seng Index ETF; and 2.
46,iShares Hang Seng TECH ETF.
47,ETFs are funds that are designed to track an index.
48,The Units of the Index Funds to which this Prospectus relates are listed on the SEHK and trade like any other equity security listed on the SEHK.
49,Only Participating Dealers may create or redeem Units directly from the Index Funds at Net Asset Value who are under no obligation to accept instructions to create or redeem Units on behalf of retail investors.
50,All other investors may only purchase and sell Units in the Index Funds on the SEHK.
51,PRICES FOR EACH INDEX FUND ON THE SEHK ARE BASED ON SECONDARY MARKET TRADING FACTORS AND MAY DEVIATE SIGNIFICANTLY FROM THE NET ASSET VALUE OF THE INDEX FUND.
52,"Investment Objective The investment objective of each Index Fund is to provide investment results that, before fees and expenses, closely correspond to the performance of the Underlying Index."
53,"An index is a group of Securities which an Index Provider selects as representative of a market, market segment or specific industry sector."
54,The Index Provider is independent of the Manager (and its connected persons) and determines the relative weightings of the Securities in the index and publishes information regarding the market value of the index.
55,There can be no assurance that an Index Fund will achieve its investment objective.
56,The Underlying Index of an Index Fund may be changed by prior approval of the SFC and notice to Unitholders in accordance with the provisions of the Trust Deed.
57,2 Investment Strategy The Manager uses a passive or indexing approach to try to achieve each Index Fund’s investment objective.
58,"The investment objective of an Index Fund is to provide investment results that, before fees and expenses, closely correspond to the performance of the Underlying Index."
59,The Manager does not try to beat or perform better than the Underlying Index.
60,Each Index Fund aims to invest at least 90% of its assets in achieving the investment objective.
61,"An Index Fund will invest, either directly or indirectly, in Securities included in the Underlying Index."
62,"An Index Fund may also invest in other investments including futures contracts, index futures contracts, options on futures contracts and options related to the Underlying Index, local currency and forward currency exchange contracts, and cash and cash equivalents for both non-hedging purposes and hedging purposes, which the Manager believes will help the Index Fund achieve its investment objective."
63,An Index Fund may invest in FDIs for non-hedging purposes subject to the limit that the Index Fund’s net derivative exposure does not exceed 50% of the Index Fund’s total Net Asset Value.
64,The investment strategy of each Index Fund is subject to the investment and borrowing restrictions set out in Schedule 1.
65,"In managing an Index Fund, the Manager may use either a representative sampling investment strategy or a full replication investment strategy as described below."
66,"Potential investors should note that the Manager may swap between the two strategies, without prior notice to Unitholders, in its absolute discretion as often as it believes appropriate in order to achieve the investment objective of the Index Fund."
67,"Representative Sampling Investment Strategy “Representative sampling” is an indexing strategy that involves investing, directly or indirectly, in a representative sample of the Securities included in the relevant Underlying Index that collectively has an investment profile that reflects the profile of the relevant Underlying Index."
68,"An Index Fund adopting a representative sampling investment strategy may or may not hold all of the Securities that are included in the relevant Underlying Index, and may hold Securities which are not included in the Underlying Index, provided that the sample closely reflects the overall characteristics of the Underlying Index."
69,"For each Index Fund, the Manager intends to adopt a representative sampling investment strategy by investing in a portfolio of Securities featuring high correlation with the Underlying Index, such that as far as possible and practicable the portfolio will consist of the component Securities of the Underlying Index."
70,"An Index Fund may from time to time hold Securities that are not included in the Underlying Index in circumstances which are independent of the Manager, including where trading in a constituent Security has been suspended, such holding results from a corporate action of a constituent Security, or the portfolio is being rebalanced in anticipation or response to a rebalance of the Underlying Index."
71,"Full Replication Investment Strategy Full “replication” is an indexing strategy that involves investing in substantially all of the Securities in the Underlying Index, either directly or indirectly, in substantially the same proportions as those Securities have in the Underlying Index."
72,"Correlation 3 An index is a theoretical financial calculation based on the performance of particular components that make up the index, whereas an Index Fund is an actual investment portfolio."
73,"The performance of an Index Fund and its Underlying Index may be different due to transaction costs, asset valuations, corporate actions (such as mergers and spin-offs), timing variances and differences between an Index Fund’s portfolio and the Underlying Index."
74,These differences may result for example from legal restrictions affecting the ability of the Index Fund to purchase or dispose of Securities or the employment of a representative sampling investment strategy.
75,The use of a representative sampling investment strategy can be expected to result in greater tracking error than a full replication investment strategy.
76,The consequences of “tracking error” are described in more detail in “Risk Factors”.
77,Leverage The net derivative exposure of each Index Fund may be up to 50% of its respective Net Asset Value.
78,Investment and Borrowing Restrictions Each Index Fund must comply with the investment and borrowing restrictions applicable to the Index Fund and summarised in Schedule 1 of this Prospectus (which includes a summary of the investment restrictions set out in the Trust Deed).
79,"Cross-trades Cross-trades between an Index Fund and other funds managed by the Manager or its affiliates may be undertaken where the Manager considers that, as part of its portfolio management, such cross- trades would be in the best interests of the Unitholders to achieve the investment objective and policy of the Index Fund."
80,"By conducting cross-trades, the Manager may achieve trading efficiencies and savings for the benefit of the Unitholders."
81,"In conducting transactions, the Manager will ensure that the trades are executed on arm’s length terms at current market value and the reason for such trades shall be documented prior to execution, in accordance with the SFC’s Fund Manager Code of Conduct."
82,"4 DESCRIPTION OF THE ISHARES CORE HANG SENG INDEX ETF Key Information The following table is a summary of key information in respect of the iShares Core Hang Seng Index ETF, and should be read in conjunction with the full text of the Prospectus."
83,"Underlying Index Index: Hang Seng Index (net total return version) Launch Date: 25 February 2009 Number of constituents: 50 stocks (as at 31 March 2020) Total Market Capitalisation (Free Float): HKD 15,676.30 billion (as at 31 March 2020) Base Currency: HK dollars (HKD) Type of Underlying Index The Underlying Index is a net total return index, meaning that the performance of the index is calculated on the basis that dividends net of tax are reinvested."
84,The Underlying Index is denominated in HKD.
85,"Listing Date (SEHK) 23 November 2016 Exchange Listing SEHK – Main Board Stock Code 09115 – USD counter 03115 – HKD counter 83115 – RMB counter Stock Short Names ISHARESHSI-U – USD counter ISHARESHSI – HKD counter ISHARESHSI-R – RMB counter ISIN Numbers HK0000313442 – USD counter HK0000313426 – HKD counter HK0000313434 – RMB counter Trading Board Lot Size 100 Units (for each counter) Base Currency Hong Kong dollars (HKD) Trading Currencies US dollars (USD) – USD counter Hong Kong dollars (HKD) – HKD counter Renminbi (RMB) – RMB counter Distribution Policy Semi-annually, at the Manager’s discretion (usually in May/June and November/December each year) (if any)."
86,Distributions may be made out of capital or effectively out of capital as well as income at the Manager’s discretion.
87,"All Units will receive distributions in the Base Currency (HKD) only.* Application Unit size (only Participating Dealers) Minimum 50,000 Units (or multiples thereof) Creation/Redemption Deadline For cash creations/redemptions (in HKD only), 2:00 p.m."
88,(Hong Kong time).
89,For in-specie creations/redemptions: 5 (i) 4:00 p.m.
90,(Hong Kong time) if it is a full trading day on the SEHK or if the SEHK is opens for normal trading in the afternoon of the relevant Dealing Day; or (ii) 12:15p.m.
91,(Hong Kong time) if the SEHK opens for normal trading only in the morning of the relevant Dealing Day.
92,Management Fee 0.09% p.a.
93,of Net Asset Value calculated daily Investment strategy Representative sampling investment strategy (Refer to the Introduction above and the “Investment Strategy” section below) Financial year end 31 December Website www.blackrock.com/hk * Unitholders of the iShares Core Hang Seng Index ETF should note that all Units will receive distributions in the Base Currency (HKD) only.
94,"As such, the Unitholder may have to bear the fees and charges associated with the conversion of such distributions from HKD to USD, RMB or any other currency."
95,Unitholders are advised to check with their brokers for arrangements concerning distributions.
96,"Investment Objective The investment objective of the iShares Core Hang Seng Index ETF is to provide investment results that, before fees and expenses, closely correspond to the performance of its Underlying Index, Hang Seng Index."
97,There can be no assurance that the iShares Core Hang Seng Index ETF will achieve its investment objective.
98,Investment Strategy The iShares Core Hang Seng Index ETF is a passively managed fund.
99,"To achieve its investment objective, the investment strategy of the iShares Core Hang Seng Index ETF is to use a representative sampling investment strategy and invest in a portfolio of Securities featuring high correlation with the Underlying Index, such that as far as possible and practicable the portfolio will consist of the component Securities of the Underlying Index."
100,The iShares Core Hang Seng Index ETF will invest primarily in Securities included in the Underlying Index.
