sentence_id,text
757,Unitholders should take advice from their own professional advisers as to their particular tax position.
758,Distributions by the Trust/Sub -Funds should generally not be subject to Hong Kong profits tax in the hands of the Unitholders according to the practice of the Inland Revenue Department of Hong Kong (as at the date of this Prospectus).
759,Stamp duty Hong Kong stamp duty is payable on the transfer of Hong Kong stock.
760,“Hong Kong stock” is defined as “stock” the transfer of which is required to be registered in Hong Kong.
761,The Units fall within the definition of “Hong Kong stock”.
762,"Under a remission order issued by the Secretary for the Treasury on 20 October 1999, no Hong Kong stamp duty is payable on an issue or redemption of Units."
763,Stamp duty payable in respect of any transfer in the shares or units of an exchange traded fund (as defined in Part 1 to Schedule 8 of the Stamp Duty Ordinance) on the SEHK is not payable.
764,Accordingly transfers of Units do not attract stamp duty and no stamp duty is payable by Unitholders on any transfer.
765,FATCA and compliance with US withholding requirements The US Hiring Incentives to Restore Employment Act (the “HIRE Act”) was signed into US law in March 2010 and includes provisions commonly referred to as the “Foreign Account Tax Compliance Act” or “FATCA”.
766,"Broadl y, the FATCA provisions are set out in sections 1471 to 1474 of the US Internal Revenue Code of 1986, as amended (the “Revenue Code”), which impose 63 a new reporting regime on foreign financial institutions such as the Trust and each Sub-Fund with respect to certain payments including interest and dividends from securities of US issuers and gross proceeds from the sale of such securities."
767,"All such payments may be subject to withholding at a rate of 30%, unless the recipient of the payment satisfies certain requirements intended to enable the IRS to identify United States persons (within the meaning of the Revenue Code) (“US persons”) with interests in such payment."
768,"To avoid such withholding on payments made to it, foreign financial institutions (including banks, brokers, custodians and investment funds) (an “FFI”), such as the Trust and each Sub-Fund will be required to enter into an agreement (an “FFI Agreement”) with the IRS to be treated as a participating FFI."
769,Participating FFIs are required to identify all investors that are US persons and report certain information concerning such US persons to the IRS.
770,The FFI Agreement will also generally require that a participating FFI deduct and withhold 30% from certain payments made by the participating FFI to investors who fail to cooperate with certain information requests made by the participating FFI or do not consent to FATCA reporting and disclosure to the IRS (referred to as “recalcitrant account holders”) and may be required to close accounts of such account holders.
771,"Moreover, participating FFIs are required to deduct and withhold such payments made to investors that are themselves FFIs but are not compliant with FATCA."
772,"FATCA withholding applies to (i) payments of US source income, including US source d ividends and interest, made after 30 June 2014; and (ii) payments of gross proceeds of sale or other disposal of property that can produce US source interest or dividend income after 31 December 2016."
773,The 30% withholding could also apply to payments otherw ise attributable to US source income (also known as “foreign passthru payments”) from 1 January 2017 at the earliest .
774,Withholding agents (which includes participating FFIs) will generally be required to begin withholding withholdable payments made after 3 0 June 2014.
775,The first reporting deadline for FFIs that have entered into the FFI Agreement will be 1 5 March 2015 with respect to information relating to the 2014 calendar year.
776,The United States and a number of other jurisdictions have entered into intergovernmental agreements (“IGAs”).
777,The United States Department of the Treasury and Hong Kong enter ed into an intergovernmental agreement on 13 November 2014 (the “Hong Kong IGA”) based on the Model 2 format (“Model 2 IGA”).
778,The Model 2 IGA modifies the foregoing requirements but generally requires similar information to be disclosed to the IRS.
779,"Under the Hong Kong IGA, an FFI (including the Trust and the Sub -Funds) will not be required to impose FATCA withholding at 30% on payments to recalcitrant accou nt holders or close the accounts of such account holders (provided information regarding such account holders is reported to the IRS as required)."
780,Withholding may apply to withholdable payments covered by FATCA if the Trust and each Sub-Fund cannot satisf y the applicable requirements and is determined to be non -FATCA compliant or if the Hong Kong government is found in breach of the terms of the agreed IGA.
781,The Trust has been registered with the IRS as a rep orting single FFI with Global Intermediary Identification Number HUAGU5.99999.SL.344.
782,"In order to protect Unitholders and avoid being subject to withholding under FATCA, it is the Manager’s intention to endeavour to satisfy the requirements imposed under FATCA."
783,"Hence it is possible that this may requi re the Trust and each Sub -Fund (through its agents or service providers) as far as legally permitted, to report information on the holdings or investment returns of any Unitholder to the IRS or the local authorities pursuant to the terms of the IGA (as the case may be) , including certain Unitholders who fail to provide the information and documents required to identify their status, or who are non-FATCA compliant financial institutions or who fall within other categories specified in the FATCA provisions and regulations."
784,"As at the date of this Prospectus, all Units are registered in the name of HKSCC Nominees Limited."
785,HKSCC Nominees Limited has registered as a participating foreign financial institution or registered deemed compliant foreign financial institution.
786,The Manager has obtained competent tax advice confirming that the Sub-Funds do not need to be registered with the IRS and that the registration of the Trust with the IRS satisfies the FATCA requirements.
787,"Although the Manager, the Trust and the Sub-Funds will attempt to satisfy any obligations imposed by FATCA on them to avoid the imposition of FATCA withholding tax, no assurance can be given 64 that the Manager, the Trust and the Sub -Funds will be able to fully satisfy these obligations."
788,"If any Sub-Fund becomes subject to a withholding tax as a result of FATCA, the Net Asset Value of such Sub -Fund may be adversely affected and such sub -fund and its Unitholders may suffer material loss."
789,The FATCA provisions are complex and their application is uncerta in at this time.
790,"The above description is based in part on regulations, official guidance, the Hong Kong IGA and model IGAs, all of which are subject to change or may be implemented in a materially different form."
791,"Nothing in this section constitutes or p urports to constitute tax advice and Unitholders should not rely on any information set out in this section for the purposes of making any investment decision, tax decision or otherwise."
792,"All Unitholders should therefore consult their own tax and professio nal advisors regarding the FATCA requirements, possible implications and related tax consequences with respect to their own situation."
793,"In particular, Unitholders who hold their Units through intermediaries should confirm the FATCA compliance status of those intermediaries to ensure that they do not suffer the above mentioned withholding tax on their investment returns."
794,65 PART 2 – SPECIFIC INFORMATION RELATING TO EACH SUB-FUND Part 2 of this Prospectus includes specific information relevant to each of Sub-Fund established under the Trust and listed on the SEHK.
795,It is updated from time to time by the Manager.
796,Information relating to each Sub-Fund is set out in a separate Appendix.
797,The information presented in each Appendix in this Part 2 should be read in con junction with the information presented in Part 1 of this Prospectus.
798,"Where the information in any Appendix in this Part 2 conflicts with the information presented in Part 1, the information in the relevant Appendix in the Part 2 prevails, however, is app licable to the specific Sub -Fund of the relevant Appendix only."
799,"Defined terms used in each of the Appendices and which are not defined in this Part 2, bear the same meanings as in Part 1 of this Prospectus."
800,References in each Appendix to “Sub -Fund” refer t o the relevant Sub -Fund which is the subject of that Appendix.
801,References in each Appendix to “Index” refers to the relevant Index details of which are set out in that Appendix.
802,1 Appendix 1: Samsung S&P GSCI Crude Oil ER Futures ETF Key information Set out below is a summary of key information in respect of this Sub -Fund which should be read together with the full text of this Appendix and the Prospectus.
803,Index S&P GSCI Crude Oil I ndex Excess Return (“Excess Return” does not mean any additional return on the ETF’s performance) Index Provider S&P Dow Jones Indices (S&P) Listing Date (SEHK) 29 April 2016 Exchange Listing SEHK – Main Board Stock Code 03175 Short Stock Name F SAMSUNG OIL Trading Board Lot Size 200 Units Base Currency Hong Kong dollars (HKD) Trading Currency HKD only Dual Counter No Distribution Policy Annually (usually in March of each year) (if any) in HKD subject to the Manager’s discretion.
804,Distributions may not be paid if the cost of the Sub -Fund’s operations is higher than the yield from management of the Sub-Fund’s cash and holdings of investment products.
805,"Furthermore, distributions may be paid out of capital or out of gross income while all or part of fees and expenses may be charged to capital at the Manager’s discretion resulting in an increase in distributable income for the payment of distributions and therefore distributions may be paid effectively out of capital."
806,"Creation/Redemption Policy Cash (HKD) only Application Unit Size (only by or through Participating Dealers) Minimum 250,000 Units (or multiples thereof) Ongoing Charges Over a Year (including the Management Fee)* 1.71% of the Net Asset Value Management Fee Currently 0.65% per year of the Net Asset Value Investment Strategy Full replication."
807,Please refer to the section on “What is the investment strategy?” below Financial Year End 31 March 2 Website www.samsungetf.com.hk * The ongoing charges figure does not represent tracking error What is the investment objective?
808,"The investment objective of the Sub -Fund is to provide investment results that, before fees and expenses, closely correspond to the performance of the S&P GSCI Crude Oil Index Excess Return (the “Index”)."
809,There can be no assurance that the Sub -Fund will achieve its investment objective.
810,The Index tracks the performance of the nearest month West Texas Intermediate crude oil (also known as Texas light sweet crude oil) Futures C ontracts (the “WTI Futures Contracts”) traded on NYMEX.
811,What is the investment strategy?
812,"In seeking to achieve the Sub -Fund’s investment objective, the Manager adopts a full replication strategy through investing directly in WTI Futures Contracts so as to give the Sub -Fund the performance of the Index."
813,"In entering the WTI Futures Contracts each calendar month, the Manager anticipates that no more than 20% of the Net Asset Value of the Sub -Fund from time to time will be used as margin to acquire the WTI Futures Contracts."
814,"Not less than 80% of the Net Asset Value of the Sub -Fund in cash (HKD) will be applied by the Manager towards investing the Sub-Fund in cash (HKD) and other HKD d enominated investment products, such as deposits with banks in Hong Kong an d SFC authorised money market funds in accordance with the requirements of the Code ."
815,Yield in HKD from such cash and investment products will be used to meet the Sub-Fund’s fees and expenses and after deduction of such fees and expenses the remainder will be distributed by the Manager to Unitholders in HKD.
816,"Other than WTI Futures Contracts , the Manager has no intention to invest the Sub -Fund in any financial derivative instruments (including structured products or instruments) for hedging or non-hedging (i.e."
817,investment) purposes .
818,The Manager will seek the prior approval of the SFC and provide at least one month’s prior notice to Unitholders before the Manager engages in any such investments.
819,"Other than margin for WTI Futures Contracts , the Sub-Fund will not itself use leverage and the Sub-Fund’s global exposure to financial derivative instruments (based on the settlement price of the WTI Futures Contracts) will not exceed 100% of its Net Asset Value."
820,The rolling strategy of the Sub-Fund will mimic that of the Index methodology so as to closely track the Index (see “Futures Roll” under “What is the Index” section below).
821,"For the Sub -Fund, the roll will take place over a 5 day period per month as stated in the Index methodology."
822,The investment strategy of t he Sub-Fund is subject to the investment and borrowing restr ictions set out in Part 1 of this Prospectus save as varied under the “Investment restriction” section below.
823,Overview of the crude oil market What is crude oil?
824,"Crude oil is a naturally occurrin g, unrefined petroleum product composed of hydrocarbon deposits and other organic materials."
825,"Crude oil can be refined to p roduce usable products such as gasoline, diesel and various forms of petrochemicals."
826,"It is a non-renewable resource , also known as a fossil fuel, which means that it cannot be rep laced naturally at the rate people consume it and is therefore a limited resource."
827,Crude oil supply Crude oil production by the Organization of the Petroleum Exporting Countries (“ OPEC”) is an important factor that affects oil prices.
828,This organisation seeks to actively manage oil production 3 in its member countries by setting production targets.
829,"Historically, crude oil prices have seen increases in times when OPEC production targets are reduced."
830,OPEC member countries produce about 30% of the world’s crude oil.
831,"Equally important to global prices, OPEC’s oil exports represent about 60% of the total petroleum traded internationally."
832,"Because of this market share, OPEC’s actions can, an d do, influence international oil prices."
833,"In particular, indications of changes in crude oil production from Saudi Arabia, OPEC's largest producer, frequently affect oil prices."
834,"The extent to which OPEC member countries utilise their available production capacity is often used as an indicator of the tightness of global oil markets, as well as an indicator of the extent to which OPEC is exerting upward influence on prices."
835,OPEC spare capacity provides an indicator of the world oil market's ability to respon d to potential crises that reduce oil supplies.
836,"As a result, oil prices tend to incorporate a rising risk premium when OPEC spare capacity reaches low levels."
837,"Markets are influenced by geopolitical events within and between OPEC countries because they have, historically, resulted in reductions in oil production."
838,"Given OPEC's market significance, events that entail an actual or future potential loss of oil supplies can produce strong reactions in oil prices."
839,Oil production from countries outside the OPEC currently represents about 70% of world oil production.
840,"Key centers of non -OPEC production include North America, regions of the former Soviet Union and the North Sea."
841,"In contrast to OPEC oil production, which is subject to central coordination, non -OPEC producers make independent decisions about oil production."
842,"Also, in contrast to OPEC, where oil production is mostly in the hands of national oil companies (“NOCs”), international or investor -owned oil companies (“IOCs”) perform most of the production activiti es in non-OPEC countries."
843,IOCs seek primarily to increase shareholder value and make investment decisions based on economic factors.
844,"While some NOCs operate in a similar manner as IOCs, many have additional objectives such as providing employment, infrastr ucture or revenue that impact their country in a broader sense."
845,"As a result, non-OPEC investment and thus future supply capability, tends to respond more readily to changes strictly in market conditions."
846,"Producers in non-OPEC countries are generally regarded as price takers, that is, they respond to market prices rather than attempt to influence prices by managing production."
847,"As a result, non-OPEC producers tend to produce at or near full capacity and so have little spare capacity."
848,"Crude oil demand OECD consists of the United States, much of Europe, and other advanced countries."
849,"At 53% of world oil consumption in 2010, these large economies consume more oil than the non -OECD countries, but oil consumption in the OECD countries has declined since 2001 and was at 49% of world oil consumption in 201 4, whereas non-OECD consumption rose 38% during the same period."
850,"Structural conditions in each country's economy influence the relationships among oil prices, economic growth and oil consumption."
851,Developed countri es tend to have higher vehicle ownership per capita.
852,"Because of this, oil use within the OECD transportation sector usually accounts for a larger share of total oil consumption than in non -OECD countries."
853,It is also more mature and slower -growing.
854,Economic conditions and policies that affect the transport of goods and people thus have a significant impact on total oil consumption in OECD countries.
855,Many OECD countries have higher fuel taxes and policies to improve the fuel economy of new vehicles and increase the use of biofuels.
856,This tends to slow the growth in oil consumption even in times of strong economic growth.
857,"Furthermore, the economies in OECD countries tend to have larger service sectors relative to manufacturing."
858,"As a result, strong economic growt h in these countries may not have the same impact on oil consumption as it would in non-OECD countries."
859,"OECD countries tend to have fewer subsidies on end -use prices, so changes in market oil prices are often quickly reflected in prices faced by consumers."
860,"However, it takes time for people to adjust their transportation routines and for the vehicle stock to turn over and become more 4 energy-efficient in response to price changes."
861,Changes in expected future oil prices also affect consumers’ decisions concerni ng modes of transportation and vehicle purchases.
862,"If prices are expected to remain high or increase in the future, more consumers may decide to purchase more fuel efficient vehicles or use public transportation."
863,Decisions like these help to reduce future o il demand and would tend to moderate expected price increases.
864,Oil consumption in developing countries that are not part of the OECD has risen sharply in recent years.
865,"While oil consumption in the OECD countries declined from 63% in 2010 to 49% in 2014, non-OECD oil consumption increased from 37% in 2010 to 51% in 2014."
866,"China, India, and Saudi Arabia had the largest growth in oil consumption among the countries in the non-OECD during this period."
867,Rising oil consumption reflects rapid economic growth in thes e countries.
868,Current and expected levels of economic growth heavily influence global oil demand and oil prices.
869,"Commercial and personal transportation activities, in particular, require large amounts of oil and are directly tied to economic conditions."
870,"Many manufacturing processes consume oil as fuel or use it as feedstock, and in some non-OECD countries, oil remains an important fuel for power generation."
871,"Because of these uses, oil prices tend to rise when economic activity and in turn oil demand is growin g strongly."
872,"Many non-OECD countries are also experiencing rapid growth in population, which is an additional factor supporting strong oil consumption growth."
873,Structural conditions in each country’s economy further influence the relationship between oil prices and economic growth.
874,"Developing countries tend to have a greater proportion of their economies in manufacturing industries, which are more energy intensive than service industries."
875,"Although transportation oil use is usually a smaller share of total oil consumption in non -OECD countries, this use tends to increase rapidly as expanding economies increase the need to move goods and people."
876,Vehicle ownership per capita is also highly correlated with rising incomes and has much room to grow in non -OECD countries.
877,"For these reasons, non-OECD economic growth rates tend to be an important factor affecting oil prices."
878,China's strong economic growth has recently resulted in that country becoming the largest energy consumer and second largest oil consumer in the world.
879,"In addition, China's rising oil consumption has been a major contributor to incremental growth in worldwide oil consumption."
880,US Energy Information Administration projects that virtually all the net increase in oil consumption in the next 25 years will come from non-OECD countries.
881,"Although oil use is clearly tied to economic activity, energy policies also significantly affect that relationship."
882,"Many developing countries, for example, control or subsidize end -use prices, which inhibits consumer response to market price changes."
883,This reduced demand response to price changes further contributes to the importance of economic growth as a key driver of non -OECD demand and in turn global oil prices.
884,"Crude oil prices Crude oil prices measure the spot price of v arious barrels of oil, most commonly either the West Texas Intermediate (“ WTI”) or the Brent Blend."
885,The OPEC basket price and the NYMEX futures price are also sometimes quoted.
886,WTI crude oil is of very high quality because it is light -weight and has low sulphur content.
887,"For these reasons, it is often referred to as “light, sweet” crude oil."
888,These properties make it excellent for making gasoline.
889,That is why it is the major benchmark of crude oil in the Americas.
890,Please refer to “What is WTI crude oil” below for more information on WTI crude oil.
891,Brent Blend is a combination of crude oil from 15 different oil fields in the North Sea.
892,"It is less “light” and “sweet” than WTI, but still excellent for making gasoline."
893,It is refined in Northwest Europe and is the primary benchmark for other crude oil in Europe or Africa.
894,"As crude oil is traded in a global market, prices of the many crude oil streams produced globally tend to move closely together, although there are persistent differentials between light -weight, low-sulphur (light-sweet) grades and heavier, higher-sulphur (heavy-sour) crudes that are lower in 5 quality."
895,"Both crude oil and petroleum product prices can be affected by events that have the potential to disrupt the flow of oil and products to market, including geopolitical and weather -related developments."
896,"These types of events may lead to actual disruptions or create uncertainty about future supply or demand, which can lead to higher volatility in prices."
897,The volatility of oil prices is inherently tied to the low responsive ness or “inelasticity” of both supply and demand to price changes in the short run.
898,Both oil production capacity and the equipment that use petroleum products as their main source of energy are relatively fixed in the near term.
899,"It takes years to develop new supply sources or vary production, and it is very hard for consumers to switch to other fuels or increase fuel efficiency in the near term when prices rise."
900,"Under such conditions, a large price change can be necessary to re-balance physical supply and demand following a shock to the system."
901,"Much of the world's crude oil is located in regions that have been prone historically to political upheaval, or have had their oil production disrupted due to political events."
902,"Several major oil price shocks have occu rred at the same time as supply disruptions triggered by political events, most notably the Arab Oil Embargo in 1973-74, the Iranian revolution and Iran-Iraq war in the late 1970s and early 1980s, and Persian Gulf War in 1990."
903,"More recently, disruptions to supply (or curbs on potential development of resources) from political events have been seen in Nigeria, Venezuela, Iraq, Iran and Libya."
904,"Given the past history of oil supply disruptions emanating from political events, market participants are always assessing the possibility of future disruptions and their potential impacts."
905,"In addition to the size and duration of a potential disruption, they also consider the availability of crude stocks and the ability of other producers to offset a potential supply l oss."
906,"For example, if the market has ample spare production capacity to offset a possible disruption, its likely impact on prices would be smaller than if spare production capacity was much lower."
