sentence_id,text
0,SAMSUNG ETFS TRUST (a Hong Kong umbrella unit trust authorised under Section 104 of the Securities and Futures Ordinance (Cap.
1,"571) of Hong Kong) Samsung S&P GSCI Crude Oil ER Futures ETF HKD Counter Stock Code: 03175 Samsung NYSE FANG+ ETF HKD Counter Stock Code: 02814 USD Counter Stock Code: 09814 Samsung Bloomberg Global Semiconductor ETF HKD Counter Stock Code: 03132 Samsung Blockchain Technologies ETF HKD Counter Stock Code: 03171 Samsung Asia Pacific ex NZ Metaverse Theme ETF HKD Counter Stock Code: 03172 PROSPECTUS Manager Samsung Asset Management (Hong Kong) Limited 三星資產運用（香港）有限公司 Listing Agent Altus Capital Limited 15 August 2025 Hong Kong Exchanges and Clearing Limited (“HKEX”), The Stock Exchange of Hong Kong Limited (the “SEHK”), Hong Kong Securities Clearing Company Limited (“HKSCC”) and the Hong Kong Securities and Futures Commission (the “SFC”) take no responsibility for the contents of this Prospectus, make no representation as to its accuracy or completeness and expressly disclaim any liability whatsoever for any loss howsoever arising from or in reliance upon the whole or any part of the contents of this Prospectus."
2,The Trust and the Sub-Fund have each been authorised as collective investment schemes by the SFC.
3,SFC authorisation is not a recommendation or endorsement of a scheme nor does it guarantee the commercial merits of a scheme or its performance.
4,It does not mean the scheme is suitable for all investors nor is it an endorsement of its suitability for any particular investor or class of investors.
5,"IMPORTANT: If you are in any doubt about the contents of this Prospectus, you should consult your stockbroker, bank manager, solicitor, accountant or other financial adviser for independent financial advice."
6,Samsung S&P GSCI Crude Oil ER Futures ETF (the “Sub-Fund”) is a futures-based exchange traded fund.
7,Investment in the Sub-Fund is only suitable to those investors who are in a financial position to assume the risks involved in futures investments.
8,"Futures investments are subject to certain key risks including leverage, counterparty and liquidity risks."
9,Movement in the prices of futures may be highly volatile.
10,The Sub-Fund may not be suitable for all investors.
11,It is possible that the entire value of your investment could be lost.
12,Please refer to the “Risk Factors” section in this Prospectus as well as the “Risk factors specific to the Sub-Fund” section in each Appendix.
13,"IMPORTANT INFORMATION This Prospectus relates to the offer in Hong Kong of units (the “Units”) in the Samsung ETFs Trust (the “Trust”), an umbrella unit trust established under Hong Kong law by a trust deed dated 13 January 2015, as amended from time to time (the “Trust Deed”) between Samsung Asset Management (Hong Kong) Limited 三星資產運用（香港） 有限公司 (the “Manager”) and HSBC Institutional Trust Services (Asia) Limited (the “Trustee”)."
14,The Trust may have one or more sub-funds (the “Sub-Funds” or individually a “Sub-Fund”) which are exchange traded funds.
15,The information contained in this Prospectus has been prepared to assist potential investors in making an informed decision in relation to investing in the Sub-Funds.
16,It contains important facts about the Sub-Funds whose Units are offered in accordance with this Prospectus.
17,"A product key facts statement which contains the key features and risks of each of the Sub-Funds is also issued by the Manager and such product key facts statement shall form part of this Prospectus, and shall be read, in conjunction with, this Prospectus."
18,"The Manager accepts full responsibility for the accuracy of the information contained in this Prospectus and the Product Key Facts Statement of each Sub-Fund and confirms having made all reasonable enquiries, that to the best of its knowledge and belief there are no other facts the omission of which would make any statement in this Prospectus or any Product Key Facts Statement misleading."
19,"The Manager also confirms that this Prospectus includes particulars given in compliance with the Rules Governing the Listing of Securities on the Stock Exchange of Hong Kong Limited and the Code on Unit Trusts and Mutual Funds (the “Code”) and the “Overarching Principles” of the SFC Handbook for Unit Trusts and Mutual Funds, Investment-Linked Assurance Schemes and Unlisted Structured Investment Products for the purposes of giving information with regard to the Units."
20,"The Trustee is not responsible for the preparation of this Prospectus and shall not be held liable to any person for any information disclosed in this Prospectus, except for the information regarding the Trustee itself under the paragraph headed “The Trustee and Registrar” in the section on “Management of the Trust”."
21,Samsung S&P GSCI Crude Oil ER Futures ETF is a collective investment scheme falling within Chapters 8.6 and 8.8 of the Code.
22,The Trust and each Sub-Fund are authorised by the SFC in Hong Kong under Section 104 of the Securities and Futures Ordinance.
23,"The SFC takes no responsibility for the financial soundness of the Trust, any Sub- Fund or for the correctness of any statements made or opinions expressed in this Prospectus."
24,SFC authorisation is not a recommendation or endorsement of a scheme nor does it guarantee the commercial merits of a scheme or its performance.
25,It does not mean the scheme is suitable for all investors nor is it an endorsement of its suitability for any particular investor or class of investors.
26,"You should consult your financial adviser or your tax advisers and take legal advice as appropriate as to whether any governmental or other consents are required, or other formalities need to be observed, to enable you to acquire Units as to whether any taxation effects, foreign exchange restrictions or exchange control requirements are applicable and to determine whether any investment in a Sub-Fund is appropriate for you."
27,"Dealings in the Units of Samsung S&P GSCI Crude Oil ER Futures ETF, Samsung NYSE FANG+ ETF, Samsung Bloomberg Global Semiconductor ETF, Samsung Blockchain Technologies ETF, and Samsung Asia Pacific ex NZ Metaverse Theme ETF on The Stock Exchange of Hong Kong Limited (the “SEHK”) have already commenced."
28,"The Units of Samsung S&P GSCI Crude Oil ER Futures ETF, Samsung NYSE FANG+ ETF, Samsung Bloomberg Global Semiconductor ETF, Samsung Blockchain Technologies ETF, and Samsung Asia Pacific ex NZ Metaverse Theme ETF have been accepted as eligible securities by Hong Kong Securities Clearing Company Limited (“HKSCC”) for deposit, clearing and settlement in the Central Clearing and Settlement System (“CCASS”)."
29,Settlement of transactions between participants of the SEHK is required to take place in CCASS on the second CCASS Settlement Day after any trading day.
30,All activities under CCASS are subject to the General Rules of CCASS and CCASS Operational Procedures in effect from time to time.
31,"No action has been taken to permit an offering of Units or the distribution of this Prospectus in any jurisdiction other than Hong Kong and, accordingly, this Prospectus does not constitute an offer or solicitation to anyone in any jurisdiction in which such offer is not authorised or to any person to whom it is unlawful to make such offer or solicitation."
32,"The Units have not been, and will not be, registered under the United States Securities Act of 1933, as amended (the “US Securities Act”) or any other United States Federal or State law and, except in a transaction which does not violate the US Securities Act, may not be directly or indirectly offered to or sold in the United States of America or any of its territories or for the benefit of a US Person (as defined in Regulation S of the US Securities Act)."
33,"The Trust and the Sub-Funds have not been and will not be registered as an investment company under the United States Investment Company Act of 1940, as amended."
34,"Units may not be acquired or owned by (i) an employee benefit plan, as defined in Section 3(3) of the Employee Retirement Income Security Act of 1974, as amended (“ERISA”), that is subject to Title I of ERISA, (ii) a plan, as defined in Section 4975(e)(1) of the US Internal Revenue Code of 1986, as amended (the “Internal Revenue Code”), that is subject to Section 4975 of the Internal Revenue Code, (iii) a plan that is subject to any other law, regulation, rule or restriction that is substantially similar to ERISA or Section 4975 of the Internal Revenue Code (“Similar Law”) or (iv) an entity whose assets are deemed to include the assets of such an employee benefit plan or plan for purposes of ERISA, Section 4975 of the Internal Revenue Code or Similar Law, unless the purchase, holding and disposition of units will not constitute a violation under ERISA, Section 4975 of the Internal Revenue Code and any applicable Similar Law."
35,"Furthermore, distribution of this Prospectus shall not be permitted unless it is accompanied by a copy of the latest annual financial statements of the Sub-Fund(s) (where existing) and, if later, its most recent interim report."
36,"You should note that any amendment or addendum to this Prospectus will only be posted on the Manager’s website (www.samsungetfhk.com) the contents of which, and of any other websites referred to in this Prospectus, have not been reviewed by the SFC."
37,This Prospectus may refer to information and materials included in websites.
38,Such information and materials do not form part of this Prospectus and they have not been reviewed by the SFC or any regulatory body.
39,Investors should note that the information provided in websites may be updated and changed periodically without any notice to any person.
40,Questions and Complaints Investors may raise any questions on or make any complaints about the Trust (including the Sub-Funds) by contacting the Manager at its address as set out in the Directory of this Prospectus or calling the Manager on +852 2115 8710 during normal office hours.
41,"Manager and QFI holder# DIRECTORY Investment Adviser^ Samsung Asset Management (Hong Kong) Limited 三星資產運用（香港）有限公司 Units 301-2, 3/F, Agricultural Bank of China Tower 50 Connaught Road Central Hong Kong Trustee and Registrar HSBC Institutional Trust Services (Asia) Limited 1 Queen’s Road Central Hong Kong Participating Dealers* Please refer to the relevant Appendix of each Sub-Fund Auditors Ernst & Young 27/F, One Taikoo Place 979 King’s Road Hong Kong Custodian# The Hongkong and Shanghai Banking Corporation Limited 1 Queen’s Road Central Hong Kong Samsung Asset Management Co., Limited 55 Sejong-daero Jung-gu Seoul 100-715 Korea Investment Adviser^^ Amplify Investments LLC 310 South Hale Street Wheaton Illinois 60187 Market Makers* Please refer to the relevant Appendix of each Sub-Fund Legal Counsel to the Manager Simmons & Simmons 30/F, One Taikoo Place 979 King’s Road Hong Kong PRC Custodian# HSBC Bank (China) Company Limited 33/F, HSBC Building Shanghai IFC 8 Century Avenue Pudong Shanghai 200120 China Service Agent HK Conversion Agency Services Limited 8th Floor, Two Exchange Square 8 Connaught Place Central Hong Kong Listing Agent Altus Capital Limited 21 Wing Wo Street Central Hong Kong * Please refer to the Manager’s website for the latest lists of Market Makers and Participating Dealers for each of the Sub-Funds."
42,"# In respect of Samsung Asia Pacific ex NZ Metaverse Theme ETF only ^ In respect of Samsung S&P GSCI Crude Oil ER Futures ETF only ^^ In respect of Samsung Blockchain Technologies ETF only CONTENTS PART 1 – GENERAL INFORMATION RELATING TO THE TRUST AND SUB-FUNDS 1 DEFINITIONS 2 INTRODUCTION 9 THE OFFERING PHASES 10 INVESTMENT OBJECTIVE, INVESTMENT STRATEGY, INVESTMENT RESTRICTIONS, SECURITIES FINANCING TRANSACTION AND BORROWING 15 THE OFFSHORE RMB MARKET 28 THE A-SHARE MARKET 29 CREATIONS AND REDEMPTIONS (PRIMARY MARKET) 33 EXCHANGE LISTING AND TRADING (SECONDARY MARKET) 46 DETERMINATION OF NET ASSET VALUE 47 FEES AND EXPENSES 50 RISK FACTORS 57 MANAGEMENT OF THE TRUST 68 STATUTORY AND GENERAL INFORMATION 78 TAXATION 86 PART 2 – SPECIFIC INFORMATION RELATING TO EACH SUB-FUND 92 APPENDIX 1: Samsung S&P GSCI Crude Oil ER Futures ETF 93 APPENDIX 2: Samsung NYSE FANG+ ETF 120 APPENDIX 3: Samsung Bloomberg Global Semiconductor ETF 134 APPENDIX 4: Samsung Blockchain Technologies ETF 151 APPENDIX 5: Samsung Asia Pacific ex NZ Metaverse Theme ETF 165 1 #9768949v2<L_LIVE_APAC1> - Samsung ETFs Trust - Prospectus (Multi counter update) PART 1 – GENERAL INFORMATION RELATING TO THE TRUST AND SUB-FUNDS Part 1 of this Prospectus includes information relevant to the Trust and all Sub-Funds established under the Trust and listed on the SEHK."
43,The information presented in this Part 1 should be read in conjunction with the information presented in the relevant Appendix in Part 2 of this Prospectus in respect of a particular Sub-Fund.
44,"Where the information in Part 2 of this Prospectus conflicts with the information presented in this Part 1, the information in the relevant Appendix in Part 2 prevails, however, it is applicable to the specific Sub-Fund of the relevant Appendix only."
45,Please refer to Part 2 “Specific Information Relating to Each Sub-Fund” for further information.
46,"2 DEFINITIONS In this Prospectus (including the relevant Appendix for any Sub-Fund), unless the context requires otherwise, the following expressions have the meanings set out below."
47,"Other capitalised terms used, but not defined, have the meaning given to those terms in the Trust Deed."
48,“After Listing” means the period which commences on the Listing Date and continues until the Sub- Fund(s) is/are terminated.
49,"“A-Shares” means shares issued by companies incorporated in the PRC and listed on the SSE, the SZSE or the BSE traded in RMB and available for investment by domestic investors, QFIs and through Stock Connect."
50,“Appendix” means an appendix to this Prospectus that sets out specific information applicable to a Sub-Fund.
51,"“Application” means an application by a Participating Dealer for the creation or redemption of Units in accordance with the procedures for creation and redemption of Units set out in the Operating Guidelines, the relevant Participation Agreement and the terms of the Trust Deed."
52,"“Application Unit” means, in relation to each Sub-Fund, such number of Units or whole multiples thereof as specified in this Prospectus or such other number of Units from time to time determined by the Manager, approved by the Trustee and notified by the Manager to the Participating Dealers."
53,“BSE” means the Beijing Stock Exchange.
54,"“Business Day” in respect of the Sub-Fund(s), means, unless the Manager and the Trustee otherwise agree, a day on which (a)(i) the SEHK is open for normal trading; and (ii) the relevant market on which Securities and/or Futures Contracts comprised in the relevant Index or Securities and/or Futures Contracts (as the case may be) comprised in the Sub-Fund, are traded is open for normal trading, or (iii) if there is more than one such market, the market designated by the Manager is open for normal trading, and (b) (where applicable) the Index is compiled and published, or such other day or days as the Manager and the Trustee may agree from time to time provided that if on any such day, the period during which the relevant securities market is open for normal trading is reduced as a result of a Number 8 Typhoon Signal, Black Rainstorm warning or other similar event, such day shall not be a Business Day unless the Manager and the Trustee otherwise agree."
55,"“Cancellation Compensation” means an amount payable by a Participating Dealer for the account of a Sub-Fund in respect of a Default or a cancellation of Creation Application or Redemption Application in accordance with the Trust Deed, as set out in the Trust Deed and in the Operating Guidelines applicable at the time the relevant Creation Application or Redemption Application is made."
56,“CCASS” means the Central Clearing and Settlement System established and operated by HKSCC or any successor system operated by HKSCC or its successors.
57,“CCASS Settlement Day” means the term “Settlement Day” as defined in the General Rules of CCASS.
58,“CFTC” means Commodity Futures Trading Commission of the United States or its successors.
59,“Code” means the Code on Unit Trusts and Mutual Funds issued by the SFC (as amended or replaced from time to time).
60,"“Connected Person” has the meaning as set out in the Code which at the date of this Prospectus means in relation to a company: (a) any person or company beneficially owning, directly or indirectly, 20% or more of the ordinary share capital of that company or able to exercise directly or indirectly, 20% or 3 more of the total votes in that company; or (b) any person or company controlled by a person who or which meets one or both of the descriptions given in (a); or (c) any member of the group of which that company forms part; or (d) any director or officer of that company or of any of its connected persons as defined in (a), (b) or (c)."
61,“Creation Application” means an application by a Participating Dealer for the creation and issue of Units in an Application Unit size in accordance with the Operating Guidelines and the Trust Deed.
62,"“CSDCC” means the China Securities Depository and Clearing Co., Ltd."
63,“CSRC” means the China Securities Regulatory Commission.
64,“Custodian” means The Hongkong and Shanghai Banking Corporation Limited or such other person appointed as custodian of a Sub-Fund (if any).
65,"“Dealing Day” means each Business Day during the continuance of the relevant Sub-Fund, and/or such other day or days as the Manager may from time to time determine with the approval of the Trustee."
66,"“Dealing Deadline” in relation to any particular place and any particular Dealing Day, means the time on each Dealing Day specified in the “The Offering Phases” section of this Prospectus or such other time or day as the Manager may from time to time determine with the approval of the Trustee."
67,“Default” means a failure by a Participating Dealer in respect of: (a) a Creation Application to deliver the requisite Securities and/or relevant cash amount; or (b) a Redemption Application to deliver the Units the subject of the Redemption Application and/or relevant cash amount.
68,"“Deposited Property” means, in respect of each Sub-Fund, all the assets (including Income Property), received or receivable by the Trustee, for the time being held or deemed to be held upon the trusts and subject to the terms of the Trust Deed for the account of the Sub-Fund(s) but excluding (i) the Income Property standing to the credit of the distribution account of such Sub-Fund (other than interest earned thereon) and (ii) any such other amount for the time being standing to the credit of the distribution account of such Sub-Fund."
69,"“Duties and Charges” means, in relation to any particular transaction or dealing, all stamp and other duties, taxes, government charges, brokerage fees, bank charges, transfer fees, registration fees, transaction levies and other duties and charges whether in connection with the constitution of the Deposited Property or the increase or decrease of the Deposited Property or the creation, issue, transfer, cancellation or redemption of Units or the acquisition or disposal of Securities and/or Futures Contracts (as the case may be) or otherwise which may have become or may be payable in respect of, and whether prior to, upon or after the occasion of, such transaction or dealing and including but not limited to, in relation to an issue of Units or redemption of Units, a charge (if any) of such amount or at such rate as is determined by the Manager or the Trustee to be made for the purpose of compensating or reimbursing the Trust for the difference between (a) the prices used when valuing the Securities and/or Futures Contracts (as the case may be) in the Trust Fund for the purpose of such issue or redemption of Units and (b) (in the case of an issue of Units) the prices which would be used when acquiring the same Securities and/or Futures Contracts (as the case may be) if they were acquired by the Trust with the amount of cash received by the Trust upon such issue of Units and (in the case of a redemption of Units) the prices which would be used when selling the same Securities and/or Futures Contracts (as the case may be) if they were sold by the Trust in order to realise the amount of cash required to be paid out of 4 the Trust Fund upon such redemption of Units."
70,"“Encumbrance” means any mortgage, charge, pledge, lien, third party right or interest, any other encumbrance or security interest of any kind or another type of preferential arrangement (including, without limitation, a title transfer or retention arrangement) having similar effect other than any such encumbrance or security interest imposed by the terms of the relevant clearing system/depositary or otherwise created by the terms of the Participation Agreement, the Trust Deed or any agreement between the Manager, the Trustee and the relevant Participating Dealer."
71,“Entities within the Same Group” means entities which are included in the same group for the purposes of consolidated financial statements prepared in accordance with internationally recognised accounting standards.
72,"“Extension Fee” means the fee payable to the Trustee on each occasion the Manager, upon a Participating Dealer’s request, grants the Participation Dealer an extended settlement in respect of a Creation Application or Redemption Application."
73,“FDIs” means financial derivative instruments.
74,“Futures Contract” means any futures contract which is traded on any Futures Exchange.
75,“Futures Exchange” means the Hong Kong Futures Exchange Limited.
76,“Government and other Public Securities” has the meaning as set out in the Code.
77,"“HKD” means Hong Kong dollars, the lawful currency of Hong Kong."
78,“HKEX” means Hong Kong Exchanges and Clearing Limited or its successors.
79,“HKSCC” means the Hong Kong Securities Clearing Company Limited or its successors.
80,“IFRS” means International Financial Reporting Standards.
81,"“Income Property” means, in respect of each Sub-Fund, (a) all interest, dividends and other sums deemed by the Trustee, (after consulting the auditors either on a general or case by case basis), to be in the nature of income (including taxation repayments, if any) received or receivable by the Trustee in respect of the Deposited Property of the relevant Sub-Fund (whether in cash or, without limitation, by warrant, cheque, money, credit or otherwise or the proceeds of sale or transfer of any Income Property received in a form other than cash); (b) all interest and other sums received or receivable by the Trustee in respect of (a), (c) or (d) of this definition; (c) all cash payments received or receivable by the Trustee for the account of the relevant Sub-Fund in respect of an Application; and (d) all Cancellation Compensation received by the Trustee for the account of the relevant Sub- Fund; and (e) any payments to be received or are receivable by the Trustee under any contractual agreements in the nature of investments for the benefit of the relevant Sub-Fund but excluding (i) the Deposited Property; (ii) any amount for the time being standing to the credit of the distribution account for the account of the relevant Sub-Fund(s) or previously distributed to Unitholders; (iii) gains for the account of the relevant Sub-Fund arising from the realisation of Securities and/or Futures Contracts (as the case may be); and (iv) any sums applied towards payment of the fees, costs and expenses payable by the Trust from the Income Property of the relevant Sub-Fund; “Index” means the index or benchmark, if any, against which an Index Tracking Sub-Fund may be benchmarked or may otherwise be referenced as set out in the relevant Appendix."
82,"“Index Provider” means, in respect of an Index Tracking Sub-Fund, the person responsible for compiling the Index against which the relevant Sub-Fund benchmarks its investments and who holds the right to licence the use of such Index to the relevant Sub-Fund as set out in the relevant Appendix."
83,"“Index Tracking Sub-Fund” means a Sub-Fund with a principal objective to track, replicate or 5 correspond to a financial index or benchmark, with an aim of providing or achieving investment results or returns that closely match or correspond to the performance of the Index that it tracks."
84,"“Initial Issue Date” means the date of the first issue of Units, which shall be, unless otherwise specified in the relevant Appendix, the Business Day immediately before the Listing Date."
85,"“Initial Offer Period” means, in respect of each Sub-Fund(s) the period before the relevant Listing Date as set out in the relevant Appendix."
