sentence_id,text
1118,"Under exceptional circumstances, the Manager may, in its absolute discretion and without prior notice to investors, deviate from the Full Replication Strategy and implement alternative investment strategies, which may include investing in WTI Futures Contracts other than those constituting the Index, underweighting or overweighting certain WTI Futures Contracts in the Index, deviating from the rolling strategy and/or rolling schedule, and/or using financial derivative instruments (other than WTI Future Contracts) for hedging purposes, in the best interests of the Sub-Fund and the Unitholders and for the protection of the Sub-Fund."
1119,"Not less than 50% of the Net Asset Value (this percentage may be reduced proportionally under exceptional circumstances where there is a higher margin requirement, as described above) of the Sub-Fund in cash (HKD or USD) will be applied by the Manager towards investing the Sub-Fund in cash (HKD or USD) and other HKD or USD denominated investment products, such as deposits with banks in Hong Kong and funds which invest primarily in money market instruments (for less than 30% of the Sub-Fund’s Net Asset Value only)."
1120,"Any investments in exchange traded funds by the Sub-Fund will be considered and treated as listed securities for the purposes of and subject to the requirements in Chapter 7.1, 7.1A and 7.2 of the Code."
1121,Yield from such cash and investment products will be used to meet the Sub-Fund’s fees and expenses and after deduction of such fees and expenses the remainder will be distributed by the Manager to Unitholders in HKD.
1122,"Other than WTI Futures Contracts, the Manager has no intention to invest the Sub-Fund in any FDIs (including structured products or instruments) for hedging or non-hedging (i.e."
1123,"investment) purposes, unless under any exceptional circumstances as described above."
1124,"Other than margin for WTI Futures Contracts, the Sub-Fund will not itself use leverage and the Sub- Fund’s global exposure to FDIs (based on the settlement price of the WTI Futures Contracts) will not exceed 100% of its Net Asset Value."
1125,The Manager will seek to carry out the rolling of the Sub-Fund according to the rolling strategy as stated in the Index methodology with the aim to closely track the Index (see “Futures Roll” under “What is the Index” section below).
1126,"For the Sub-Fund, under normal market conditions the roll will take place over a 5-day period per month as stated in the Index methodology."
1127,"Under exceptional market conditions, the Manager may, in its discretion, deviate from the rolling strategy and/or rolling schedule as mentioned above in the best interests of the Sub-Fund and the Unitholders and for the protection of the Sub-Fund."
1128,The investment strategy of the Sub-Fund is subject to the investment and borrowing restrictions set out in Part 1 of this Prospectus save as varied under the “Investment restriction” section below.
1129,Use of derivatives The Sub-Fund’s net derivative exposure may be more than 50% but up to 100% of the Sub-Fund’s Net Asset Value.
1130,Overview of the crude oil market What is crude oil?
1131,"Crude oil is a naturally occurring, unrefined petroleum product composed of hydrocarbon deposits and other organic materials."
1132,"Crude oil can be refined to produce usable products such as gasoline, diesel and various forms of petrochemicals."
1133,"It is a non-renewable resource, also known as a fossil fuel, which means that it cannot be replaced naturally at the rate people consume it and is therefore a limited resource."
1134,91 Crude oil supply Crude oil production by the Organization of the Petroleum Exporting Countries (“OPEC”) is an important factor that affects oil prices.
1135,This organisation seeks to actively manage oil production in its member countries by setting production targets.
1136,"Historically, crude oil prices have seen increases in times when OPEC production targets are reduced."
1137,OPEC member countries produce about 43% of the world’s crude oil.
1138,"Equally important to global prices, 79.4% of the world's proven oil reserves are located in OPEC Member Countries."
1139,"Because of this market share, OPEC’s actions can, and do, influence international oil prices."
1140,"In particular, indications of changes in crude oil production from Saudi Arabia, OPEC's largest producer, frequently affect oil prices."
1141,"The extent to which OPEC member countries utilise their available production capacity is often used as an indicator of the tightness of global oil markets, as well as an indicator of the extent to which OPEC is exerting upward influence on prices."
1142,OPEC spare capacity provides an indicator of the world oil market's ability to respond to potential crises that reduce oil supplies.
1143,"As a result, oil prices tend to incorporate a rising risk premium when OPEC spare capacity reaches low levels."
1144,"Markets are influenced by geopolitical events within and between OPEC countries because they have, historically, resulted in reductions in oil production."
1145,"Given OPEC's market significance, events that entail an actual or future potential loss of oil supplies can produce strong reactions in oil prices."
1146,Oil production from countries outside the OPEC currently represents about 57% of world oil production.
1147,"Key centres of non-OPEC production include North America, regions of the former Soviet Union and the North Sea."
1148,"In contrast to OPEC oil production, which is subject to central coordination, non-OPEC producers make independent decisions about oil production."
1149,"Also, in contrast to OPEC, where oil production is mostly in the hands of national oil companies (“NOCs”), international or investor-owned oil companies (“IOCs”) perform most of the production activities in non-OPEC countries."
1150,IOCs seek primarily to increase shareholder value and make investment decisions based on economic factors.
1151,"While some NOCs operate in a similar manner as IOCs, many have additional objectives such as providing employment, infrastructure or revenue that impact their country in a broader sense."
1152,"As a result, non-OPEC investment and thus future supply capability, tends to respond more readily to changes strictly in market conditions."
1153,"Producers in non-OPEC countries are generally regarded as price takers, that is, they respond to market prices rather than attempt to influence prices by managing production."
1154,"As a result, non-OPEC producers tend to produce at or near full capacity and so have little spare capacity."
1155,"Crude oil demand OECD consists of the United States, much of Europe, and other advanced countries."
1156,"At 53% of world oil consumption in 2010, these large economies consume more oil than the non-OECD countries, but have much lower oil consumption growth."
1157,"Oil consumption in the OECD countries actually declined in the decade between 2000 and 2010, whereas non-OECD consumption rose 40% during the same period."
1158,"Structural conditions in each country's economy influence the relationships among oil prices, economic growth and oil consumption."
1159,Developed countries tend to have higher vehicle ownership per capita.
1160,"Because of this, oil use within the OECD transportation sector usually accounts for a larger share of total oil consumption than in non-OECD countries."
1161,It is also more mature and slower- growing.
1162,Economic conditions and policies that affect the transport of goods and people thus have a significant impact on total oil consumption in OECD countries.
1163,Many OECD countries have higher fuel taxes and policies to improve the fuel economy of new vehicles and increase the use of biofuels.
1164,This tends to slow the growth in oil consumption even in times of strong economic growth.
1165,"Furthermore, the economies in OECD countries tend to have larger service sectors relative to manufacturing."
1166,"As a result, strong economic growth in these countries may not have the same impact on oil consumption as it would in non-OECD countries."
1167,"OECD countries tend to have fewer subsidies on end-use prices, so changes in market oil prices are often quickly reflected in prices faced by consumers."
1168,"However, it takes time for people to adjust 92 their transportation routines and for the vehicle stock to turn over and become more energy-efficient in response to price changes."
1169,Changes in expected future oil prices also affect consumers’ decisions concerning modes of transportation and vehicle purchases.
1170,"If prices are expected to remain high or increase in the future, more consumers may decide to purchase more fuel efficient vehicles or use public transportation."
1171,Decisions like these help to reduce future oil demand and would tend to moderate expected price increases.
1172,"Oil consumption in the OECD countries declined from 49% in 2014 to 44% in 2024, non-OECD oil consumption increased from 51% in 2014 to 56% in 2024."
1173,China and India showed strong growth in oil consumption among the countries in the non-OECD during this period.
1174,Rising oil consumption reflects rapid economic growth in these countries.
1175,Current and expected levels of economic growth heavily influence global oil demand and oil prices.
1176,"Commercial and personal transportation activities, in particular, require large amounts of oil and are directly tied to economic conditions."
1177,"Many manufacturing processes consume oil as fuel or use it as feedstock, and in some non-OECD countries, oil remains an important fuel for power generation."
1178,"Because of these uses, oil prices tend to rise when economic activity and in turn oil demand is growing strongly."
1179,"Many non-OECD countries are also experiencing rapid growth in population, which is an additional factor supporting strong oil consumption growth."
1180,Structural conditions in each country’s economy further influence the relationship between oil prices and economic growth.
1181,"Developing countries tend to have a greater proportion of their economies in manufacturing industries, which are more energy intensive than service industries."
1182,"Although transportation oil use is usually a smaller share of total oil consumption in non-OECD countries, this use tends to increase rapidly as expanding economies increase the need to move goods and people."
1183,Vehicle ownership per capita is also highly correlated with rising incomes and has much room to grow in non-OECD countries.
1184,"For these reasons, non-OECD economic growth rates tend to be an important factor affecting oil prices."
1185,China's strong economic growth has recently resulted in that country becoming the largest energy consumer and second largest oil consumer in the world.
1186,"In addition, China's rising oil consumption has been a major contributor to incremental growth in worldwide oil consumption."
1187,US Energy Information Administration projects that virtually all the net increase in oil consumption in the next 25 years will come from non-OECD countries.
1188,"Although oil use is clearly tied to economic activity, energy policies also significantly affect that relationship."
1189,"Many developing countries, for example, control or subsidize end-use prices, which inhibits consumer response to market price changes."
1190,This reduced demand response to price changes further contributes to the importance of economic growth as a key driver of non-OECD demand and in turn global oil prices.
1191,"Crude oil prices Crude oil prices measure the spot price of various barrels of oil, most commonly either the West Texas Intermediate (“WTI”) or the Brent Blend."
1192,The OPEC basket price and the NYMEX futures price are also sometimes quoted.
1193,WTI crude oil is of very high quality because it is light-weight and has low sulphur content.
1194,"For these reasons, it is often referred to as “light, sweet” crude oil."
1195,These properties make it excellent for making gasoline.
1196,That is why it is the major benchmark of crude oil in the Americas.
1197,Please refer to “What is WTI crude oil” below for more information on WTI crude oil.
1198,Brent Blend is a combination of crude oil from 15 different oil fields in the North Sea.
1199,"It is less “light” and “sweet” than WTI, but still excellent for making gasoline."
1200,It is refined in Northwest Europe and is the primary benchmark for other crude oil in Europe or Africa.
1201,"As crude oil is traded in a global market, prices of the many crude oil streams produced globally tend to move closely together, although there are persistent differentials between light-weight, low- sulphur (light-sweet) grades and heavier, higher-sulphur (heavy-sour) crudes that are lower in quality."
1202,"93 Both crude oil and petroleum product prices can be affected by events that have the potential to disrupt the flow of oil and products to market, including geopolitical and weather-related developments."
1203,"These types of events may lead to actual disruptions or create uncertainty about future supply or demand, which can lead to higher volatility in prices."
1204,The volatility of oil prices is inherently tied to the low responsiveness or “inelasticity” of both supply and demand to price changes in the short run.
1205,Both oil production capacity and the equipment that use petroleum products as their main source of energy are relatively fixed in the near term.
1206,"It takes years to develop new supply sources or vary production, and it is very hard for consumers to switch to other fuels or increase fuel efficiency in the near term when prices rise."
1207,"Under such conditions, a large price change can be necessary to re-balance physical supply and demand following a shock to the system."
1208,"Much of the world’s crude oil is located in regions that have been prone historically to political upheaval, or have had their oil production disrupted due to political events."
1209,"Several major oil price shocks have occurred at the same time as supply disruptions triggered by political events, most notably the Arab Oil Embargo in 1973-74, the Iranian revolution and Iran-Iraq war in the late 1970s and early 1980s, and Persian Gulf War in 1990."
1210,"More recently, disruptions to supply (or curbs on potential development of resources) from political events have been seen in Nigeria, Venezuela, Iraq, Iran and Libya."
1211,"Given the past history of oil supply disruptions emanating from political events, market participants are always assessing the possibility of future disruptions and their potential impacts."
1212,"In addition to the size and duration of a potential disruption, they also consider the availability of crude stocks and the ability of other producers to offset a potential supply loss."
1213,"For example, if the market has ample spare production capacity to offset a possible disruption, its likely impact on prices would be smaller than if spare production capacity was much lower."
1214,"When there are significant concerns about the potential for a disruption at a time when spare capacity and inventories are not seen as sufficient to substantially offset the associated loss in supply, prices may be above the level that might be expected if only current demand and supply were considered, as forward-looking behaviour adds a “risk premium”."
1215,Weather can also play a significant role in oil supply.
1216,"Hurricanes in 2005, for example, shut down oil and natural gas production as well as refineries."
1217,"As a result, petroleum product prices increased sharply as supplies to the market dropped."
1218,"Severely cold weather can strain product markets as producers attempt to supply enough of the product, such as heating oil, to consumers in a short amount of time, resulting in higher prices."
1219,"Other events such as refinery outages or pipeline problems can restrict the flow of oil and products, driving up prices."
1220,"94 However, the influence of these types of factors on oil prices tends to be relatively short lived."
1221,"Once the problem subsides and oil and product flows return to normal, prices usually return to previous levels."
1222,"Oil price, oil futures and financial market Market participants not only buy and sell physical quantities of oil, but also trade contracts for the future delivery of oil and other energy derivatives."
1223,"One of the roles of futures markets is price discovery, and as such, these markets play a role in influencing oil prices."
1224,"Oil market trading activity involves a range of participants with varying motivations, even within individual participants."
1225,"Some, such as oil producers and airlines, have a significant commercial exposure to changes in the price of oil and petroleum-based fuels, and may seek to hedge their risk by buying and selling energy derivatives."
1226,"For example, an airline may want to buy futures or options in order to avoid the possibility that its future fuel costs will rise above a certain level, while an oil producer may want to sell futures in order to lock in a price for its future output."
1227,"Banks, hedge funds, commodity trading advisors, and other money managers who often do not have interests in trading physical oil are also active in the market for energy derivatives to try to profit from changes in prices."
1228,"In recent years, investors have also shown interest in adding energy and other commodities as alternatives to equity and bond investments to diversify their portfolios or to hedge inflation risks."
1229,"Banks, hedge funds and other “non-commercial” investors can add liquidity to futures and derivative markets by taking the other side of transactions with commercial participants."
1230,"On the other hand, concerns have been raised that non-commercial commodity trading and investment may amplify price movements, particularly at times when momentum is running strongly in a particular direction."
1231,Activity in commodity exchange contracts has risen in recent years.
1232,"One measure of activity in futures markets is open interest on exchanges, which indicates the number of contracts in a trading session that have not been settled or closed."
1233,"Open interest on exchange-traded crude oil futures contracts increased substantially over the past decade, as measured by the NYMEX, the main commodities exchange for energy products in the United States."
1234,"95 Both commercial participants with “real” demand for oil and non-commercial investors, such as money managers and funds that are interested in trading contracts for investment and diversification purposes, have shown increased trading activity."
1235,"In addition to Futures Contracts, another way for market participants to invest in crude oil is through the buying and selling of options contracts."
1236,Options allow for investment exposure with limited potential for losses and provide an insurance-like instrument against adverse commodity price movements.
1237,What is WTI crude oil?
1238,"West Texas Intermediate (WTI) crude oil, also known as Texas light sweet, is a grade of crude oil used as a benchmark in oil pricing."
1239,WTI consists of a blend of several U.S.
1240,domestic streams of light sweet crude oil.
1241,"As a pricing mechanism for physical delivery of crude oil in North America, WTI is firmly rooted in the physical market."
1242,"Because of the unique immediacy, breadth, and depth of pricing and inventory data supplied by the U.S."
1243,"government, and because onshore North American production has been a key driver of growing global crude oil supply over the past decade, WTI is widely regarded as the crude oil benchmark that reflects the supply and demand dynamics of the market."
1244,"This grade is described as light because of its relatively low density, and sweet because of its low sulphur content."
1245,"Due to its high viscosity and low sulphur content, WTI crude oil can produce a high yield of gasoline during the refining process."
1246,WTI crude oil is the underlying commodity of the WTI Futures Contracts.
1247,What are WTI Futures Contracts?
1248,WTI Futures Contracts are West Texas Intermediate crude oil Futures Contract traded on the NYMEX in USD.
1249,"The parent company of NYMEX is CME Group Inc., which is an American futures company and one of the largest futures and options exchanges."
1250,"It comprises four exchanges, namely Chicago Mercantile Exchange (“CME”), Chicago Board of Trade (“CBOT”), NYMEX and Commodity Exchange Inc."
1251,(“COMEX”).
1252,"WTI Futures Contract is one of the deepest and most liquid global energy benchmarks, trading nearly 1,200,000 futures and options contracts daily."
1253,"The open interest of WTI Futures Contracts exceeds 2.8 million lots, equivalent to more than 2.8 billion barrels."
1254,"WTI Futures Contracts have the following characteristics: (a) WTI Futures Contracts provide a basic unit of account in increments of 1,000 barrels and minimum fluctuation as USD0.01 per barrel."
1255,(b) WTI Futures Contracts are listed nine years forward using the following listing schedule: consecutive months are listed for the current year and the next five years.
1256,"In addition, the June and December contract months are listed beyond the sixth year."
1257,"Additional months will be added on an annual basis after the December contract expires, so that an additional June and December contract would be added nine years forward, and the consecutive months in the sixth calendar year will be filled in."
1258,(c) Market participants can trade WTI Futures Contracts on CME Globex from Sunday to Friday 6:00 p.m.
1259,to 5:00 p.m.
1260,(EST) with a 60-minute break each day beginning at 5:00 p.m.
1261,(Chicago time).
1262,(d) Trading in the current delivery month shall cease on the third business day prior to the twenty-fifth calendar day of the month preceding the delivery month.
1263,"If the twenty-fifth calendar day of the month is a non-business day, trading shall cease on the third business day prior to the last business day preceding the twenty-fifth calendar day."
1264,"(e) Upon a transaction’s acceptance by CME Clearing, a central counterparty imposes itself as the legal counterparty to every trade, which effectively eliminates counterparty risks between market participants."
1265,"This substitution of counterparties is accomplished through 96 the legal process of contract novation, which discharges the contract between the original trading counterparties and creates two new, legally binding contracts – one between each of the original trading counterparties and CME Clearing."
1266,(f) The margin requirement of WTI Futures Contracts is subject to change.
1267,"Currently, margin requirements of June 2025 WTI Futures Contracts are USD6,030 as the initial margin and USD5,482 as the maintenance margin."
1268,"(g) CME Clearing accepts a wide range of collateral for deposit into trading accounts, including USD, select foreign currencies, U.S."
1269,"Treasuries, select foreign sovereign debt, asset- backed securities and agency bonds."
1270,(h) CME Clearing manage the collateral based on future’s daily settlement price which is based on CME Globex VWAP between 2:28 p.m.
1271,and 2:30 p.m.
1272,Eastern Time.
1273,"(i) The position limit is 3,000 contracts for “initial spot-month” limit for contracts that will expire in the current month only."
1274,"By way of example, as at early July 2020, August2020 contracts are “initial spot-month” contracts which will expire in July 2020."
1275,Effective date is close of 3 business days prior to the last trading date of the contract.
1276,The position limit is level which a market participant may not exceed unless it has an approved exemption.
1277,"(j) The single month accountability level is 10,000 contracts and all month accountability level is 20,000 contracts."
1278,Position accountability levels are levels which a market participant may exceed and not be in violation of CME rule.
1279,A market participant who exceeds an accountability level and/or a reportable level may be asked by CME Group Inc.
1280,to provide information relating to the position.
1281,Failure to supply the requested information may result in an order to reduce such positions.
1282,(k) The reportable level is 350 contracts.
1283,"The reportable level is level at which clearing members, omnibus accounts and foreign brokers are required to submit to CME a daily report of all positions."
1284,"(l) If the lead contract month (as identified by NYMEX) is bid or offered at the upper or lower price fluctuation limit at the first special price fluctuation limit level (currently USD10/barrel), it will be considered a triggering event that will begin a two (2) minute monitoring period in the lead contract month."
1285,"If, at the end of the two (2) minute monitoring period, the lead contract month of the Futures Contract is not bid or offered at the applicable special price fluctuation limit, the special price fluctuation limits shall be expanded an additional increment above and below the previous day's settlement price for all contract months of the Futures Contracts."
1286,"If, however, at the end of the two (2) minute monitoring period, the lead contract month of the Futures Contract is bid or offered at the applicable special price fluctuation limit, a two (2) minute temporary trading halt will commence in all contract months of the futures contract."
1287,"Following the end of a temporary trading halt, NYMEX shall re-open simultaneously in all contract months of the Futures Contract."
1288,"When trading resumes, the special price fluctuation limits shall be expanded an additional increment above and below the previous day's settlement price for all contract months of the Futures Contract."
