sentence_id,text
0,"IMPORTANT: If you are in any doubt about the contents of this Prospectus, you should consult your stockbroker, bank manager, solicitor, accountant or other financial adviser for independent financial advice."
1,Samsung S&P GSCI Crude Oil ER Futures ETF (the “Sub-Fund”) is a futures-based exchange traded fund .
2,Investment in the Sub -Fund is only suitable to those investors who are in a financial position to assume the risks involved in futures investments.
3,"Futures investments are subject to certain key risks including leverage, counterparty and liquidity risks."
4,Movement in the prices of futures may be highly volatile.
5,The Sub -Fund may not be suitable for all investors.
6,It is possible that the entire value of your investment could be lost .
7,Please refer to the “ Risk Factors” section in this Prospectus as well as the “Risk factors specific to the Sub-Fund” section in each Appendix.
8,SAMSUNG ETFS TRUST (a Hong Kong umbrella unit trust authorised under Section 104 of the Securities and Futures Ordinance (Cap.
9,"571) of Hong Kong) Samsung S&P GSCI Crude Oil ER Futures ETF HKD Counter Stock Code: 03175 PROSPECTUS Manager Samsung Asset Management (Hong Kong) Limited 三星資產運用（香港）有限公司 Investment Adviser Samsung Asset Management Co., Limited Listing Agent Altus Capital Limited 29 September 2017 Hong Kong Exchanges and Clearing Limited (“HKEx”), The Stock Exchange of Hong Kong Limited (the “SEHK”) , Hong Kong Securities Clearing Company Limited (“HKSCC”) and the Hong Kong Securities and Futures Commission (the “SFC”) take no responsibility for the contents of this Prospectus, make no representation as to its accuracy or completeness and expressly disclaim any liability whatsoever for any loss howsoever arising from or in reliance upon the whole or any part of the contents of this Prospectus."
10,The Trust and the Sub -Fund have each been authorised as collective investment schemes by the SFC.
11,SFC authorisation is not a recommendation or endorsement of a scheme nor does it guarantee the commercial merits of a sc heme or its performance.
12,It does not mean the scheme is suitable for all investors nor is it an endorsement of its suitability for any p articular investor or class of investors.
13,"i IMPORTANT INFORMATION This Prospectus relates to the offer in Hong Kong of units (the “Units”) in the Samsung ETFs Trust (the “Trust”), an umbrella unit trust established under Hong Kong law by a trust deed dated 13 January 2015 (the “Trust Deed”) between Samsung Asset Management (Hong Kong) Limited 三星資產運用 （香港） 有限公司 (the “Manager”) and HSBC Institutional Trust Services (Asia) Limited (the “Trustee”)."
14,The Trust may have one or more sub-funds (the “Sub-Funds” or individually a “Sub-Fund”) which are exchange traded funds.
15,The information contained in this Prospectus has been prepared to assist potential investors in making an informed decision in relation to investing in the Sub -Funds.
16,It contains important facts about the Sub -Funds whose Units are offered in accordance with this Prospectus.
17,"A product key facts statement which conta ins the key features and risks of each of the Sub -Funds is also issued by the Manager and such product key facts statement shall form part of this Prospectus, and shall be read, in conjunction with, this Prospectus."
18,"The Manager accepts full responsibility for the accuracy of the information contained in this Prospectus and confirms having made all reasonable enquiries, that to the best of its knowledge and belief there are no other facts the omission of which would make any statement misleading."
19,"The Manag er also confirms that this Prospectus includes particulars given in compliance with the Rules Governing the Listing of Securities on the Stock Exchange of Hong Kong Limited and the Code on Unit Trusts and Mutual Funds (the “Code”) and the “Overarching Prin ciples” of the SFC Handbook for Unit Trusts and Mutual Funds, Investment -Linked Assurance Schemes and Unlisted Structured Investment Products for the purposes of giving information with regard to the Units."
20,"The Trustee is not responsible for the preparati on of this Prospectus and shall not be held liable to any person for any information disclosed in this Prospectus, except for the information regarding the Trustee itself under the paragraph headed “The Trustee and Registrar” in the section on “Management of the Trust”."
21,Currently the only Sub-Fund is a collective investment scheme falling within Chapters 8.6 and 8.4A and Appendix I of the Code.
22,The Trust and each Sub-Fund is authorised by the SFC in Hong Kong under Section 104 of the Securities and Futures Ordinance.
23,"The SFC takes no responsibility for the financial soundness of the Trust, any Sub-Fund or for the correctness of any statements made or opinions expressed in this Prospectus."
24,SFC authorisation is not a recommendation or endorsement of a sc heme nor does it guarantee the commercial merits of a scheme or its performance.
25,It does not mean the scheme is suitable for all investors nor is it an endorsement of its suitability for any particular investor or class of investors.
26,"You should consult y our financial adviser, consult your tax advisers and take legal advice as appropriate as to whether any governmental or other consents are required, or other formalities need to be observed, to enable you to acquire Units as to whether any taxation effects , foreign exchange restrictions or exchange control requirements are applicable and to determine whether any investment in a Sub-Fund is appropriate for you."
27,Dealings in the Units of Samsung S&P GSCI Crude Oil ER Futures ETF on The Stock Exchange of Hong Kong Limited (the “SEHK”) have already commenced.
28,"The Units of Samsung S&P GSCI Crude Oil ER Futures ETF have been accepted as eligible securities by Hong Kong Securities Clearing Company Limited (“HKSCC”) for deposit, clearance and settlement in the Centr al Clearing and Settlement System (“CCASS”)."
29,Settlement of transactions between participants of the SEHK is required to take place in CCASS on the second CCASS Settlement Day after any trading day.
30,All activities under CCASS are subject to the General Rule s of CCASS and CCASS Operational Procedures in effect from time to time.
31,"No action has been taken to permit an offering of Units or the distribution of this Prospectus in any jurisdiction other than Hong Kong and, accordingly, this Prospectus does not con stitute an offer or solicitation to anyone in any jurisdiction in which such offer is not authorised or to any person to whom it is unlawful to make such offer or solicitation."
32,"The Units have not been, and will not be, registered under the United States S ecurities Act of 1933, as amended (the “US Securities Act”) or any other United States Federal or State law and, except in a transaction which does not violate the US Securities Act, may not be directly or indirectly offered to or sold in the United States of America or any of its territories or for the benefit of a US Person (as defined in Regulation S of the US Securities Act)."
33,"The Trust and the Sub-Funds have not been and will not be registered as an investment company under the United States Investment Company Act of 1940, as amended."
34,"Units may not be acquired or owned by (i) an employee benefit plan, as defined in Section 3(3) of the Employee Retirement Income Security Act of 1974, as amended (“ERISA”), that is subject to Title I of ERISA, (ii) a plan, as defined in Section 4975(e)(1) of the US Internal Revenue Code of 1986, as amended (the “Internal Revenue Code”), that is subject to Section 4975 of the Internal Revenue Code, (iii) a plan that is subject to any other law, regulation, rule or restriction that is substantially similar to ERISA or Section 4975 of the Internal Revenue Code (“Similar Law”) or (i v) an entity whose assets are deemed to include the assets of such an employee benefit plan or plan for purposes of ERISA, Section 4975 of the Inter nal Revenue Code or Similar Law, unless the purchase, holding and disposition of units will not constitute a violation under ERISA, Section 4975 of the Internal Revenue Code and any applicable Similar Law."
35,"Furthermore, distribution of this Prospectus shall not be permitted unless it is accompanied by a copy of the latest ii annual financial statements of the Sub-Fund(s) (where existing) and, if later, its most recent interim report."
36,"You should note that any amendment or addendum to this Prospectus will only be posted on the Manager’s website (www.samsungetf.com.hk) the contents of which, and of any other websites referred to in this Prospectus, have not been reviewed by the SFC."
37,This Prospectus may refer to inform ation and materials included in websites.
38,Such information and mate rials do not form part of this Prospectus and they have not been reviewed by the SFC or any regulatory body.
39,Investors should note that the information provided in websites may be updated and changed periodically without any notice to any person.
40,Questions and Complaints Investors may raise any questions on or make any complaints about the Trust (including the Sub -Funds) by contacting the Manager at its address as set out in the Directory of this Prospectus or calling the Manager on +852 2115 6365 during normal office hours.
41,"iii DIRECTORY Manager Samsung Asset Management (Hong Kong) Limited 三星資產運用（香港）有限公司 4513-14, Two International Finance Centre 8 Finance Street Central Hong Kong Investment Adviser Samsung Asset Management Co., Limited 55 Sejong-daero Jung-gu Seoul 100-715 Korea Trustee and Registrar HSBC Institutional Trust Services (Asia) Limited 1 Queen’s Road Central Hong Kong Listing Agent Altus Capital Limited 21 Wing Wo Street Central Hong Kong Participating Dealers* China Merchants Securities (HK) Co., Ltd 48/F, One Exchange Square Central Hong Kong Guotai Junan Securities (Hong Kong) Ltd 27th Floor, Low Block Grand Millennium Plaza 181 Queen’s Road, Central Hong Kong Market Makers* China Merchants Securities (HK) Co., Ltd 48/F, One Exchange Square Central Hong Kong Commerz Securities Hong Kong Ltd 15/F, Lee Garden One 33 Hysan Avenue Causeway Bay Hong Kong ABN AMRO Clearing Hong Kong Ltd Level 70, International Commerce Centre 1 Austin Road West Kowloon Hong Kong Auditors Deloitte Touche Tohmatsu 35/F One Pacific Place 88 Queensway Hong Kong Nomura International (Hong Kong) Ltd 30/F, Two International Finance Centre 8 Finance Street Central Hong Kong Legal Counsel to the Manager Simmons & Simmons 13/F, One Pacific Place 88 Queensway Hong Kong Morgan Stanley Hong Kong Securities Ltd Level 46, International Commerce Centre 1 Austin Road West Kowloon Hong Kong Service Agent HK Conversion Agency Services Limited 1/F One & Two Exchange Square 8 Connaught Place Central Hong Kong * Please refer to the Manager’s website for the latest lists of Market Makers and Participating Dealers for each of the Sub-Funds."
42,"iv CONTENTS PART 1 – GENERAL INFORMATION RELATING TO THE TRUST AND SUB-FUNDS 5 DEFINITIONS 6 INTRODUCTION 12 THE OFFERING PHASES 13 INVESTMENT OBJECTIVE, INVESTMENT STRATEGY, INVESTMENT RESTRICTIONS, SECURITIES LENDING AND BORROWING 17 CREATIONS AND REDEMPTIONS (PRIMARY MARKET) 21 EXCHANGE LISTING AND TRADING (SECONDARY MARKET) 33 DETERMINATION OF NET ASSET VALUE 34 FEES AND EXPENSES 37 RISK FACTORS 40 MANAGEMENT OF THE TRUST 50 STATUTORY AND GENERAL INFORMATION 56 TAXATION 62 PART 2 – SPECIFIC INFORMATION RELATING TO EACH SUB-FUND 65 APPENDIX 1: SAMSUNG S&P GSCI CRUDE OIL ER FUTURES ETF 5 PART 1 – GENERAL INFORMATION RELATING TO THE TRUST AND SUB-FUNDS Part 1 of this Prospectus includes information relevant to the Trust and all Sub-Funds established under the Trust and listed on the SEHK."
43,The information pr esented in this Part 1 should be read in conjunction with the information presented in the relevant Appendix in Part 2 of this Prospectus in respect of a particular Sub-Fund.
44,"Where the information in Part 2 of this Prospectus conflicts with the informatio n presented in this Part 1, the information in the relevant Appendix in Part 2 prevails, however, it is applicable to the specific Sub -Fund of the relevant Appendix only."
45,Please refer to Part 2 “Specific Information Relating to Each Sub-Fund” for further information.
46,"6 DEFINITIONS In this Prospectus (including the relevant Appendix for any Sub-Fund), unless the context requires otherwise, the following expressions have the meanings set out below."
47,"Other capitalised terms used, but not defined, have the meaning given to those terms in the Trust Deed."
48,“After Listing” means the period which commences on the Listing Date and continues until the Sub-Fund(s) is/are terminated.
49,“Appendix” means an appendix to this Prospectus that sets out specific information applicable to a Sub-Fund.
50,"“Application” means an application by a Participating Dealer for the creation or redemption of Units in accordance with the procedures for creation and redemption of Units set out in the Operating Guidelines, the relevant Participation Agreement and the terms of the Trust Deed."
51,"“Application Unit” means, in relation to each Sub -Fund, such number of Units or whole multiples thereof as specified in this Prospectus or such other number of Units determined by the Manager, approved by the Trustee and notified by the Manager to the Participating Dealers."
52,"“Business Day” in respect of the Sub -Fund(s), means, unless the Manager and the Trustee otherwise agree, a day on which (a)(i) the SEHK is open for normal trading; and (ii) the relevant market on which Securities and/or Futures Contracts, as the case may be, are traded is open for normal trading , or (iii) if there are more than one such market, the market designated by the Manager is open for normal trading, and (b) the Index is compiled and published, or such other day or days as the Manager and the Trustee may agree from time to time provided that if on any such day, the period during which the relevant securities market is open for normal trading is reduced as a result of a Number 8 Typhoon Signal, Black Rainstorm warning or other similar event, such day shall not be a Business Day unless the Manager and the Trustee otherwise agree."
53,"“Cancellation Compensation” means an amount payable by a Participating Dealer for the account of the Sub -Fund i n respect of a Default, as set out in the Trust Deed and in the Operating Guidelines applicable at the time the relevant Creation Application or Redemption Application is made."
54,“CCASS” means the Central Clearing and Settlement System established and operat ed by HKSCC or any successor system operated by HKSCC or its successors.
55,“CCASS Settlement Day” means the term “Settlement Day” as defined in the General Rules of CCASS.
56,“CFTC” means Commodity Futures Trading Commission of the United States or its successors.
57,“Code” means the Code on Unit Trusts and Mutual Funds issued by the SFC (as amended or replaced from time to time).
58,"“Connected Person” has the meaning as set out in the Code which at the date of this Prospectus means in relation to a company: (a) any p erson or company beneficially owning, directly or indirectly, 20% or more of the ordinary share capital of that company or able to exercise directly or indirectly, 20% or more of the total votes in that company; or (b) any person or company controlled by a person who or which meets one or both of the descriptions given in (a); or (c) any member of the group of which that company forms part; or (d) any director or officer of that company or of any of its connected persons as defined in (a), (b) or (c)."
59,7 “Creation Application” means an application by a Participating Dealer for the creation and issue of Units in an Application Unit size in accordance with the Operating Guidelines and the Trust Deed.
60,"“Dealing Day” means each Business Day during the continuance of the relevant Sub-Fund, and/or such other day or days as the Manager may from time to time determine with the approval of the Trustee."
61,"“Dealing Deadline” in relation to any particular place and any particular Dealing Day, means the time on each Dealing Day specified in the “The Offering Phases” section of this Prospectus or such other time or day as the Manager may from time to time determine with the approval of the Trustee."
62,“Default” means a failure by a Participating Dealer in respect of: (a) a Creation Application to deliver the relevant cash amount; or (b) a Redemption Application to deliver the Units the subject of the Redemption Application and/or relevant cash amount.
63,"“Deposited Property” means, in respect of each Sub-Fund, all the assets (includin g Income Property), received or receivable by the Trustee, for the time being held or deemed to be held upon the trusts and subject to the terms of the Trust Deed for the account of the Sub -Fund(s) but excluding (i) the Income Property standing to the cred it of the distribution account of such Sub-Fund (other than interest earned thereon) and (ii) any such other amount for the time being standing to the credit of the distribution account of such Sub-Fund."
64,"“Dual Counter” means the facility by which the Units of a Sub-Fund traded in RMB and traded in HKD are each assigned separate stock codes on the SEHK and are accepted for deposit, clearing and settlement in CCASS in more than one eligible currency (RMB or HKD) as described in the relevant Appendix of this Prospectus."
65,"“Duties and Charges” means, in relation to any particular transaction or dealing, all stamp and other duties, taxes, government charges, brokerage, bank charges, transfer fees, registration fees, transaction levies and other duties and charges w hether in connection with the constitution of the Deposited Property or the increase or decrease of the Deposited Property or the creation, issue, transfer, cancellation or redemption of Units or the acquisition or disposal of Securities and/or Futures Contracts (as the case may be) or otherwise which may have become or may be payable in respect of, and whether prior to, upon or after the occasion of, such transaction or dealing and including but not limited to, in relation to an issue of Units or redemption of Units, a charge (if any) of such amount or at such rate as is determined by the Manager or the Trustee to be made for the purpose of compensating or reimbursing the Trust for the difference between (a) the prices used when valuing the Securities and/or Futures Contracts (as the case may be) in the Trust Fund for the purpose of such issue or redemption of Units and (b) (in the case of an issue of Units) the prices which would be used when acquiring the same Securities and/or Futures Contracts (as the case may be) if they were acquired by the Trust with the amount of cash received by the Trust upon such issue of Units and (in the case of a redemption of Units) the prices which would be used when selling the same Securities and/or Futures Contracts (as the case may be) if they were sold by the Trust in order to realise the amount of cash required to be paid out of the Trust Fund upon such redemption of Units."
66,"“Encumbrance” means any mortgage, charge, pledge, lien, third party right or interest, any other encumbrance or security interest of any kind or another type of preferential arrangement (including, without limitation, a title transfer or retention arrangement) having similar effect other than any such encumbrance or security interest imposed by the term s of the relevant clearing system/depositary or otherwise created by the terms of the Participation Agreement, the Trust Deed or any agreement between the Manager, the Trustee and the relevant Participating Dealer."
67,"“Extension Fee” means the fee payable to the Trustee on each occasion the Manager, upon a Participating Dealer’s request, grants the Participation Dealer an extended settlement in respect of a Creation Application or Redemption Application."
68,8 “Futures Contract” means any futures contract which is traded on any Futures Exchange.
69,“Futures Exchange” means the Hong Kong Futures Exchange Limited.
70,"“HKD” means Hong Kong dollars, the lawful currency of Hong Kong."
71,“HKEx” means Hong Kong Exchanges and Clearing Limited or its successors.
72,“HKSCC” means the Hong Kong Securities Clearing Company Limited or its successors.
73,“IFRS” means International Financial Reporting Standards.
74,"“Income Property” means, in respect of each Sub-Fund, (a) all interest, dividends and other sums deemed by the Trustee, (after consulting the auditors either on a general or case by case basis), to be in the nature of income (including taxation repayments, if any) received or receivable by the Trustee in respect of the Deposited Property of the relevant Sub-Fund (whether in cash or, without limitation, by warrant, cheque, money, credit or otherwise or the proceeds of sale or transfer of any Income Property received in a form other than cash); (b) all interest and other sums received or receivable by the Trustee in respect of (a), (c) or (d) of this definition; (c) all cash payments received or receivable by the Trustee for the account of the relevant Sub-Fund in respect of an Application; and (d) all Cancellation Compensation received by the Trustee for the account of the relevant Sub-Fund; (e) any payments to be received or are receivable by the Trustee under any contractual agreements in the nature of investments for the benefit of the relevant Sub -Fund but excluding (i) the Deposited Property; (ii) any amount for the time being standing to the credit of the distribution account for the account of the relevant Sub-Fund(s) or previously distributed to Unitholders; (iii) gains for the account of the relevant Sub-Fund arising from the realisation of Securities and/or Futures Contracts (as the ca se may be) ; and (iv) any sums applied towards payment of the fees, costs and expenses payable by the Trust from the Income Property of the relevant Sub-Fund; “Index” means, in respect of a Sub -Fund, the index against which the relevant Sub -Fund is benchmarked as set out in the relevant Appendix."
75,"“Index Provider” means, in respect of a Sub-Fund, the person responsible for compiling the Index against which the relevant Sub -Fund benchmarks its investments and who holds the right to licence the use of such Index to the relevant Sub-Fund as set out in the relevant Appendix."
76,"“Initial Issue Date” means the date of the first issue of Units, which shall be , unless otherwise specified in the relevant Appendix, the Business Day immediately before the Listing Date."
77,"“Initial Offer Period” means, in respect of each Sub -Fund(s) the period before the relevant Listing Date as set out in the relevant Appendix."
78,“Insolvency Event” occurs in relation to a person where (i) an order has been made or an effective resolution passed for the liquidation or bankruptcy of the person; (ii) a receiver or similar officer has been appointed in respect of the person or of any of the person’s assets or the person becomes subject to an administration order; (iii) the person enters into an arran gement with one or more of its creditors or is deemed to be unable to pay its debts; (iv) the person ceases or threatens to cease to carry on its business or substantially the whole of its business or makes or threatens to make any material alteration to t he nature of its business; or (v) the Manager in good faith believes that any of the above is likely to occur.
79,"“Investment Adviser” means in respect of each Sub -Fund, unless otherwise stated in the relevant Appendix, Samsung Asset Management Co., Limited."
80,"“Issue Price” means the price at which Units may be issued, determined in accordance with the Trust Deed."
81,"“Listing Date” means , in respect of a Sub -Fund, the date on which the Units are first listed and from which dealings therein are permitted to take place on SEHK, the expected date of which is set 9 out in the relevant Appendix for the Sub-Fund."
82,“Manager” means Samsung Asset Management (Hong Kong) Limited 三星資產運用（香港）有限 公司 or such other person or persons for the time being duly appointed pursuant to the Trust Deed as manager of the Trust in succession thereto being approved by the SFC under the Code.
83,“Market” means in any part of the world: (a) in relation to any Security: the SEHK or such other stock exchange from time to time determined by the Manager; and (b) in relation to any futures contract: the Hong Kong Futures Exchange or such other futures exchange from time to time determined by the Manager.
84,“Market Maker” means a broker or dealer permitted by the SEHK to act as such by making a market for the Units in the secondary market on the SEHK.
85,"“Net Asset Value” means the net asset value of a Sub-Fund or, as the context may require, the net asset value of a Unit calculated under the Trust Deed."
86,“NYMEX” means the New York Mercantile Exchange.
87,"“OECD” means the Organisation for Economic Cooperation and Development, whose member states include all countries listed on the OECD website: http://www.oecd.org."
