sentence_id,text
483,"Set out below is a summary of how various property held by the relevant Sub-Fund are valued: (a) Securities that are quoted, listed, traded or dealt in on any Market shall unless the Manager (in consultation with the Trustee) determines that some other method is more appropriate, be valued by reference to the price appearing to the Manager to be the official closing price or, if unavailable, the last traded price on the Market as the Manager may consider in the circumstances to provide fair criterion, provided that (i) if a Security is quoted or listed on more than one Market, the Manager shall adopt the price quoted on the Market which in its opinion provides the principal market for such Security; (ii) if prices on that Market are not available at the relevant time, the value of the Securities shall be certified by such firm or institution making a market in such investment as may be appointed for such purpose by the Manager; (iii) interest accrued on any interest-bearing Securities shall be taken into account, unless such interest is included in the quoted or listed price; and (iv) the Manager and the Trustee shall be entitled to use and rely on electronic price feeds from such source or sources as they may from time to time determine, notwithstanding that the prices so used are not the last traded prices as the case may be; (b) the value of each interest in any unlisted mutual fund corporation or unit trust shall be the latest available net asset value per share or unit in such mutual fund corporation or unit trust or if not available or appropriate, the last available bid or offer price for such unit, share or other interest; (c) Futures Contracts will be valued at the official closing price of the Futures Contracts or if such price is not available (i) the latest available price or (ii) if bid and offer quotations are made, the latest available middle market quotation of such Futures Contract in each case at the Valuation Point or as otherwise valued as described in the Trust Deed; (d) except as provided for in paragraph (b), the value of any investment which is not listed, quoted or ordinarily dealt in on a Market shall be the initial value thereof equal to the amount expended on behalf of the relevant Sub-Fund in the acquisition of such investment (including, in each case the amount of stamp duties, commissions and other acquisition expenses) provided that a revaluation shall be made on each Valuation Day by reference to the latest bid price, asked price or mean thereof, as the Trustee and the Manager consider appropriate, quoted by a professional person, firm or institution making a market in such investments or such professional person, firm or institution approved by the Trustee as qualified to value such investments (which may, if the Trustee agrees, be the Manager); (e) cash, deposits and similar investments shall be valued at their face value (together with accrued interest) unless, in the opinion of the Manager, any adjustment should be made to reflect the value thereof; and (f) notwithstanding the foregoing, the Manager may, in consultation with the Trustee, adjust the value of any investment if, having regard to relevant circumstances, the Manager considers that such adjustment is required to fairly reflect the value of the investment."
484,The Trustee will perform any currency conversion at rates as may be agreed between the Trustee and the Manager from time to time.
485,The above is a summary of the key provisions of the Trust Deed with regard to how the various assets of the relevant Sub-Fund are valued.
486,"47 Suspension of determination of Net Asset Value The Manager may, in consultation with the Trustee having regard to the best interests of Unitholders, declare a suspension of the determination of the Net Asset Value of the relevant Sub- Fund for the whole or any part of any period during which: (a) there exists any state of affairs prohibiting the normal disposal and/or purchase of the investments of the relevant Sub-Fund; (b) circumstances exist as a result of which, in the opinion of the Manager, it is not reasonably practicable to realise any Securities and/or Futures Contracts held or contracted for the account of the Sub-Fund or it is not possible to do so without seriously prejudicing the interest of Unitholders of Units of the relevant Sub-Fund; (c) for any other reason the prices of investments of the relevant Sub-Fund cannot, in the opinion of the Manager, reasonably, promptly and fairly be ascertained; (d) there is a breakdown in any of the means normally employed in determining the Net Asset Value of the relevant Sub-Fund or the Net Asset Value per Unit of the relevant class or when for any other reason the value of any Securities and/or Futures Contracts or other property for the time being comprised in the relevant Sub-Fund cannot, in the opinion of the Manager, reasonably, promptly and fairly be ascertained; (e) the remittance or repatriation of funds which will or may be involved in the realisation of, or in the payment for, the Securities and/or Futures Contracts of the relevant Sub-Fund or the subscription or redemption of Units of the relevant Sub-Fund is delayed or cannot, in the opinion of the Manager, be carried out promptly or at normal rates of exchange; or (f) the business operations of the Manager, the Trustee, the Custodian (where applicable) or the PRC Custodian (where applicable) or delegate of the Manager, the Trustee, the Custodian (where applicable) or the PRC Custodian (where applicable) in relation to the relevant Sub-Fund are substantially interrupted or closed as a result of or arising from pestilence, acts of war, terrorism, insurrection, revolution, civil unrest, riots, strikes or acts of God."
487,"Any suspension shall take effect upon its declaration and thereafter there shall be no determination of the Net Asset Value of the relevant Sub-Fund and, in the case of an Index Tracking Sub-Fund, the Manager shall be under no obligation to rebalance the relevant Index Tracking Sub-Fund until the suspension is terminated on the earlier of (i) the Manager declaring the suspension is at an end; and (ii) the first Dealing Day on which (1) the condition giving rise to the suspension shall have ceased to exist; and (2) no other condition under which suspension is authorised exists."
488,"The Manager shall notify the SFC and publish a notice of suspension as soon as may be practicable following the suspension, and at least once a month during the suspension, on its website at www.samsungetfhk.com (the contents of which and of other websites referred to in this Prospectus have not been reviewed by the SFC) or in such other publications as the Manager decides."
489,No Units of a Sub-Fund will be issued or redeemed during any period of suspension of the determination of the Net Asset Value of the relevant Sub-Fund.
490,"Issue Price and Redemption Value The Issue Price which is the subject of a Creation Application during the Initial Offer Period of a Sub-Fund will be a fixed amount per Unit, or (for an Index Tracking Sub-Fund only) a percentage of the closing level of the relevant Index (expressed in the base currency of the relevant Sub-Fund) as at the last day of the Initial Offer Period, rounded to four decimal places (0.00005 or above being rounded up, and less than 0.00005 being rounded down), or such other amount from time to 48 time determined by the Manager in consultation with the Trustee."
491,The Issue Price during the Initial Offer Period of each Sub-Fund will be set out in the relevant Appendix for that Sub-Fund.
492,"After the expiry of the Initial Offer Period, the Issue Price of Units created and issued by a Creation Application, will be the prevailing Net Asset Value of the relevant Sub-Fund as at the relevant Valuation Point divided by the total number of Units in issue rounded to the nearest four decimal places (0.00005 or above being rounded up, and less than 0.00005 being rounded down)."
493,"The Redemption Value on a Dealing Day shall be the prevailing Net Asset Value of the relevant Sub-Fund as at the relevant Valuation Point divided by the total number of Units in issue rounded to the nearest four decimal places (0.00005 or above being rounded up, and less than 0.00005 being rounded down)."
494,The benefit of any rounding adjustments will be retained by the relevant Sub-Fund.
495,The latest Net Asset Value of the Units will be available on the Manager’s website at www.samsungetfhk.com (the contents of which and of other websites referred to in this Prospectus have not been reviewed by the SFC) or published in such other publications as the Manager may decide from time to time.
496,"Neither the Issue Price nor the Redemption Value takes into account Duties and Charges, Transaction Fees or fees payable by a Participating Dealer."
497,"49 FEES AND EXPENSES There are different levels of fees and expenses applicable to investing in a Sub-Fund as set out below, current as at the date of this Prospectus."
498,"Where any levels of fees and expenses applicable to a particular Sub-Fund differs from the following, such fees and expenses will be set out in full in the relevant Appendix."
499,"(a) Fees and expenses payable by Participating Dealers on creations and redemptions (as applicable) of Units (applicable both during the Initial Offer Period and After Listing) Administrative transaction fee and Service Agent’s fee Samsung S&P GSCI Crude Oil ER Futures ETF HKD4,0001 per Application and HKD1,0001 per book-entry deposit and withdrawal transaction See Note2 Samsung NYSE FANG+ ETF USD6003 per Application and HKD1,0003 per book-entry deposit and withdrawal transaction See Note4 Amount Samsung Bloomberg Global Semicondu ctor ETF USD6005 per Application and HKD1,0005 per book-entry deposit and withdrawal transaction See Note6 Samsung Blockchain Technologies ETF USD6007 per Application and HKD1,0007 per book-entry deposit and withdrawal transaction See Note8 Samsung Asia Pacific ex NZ Metaverse Theme ETF HKD4,7009 per Application and HKD1,0009 per book-entry deposit and withdrawal transaction See Note10 1 HKD4,000 is payable to the Trustee and HKD1,000 is payable to the Service Agent."
500,"2 The administrative transaction fee of HKD4,000 is payable by a Participating Dealer to the Trustee for the benefit of the Trustee and/or Registrar."
501,"The Service Agent’s fee of HKD1,000 is payable by the Participating Dealer to the Service Agent."
502,The Service Agent will charge a fee for each book-entry deposit and withdrawal transaction.
503,A Participating Dealer may pass on to the relevant investor such Transaction Fee.
504,"3 USD600 is payable to the Trustee and HKD1,000 is payable to the Service Agent."
505,4 The administrative transaction fee of USD600 is payable by a Participating Dealer to the Trustee for the benefit of the Trustee and/or Registrar.
506,"The Service Agent’s fee of HKD1,000 is payable by the Participating Dealer to the Service Agent."
507,The Service Agent will charge a fee for each book-entry deposit and withdrawal transaction.
508,A Participating Dealer may pass on to the relevant investor such Transaction Fee.
509,"5 USD600 is payable to the Trustee and HKD1,000 is payable to the Service Agent."
510,6 The administrative transaction fee of USD600 is payable by a Participating Dealer to the Trustee for the benefit of the Trustee and/or Registrar.
511,"The Service Agent’s fee of HKD1,000 is payable by the Participating Dealer to the Service Agent."
512,The Service Agent will charge a fee for each book-entry deposit and withdrawal transaction.
513,A Participating Dealer may pass on to the relevant investor such Transaction Fee.
514,"7 USD600 is payable to the Trustee and HKD1,000 is payable to the Service Agent."
515,8 The administrative transaction fee of USD600 is payable by a Participating Dealer to the Trustee for the benefit of the Trustee and/or Registrar.
516,"The Service Agent’s fee of HKD1,000 is payable by the Participating Dealer to the Service Agent."
517,The Service Agent will charge a fee for each book-entry deposit and withdrawal transaction.
518,A Participating Dealer may pass on to the relevant investor such Transaction Fee.
519,"9 HKD4,700 is payable to the Trustee and HKD1,000 is payable to the Service Agent."
520,"50 Registrar fee HKD16011 per Application Included in the Trustee’s fee Included in the Trustee’s fee Included in the Trustee’s fee Included in the Trustee’s fee Application cancellation fee12 HKD12,000 per Application USD1,200 per Application USD1,200 per Application USD1,200 per Application HKD9,400 per Application Extension Fee13 HKD12,000 per Application USD1,200 per Application USD1,200 per Application USD1,200 per Application HKD9,400 per Application Stamp duty Nil Nil Nil Nil Nil All other Duties and Charges incurred by the Trustee or the Manager in connection with the creation or redemption (b) Fees and expenses payable by investors As applicable As applicable As applicable As applicable As applicable Amount Fees and charges imposed by the Participating (i) Fees payable by clients of the Participating Dealers in respect of creations and redemptions (as applicable) via the Participating Dealer (applicable both during the Initial Offer Period and After Listing) Such amounts as determined by the relevant Participating Dealer 10 The administrative transaction fee of HKD4,700 is payable by a Participating Dealer to the Trustee for the benefit of the Trustee and/or Registrar."
521,"The Service Agent’s fee of HKD1,000 is payable by the Participating Dealer to the Service Agent."
522,The Service Agent will charge a fee for each book-entry deposit and withdrawal transaction.
523,A Participating Dealer may pass on to the relevant investor such Transaction Fee.
524,11 The Registrar will charge each Participating Dealer a fee for each Creation Application and Redemption Application.
525,12 An application cancellation fee is usually payable to the Trustee for the account of the Registrar in respect of either a withdrawn or failed Creation Application or Redemption Application (other than in certain circumstances such as following a suspension of creations or redemptions by the Manager).
526,"13 An Extension Fee is payable to the Trustee on each occasion the Manager, upon a Participating Dealer’s request, grants the Participation Dealer an extended settlement in respect of a Creation Application or Redemption Application."
527,51 Dealer14 (ii) Fees payable by all investors in respect of dealings in the Units on SEHK (applicable After Listing) Brokerage Market rates SFC transaction levy Accounting and Financial Reporting Council (“AFRC”) transaction levy SEHK trading fee 0.0027%15 0.00015%16 0.00565%17 Stamp duty Nil (c) Fees and expenses payable by the Sub-Funds (See further disclosure below) No money should be paid to any intermediary in Hong Kong which is not licensed or registered to carry on Type 1 regulated activity under Part V of the SFO.
528,14 The Participating Dealer may increase or waive the level of its fees in its discretion.
529,Information regarding these fees and charges is available upon request to the relevant Participating Dealer.
530,"15 SFC transaction levy of 0.0027% of the trading price of the Units, payable by the buyer and the seller."
531,"16 AFRC transaction levy of 0.00015% of the trading price of the Units, payable by the buyer and the seller."
532,"17 Trading fee of 0.00565% of the trading price of the Units, payable by the buyer and the seller."
533,52 Fees and Expenses Payable by the Sub-Funds Management fee The Manager is entitled to receive a management fee of up to 0.99% per year of the Net Asset Value of each Sub-Fund.
534,The current management fee percentage in respect of each Sub-Fund is set out in the relevant Appendix and is accrued daily and calculated as at each Dealing Day and payable monthly in arrears.
535,This fee is payable out of the Trust Fund.
536,The Manager may pay a distribution fee to any distributor or sub-distributors of the Trust out of the management fees it receives from the Trust.
537,A distributor may re-allocate an amount of the distribution fee to the sub-distributors.
538,"The fees of the Investment Adviser, if any, will be paid by the Manager and not out of the assets of the relevant Sub-Fund."
539,"Trustee’s and Registrar’s fee The Trustee receives out of the assets of each Sub-Fund a monthly trustee’s fee, payable in arrears, accrued daily and calculated as at each Dealing Day of up to 1.00% per year of the Net Asset Value of a Sub-Fund."
540,The Trustee fee percentage in respect of each Sub-Fund is set out in the relevant Appendix.
541,The trustee’s fee is inclusive of fees payable to the Custodian and the PRC Custodian.
542,"The Trustee shall also be entitled to be reimbursed out of the assets of the relevant Sub-Fund various transaction, processing fees and safekeeping fees and all out-of-pocket expenses incurred (including any sub-custody fees and expenses)."
543,The Registrar is entitled to a registrar fee and an administrative transaction fee for any creation and redemption of Units of the relevant Sub-Fund as set out in the relevant Appendix.
544,"Service Agent’s fee The Service Agent is entitled to receive a monthly reconciliation fee of HKD5,000 from the Manager."
545,The Manager shall pass on to the relevant Sub-Fund such reconciliation fee.
546,"For any period less than a month, the reconciliation fee is on a pro-rata basis and accrues on a daily basis."
547,"The Trustee, on behalf of the Trust, will pay all other expenses chargeable by the Service Agent in connection with the Service Agent’s role."
548,"Ongoing charges The estimated ongoing charges (where a Sub-Fund is newly established) or actual ongoing charges of a Sub-Fund where applicable, which are the sum of anticipated ongoing expenses of the relevant Sub-Fund expressed as a percentage of the estimated average Net Asset Value of the relevant Sub-Fund, are set out in the relevant Appendix."
549,Where a Sub-Fund is newly established the Manager will make a best estimate of the ongoing charges and keep such estimate under review.
550,The establishment costs of a Sub-Fund will also be included in the ongoing charges calculation.
551,"Ongoing expenses are generally payments deducted from the assets of a Sub-Fund where these are permitted by the Trust Deed, the Code and the law."
552,"These include all types of cost borne by a Sub-Fund, whether incurred in its operation or the remuneration of any party."
553,"For Index Tracking Sub-Funds, the ongoing charges do not represent the estimated tracking error."
554,Promotional expenses The Sub-Fund(s) will not be responsible for any promotional expenses including those incurred by any marketing agents and any fees imposed by such marketing agents on their customers investing in the Sub-Fund(s) will not be paid (either in whole or in part) out of the Trust Fund.
555,"Other expenses 53 The Sub-Fund(s) will bear all operating costs relating to the administration of the Sub-Fund(s) including but not limited to stamp and other duties, governmental charges, brokerages, commissions, exchange costs and commissions, bank charges and other costs and expenses payable in respect of the acquisition, holding and realisation of any investment or any monies, deposit or loan, charges and expenses of its legal counsel, auditors and other professionals, index licensing fees (in respect of Index Tracking Sub-Funds only), the costs in connection with maintaining a listing of the Units on the SEHK or other exchange (including, if considered appropriate by the Manager, any additional costs of determining the stock code by drawing from special ballot pool, which are estimated to be HKD500,000) and maintaining the Trust’s and the Sub-Fund’s authorisation under the SFO, costs incurred in the preparation, printing and updating of any offering documents and the costs incurred in the preparation of supplemental deeds, any disbursements or out-of-pocket expenses properly incurred on behalf of the Sub-Fund(s) by the Trustee, the Manager or the Registrar or any of its service providers, the expenses incurred in convening meetings of Unitholders, preparing, printing and distributing annual financial reports and interim unaudited financial reports and other circulars relating to the Sub-Fund(s) and the expenses of publishing Unit prices."
556,54 Establishment costs The cost of establishing the Trust was borne primarily by the Manager and partly by the Trust and was fully amortised during the first financial year of the Trust.
557,"The cost of establishing the Samsung S&P GSCI Crude Oil ER Futures ETF including the preparation of this Prospectus, inception fees, the costs of seeking and obtaining the listing and authorisation by the SFC and all initial legal and printing costs was approximately HKD1.5 million and is being borne by the Samsung S&P GSCI Crude Oil ER Futures ETF and amortised over the first five financial years of the Samsung S&P GSCI Crude Oil ER Futures ETF."
558,"The cost of establishing the Samsung NYSE FANG+ ETF, including the preparation of this Prospectus, inception fees, the costs of seeking and obtaining the listing and authorisation by the SFC and all initial legal and printing costs was approximately HKD1.5 million and are being borne by the Samsung NYSE FANG+ ETF (unless otherwise determined by the Manager) and will be amortised over the first 5 financial years of the Samsung NYSE FANG+ ETF (or such other period as determined by the Manager after consulting the Auditor)."
559,"The cost of establishing the Samsung Bloomberg Global Semiconductor ETF, including the preparation of this Prospectus, inception fees, the costs of seeking and obtaining the listing and authorisation by the SFC and all initial legal and printing costs was approximately HKD1.2 million and are being borne by the Samsung Bloomberg Global Semiconductor ETF (unless otherwise determined by the Manager) and will be amortised over the first 5 financial years of the Samsung Bloomberg Global Semiconductor ETF (or such other period as determined by the Manager after consulting the Auditor)."
560,"The cost of establishing the Samsung Blockchain Technologies ETF, including the preparation of this Prospectus, inception fees, the costs of seeking and obtaining the listing and authorisation by the SFC and all initial legal and printing costs is approximately HKD1.2 million and will be borne by the Manager."
561,"The cost of establishing the Samsung Asia Pacific ex NZ Metaverse Theme ETF, including the preparation of this Prospectus, inception fees, the costs of seeking and obtaining the listing and authorisation by the SFC and all initial legal and printing costs is approximately HKD1.5 million and will be borne by the Manager."
562,The attention of investors is drawn to the risk factor entitled “Valuation and accounting risk”.
563,"Increase in fees The current fees in respect of each Sub-Fund payable to the Manager and the Trustee as described in the relevant Appendix may be increased on notice to Unitholders, subject to the maximum rates set out in the Trust Deed."
564,55 RISK FACTORS An investment in any Sub-Fund carries various risks.
565,"Each of these may affect the Net Asset Value, yield, total return and trading price of the Units."
566,There can be no assurance that the investment objective of a Sub-Fund will be achieved.
567,"You should carefully evaluate the merits and risks of an investment in the relevant Sub-Fund in the context of your overall financial circumstances, knowledge and experience as an investor."
568,The risk factors set forth below are the risks which are believed by the Manager and its directors to be relevant and presently applicable to all Sub-Funds.
569,"You should refer to additional risk factors, specific to each Sub-Fund, as set out in the relevant Appendix."
570,"In particular, further risk factors applicable to the Sub-Funds which adopt a Multi Counter (in addition to these below) are set out in the relevant Appendix."
571,Risks associated with investment in any Sub-Fund Investment objective risk There is no assurance that the investment objective of a Sub-Fund will be achieved.
572,"Whilst it is the intention of the Manager to implement strategies which are designed to achieve the investment objective and, for an Index Tracking Sub-Fund, to minimise tracking error, there can be no assurance that these strategies will be successful."
573,It is possible that you as an investor may lose a substantial proportion or all of its investment in a Sub-Fund.
574,"As a result, each investor should carefully consider whether you can afford to bear the risks of investing in the relevant Sub-Fund."
575,Market risk The Net Asset Value of each Sub-Fund will change with changes in the market value of the Securities and/or Futures Contracts it holds.
576,The price of Units and the income from them may go down as well as up.
577,"There can be no assurance that an investor will achieve profits or avoid losses, significant or otherwise."
578,"The capital return and income of the Sub-Fund is based on the capital appreciation and income on the Securities and/or Futures Contracts it holds, less expenses incurred."
579,A Sub-Fund’s return may fluctuate in response to changes in such capital appreciation or income.
580,"Furthermore, an Index Tracking Sub-Fund may experience volatility and decline in a manner that broadly corresponds with the relevant Index."
581,Investors in a Sub-Fund are exposed to the same risks that investors who invest directly in the underlying Securities and/or Futures Contracts would face.
