sentence_id,text
1840,"Except for certain custom index calculation services, all information provided by ICE Data is general in nature and not tailored to the needs of LICENSEE or any other person, entity or group of persons."
1841,"ICE Data has no obligation or liability in connection with the administration, marketing, or trading of the Product."
1842,ICE Data is not an investment advisor.
1843,"Inclusion of a security within an index is not a recommendation by ICE Data to buy, sell, or hold such security, nor is it considered to be 127 investment advice."
1844,"ICE DATA AND ITS SUPPLIERS DISCLAIM ANY AND ALL WARRANTIES AND REPRESENTATIONS, EXPRESS AND/OR IMPLIED, INCLUDING ANY WARRANTIES OF MERCHANTABILITY OR FITNESS FOR A PARTICULAR PURPOSE OR USE, INCLUDING THE INDICES, INDEX DATA AND ANY INFORMATION INCLUDED IN, RELATED TO, OR DERIVED THEREFROM (“INDEX DATA”)."
1845,"ICE DATA AND ITS SUPPLIERS SHALL NOT BE SUBJECT TO ANY DAMAGES OR LIABILITY WITH RESPECT TO THE ADEQUACY, ACCURACY, TIMELINESS OR COMPLETENESS OF THE INDICES AND THE INDEX DATA, WHICH ARE PROVIDED ON AN “AS IS” BASIS AND YOUR USE IS AT YOUR OWN RISK."
1846,Index licence agreement The initial term of the licence of the Index commenced on 10 December 2020 and shall be valid for an initial term of twelve months.
1847,"After the expiry of the initial term, the licence shall renew automatically for consecutive renewal terms of one year, unless either party to the licence agreement provides written notice of termination to the other party of its intent not to renew at least 180 days prior to the end of the initial term or the then current term."
1848,The licence agreement may otherwise be terminated in accordance with the provisions of the licence agreement.
1849,Appendix dated 15 August 2025 128 APPENDIX 3: Samsung Bloomberg Global Semiconductor ETF Key information Set out below is a summary of key information in respect of this Sub-Fund which should be read together with the full text of this Appendix and this Prospectus.
1850,Index Bloomberg Global Semiconductor Top 20 Index Type of Index Price return index Initial Issue Date 8 November 2021 (the Business Day immediately before the Listing Date) Listing Date (SEHK) 9 November 2021 Exchange Listing SEHK – Main Board Stock Code 03132 Stock Short Name SAMSUNG SEMICON Trading Board Lot Size 100 Units Base Currency US dollars (USD) Trading Currency Hong Kong dollars (HKD) Distribution Policy Semi-annually (usually in June and December of each year) (if any) subject to the Manager’s discretion.
1851,Distributions on all Units will be in USD only*.
1852,Distributions may not be paid if the cost of the Sub-Fund’s operations is higher than the yield from the Sub-Fund’s cash and holdings of investment products.
1853,Distributions may be paid out of capital or effectively out of capital as well as income at the Manager’s discretion.
1854,"Creation/Redemption Policy Cash (in USD only) or a combination of cash (in USD only) and in-kind Application Unit Size (only by or through Participating Dealers) Minimum 250,000 Units (or multiples thereof) Dealing Deadline During the Initial Offer Period: 4:00 p.m."
1855,(Hong Kong time) After Listing: 11:00 a.m.
1856,(Hong Kong time) Management Fee Currently 0.85% per year of the Net Asset Value Investment Strategy Primarily full replication strategy.
1857,Please refer to the section on “What is the investment strategy?” below Maximum Deviation from Index Weighting 3 percentage points 129 Financial Year End 31 March.
1858,The first financial year of the Sub-Fund will end on 31 March 2022.
1859,The first half-yearly unaudited financial report and the first audited annual report of the Sub-Fund will be for the period ending 30 September 2021 and 31 March 2022 respectively.
1860,Listing Agent Altus Capital Limited Market Makers# Flow Traders Hong Kong Limited Jane Street Asia Trading Limited Participating Dealers# ABN AMRO Clearing Hong Kong Limited Mirae Asset Securities (HK) Limited Korea Investment & Securities Asia Limited CGS International Securities (Hong Kong) Limited Phillip Securities (Hong Kong) Limited iFAST Securities (HK) Limited Valuable Capital Limited The Hongkong and Shanghai Banking Corporation Limited Merrill Lynch Far East Limited Citigroup Global Markets Asia Limited Service Agent HK Conversion Agency Services Limited Website www.samsungetfhk.com * All Units will receive distributions in USD only.
1861,"In the event that the relevant Unitholder has no USD account, the Unitholder may have to bear the fees and charges associated with the conversion of such dividend from USD into HKD or any other currency."
1862,Unitholders are advised to check with their brokers regarding arrangements for distributions and to consider the risk factor entitled “Other currency distributions risk” below.
1863,# Please refer to the Manager’s website for the latest lists of Market Makers and Participating Dealers.
1864,The latest list of Market Makers is also available at www.hkex.com.hk.
1865,What is the investment objective?
1866,"The investment objective of the Sub-Fund is to provide investment results that, before fees and expenses, closely correspond to the performance of the Index."
1867,There can be no assurance that the Sub-Fund will achieve its investment objective.
1868,What is the investment strategy?
1869,"In order to achieve the Sub-Fund’s investment objective, the Manager intends to primarily use a 130 full replication strategy through investing directly in the Index constituents in substantially the same weightings in which they are included in the Index."
1870,Please refer to the section “The Index” below for further information.
1871,"Where the adoption of a full replication strategy is not efficient or practicable or where the Manager considers appropriate in the best interest of the Sub-Fund and the Unitholders, the Manager may pursue a representative sampling strategy, and invest, directly or indirectly, in a representative sample of the Securities in the Index that collectively reflects the investment characteristics of the Index and aims to replicate its performance."
1872,"The Sub-Fund, in using a representative sampling strategy, may or may not hold all of the Securities included in the Index, and may hold a portfolio of Securities which are not included in the Index, provided that these collectively feature a high correlation with the Index."
1873,"In pursuing a representative sampling strategy, the Manager may cause the Sub-Fund to deviate from the Index weighting on the condition that the maximum deviation from the Index weighting of any constituent will not exceed 3 percentage points above or below such weighting."
1874,"The Sub-Fund may switch between the full replication strategy and the representative sampling strategy without prior notice to investors, in its absolute discretion, and as often as it believes is appropriate in order to achieve the investment objective of the Sub-Fund by tracking the Index as closely as possible to the benefit of investors."
1875,"The Sub-Fund may invest up to 100% of its Net Asset Value directly in the Index constituents, which include common stocks, American Depositary Receipts (“ADRs”) and Global Depositary Receipts (“GDRs”) listed on stock exchanges globally."
1876,The Sub-Fund may also invest in money market funds and in cash deposits for cash management purposes although such investments are not anticipated to exceed 5% of the Net Asset Value of the Sub-Fund.
1877,"The Manager may enter into securities lending transactions on behalf of the Sub-Fund with a maximum level of up to 25% of the Sub-Fund’s Net Asset Value and an expected level of approximately 20% of the Sub-Fund’s Net Asset Value at any one time, and the Manager has the right to recall the securities lent out at any time."
1878,All such transactions will only be entered into with institutions of appropriate financial standing which are acceptable to the Manager.
1879,"As part of its Securities Lending Transactions, the Sub-Fund will receive as collateral sufficient cash and/or liquid assets, the value of which, during the duration of the securities lending agreement, will be equal to at least 100% of the global valuation of the securities lent (interests, dividends and other eventual rights included), marked to market on a daily basis."
1880,The Trustee will be responsible for the safekeeping of such collateral received and held in custody.
1881,The valuation of the collateral generally takes place on trading day T.
1882,"If the value of the collateral falls below 100% of the global valuation of the securities lent on any trading day T, the Manager will call for additional collateral on trading day T, and the borrower will have to deliver additional collateral to make up for the difference in securities value by 4 p.m."
1883,on trading day T+1.
1884,The Sub-Fund will not engage in any reinvestment of collateral received.
1885,The global valuation of the securities lent will be disclosed in the annual audited financial reports and interim half yearly unaudited financial reports of the Sub-Fund.
1886,"To the extent the Sub-Fund undertakes Securities Lending Transactions, all revenues (net of direct and indirect expenses as reasonable and normal compensation for the services rendered by the Manager, a securities lending agent and/or other service providers in the context of such transactions to the extent permitted by applicable legal and regulatory requirements) shall be returned to the Sub-Fund."
1887,The cost relating to Securities Lending Transactions will be borne by the borrower.
1888,"Currently, the Manager has no intention to invest the Sub-Fund in any financial derivative instruments for hedging or non-hedging (i.e."
1889,"investment) purposes, and will not enter into Sale and Repurchase Transactions or Reverse Repurchase Transactions and other similar over-the-counter transactions."
1890,131 Prior approval of the SFC will be sought and not less than one month’s prior notice will be given to the Unitholders in the event the Manager wishes to adopt investment strategy other than full replication strategy or representative sampling strategy.
1891,The investment strategy of the Sub-Fund is subject to the investment and borrowing restrictions set out in Part 1 of this Prospectus.
1892,Use of derivatives The Sub-Fund will not use derivatives for any purpose.
1893,"Risk factors specific to the Sub-Fund In addition to the risk factors presented in Part 1 of this Prospectus, the risk factors set forth below are also specific risks, in the opinion of the Manager, considered to be relevant and presently applicable to the Sub-Fund."
1894,"Sector Concentration Risk Due to the concentration of the Index in the semiconductor sector, the performance of the Index may be more volatile when compared to other broad-based stock indices."
1895,The price volatility of the Sub-Fund may be greater than the price volatility of exchange traded funds tracking more board- based indices.
1896,"Semiconductor sector risk The Sub-Fund is subject to the risk that companies that are in the semiconductor industry may be particularly affected by certain factors as specified below, which may, in certain circumstances, cause the value of securities of all companies within the semiconductor sector of the market to deteriorate."
1897,"Specific factors faced by semiconductor companies which may affect the value of their securities include, but are not limited to, domestic and international competition pressures (including competition from subsidised foreign competitors with lower production costs), rapid obsolescence of products as a result of the fast-developing nature of the semiconductor industry, the economic performance of the customers of semiconductor companies which may in turn affect the growth and market outlook of the semiconductor industry, capital equipment expenditures which could be substantial and suffer from rapid obsolescence and potential shortages of raw materials or equipment which could result in an increase in prices of raw materials or equipment, longer delivery time of products or even production stoppage."
1898,"Companies in the semiconductor sector also typically rely on heavy and significant spending on research and development, and there is no guarantee that the products produced by these companies will materialise into commercially successful products."
1899,"Furthermore, as the semiconductor sector may be deemed sensitive to national interests, the sector may be subject to government intervention, sanctions and trade protectionism."
1900,"Companies in the semiconductor sector may be highly dependent upon government subsidies and incentives (including but not limited to preferential tax treatments) and contracts with government entities, and may be negatively affected if such subsidies are reduced, such preferential tax treatments expires or are discontinued, or contracts are unavailable due to changes in government policies."
1901,The success of companies in the semiconductor sector is typically dependent on the companies’ ability to maintain relationships with their technology partners.
1902,"If a company’s relationship with a technology partner were impaired or terminated, the company may not be able to enter into a new technology alliance on a timely basis or on commercially favourable terms, which could result in significant additional cost or disruptions to its businesses."
1903,132 The semiconductors sector is also characterised by cyclical market patterns and periodic overcapacity.
1904,Business conditions in this industry may change rapidly from periods of production shortages and strong demand to periods of weak demand.
1905,Any future downturn in the industry could harm the business and operating results of semiconductor companies.
1906,"Emerging markets risk The Sub-Fund invests in emerging markets which may involve increased risks and special considerations not typically associated with investment in more developed markets, such as liquidity risks, currency risks/control, political and economic uncertainties, legal and taxation risks, settlement risks, custody risk, currency devaluation, inflation and the likelihood of a high degree of volatility."
1907,High market volatility and potential settlement difficulties in the markets may also result in significant fluctuations in the prices of the securities traded on such markets and thereby may adversely affect the value of the Sub-Fund.
1908,"Eurozone risk In light of ongoing concerns on the sovereign debt risk of certain countries within the Eurozone, the Sub-Fund’s investments in the region may be subject to higher volatility, liquidity, currency and default risks."
1909,"Any adverse events, such as credit downgrade of a sovereign or exit of EU members from the Eurozone, may have a negative impact on the value of the Sub-Fund."
1910,"Risks associated with depositary receipts Exposure to depositary receipts including ADRs and GDRs may generate additional risks compared to a direct exposure to the corresponding underlying stocks, in particular, the risk of non-segregation under applicable law of the depositary bank who hold the underlying stock as collateral and its own assets."
1911,"In case of bankruptcy of the depositary bank, there could be a risk that the underlying shares would not be attributed to holders of depositary receipts, although segregation is an integral part of the depositary agreement regulating the issuance of the depositary receipts."
1912,"In such case, the most likely scenario would be the trading suspension and thereafter a freeze of the price of the depositary receipts impacted by such bankruptcy event."
1913,Bankruptcy events in respect of the depositary banks issuing the depositary receipts may negatively affect the performance and/or the liquidity of the Sub-Fund.
1914,"There are fees related to depositary receipts, for example fees charged by banks for the custody of underlying assets of depositary receipts, which may impact the performance of the depositary receipts."
1915,"Also, holders of depositary receipts are not direct shareholders of the underlying company and generally do not have voting and other shareholder rights as shareholders do."
1916,The Sub-Fund may also be subject to liquidity risk as depositary receipts are often less liquid than the corresponding underlying stocks.
1917,"Risk associated with small-capitalisation/mid-capitalisation companies The Sub-Fund may invest in small-capitalisation/mid-capitalisation companies, the stock of which may have lower liquidity and their prices are more volatile to adverse economic developments than those of larger capitalisation companies in general."
1918,Foreign exchange risk Underlying investments of the Sub-Fund may be denominated in currencies other than the base currency of the Sub-Fund and a substantial portion of the dividends distributed by the underlying investments of a Sub-Fund may therefore be received in currencies other than its base currency.
1919,"In addition, the base currency of the Sub-Fund is USD but the trading currency of the Sub-Fund is in HKD."
1920,Any fluctuation in the exchange rate of the base currency of the Sub-Fund relative to the relevant currencies will affect the Sub-Fund’s Net Asset Value regardless of the performance of its underlying investments.
1921,"As a Sub-Fund’s Net Asset Value is calculated in its base currency, an 133 investor may lose money if the relevant foreign currencies depreciate against the Sub-Fund’s base currency, irrespective of the positive performance of the underlying investments."
1922,New index risk The Index is new and has minimal operating history by which investors can evaluate its previous performance.
1923,There can be no assurance as to the performance of the Index.
1924,The Sub-Fund may be riskier than other exchange traded funds tracking more established indices with longer operating history.
1925,"Distributions out of or effectively out of capital risk The Manager may, at its discretion make distributions out of capital."
1926,"The Manager may also, at its discretion, make distributions out of gross income while all or part of the fees and expenses of the Sub-Fund are charged to/paid out of the capital of the Sub-Fund, resulting in an increase in distributable income for the payment of distributions by the Sub-Fund and therefore, the Sub-Fund may effectively pay distributions out of the capital."
1927,Payment of distributions out of capital or effectively out of capital amounts to a return or withdrawal of part of an investor’s original investment or from any capital gains attributable to that original investment.
1928,Any distributions involving payment of distributions out of or effectively out of the Sub-Fund’s capital may result in an immediate reduction of the Net Asset Value per Unit.
1929,The Manager may amend its distribution policy subject to the SFC’s prior approval (if required) and by giving not less than one month’s prior notice to Unitholders.
1930,Other currency distributions risk Investors should note that all Units will receive distributions in the base currency (USD) only.
1931,"In the event that the relevant Unitholder has no USD account, the Unitholder may have to bear the fees and charges associated with the conversion of such distribution from USD to HKD or any other currency."
1932,The Unitholder may also have to bear bank or financial institution fees and charges associated with the handling of the distribution payment.
1933,Unitholders are advised to check with their brokers regarding arrangements for distributions.
1934,"Trading differences risks As the exchanges on which the Index constituents are listed may be open when Units in the Sub-Fund are not priced, the value of the Securities in the Sub-Fund’s portfolio may change on days when investors will not be able to purchase or sell the Sub-Fund’s Units."
1935,"Furthermore, the market price of underlying Securities listed on the above exchanges which are established outside Hong Kong may not be available during part or all of the SEHK trading sessions due to trading hour differences which may result in the trading price of the Sub-Fund deviating away from the Net Asset Value."
1936,Securities listed on certain exchanges may be subject to trading bands which restrict increases and decreases in the trading price.
1937,Units listed on the SEHK are not.
1938,"The prices quoted by the SEHK market maker would therefore be adjusted to take into account any accrued market risk that arises from such unavailability of the Index level and as a result, the level of premium or discount of the Unit price of the Sub-Fund to its Net Asset Value may be higher."
1939,Market suspension of trading risk Some stock exchanges on which the Sub-Fund will invest may have the right to suspend or limit trading in any Security traded on the relevant exchange.
1940,The government or the regulators may also implement policies that may affect the financial markets.
1941,"Foreign investments restrictions risk Some countries in which the Sub-Fund will invest may restrict foreign investment or the 134 repatriation of income, capital or the proceeds from sale of Securities, or may intervene with foreign exchange rates."
1942,The Sub-Fund may incur higher costs investing in these countries.
1943,"These restrictions may limit the Sub-Fund’s ability to invest in these countries, delay the investment or repatriation of capital of the Sub-Fund and impact the Sub-Fund’s ability to track the performance of the Index."
1944,Securities Lending Transactions risks The borrower may fail to return the securities in a timely manner or at all.
1945,The Sub-Fund may as a result suffer from a loss or delay when recovering the securities lent out.
1946,This may restrict the Sub- Fund’s ability in meeting delivery or payment obligations from redemption requests and may trigger claims.
1947,"There is a risk that the collateral received may be realised at a value lower than the value of the securities lent, whether due to inaccurate pricing of the collateral, adverse market movements in the value of the collateral, intra-day increase in the value of the securities lent, a deterioration in the credit rating of the collateral issuer, or the illiquidity of the market in which the collateral is traded."
1948,This may result in significant losses for the Sub-Fund if the borrower fails to return the securities lent out.
1949,"By undertaking Securities Lending Transactions, the Sub-Fund is exposed to operational risks such as delay or failure of settlement."
1950,Such delays or failure may restrict the Sub-Fund’s ability in meeting delivery or payment obligations from redemption requests and may trigger claims.
1951,"Risk Associated with the PRC Economic, Political and Social Risks of the PRC The economy of the PRC, which has been in a state of transition from a planned economy to a more market oriented economy, differs from the economies of most developed countries in many respects, including the level of government involvement, its state of development, its growth rate, control of foreign exchange, and allocation of resources."
1952,"Although the majority of productive assets in the PRC are still owned by the PRC government at various levels, in recent years, the PRC government has implemented economic reform measures emphasising utilisation of market forces in the development of the economy of the PRC and a high level of management autonomy."
1953,"The economy of the PRC has experienced significant growth in the past 25 years, but growth has been uneven both geographically and among various sectors of the economy."
1954,Economic growth has also been accompanied by periods of high inflation.
1955,The PRC government has implemented various measures from time to time to control inflation and restrain the rate of economic growth.
1956,"For more than 25 years, the PRC government has carried out economic reforms to achieve decentralisation and utilisation of market forces to develop the economy of the PRC."
1957,These reforms have resulted in significant economic growth and social progress.
1958,"There can, however, be no assurance that the PRC government will continue to pursue such economic policies or, if it does, that those policies will continue to be successful."
1959,Any such adjustment and modification of those economic policies may have an adverse impact on the securities market in the PRC as well as the underlying Securities of the Sub-Fund.
1960,"Further, the PRC government may from time to time adopt corrective measures to control the growth of the PRC economy which may also have an adverse impact on the capital growth and performance of the Sub-Fund."
1961,"Political changes, social instability and adverse diplomatic developments in the PRC could result in the imposition of additional government restrictions including expropriation of assets, confiscatory taxes or nationalisation of some or all of the property held by the underlying issuers of the Securities in the Sub-Fund’s portfolio."
1962,135 PRC Laws and Regulations Risk The regulatory and legal framework for capital markets and joint stock companies in the PRC may not be as well developed as those of developed countries.
1963,"PRC laws and regulations affecting securities markets are relatively new and evolving, and because of the limited volume of published cases and judicial interpretation and their non-binding nature, interpretation and enforcement of these regulations involve significant uncertainties."
1964,"In addition, as the PRC legal system develops, no assurance can be given that changes in such laws and regulations, their interpretation or their enforcement will not have a material adverse effect on their business operations."
