sentence_id,text
146, HSTECH ETF launch date: 2020.
147,Is there any guarantee?
148,The HSTECH ETF does not have any guarantees.
149,You may not get back the amount of money you invest.
150,What are the fees and charges?
151,Charges incurred when trading the Units of HSTECH ETF on SEHK Fee What you pay Brokerage Fee Market rates SFC Transaction Levy 0.0027%1 Accounting and Financial Reporting Council (“AFRC”) Transaction Levy 0.00015%2 SEHK Trading Fee 0.00565%3 Stamp Duty Nil 1 SFC Transaction Levy of 0.0027% of the trading price of the Units is payable by each of the buyer and the seller.
152,2 AFRC transaction levy of 0.00015% of the trading price of the Units is payable by each of the buyer and the seller.
153,3 SEHK Trading Fee of 0.00565% of the trading price of the Units is payable by each of the buyer and the seller.
154,Ongoing fees payable by the HSTECH ETF in respect of the Units The following expenses will be paid out of the HSTECH ETF .
155,They affect you because they reduce the N et Asset Value of the relevant Units of the HSTECH ETF which may affect the trading price.
156,"Fee Annual rate (as a % of the Net Asset Value of the Units) Management Fee^ 0.55% per annum Trustee Fee^ 0.0425% per annum, subject to a minimum monthly Trustee Fee of HKD7,500 Performance Fee Nil Administration Fee Nil ^ Please note that the annual rate stated may be increased up to a permitted maximum rate as set out in the Hong Kong Offering Document of the HSTECH ETF by giving 1 month’s prior notice to relevant Unitholders."
157,Other fees You may have to pay other fees when dealing in the Units of the HSTECH ETF.
158,"Additional Information You can find the following information of the HSTECH ETF at the website at www.hangsenginvestment.com▲ (this website has not been reviewed by the SFC):  The Hong Kong Offering Document (including this Product Key Facts Statement ) in respect of the HSTECH ETF, as may be updated from time to time  The latest annual audited and interim unaudited financial reports of the HSTECH ETF  The last Net Asset Value in HKD and the last Net Asset Value per Unit in HKD (updated on a daily basis)  The near real-time indicative Net Asset Value per Unit (updated every 15 seconds during the SEHK 9 trading hours throughout each Dealing Day) in HKD  Any notices relating to material changes to the HSTECH ETF which may have an impact on its investors, such as material alterations or addit ions to the Hong Kong Offering Document or the HSTECH ETF’s constitutive documents  Any public announcements made by the HSTECH ETF, including information with regard to the HSTECH ETF and the Index, notice of suspension and resumption of creation and redemption of units, suspension of the calculation of the Net Asset Value, changes in fees and suspension and resumption of trading  The latest list of Participating Dealers and market makers  The full holdings of the HSTECH ETF (updated on a daily basis)  The ongoing charges figure and the past performance information of all classes of the HSTECH ETF  The tracking difference and tracking error of the HSTECH ETF  The compositions of the dividends (i.e."
159,"the relative amounts paid out of (i) net distributable income and (ii) capital), if any, for a rolling 12-month period Important If you are in doubt, you should seek professional advice."
160,The SFC takes no responsibility for the contents of this statement and makes no representation as to its accuracy or completeness.
161,▲ This website has not been reviewed by the SFC.
162,Issued by Hang Seng Investment Management Limited (wholly-owned subsidiary of Hang Seng Bank)
