sentence_id,text
0,PRODUCT KEY FACTS Global X Exchange Traded Funds Series OFC - Global X China Life Franklin HK-US Equity Select ETF (Listed Class) 19 March 2026 Issuer: Mirae Asset Global Investments (Hong Kong) Limited ◼ This is a passive exchange traded fund.
1,◼ This statement provides you with key information about this product.
2,◼ This statement is a part of the Prospectus.
3,◼ You should not invest in this product based on this statement alone.
4,"Quick facts Stock code: HKD counter: 03428 RMB counter: 83428 USD counter: 09428 Trade lot size: 50 Shares (HKD / RMB / USD counter) Manager: Mirae Asset Global Investments (Hong Kong) Limited Sub-Investment Manager: China Life Franklin Asset Management Co., Limited (based in Hong Kong, external delegation) Custodian: Cititrust Limited Administrator: Citibank, N.A., Hong Kong Branch Ongoing charges over a year*: Estimated to be 0.75% Estimated annual tracking difference^: -1.25% Underlying Index: CSI Select Market Moderate Index Base currency: Hong Kong dollar (HKD) Trading currency: HKD counter: HKD RMB counter: Renminbi (RMB) USD counter: US dollars (USD) Financial year end of the Sub-Fund: 31 March Distribution policy: Annually at the Manager’s discretion."
5,"Distributions may be paid out of capital or effectively out of capital, but may not be so paid if the cost of the Sub -Fund’s operations is higher than the return from management of the Sub -Fund’s cash and holdings of i nvestment products."
6,Distributions on any Shares (in any counter) will be in HKD only.
7,"ETF Website#: https://www.globalxetfs.com.hk/ * As the Sub -Fund (as defined below) is newly set up, this figure is an estimate only and represents the sum of the estimated ongoing charges over a 12-month period, expressed as a percentage of the estimated average net asset value (“NAV”) of the Listed Class of Shares (as defined below) over the same period."
8,It may be different upon actual operation of the Sub-Fund and may vary from year to year.
9,This figure does not include the swap fees.
10,"As the Sub-Fund adopts a single management fee structure, the esti mated ongoing charges of the Sub -Fund will be equal to the amount of the single management fee, which is capped at 0."
11,75% of the average NAV of the Listed Class of Shares of the Sub -Fund.
12,Any ongoing expenses exceeding 0.75% of the average NAV of the Listed Class of Shares of the Sub-Fund will be borne by the Manager and will not be charged to the Sub-Fund.
13,Please refer to “Ongoing fees payable by the Sub-Fund” below and the Prospectus for details.
14,^ This is an estimated annual tracking difference.
15,Investors should refer to the Sub -Fund’s website for more up -to-date information on the actual tracking difference.
16,# This website has not been reviewed or approved by the Securities and Futures Commission (the “SFC”).
17,What is this product?
18,"• Global X China Life Franklin HK -US Equity Select ETF (the “Sub-Fund”) is a sub -fund of the Global X Exchange Traded Funds Series OFC (the “Company”), which is a public umbrella open-ended fund company established under Global X Exchange Traded Funds Series OFC - Global X China Life Franklin HK-US Equity Select ETF (Listed Class) 2 Hong Kong law with variable capital with limited liability and segregated liability between sub -funds."
19,The Sub-Fund is a passively managed index tracking exchange traded fund falling under Chapter 8.6 of the Code on Unit Trusts and Mutual Funds (the “Code”).
20,• The Sub-Fund offers both listed class of Shares (the “Listed Class of Shares”) and unlisted classes of Shares (the “Unlisted Classes of Shares”).
21,"This statement contains information about the offering of the Listed Class of Shares, and unless otherwise specified, references to “Shares” in this statement shall refer to the “Listed Class of Shares”."
22,Investors should refer to a separate statement for the offering of the Unlisted Classes of Shares.
23,• The Listed Class of Shares of the Sub -Fund are listed on The Stock Exchange of Hong Kong Limited (the “SEHK”) and are traded on the SEHK like listed stocks.
24,"Objective and investment strategy Objective The investment objective of the Sub -Fund is to provide investment results that, before fees and expenses, closely correspond to the performance of the CSI Select Market Moderate Index (the “Index”)."
25,"Strategy In order to achieve its investment objective, the Sub-Fund intends to adopt a combination of physical representative sampling and synthetic representative sampling strategy."
26,"The Sub -Fund will (i) primarily use a physical representative sampling strategy by investing 50% to 100% of its NAV in securities constituting the Index (“Index Securities”); and (ii) where the Manager believes such investments are beneficial to the Sub -Fund and will help the Sub -Fund achieve its investment objective, use a synthetic representative sampling strategy as an ancillary strategy by investing up to 50% of its NAV in financial derivative instruments (“FDIs”), which will only be funded total return swaps with one or more counterparties."
27,Physical representative sampling strategy (primary strategy) The Sub-Fund primarily uses a physical representative sampling strategy by investing 50% to 100% of its NAV in Index Securities and in a portfolio featuring high correlation with the Index .
28,"The Sub-Fund may invest up to 100% of its NAV directly in equity securities listed on the SEHK, NASDAQ and New York Stock Exchange."
29,The Sub-Fund may not invest in all Index Securities and may hold securities which are not Index Securities.
30,"Synthetic representative sampling strategy (ancillary strategy) On an ancillary basis, t he Sub-Fund’s synthetic representative sampling strategy will involve investing up to 50% of its NAV in FDIs, which will only be direct investment in funded total return swap transaction(s) whereby the Sub -Fund will pass on the relevant portion of cash to the counterparty(ies) of the Sub-Fund pursuant to a Swap (the “Swap Counterparty(ies)”) and in return the Swap Counterparty(ies) will provide the Sub-Fund with an exposure to the economic gain/loss in the performance of the Index Se curities (net of swap fees )."
31,The Manager will only use a synthetic representative sampling strategy when it considers that such investments are beneficial to the Sub-Fund.
32,The Sub-Fund shall bear the swap fees payable to the Swap Counterparty each time the Sub -Fund enters into a swap transaction.
33,"The swap fees represent the brokerage commission , transaction costs, and the Swap Counterparty’s execution costs and bid offer spreads incurred by the Swap Counterparty when entering into and maintaining the referenced equity positions for the relevant swaps ."
34,"In extreme market conditions and exceptional circumstances, the brokerage commission and the Swap Counterparty’s costs as mentioned above may increase significantly and in return increase the swap fees."
35,Swap fees are accrued daily and spread out over the month in line with the underlying transactions.
36,The maximum unwinding fee payable by the Sub -Fund is 0.2% per transaction on the notional amount of the swap unwound.
37,"The Manager will obtain collateral that represents at least 100% of the Sub-Fund’s gross total counterparty risk, and will manage the Sub-Fund to ensure that the collateral held by the Sub-Fund will represent at least 100% of the Sub-Fund’s gross total counterparty risk exposure."
38,The Swap Counterparty(ies) shall post collateral to the Sub-Fund in respect of the fully funded total return swaps.
39,"The total return swaps shall be marked-to-market on a daily basis with a view to ensuring that there is no uncollateralised counterparty risk exposure at the end of a trading day (subject to intra -day price movements, market risk and settlement risk etc.)."
40,The valuation of the collateral and the calculation of counterparty risk exposure in respect of any trading day T generally occurs at the end of that trading day.
41,"If the collateral held by the Sub- Fund is not at least 100% of the Sub -Fund’s gross total counterparty risk exposure in respect of any trading day T, by the end of that trading day T, the Manager will generally require that each Swap Counterparty deliver additional collateral assets (i.e."
42,"top-up variation margin) to make up for the difference in value, with the settlement of such delivery expected to occur on or before trading day T+2."
43,Each Swap Counterparty will deliver collateral with a view to reduce the ne t exposure of the Sub-Fund to each Swap Counterparty to 0%.
44,"The collateral may take such form as the Manager considers appropriate, and the Manager expects it to be in the form Global X Exchange Traded Funds Series OFC - Global X China Life Franklin HK-US Equity Select ETF (Listed Class) 3 of bonds and/or cash and subject to the haircut policy as set out in the sub-section entitled “Collateral” under the section “Investment Objective, Strategy and Restrictions, Securities Lending and Borrowing” in Part 1 of the Prospectus."
45,The swap fees will be disclosed in the interim and annual financial reports of the Sub-Fund.
46,"The swap fees will be borne by the Sub-Fund and hence may have an adverse impact on the NAV and the performance of the Sub-Fund, and may result in higher tracking error."
47,Exposure of the Sub -Fund to the Index Securities (either through direct investment or FDIs) will be in substantially the same weightings (i.e.
48,proportions) as these Index Securities have in the Index.
49,The Manager may cause the Sub-Fund to deviate from the index weighting on condition that the maximum deviation from the index weighting of any constituent will not exceed 3% or such other percentage as determined by the Manager after consultation with the SFC.
50,The diagram below shows the investment strategies of the Sub-Fund: Other investments The Sub-Fund may also invest not more than 5% of its NAV in cash and money market funds for cash management purpose.
51,No more than 30% of the Sub-Fund’s NAV may be invested in collective investment schemes that have high correlation with the Index which may be authorised by the SFC in accordance with all the applicable requirements of the Code.
52,"For the avoidance of doubt, the Sub-Fund’s investment in the money market funds mentioned in the preceding paragraph is not subject to this limit."
53,"Any investments in exchange traded funds will be considered and treated as collective investment schemes for the purposes of and subject to the requirements in 7.11, 7.11A and 7.11B of the Code."
54,"Other than as set out above, the Sub-Fund may also invest in FDIs for hedging purposes."
55,"The Sub-Fund will not enter into securities lending transactions, sale and repurchase transactions, reverse repurchase transactions and other similar over -the-counter transactions."
56,Prior approval of the SFC (to the extent required under applicable regulatory requirements) will be sought and not less than one month’s prior notice (or such shorter notice period as may be permitted under applicable regulatory requirements) will be given to Shareholders in the event the Manager wishes to enter into such transactions.
57,The investment strategy of the Sub -Fund is subject to the investment and borrowing restrictions set out in Part 1 of the Prospectus.
58,Index The CSI Select Market Moderate Index (the “Index”) selects 45 listed company securities from the CSI Hong Kong Connect High Dividend Yield Investment Index (the “HK Connect Index”) and the CSI US stock 30 Index (the “US Index”) as constituents.
59,The Index seeks to reflect the overall performance of the corresponding listed company securities.
60,"The Index was launched on 20 July 2012 and has a base value of 1000 on its base date, being 31 December 2004."
61,"The index universe of the HK Connect Index consists of eligible securities of Hong Kong Stock Connect Southbound Trading in CSI HK300 index constituents , and eligible securities have to satisfy the liquidity criteria of an average daily trading value of not less than HK$ 50 million over the past year; and dividend criteria, namely paying dividend in each of the last 3 years, with (i) a mean of payout ratio in the last 3 years and (ii) payout ratio in the last year both between 0 and 1."
62,"The index universe of the US Index consists of eligible securities of listed companies on the NASDAQ and New York Stock Exchange in non-financial sectors, and eligible securities have to be listed for at least three months and satisfy the average monthly turnover rate of at least 0.05% of the free float market capitalisation over the past 12 months or the past 3 months."
63,30 Hong Kong-listed securities (from the HK Connect Index) and 15 US-listed securities (from the US Index) are selected as constituents of the Index.
64,"For the Hong Kong-listed candidates, they are ranked by the average dividend Sub-Fund (Representative sampling strategy) Physical representative sampling strategy (primary strategy) (50% - 100% of NAV) Synthetic representative sampling strategy (ancillary strategy) (Up to 50% of NAV) Equity securities listed on Hong Kong and US stock exchanges FDIs (funded total return swaps) Global X Exchange Traded Funds Series OFC - Global X China Life Franklin HK-US Equity Select ETF (Listed Class) 4 yield over the past 3 years in descending order , and the top 30 securities are selected as Index constituents."
65,"For US- listed candidates, securities are ranked by average daily total market capitalisation of the most recent year in descending order, and the top 15 securities are selected as Index constituents."
66,"The Index is a price return, free-float market capitalisation-weighted index."
67,"A price return index reflects the market price movements of the Index constituents, disregarding any payments made in respect of the Index constituents."
68,The weight of a selected Index constituent will be determined based on its total market capitalisation and subject to a single security cap of 10%.
69,"Additionally, the overall index weighting allocation will be divided between (i) Hong Kong -listed securities eligible under Stock Connect and (ii) US-listed securities, at 65% and 35%, respectively."
70,Adjustment of the Index constituents occurs semi -annually.
71,Such constituent adjustments will be effective as of the next trading day after the second Friday in June and December.
72,"In addition, rebalancing of the Index occurs at the end of March and Septembe r."
73,Such rebalancing adjustments will be effective at the last trading day of March and September.
74,"The Index is compiled and managed by the China Securities Index Co., Ltd."
75,(the “Index Provider”).
76,The Manager and the Sub-Investment Manager (and each of their Connected Persons) are independent of the Index Provider .
77,"As of 26 February 2026, the Index consists of 45 stocks with full market capitalisation of USD$31.21 trillion."
78,The most updated list of the constituents of the Index and their respective weightings and additional information and other important news of the Index can be obtained from the website of the Index Provider at https://www.csindex.com.cn/#/indices/family/detail?indexCode=932690 (the contents of which has not been reviewed by the SFC).
79,Bloomberg code: CS932690 Use of derivatives/ investment in derivatives The Sub-Fund’s net derivative exposure may be up to 50% of the Sub-Fund’s NAV.
80,What are the key risks?
81,Investment involves risks.
82,You may suffer substantial / total loss by investing in this Sub -Fund.
83,Please refer to the Prospectus for details including the risk factors.
84,General investment risk • The Sub-Fund’s investment portfolio may fall in value due to any of the key risk factors below and therefore your investment in the Sub-Fund may suffer losses.
85,There is no guarantee of the repayment of principal.
86,"Equity market risk • The Sub-Fund’s investment in equity securities is subject to general market risks, whose value may fluctuate due to various factors, such as changes in investment sentiment, political, geopolitical and economic conditions and issuer-specific factors."
87,Concentration in high dividend stocks and associated risk • The Hong Kong constituents of the Sub -Fund are high dividend stocks listed on the SEHK which subjects it to greater concentration risk.
88,"High dividend stocks often belong to specific sectors, which may not be as diversified as the broader market potentially leading to greater exposure to sector -specific risks and market fluctuations."
89,"This concentration may lead to increased volatility and risk, particularly if these sectors experience downturns or regulatory changes."
90,"Additionally, companies that offer high dividends may, in challenging economic environments, might reduce or suspend dividend payments, in turn impacting the Sub-Fund's performance."
91,"There is no assurance that dividends will be declared and paid in respect of the securities comprising the Index, a nd dividend payment rates in respect of such securities will depend on the performance of the constituent securities of the Index as well as factors beyond the control of the Manager."
92,Geographical concentration risk • The Sub-Fund’s investments are concentrated in Hong Kong and the United States.
93,"The value of the Sub -Fund may be more volatile than that of a fund having a more diverse portfolio of investments and may be more susceptible to adverse economic, political, po licy, foreign exchange, liquidity, tax, legal or regulatory event affecting the Hong Kong and the United States markets."
94,"Sector concentration risk • The constituents of the Index, and accordingly the Sub-Fund’s investments, may from time to time be concentrated in companies in a particular industry or sector."
95,"The value of the Sub-Fund may be more volatile than that of a fund having a more diverse portfolio of investments and may be more susceptible to adverse economic, political, policy, foreign exchange, liquidity, tax, legal or regulatory event affecting the relevant sector."
96,"• The constituents of the US Index, and accordingly the Sub-Fund’s investments, may be concentrated in the artificial intelligence (“AI”) sector."
97,"The value of the Sub-Fund may be more volatile than that of a fund having a more diverse portfolio of investments and may be more susceptible to adverse economic, political, policy, foreign exchange, liquidity, tax, legal or regulatory event affect ing the AI sector."
98,"Constituents of the US Index that centred on AI, Global X Exchange Traded Funds Series OFC - Global X China Life Franklin HK-US Equity Select ETF (Listed Class) 5 presents risks such as high computational demands, potential biases in AI outputs, and cybersecurity vulnerabilities, as well as regulatory challenges such as compliance with evolving laws and intellectual property disputes."
99,The business for companies in this theme is subject to high volatility which may in turn have adverse effects on the Sub- Fund.
100,• Many of the companies in the AI sector have a relatively short operating history.
101,Companies in the AI sector are often characterised by relatively higher volatility in price performance when compared to other economic sectors.
102,"Companies in the technology sector also face intense competition, and there may also be substantial government intervention, which may have an adverse effect on profit margins."
103,Rapid changes could render obsolete the products and services offered by these companies.
104,"These companies are also subject to the risks of loss or impairment of intellectual property rights or licences, cyber security risks resulting in undesirable legal, financial, operational and reputational consequences."
105,A downturn in the business for companies in the AI sector theme may have adverse effects on the Sub-Fund.
106,Synthetic replication strategy risk The Manager seeks to mitigate the counterparty risks by fully collateralising all counterparty exposures.
107,There is a risk that the value of the collateral may be substantially lower than the amount secured and so the Sub-Fund may suffer significant losses.
108,Any loss would result in a reduction in the NAV of the Sub-Fund and impair the ability of the Sub-Fund to achieve its investment objective of tracking the Index.
109,The Sub-Fund may suffer significant losses if the counterparty fails to perform its obligations under the funded Swap.
110,"The value of the collateral assets (in the case of funded total return swaps) may be affected by market events and may diverge substantially from the performance of the Index, which may cause the Sub-Fund’s exposure to the Swap Counterparty to be under -collateralised (in the case of funded total return s waps) and therefore result in significant losses."
111,Small-capitalisation / mid-capitalisation companies risk The Sub -Fund may invest in stocks of small -capitalisation / mid -capitalisation companies.
112,The stock of small - capitalisation / mid-capitalisation companies may have lower liquidity and their prices are more volatile to adverse economic developments than those of larger capitalisation companies in general.
113,Mega-capitalisation companies risk Some of the constituents of the Index are mega -capitalisation companies that are relatively mature compared to smaller companies and therefore subject to slower growth during times of economic expansion.
114,They may struggle with flexibility to respond quickl y to disruptions and changes in trends.
115,"The high valuation of mega -capitalisation companies can make them more susceptible to market corrections, downturns and changes in interest rates."
116,"Moreover, mega -capitalisation companies typically have high price -to-earnings ratio than smaller capitalisation companies which can lead to overvaluation and may indicate there is less room for gains and even potential downward price adjustment."
117,"Mega -capitalisation companies usually exert market dominance and therefore frequently face regulatory pressures, in particular antitrust scrutiny."
118,This leads to legal challenges and increased costs which may in turn affect profitability.
119,Risks associated with investments in FDIs • The Sub-Fund’s synthetic representative sampling strategy will involve investing up to 50% of its NAV in funded total return swaps.
120,"In the case of swaps, the Sub -Fund may suffer significant loss if a Swap Counterparty fails to perform its obligations, or in case of insolvency or default of the Swap Counterparty(ies)."
121,"Total return swaps typically involve a combination of liquidity risk, counterparty risk and legal risk."
122,"A total return swap is a bilateral agreement that involves a counterparty which may, for any reason, not be in a position to fulfil its obligations under the total return swap."
123,"Each total return swap is a bespoke transaction, including with respect to its reference obligation, duration, and contractual terms."
124,"Such a lack of standardisation ma y adversely affect the price or conditions under which a total return swap can be sold, liquidated or closed out."
125,"Over -the-counter (OTC) markets, in which total return swaps are traded, are subject to less governmental regulation and supervision of transactions than organised exchanges."
126,"Many of the protections afforded to participants on some organised exchanges, such as the performance guarantee of an exchange clearing house, may not be available in connection with transactions carried out on OTC markets."
127,• The Sub-Fund may also invest in FDIs for hedging purposes.
128,"Risks associated with FDIs include counterparty/credit risk, liquidity risk, valuation risk, volatility risk and over -the-counter transaction risk."
129,"FDIs are susceptible to price fluctuations and higher volatility, and may have large bid and offer spreads and no active secondary markets."
130,The leverage element/component of an FDI can result in a loss significantly greater than the amount invested in the FDI by the Sub-Fund.
131,Exposure to FDIs may lead to a high risk of significant loss by the Sub-Fund.
132,Currency risk • The Shares traded in the RMB counter and the USD counter are denominated in a currency other than the base currency of the Sub-Fund.
133,Underlying investments of the Sub -Fund may also be denominated in currencies other Global X Exchange Traded Funds Series OFC - Global X China Life Franklin HK-US Equity Select ETF (Listed Class) 6 than the base currency of the Sub -Fund.
134,The NAV of the Sub -Fund and its performance may be affected unfavourably by fluctuations in the exchange rates between these currencies and the base currency and by changes in exchange rate controls.
135,"RMB currency risk • RMB is currently not freely convertible and is subject to exchange controls and restrictions which, under exceptional circumstances, may cause a delay in payment of redemptions in RMB."
136,"Although offshore RMB (CNH) and onshore RMB (CNY) are the same currency, they trade at different rates."
137,Any divergence between CNH and CNY may adversely impact investors.
138,"Multi-counter trading risk • If there is any limitation on the level of services by brokers and CCASS participants, Shareholders will only be able to trade their Shares in the relevant counter on the SEHK."
139,"• The market price on the SEHK of Shares traded in HKD, USD and RMB may deviate significantly due to different factors, such as market liquidity, supply and demand in each counter and the exchange rate between the RMB and the HKD or the USD (in both the onshore and the offshore markets)."
