sentence_id,text
140,As such investors may pay more or receive less when buying or selling Shares traded in HKD or USD on the SEHK than in respect of Shares traded in RMB and vice versa.
141,• Investors without RMB accounts may buy and sell HKD or USD traded Shares only.
142,They will not be able to buy or sell RMB traded Shares.
143,Investors should also note that distributions are made in HKD only.
144,"As such, investors may suffer a foreign exchange loss and incur foreign exchange associated fees and charges to receive their dividend."
145,"• Not all brokers and CCASS participants may be familiar with the single International Securities Identification Number approach for Multi-counter Eligible Securities adopted in June 2025 or may not be operationally ready, and as such may not be able to (i) buy Shares in one counter and to sell Shares in the other, or (ii) trade Shares in different counters at the same time."
146,This may result in potential settlement failure or delay.
147,Differences in dealing arrangements between Listed and Unlisted Classes of Shares risk • Investors of Listed Class of Shares and Unlisted Classes of Shares are subject to different pricing and dealing arrangements.
148,The NAV per Share of each of the Listed Class of Shares and Unlisted Classes of Shares may be different due to different fees and cost applicable to each class.
149,The trading hours of the SEHK applicable to the Listed Class of Shares in the secondary market and the dealing deadlines in respect of the Unlisted Classes of Shares are also different.
150,"• Shares of the Listed Class of Shares are traded on the stock exchange on an intraday basis at the prevailing market price (which may diverge from the corresponding NAV), while Shares of the Unlisted Classes of Shares are sold through intermediaries based on the dealing day-end NAV and are dealt at a single valuation point with no access to intraday liquidity in an open market."
151,"Depending on market conditions, investors of the Listed Class of Shares may be at an advantage or disadvantage compared to investors of the Unlisted Classes of Shares."
152,"• In a stressed market scenario, investors of the Unlisted Classes of Shares could redeem their Shares at NAV while investors of the Listed Class of Shares in the secondary market could only redeem at the prevailing market price (which may diverge from the corresponding NAV) and may have to exit the Sub-Fund at a significant discount."
153,"On the other hand, investors of the Listed Class of Shares could sell their Shares on the secondary market during the day thereby crystallising their positions while investors of the Unlisted Classes of Shares could not do so in a timely manner until the end of the day."
154,Differences in cost mechanisms between Listed and Unlisted Classes of Shares risk • Investors should note that different cost mechanisms apply to Listed Class of Shares and Unlisted Classes of Shares.
155,"For Listed Class of Shares, the transaction fee and duties and charges in respect of creation and redemption applications are paid by the p articipating dealers applying for or redeeming such Shares and/or the Manager."
156,"Investors of Listed Class of Shares in the secondary market will not bear such transaction fees and duties and charges (but for the avoidance of doubt, may bear other fees, suc h as SEHK trading fees)."
157,"• On the other hand, the subscription and redemption of Unlisted Classes of Shares may be subject to a subscription fee and redemption fee, respectively, which will be payable to the Manager by the investor subscribing or redeeming."
158,"In addition, in order to protect the interests of all Shareholders of Unlisted Classes of Shares, in the event of substantial net subscriptions or net redemptions of an Unlisted Class of Shares of the Sub -Fund and/or exceptional market circumstances, in addition to the Subscription Price and/or Redemption Price, the Manager may (in its absolute discretion and taking into account the best interests of the Shareholders) impose a fiscal charge to account for the impact of the related costs."
159,• Any or all of these factors may lead to a difference in the NAV of the Listed Class of Shares and the Unlisted Classes of Shares.
160,Risk of delegation to the Sub-Investment Manager • The Manager has delegated the investment discretion in respect of the Sub-Fund to the Sub-Investment Manager.
161,The Sub-Investment Manager will utilise its expertise and systems for the Sub -Fund’s investments.
162,Any disruption Global X Exchange Traded Funds Series OFC - Global X China Life Franklin HK-US Equity Select ETF (Listed Class) 7 in the communication with or assistance from the Sub -Investment Manager or a loss of service of the Sub - Investment Manager or any of its key personnel may adversely affect the operations of the Sub -Fund.
163,The implementation of the delegation arrangement is also dependent on the ongoing monitoring and supervision of the Sub-Investment Manager by the Manager.
164,Passive investment risk • The Sub-Fund is passively managed and the Manager will not have the discretion to adapt to market changes due to the inherent investment nature of the Sub-Fund.
165,Falls in the Index are expected to result in corresponding falls in the value of the Sub-Fund.
166,"Tracking error risk • The Sub-Fund may be subject to tracking error risk, which is the risk that its performance may not track that of the Index exactly."
167,"This tracking error may result from the investment strategy used, and fees and expenses."
168,The Manager will monitor and seek to manage such risk in minimising tracking error.
169,There can be no assurance of exact or identical replication at any time of the performance of the Index.
170,Trading risks • The trading price of the Shares on the SEHK is driven by market factors such as the demand and supply of the Shares.
171,"Therefore, the Shares may trade at a substantial premium or discount to the Sub -Fund’s NAV."
172,• As investors will pay certain charges (e.g.
173,"trading fees and brokerage fees) to buy or sell Shares on the SEHK, investors may pay more than the NAV per Share when buying Shares on the SEHK, and may receive less than the NAV per Share when selling Shares on the SEHK."
174,• The Shares in the RMB counter are RMB denominated securities traded on the SEHK and settled in CCASS.
175,Not all stockbrokers or custodians may be ready and able to carry out trading and settlement of the RMB traded Shares.
176,The limited availability of RMB outside the PRC may also affect the liquidity and trading price of the RMB traded Shares.
177,"Trading differences risks • As the relevant stock exchanges on which the Index constituents are listed may be open when the Shares in the Sub-Fund are not priced, the value of the securities in the Sub-Fund’s portfolio may change on days when investors will not be able to purchase or sell the Sub-Fund’s Shares."
178,• Differences in trading hours between the relevant stock exchanges and the SEHK may also increase the level of premium or discount of the Share price to its NAV.
179,• Shares listed on certain stock exchanges are subject to trading bands which restrict increase and decrease in the trading price.
180,Shares listed on the SEHK are not.
181,This difference may also increase the level of premium or discount of the Share price to its NAV.
182,"Termination risk • The Sub-Fund may be terminated early under certain circumstances, for example, where the Index is no longer available for benchmarking or if the NAV of the Sub-Fund is less than HK$50,000,000 (or its equivalent in the Sub- Fund’s base currency)."
183,Investors may not be able to recover their investments and suffer a loss when the Sub-Fund is terminated.
184,Risk of investing in other collective investment schemes • The underlying funds in which the Sub-Fund may invest may not be regulated by the SFC.
185,There will be additional costs involved when investing into these underlying funds.
186,There can also be no assurance that an underlying fund’s investment strategy will be successful or that its investment objective will be achieved.
187,There is also no guarantee that the underlying funds will always have sufficient liquidity to meet the Sub-Fund’s redemption requests as and when made.
188,"Reliance on market maker risk • Although the Manager will use its best endeavours to put in place arrangements so that at least one Market Maker will maintain a market for the Shares in each counter, and that at least one Market Maker for each counter gives not less than three months’ notice prior to terminating market making arrangement under the relevant market maker agreement, liquidity in the market for Shares in a counter may be adversely affected if there is no or only one Market Maker for the Shares in that counter."
189,There is also no guarantee that any market making activity will be effective.
190,• There may be less interest by potential market makers making a market in Shares denominated and traded in RMB.
191,Any disruption to the availability of RMB may adversely affect the capability of market makers in providing liquidity for the Shares.
192,Distributions paid out of capital / effectively out of capital risk • Payments of distributions out of capital or effectively out of capital amounts to a return or withdrawal of part of an investor’s original investment or from any capital gains attributable to that original investment.
193,Any such distributions may result in a n immediate reduction in the NAV per Share of the Sub -Fund and will reduce the capital available for future investment.
194,Global X Exchange Traded Funds Series OFC - Global X China Life Franklin HK-US Equity Select ETF (Listed Class) 8 How has the Sub-Fund performed?
195,"Since the Sub-Fund is newly set up, there is insufficient data available to provide a useful indication of past performance to investors."
196,Is there any guarantee?
197,The Sub-Fund does not have any guarantees.
198,You may not get back the amount of money you invest.
199,What are the fees and charges?
200,"Charges incurred when trading the Sub-Fund on SEHK Fee What you pay Brokerage fee Market rates Transaction levy 0.0027%1 of the trading price Accounting and Financial Reporting Council (“AFRC”) transaction levy 0.00015%2 of the trading price Trading fee 0.00565%3 of the trading price Stamp duty Nil 1 Transaction levy of 0.0027% of the trading price of the Shares, payable by each of the buyer and the seller."
201,"2 AFRC transaction levy of 0.00015% of the trading price of the Shares, payable by each of the buyer and the seller."
202,"3 Trading fee of 0.00565% of the trading price of the Shares, payable by each of the buyer and the seller."
203,Ongoing fees payable by the Sub-Fund The following expenses will be paid out of the Sub-Fund.
204,They affect you because they reduce the NAV of the Sub-Fund which may affect the trading price.
205,"Annual rate (as a % of the Sub-Fund’s NAV) Management fee * Currently 0.75% per annum Custodian fee Included in the Single Management Fee (as defined below) Performance fee Not applicable Administration fee Not applicable Registrar fee Included in the Single Management Fee * The management fee is a single flat fee, payable out of the assets of the Sub -Fund, to cover all of the fees, costs and expenses associated with the Sub-Fund (and its due proportion of any costs and expenses of the Company allocated to it) (the “Single Management Fee”)."
206,"As the Single Management Fee is a single fixed rate, the ongoing charges figure of the Sub-Fund will be equal to the Single Management Fee."
207,"Any costs, fees and expenses associated with the Sub-Fund exceeding the Single Management Fee shall be borne by the Manager and shall not be charged to the Sub -Fund."
208,"For the avoidance of doubt, the Single Management Fee does not include (to the extent not included in the operational fees as set out in the Prospectus) brokerage and transaction costs such as the fees and charges relating to the investment and realisation of investments of the Sub-Fund and extraordinary items such as litigation expenses."
209,Please note the Single Management Fee may be increased up to a permitted maximum level by providing one month’s prior notice to Shareholders.
210,Please refer to the section headed “Fees and Expenses” of the Prospectus for details.
211,Other fees You may have to pay other fees when dealing in the Shares of the Sub-Fund.
212,Please refer to the Prospectus for details.
213,"Global X Exchange Traded Funds Series OFC - Global X China Life Franklin HK-US Equity Select ETF (Listed Class) 9 Additional information You can find the following information relating to the Sub -Fund (in English and Chinese) at the following website at https://www.globalxetfs.com.hk/ (which has not been reviewed or approved by the SFC): ◼ The Prospectus including this Product Key Facts Statement (as revised from time to time) ◼ The latest annual financial reports and interim half yearly unaudited financial reports (in English only) ◼ Any notices relating to material changes to the Sub -Fund which may have an impact on its investors such as material alterations or additions to the Prospectus (including this Product Key Facts Statement) or the constitutive documents of the Company and/or the Sub-Fund ◼ Any public announcements made by the Manager in respect of the Sub -Fund, including information with regard to the Sub-Fund and the Index, the suspension of the creations and redemptions of Shares, the suspension of the calculation of the NAV, the changes in fees and the suspension and resumption of trading in its Shares ◼ The near real time indicative NAV per Share of the Sub-Fund in HKD, RMB and USD (updated every 15 second throughout each dealing day) ◼ The last NAV of the Sub-Fund in HKD only and the last NAV per Share of the Sub-Fund in HKD, RMB and USD (updated on a daily basis on each Dealing Day) ◼ The past performance information of both the Listed Class of Shares and Unlisted Classes of Shares of the Sub- Fund ◼ The ongoing charges of both the Listed Class of Shares and Unlisted Classes of Shares of the Sub -Fund ◼ The annual tracking difference and tracking error of the Sub-Fund ◼ The full portfolio information of the Sub-Fund (updated on a daily basis) ◼ The latest list of the Participating Dealers and Market Makers for the Sub-Fund ◼ The composition of distributions (i.e."
214,"the relative amounts paid out of (i) net distributable income, and (ii) capital), if any, for a 12-month rolling period ◼ The proxy voting policy of the Manager The near real time indicative NAV per Share in USD and RMB and the last NAV per Share in USD and RMB are for reference only."
215,The near real time indicative NAV per Share in USD uses a real time HKD:USD foreign exchange rate – it is calculated using the near real -time indicative NAV per Share in HKD multiplied by a real -time HKD:USD foreign exchange rate provided by ICE Data Indices when the SEHK is opened for trading.
216,The near real time indicative NAV per Share in RMB uses a real time HKD:RMB foreign exchange rate – it is calculated using the near real-time indicative NAV per Share in HKD multiplied by a real -time HKD:RMB foreign exchange rate provided by ICE Data Indices when the SEHK is opened for trading.
217,"Since the indicative NAV per Share in HKD will not be updated when the underlying markets are closed, the change to the indicative NAV per Share in USD or RMB (if any) during such period is solely due to the change in the foreign exchange rate."
218,"The last Net Asset Value per Share in RMB and USD is indicativ e, is each calculated using the last Net Asset Value per Share in HKD multiplied by the respective RMB:HKD and USD:HKD exchange rates quoted by Thomson Reuters at 4:00pm (London Time) as of the same Dealing Day provided by the Custodian."
219,The official last Net Asset Value per Share in HKD and the indicative last Net Asset Value per Share in RMB and USD will not be updated when the underlying share market is closed.
220,"Important If you are in doubt, you should seek professional advice."
221,The SFC takes no responsibility for the contents of this statement and makes no representation as to its accuracy or completeness.
222,The Company has been registered with the SFC as an open -ended fund company.
223,The Company and the Sub -Fund have been authorised as collective investment schemes by the SFC.
224,"SFC registration and authorisation do not represent a recommendation or endorsement of the Company or the Sub-Fund nor do they guarantee the commercial merits of the Company, the Sub -Fund or their performance."
225,They do not mean the Company or the Sub -Fund i s suitable for all investors nor do they represent an endorsement of their suitability for any particular investor or class of investors.
