sentence_id,text
0,1 Product Key Facts CHINAAMC ASIA HIGH DIVIDEND ETF (Listed Class) A sub-fund established under the ChinaAMC Global ETF Series II China Asset Management (Hong Kong) Limited April 2026 This is a passive exchange traded fund.
1,This statement provides you with key information about this product.
2,This statement is a part of the offering document.
3,You should not invest in this product based on this statement alone.
4,Quick facts Stock code: 3145 Trading lot size: 200 Units Manager: China Asset Management (Hong Kong) Limited Investment Delegate : Mackenzie Financial Corporation – Canada (external delegation ) Trustee: State Street Trust (HK) Limited Registrar: Tricor Investor Services Limited Ongoing charges Estimated to be 0.85%# over a year: Estimated annual Tracking difference: Estimated to be-0.85%## Index: Bloomberg APAC High Dividend 40 Net Return Index HKD Base currency: HKD Trading currency: HKD Financial year end: 31 December Dividend policy: The Manager intends to distribute income to unitholders at least monthly.
5,"There is no guarantee of regular distribution payments, or the amount being distributed."
6,Distributions may be paid out of capital or effectively out of capital as well as income at the Manager’s discretion .
7,This may result in an immediate reduction of the NAV per unit of the Sub-Fund.
8,# This is a best estimate figure as the Sub -Fund no longer adopts a single management fee structure and the management fee for the Listed Class of Units has increase d from 0.45% per annum to 0.60% per annum of the Net Asset Value of the relevant class with effect from 31 October 2025.
9,It represents the sum of the estimated ongoing expenses chargeable to the relevant class of the Sub-Fund over a 12 -month period expressed as a percentage of the average Net Asset Value of the relevant class over the same period.
10,The actual figure may be different and may vary from year to year.
11,## This is an estimated annual tracking difference.
12,Investors should refer to the website of the Sub -Fund for more up -to-date information on actual tracking difference.
13,2 ETF website: www.chinaamc.com.hk (this website has not been reviewed by the SFC) What is this product?
14,ChinaAMC Asia High Dividend ETF (the “ Sub-Fund”) is a fund constituted in the form of a unit trust established under Hong Kong law and is a sub -fund of the ChinaAMC Global ETF Series II.
15,The Sub-Fund is a passively managed index tracking exchange traded fund falling under Chapter 8.6 of the Code on Unit Trusts and Mutual Funds issued by the SFC.
16,The Sub-Fund offers both listed class of Units (the “Listed Class of Units”) and unlisted classes of Units (the “Unlisted Classes of Units”).
17,"This statement contains information about the offering of the Listed Class of Units, and unless otherwise specifie d, references to “Units” in this statement shall refer to the “Listed Class of Units”."
18,Investors should refer to a separate statement for the offering of the Unlisted Classes of Units.
19,The Listed Class of Units are listed on The Stock Exchange of Hong Kong Limited (the “SEHK”) and are traded on the SEHK like listed stocks.
20,"Objective and Investment Strategy Objective The Sub -Fund aims to provide investment results that, before fees and expenses, closely correspond to the performance of the Bloomberg APAC High Dividend 40 Net Return Index HKD (the “Index”)."
21,Strategy The Manager intends to adopt primarily a full replication strategy to achieve the investment objective of the Sub -Fund.
22,"The Manager may however, in the appropriate circumstances, choose to use a representative sampling strategy."
23,"When the Sub -Fund adopts the replication strategy, it will invest in substantially all the Index securities constituting the Index in substantially the same weightings (i.e."
24,proportions) as these Index securities have in the Index.
25,"When the Sub-Fund adopts the representative sampling strategy, it will invest, either directly or indirectly, in securities comprised in the Index, or in securities that are not included in its Index, but which the Manager believes will help the Sub -Fund a chieve its investment objective."
26,"In pursuing a representative sampling strategy, the Manager may cause the Sub -Fund to deviate from the Index weighting on the condition that the maximum deviation from the Index weighting of any constituent will not exceed 3% or such other percentage as determined by the Manager after consultation with the SFC."
27,The Sub-Fund may invest not more than 10% of its Net Asset Value (“NAV”) in other physical exchange traded funds (“ETFs”) to gain exposure to the performance of the Index.
28,Investors should note that the Manager may switch between the full replication and representative sampling strategies without notice to investors and in its absolute discretion.
29,"The Sub-Fund may invest in financial derivative instruments (“FDIs”), including but not limited to futures and total return index swaps, for hedging or non-hedging (i.e."
30,investment) purposes.
31,The 3 Sub-Fund’s holdings of FDIs for non-hedging (i.e.
32,investment) purposes will not exceed 10% of its NAV.
33,"The Sub-Fund currently does not intend to engage in securities lending transactions, sale and repurchase transactions or reverse repurchase transactions ."
34,"Where the Sub -Fund does engage in securities financing transactions, prior approval shall be obtained from the SFC (if so required) and no less than 1 month’s prior notice (or such other notice period as required by the Code) will be given to the Unitholde rs."
35,The investment strategy of the Sub-Fund is subject to the investment and borrowing restrictions set out in the Prospectus.
36,"The Manager has appointed Mackenzie Financial Corporation as investment delegate of the Sub-Fund, whereby the Investment Delegate exercises investment discretion in respect of the investments of the Sub-Fund and is responsible for the selection and ongoing monitoring of the Sub-Fund’s investments pursuant to the above investment objective and strategy , subject to the oversight of the Manager."
37,"Index The Index seeks to track the 40 companies with the highest estimated dividend yield from the Bloomberg APAC Large, Mid & Small Cap Index (the “ Parent Index ”), subject to currency, market and sector diversification ."
38,The Parent Index is a float market capitalization weighted equity benchmark that covers 99% of the market capitalisation in the Asia -Pacific (APAC) markets.
39,"For the purposes of the Parent Index, the APAC markets include Australia, Hong Kong, Japan, New Zealand , Singapore, China, India, Indonesia, Korea, Malaysia, the Philippines, Taiwan and Thailand."
40,The companies in the Index are weighted in proportion to their Bloomberg Estimates Dividend Yield1.
41,"Specifically, the weight of a constituent is calculated by dividing its Bloomberg Estimates Dividend Yield by the sum of the Bloomberg Estimates Dividend Yields of all constituents in the Index."
42,"To be eligible for inclusion in the Index, a company must be a constituent of the Parent Index, subject to further eligibility requirements specific to the Index in terms of stock exchange, security type and classes of securities ."
43,"Companies will then be subject to a 4 -step selection process, which includes (1) market data screening (which requires a company to have a minimum free float market capitalisation of USD750 million, a minimum 90-day average value traded at USD10 million and a Bloomberg Estimates D ividend Yield smaller than or equal to 20% ), (2) quality screening (which requires a company to be within the top 90 th percentile based on a composite quality rank derived from the leverage and return on equity ratios of the company), (3) diversification screening (which requires a company to rank within 15 th by Bloomberg Estimates Dividend Yield rank within the companies with same currency, market and sectors) and (4) final selection based on Bloomberg Estimates Dividend Yield."
44,"The Index was launched on 23 July 2025 and had a base level of 1,000 on 30 March 2015."
45,1 Bloomberg Estimates Dividend Yield is a ratio calculated by dividing the Bloomberg Estimates Dividend Per Share (BEst DPS) by the latest close price of the security.
46,"BEst DPS is calculated using a period -bound weighted average (Blended Forward) methodolog y and reflects the consensus estimate, which is the mean of at least three sell -side analyst estimates for Dividends Per Share."
47,The period -bound weighted average (Blended Forward) methodology combines dividend estimates for the current fiscal year (Year 1) and the next fiscal year (Year 2) to calculate a blended forward-looking estimate over a 12-month forward period.
48,"The Year 1 estimate is weighted based on the proportion of the 12 -month forward period that falls within the current fiscal year, while the Year 2 estimate is weighted by the remaining proportion of the 12-month forward period that falls within the next fiscal year."
49,4 The Index is a net total return index.
50,A net total return index calculates the performance of the index constituents on the basis that any dividends or distributions are reinvested after the deduction of any taxes that may apply.
51,"As of 19 March 2026 , the Index had a market capitalisation of HKD 3.63 trillion and 40 constituents."
52,The Index is denominated in HKD.
53,The Index is compiled and published by Bloomberg Index Services Limited (the “Index Provider”).
54,The Manager (and each of its Connected Persons) is independent of the Index Provider.
55,"You can obtain the most updated list of the constituents of the Index together with their respective weightings and additional information of the Index, including the index methodology, the closing level and other important news of the Index, from the website of the Index Provider at https://www.bloomberg.com/quote/BAHD40H:IND and https://www.bloomberg.com/professional/products/indices/documentation/."
56,Please refer to the Manager’s website for the latest hyperlink s for the Index (these websites have not been reviewed by the SFC).
57,Index Code Bloomberg Code: BAHD40NH Use of derivatives / investment in derivatives The Sub-Fund’s net derivative exposure may be up to 50% of its Net Asset Value.
58,What are the key risks?
59,Investment involves risks.
60,Please refer to the Prospectus for details including the risk factors.
61,High Dividend Yield Securities Risk • The Sub-Fund invests in high dividend yield securities which may offer a higher rate of dividend yield.
62,"However, high dividend yield securities are subject to risks that the dividend could be reduced or abolished, or the risks that the value of the securities could decline or have lower-than average potential for price appreciation."
63,Concentration in Asian Markets Risk / Emerging Market Risk • The Sub-Fund’s investments are concentrated in Asian markets.
64,"The value of the Sub- Fund may be more susceptible to adverse economic, political, policy, foreign exchange, liquidity, tax, legal or regulatory event affecting Asian markets."
65,• Certain Asian markets in which the Sub -Fund invests may be emerging markets .
66,"Investing in emerging markets involves a greater risk of loss than investing in more developed markets due to, among other factors, greater political, tax, economic, foreign exchange, liquidity and regulatory risks."
67,Sector Concentration Risk • The Sub-Fund’s investments may from time to time be concentrated in one or more sectors.
68,The value of the Sub -Fund may be more volatile than that of a fund having a more diverse portfolio of investments.
69,"The value of the Sub -Fund may be more susceptible to adverse economic, political, policy, foreign exchange, liquidity, tax, legal or regulatory event affecting the relevant sector."
70,5 Risk Associated with Small-Capitalisation / Mid-Capitalisation Companies • The stocks of small-capitalisation/ mid-capitalisation companies may have lower liquidity and their prices are more volatile and susceptible to adverse economic developments than those of larger capitalisation companies in general.
71,"Management Risk • Because there can be no guarantee that the Sub-Fund’s performance is identical to that of the Index, it is subject to management risk."
72,"This is the risk that the Manager’s and the Investment Delegate’s strategy, the implementation of which is subject to a number of constraints, may not produce the intended results."
73,"In addition, the Manager and the Investment Delegate (as a delegate of the Manager ) have absolute discretion to exercise Unitholders’ rights with respect to securities comprising the Sub -Fund."
74,There can be no guarantee that the exercise of such discretion will result in the investment objective of the Sub-Fund being achieved.
75,Reliance on the Investment Delegate Risk • The Manager has delegated the exercise of investment discretion for the Sub -Fund to the Investment Delegate.
76,Unitholders must rely on the Investment Delegate in implementing the investment strategies and the performance of the Sub-Fund is largely dependent on the services and skills of its officers and employees.
77,"In the case of loss of service of the Investment Delegate or any of its key personnel, as well as any significant interruption of the Investment Delegate's business operations or in the extreme case of the insolvency of the Investment Delegate, the trustee may not find successor managers/investment delegates with the requisite skills, qualifications and the new appointment may not be on equivalent terms or of similar quality."
78,The occurrence of any of these events may have an adverse impact on the Sub-Fund’s performance and thus the value of your investment.
79,New Index Risk • The Index is new and has minimal operating history by which investors can evaluate its previous performance.
80,The Sub-Fund may be riskier than other exchange traded funds tracking more established indices with longer operating history.
81,Tracking Error Risk • The Sub-Fund may use representative sampling strategy.
82,"It is therefore possible that the Sub-Fund may be subject to a greater risk of tracking error, which is the risk that its performance may not track that of the Index accurately."
83,"Other factors such as fees and expenses, and inability to rebalance the Sub-Fund’s holdings in response to changes to the Index may also cause tracking error."
84,There can be no assurance of exact or identical replication at any time of the performance of the Index.
85,Investment Risk • The Sub -Fund is an investment fund.
86,There is no guarantee of the repayment of principal.
87,Therefore your investment in the Sub-Fund may suffer losses.
88,Foreign Exchange Risk • An investment in the Sub-Fund may directly or indirectly involve exchange rate risk.
89,The constituent securities of the Index may be denominated in currencies other than the base 6 currency of the Sub-Fund (which is the HKD).
90,Fluctuations in the exchange rates between such currency and the base currency may have an adverse impact on the performance of the Sub-Fund.
91,Passive Investment Risk • The Sub -Fund is not actively managed and will not adopt any temporary defensive position against any market downturn.
92,"Therefore when there is a decline in the Index, the Sub -Fund will also decrease in value."
93,Investors may suffer significant losses accordingly.
94,"Risks associated with investment in FDIs • Risks associated with FDIs include counterparty/credit risk, liquidity risk, valuation risk, volatility risk and over -the-counter transaction risk."
95,The leverage element/component of an FDI can result in a loss significantly greater than the amount invested in the FDIs by the Sub -Fund.
96,Exposure to FDIs may lead to a high risk of significant loss by the Sub-Fund.
97,Differences in dealing arrangements between Listed and Unlisted Classes of Units • Investors of Listed and Unlisted Classes of Units are subject to different pricing and dealing arrangements.
98,The NAV per Unit of each of the Listed and Unlisted Classes of Units may be different due to different fees and cost applicable to each class.
99,The trading hours of The Stock Exchange of Hong Kong Limited applicable to the Listed Class of Units in the secondary market and the dealing deadlines in respect of the Listed Class of Units (on the primary market) or Unlisted Classes of Units are also different.
100,"• Units of the Listed Class of Units are traded on the stock exchange in the secondary market on an intraday basis at the prevailing market price (which may diverge from the corresponding NAV), while Units of the Unlisted Classes of Units are sold through intermediaries based on the dealing day -end NAV and are dealt at a single valuation point with no access to intraday liquidity in an open market."
101,"Depending on market conditions, investors of the Unlisted Classes of Units may be at an advantage or disadvantage compared to investors of the Listed Class of Units."
102,"• In a stressed market scenario, investors of the Unlisted Classes of Units could redeem their Units at NAV while investors of the Listed Class of Units in the secondary market could only redeem at the prevailing market price (which may diverge from the corresponding NAV) and may have to exit the Sub-Fund at a significant discount."
103,"On the other hand, investors of the Listed Class of Units could sell their Units on the secondary market during the day thereby crystallising their positions while investors of the Unlisted Classes of Units could not do so in a timely manner until the end of the day."
104,"Trading Risk • Generally, retail investors can only buy or sell Units on the SEHK."
105,The trading price of the Units on the SEHK is subject to market forces and may trade at a substantial premium or discount to the NAV per Unit.
106,• As investors will pay certain charges (e.g.
107,"trading fees and brokerage fees) to buy or sell Units on the SEHK, investors may pay more than the NAV per Unit when buying Units on the SEHK, and may receive less than the NAV per Unit when selling Units on the SEHK."
108,"Reliance on Market Makers Risk 7 • Although the Manager ensures that at least one market maker will maintain a market for the Units of the Sub -Fund, it should be noted that liquidity in the market for the Units may be adversely affected if there is no market maker for the Units of the Sub-Fund."
109,The Manager will seek to mitigate this risk by ensuring at least one market maker for the Units of the Sub-Fund gives not less than 3 months’ notice prior to terminating market making.
110,"It is possible that there is only one SEHK market maker to the Sub-Fund, or the Manager may not be able to engage a substitute market maker within the termination notice period of a market maker, and there is also no guarantee that any market making activity will be effective."
111,Distributions out of or effectively out of capital risks • Payment of dividends out of capital or effectively out of capital amounts to a return or withdrawal of part of an investor’s original investment or from any capital gains attributable to that original investment.
112,Any such distributions may result in an im mediate reduction in the NAV per Unit of the Sub-Fund.
113,This may also reduce the capital that the Sub-Fund has available for investment in future and may constrain capital growth.
114,"Early Termination Risk • The Sub-Fund may be terminated early under certain circumstances, for example, where the Index is no longer available for benchmarking or if the aggregate NAV of all the Units (including Unlisted Class(es) of Units) of the Sub -Fund is less than HKD100 million."
115,Investors should refer to “Termination” in the Prospectus for further details.
116,Investors may suffer a loss when the Sub-Fund is terminated.
117,Rebalancing Period Risk • The Index of the Sub -Fund was changed from the NASDAQ Asia ex Japan Dividend AchieversTM Index (the “Previous Index”) to the Bloomberg APAC High Dividend 40 Net Return Index HKD effective from 31 October 2025.
118,The rebalancing of assets held by the Sub-Fund as a result of the change in the Index is anticipated to take place over a period of up to 3 trading days (the “Rebalancing Period”).
119,"During the Rebalancing Period, the holdings of the Sub -Fund will be rebalanced from the constituents of the Previous Index to the constituents of the Index."
120,"During the Rebalancing Period, the tracking error and tracking difference of the Sub -Fund may increase due to the rebalancing activities."
121,Investors who deal with Units of the Sub -Fund during the Rebalancing Period should exercise caution.
122,"Past Performance Risk • As a result of the change in the Index, the past performance of the Sub-Fund prior to31 October 2025 was achieved under circumstances which no longer apply from 31 October 2025."
123,Investors should exercise caution when considering the past performance of the Sub-Fund prior to 31 October 2025.
124,How has the fund performed?
125,"8 Notes: (1) With effect from 23 December 2024, the investment strategy of the Sub -Fund was changed to allow investment in FDIs for hedging or non -hedging purposes and the holdings of FDIs for non-hedging purposes will not exceed 10% of the Sub -Fund’s NAV."
126,The performance of the Sub-Fund since then has factored in the above change.
127,"Since 28 May 2021, the Manager of the Sub-Fund changed from BMO Global Asset Management (Asia) Limited to China Asset Management (Hong Kong) Limited and the investment management function of the Sub-Fund has been delegated to Mackenzie Financial Corporation."
128,The performance of the Sub-Fund prior to 2021 was achieved under circumstances that no longer apply.
129,(2) The performance of the Sub -Fund prior to 31 October 2025 was achieved under circumstances that no longer apply as a result of a change in the underlying index of the Sub-Fund.
130,"Prior to 31 October 2025, t he underlying index of the Sub -Fund was NASDAQ Asia ex Japan Dividend Achievers TM Index."
131,T he underlying index of the Sub -Fund was changed to Bloomberg APAC High Dividend 40 Net Return Index HKD on 31 October 2025 .
132,Investors should exercise caution when considering the past performance of Sub-Fund during the above periods .
133,• Past performance information is not indicative of future performance.
134,Investors may not get back the full amount invested.
135,"• The computation basis of the performance is based on the calendar year end, NAV-to-NAV, with dividends reinvested."
136,• These figures show by how much the Listed Class of Units of the Sub-Fund increased or decreased in value during the calendar year shown.
137,Performance data is calculated in HKD including ongoing charges and excluding expenses payable by investors on the SEHK.
138,• Where no past performance is shown there was insufficient data available in that year to provide performance.
139,"• Underlying Index: Bloomberg APAC High Dividend 40 Net Return Index HKD (prior to 31 October 2025, NASDAQ Asia ex Japan Dividend AchieversTM Index) • Sub-Fund launch date: 13 November 2014 7.6% 38.8% -9.0% 18.1% 4.9% 6.6% -10.9% 12.2% 16.4% 21.6% 8.5% 38.2% -8.5% 18.8% 5.8% 7.5% -10.1% 13.0% 17.3% 23.2% -20.0% -10.0% 0.0% 10.0% 20.0% 30.0% 40.0% 50.0% 2016 2017 2018 2019 2020 2021 2022 2023 2024 2025 Product Index The performance prior to 2025 was achieved under circumstances that no longer apply as a result of a change in the underlying index of the Sub-Fund (please refer to Note (2) below)."
140,9 Is there any guarantee?
141,The Sub-Fund does not have any guarantees.
142,You may not get back the amount of money you invest.
143,What are the fees and charges?
144,Charges incurred when trading the fund on the SEHK Fee What you pay Brokerage fee Market rates Transaction levy 0.0027%2 Accounting and Financial Reporting Council (“AFRC”) transaction levy 0.00015%2 Trading fee 0.00565%3 Stamp duty Nil Ongoing fees payable by the Sub -Fund The following expenses will be paid out of the Sub -Fund.
145,They affect you because they reduce the NAV of the Sub-Fund which may affect the trading price.
146,"Annual rate (as a % of NAV) Management Fee* # 0.60% Trustee Fee* 0.07%, subject to a minimum fee of USD 7,000 per month Administration Fee Included in the Trustee Fee Performance Fee Nil Other Ongoing Costs Please refer to the Prospectus for details of ongoing costs payable by the Sub -Fund * The current fees in respect of the Sub-Fund as described above may be increased on notice to Unitholders, subject to the permitted maximum rates."
147,Please refer to the section headed “Fees and Expenses” in the Prospectus for further details of the fees and charges payable and the permitted maximum rates of such fee s allowed as well as other on -going expenses that may be borne by the Sub -Fund.
148,"# Where the Sub-Fund invests in funds which are managed by the Manager or its connected persons (the “underlying funds”), the Manager will procure that the underlying fund(s) will not charge any management fee in order to ensure no double -charging of management fees."
149,Other fees You may have to pay other fees when dealing in the Units of the Sub-Fund.
150,"Please refer to the Prospectus for details of other fees and expenses applicable to the creation or redemption, or dealing in Units."
151,You should also check with your intermediaries on the payment process including the currency that you should use for settling such fees and how they set the exchange rate to be used if any currency conversion is required in the transaction.
