sentence_id,text
152,"2 Transaction levy of 0.0027% of the trading price of the Units, payable by each of the buyer and the seller."
153,"2 AFRC transaction levy of 0.00015% of the trading price of the Units, payable by each of the buyer and the seller."
154,"3 Trading fee of 0.00565% of the trading price of the Units, payable by each of the buyer and the seller."
155,10 Additional Information You can find the following information in respect of the Sub -Fund at the following website at www.chinaamc.com.hk (this website has not been reviewed by the SFC).
156,"(a) the Prospectus and this product key fact s statement in respect of the Sub -Fund (as revised from time to time); (b) the latest annual audited accounts and interim half yearly unaudited report (in English only); (c) any notices for material alterations or additions to th e Prospectus or the Sub -Fund’s constitutive documents; (d) any public announcements made by the Sub -Fund, including information with regard to the Sub-Fund and Index, notices of the suspension of the calculation of the NAV, changes in fees and the suspension and resumption of trading; (e) the near-real time indicative NAV per Unit updated every 15 seconds during trading hours throughout each Dealing Day in HKD; (f) the last NAV of the Sub -Fund and the last NAV per Unit of the Listed Class of Units in HKD (updated on a daily basis) ; (g) the full holdings of the Sub-Fund (updated on a daily basis); (h) the latest list of the Participating Dealers and Market Makers; (i) the tracking difference and tracking error of the Sub-Fund; and (j) the composition of distributions (i.e."
157,the relative amounts of distributions paid and the percentages of dividends out of (i) net distributable income and (ii) capital) for a rolling 12- month period.
158,Real-time updates about the Index can be obtained through other financial data vendors.
159,"Additional and the latest updated information about the Index (including without limitation, a description of the way in which the Index is calculated, any change in th e composition of the Index, any change in the method for compiling and calculating the Index) can be obtained via the Manager’s website and the Index Provider’s website (neither of which, nor any other website referred to in this statement or the Prospectus, has been reviewed by the SFC)."
160,Please refer to the section on “Website Information” for the warning and the disclaimer regarding information contained in such website.
161,Please refer to the Prospectus for details.
162,"Important If you are in doubt, you should seek professional advice."
163,The SFC takes no responsibility for the contents of this statement and makes no representation as to its accuracy or completeness.
