sentence_id,text
151,"Additional information You can find the following information relating to the Sub-Fund (in English and in Chinese) at the following website https://cicchkam.com (which has not been reviewed or approved by the SFC):  The Prospectus including the Product Key Facts Statement (as revised from time to time)  The latest annual audited accounts and interim half yearly unaudited report of the Sub -Fund (in English only)  Any notices relating to material changes to the Sub-Fund which may have an impact on its investors such as material alterations or additions to the Prospectus including the Product Key Facts Statement or the constitutive documents of the Trust and/or the Sub-Fund  Any public announcements made by the Manager in respect of the Sub-Fund, including information with regard to the Sub-Fund, the suspension of creations and redemptions of Units, the suspension of the calculation of its NAV, changes in its fees and the suspension and resumption of trading in its Units CICC HKD Money Market ETF 9  The near real time indicative NAV per Unit of the Sub-Fund (updated every 15 seconds throughout each dealing day) in HKD  The last NAV of the Sub-Fund in HKD and the last closing NAV per Unit of the Sub-Fund in HKD  The ongoing charges figure and past performance information of all classes of the Sub-Fund  The full holdings of the Sub-Fund (updated on a monthly basis within one month of the end of each month)  The latest list of the Participating Dealers and Market Makers of the Sub-Fund  The composition of distributions (i.e."
152,"the relative amounts paid out of (i) net distributable income, and (ii) capital), if any, for a 12-month rolling period The near real time indicative NAV per Unit in HKD are indicative and for reference only."
153,This is updated every 15 seconds during SEHK trading hours and is calculated by Solactive AG.
154,"Important If you are in doubt, you should seek professional advice."
155,The SFC takes no responsibility for the contents of this statement and makes no representation as to its accuracy or completeness.
