sentence_id,text
0,CICC HKD Money Market ETF 1 PRODUCT KEY FACTS CICC HKD Money Market ETF (Listed Class) (a sub-fund of CICC Fund Series) China International Capital Corporation Hong Kong Asset Management Limited 29 April 2025 This is an active exchange traded fund.
1,This statement provides you with key information about this product.
2,This statement is a part of the Prospectus.
3,You should not invest in this product based on this statement alone.
4,"Quick facts Stock codes: 03071 – HKD counter Trading lot size: 1 Unit Manager: China International Capital Corporation Hong Kong Asset Management Limited Trustee and Registrar: Brown Brothers Harriman Trustee Services (Hong Kong) Limited Ongoing charges over a year*: 0.245% Dealing frequency: Daily (each Business Day as defined in the Prospectus) Base currency: Hong Kong Dollars (HKD) Trading currency: Hong Kong Dollars (HKD) – HKD counter Financial year end of this fund: 31 December Distribution policy: Subject to the Manager’s discretion, the Manager intends to pay distributions to Unitholders annually."
5,All units will receive distributions in the base currency (HKD) only.
6,Distributions may be made out of capital or effectively out of capital as well as income at the Manager’s discretion.
7,Any distributions out of capital or effectively out of capital may result in an immediate reduction in the net asset value (“NAV”) per Unit of the Sub-Fund (as defined below).
8,ETF website: https://cicchkam.com * The ongoing charges figure is based on expenses for the year ended 31 December 2024.
9,This figure may vary from year to year.
10,It represents the sum of the ongoing charges expressed as a percentage of the average NAV of the unit class for the corresponding period.
11,What is this product?
12,"CICC HKD Money Market ETF (the “Sub-Fund”) is a sub-fund of CICC Fund Series, which is an umbrella unit trust established under Hong Kong law."
13,The listed class of units of the Sub-Fund (“Listed Class of Units”) are listed on The Stock Exchange of Hong Kong Limited (the “SEHK”).
14,These Listed Class of Units are traded on the SEHK like listed stocks.
15,The Sub-Fund is an actively managed exchange traded fund under Chapters 8.2 and 8.10 of the Code on Unit Trusts and Mutual Funds (the “Code”).
16,CICC HKD Money Market ETF 2 The Sub-Fund offers both Listed Class of Units and unlisted class of Units (the “Unlisted Class of Units”).
17,"This statement c ontains information about the offering of the Listed Class of Units, and unless otherwise specified references to “Units” in this statement shall refer to the “Listed Class of Units”."
18,Investors should refer to a separate statement for the offering of Unlisted Class of Units.
19,The purchase of a Unit in the Sub-Fund is not the same as placing funds on deposit with a bank or deposit-taking company.
20,The Sub -Fund does not guarantee principal and the Manager has no obligation to redeem the Units at the offer value.
21,The Sub-Fund does not have a constant NAV.
22,The Sub-Fund is not subject to the supervision of the Hong Kong Monetary Authority.
23,Objective and investment strategy Objective The Sub-Fund’s objective is to invest in short -term deposits and high quality money market investments.
24,"The Sub-Fund seeks to achieve a return in Hong Kong Dollars in line with prevailing money market rates, with primary considerations of both capital preservation and liquidity."
25,There can be no assurance that the Sub-Fund will achieve its investment objective.
26,"Strategy The Sub-Fund will invest at least 70% of its NAV in Hong Kong Dollars (“ HKD”) denominated and settled short-term deposits and high quality money market instruments issued by governments, quasi - governments, international organisations and financial institutions."
27,"High quality money market instruments include debt securities, commercial papers, certificates of deposits and commercial bills."
28,"In assessing whether a money market instrument is of high quality, at a minimum the credit quality and the liquidity profile of the money market instruments will be taken into account."
29,The Sub -Fund will invest less than 30% of its NAV into non -HKD-denominated and settled short -term deposits and high quality money market instruments.
30,The Manager may hedge any non-HKD-denominated and settled investments into HKD to manage any material currency risk.
31,"The value of the Sub-Fund’s holding of investments in the form of short-term and high quality asset backed securities subject to the same criteria as set out below for selection of debt securities, such as mortgage backed securities and asset backed commercial papers, may not exceed 15% of its NAV."
32,The asset allocation of the Sub-Fund will change according to the Manager’s view of market conditions and the international investment trends and environment.
33,"The Manager will assess the yield of money market instruments, and will take into consideration factors such as currency risk, credit/counterparty risk liquidity, costs, timing of execution and the relative attractiveness of individual securities and issuers in the market."
34,"The debt securities that may be invested by the Sub-Fund include but are not limited to government bonds, fixed and floating rate bonds."
35,"Other than the general criteria de scribed above, the Manager will also consider the following in selecting high quality debt securities: 1."
36,"Credit quality: The Sub-Fund will only invest in debt securities rated investment grade or above by an independent rating agency, e.g."
37,"Fitch, Moody’s, Standard and Poor’s."
38,A short -term debt security is considered investment grade if its credit rating is A -3 or higher by Standard & Poor’s or F3 or higher by Fitch Ratings or P-3 or higher by Moody’s or equivalent rating as rated by one of the international credit rating agencies.
39,"For this purpose, if the relevant debt security does not itself have a credit rating, then reference can be made to the credit rating of the issuer or guarantor of such debt security."
40,"The Manager maintains effective internal policies and procedures and exercises professional independent judgment on credit assessment, and the aforesaid external rating is only one of the factors taken into account by the Manager in assessing credit quality of debt securities."
41,CICC HKD Money Market ETF 3 2.
42,"Maturity: Out of investments that fulfil the criteria on credit rating, the portfolio will be constructed out of investments with a target maturity of around 60 days (or below), subject to the overall limit in weighted average maturity, weighted average life and remaining maturity of the portfolio as described below."
43,Liquidity: Investments that satisfy the above requirements will be assessed based on liquidity.
44,"The Manager will assess the liquidity of the investments based on historical liquidity of similar debt securities, by assessing the days to liquidate for such instruments."
45,Only instruments with high liquidity will be included in the portfolio of the Sub-Fund.
46,"There is no specific geographical allocation of the country or region of issue of the debt securities or deposits, except that the Sub-Fund will not invest more than 30% of its NAV in emerging markets."
47,"Countries or regions in which the Sub -Fund may invest in include Hong Kong, Mainland China, Japan, Korea, Australia, Canada, the United Kingdom, the European Union and the United States."
48,"The Sub -Fund may invest less than 30% of its NAV into onshore Mainland China markets through available means, including, but not limited to, the China inter-bank bond market under the mutual bond market access between Hong Kong and Mainland China and the regime allowing foreign institutional investors to invest in the China inter- bank bond market."
49,"The onshore Mainland China securities that may be invested by the Sub-Fund include but are not limited to negotiable certificates of deposits, trea sury bonds, policy bank bonds, and local government bonds."
50,"The aggregate value of the Sub -Fund’s holding of instruments and deposits issued by a single entity will not exceed 10% of the total NAV of the Sub -Fund except: (i) where the entity is a substantia l financial institution and the total amount does not exceed 10% of the entity’s share capital and non -distributable capital reserves, the limit may be increased to 25%; or (ii) in the case of government and other public securities, up to 30% may be invest ed in the same issue; or (iii) in respect of any deposit of less than USD1,000,000 or its equivalent in HKD, where the Sub -Fund cannot otherwise diversify as a result of its size."
51,The Sub -Fund will maintain a portfolio with weighted average maturity not e xceeding 60 days and a weighted average life not exceeding 120 days.
52,"The Sub -Fund will not purchase an instrument with a remaining maturity of more than 397 days, or two years in the case of government and other public securities."
53,"The Sub-Fund may also en ter into reverse repurchase transactions, and its expected exposure to such transactions shall be between 0% to 50% of its NAV, subject to a maximum of 100% of its NAV, provided that the aggregate amount of cash provided to the same counterparty may not ex ceed 15% of its NAV."
54,Reverse repurchase transactions are transactions where the Sub-Fund buys securities such as bonds using cash and simultaneously agrees to sell such securities back to the counterparty at a pre-determined future date for a pre -determined price.
55,"A reverse repurchase transaction is economically similar to secured lending, with the counterparty of the Sub-Fund submitting securities as collateral for the cash that it borrows from the Sub-Fund."
56,"Collateral received may only be cash and high q uality money market investments subject to the credit quality, maturity and liquidity requirements set out above."
57,"The weighted average maturity and weighted average life of the collateral, together with other investments made by the Sub-Fund in accordance with the investment strategy set out herein, shall not exceed the limits set out above."
58,A counterparty to the reverse repurchase transactions entered into by the Sub -Fund will be a financial institution subject to ongoing prudential regulation and supervi sion.
59,"It will be an independent counterparty approved by the Manager and is expected to have a minimum credit rating of BBB - or above (by Moody's or Standard & Poor's), or any other equivalent ratings by recognised credit rating agencies, or be a licensed corporation with the SFC or registered institution with the Hong Kong Monetary Authority."
60,"Subject to the above, there is no requirement on its country or region of origin."
61,"All the revenues arising from such CICC HKD Money Market ETF 4 transactions, net of direct and indirect expenses as reasonable and normal compensation for the services rendered in the context of such transactions, will be returned to the Sub-Fund."
62,The Sub-Fund may enter into repurchase transactions for up to 10% of its NAV.
63,Repurchase transactions are transactions where the Sub-Fund sells securities such as bonds for cash and simultaneously agrees to repurchase the securities from the counterparty at a pre-determined future date for a pre-determined price.
64,"A repurchase transaction is economically similar to secure d borrowing, with the counterparty of the Sub - Fund receiving securities as collateral for the cash that it lends to the Sub -Fund."
65,It is the intention of the Manager to sell the securities for cash equal to the market value of the securities provided to th e counterparty.
66,"Cash obtained in repurchase transactions will be used for meeting redemption requests or defraying operating expenses, but will not be re-invested."
67,The Sub-Fund may borrow up to 10% of its NAV but only on a temporary basis for the purpose of meeting redemption requests or defraying operating expenses.
68,The Sub-Fund will not write any options.
69,Up to 10% of the NAV of the Sub -Fund may be invested in other money market funds authorised by the Securities and Futures Commission (“SFC”)1.
70,"The Sub-Fund currently has no intention to invest in structured deposits, structured products or over -the- counter securities, or to take any short positions, and the Manager will not enter into any securities lending transactions."
71,The Sub-Fund will not invest in instruments with loss-absorption features (such as contingent convertible bonds or senior non-preferred debt).
72,The Sub-Fund will only invest in financial derivative instruments for hedging purposes only.
73,"If any of this changes in the future, prior approval of the SFC will be sought and not less than one month’s notice will be provided to Unitholders before the Sub-Fund enters into any such transaction."
74,Use of derivatives The Sub-Fund’s net derivative exposure may be up to 50% of the Sub-Fund’s NAV.
75,What are the key risks?
76,Investment involves risks.
77,Please refer to the Prospectus for details including the risk factors.
78,General investment risk  The Sub-Fund’s investment portfolio may fall in value due to any of the key risk factors below and therefore your investment in the Sub-Fund may suffer losses.
79,There is no guarantee of the repayment of principal.
80,Active ETF risk  The Manager employs an actively managed investment strategy for the Sub-Fund.
81,"The Sub-Fund does not seek to track any index or benchmark, and there is no replication or representative sampling conducted by the Manager."
82,"It may fail to meet its objective as a result of the Manager’ s selection of investments, and/or the implementation of processes which may cause the Sub-Fund to underperform as compared to prevailing money market rates or other money market funds with a similar objective."
83,"Debt securities risks  Short-term debt instrum ents risk : As the Sub -Fund may invest significantly in short -term debt instruments with short maturities, it means the turnover rates of the Sub -Fund’s investments may be 1 SFC authorization is not a recommendation or endorsement of a scheme nor does it guarantee the commercial merits of a scheme or its performance."
84,It does not mean the scheme is suitable for all investors nor is it an endorsement of its suitabil ity for any particular investor or class of investors.
85,CICC HKD Money Market ETF 5 relatively high and the transaction costs incurred as a result of the purchase or sal e of short-term debt instruments may also increase which in turn may have a negative impact on the NAV of the Sub-Fund.
86, Credit / Counterparty risk : The Sub -Fund is exposed to the credit/default risk of issuers of the debt securities that the Sub-Fund may invest in.
87, Interest rate risk: Investment in the Sub -Fund is subject to interest rate risk.
88,"In general, the prices of debt securities rise when interest rates fall, whilst their prices fall when interest rates rise."
89," Sovereign debt risk: The Sub -Fund’s investment in securities issued or guaranteed by governments may be exposed to political, social and economic risks."
90,"In adverse situations, the sovereign issuer may not be able or willing to repay the principal and/or interest when due or may request the Sub -Fund to participate in restructuring such debts."
91,The Sub -Fund may suffer significant losses when there is a default of sovereign debt issuer.
92, Credit rating risk : Credit ratings assigned by rating agencies are subject to limitations and do not guarantee the creditworthiness of the security and/or issuer at all times.
93, Downgrading risk: The credit rating of a debt instrument or its issuer may subsequently be downgraded.
94,"In the event of such downgrading, the value of the Sub -Fund may be adversely affected."
95,There is no assurance that the debt instruments invested by the Sub-Fund or the issuer of the debt instruments will continue to have an investment grade rating or continue to be rated.
96,The Manager may or may not be able to dispose the debt instruments that are being downgraded.
97, Valuation risk : Valuation of the Sub -Fund’s investments ma y involve uncertainties and judgmental determinations.
98,"If such valuation turns out to be incorrect, this may affect the NAV calculation of the Sub-Fund."
99,Risks associated with bank deposits  Bank deposits are subject to the credit risks of the relevant financial institutions.
100,"The Sub-Fund’s deposit may not be protected by any deposit protection schemes, or the value of the protection under the deposit protection schemes may not cover the full amount deposited by the Sub-Fund."
101,"Therefore, if the relevant financial institution defaults, the Sub-Fund may suffer losses as a result."
102,"Risks relating to repurchase agreements  In the event of the failure of the counterparty with which collateral has been placed, the Sub-Fund may suffer loss as there may be delays in reco vering collateral placed out or the cash originally received may be less than the collateral placed with the counterparty due to inaccurate pricing of the collateral or market movements."
103,"Risks relating to reverse repurchase agreements  In the event of the failure of the counterparty with which cash has been placed, the Sub-Fund may suffer loss as there may be delay in recovering cash placed out or difficulty in realising collateral or proceeds from the sale of the collateral may be less than the cash placed with the counterparty due to inaccurate pricing of the collateral or market movements."
104,Differences in dealing arrangements between Listed and Unlisted Classes of Units risk  Investors of Listed and Unlisted Classes of Units are subject to different pricin g and dealing arrangements.
105,The NAV per Unit of each of the Listed and Unlisted Classes of Units may be different due to different fees and cost applicable to each class.
106,The trading hours of The Stock Exchange of Hong Kong Limited applicable to the Listed Class of Units in the secondary market are also different from both the dealing deadline applicable to the Listed Class of Units in the primary market and the dealing deadlines in respect of the Unlisted Classes of Units.
107,"CICC HKD Money Market ETF 6  Units of the Listed Class of Unit s are traded on the stock exchange in the secondary market on an intraday basis at the prevailing market price (which may diverge from the corresponding NAV), while units of the Unlisted Classes of Units are dealt through intermediaries based on the NAV calculated as at a single Valuation Point with no access to intraday liquidity in an open market."
108,"Depending on market conditions, investors of the Unlisted Classes of Units may be at an advantage or disadvantage compared to investors of the Listed Class of Units."
109," In a stressed market scenario, investors of the Unlisted Classes of Units could redeem their units at NAV while investors of the Listed Class of Units in the secondary market could only redeem at the prevailing market price (which may diverge from the corresponding NAV) and may have to exit the Sub- Fund at a significant discount."
110,"On the other hand, investors of the Listed Class of Units could sell their Units on the secondary market during the day thereby crystallising their positions while investors of the Unlisted Classes of Units could not do so in a timely manner until the end of the day."
111,Concentration risk  The Sub-Fund will invest primarily in the Hong Kong Dollar-denominated and settled short-term deposits and money market investments.
112,The Sub-Fund is therefore likely to be more volatile than a broad-based fund that adopts a more diversified strategy.
113,"The value of the Sub -Fund may be more susceptible to adverse economic, political, policy, foreign exchange, liquidity, tax, legal or reg ulatory event affecting the Hong Kong Dollar money markets."
114,Trading risks  The trading price of Units on the SEHK is driven by market factors such as the demand and supply of Units.
115,"Therefore, the Units may trade at a substantial premium or discount to the Sub-Fund’s NAV and may deviate significantly from the NAV per Unit."
116, As investors will pay certain charges (e.g.
117,"trading fees and brokerage fees) to buy or sell Units on the SEHK, investors may pay more than the NAV per Unit when buying Units on the SEHK, and may receive less than the NAV per Unit when selling Units on the SEHK."
118,"Reliance on market maker and liquidity risks  Although the Manager will ensure that at least one Market Maker will maintain a market for the Units in each counter, and that at least one Market Maker in each counter gives not less than 3 months’ notice prior to terminating market making arrangement under the relevant market maker agreement, liquidity in the market for Units may be adversely affected if there is no or only one Market Maker for the Units."
119,There is also no guarantee that any market making activity will be effective.
120,Currency risk  Underlying investments of the Sub -Fund may be denominated in currencies other than the base currency of the Sub -Fund.
121,"While currency hedging will be employed where appropriate, there is no assurance that such hedging will be effective to mitigate all foreign exchange risks."
122,"Therefore, the NAV of the Sub -Fund may be affected unfavorably by fluctuations in the exchange rates between such currencies and the base currency and by changes in exchange rate controls."
123,"Termination risks  The Sub-Fund may be terminated early under certain circumstances, for example, if the size of the Sub- Fund falls below US$10,000,000 (or equivalent)."
124,Investors may not be able to recover their investments and suffer a loss when the Sub-Fund is terminated.
125,CICC HKD Money Market ETF 7 13.
126,Distributions out of or effectively out of capital risk  Payment of distributions out of capital or effectively out of capital amounts to a return or withdrawal of part of an investor’s original investment or from any capital gains attributable to that original investment.
127,Any such distributions may result in an immediate reduction in the NAV per Unit of the Sub-Fund.
128,How has the fund performed?
129, Past performance information is not indicative of future performance.
130,Investors may not get back the full amount invested.
131," The computation basis of the performance is based on the calendar year end, NAV -to-NAV, with interests reinvested."
132, These figures show by how much the Listed Class of Units of the Sub -Fund increased or decreased in value during the calendar year shown.
133,Performance data is calculated in HKD including ongoing charges and excluding your trading costs on the SEHK.
134," Where no past performance is shown, there w as insufficient data available in that year to provide performance."
135, Fund launch date: 2020 Is there any guarantee?
136,The Sub-Fund does not have any guarantees.
137,You may not get back the amount of money you invest.
138,What are the fees and charges?
139,Please refer to the section entitled “Fees and Expenses” of the Prospectus for details of other fees and expenses.
140,"Charges incurred when trading the Sub-Fund on the SEHK 0.2% 1.4% 4.2% 4.4% 0.00% 0.50% 1.00% 1.50% 2.00% 2.50% 3.00% 3.50% 4.00% 4.50% 5.00% 2020 2021 2022 2023 2024 Listed Class of Units of the Sub-Fund CICC HKD Money Market ETF 8 Fees What you pay Brokerage fee Market rates Transaction levy 0.0027%1 of the trading price Accounting and Financial Reporting Council (“AFRC”) transaction levy 0.00015%2 Trading fee 0.00565%3 of the trading price Stamp duty Nil 1 Transaction levy of 0.0027% of the trading price of the Units, payable by each of the buyer and the seller."
141,"2 AFRC transaction levy of 0.00015% of the trading price of the Units, payable by each of the buyer and the seller."
142,"3 Trading fee of 0.00565% of the trading price of the Units, payable by each of the buyer and the seller."
143,Ongoing fees payable by the Sub-Fund The following expenses will be paid out of the Sub-Fund.
144,They affect you because they reduce the NAV of the Sub-Fund which may affect the trading price.
145,"Fees Annual rate (as a % of the NAV of the respective class of units) Management fee^* 0.245% Trustee fee Included in the Management fee Performance fee Nil Administration and custody fees Included in the Management fee ^ The management fee is a single flat fee to cover all of the Sub-Fund’s fees, costs and expenses (and its due proportion of any costs and expenses of the Trust allocated to it)."
146,The ongoing charges of the Sub -Fund is equal to the amount of the single management fee.
147,Please refer to the Prospectus for details.
148,* Please note that the management fee may be increased up to a permitted maximum on giving 1 month’s notice to Unitholders.
149,Please refer to the section of the offering document entitled “Fees and Expenses” for further details of the fees and charges payable and the permitted maximum of such fees allowed as well as other ongoing expenses that may be borne by the Trust.
150,Other fees You may have to pay other fees when dealing in the Units of the Sub-Fund.
